"NASCAR: Alex Bowman's 'Hack' shirts are a huge hit and raising money for charity","FOX News","Alex Bowman will donate a portion of the proceeds from the sale of his Hack T-shirts to animal shelters. The Hendrick Motorsports driver released the shirts as a joke to celebrate his win at Martinsville, but they have been a big hit.","2021-11-03 10:48:36","Top News","https://www.foxnews.com/auto/nascar-alex-bowmans-hack-shirts-charity","2643d6de54103a6afdce2316e9a040c6c6842045a7d3e947938b8f64dcb3254f","1481c6726eb80892c5d2aa6042c14495"
"Youngkin victory deals another blow to Biden, as agenda stalls in Congress","FOX News","Republican Glenn Youngkin's victory in Virginia's governor's election Tuesday night dealt another blow to President Biden and Democrats.","2021-11-03 10:33:37","Top News","https://www.foxnews.com/politics/youngkin-victory-another-blow-biden-agenda-congress","2643d6de54103a6afdce2316e9a040c6c6842045a7d3e947938b8f64dcb3254f","cd9fa971790aace724e1780ab80f1dd3"
"Drunk driver who caused chain reaction crashes in Calif. that killed mom, 24, convicted of 2nd-degree murder","FOX News","A man whose crash on a Southern California freeway while drunk led to a chain reaction of collisions that left a 24-year-old mother dead and five others hurt, was convicted of second-degree murder on Tuesday, according to a report.","2021-11-03 10:23:02","Top News","https://www.foxnews.com/us/drunk-driver-who-caused-chain-reaction-crashes-in-calif-that-killed-mom-24-convicted-of-2nd-degree-murder","2643d6de54103a6afdce2316e9a040c6c6842045a7d3e947938b8f64dcb3254f","bb66acedb695dd3c66a7d4f20e44178d"
"'Rust' assistant director Dave Halls: 5 things to know","FOX News","A look at Dave Halls, who worked on Rust, The Matrix Reloaded and more","2021-11-03 10:17:34","Top News","https://www.foxnews.com/entertainment/rust-assistant-director-dave-halls","2643d6de54103a6afdce2316e9a040c6c6842045a7d3e947938b8f64dcb3254f","59b23643471bba1bb811d6a3c01c0f53"
"Senate Republicans to formally disapprove, nullify Biden vaccine mandate on private employees","FOX News","More than three dozen Senate Republicans are moving to formally disapprove and nullify President Biden’s vaccine mandate on private employees Wednesday under the Congressional Review Act.","2021-11-03 10:03:05","Top News","https://www.foxnews.com/politics/senate-republicans-formally-disapprove-nullify-biden-vaccine-mandate-private-employees","2643d6de54103a6afdce2316e9a040c6c6842045a7d3e947938b8f64dcb3254f","f3f2d482e9a9e8e7a8c4f7bae9ec220b"
"Karol Markowicz: The most expensive holidays ever? This is a big deal","FOX News","What will the holidays be like in America this year?","2021-11-03 10:00:00","Top News","https://www.foxnews.com/opinion/expensive-holidays-big-deal-karol-markowicz","2643d6de54103a6afdce2316e9a040c6c6842045a7d3e947938b8f64dcb3254f","74f11ef545e658e57a0a92268c90635b"
"Virginia election timeline: How education became crucial to Republicans' victory","FOX News","Earlier this year, school board meetings in Loudoun County, Virginia, started capturing national media attention as frustrated parents demanded changes to its so-called equity trainings and racially charged materials.","2021-11-03 11:51:57","Top News","https://www.foxnews.com/politics/education-issue-virginia-governor-youngkin-victory","2643d6de54103a6afdce2316e9a040c6c6842045a7d3e947938b8f64dcb3254f","c8e8c562dd9dd153c7a8ba0d9782ce93"
"Cold weather, snow forecast for parts of Northeast, Michigan","FOX News","The coldest air so far this season has spread south and eastward, with temperatures getting into the 40s and 50s as far as south Texas on Wednesday, marking the end of the growing season for many states.","2021-11-03 11:49:04","Top News","https://www.foxnews.com/us/cold-weather-snow-forecast-for-northeast-michigan","2643d6de54103a6afdce2316e9a040c6c6842045a7d3e947938b8f64dcb3254f","0b46697024edd5e9d076fb223b374a73"
"Ree Drummond's brother, who once appeared on 'Pioneer Woman,' dead","FOX News","Ree Drummond's brother has died, leaving many in her family's home state of Oklahoma in mourning.","2021-11-03 11:32:06","Top News","https://www.foxnews.com/entertainment/ree-drummond-brother-appeared-pioneer-woman-dead","2643d6de54103a6afdce2316e9a040c6c6842045a7d3e947938b8f64dcb3254f","8efd5d716c2c3d71d6d3e7bb36b5bc8b"
"Pandemic and politics drive China's Xi Jinping's decision to avoid climate summit","FOX News","Chinese President Xi Jinping has been absent from the Group of 20 summit in Rome and this week's global climate talks in Scotland, drawing criticism from U.S. President Biden and questions about China’s commitment to reducing greenhouse gas emissions.","2021-11-03 11:16:40","Top News","https://www.foxnews.com/world/pandemic-politics-drive-china-xi-jinpings-decision-climate-summit","2643d6de54103a6afdce2316e9a040c6c6842045a7d3e947938b8f64dcb3254f","780f9b82dd92bf4b9835c1bd4dffa301"
"Toyota Tacozilla off-road 'micro-house' camper revealed","FOX News","The Toyota Tacozilla concept is a Tacoma pickup that's been converted into an off-road camper for the automaker's display at the SEMA Show in Las Vegas. The mini camper has a bed, kitchen, full bathroom and other comforts of home.","2021-11-03 11:12:43","Top News","https://www.foxnews.com/auto/toyota-tacozilla-off-road-microhouse-camper","2643d6de54103a6afdce2316e9a040c6c6842045a7d3e947938b8f64dcb3254f","612cab3cdc75292ef891a1e761b7c75c"
"Climate change: UK calls on private sector to make big investments to save the planet","FOX News","Britain called Wednesday at COP26 for the world's financial industry to channel its vast funds toward greener investments to ensure that global efforts to curb global warming succeed.","2021-11-03 12:53:19","Top News","https://www.foxnews.com/world/global-warming-uk-calls-private-sector-big-investments-save-planet","2643d6de54103a6afdce2316e9a040c6c6842045a7d3e947938b8f64dcb3254f","b14010080ff43feb400eaa617029ec20"
"Winsome Sears says she would die for America, starts 'USA' chant during victory speech: 'American dream'","FOX News","Winsome Sears delivered a patriotic speech after she was projected to become the first woman and woman of color to be elected Virginia’s lieutenant governor.","2021-11-03 12:41:58","Top News","https://www.foxnews.com/politics/winsome-sears-victory-speech-usa-chant-virginia","2643d6de54103a6afdce2316e9a040c6c6842045a7d3e947938b8f64dcb3254f","c955d7c436ade3816fe2853a78961c49"
"Republicans win Virginia governor race, lead in New Jersey, in shocking results just 10 months into Biden term","FOX News","Republicans pulled off a win in the Virginia governor's race many would have believed impossible just several months ago.","2021-11-03 12:41:47","Top News","https://www.foxnews.com/politics/virginia-new-jersey-biden-republicans-democrats","2643d6de54103a6afdce2316e9a040c6c6842045a7d3e947938b8f64dcb3254f","c1cfbf7136658832290a3d43d31bc9bc"
"Prominent CRT opponent declares Youngkin win a 'political sea change' and a 'massive loss for Joy Reid'","FOX News","Prominent critical race theory opponent Christopher Rufo predicted a seismic shift in the country following GOP candidate Glenn Youngkin's victory in the Virginia gubernatorial race.","2021-11-03 12:38:09","Top News","https://www.foxnews.com/media/christopher-rufo-virginia-glenn-youngkin-joy-reid","2643d6de54103a6afdce2316e9a040c6c6842045a7d3e947938b8f64dcb3254f","e44a45ce3e2453392393f68052889d0b"
"The Ford F-100 Eluminator is a DYI electric pickup","FOX News","The Ford F-100 Eluminator is a custom pickup equipped with Ford's new Eluminator electric crate motor, which can be used for custom builds.","2021-11-03 12:29:57","Top News","https://www.foxnews.com/auto/ford-f-100-eluminator-dyi-electric-pickup","2643d6de54103a6afdce2316e9a040c6c6842045a7d3e947938b8f64dcb3254f","1d2a145ec8565913a474d3927d4bbc06"
"'Rust' first camera assistant claims Alec Baldwin shooting a result of lack of gun safety protocols","FOX News","“Rust” first camera assistant Lane Luper is speaking out about a lack of gun safety on set that he says contributed to Alec Baldwin discharging a gun that killed cinematographer Halyna Hutchins.","2021-11-03 12:26:58","Top News","https://www.foxnews.com/entertainment/rust-first-camera-assistant-claims-alec-baldwin-shooting-result-lack-gun-safety-protocols","2643d6de54103a6afdce2316e9a040c6c6842045a7d3e947938b8f64dcb3254f","da9c8bdfee41ee1f2afc3efa4159efc9"
"Florida man who fired 8 gunshots at deputy during traffic stop arrested after days on the run","FOX News","Ma'at Lee, 20, of Tampa, was arrested Tuesday after firing eight gunshots at a Hillsborough County Sheriff's deputy who pulled him over on suspicion of driving a stolen vehicle on Sunday, authorities said.","2021-11-03 12:25:35","Top News","https://www.foxnews.com/us/florida-man-shooting-deputy-traffic-stop-arrested","2643d6de54103a6afdce2316e9a040c6c6842045a7d3e947938b8f64dcb3254f","de852e8c257b81390d11393ca0e103d7"
"With New Jersey governor election results too close to call, here's how recounts work in the Garden State","FOX News","The New Jersey governor's election results remained too close to call early Wednesday morning as Republican challenger Jack Ciattarelli held a narrow lead over incumbent Democratic Gov. Phil Murphy, meaning that no matter who ends up in front once all votes are counted, the other side will want to challenge the outcome.","2021-11-03 12:19:00","Top News","https://www.foxnews.com/politics/new-jersey-too-close-to-call-how-election-recounts-work","2643d6de54103a6afdce2316e9a040c6c6842045a7d3e947938b8f64dcb3254f","2aadcf5b9ccfa47e377b9f7e3e4e8905"
"CNN reporter repeats questionable claim that critical race theory is not being taught in Virginia schools","FOX News","CNN reporter Eva McKend repeated a questionable claim early Wednesday morning that critical race theory (CRT) was not being taught in Virginia's public schools despite the phrase appearing multiple times on the Virginia Department of Education website and a number of instances of its promotion by officials in the state.","2021-11-03 12:17:39","Top News","https://www.foxnews.com/media/cnn-eva-mckend-claims-critical-race-theory-not-taught-virginia-schools","2643d6de54103a6afdce2316e9a040c6c6842045a7d3e947938b8f64dcb3254f","768eefc30686ead1e7b8675fd83bbb93"
"RNC Chairwoman McDaniel: Virginia rejects Biden, Democrats' failures. The red wave has begun","FOX News","Virginians resoundingly rejected Joe Biden and the Democrat Party’s failed agenda on Tuesday night.","2021-11-03 12:15:48","Top News","https://www.foxnews.com/opinion/virginia-biden-democrats-red-wave-rnc-chairwoman-mcdaniel","2643d6de54103a6afdce2316e9a040c6c6842045a7d3e947938b8f64dcb3254f","0556e46fc92f5ce0d87f96b84cac1ed5"
"Coast Guard suspends search after plane vanishes near Cape Cod","FOX News","The Coast Guard on Tuesday suspended its search for a small plane reported missing off the coast of Massachusetts.","2021-11-03 13:54:27","Top News","https://www.foxnews.com/us/coast-guard-suspends-search-after-plane-vanishes-near-cape-cod","2643d6de54103a6afdce2316e9a040c6c6842045a7d3e947938b8f64dcb3254f","47d80ec7fe2f9a664179ca28fbeecfae"
"Pete Hegseth on Minneapolis results: People who are threatened want a cop to show up, not a social worker","FOX News","“Fox & Friends Weekend co-host Pete Hegseth told “Fox & Friends” on Wednesday that Minneapolis voters rejected a plan to defund police because people want a cop, not a social worker if they are threatened.","2021-11-03 13:48:15","Top News","https://www.foxnews.com/media/minneapolis-voters-reject-defund-replace-police-hegseth","2643d6de54103a6afdce2316e9a040c6c6842045a7d3e947938b8f64dcb3254f","eee0301e377eeafad8b7fec79e3f57e2"
"Winsome Sears poised to become Virginia's first Black female lieutenant governor: 'I'm representing everybody'","FOX News","Winsome Sears, GOP candidate to be Virginia's next lieutenant governor, blasted the left for sowing division among Americans in order to become the token 'political savior' on 'Fox & Friends.'","2021-11-03 13:36:56","Top News","https://www.foxnews.com/media/winsome-sears-virginia-first-female-black-lieutenant-governor-fox-friends","2643d6de54103a6afdce2316e9a040c6c6842045a7d3e947938b8f64dcb3254f","b0ba571938dae61bfb28b6d382454eac"
"Liz Peek: Biden, Democrats will learn nothing from shocking election upsets","FOX News","Are Democrats listening? Did they hear the thunderclap message sent in New Jersey? Do they understand why in Virginia long-shot candidate Glenn Youngkin upset Democrat Terry McAuliffe?","2021-11-03 13:26:51","Top News","https://www.foxnews.com/opinion/biden-democrats-learn-nothing-election-upsets-liz-peek","2643d6de54103a6afdce2316e9a040c6c6842045a7d3e947938b8f64dcb3254f","e4ea5629f1a4383c769e4c4fa7493b85"
"How Lincoln, Douglass emerged to reunify America in 'The President and the Freedom Fighter'","FOX News","New Fox Nation special 'The President and the Freedom Fighter' accompanies Brian Kilmeade's book about two American heroes, Abraham Lincoln and Frederick Douglass, who moved from strong disagreement to friendship --- and changed the entire course of history.","2021-11-03 13:17:53","Top News","https://www.foxnews.com/media/the-president-and-the-freedom-fighter-brian-kilmeade-fox-nation","2643d6de54103a6afdce2316e9a040c6c6842045a7d3e947938b8f64dcb3254f","4b492fa70257e103d7d2c22a28b5723c"
"FBI might re-arrest Heather Mack as Chicago 'Suitcase Killer' returns from Bali with daughter, attorney says","FOX News","The FBI might arrest Heather Mack, who served seven years in an Indonesian prison for aiding in the 2014 murder of her mother, upon her expected return to the U.S. Wednesday, her attorney says.","2021-11-03 13:05:27","Top News","https://www.foxnews.com/us/fbi-re-arrest-heather-mack-chicago-suitcase-killer-returns-bali","2643d6de54103a6afdce2316e9a040c6c6842045a7d3e947938b8f64dcb3254f","2d5626d74c3061c84c42cd6a916e5e09"
"'Rust' armorer's attorneys speculate sabotage occurred on set in deadly Alec Baldwin shooting incident","FOX News","The armorer on the set of “Rust” offered a chilling theory through her attorneys about what led to the accidental shooting death of Halyna Hutchins.","2021-11-03 13:05:04","Top News","https://www.foxnews.com/entertainment/rust-armorers-attorneys-speculate-sabotage-deadly-alec-baldwin-shooting","2643d6de54103a6afdce2316e9a040c6c6842045a7d3e947938b8f64dcb3254f","3c2f2a5af0cd3057e5a374c3bdee813d"
"House GOP reelection arm expands 2022 Democratic targets in wake of Youngkin Virginia victory","FOX News","House Republican expand their list of House Democrats they consider vulnerable in the 2022 midterm elections, in the wake of the GOP's win in Virginia's gubernatorial race","2021-11-03 13:01:38","Top News","https://www.foxnews.com/politics/house-gop-reelection-arm-expands-2022-democratic-targets-youngkin-virginia-victory","2643d6de54103a6afdce2316e9a040c6c6842045a7d3e947938b8f64dcb3254f","e71e793007482d36eaadfec933193b6b"
"Scheifele gets SO winner as Jets beat Stars 4-3","FOX News","Mark Scheifele scored the deciding goal in the shootout in his return from COVID-19 protocol, leading the Winnipeg Jets to a 4-3 win over the Dallas Stars on Tuesday night.","2021-11-03 14:47:23","Top News","https://www.foxnews.com/sports/scheifele-gets-so-winner-as-jets-beat-stars-4-3","2643d6de54103a6afdce2316e9a040c6c6842045a7d3e947938b8f64dcb3254f","e12e2edfb9536d636bf0cb37834a7a38"
"Hertl scores 2 goals as short-handed Sharks beat Sabres 5-3","FOX News","Tomás Hertl had two goals and an assist, and the San Jose Sharks beat the Buffalo Sabres 5-3 on Tuesday night.","2021-11-03 14:40:37","Top News","https://www.foxnews.com/sports/hertl-scores-2-goals-as-short-handed-sharks-beat-sabres-5-3","2643d6de54103a6afdce2316e9a040c6c6842045a7d3e947938b8f64dcb3254f","f645bd4927e2dde83fc43d72aef6ff1b"
"McAuliffe concedes to Youngkin in Virginia's bruising gubernatorial election","FOX News","Former Democratic Gov. Terry McAuliffe of Virginia conceded on Wednesday in his hard fought gubernatorial election battle against Republican nominee Glenn Youngkin","2021-11-03 14:37:11","Top News","https://www.foxnews.com/politics/mcauliffe-concedes-to-youngkin-virginia-governor-race","2643d6de54103a6afdce2316e9a040c6c6842045a7d3e947938b8f64dcb3254f","678def61eb19516a12cb63ce032c6ace"
"DeSantis blasts Biden's agenda after McAuliffe's loss in Virginia: Americans are 'rebelling' against Democrats","FOX News","Florida Governor Ron DeSantis weighed in on the Virginia gubernatorial election results and suggested that Youngkin won because Americans are tired of the Democrats' agenda.","2021-11-03 14:37:04","Top News","https://www.foxnews.com/media/desantis-says-americans-are-rebelling-against-democrat-agenda-virginia","2643d6de54103a6afdce2316e9a040c6c6842045a7d3e947938b8f64dcb3254f","9317603f41fec43fe48c675d5e6b21e3"
"Duchene's overtime goal sends Predators past Flames 3-2","FOX News","Matt Duchene scored at 1:37 of overtime, giving the Nashville Predators a 3-2 win over Calgary on Tuesday night and snapping the Flames six-game win streak.","2021-11-03 14:36:45","Top News","https://www.foxnews.com/sports/duchenes-overtime-goal-sends-predators-past-flames-3-2","2643d6de54103a6afdce2316e9a040c6c6842045a7d3e947938b8f64dcb3254f","e511549f3418ff1f28c51254d5f6325f"
"Volcanic eruptions are forcing Spanish islanders to stay inside","FOX News","Authorities on the Spanish island of La Palma are telling people who live near an erupting volcano to stay indoors because of a heavy fall of ash that has forced the cancellation of flights and school classes.","2021-11-03 14:34:07","Top News","https://www.foxnews.com/world/volcanic-eruptions-forcing-spanish-islanders-stay-inside","2643d6de54103a6afdce2316e9a040c6c6842045a7d3e947938b8f64dcb3254f","46a23ff37a9d03bdd9597d5b0421e97b"
"Miller scores in overtime, Canucks rally to beat Rangers 3-2","FOX News","J.T. Miller scored his second goal of the game 2:22 into overtime and the Vancouver Canucks rallied to beat the New York Rangers 3-2 Tuesday night.","2021-11-03 14:30:26","Top News","https://www.foxnews.com/sports/miller-scores-in-overtime-canucks-rally-to-beat-rangers-3-2","2643d6de54103a6afdce2316e9a040c6c6842045a7d3e947938b8f64dcb3254f","7a13cc5f08ebbcf2a7f6493905382189"
"Clay Travis hails Youngkin victory: ‘The woke agenda, thank the Lord, is dead!’","FOX News","OutKick Founder Clay Travis told “Fox & Friends” on Wednesday that Glenn Youngkin leading the Virginia gubernatorial race shows women left behind the Democratic Party and a “mom revolution” carried the candidate to a projected victory.","2021-11-03 14:29:09","Top News","https://www.foxnews.com/media/clay-travis-hails-youngkin-victory-the-woke-agenda-thank-the-lord-is-dead","2643d6de54103a6afdce2316e9a040c6c6842045a7d3e947938b8f64dcb3254f","2bc105b97428818b5ed233d2f11b5597"
"Backup QBs shine across NFL in Week 8","FOX News","From Mike White's memorable starting debut to Cooper Rush's prime-time comeback, as well as a rare win for Geno Smith and a comeback by Trevor Siemian to beat Tom Brady, backup quarterbacks took center stage this past week in the NFL.","2021-11-03 14:20:55","Top News","https://www.foxnews.com/sports/backup-qbs-shine-across-nfl-in-week-8","2643d6de54103a6afdce2316e9a040c6c6842045a7d3e947938b8f64dcb3254f","e32900330b23b61283062312d6c63212"
"Jennifer Garner sparks engagement rumors with latest Instagram post","FOX News","Jennifer Garner had a ring on her finger in her latest Instagram video, sparking speculation that she is engaged to longtime boyfriend John Miller.","2021-11-03 14:19:20","Top News","https://www.foxnews.com/entertainment/jennifer-garner-engagement-rumors-instagram-post","2643d6de54103a6afdce2316e9a040c6c6842045a7d3e947938b8f64dcb3254f","5866a2520f6a9504b3ced25a55acb3be"
"Kyle Rittenhouse 'freaking out', said people ‘were trying to hurt him,’ friend testifies","FOX News","Kyle Rittenhouse was freaking out, pale and seemed really scared in the moments after shooting three men during destruction and unrest in Kenosha, Wisconsin, and said he had to do it because people were trying to hurt him, a friend testified at Rittenhouse's murder trial.","2021-11-03 15:51:32","Top News","https://www.foxnews.com/us/kyle-rittenhouse-trial-people-trying-hurt-him-friend-testifies","2643d6de54103a6afdce2316e9a040c6c6842045a7d3e947938b8f64dcb3254f","94f2b5f34f746a80cb9f9595bd736ac0"
"MSNBC has brutal day with historic viewership declines, Election Night meltdowns","FOX News","MSNBC had a tough time on Tuesday with historic ratings declines followed by an evening of its hosts and pundits being ridiculed for a series of election night meltdowns and inaccurate claims.","2021-11-03 15:50:45","Top News","https://www.foxnews.com/media/msnbc-historic-viewership-declines-election-night-meltdowns","2643d6de54103a6afdce2316e9a040c6c6842045a7d3e947938b8f64dcb3254f","b871bd39a64a065dcad57f8bc01ba42e"
"Packers' Aaron Rodgers, unvaccinated, tests positive for COVID-19, to miss Chiefs game: report","FOX News","Green Bay Packers quarterback Aaron Rodgers will miss Sunday’s game against the Kansas City Chiefs after testing positive for COVID-19, according to multiple reports.","2021-11-03 15:49:12","Top News","https://www.foxnews.com/sports/packers-aaron-rodgers-unvaccinated-positive-covid-19-chiefs","2643d6de54103a6afdce2316e9a040c6c6842045a7d3e947938b8f64dcb3254f","5ba99de9e7e426aba62a1410cd179027"
"Linda Carlson, 'Newhart' and 'Murder One' actress, dead at 76","FOX News","Actress Linda Carlson made her TV debut in 1977’s 'Westside Medical,' playing Dr. Janet Cottrell for the 13-episode run.","2021-11-03 15:40:14","Top News","https://www.foxnews.com/entertainment/linda-carlson-newhart-murder-one-dead","2643d6de54103a6afdce2316e9a040c6c6842045a7d3e947938b8f64dcb3254f","cd8114cbcf6ed8d536fc13d724c6c1e6"
"Youngkin 2024 speculation swirls after stunning Virginia election victory","FOX News","The McAuliffe camp was left shellshocked Tuesday night after Youngkin ran away with the off-year election widely seen as a referendum on President Biden and a bellwether for the 2022 midterms.","2021-11-03 15:37:36","Top News","https://www.foxnews.com/politics/youngkin-2024-speculation-virginia-election-victory","2643d6de54103a6afdce2316e9a040c6c6842045a7d3e947938b8f64dcb3254f","b9b019f5559690ceb797aec925137d1b"
"Mario Batali set to face trial in April over sexual misconduct charges","FOX News","Celebrity chef Mario Batali's trial on sexual misconduct charges in Boston has been set for April.","2021-11-03 15:36:34","Top News","https://www.foxnews.com/entertainment/mario-batali-trial-april-sexual-misconduct-charges","2643d6de54103a6afdce2316e9a040c6c6842045a7d3e947938b8f64dcb3254f","439668e5ef361a1bba9169e87090b0d9"
"Pennsylvania city rejects removing English as their official language: 'International city'","FOX News","Voters in the Pennsylvania city of Allentown have rejected a ballot question asking whether English should be removed as its official language.","2021-11-03 15:31:20","Top News","https://www.foxnews.com/us/pennsylvania-allentown-rejects-removing-english-as-official-language","2643d6de54103a6afdce2316e9a040c6c6842045a7d3e947938b8f64dcb3254f","8046f5fe21e8c8280103b3097ccc744a"
"CNN's Van Jones continues pushing claim that critical race theory concerns amount to racial 'dog-whistling'","FOX News","CNN political commentator Van Jones claimed Tuesday that concern over critical race theory being taught in schools amounted to racial dog whistling as he implored Democrats to come up with better answers by next year's midterm elections.","2021-11-03 15:24:20","Top News","https://www.foxnews.com/media/cnn-van-jones-claim-critical-race-theory-concerns-racial-dog-whistling","2643d6de54103a6afdce2316e9a040c6c6842045a7d3e947938b8f64dcb3254f","1e47cf60baf5aa1b0aa1907461b2097f"
"McAuliffe Virginia governor campaign's inability to combat 'race-baiting BS' blasted by progressives","FOX News","A coalition of progressive groups issued a scathing reaction to Terry McAuliffe’s loss in Virginia's election for governor, blasting Democrats for running an uninspired campaign that failed to address issues voters really care about.","2021-11-03 15:18:20","Top News","https://www.foxnews.com/politics/virginia-governor-election-results-progressives-mcauliffe","2643d6de54103a6afdce2316e9a040c6c6842045a7d3e947938b8f64dcb3254f","6c06416cb5637e1f7441caf3dbf52f9c"
"Buffalo mayor, a write-in candidate, declares victory over AOC-backed socialist","FOX News","Buffalo, New York, Mayor Byron Brown was not even on the ballot for his city's mayoral election but he has declared victory over Democratic candidate India Walton – a self-declared democratic socialist.","2021-11-03 15:10:37","Top News","https://www.foxnews.com/politics/buffalo-mayor-write-in-candidate-declares-victory-over-aoc-backed-socialist","2643d6de54103a6afdce2316e9a040c6c6842045a7d3e947938b8f64dcb3254f","be0ebc1b9f6f95f4c4c887e0569b9a61"
"Pelosi says Virginia election results won't change Democrats' agenda; Republicans call her 'LAME DUCK'","FOX News","House Speaker Nancy Pelosi said Democrats aren’t changing course on their multitrillion-dollar agenda despite suffering a devastating loss in the Virginia gubernatorial race Tuesday night as party negotiations continue.","2021-11-03 16:53:33","Top News","https://www.foxnews.com/politics/pelosi-virginia-election-results-democrats-agenda","2643d6de54103a6afdce2316e9a040c6c6842045a7d3e947938b8f64dcb3254f","1d0f9d98eb7b2a846a9bf13e5f9c4982"
"‘Sister Wives’ stars Christine Brown, Kody Brown call it quits after 25 years: We’ve ‘grown apart’","FOX News","Christine Brown broke the news on Instagram. The exes share six children.","2021-11-03 16:50:54","Top News","https://www.foxnews.com/entertainment/sister-wives-christine-brown-kody-brown-split","2643d6de54103a6afdce2316e9a040c6c6842045a7d3e947938b8f64dcb3254f","55aa4520e96d0879864a6ed68229c63f"
