"Tesla raises Model 3 and Model Y prices again, now up $8,000 this year","FOX News","Tesla has raised the price of the Model 3 and Model Y by $1,000, but added Midnight Silver Metallic paint to its free color selections.","2021-11-05 13:04:25","Top News","https://www.foxnews.com/auto/tesla-raises-model-3-model-y-prices","2643d6de54103a6afdce2316e9a040c6c6842045a7d3e947938b8f64dcb3254f","dcb7b13ddb8bece44b4c2a7b50542e82"
"Warmer weather forecast for much of US as storms continue for West, Florida","FOX News","A warm-up is coming for much of the country after several days of colder-than-average temperatures.","2021-11-05 13:02:57","Top News","https://www.foxnews.com/us/warmer-weather-forecast-storms-continue-for-west-florida","2643d6de54103a6afdce2316e9a040c6c6842045a7d3e947938b8f64dcb3254f","4036756567b8126c120c173b3a64052b"
"Queen Elizabeth flies to Sandringham by helicopter with doctor’s approval: report","FOX News","Queen Elizabeth, Britain’s longest-lived and longest-reigning monarch, is due to celebrate her Platinum Jubilee — 70 years on the throne — next year.","2021-11-05 13:00:17","Top News","https://www.foxnews.com/entertainment/queen-elizabeth-flies-sandringham-helicopter-doctors-approval","2643d6de54103a6afdce2316e9a040c6c6842045a7d3e947938b8f64dcb3254f","ed62a523b90e1915953848b5c5d38af4"
"ABBA drops 'Voyage,' first album in 40 years","FOX News","The band announced their studio return via Twitter back in September.","2021-11-05 12:59:03","Top News","https://www.foxnews.com/entertainment/abba-drops-voyage-first-album-40-years","2643d6de54103a6afdce2316e9a040c6c6842045a7d3e947938b8f64dcb3254f","f0383478f8a0f9cab973407e82dc5c62"
"Brett Tolman: Arrest of Steele dossier source links Clintons with Trump-Russia conspiracy","FOX News","Former federal prosecutor Brett Tolman explained on Fox & Friends how the latest indictment in Special Counsel John Durham's probe is connected to the Clintons.","2021-11-05 12:59:01","Top News","https://www.foxnews.com/media/hillary-clinton-durham-probe-steele-dossier-igor-danchenko-tolman","2643d6de54103a6afdce2316e9a040c6c6842045a7d3e947938b8f64dcb3254f","3b84a88df21ef600d777e4753a7a7595"
"New York Times triggers Biden aides with editorial urging Democrats to be 'more moderate'","FOX News","The New York Times snubbed Joe Biden as too moderate last year while endorsing candidates in the Democratic primary, and annoyed White House aides reminded the paper of that Friday after the editorial board urged Democrats to embrace moderate policies following brutal results for Democrats this week.","2021-11-05 14:48:34","Top News","https://www.foxnews.com/media/biden-aides-new-york-times-moderate-dems-political-nightmare","2643d6de54103a6afdce2316e9a040c6c6842045a7d3e947938b8f64dcb3254f","1377d8e745e48fd28e3aedae3c583e8c"
"California school officials alert parents to sale of addictive new drug: reports","FOX News","California school officials are warning parents about a new addictive street drug called Paint.","2021-11-05 14:41:19","Top News","https://www.foxnews.com/health/california-school-officials-alert-parents-to-sale-of-addictive-new-drug-reports","2643d6de54103a6afdce2316e9a040c6c6842045a7d3e947938b8f64dcb3254f","ff94ade0b129f1dd1a7b1a94190f90f5"
"Deroy Murdock: Voters shout at Democrats and their message is 'no, no, no'","FOX News","From the White House to school boards across America, voters on Tuesday shouted, No! to far-left public policy.","2021-11-05 14:07:39","Top News","https://www.foxnews.com/opinion/voters-democrats-message-deroy-murdock","2643d6de54103a6afdce2316e9a040c6c6842045a7d3e947938b8f64dcb3254f","1e0b88b416d7e91a6cb1d1a3ea71629e"
"Illinois mom charged with child endangerment after five children died in fire","FOX News","A woman has been charged with child endangerment in the August fire deaths of her five young children, who she allegedly left in a southwest Illinois apartment without adult supervision.","2021-11-05 14:03:45","Top News","https://www.foxnews.com/us/illinois-mom-charged-child-endangerment-five-children-died-fire","2643d6de54103a6afdce2316e9a040c6c6842045a7d3e947938b8f64dcb3254f","118399a1d5f264f19df531a9219c9ffa"
"Former Lincoln Project adviser gets nuked for condescending tweet about NJ truck driver winning election","FOX News","Contributing writer for The Atlantic and former Lincoln Project adviser Tom Nichols was roasted by critics Thursday over a condescending tweet intending to mock New Jersey truck driver Edward Durr, who pulled off a surprise election victory earlier this week when he defeated the state's longtime Democratic Senate president.","2021-11-05 13:15:36","Top News","https://www.foxnews.com/media/former-lincoln-project-advisor-nuked-condescending-tweet-new-jersey-truck-driver-winning-election","2643d6de54103a6afdce2316e9a040c6c6842045a7d3e947938b8f64dcb3254f","c03ab3c732616211e4dca86687839dd2"
"Kyle Rittenhouse trial: Witness says man shot was acting 'belligerently'","FOX News","The first man shot and killed by Kyle Rittenhouse on the streets of Kenosha was acting “belligerently” that night but did not appear to pose a serious threat to anyone, a witness testified Friday at Rittenhouse's murder trial.","2021-11-05 15:58:22","Top News","https://www.foxnews.com/us/kyle-rittenhouse-trial-witness-man-shot-acting-belligerently","2643d6de54103a6afdce2316e9a040c6c6842045a7d3e947938b8f64dcb3254f","5f29d752b9bca0dbd9cc37176558684a"
"'Democrats are in disarray': DC locals share how they feel about party's direction","FOX News","Locals in Washington, D.C., told Fox News how they felt about the direction of the Democratic Party.","2021-11-05 15:42:04","Top News","https://www.foxnews.com/politics/democrats-disarray-dc-locals-partys-direction","2643d6de54103a6afdce2316e9a040c6c6842045a7d3e947938b8f64dcb3254f","797b49dcfd767b1c64cbe020908cc840"
"Mariska Hargitay opens up about losing her mom Jayne Mansfield as a child: ‘There’s no guarantees’","FOX News","Jayne Mansfield was 34 years old when she passed away in 1967 from injuries she sustained in a late-night car accident.","2021-11-05 15:34:32","Top News","https://www.foxnews.com/entertainment/mariska-hargitay-losing-mom-jayne-mansfield","2643d6de54103a6afdce2316e9a040c6c6842045a7d3e947938b8f64dcb3254f","6ca8446dc34304c80f58441494a44909"
"Browns release Odell Beckham Jr. years after blockbuster trade","FOX News","The Cleveland Browns released Odell Beckham Jr. on Friday more than two years after acquiring him in a blockbuster trade from the New York Giants.","2021-11-05 15:30:39","Top News","https://www.foxnews.com/sports/browns-release-odell-beckham-jr","2643d6de54103a6afdce2316e9a040c6c6842045a7d3e947938b8f64dcb3254f","7052058e2eb84f683a3ee73d4b04413b"
"Liberal late-night hosts Stephen Colbert, Seth Meyers downplay Democrat losses in Virginia","FOX News","Liberal late-night hosts Stephen Colbert and Seth Meyers tried to downplay Republican Glenn Youngkin’s victory over Democrat Terry McAuliffe in the Virginia governor's race Thursday after lefty cable news pundits spent the past two days panicking about the results.","2021-11-05 15:19:44","Top News","https://www.foxnews.com/media/stephen-colbert-seth-meyers-downplay-democrat-losses-virginia","2643d6de54103a6afdce2316e9a040c6c6842045a7d3e947938b8f64dcb3254f","d09a3dddb569b7595e6778310f56db21"
"Republicans say down-ballot victories this week a roadmap for more GOP wins in 2022","FOX News","Republicans say state legislative pickups this week in Virginia and New Jersey will serve as a guide to the bigger elections ahead in 2022","2021-11-05 15:14:59","Top News","https://www.foxnews.com/politics/republicans-down-ballot-victories-roadmap-more-gop-wins-2022","2643d6de54103a6afdce2316e9a040c6c6842045a7d3e947938b8f64dcb3254f","0992e6eddd35872b8c63433df88bedb2"
"Oklahoma teachers fired for refusing to wear masks: 'Never thought this would happen' in America","FOX News","The Oklahoma City public school board unanimously voted to fire six teachers for refusing to follow the school’s mask mandate.","2021-11-05 15:11:54","Top News","https://www.foxnews.com/media/teachers-sue-oklahoma-school-district-fired-refusing-masks","2643d6de54103a6afdce2316e9a040c6c6842045a7d3e947938b8f64dcb3254f","a99a04bf7fc1bb85092ee268a9d8f7c2"
"Students sing to teacher with stage 4 cancer outside hospital: 'It was overwhelming'","FOX News","In an emotional goodbye visit, 26 children sang worship songs prior to Carol Mack's move to hospice care","2021-11-05 15:08:50","Top News","https://www.foxnews.com/lifestyle/students-sing-to-teacher-cancer-outside-hospital","2643d6de54103a6afdce2316e9a040c6c6842045a7d3e947938b8f64dcb3254f","51952114191279a87ec004a81165c626"
"Ahmaud Arbery murder trial begins after controversial jury selection","FOX News","Opening statements began Friday in the murder trial of three White men charged in the shooting death of Ahmaud Arbery, with a prosecutor telling jurors that faulty assumptions led them to chase down the 25-year-old Black man. Arbery's killing was largely ignored until a leaked cellphone video stirred outrage that deepened a national reckoning over racial injustice.","2021-11-05 15:07:14","Top News","https://www.foxnews.com/us/trial-killing-ahmaud-arbery-begins","2643d6de54103a6afdce2316e9a040c6c6842045a7d3e947938b8f64dcb3254f","57c0f5c5968e773db386976c77bd8136"
"Jim Jordan blasts Pelosi and Biden's 'ridiculous' spending bill on 'Faulkner Focus'","FOX News","Rep. Jim Jordan, R-Ohio, took aim at Nancy Pelosi and discussed Biden's spending bill on Friday, which he claimed would ‘exacerbate’ other problems the administration has created.","2021-11-05 16:57:02","Top News","https://www.foxnews.com/media/jim-jordan-pelosi-biden-spending-bill-house","2643d6de54103a6afdce2316e9a040c6c6842045a7d3e947938b8f64dcb3254f","0281fbc64d984010eedaf84fdcb387b9"
"Newt Gingrich on Dems' massive spending bill: Many will be 'voting to retire'","FOX News","Former House Speaker Newt Gingrich told America's Newsroom on Friday that any Democrat in a swing district who votes for President Biden's spending bill is “voting to retire,” arguing the bill will hurt Democrats in 2022.","2021-11-05 16:52:41","Top News","https://www.foxnews.com/media/newt-gingrich-democrats-pelosi-spending-bill","2643d6de54103a6afdce2316e9a040c6c6842045a7d3e947938b8f64dcb3254f","ef037b179dd33dd8a55cc4d00b6542c1"
"Scottie Pippen assails Michael Jordan, 'The Last Dance' in new book: 'I was nothing more than a prop'","FOX News","Scottie Pippen’s issue with Michael Jordan had become more apparent after “The Last Dance” documentary last year, which chronicled the final season the dynastic Chicago Bulls were together.","2021-11-05 16:47:55","Top News","https://www.foxnews.com/sports/scottie-pippen-michael-jordan-last-dance-book","2643d6de54103a6afdce2316e9a040c6c6842045a7d3e947938b8f64dcb3254f","4acd4906ff4e93a5af3dd85c21b6639f"
"CNN boss Jeff Zucker offered MSNBC's Rachel Maddow $20M to join network's streaming service: report","FOX News","CNN president Jeff Zucker reportedly attempted to poach MSNBC star Rachel Maddow for his network's new streaming service set to debut next year.","2021-11-05 16:43:10","Top News","https://www.foxnews.com/media/cnn-jeff-zucker-msnbc-rachel-maddow-offer","2643d6de54103a6afdce2316e9a040c6c6842045a7d3e947938b8f64dcb3254f","9337197b471de981a42d8e82f924161d"
"Dana White says he won't mandate vaccines for fighters: 'This is a free country, do what you want'","FOX News","Dana White explained why he doesn't support vaccine mandates, saying it should be each American's choice. He also explained to Fox News' Brian Kilmeade how his business experienced exponential growth throughout the pandemic.","2021-11-05 16:42:21","Top News","https://www.foxnews.com/media/dana-white-ufc-268-vaccine-mandates-return-normalcy","2643d6de54103a6afdce2316e9a040c6c6842045a7d3e947938b8f64dcb3254f","78f1e2c83dc5a47be1265cfa50f5dbd2"
"Baltimore County councilman: State's attorney’s policies create ‘message of permissiveness' amid crime spike","FOX News","A Baltimore County councilman is speaking out this week about a reported rise in crime in the area, arguing that prosecution policies recently implemented by the State’s Attorney for Baltimore City, Marilyn Mosby, have created a message of permissiveness.","2021-11-05 16:40:24","Top News","https://www.foxnews.com/us/baltimore-county-councilman-crime-increase-mosby-policies","2643d6de54103a6afdce2316e9a040c6c6842045a7d3e947938b8f64dcb3254f","a90e88e36b7681bbddf0aeeb89017219"
"Democrats’ $1.75 trillion bill could massively increase fines against employers violating vaccine mandate","FOX News","The Build Back Better plan would increase OSHA violations tenfold. President Biden will use OSHA penalties to enforce his vaccine mandate.","2021-11-05 16:32:59","Top News","https://www.foxnews.com/politics/democrats-1-75-trillion-bill-could-massively-increase-fines-against-employers-violating-vaccine-mandate","2643d6de54103a6afdce2316e9a040c6c6842045a7d3e947938b8f64dcb3254f","e281f9f25954a92b87e939d9b418eec0"
"Brigitte Bardot fined by French court for calling La Reunion islanders ‘degenerate savages’","FOX News","This isn’t the first time that the actress-turned-animal rights activist has faced legal woes over allegations of racism.","2021-11-05 16:31:24","Top News","https://www.foxnews.com/entertainment/brigitte-bardot-fined-french-court-la-reunion-racism-letter","2643d6de54103a6afdce2316e9a040c6c6842045a7d3e947938b8f64dcb3254f","f1a62b8b3341d73b87eebe263842387e"
"Liberal MSNBC guest calls Winsome Sears a 'Black mouth' for 'White supremacist practices'","FOX News","Liberal commentator Michael Eric Dyson called Virginia's incoming lieutenant governor Winsome Sears a Black mouth of White supremacy on Thursday in what critics called a repugnant segment on MSNBC.","2021-11-05 16:20:15","Top News","https://www.foxnews.com/media/liberal-dyson-msnbc-joy-reid-winsome-sears-black-mouth-white-supremacist","2643d6de54103a6afdce2316e9a040c6c6842045a7d3e947938b8f64dcb3254f","93172307af23dd664bffdd6ec84305d6"
"Pennsylvania high school students barred from hockey game after vulgar taunts at female goalie: reports","FOX News","An entire student section of a Pennsylvania high school was barred from attending hockey games after aggressively taunting the opposing team’s female goalie.","2021-11-05 16:16:05","Top News","https://www.foxnews.com/sports/high-school-students-barred-vulgar-taunts-female-goalie-hockey","2643d6de54103a6afdce2316e9a040c6c6842045a7d3e947938b8f64dcb3254f","6c4ad1169e520c804dac29d21706b228"
"Charlottesville city council flames Lincoln Project over Virginia tiki torch stunt smearing Youngkin backers","FOX News","Disgraced anti-Republican group The Lincoln Project and its co-founder Steve Schmidt were blasted by the Charlottesville city council Thursday over their decision to protest outside of a Glenn Youngkin campaign event dressed in outfits similar to those worn by Unite the Right demonstrators at the notorious 2017 rally.","2021-11-05 17:52:31","Top News","https://www.foxnews.com/media/charlottesville-city-council-flames-the-lincoln-project-tiki-torch","2643d6de54103a6afdce2316e9a040c6c6842045a7d3e947938b8f64dcb3254f","fb85439bad1d14cdca38e5d2ab23cf42"
"Ahmaud Arbery trial: Killers did everything on assumption, prosecutor says","FOX News","White men in pickup trucks chased Ahmaud Arbery for five minutes, and one threatened to shoot him, as they cut off his escape from a Georgia subdivision and ultimately killed the 25-year-old Black man with a shotgun, a prosecutor told a trial jury Friday.","2021-11-05 17:36:30","Top News","https://www.foxnews.com/us/prosecutor-ahmaud-arberys-killers-everything-assumption","2643d6de54103a6afdce2316e9a040c6c6842045a7d3e947938b8f64dcb3254f","0eff6aa6aa8626de82de657a7326ad26"
"National Park Service wants public’s help in Blue Ridge Parkway murder investigation","FOX News","The National Park Service is asking for the public’s help after a Rhode Island father of two has mysteriously turned up dead in North Carolina.","2021-11-05 17:35:07","Top News","https://www.foxnews.com/us/national-park-service-wants-publics-help-in-blue-ridge-parkway-murder-investigation","2643d6de54103a6afdce2316e9a040c6c6842045a7d3e947938b8f64dcb3254f","b6348861c379c7ef21419b0752041a72"
"Namajunas, Usman fight in rematches in UFC return to NYC","FOX News","Rose Namajunas used New York as her breakout city on her way toward UFC stardom. She won the 115-pound title in November 2017 at Madison Square Garden and followed it up just five months later with a successful defense in Brooklyn.","2021-11-05 17:23:36","Top News","https://www.foxnews.com/sports/namajunas-usman-fight-rematches-in-ufc-return-to-nyc","2643d6de54103a6afdce2316e9a040c6c6842045a7d3e947938b8f64dcb3254f","b4ab326bb22f70978965ea19a179d93e"
"Charlie Kirk: What Youngkin's victory tells us about Trump and the conservative movement","FOX News","While Glenn Youngkin may not share Trump’s blustering style, he nevertheless won precisely because of the kind of combative conservative politics that defines Trumpism.","2021-11-05 17:19:54","Top News","https://www.foxnews.com/opinion/youngkin-victory-conservative-movement-charlie-kirk","2643d6de54103a6afdce2316e9a040c6c6842045a7d3e947938b8f64dcb3254f","b42ba1f415d7f8bbcfb83265105d5793"
"Qatari club agrees to let Xavi become Barcelona coach","FOX News","Xavi Hernández, the player who personified the attacking style popularized by Barcelona and Spain's national team, is close to returning to Camp Nou as coach.","2021-11-05 17:19:48","Top News","https://www.foxnews.com/sports/qatari-club-agrees-let-xavi-become-barcelona-coach","2643d6de54103a6afdce2316e9a040c6c6842045a7d3e947938b8f64dcb3254f","4e6330828b6ce7a8d1fcab471af10c54"
"Abortion access advocates repeatedly decline to say at House hearing whether procedure takes a human life","FOX News","Two advocates repeatedly declined to answer Rep. Mike Johnson's questions about abortion Thursday – underscoring the tension surrounding Texas' controversial law and the debate over when life begins.","2021-11-05 17:19:01","Top News","https://www.foxnews.com/politics/abortion-johnson-texas-law","2643d6de54103a6afdce2316e9a040c6c6842045a7d3e947938b8f64dcb3254f","06d0e6c5e515f6189692e8c7b8fd9e6b"
"Golden Knights' acquisition of Eichel brings more questions","FOX News","Jack Eichel gives the Vegas Golden Knights the elite center they hope is the final piece of their Stanley Cup puzzle.","2021-11-05 17:16:14","Top News","https://www.foxnews.com/sports/golden-knights-acquisition-eichel-brings-more-questions","2643d6de54103a6afdce2316e9a040c6c6842045a7d3e947938b8f64dcb3254f","c951b5f899b9cc589df21f19c4256f57"
"Thunder roar back to beat Lakers again, 107-104","FOX News","Shai Gilgeous-Alexander scored 11 of his 28 points in the fourth quarter, and the Oklahoma City Thunder rallied from a 19-point deficit to beat the Los Angeles Lakers for the second time this season, 107-104 on Thursday night.","2021-11-05 17:12:50","Top News","https://www.foxnews.com/sports/thunder-roar-back-to-beat-lakers-again-107-104","2643d6de54103a6afdce2316e9a040c6c6842045a7d3e947938b8f64dcb3254f","7d67ece6098afd054c7c6a91b13f11eb"
"Eberle nets Kraken's 1st hat trick, Seattle tops Buffalo 5-2","FOX News","Jordan Eberle provided the big momentum swing for the Seattle Kraken when he scored seconds after the Buffalo Sabres took the lead in the second period.","2021-11-05 17:08:48","Top News","https://www.foxnews.com/sports/eberle-nets-krakens-1st-hat-trick-seattle-tops-buffalo-5-2","2643d6de54103a6afdce2316e9a040c6c6842045a7d3e947938b8f64dcb3254f","a12d4efe90113cd3a99d62e955d6f989"
"Surveillance video shows Henry Ruggs III doing 156 mph before deadly crash","FOX News","Surveillance video obtained by TMZ shows now-former Raiders wide receiver Henry Ruggs III traveling at a high rate of speed down a Las Vegas road before crashing his Corvette into a RAV4 and killing the female driver early Tuesday morning.","2021-11-05 18:55:57","Top News","https://www.foxnews.com/sports/surveillance-video-henry-ruggs-deadly-crash","2643d6de54103a6afdce2316e9a040c6c6842045a7d3e947938b8f64dcb3254f","595bd7e94f6e3bbdac22d0c701d06df8"
"Federal government cancels COVID-19 vaccine manufacturer's multimillion-dollar deal","FOX News","The federal government has canceled a multimillion-dollar deal with COVID-19 vaccine manufacturer Emergent BioSolutions after its facilities were found to have produced millions of contaminated Johnson & Johnson vaccine doses.","2021-11-05 18:54:27","Top News","https://www.foxnews.com/health/federal-government-cancels-covid-vaccine-manufacturers-multimillion-dollar-deal","2643d6de54103a6afdce2316e9a040c6c6842045a7d3e947938b8f64dcb3254f","0049e61800fd235e5440b0763a80aec7"
"Who will be the 2021 NASCAR Cup Series champion?","FOX News","The odds are in for the NASCAR Cup Series championship race at Phoenix Raceway on Nov. 7 and this driver is the favorite to win.","2021-11-05 18:33:34","Top News","https://www.foxnews.com/auto/2021-nascar-cup-series-champion","2643d6de54103a6afdce2316e9a040c6c6842045a7d3e947938b8f64dcb3254f","edc03a28bcc8704440c345bf76a028eb"
"Infamous murderer Richard Matt whose 2015 prison break inspired a TV series may have killed woman in 1993","FOX News","Murderer Richard Matt who escaped a NY prison with a pal in 2015, sparking a nationwide manhunt before he was shot dead, may have killed a woman in 1993.","2021-11-05 18:29:44","Top News","https://www.foxnews.com/us/infamous-murderer-richard-matt-2015-prison-break-inspired-tv-series-killed-woman-1993","2643d6de54103a6afdce2316e9a040c6c6842045a7d3e947938b8f64dcb3254f","2437607f89896a940daa3ff6dccc0535"
"Tom Del Beccaro: Dems play the long game by ramping up endless government spending","FOX News","The headlines out of Virginia were stark for Democrats. For the first time in 11 years, Virginians elected Republicans statewide. The New Jersey governor’s race and other results were warnings, too.","2021-11-05 18:23:37","Top News","https://www.foxnews.com/opinion/beccaro-democrats-virginia-government-spending","2643d6de54103a6afdce2316e9a040c6c6842045a7d3e947938b8f64dcb3254f","c597b1ff96fe7978b332ac7b3a078332"
"Russian diplomat found dead in Berlin, embassy refused autopsy","FOX News","German authorities found a Russian diplomat dead on the pavement outside the Russian embassy last month, according to reports made public Friday.","2021-11-05 18:20:49","Top News","https://www.foxnews.com/world/russian-diplomat-dead-berlin-refused-autopsy","2643d6de54103a6afdce2316e9a040c6c6842045a7d3e947938b8f64dcb3254f","b8ce4943df1f3116a74728821ec3e861"
"Ecstasy can help people with PTSD, study says","FOX News","Methylenedioxymethamphetamine (MDMA)-assisted therapy has been able to aid people with severe post-traumatic stress disorder (PTSD), according to researchers.","2021-11-05 18:07:32","Top News","https://www.foxnews.com/health/ecstasy-ptsd-study","2643d6de54103a6afdce2316e9a040c6c6842045a7d3e947938b8f64dcb3254f","3a56d0bc8d231abc66ae352cfc883fe9"
"California police respond to shopping mall amid reports of active shooter","FOX News","There was a large police presence at a Northern California shopping mall Friday night amid reports of an active shooter.","2021-11-06 01:53:38","Top News","https://www.foxnews.com/us/california-police-respond-to-shopping-mall-amid-reports-of-active-shooter","2643d6de54103a6afdce2316e9a040c6c6842045a7d3e947938b8f64dcb3254f","bd126b10a993fb3ce0b32242cb683655"
"Packers coach Matt LeFleur unlikely to watch Aaron Rodgers' controversial interview","FOX News","Green Bay Packers coach Matt LaFleur told reporters Friday he had no plans to watch Aaron Rodgers’ interview about defending his decision to forgo the coronavirus vaccine.","2021-11-06 01:48:07","Top News","https://www.foxnews.com/sports/packers-matt-lefleur-unlikely-to-watch-aaron-rodgers-interview","2643d6de54103a6afdce2316e9a040c6c6842045a7d3e947938b8f64dcb3254f","ad5f33f5561d148cb3f50c8aeec47a78"
"Biden administration 'took a chainsaw' to energy industry, global security: Dagen McDowell","FOX News","'The Five' panel reacted to Energy Secretary Jennifer Granholm, who laughed off oil supply concerns during an interview with Bloomberg.","2021-11-06 01:37:30","Top News","https://www.foxnews.com/media/biden-administration-chainsaw-energy-industry-global-security-dagen-mcdowell","2643d6de54103a6afdce2316e9a040c6c6842045a7d3e947938b8f64dcb3254f","ec451a2ec49d76ac385461c1829b8468"
"DC area police warn residents after multiple reports of possible 'spiked drinks'","FOX News","The Arlington County Police Department is issuing a warning to residents after receiving multiple reports of spiked drinks in the month of October.","2021-11-06 01:31:15","Top News","https://www.foxnews.com/us/arlington-county-police-warn-residents-after-multiple-reports-of-spiked-drinks","2643d6de54103a6afdce2316e9a040c6c6842045a7d3e947938b8f64dcb3254f","47a2a408a7598c609a48a7f344eb6e46"
"Sandra Lee returns to a post-Andrew Cuomo New York for swanky gala","FOX News","Celebrity chef Sandra Lee returned to New York for a ritzy gala a day before it was announced that her ex Andrew Cuomo's arraignment has been delayed until Jan. 7.","2021-11-06 01:23:22","Top News","https://www.foxnews.com/entertainment/sandra-lee-post-andrew-cuomo-new-york-gala","2643d6de54103a6afdce2316e9a040c6c6842045a7d3e947938b8f64dcb3254f","407b2f9122c6fd07f9b104192be4fb01"
