"Trump’s Money-Losing D.C. Hotel Will Sell to Firm That Will Rebrand It to Waldorf Astoria","Skift","It's hard to imagine the Trump brand surviving in the hotel space beyond any current contracts. As a brand it added nothing lasting and certainly won't be missed. -Jason Clampet","2021-11-14 22:30:00","Travel","https://skift.com/2021/11/14/trumps-money-losing-d-c-hotel-sold-to-firm-that-will-rebrand/","3a34d533cce962ef92d331edae0e98b7b168ea668d8d4d1b87a530189792314d","9c3eaef06b2fade3dc6762f58e688203"
"Dubai Airport CEO Says the International Recovery Is Accelerating","Skift","Paul Griffiths is confident that traffic will return to normal by 2024 — but staffing issues could hold back the recovery at the world's busiest airport.-Matthew Parsons","2021-11-15 08:44:58","Travel","https://skift.com/2021/11/15/dubai-airport-ceo-says-the-international-recovery-is-accelerating/","3a34d533cce962ef92d331edae0e98b7b168ea668d8d4d1b87a530189792314d","5c533c53b45d4659aecdff32ce9e2f99"
"Examining Accor’s Vision for Branded Residences","Skift","With robust growth even through the pandemic, Accor’s residential offerings across brands like Raffles, Fairmont, Sofitel, SLS, and many more have a bright future ahead — and an edge over competitors in the market.-Accor Group","2021-11-15 14:45:00","Travel","https://skift.com/2021/11/15/examining-accors-vision-for-branded-residences/","3a34d533cce962ef92d331edae0e98b7b168ea668d8d4d1b87a530189792314d","975fa84913d230f418754a12476933c3"
"Global Airline Group Hires Chief Economist With a Net Zero Emissions Focus","Skift","The aviation industry's target of achieving net zero emissions is a necessary step to combat climate change but it will be enormously difficult as the number of people taking to the skies shows no signs of slowing down — especially as destinations are reopening. IATA's new hire of an industry outsider signals that it will be a priority.   -Rashaad Jorden","2021-11-15 16:40:00","Travel","https://skift.com/2021/11/15/global-airline-group-hires-chief-economist-with-a-net-zero-emissions-focus/","3a34d533cce962ef92d331edae0e98b7b168ea668d8d4d1b87a530189792314d","5d65125330bb64d9b54cea130b8dc997"
"Growing Vaccine Passport Fraud Leaves Tour Operators Struggling to Crack Down","Skift","As relieved as many tour operators have been to resume trips, the challenges those companies face from vaccine scamsters are growing, and is a huge distraction and risk for these companies trying to come back from the precipice. -Rashaad Jorden","2021-11-15 18:45:00","Travel","https://skift.com/2021/11/15/growing-vaccine-passport-fraud-leaves-tour-operators-struggling-to-crack-down/","3a34d533cce962ef92d331edae0e98b7b168ea668d8d4d1b87a530189792314d","f3ca4d7b712394492aa9f10eb1fa9cd1"
"17 Things That Excite Me About the Travel Industry During Its Ferocious Comeback","Skift","The pandemic indeed has been a portal to change in so many ways, and the innovation is coming at the edges as it always does. Here are some of the reasons why I am excited about the travel industry today, almost a decade into running and building Skift.-Rafat Ali","2021-11-15 18:00:00","Travel","https://skift.com/2021/11/15/17-things-that-excite-me-about-the-travel-industry-during-its-ferocious-comeback/","3a34d533cce962ef92d331edae0e98b7b168ea668d8d4d1b87a530189792314d","d76b7264e40244aac627affab5d6e4b4"
"CWT Emerges From Bankruptcy With $100 Million to Invest in Business Travel Tech","Skift","A milestone in the agency's transformation saga, which could see its new owners opt to acquire other technology players, and target mid-size customers, as part of its post-pandemic rehabilitation.-Matthew Parsons","2021-11-16 07:30:00","Travel","https://skift.com/2021/11/16/cwt-emerges-from-bankruptcy-with-100-million-to-invest-in-business-travel-tech/","3a34d533cce962ef92d331edae0e98b7b168ea668d8d4d1b87a530189792314d","f8d6be75283dc0e2ef8ef6559486d67c"
"Hilton Inks Deal With Amazon for Digital Health Services","Skift","Adding Hilton as a client is a major boost to Amazon's healthcare business, which encompasses the increasingly popular telehealth practice many patients relied on during the pandemic to see their doctors.-Cameron Sperance","2021-11-15 22:15:00","Travel","https://skift.com/2021/11/15/hilton-inks-deal-with-amazon-for-digital-health-services/","3a34d533cce962ef92d331edae0e98b7b168ea668d8d4d1b87a530189792314d","9091ab3df2c8387420fcfe2e657e9d11"
"Spain Tourism Will Hit 66% of 2019 Levels This Quarter Says Minister","Skift","What have tourism-dependent countries such as Spain done to address the pre-pandemic overtourism issues made explicit during 2019's highs? We haven't seen much, and worry for a return of some big lows amidst the rising optimism.  -Jason Clampet","2021-11-15 21:35:00","Travel","https://skift.com/2021/11/15/spain-tourism-will-hit-66-of-2019-levels-this-quarter-says-minister/","3a34d533cce962ef92d331edae0e98b7b168ea668d8d4d1b87a530189792314d","2ef20ffdcf0c2cf18feaa939ed6cc2a2"
"Vacasa Bumps Up Revenue Target for 2022 as It Prepares for Public Debut","Skift","The vacation rental market is surging ahead, but that doesn't automatically lead to a profitable business for those operating in the space. But Vacasa's most recent quarter should give prospective investors more confidence.-Matthew Parsons","2021-11-16 11:30:00","Travel","https://skift.com/2021/11/16/vacasa-bumps-up-revenue-target-for-2022-as-it-prepares-for-public-debut/","3a34d533cce962ef92d331edae0e98b7b168ea668d8d4d1b87a530189792314d","9e56ddd1a480476a5826376d3085ba00"
"Spain Tourism Will Hit 66% of 2019 Levels This Quarter, Says Minister","Skift","What have tourism-dependent countries such as Spain done to address the pre-pandemic overtourism issues made explicit during 2019's highs? We haven't seen much, and worry for a return of some big lows amidst the rising optimism.  -Jason Clampet","2021-11-15 21:35:00","Travel","https://skift.com/2021/11/15/spain-tourism-will-hit-66-of-2019-levels-this-quarter-says-minister/","3a34d533cce962ef92d331edae0e98b7b168ea668d8d4d1b87a530189792314d","a6bbaca675ae0a4e8d54d8b5d9626ec6"
"Why Accor Struggles to Gain Traction in the U.S.","Skift","Some sort of marriage, whether an outright acquisition or more of a loyalty alliance, is necessary to give Accor stronger footing in the U.S. But the pandemic didn't provide any opportunity to capitalize on takeover bargains.-Cameron Sperance","2021-11-17 07:30:00","Travel","https://skift.com/2021/11/17/why-accor-struggles-to-gain-traction-in-the-u-s/","3a34d533cce962ef92d331edae0e98b7b168ea668d8d4d1b87a530189792314d","89abc8448f99dadb6c5c293e3250fd9c"
"Amazon Ads Wants to Help Travel Outfits by Sharing Its Customers’ Buying Habits","Skift","It's not just all about Amazon Web Services anymore when Amazon reaches out to travel industry customers. It is still early days but Amazon Ads may one day crimp travel brands' spending on Google and Facebook.-Dennis Schaal","2021-11-17 07:00:00","Travel","https://skift.com/2021/11/17/amazon-ads-wants-to-help-travel-outfits-by-sharing-its-customers-buying-habits/","3a34d533cce962ef92d331edae0e98b7b168ea668d8d4d1b87a530189792314d","dd0d7ffcc6b8f8bf5019d84eb806ce18"
"American Airlines Strikes Blockchain Partnership to Help Corporate Travel Buyers","Skift","While the new partnership may make it easier for corporate travelers to book flights while disintermediating incumbents like Amadeus and Sabre, American Airlines still has much more to do in order attract the market it believes will return en masse in 2022.-Rashaad Jorden","2021-11-16 20:30:00","Travel","https://skift.com/2021/11/16/american-airlines-strikes-blockchain-partnership-to-help-corporate-travel-buyers/","3a34d533cce962ef92d331edae0e98b7b168ea668d8d4d1b87a530189792314d","9c508df850311e2e7b2655564c4aabb0"
"U.S. Bancorp to Buy Will Smith-Backed Travel Platform TravelBank for $200 Million","Skift","Banks see that integrating travel and expense products is an effective way to enhance their own credit card offering to customers, corporate or otherwise. Expect more deals before the year's out.-Matthew Parsons","2021-11-16 16:30:00","Travel","https://skift.com/2021/11/16/u-s-bank-to-buy-corporate-will-smith-backed-travel-platform-travelbank-for-200-million/","3a34d533cce962ef92d331edae0e98b7b168ea668d8d4d1b87a530189792314d","cf327045082779219e851e11c5b9f90e"
"Hong Kong and China Travel Curbs Present Big Hurdles for Staff : Goldman Sachs CEO","Skift","David Solomon shared at a conference that the challenges of doing business in Hong Kong and China for his investment bank are significant. But are his words enough to spur change for the strict travel restrictions? Probably not. -Tom Lowry","2021-11-17 12:40:00","Travel","https://skift.com/2021/11/17/hong-kong-and-china-travel-curbs-present-big-hurdles-for-staff-goldman-sachs-ceo/","3a34d533cce962ef92d331edae0e98b7b168ea668d8d4d1b87a530189792314d","f188f9a44c06e2ff6700219ca37750d5"
"Global Hotel Rates Could Rise 4 Times Inflation in 2022: New Report","Skift","Companies shouldn't underestimate the knock-on effect of this year's labor crisis, and this new report is a timely heads-up to help them better manage their costs next year.-Matthew Parsons","2021-11-17 13:30:00","Travel","https://skift.com/2021/11/17/global-hotel-rates-could-be-4-times-inflation-in-2022-new-report/","3a34d533cce962ef92d331edae0e98b7b168ea668d8d4d1b87a530189792314d","306b3c7a424f8db1a99f86e4f1c341e3"
"Skift Webinar: Take Off With New Engagement Strategies in 2022 and Beyond","Skift","In this recent webinar, Braze and Skyscanner explored traveler trends to uncover how brands and operators can place customer needs front and center, build relationships in a time of uncertainty, and focus on personalized communications that will inspire lifelong loyalty and trust.-Braze","2021-11-17 15:00:00","Travel","https://skift.com/2021/11/17/skift-webinar-take-off-with-new-engagement-strategies-in-2022-and-beyond/","3a34d533cce962ef92d331edae0e98b7b168ea668d8d4d1b87a530189792314d","a250ccc32d036ea2aef4624eb2d7a4ca"
"What Travel Will Look Like in the 5G Era, According to a Verizon Executive","Skift","5G connectivity will shape the ways airports, aircrafts, hotels, transportation, and other elements of the travel journey can deliver better guest experiences and more seamlessly operate behind the scenes. A Verizon executive spoke to SkiftX about what they expect the transformation could look like.-Verizon","2021-11-17 14:40:00","Travel","https://skift.com/2021/11/17/what-travel-will-look-like-in-the-5g-era-according-to-a-verizon-executive/","3a34d533cce962ef92d331edae0e98b7b168ea668d8d4d1b87a530189792314d","2dbdb3a0caa5e8f0658f36da186b4eea"
"Americas, Europe Giving Airlines Biggest Boost: New Skift Recovery Index","Skift","There is still some weakness in the recovery of the airline sector, particularly in flight search levels and the pricing power of airlines. However, data from the Skift Recovery Index shows that flight bookings and capacity are making major strides toward pre-pandemic levels.-Wouter Geerts","2021-11-17 15:30:00","Travel","https://skift.com/2021/11/17/americas-europe-giving-airlines-biggest-boost-new-skift-recovery-index/","3a34d533cce962ef92d331edae0e98b7b168ea668d8d4d1b87a530189792314d","37d3d2595b7014c62baf1ef48a20e438"
"Soho House Will Raise Prices Fearlessly Despite Spiking Inflation","Skift","Profitability remains elusive for Soho House parent Membership Collective Group. Raising prices will help the company eventually change this, but company leaders must be careful about not scaring off people who could begin to think membership no longer holds its value.-Cameron Sperance","2021-11-17 17:00:00","Travel","https://skift.com/2021/11/17/soho-house-will-raise-prices-fearlessly-despite-spiking-inflation/","3a34d533cce962ef92d331edae0e98b7b168ea668d8d4d1b87a530189792314d","cc44975dc22dec13cb2a7bda4cbc9099"
"American CEO Says Airline Will Coexist, Not Compete, With Zoom","Skift","Drawing parallels with the 1990s internet boom may seem odd, but Doug Parker thinks history will repeat itself, and more relationship building on virtual meeting platforms will only encourage more meetings in person.-Matthew Parsons","2021-11-17 16:40:39","Travel","https://skift.com/2021/11/17/american-ceo-says-airline-will-coexist-not-compete-with-zoom/","3a34d533cce962ef92d331edae0e98b7b168ea668d8d4d1b87a530189792314d","24770049e2433359f7fed93c0d7c36a4"
"Aircraft Leasing Exec Cites Frustration Over Boeing’s Production Problems","Skift","Boeing's challenges make for an uncompetitive environment given the current state of the aircraft-manufacturing duopoly. And Boeing's woes seems formidable.-Dennis Schaal","2021-11-17 17:50:00","Travel","https://skift.com/2021/11/17/aircraft-leasing-exec-cites-frustration-over-boeings-production-problems/","3a34d533cce962ef92d331edae0e98b7b168ea668d8d4d1b87a530189792314d","6b2cc8931b6ad5619aa4dda857be3c11"
"Airlines Are Getting Religion About the Environment Thanks to Wall Street","Skift","The airline industry may say it welcomes the pressure from investors to be more green, but consumers too, hold an enormous amount of sway about whether airlines can be truly more sustainable. The questions is if travelers are willing to pony up more money to help the environment. -Rashaad Jorden","2021-11-17 19:10:00","Travel","https://skift.com/2021/11/17/airlines-are-getting-religion-about-the-environment-thanks-to-wall-street/","3a34d533cce962ef92d331edae0e98b7b168ea668d8d4d1b87a530189792314d","c0b2d106678382390df375df0d39db3f"
"Business Traveler Airlines Loyalty Up for Grabs Coming Out of Pandemic","Skift","Whether it is hotels offering sporadic housekeeping or over-overcrowded airport lounges, service levels across the travel industry have plummeted coming out of the pandemic. Loyalty indeed is under severe pressure.-Dennis Schaal","2021-11-17 20:50:00","Travel","https://skift.com/2021/11/17/business-traveler-airlines-loyalty-up-for-grabs-coming-out-of-pandemic/","3a34d533cce962ef92d331edae0e98b7b168ea668d8d4d1b87a530189792314d","7e9bb8f3858eb48483d83f9c0575f8f2"
"America’s Most Famous Flight Attendant Won’t Give Up on Unionizing Delta","Skift","Fourth time’s a charm? Sara Nelson is the latest union leader to attempt to organize flight attendants at Delta Air Lines, which has a mostly non-union workforce. If it’s going to ever happen, the pandemic will be the catalyst to give Nelson a victory.-Cameron Sperance","2021-11-17 21:40:00","Travel","https://skift.com/2021/11/17/americas-most-famous-flight-attendant-wont-give-up-on-unionizing-delta/","3a34d533cce962ef92d331edae0e98b7b168ea668d8d4d1b87a530189792314d","5eb4fd185f045f4413204cbbbd17d20e"
"United CEO Vows to Beat Margin-Leader Delta on Quality not Quantity","Skift","United CEO Scott Kirby is talking up his investments in product, and quality improvements at the carrier. But it will still be a steep challenge to beat Delta Air Lines, the longstanding leader on quality and margins in the U.S.-Edward Russell","2021-11-17 21:10:00","Travel","https://skift.com/2021/11/17/united-ceo-vows-to-beat-margin-leader-delta-on-quality-not-quantity/","3a34d533cce962ef92d331edae0e98b7b168ea668d8d4d1b87a530189792314d","7a1ab1e04342ba60c86c71d4d4628c07"
"Etihad Aviation CEO Wants Policy Makers to Take the Strain of Making Flying Greener","Skift","Governments will likely use taxes and penalties as incentives to encourage airlines to operate more sustainably over the next decade, but Tony Douglas wants more players in the commercial aviation ecosystem to pay their part.-Matthew Parsons","2021-11-17 21:05:00","Travel","https://skift.com/2021/11/17/etihad-aviation-ceo-wants-policy-makers-to-take-the-strain-of-making-flying-greener/","3a34d533cce962ef92d331edae0e98b7b168ea668d8d4d1b87a530189792314d","6f19db9b3ce5aeb16f256bc62635c5ce"
"KLM Chief Realistic About Long-Haul Travel After U.S. Reopening Pop","Skift","Pieter Elbers thinks the world is on its way to recovering from the Covid-19 pandemic, but he tempers his optimism by saying the road ahead will be bumpy. Transatlantic travel may have surged after the U.S. reopened to vaccinated travelers on November 8, but long-haul travel will take some time to return to its pre-pandemic levels, he said. -Madhu Unnikrishnan","2021-11-17 20:55:00","Travel","https://skift.com/2021/11/17/klm-chief-realistic-about-long-haul-travel-after-u-s-reopening-pop/","3a34d533cce962ef92d331edae0e98b7b168ea668d8d4d1b87a530189792314d","800312c36c85191638e9c424a4967867"
"What TAP Air Portugal Shows Us About the Travel Recovery","Skift","A government bailout always helps, but the recovery of Portugal's home airline points to the benefit of serving resilient markets in South America and Africa.-Lebawit Lily Girma","2021-11-17 21:00:00","Travel","https://skift.com/2021/11/17/what-tap-air-portugal-shows-us-about-the-travel-recovery/","3a34d533cce962ef92d331edae0e98b7b168ea668d8d4d1b87a530189792314d","d88121fd478bdff6865b29a2dfc4bc1c"
"OTA Insight Nabs $80 Million in Funding From Spectrum Equity","Skift","The SiteMinder IPO in Australia served as inspiration for numerous travel tech and data intelligence companies, including OTA Insight. The latter hopes that Spectrum Equity can help OTA Insight make a similar leap.-Dennis Schaal","2021-11-18 05:01:00","Travel","https://skift.com/2021/11/18/ota-insight-nabs-80-million-in-funding-from-spectrum-equity/","3a34d533cce962ef92d331edae0e98b7b168ea668d8d4d1b87a530189792314d","74c44fe8d06918e2d648d4ea8d638b9c"
"How Travel Companies Are Meeting the Needs of the Emerging Super Commuter","Skift","Frequent business travelers are typically offered the most flexible rates, but now workers tentatively returning to the office are being targeted.-Matthew Parsons","2021-11-19 07:30:00","Travel","https://skift.com/2021/11/19/how-travel-companies-are-meeting-the-needs-of-the-emerging-super-commuter/","3a34d533cce962ef92d331edae0e98b7b168ea668d8d4d1b87a530189792314d","2b64f8956f1e14be82e9d57257701f58"
"The Best of Daily Lodging Report for the Week Ending November 19","Skift","Hilton is a winner in the Trump D.C. hotel sale while China's hotel development pipeline isn't suffering like the country's occupancy rates amid new coronavirus mitigation efforts.-Cameron Sperance","2021-11-19 07:00:00","Travel","https://skift.com/2021/11/19/the-best-of-daily-lodging-report-for-the-week-ending-november-19/","3a34d533cce962ef92d331edae0e98b7b168ea668d8d4d1b87a530189792314d","8477571c73fa53ed8b292ba0f04b1120"
"Hong Kong’s Cathay Pacific Sacks 3 Pilots Infected With Covid on Germany Layover","Skift","Hong Kong has some of the strictest Covid restrictions anywhere, making it even more shocking that three pilots on Cathay were dismissed after it was discovered they were infected with coronavirus. Expect tighter compliance checks at overseas hubs going forward.-Tom Lowry","2021-11-19 00:15:00","Travel","https://skift.com/2021/11/18/hong-kongs-cathay-pacific-sacks-3-pilots-infected-with-covid-on-germany-layover/","3a34d533cce962ef92d331edae0e98b7b168ea668d8d4d1b87a530189792314d","3c43c718b2cdd1949975cd46fc90be3a"
"Qatar in Rush to Offer Enough Hotel Rooms for Soccer Fans Ahead of World Cup","Skift","World Cup 2022 is not far off, and Qatar has a lot riding on the event as a catalyst for tourism in the future. Not having enough hotel rooms to house visitors to Doha could be a disaster ahead of the showcase event. -Tom Lowry","2021-11-18 21:15:00","Travel","https://skift.com/2021/11/18/qatar-in-rush-to-offer-enough-hotel-rooms-for-soccer-fans-ahead-of-world-cup/","3a34d533cce962ef92d331edae0e98b7b168ea668d8d4d1b87a530189792314d","80dbacea804b234266a93b2b56ebadab"
"5 Takeaways From Skift Aviation Forum","Skift","Have airlines passed an inflection point and will 2022 be the year demand recovers more fully? Airline executives at the Skift Aviation Forum believe so, although they warn that the road to recovery will be bumpy. -Edward Russell","2021-11-18 17:40:00","Travel","https://skift.com/2021/11/18/5-takeaways-from-skift-aviation-forum/","3a34d533cce962ef92d331edae0e98b7b168ea668d8d4d1b87a530189792314d","73dfe39537779f7b443a4532c86e058f"
"Alitalia to Auction Off Its Loyalty Program — Bids Start at $57 Million","Skift","A potential easy win of an impressive 6.2 million members goes to the highest bidder, and each and every flyer a valuable resource for an airline wanting to take advantage of Europe's upcoming recovery.-Matthew Parsons","2021-11-18 10:00:00","Travel","https://skift.com/2021/11/18/alitalia-to-auction-off-its-loyalty-program-bids-start-at-57-million/","3a34d533cce962ef92d331edae0e98b7b168ea668d8d4d1b87a530189792314d","9707b8b1b6a76c67079529d00d80b4ae"
