"Lotus teases Type 132 electric crossover due in 2022","The Car Connection","Lotus is working on a crossover. Yes, the company famous for lightweight sports cars is expanding into vehicles normally found at the grocery store instead of at the track. The move is necessary to boost Lotus' financial health, and the profits generated should lead to new and better sports cars. The new crossover, code-named the Type 132, is due...","2021-11-09 11:00:00","Cars","https://www.motorauthority.com/news/1049985_lotus-teases-type-132-electric-crossover-due-in-2022?utm_source=feedburner&utm_medium=feed&utm_campaign=Feed%3A+Motorauthority2+%28Motorauthority+Master+Feed%29","4375c6e7686712603f8231852cbdecc1427f28d4215a09cf75d885027fae45f6","db3a55b6108babf70fee29f26fccedfe"
"Mercedes-Benz teams up with Visa to make easy in-car payments","The Car Connection","You can already make payments with your phone, and soon you will be able to do so with your Mercedes-Benz using just a fingerprint for authentication. Mercedes already has its own Mercedes Pay system that allows users to purchase items or services from the car, but now it's teamed up with Visa to make the process easier and more widely available...","2021-11-09 12:00:00","Cars","https://www.motorauthority.com/news/1134110_mercedes-benz-teams-up-with-visa-to-make-easy-in-car-payments?utm_source=feedburner&utm_medium=feed&utm_campaign=Feed%3A+Motorauthority2+%28Motorauthority+Master+Feed%29","4375c6e7686712603f8231852cbdecc1427f28d4215a09cf75d885027fae45f6","f42447f8b307b6b6a685f211a892354e"
"2022 Ford Bronco Raptor teased, arriving in 2022","The Car Connection","The Ford Bronco's back, but the Blue Oval isn't done. A hotter, wilder Bronco is in the works with even more off-road capability, power, and attitude. On Monday, Ford-supported enthusiast forum The Bronco Nation provided a first look at the 2022 Ford Bronco Raptor. The images are of a production-looking Bronco Raptor playing in the mud. The...","2021-11-09 13:03:00","Cars","https://www.motorauthority.com/news/1129621_2022-ford-bronco-raptor?utm_source=feedburner&utm_medium=feed&utm_campaign=Feed%3A+Motorauthority2+%28Motorauthority+Master+Feed%29","4375c6e7686712603f8231852cbdecc1427f28d4215a09cf75d885027fae45f6","7138e82c43c6075c2358b3dfeadef2de"
"Porsche Panamera gets Platinum Edition just in time for 2021 LA Auto Show","The Car Connection","Porsche will use the 2021 Los Angeles Auto Show on later this month to debut a Platinum Edition version of its Panamera. Designed for the Panamera, Panamera 4 and Panamera 4 E-Hybrid grades of Porsche's big hatch, the Platinum Edition treatment adds a number of popular options as standard, along with a few black accents inside and out. Among the...","2021-11-09 13:00:00","Cars","https://www.motorauthority.com/news/1134111_porsche-panamera-gets-platinum-edition-just-in-time-for-2021-la-auto-show?utm_source=feedburner&utm_medium=feed&utm_campaign=Feed%3A+Motorauthority2+%28Motorauthority+Master+Feed%29","4375c6e7686712603f8231852cbdecc1427f28d4215a09cf75d885027fae45f6","ba60c595cea302f70830319f9b95f5b0"
"2022 Mazda CX-50 teased ahead of Nov. 15 reveal","The Car Connection","Mazda is set to unveil a new crossover on November 15, with the timing pointing to an official debut at the 2021 Los Angeles Auto Show starting two days later. The automaker posted a teaser video on Monday to social media, which shows a crossover with a kayak strapped to its roof driving through a lush forest. The crossover is thought to be a new...","2021-11-09 13:45:00","Cars","https://www.motorauthority.com/news/1134112_2022-mazda-cx-50-teased-ahead-of-nov-15-reveal?utm_source=feedburner&utm_medium=feed&utm_campaign=Feed%3A+Motorauthority2+%28Motorauthority+Master+Feed%29","4375c6e7686712603f8231852cbdecc1427f28d4215a09cf75d885027fae45f6","da21230f10fb757bb0ff62ff5075b4ab"
"EV conversion company Everrati sets up US division","The Car Connection","Strong demand from customers in the U.S. has persuaded U.K. electric-vehicle conversion expert Everrati to establish a local division. It's still early days as Everrati only started accepting orders from U.S. customers in July, though the company said on Tuesday that it has already appointed two local members for the leadership team. One is Amit...","2021-11-09 15:00:00","Cars","https://www.motorauthority.com/news/1134113_ev-conversion-company-everrati-sets-up-us-division?utm_source=feedburner&utm_medium=feed&utm_campaign=Feed%3A+Motorauthority2+%28Motorauthority+Master+Feed%29","4375c6e7686712603f8231852cbdecc1427f28d4215a09cf75d885027fae45f6","6317c11494e8c92c067458b6cb21a906"
"Ford Bronco Raptor, Lotus crossover, Porsche Panamera Platinum: Car News Headlines","The Car Connection","Ford already sells Raptor versions of the F-150 and Ranger (not yet in the U.S.), and soon the Bronco will receive the desert racing treatment. We have new photos of a prototype for the planned Bronco Raptor which is expected to hit dealerships by next summer. Lotus is planning a slew of new models, and most of them aren't sports cars. Next in the...","2021-11-09 16:00:00","Cars","https://www.motorauthority.com/news/1133436_ford-bronco-raptor-lotus-crossover-porsche-panamera-platinum-car-news-headlines?utm_source=feedburner&utm_medium=feed&utm_campaign=Feed%3A+Motorauthority2+%28Motorauthority+Master+Feed%29","4375c6e7686712603f8231852cbdecc1427f28d4215a09cf75d885027fae45f6","01723e57e772284ee022ac6c43929f5c"
"Nissan CEO: We're definitely making a new platform for the R36 GT-R","The Car Connection","A next-generation R36 Nissan GT-R is in the works, and it will get a new platform, the automaker's CEO said in an interview with Autocar published Monday. We're definitely making a new platform, Nissan CEO Makoto Uchida said, and our goal is clear: the GT-R has to be the quickest car of its kind. It has to own the track. And it has to play the...","2021-11-09 16:57:00","Cars","https://www.motorauthority.com/news/1134115_nissan-ceo-we-re-definitely-making-a-new-platform-for-the-r36-gt-r?utm_source=feedburner&utm_medium=feed&utm_campaign=Feed%3A+Motorauthority2+%28Motorauthority+Master+Feed%29","4375c6e7686712603f8231852cbdecc1427f28d4215a09cf75d885027fae45f6","434db02bc59b3f78d6612c5eae6b5273"
"Hyundai restomods a Pony and Grandeur with electric powertrains, wild LED lighting","The Car Connection","Hyundai recently revealed two restomods of important models from its past with electric powertrains. Over the weekend, the automaker unveiled an EV concept based on the first-generation Grandeur. Launched in 1986, the Grandeur was Hyundai's first attempt at a flagship luxury sedan, setting the stage for today's Genesis luxury brand. The Grandeur...","2021-11-09 19:00:00","Cars","https://www.motorauthority.com/news/1134117_hyundai-restomods-a-pony-and-grandeur-with-electric-powertrains-wild-led-lighting?utm_source=feedburner&utm_medium=feed&utm_campaign=Feed%3A+Motorauthority2+%28Motorauthority+Master+Feed%29","4375c6e7686712603f8231852cbdecc1427f28d4215a09cf75d885027fae45f6","a0ec3ea85caeb32b97978e6421477213"
"Porsche reportedly has 3 classic-inspired 911 specials coming","The Car Connection","Remember all of the excitement surrounding the launch of the Porsche 911 R special edition five years ago? Well, get ready for another round as Porsche has new specials coming for its current 992-generation 911. We've already spotted prototypes for a car that looks like a modern 911 Sport Classic, the clear giveaway being the prominent ducktail...","2021-11-09 18:00:00","Cars","https://www.motorauthority.com/news/1134114_porsche-reportedly-has-3-classic-inspired-911-specials-coming?utm_source=feedburner&utm_medium=feed&utm_campaign=Feed%3A+Motorauthority2+%28Motorauthority+Master+Feed%29","4375c6e7686712603f8231852cbdecc1427f28d4215a09cf75d885027fae45f6","f17adc2d03d6822c19f947628faf8183"
"Rivian IPO could value company at $77B, or close to the values of Ford, GM","The Car Connection","Rivian's first product, the 2022 R1T full-size pickup, is now in production and initial impressions, including from us, are positive. That should bode well for the company's efforts to raise additional funds by launching an initial public offering, the prospectus for which was filed in October and amended on Tuesday. Rivian plans to list on the...","2021-11-10 09:00:00","Cars","https://www.motorauthority.com/news/1133395_rivian-ipo-could-value-company-at-77b-or-close-to-the-values-of-ford-gm?utm_source=feedburner&utm_medium=feed&utm_campaign=Feed%3A+Motorauthority2+%28Motorauthority+Master+Feed%29","4375c6e7686712603f8231852cbdecc1427f28d4215a09cf75d885027fae45f6","1e38ca131270706b90ea34138e13c69e"
"Hyundai launches Supernal flying taxi division, promises first commercial flight by 2028","The Car Connection","Hyundai Motor Group last week launched Supernal, a standalone business that aims to make an affordable, zero-emission flying taxi service a reality. Headquartered in Washington, D.C., and with offices throughout California, Supernal is an evolution of HMG's Urban Air Mobility division established in 2019, and is headed by Jaiwon Shin, an...","2021-11-10 11:00:00","Cars","https://www.motorauthority.com/news/1132611_hyundai-launches-supernal-flying-taxi-division-promises-first-commercial-flight-by-2028?utm_source=feedburner&utm_medium=feed&utm_campaign=Feed%3A+Motorauthority2+%28Motorauthority+Master+Feed%29","4375c6e7686712603f8231852cbdecc1427f28d4215a09cf75d885027fae45f6","f8915f89fe266a80ae218079a8f6dcf6"
"2022 Ford Bronco Raptor teased with turbocharged V-6 engine, arriving in 2022","The Car Connection","The Ford Bronco's back, but the Blue Oval isn't done. A hotter, wilder Bronco is in the works with even more off-road capability, power, and attitude. On Monday, Ford-supported enthusiast forum The Bronco Nation provided a first look at the 2022 Ford Bronco Raptor. The images are of a production-looking Bronco Raptor playing in the mud. The...","2021-11-10 12:48:00","Cars","https://www.motorauthority.com/news/1129621_2022-ford-bronco-raptor?utm_source=feedburner&utm_medium=feed&utm_campaign=Feed%3A+Motorauthority2+%28Motorauthority+Master+Feed%29","4375c6e7686712603f8231852cbdecc1427f28d4215a09cf75d885027fae45f6","76231b6f79d1d03365d4f3af054f5645"
"VW plans second Wolfsburg plant for Trinity technological flagship","The Car Connection","Volkswagen plans to add a second plant near its headquarters in Wolfsburg, Germany, the automaker said on Tuesday. Expected to be given final approval in December, the plant will be a state-of-the-art facility with a high level of automation to help boost efficiency. It is expected to have a capacity of around 250,000 vehicles, or about half the...","2021-11-10 13:00:00","Cars","https://www.motorauthority.com/news/1134121_vw-plans-second-wolfsburg-plant-for-trinity-technological-flagship?utm_source=feedburner&utm_medium=feed&utm_campaign=Feed%3A+Motorauthority2+%28Motorauthority+Master+Feed%29","4375c6e7686712603f8231852cbdecc1427f28d4215a09cf75d885027fae45f6","7ac87a62b0930eb020b37959851e4343"
"First look at modern Lincoln Zephyr for Chinese market","The Car Connection","Photos of the new Lincoln Zephyr mid-size sedan for the Chinese market have surfaced in local media. The photos are originally from a website for China's intellectual property office, and have been republished by popular automotive website Autohome. They show a design that's almost identical to the one on the Zephyr Reflection concept car rolled...","2021-11-10 14:30:00","Cars","https://www.motorauthority.com/news/1134122_first-look-at-modern-lincoln-zephyr-for-chinese-market?utm_source=feedburner&utm_medium=feed&utm_campaign=Feed%3A+Motorauthority2+%28Motorauthority+Master+Feed%29","4375c6e7686712603f8231852cbdecc1427f28d4215a09cf75d885027fae45f6","536c46b6973fdaaa13241e7ee4eb6d55"
"France's Gaussin unveils hydrogen-electric truck for 2022 Dakar Rally","The Car Connection","France's Gaussin is developing a range of hydrogen-electric commercial vehicles, and to prove the technology the company will enter one specially developed for racing in the 2022 Dakar Rally. The version developed for the Dakar is known as the H2 Racing Truck, and it will be entered in a new alternative energy class being introduced in the 2022...","2021-11-10 16:45:00","Cars","https://www.motorauthority.com/news/1134124_france-s-gaussin-unveils-hydrogen-electric-truck-for-2022-dakar-rally?utm_source=feedburner&utm_medium=feed&utm_campaign=Feed%3A+Motorauthority2+%28Motorauthority+Master+Feed%29","4375c6e7686712603f8231852cbdecc1427f28d4215a09cf75d885027fae45f6","d49667764d9ce1d60d1b91b484e8b749"
"R36 Nissan GT-R, Rivian IPO, 2022 Lincoln Zephyr: Today's Car News","The Car Connection","The current R35 Nissan GT-R is definitely long in the tooth, having been on sale since the 2009 model year. Nissan is working on a redesigned GT-R, the R36 generation, and the automaker's CEO has just confirmed a new platform for the car. Rivian is the latest in a long line of electric-vehicle startups that have gone public. Rather than a SPAC...","2021-11-10 16:00:00","Cars","https://www.motorauthority.com/news/1134123_r36-nissan-gt-r-rivian-ipo-2022-lincoln-zephyr-today-s-car-news?utm_source=feedburner&utm_medium=feed&utm_campaign=Feed%3A+Motorauthority2+%28Motorauthority+Master+Feed%29","4375c6e7686712603f8231852cbdecc1427f28d4215a09cf75d885027fae45f6","4824124c190117e32cd5bf68b41327d6"
"2023 Subaru Solterra revealed, shares design with Toyota BZ4X","The Car Connection","Just as the jointly developed Subaru BRZ and Toyota GR86 feature common styling inside and out, Subaru's new Solterra battery-electric crossover revealed on Wednesday matches the Toyota model developed alongside it, the BZ4X. So far we've only been shown the BZ4X and Solterra in Japanese spec. Details on U.S.-bound versions should be revealed at...","2021-11-11 07:00:00","Cars","https://www.motorauthority.com/news/1132214_2023-subaru-solterra-price-specs-review-photos-info","4375c6e7686712603f8231852cbdecc1427f28d4215a09cf75d885027fae45f6","6b6bdbdad074deb627a9fbb9c9b92613"
"Porsche creating digital clone of your Taycan for remote monitoring","The Car Connection","A software update for the Porsche Taycan will create a digital twin of individual cars for remote monitoring and data analysis, Porsche announced last week. These twins will be created using data from onboard sensors, as well as information from maintenance and repairs, the automaker explained in a press release. The goal is to use data to...","2021-11-10 18:00:00","Cars","https://www.motorauthority.com/news/1134126_porsche-creating-digital-clone-of-your-taycan-for-remote-monitoring","4375c6e7686712603f8231852cbdecc1427f28d4215a09cf75d885027fae45f6","8ea5e23d861fc7b33fdf1907ce1023a2"
"Rivian's stock market value screams past Ford on first day of trading, rivals GM","The Car Connection","Rivian's first product, the 2022 R1T full-size pickup, is in production and initial impressions, including from us, are positive. This seems to have bode well for the company's efforts to raise additional funds, as the recent initial public offering shows. Rivian set the price of a share in its IPO at $78, which was higher than what many expected...","2021-11-11 08:00:00","Cars","https://www.motorauthority.com/news/1133395_rivian-s-stock-market-value-screams-past-ford-on-first-day-of-trading-rivals-gm","4375c6e7686712603f8231852cbdecc1427f28d4215a09cf75d885027fae45f6","2733a4917c96c77bd17597aad4d98035"
"2024 BMW 5-Series spy shots: Popular sedan slims down for next generation","The Car Connection","A prototype for BMW's next-generation 5-Series has been spotted again. The new mid-size sedan is still at an early stage of development but a number of details can already be identified. The proportions are reminiscent of the much-loved E39 generation, while the headlights look to be getting slimmer than on the current generation. We can also see...","2021-11-11 11:00:00","Cars","https://www.motorauthority.com/news/1132902_2024-bmw-5-series-spy-shots","4375c6e7686712603f8231852cbdecc1427f28d4215a09cf75d885027fae45f6","e98cde5b25994a93fe44478c8e7ea73b"
"Ferrari BR20 revealed as latest Special Projects one-off","The Car Connection","Ferrari has a new addition to its growing list of one-off cars developed by the Special Projects division on behalf of a well-heeled client. The latest, unveiled on Thursday, is the BR20. The coach-built supercar is based on the discontinued GTC4 Lusso and features a body whose lines were inspired by Ferraris of the 1950s and '60s. Specific models...","2021-11-11 12:00:00","Cars","https://www.motorauthority.com/news/1134132_ferrari-br20-revealed-as-latest-special-projects-one-off","4375c6e7686712603f8231852cbdecc1427f28d4215a09cf75d885027fae45f6","75229d04d98457618c7887ab2ffec1d5"
"Kia EV9: Concept for big, boxy electric SUV to debut Nov. 17","The Car Connection","Kia is just days out from previewing a planned electric SUV with the Concept EV9. Few details have been confirmed but teaser sketches of the concept car, released by the automaker on Wednesday, suggest we're looking at a big, boxy SUV not unlike the current Telluride. Some of the sketches show the interior which sports a yoke-style steering wheel...","2021-11-11 13:00:00","Cars","https://www.motorauthority.com/news/1134098_kia-ev9-concept-for-big-boxy-electric-suv-to-debut-nov-17","4375c6e7686712603f8231852cbdecc1427f28d4215a09cf75d885027fae45f6","2f27523094aa18f714c7957fe87bdb8b"
"Foxconn finalizes deal to acquire Lordstown plant, agrees to co-develop vehicles","The Car Connection","Struggling electric-vehicle startup Lordstown Motors has been thrown a lifeline by Foxconn, the Taiwanese contract manufacturer famous for building the iPhone for Apple. The two companies on Wednesday announced that they've finalized a previously announced deal that will see Foxconn purchase Lordstown's plant located in Lordstown, Ohio. Foxconn...","2021-11-11 14:30:00","Cars","https://www.motorauthority.com/news/1134134_foxconn-finalizes-deal-to-acquire-lordstown-plant-agrees-to-co-develop-vehicles","4375c6e7686712603f8231852cbdecc1427f28d4215a09cf75d885027fae45f6","2f364c400a004eceaa885b7a81b7ba35"
"Preview: 2023 Acura Integra prototype revives hatchback body, aims for past glory","The Car Connection","Acura has taken the wraps off of its new Integra prototype at an event in Los Angeles and the new five-door hatchback is intended to signal the return of affordable performance to the Acura lineup. A few details that we had previously guessed at were confirmed, starting with the powertrain. Under the hood will be a 1.5-liter turbo-4 (the first...","2021-11-12 03:14:00","Cars","https://www.motorauthority.com/news/1134147_preview-2023-acura-integra-prototype-revives-hatchback-body-aims-for-past-glory","4375c6e7686712603f8231852cbdecc1427f28d4215a09cf75d885027fae45f6","765855dd12b93ff3ff17228859219bd8"
"Bentley delivered first customer car 100 years ago","The Car Connection","Bentley may have celebrated its centennial in 2019, but this week marks the 100th anniversary of the purchase of the first Bentley customer car. That car was a Bentley 3 Litre, bought by wealthy British racing enthusiast Noel van Raalte in 1921, according to a Bentley press release. Manufactured at Bentley's original factory in Cricklewood, North...","2021-11-11 18:00:00","Cars","https://www.motorauthority.com/news/1134138_bentley-delivered-first-customer-car-100-years-ago","4375c6e7686712603f8231852cbdecc1427f28d4215a09cf75d885027fae45f6","ba3929f5c9b31dce434374b6f08fa9a4"
"TDF's retired F1 race cars are now available for US track enthusiasts","The Car Connection","Forget the Aston Martin Valkyrie and Mercedes-Benz AMG One. If you want the real Formula One experience in a car you can own, Tour-De-Force has the perfect offering. The U.K.-based motorsport and engineering company last year started offering what can best be described as the ultimate track car. That's because the company's TDF One is a genuine F1...","2021-11-11 16:45:00","Cars","https://www.motorauthority.com/news/1134139_tdf-s-retired-f1-race-cars-are-now-available-for-us-track-enthusiasts","4375c6e7686712603f8231852cbdecc1427f28d4215a09cf75d885027fae45f6","796b93f80239c752d30645237dbf1bc8"
"Ferrari BR20, Kia EV9, 2024 BMW 5-Series: Car News Headlines","The Car Connection","Ferrari has unveiled a new Special Projects car based on the GTC4 Lusso. It's called the BR20, and it's a large, graceful coupe with lines inspired by classic Ferraris like the 410 Superamerica and 500 Superfast. Kia is just days out from unveiling a concept for a large electric SUV. The concept is likely a preview of Kia's counterpart to...","2021-11-11 16:00:00","Cars","https://www.motorauthority.com/news/1134099_ferrari-br20-kia-ev9-2024-bmw-5-series-car-news-headlines","4375c6e7686712603f8231852cbdecc1427f28d4215a09cf75d885027fae45f6","31ae761b3803d68999361e1d6ce59824"
"2024 BMW i5 spy shots: Electric 5-Series spotted testing","The Car Connection","BMW is currently testing prototypes for a redesigned 5-Series, the nameplate's eighth generation, and our latest spy shots show a prototype for a planned battery-electric version of the mid-size sedan. The electric 5-Series, which will likely be called an i5, was first confirmed in 2020. We should see it debut alongside the regular versions of the...","2021-11-12 10:00:00","Cars","https://www.motorauthority.com/news/1132914_2024-bmw-i5-spy-shots","4375c6e7686712603f8231852cbdecc1427f28d4215a09cf75d885027fae45f6","1ab2e999b248d500b78618c35a26c081"
"Chevy will soon start selling a Corvette Z06 GT3.R customer race car","The Car Connection","Chevrolet only in October unveiled the new 2023 Corvette Z06 based on the eighth generation of America's sports car—and now the Bowtie brand has unveiled a new GT3-spec version to be offered as a customer race car. Yes, a new Corvette Z06 GT3.R race car will be offered as a turnkey solution for customer teams. It will be ready in time for...","2021-11-12 11:00:00","Cars","https://www.motorauthority.com/news/1134149_chevy-will-soon-start-selling-a-corvette-z06-gt3-r-customer-race-car","4375c6e7686712603f8231852cbdecc1427f28d4215a09cf75d885027fae45f6","ad504387ee78df5acd8bcb3b83232772"
"Drako Dragon coming to replace the GTE before it's even launched","The Car Connection","There's a Silicon Valley-based electric-vehicle startup by the name of Drako, which in 2019 unveiled the GTE electric super sedan packing 1,200 hp and a starting price of $1.25 million. At the time, the performance was still somewhat revolutionary for a production EV, though since then both Tesla and Lucid have launched electric sedans with over...","2021-11-12 12:00:00","Cars","https://www.motorauthority.com/news/1134150_drako-dragon-coming-to-replace-the-gte-before-it-s-even-launched","4375c6e7686712603f8231852cbdecc1427f28d4215a09cf75d885027fae45f6","a0ebb645178043d7f89551eaea02fd7d"
"Test mule for 2023 Lamborghini Aventador successor possibly spied","The Car Connection","Lamborghini has been spotted testing an Aventador that could just be hiding the mechanicals destined for the car's successor. The mysterious Aventador was spotted at a guarded test track in Europe. Our photographer couldn't get close to the track and was forced to take these snaps from a far distance. It's hard to make out any details but it looks...","2021-11-12 13:00:00","Cars","https://www.motorauthority.com/news/1120568_test-mule-for-2023-lamborghini-aventador-successor-possibly-spied","4375c6e7686712603f8231852cbdecc1427f28d4215a09cf75d885027fae45f6","63b4ed6a68a6979f9380920c82dbc7fc"
"2021 F1 Brazilian Grand Prix preview: A final test for sprint race qualifying","The Car Connection","After skipping 2020 due to Covid-related travel restrictions, Brazil's Autodromo Jose Carlos Pace, known to most fans as Interlagos, is once again set to host a Formula One race this weekend. The circuit, located in Sao Paulo, has previously hosted 37 Brazilian Grands Prix, and the races are always exciting. The circuit's compact layout means...","2021-11-12 14:30:00","Cars","https://www.motorauthority.com/news/1134152_2021-formula-one-brazilian-grand-prix-preview","4375c6e7686712603f8231852cbdecc1427f28d4215a09cf75d885027fae45f6","6d6eaa1454050e74fd1ea8c06aa463be"
"Porsche bringing 718 Cayman GT4 RS, new Taycan body style to 2021 LA Auto Show","The Car Connection","Porsche will have a busy time at the 2021 Los Angeles Auto Show on next week, as it has five world premieres planned. In addition to the recently revealed Panamera Platinum Edition, Porsche on Friday said it's also bringing the 718 Cayman GT4 RS, plus a related race car, a third body style for the Taycan, and a new grade for the Taycan positioned...","2021-11-12 16:45:00","Cars","https://www.motorauthority.com/news/1134157_porsche-bringing-718-cayman-gt4-rs-new-taycan-body-style-to-2021-la-auto-show","4375c6e7686712603f8231852cbdecc1427f28d4215a09cf75d885027fae45f6","2cd218e8b463d88acdd25a6f495adc61"
"2023 Acura Integra, 2024 Chevy Corvette Z06 GT3.R, Aventador successor: Today's Car News","The Car Connection","Acura has rolled out a prototype for a modern Integra ahead of the start of sales next year, and as expected the car is based on the Honda Civic hatchback platform. Unfortunately Acura is holding back all the specs until closer to the market launch. Chevrolet is jumping into the customer racing game. The Bowtie brand will offer a GT3-spec customer...","2021-11-12 16:00:00","Cars","https://www.motorauthority.com/news/1134153_2023-acura-integra-2024-chevy-corvette-z06-gt3-r-aventador-successor-today-s-car-news","4375c6e7686712603f8231852cbdecc1427f28d4215a09cf75d885027fae45f6","786ded6bb02689b547c87dfe61453389"
