"SNL reminds us why learning how to drive a stick is critical","The Car Connection","Picture this – you’ve just broken into a billionaire’s garage packed with collector vehicles with one mission – to steal a Lamborghini Diablo. With your eyes on the prize and just two minutes on the clock for a successful escape, you hop in the driver’s seat and put your foot on the gas. You hear the V12 engine rev...","2021-11-12 18:00:00","Cars","https://www.motorauthority.com/news/1134159_snl-reminds-us-why-learning-how-to-drive-a-stick-is-critical","4375c6e7686712603f8231852cbdecc1427f28d4215a09cf75d885027fae45f6","883b339d7b0e12d5578efafc41af96fd"
"2023 Acura Integra, next-gen Nissan GT-R, Porsche 911 hybrid: The Week In Reverse","The Car Connection","A prototype of the 2023 Acura Integra broke cover, Nissan announced details surrounding the next-generation Nissan GT-R , and we spotted the hybrid Porsche 911. It's the Week in Reverse, right here at Motor Authority. Acura pulled the wraps off the 2023 Acura Integra. The iconic nameplate is set to return next year, and the prototype revealed the...","2021-11-12 19:00:00","Cars","https://www.motorauthority.com/news/1134158_2023-acura-integra-next-gen-nissan-gt-r-porsche-911-hybrid-the-week-in-reverse","4375c6e7686712603f8231852cbdecc1427f28d4215a09cf75d885027fae45f6","bc91e2e9aa235842909d27168cc9f51a"
"First drive review: 2022 Jeep Grand Cherokee tackles off-road trails and on-road luxury","The Car Connection","Moab, Utah, is the unofficial adventure capital of the U.S. Numerous off-road trails wind their way up red rock buttes and mesas under an azure sky. Twisty roads snake through the rocky, hilly geography and run along the nearby Colorado River. It’s the ideal location to show off both the on- and off-road prowess of the redesigned 2022 Jeep...","2021-11-15 05:01:00","Cars","https://www.motorauthority.com/news/1132495_2022-jeep-grand-cherokee-price-specs-review-photos-info","4375c6e7686712603f8231852cbdecc1427f28d4215a09cf75d885027fae45f6","d2609a93606e5d0329a8dffc41ce5f78"
"GM reportedly to produce electric Hummers for US military","The Car Connection","The 2022 GMC Hummer EV pickup truck could spawn a U.S. military vehicle, the head of General Motors Defense said in an interview with CNBC published on Thursday. GM plans to build prototypes of the militarized Hummer EV, dubbed electric Light Reconnaissance Vehicle (eLRV) in 2022 for evaluation by the U.S. Army, GM Defense President Steve DuMont...","2021-11-14 13:00:00","Cars","https://www.motorauthority.com/news/1134155_gm-reportedly-to-produce-electric-hummers-for-us-military","4375c6e7686712603f8231852cbdecc1427f28d4215a09cf75d885027fae45f6","04906cb31a49b8e0386997fcc7c34b4f"
"1993 Jaguar XJ220 C LM that raced at Le Mans heads to auction","The Car Connection","The Jaguar XJ220 was the British automaker's ultimate road car of the early 1990s, but a handful of these supercars also raced at the 24 Hours of Le Mans. One of those XJ220 Le Mans cars is heading to a sale from auction house RM Sotheby's on November 19 at France's Circuit Paul Ricard. This 1993 Jaguar XJ220 C LM is one of three that competed at...","2021-11-14 11:00:00","Cars","https://www.motorauthority.com/news/1134104_1993-jaguar-xj220-c-lm-that-raced-at-le-mans-heads-to-auction","4375c6e7686712603f8231852cbdecc1427f28d4215a09cf75d885027fae45f6","6c64809d9e05dc9cba5fcd8d55f0224f"
"2024 BMW 5-Series, 2023 Acura Integra, Ferrari BR20: This Week's Top Photos","The Car Connection","BMW looks to be readying a sleeker, sexier design for its next-generation 5-Series. A prototype was spotted and reveals a number of clues about the new design. An electric 5-Series, likely dubbed the i5, is also coming. The first hybrid 911, at least in terms of road-going models, was also spotted testing. The hybrid should be a new range-topping...","2021-11-13 13:30:00","Cars","https://www.motorauthority.com/news/1134165_2024-bmw-5-series-2023-acura-integra-ferrari-br20-this-week-s-top-photos","4375c6e7686712603f8231852cbdecc1427f28d4215a09cf75d885027fae45f6","7565d17b77f5538a21ab9d100834a00f"
"2022 Ford Mustang Shelby GT500 Heritage Edition gets retro look","The Car Connection","Ford on Friday announced the 2022 Mustang Shelby GT500 Heritage Edition, a new special-edition model paying homage to the original 1967 Shelby GT500. Heritage Edition cars get 1967-inspired Brittany Blue paint with two Wimbledon White racing stripe options: painted or vinyl. The latter adds side stripes as well. Ford is also adding the Code Orange...","2021-11-13 11:00:00","Cars","https://www.motorauthority.com/news/1134161_2022-ford-mustang-shelby-gt500-heritage-edition-gets-retro-look","4375c6e7686712603f8231852cbdecc1427f28d4215a09cf75d885027fae45f6","d6c0dde229054b24c341cd0e7a23bf45"
"Hamilton comes from behind to win 2021 F1 Brazilian Grand Prix","The Car Connection","Mercedes-Benz AMG's Lewis Hamilton delivered a spectacular drive on Sunday to take home victory at the 2021 Formula One Brazilian Grand Prix held at Sao Paulo's Autodromo Jose Carlos Pace. The reigning champion started the race at 10th on the grid but, thanks in part to a new power unit, was able to fight his way up and overtake current...","2021-11-15 11:00:00","Cars","https://www.motorauthority.com/news/1134170_2021-f1-brazilian-grand-prix-results","4375c6e7686712603f8231852cbdecc1427f28d4215a09cf75d885027fae45f6","1027634eaeca7be838c1b5b008d9b45f"
"Did Audi just buy McLaren? Nope","The Car Connection","Citing an anonymous source, Autocar reported on Monday that Audi has purchased McLaren Group, the parent company of both the McLaren Formula One team and McLaren supercars division. McLaren Group is currently majority owned by the sovereign wealth fund of Bahrain. However, McLaren has since denied the report. Autocar's report followed a report...","2021-11-15 12:00:00","Cars","https://www.motorauthority.com/news/1134171_did-audi-just-buy-mclaren-nope","4375c6e7686712603f8231852cbdecc1427f28d4215a09cf75d885027fae45f6","c69f56775726b74bfcf411873a9fe630"
"Redesigned Dodge Durango twinned with Jeep Wagoneer reportedly coming in 2023","The Car Connection","The current Dodge Durango has been on sale since the 2011 model year, and it's now without a platform-mate since the Jeep Grand Cherokee, which previously was twinned with the Durango, has moved onto Stellantis' Giorgio platform with its latest redesign. The latest Grand Cherokee also has a seven-seat Grand Cherokee L version this time around...","2021-11-15 13:45:00","Cars","https://www.motorauthority.com/news/1134172_redesigned-dodge-durango-twinned-with-jeep-wagoneer-reportedly-coming-in-2023","4375c6e7686712603f8231852cbdecc1427f28d4215a09cf75d885027fae45f6","47f96c2cc6b41c15665ec803f96f0b64"
"Upcoming Aston Martin DBX mild-hybrid destined for China only","The Car Connection","Aston Martin has been testing a mild-hybrid version of its DBX crossover for several months, and the automaker last week confirmed the vehicle is being developed exclusively for sale in China. It will make its formal debut at Auto Guangzhou 2021 which starts November 19. The DBX mild-hybrid will feature a similar setup to the one used by...","2021-11-15 13:00:00","Cars","https://www.motorauthority.com/news/1133384_aston-martin-dbx-mild-hybrid-destined-for-china-only","4375c6e7686712603f8231852cbdecc1427f28d4215a09cf75d885027fae45f6","7a68c55d56146a98bb903d165093230b"
"McLaren Group denies reports it was bought by Audi","The Car Connection","Citing an anonymous source, Autocar reported on Monday that Audi has purchased McLaren Group, the parent company of both the McLaren Formula One team and McLaren supercars division. McLaren Group is currently majority owned by the sovereign wealth fund of Bahrain. However, McLaren has since denied the report, calling it wholly innacurate....","2021-11-15 12:00:00","Cars","https://www.motorauthority.com/news/1134171_did-audi-just-buy-mclaren-nope","4375c6e7686712603f8231852cbdecc1427f28d4215a09cf75d885027fae45f6","cf456f5ed48ba72aa0bc0618bee5ca24"
"Aston Martin DBX mild-hybrid destined for China only","The Car Connection","Aston Martin has been testing a mild-hybrid version of its DBX crossover for several months, and the automaker has now revealed it as the DBX Straight-Six. It's been developed exclusively for the Chinese market, and will make its formal debut at Auto Guangzhou 2021 which starts November 19. The DBX Straight-Six features the same powertrain setup...","2021-11-15 13:00:00","Cars","https://www.motorauthority.com/news/1133384_aston-martin-dbx-mild-hybrid-destined-for-china-only","4375c6e7686712603f8231852cbdecc1427f28d4215a09cf75d885027fae45f6","fd9c8554e448a44d08f8eeadc1f96b0d"
"2023 BMW 7-Series spy shots and video: Redesigned flagship sedan takes shape","The Car Connection","BMW is working on a redesign for its 7-Series and new prototypes have been spotted. The seventh-generation flagship is set to debut in 2022 as a 2023 model. Previously we brought you spy shots of a new battery-electric variant that may end up being called an i7. The latest prototypes are for variants equipped with internal-combustion engines, and...","2021-11-15 15:00:00","Cars","https://www.motorauthority.com/news/1131300_2023-bmw-7-series-spy-shots-video","4375c6e7686712603f8231852cbdecc1427f28d4215a09cf75d885027fae45f6","f1503e40e6389d8d356d326e3efd6a67"
"2022 Jeep Grand Cherokee, 2022 Aston Martin DBX, next Dodge Durango: Car News Headlines","The Car Connection","The latest Jeep Grand Cherokee can handle the rigors of Moab while also delivering every day luxury. And it's now more flexible than ever thanks to both two- and three-row versions on offer. We've just taken a spin in the two-row. Aston Martin's DBX has only been out a year but is already accounting for roughly one out of every two sales. No...","2021-11-15 16:00:00","Cars","https://www.motorauthority.com/news/1134174_2022-jeep-grand-cherokee-2022-aston-martin-dbx-next-dodge-durango-car-news-headlines","4375c6e7686712603f8231852cbdecc1427f28d4215a09cf75d885027fae45f6","b435e22cf435a5ba36804ce508eaa3b4"
"Dutch design firm imagines a modern Ferrari F50","The Car Connection","Dutch firm Ugur Sahin Design has reimagined the Ferrari F50. Dubbed Project Fenix, the concept was created to celebrate the firm's 15th anniversary. The design's integrated basket-handle rear wing and black body line are clear references to the original F50, but its larger front air intakes and slim headlights and taillights are more modern...","2021-11-15 19:00:00","Cars","https://www.motorauthority.com/news/1134175_dutch-design-firm-imagines-a-modern-ferrari-f50","4375c6e7686712603f8231852cbdecc1427f28d4215a09cf75d885027fae45f6","c37e302bc682aa4221456bd329621bb1"
"2023 Kia Niro EV spy shots","The Car Connection","Kia is developing a redesigned Niro compact crossover and our latest spy shots show a prototype for the electric version. The current Niro spawned its Niro EV electric variant for the 2019 model year. Expect this new Niro EV to debut alongside the new Niro in 2022. They should both arrive as 2023 models. Kia has only just launched the 2022 EV6, a...","2021-11-15 18:00:00","Cars","https://www.motorauthority.com/news/1134176_2023-kia-niro-ev-spy-shots","4375c6e7686712603f8231852cbdecc1427f28d4215a09cf75d885027fae45f6","32291aa32edd3c9e280f57660c7bea28"
"Racing legend Bob Bondurant dead at 88","The Car Connection","Racing driver and driving school founder Bob Bondurant died Friday in Paradise Valley, Arizona, at the age of 88, Racer has learned. The son of a car dealer, Bondurant began racing in Corvettes on the West Coast in the early 1960s. He soon switched allegiance to Carroll Shelby and Ford, winning the GT class at the 1964 24 Hours of Le Mans in a...","2021-11-15 16:45:00","Cars","https://www.motorauthority.com/news/1134173_racing-legend-bob-bondurant-dead-at-88","4375c6e7686712603f8231852cbdecc1427f28d4215a09cf75d885027fae45f6","a231dc64ed124265cf15cf70d1d38424"
"Preview: 2023 Mazda CX-50 is a compact crossover with rugged looks, standard AWD","The Car Connection","Mazda late on Monday provided a first look at the 2023 CX-50, a compact crossover the automaker said is aimed at outdoor enthusiasts and other lifestyle-oriented buyers. Mazda is holding back detailed specifications until closer to the market launch next spring, but we know the CX-50 will come with standard all-wheel drive and initially be offered...","2021-11-16 07:30:00","Cars","https://www.motorauthority.com/news/1134112_2023-mazda-cx-50-price-specs-review-photos-info","4375c6e7686712603f8231852cbdecc1427f28d4215a09cf75d885027fae45f6","c3665eb4c3f908103f7c4cb3dbc1a9c3"
"Guanyu Zhou becomes China's first F1 driver after signing with Alfa Romeo","The Car Connection","Alfa Romeo's Formula One team will have a new driver lineup in 2022 with the announcement on Tuesday that Guanyu Zhou will replace Antonio Giovinazzi after the current season. Zhou currently competes in F2, where he has multiple wins and is currently second in the championship. He is also a test driver for Alpine, and with the promotion to Alfa...","2021-11-16 09:45:00","Cars","https://www.motorauthority.com/news/1134184_guanyu-zhou-becomes-china-s-first-f1-driver-after-signing-with-alfa-romeo","4375c6e7686712603f8231852cbdecc1427f28d4215a09cf75d885027fae45f6","c9a426ed909ed254047b3cee45d8a45a"
"600-plus-hp Audi RS 6 Avant E-Tron reportedly in the works","The Car Connection","With Audi set to launch its final car with an internal-combustion engine in 2026, most models in the automaker's lineup in the coming years will transition to electric power, including those from the Audi Sport division. Audi Sport is responsible for S- and RS-badged Audis (as well as the R8 supercar), and there are already electric models...","2021-11-16 11:00:00","Cars","https://www.motorauthority.com/news/1134182_600-plus-hp-audi-rs-6-avant-e-tron-reportedly-in-the-works","4375c6e7686712603f8231852cbdecc1427f28d4215a09cf75d885027fae45f6","7335fd241596b2982377f3117970b6ed"
"Electric Genesis GV70 to debut at Auto Guangzhou 2021","The Car Connection","Genesis is pushing ahead with the full electrification of its lineup. Having already revealed an electric version of the G80 and a dedicated electric vehicle dubbed the GV60, Genesis is now days out from revealing an electric version of its GV70. The Korean luxury brand has dropped a teaser photo of a new GV70 variant set to debut on Friday at...","2021-11-16 13:00:00","Cars","https://www.motorauthority.com/news/1131378_electric-genesis-gv70-to-debut-at-auto-guangzhou-2021","4375c6e7686712603f8231852cbdecc1427f28d4215a09cf75d885027fae45f6","f5a3420c4704909a8fe534054d00f6db"
"2024 Mercedes-Benz Maybach GLS-Class spy shots: Mild facelift pegged for ultra-lux SUV","The Car Connection","Mercedes-Benz looks to be in the early stages of development of an update for its Maybach GLS-Class, the ultra-luxury version of the full-size GLS-Class. The current-generation GLS-Class arrived on the scene in 2019 as a 2020 model, with the Maybach version arriving a year later. In Mercedes tradition, the GLS-Class should receive a mid-cycle...","2021-11-16 14:30:00","Cars","https://www.motorauthority.com/news/1134185_2024-mercedes-benz-maybach-gls-class-spy-shots","4375c6e7686712603f8231852cbdecc1427f28d4215a09cf75d885027fae45f6","ba6f7fb531784d4fc206194ddbf3c034"
"Porsche 718 Cayman GT4 RS Clubsport offers GT4 racers a ready-made race car for $229,000","The Car Connection","Porsche has a new customer race car for the IMSA Michelin Pilot Challenge and SRO GT4 America classes, and it's based on the most extreme 718 Cayman yet. Porsche unveiled the 718 Cayman GT4 RS Clubsport Wednesday at the Los Angeles auto show. Like the 2022 Porsche 718 Cayman GT4 RS, the Clubsport draws its power from the brand's naturally...","2021-11-17 05:30:00","Cars","https://www.motorauthority.com/news/1134192_porsche-718-cayman-gt4-rs-clubsport-offers-gt4-racers-a-ready-made-race-car-for-229-000","4375c6e7686712603f8231852cbdecc1427f28d4215a09cf75d885027fae45f6","36cf34b4c4eebab25ed639e4b492d6ba"
"2022 Porsche Taycan adds GTS model, Sport Turismo body style","The Car Connection","The Porsche Taycan has brought Porsche into the electric era with the performance expected of the brand. On Wednesday, Porsche unveiled the sportiest version yet, the Taycan GTS, which also marks the debut of the Sport Turismo body style. But the Taycan already offers a wagon body style, right? Yes, but that's the Cross Turismo with 0.8 inch more...","2021-11-17 05:00:00","Cars","https://www.motorauthority.com/news/1134194_2022-porsche-taycan-adds-gts-model-sport-turismo-body-style","4375c6e7686712603f8231852cbdecc1427f28d4215a09cf75d885027fae45f6","5d9cab0f62e654d74f67abdf27507fcb"
"2022 Porsche 718 Cayman GT4 RS channels 911 GT3 in the most extreme Cayman yet","The Car Connection","The Porsche 718 Cayman thrills drivers with the incredible balance and agility of a mid-engine sports car. If it's missing anything, it might be the naturally aspirated 4.0-liter flat-6 from the 911 GT3. Call it case closed. On Tuesday, Porsche unveiled the new 718 Cayman GT4 RS on the eve of the Los Angles auto show with the GT3's 500-hp flat-6...","2021-11-17 04:30:00","Cars","https://www.motorauthority.com/news/1134179_2022-porsche-718-cayman-gt4-rs-channels-911-gt3-in-the-most-extreme-cayman-yet","4375c6e7686712603f8231852cbdecc1427f28d4215a09cf75d885027fae45f6","3c9f13ee2bd67f7eba72757045c1263e"
"Preview: 2023 Nissan Ariya arrives with 300-mile range, $47,125 starting price","The Car Connection","It's been more than a year since Nissan first took the covers off the Ariya, a small, battery-electric crossover. Well, Nissan on Tuesday finally confirmed that the Ariya will land in showrooms next fall as a 2023 model. Yes, there's another year of waiting. Nissan also announced that the reservation process is now open, but interested buyers...","2021-11-17 03:00:00","Cars","https://www.motorauthority.com/news/1128729_2023-nissan-ariya-price-specs-review-photos-info","4375c6e7686712603f8231852cbdecc1427f28d4215a09cf75d885027fae45f6","43c152fecf85a26e8dde7ac0efb5c0df"
"First drive review: 2022 BMW 2-Series gets bigger, but feels smaller","The Car Connection","Whenever I hear that a BMW has grown in a redesign, a little piece of me dies inside. This isn’t to solely impugn BMW. Model bloat happens at every automaker. But it especially hurts when it’s a BMW because that growth often makes the cars lose some of the edge that made them so fun to drive. That’s certainly the case in the...","2021-11-16 23:01:00","Cars","https://www.motorauthority.com/news/1132734_2022-bmw-2-series-price-specs-review-photos-info","4375c6e7686712603f8231852cbdecc1427f28d4215a09cf75d885027fae45f6","2e3db21c47e5ae1dae56c445397856e7"
"2008 Mercedes-Benz CLK 63 AMG Black Series roars into Jay Leno's Garage","The Car Connection","While an AMG badge signifies greater performance than a standard Mercedes-Benz, there has also been a performance hierarchy within AMG for some time. At the top of that hierarchy are the Black Series models, and racing driver Tommy Kendall recently brought one of the earliest versions to Jay Leno's famous garage. The 2008 Mercedes-Benz CLK 63 AMG...","2021-11-16 18:00:00","Cars","https://www.motorauthority.com/news/1134189_2008-mercedes-benz-clk-63-amg-black-series-roars-into-jay-leno-s-garage","4375c6e7686712603f8231852cbdecc1427f28d4215a09cf75d885027fae45f6","4d7735b2b959a38a45bf258c339a340b"
"Here are all the Easter eggs in Cadillac's CT4-V and CT5-V Blackwing sedans","The Car Connection","The 2022 Cadillac CT4-V Blackwing and CT5-V Blackwing both have a number of Easter eggs sprinkled throughout their cabins. While it does take away some of the fun of discovering them, Cadillac on Monday explained a few of them. Both sedans are available with manual or paddle-shifted automatic transmissions. On manual cars, the blanking panels...","2021-11-16 16:45:00","Cars","https://www.motorauthority.com/news/1134187_here-are-all-the-easter-eggs-in-cadillac-s-ct4-v-and-ct5-v-blackwing-sedans","4375c6e7686712603f8231852cbdecc1427f28d4215a09cf75d885027fae45f6","321b2051957b9f40eacf9233e4cb9ebc"
"2023 Mazda CX-50, 2024 Mercedes-Benz GLS-Class, electric Audi RS 6: Today's Car News","The Car Connection","Mazda has multiple new crossovers on the way, and the first of these has been revealed as the 2023 CX-50. It's a compact crossover similar in size to the CX-5, and it's aimed at outdoor enthusiasts and other lifestyle-oriented buyers instead of urban commuters. Mercedes-Benz's GLS-Class is about to come in for a mid-cycle update, and we've just...","2021-11-16 16:00:00","Cars","https://www.motorauthority.com/news/1134186_2023-mazda-cx-50-2024-mercedes-benz-gls-class-electric-audi-rs-6-today-s-car-news","4375c6e7686712603f8231852cbdecc1427f28d4215a09cf75d885027fae45f6","5846ce406097dfa4902f43d0befedd14"
"German EV startup Sono plans US IPO","The Car Connection","A German electric-vehicle startup by the name of Sono Motors, which has largely flown under the radar, plans to go public by launching an initial public offering in the U.S. The Munich-based company on Tuesday said it planned to list 10 million shares at $15 per share, with underwriters given a 30-day option to purchase an additional 1.5 million...","2021-11-17 11:00:00","Cars","https://www.motorauthority.com/news/1134197_german-ev-startup-sono-plans-us-ipo","4375c6e7686712603f8231852cbdecc1427f28d4215a09cf75d885027fae45f6","4e6c72bdd5b4abaa20bcb3a08d4d251e"
"Preview: 2023 Toyota BZ4X electric crossover revealed with 214 hp, 250-mile range","The Car Connection","Toyota on Wednesday revealed U.S. information for the first member of its new BZ (Beyond Zero) sub-brand for electric vehicles. It's a small crossover similar in size to the top-selling RAV4, and it's due in U.S. showrooms in mid-2022 as a 2023 model. The crossover was previewed in April by the BZ4X concept and carries that name into production. A...","2021-11-17 12:30:00","Cars","https://www.motorauthority.com/news/1134013_2023-toyota-bz4x-price-specs-review-photos-info","4375c6e7686712603f8231852cbdecc1427f28d4215a09cf75d885027fae45f6","b9a670f4555bae54b416539326348e39"
"Dodge introduces Jailbreak models for 2022 Charger and Challenger SRT Hellcat Redeyes","The Car Connection","Buyers of the 2022 Dodge Challenger SRT Hellcat Redeye Widebody and 2022 Dodge Charger SRT Hellcat Redeye Widebody no longer need to be limited to the standard color palette on offer. That's because Dodge is introducing a special Jailbreak model that unlocks color options for the cars when ordering, not just for the exterior but also interior trim...","2021-11-17 12:00:00","Cars","https://www.motorauthority.com/news/1134199_dodge-introduces-jailbreak-models-for-2022-charger-and-challenger-srt-hellcat-redeyes","4375c6e7686712603f8231852cbdecc1427f28d4215a09cf75d885027fae45f6","fd9649ad9e4f2540cc558a0e4c3298b0"
"TVR prepares for EV future with partnership with lithium producer","The Car Connection","TVR on Monday said it formed a deal with a lithium producer by the name of Ensorcia Metals, to help generate funding for production of the current V-8-powered Griffith sports car as well as establish a joint venture in the electric-vehicle space. The revived British sports car marque was vague in its latest statement but said work on alternative...","2021-11-17 13:45:00","Cars","https://www.motorauthority.com/news/1134201_tvr-prepares-for-ev-future-with-partnership-with-lithium-producer","4375c6e7686712603f8231852cbdecc1427f28d4215a09cf75d885027fae45f6","dc48e5a563b7f631228bba9096b75508"
"Lucid's market value now higher than Ford","The Car Connection","Electric-vehicle startup Lucid has only just started production of its first model, the 2022 Air luxury sedan, but its share price has been on a tear since the company went public via a SPAC deal in July. On Tuesday the share price shot up 24% following the release of positive news about reservations and production numbers, bringing Lucid's market...","2021-11-17 13:00:00","Cars","https://www.motorauthority.com/news/1134200_lucid-s-market-value-now-higher-than-ford","4375c6e7686712603f8231852cbdecc1427f28d4215a09cf75d885027fae45f6","873de8f17b35adc199000694aa96410e"
"Infrastructure law paves way for adaptive headlights in US","The Car Connection","The infrastructure bill signed into law by President Joe Biden on Monday includes more than just funding for roads and bridges. It also updates regulations to finally bring adaptive headlights to the U.S. Adaptive headlights, also known as matrix headlights, consist of numerous small LED elements and mirrors that can control a light beam in...","2021-11-17 15:00:00","Cars","https://www.motorauthority.com/news/1134202_infrastructure-law-paves-way-for-adaptive-headlights-in-us","4375c6e7686712603f8231852cbdecc1427f28d4215a09cf75d885027fae45f6","f61e3ca32ecb82d99609fcc071c2aec7"
"2022 Porsche 718 Cayman GT4 RS, 2023 Nissan Ariya, 2023 Toyota BZ4X: Car News Headlines","The Car Connection","After what seems like forever, Porsche's 718 Cayman GT4 RS has finally landed, and the car is even better than what we had expected. We're talking a flat-6 that revs to 9,000 rpm and delivers almost 500 hp. There's no manual but we can't fault Porsche's 7-speed dual-clutch box. In fact, probably the only downside with the car is the challenge it...","2021-11-17 16:00:00","Cars","https://www.motorauthority.com/news/1134203_2022-porsche-718-cayman-gt4-rs-2023-nissan-ariya-2023-toyota-bz4x-car-news-headlines","4375c6e7686712603f8231852cbdecc1427f28d4215a09cf75d885027fae45f6","942e97cacce5c70428dbdee8857ee346"
