"BDS built a two-door Ford Bronco rescue pickup","The Car Connection","Among the many Bronco builds unveiled for the 2021 SEMA show, BDS Suspension's build stood out thanks to a two-door pickup-body conversion and rescue theme. The aftermarket suspension company provided a bit more detail on the build in a blog post. Dubbed Fire Command, the two-door Bronco was designed to help a fire chief get to the site of an...","2021-11-03 18:00:00","Cars","https://www.motorauthority.com/news/1134058_bds-built-a-two-door-ford-bronco-rescue-pickup?utm_source=feedburner&utm_medium=feed&utm_campaign=Feed%3A+Motorauthority2+%28Motorauthority+Master+Feed%29","4375c6e7686712603f8231852cbdecc1427f28d4215a09cf75d885027fae45f6","51d8ac4c5cc48af39ad924291bba0515"
"Hyundai Seven concept previews large electric crossover due in 2024","The Car Connection","Hyundai on Wednesday provided a teasing look at a concept that previews a large electric crossover set to join the automaker's Ioniq family of battery-electric vehicles in 2024, possibly as the Ioniq 7. The concept is called the Seven, which backs rumors of the Ioniq 7 name being used for the production model, as well as the vehicle having seven...","2021-11-03 22:00:00","Cars","https://www.motorauthority.com/news/1133531_hyundai-seven-concept-previews-large-electric-crossover-due-in-2024?utm_source=feedburner&utm_medium=feed&utm_campaign=Feed%3A+Motorauthority2+%28Motorauthority+Master+Feed%29","4375c6e7686712603f8231852cbdecc1427f28d4215a09cf75d885027fae45f6","927e3784abe0b2b681c64a8f6e303bb4"
"2024 Mini Countryman spy shots: ICE and battery-electric power on the menu","The Car Connection","Hot on the heels of Wednesday's tease of the next-generation Mini Hardtop comes our first spy shots of the premium small car brand's next Countryman. Both redesigned vehicles are due in 2023, likely as 2024 models. The Countryman prototype in our spy shots is for a performance-oriented model, as evidenced by the big wheel and brake package, and...","2021-11-04 10:00:00","Cars","https://www.motorauthority.com/news/1130375_2024-mini-countryman-spy-shots?utm_source=feedburner&utm_medium=feed&utm_campaign=Feed%3A+Motorauthority2+%28Motorauthority+Master+Feed%29","4375c6e7686712603f8231852cbdecc1427f28d4215a09cf75d885027fae45f6","53ab1ba7561750816d0a0f0aa18510eb"
"McLaren partners with Multimatic for 2022 Extreme E entry","The Car Connection","McLaren is set to enter the new electric off-road racing series Extreme E in 2022, but it won't go it alone. The British race team and supercar manufacturer announced on Wednesday that it will partner with leading Canadian motorsport and engineering company Multimatic for its Extreme E effort. The partnership will provide McLaren with access to...","2021-11-04 11:00:00","Cars","https://www.motorauthority.com/news/1134067_mclaren-partners-with-multimatic-for-2022-extreme-e-entry?utm_source=feedburner&utm_medium=feed&utm_campaign=Feed%3A+Motorauthority2+%28Motorauthority+Master+Feed%29","4375c6e7686712603f8231852cbdecc1427f28d4215a09cf75d885027fae45f6","673063926dc24f7251b9a89e992ff281"
"New BMW M flagship to be unveiled Nov. 29","The Car Connection","BMW announced on Thursday that its BMW M performance division will unveil a new flagship vehicle on November 29. The vehicle is described as a high-performance hybrid to be built at BMW's plant in Spartanburg, South Carolina. The plant, which is BMW Group's biggest in the world, currently builds crossovers exclusively. The list includes the X3...","2021-11-04 12:45:00","Cars","https://www.motorauthority.com/news/1133387_new-bmw-m-flagship-to-be-unveiled-nov-29?utm_source=feedburner&utm_medium=feed&utm_campaign=Feed%3A+Motorauthority2+%28Motorauthority+Master+Feed%29","4375c6e7686712603f8231852cbdecc1427f28d4215a09cf75d885027fae45f6","34cb447916b6882d2082ab18e2ed483d"
"First customer example of 1,139-hp Aston Martin Valkyrie has been built","The Car Connection","Aston Martin's Valkyrie hypercar is finally in production, five years after it was first shown as a concept. The automaker announced on Thursday that the first customer example has been completed and will be delivered in the coming weeks. That's about two years later than originally planned. Production is taking place at Aston Martin's plant in...","2021-11-04 12:00:00","Cars","https://www.motorauthority.com/news/1127494_first-customer-example-of-1-139-hp-aston-martin-valkyrie-has-been-built?utm_source=feedburner&utm_medium=feed&utm_campaign=Feed%3A+Motorauthority2+%28Motorauthority+Master+Feed%29","4375c6e7686712603f8231852cbdecc1427f28d4215a09cf75d885027fae45f6","eb3af9ea792ca8ee6fd703199e857280"
"Next Ferrari Icona model to debut mid-Nov., likely take inspiration from 1967's 330 P4","The Car Connection","Ferrari in 2018 launched the new Icona series aimed at collectors looking to purchase a one-off or low-volume Ferrari with styling unashamedly cribbed from past classics. The first in the series were the 812-based Monza SP1 and Monza SP2 cars, inspired by early racing barchettas like the original 750 Monza and 860 Monza of the 1950s. The next...","2021-11-04 14:00:00","Cars","https://www.motorauthority.com/news/1133625_next-ferrari-icona-model-to-debut-mid-nov-likely-take-inspiration-from-1967-s-330-p4?utm_source=feedburner&utm_medium=feed&utm_campaign=Feed%3A+Motorauthority2+%28Motorauthority+Master+Feed%29","4375c6e7686712603f8231852cbdecc1427f28d4215a09cf75d885027fae45f6","4afca60dccc0a6c1e4edd2938bf5fd79"
"Lexus F to introduce 4 levels of performance","The Car Connection","You may be wondering why Lexus decided to call the range-topping version of its latest IS sedan an IS 500 F Sport Performance instead of simply an IS F, especially considering that it packs a more powerful version of the same V-8 engine that featured in the last IS F. At the car's launch earlier this year, Lexus said the decision had to do with...","2021-11-04 15:45:00","Cars","https://www.motorauthority.com/news/1134068_lexus-f-to-introduce-4-levels-of-performance?utm_source=feedburner&utm_medium=feed&utm_campaign=Feed%3A+Motorauthority2+%28Motorauthority+Master+Feed%29","4375c6e7686712603f8231852cbdecc1427f28d4215a09cf75d885027fae45f6","94c137eba61a0e6a6276acd0226ec7de"
"Aston Martin Valkyrie, Hyundai Ioniq 7, Mini Countryman: Today's Car News","The Car Connection","Aston Martin's Valkyrie is now in production and will start deliveries within weeks. The news comes five years after a concept for the hypercar was first shown. Aston Martin plans to build 150 regular Valkyries, plus 85 Valkyrie Spider convertibles and 40 Valkyrie AMR Pro track cars. Following the Ioniq 5 compact crossover and upcoming Ioniq 6...","2021-11-04 15:00:00","Cars","https://www.motorauthority.com/news/1126218_aston-martin-valkyrie-hyundai-ioniq-7-mini-countryman-today-s-car-news?utm_source=feedburner&utm_medium=feed&utm_campaign=Feed%3A+Motorauthority2+%28Motorauthority+Master+Feed%29","4375c6e7686712603f8231852cbdecc1427f28d4215a09cf75d885027fae45f6","1ef1130fe3daca4aac213eefeff3d42b"
"Electric 2024 VW Bus teased, reveal set for 2022","The Car Connection","Volkswagen on Wednesday teased a prototype version of its ID.Buzz—the all-electric revival of the classic Microbus—which the automaker plans to fully reveal in 2022. The camouflaged ID.Buzz prototype was shown briefly by Klaus Zellmer, VW board member for global sales, during the livestream of the VW ID.5 crossover reveal. Zellmer...","2021-11-04 17:00:00","Cars","https://www.motorauthority.com/news/1134070_electric-2024-vw-bus-teased-reveal-set-for-2022?utm_source=feedburner&utm_medium=feed&utm_campaign=Feed%3A+Motorauthority2+%28Motorauthority+Master+Feed%29","4375c6e7686712603f8231852cbdecc1427f28d4215a09cf75d885027fae45f6","60a2fbc490732ad709d6f0b529305469"
"Listen to Chevy's 632-cubic-inch 10.3-liter V-8 rev to 7,000 rpm on the dyno","The Car Connection","Chevrolet unveiled its biggest, most powerful crate engine to date at the 2021 SEMA show this week, and now it's offer a tease of this massive engine's sound. The Chevrolet Performance ZZ632/1000 V-8 crate engine displaces 10.35 liters, or 632 cubic inches, and can rev to 7,000 rpm. Chevrolet Performance recently posted a short video on Instagram...","2021-11-04 18:00:00","Cars","https://www.motorauthority.com/news/1134072_listen-to-chevy-s-632-cubic-inch-10-3-liter-v-8-rev-to-7-000-rpm-on-the-dyno?utm_source=feedburner&utm_medium=feed&utm_campaign=Feed%3A+Motorauthority2+%28Motorauthority+Master+Feed%29","4375c6e7686712603f8231852cbdecc1427f28d4215a09cf75d885027fae45f6","bc1a35fbde13701fc81416649fd66d29"
"2022 Audi Q5 E-Tron spy shots: Chinese-market electric crossover surfaces","The Car Connection","Audi is close to revealing an electric crossover sized between the E-Tron and recently launched Q4 E-Tron. It isn't the Q6 E-Tron that Audi plans to unveil in 2022. Rather, the new crossover has been badged a Q5 E-Tron, and it has been developed exclusively for the Chinese market where it will be built by Audi via a local joint venture with...","2021-11-05 10:00:00","Cars","https://www.motorauthority.com/news/1132759_2022-audi-q5-e-tron-spy-shots?utm_source=feedburner&utm_medium=feed&utm_campaign=Feed%3A+Motorauthority2+%28Motorauthority+Master+Feed%29","4375c6e7686712603f8231852cbdecc1427f28d4215a09cf75d885027fae45f6","e390773a102c98ccb32e69f7a4b44da7"
"Preview: 2022 Toyota Tundra revealed with new platform, V-6 power, rear coil springs, and $37,645 price tag","The Car Connection","Toyota in September unveiled a new generation of its Tundra full-size pickup truck, and on Friday we receive the all-important pricing details. Set to go on sale in December as a 2022 model with a starting price of $37,645, including a $1,695 destination charge, the arrival of the new Tundra is a big deal as this is only the third generation since...","2021-11-05 11:00:00","Cars","https://www.motorauthority.com/news/1132650_2022-toyota-tundra-price-specs-review-photos-info?utm_source=feedburner&utm_medium=feed&utm_campaign=Feed%3A+Motorauthority2+%28Motorauthority+Master+Feed%29","4375c6e7686712603f8231852cbdecc1427f28d4215a09cf75d885027fae45f6","840bb09cac9717a00dbd91b89d78c269"
"First Alfa Romeo EV due in 2024, may feature Quadrifoglio performance grade","The Car Connection","Alfa Romeo has no plans to abandon its Quadrifoglio performance option when the automaker goes the full-electric route by 2027. That's according to Alfa Romeo chief Jean-Philippe Imparato who, in an interview with Autocar published on Thursday, said Alfa Romeo's first electric vehicle will arrive in 2024 and may gain a Quadrifoglio variant. He...","2021-11-05 12:00:00","Cars","https://www.motorauthority.com/news/1134075_first-alfa-romeo-ev-due-in-2024-may-feature-quadrifoglio-performance-grade?utm_source=feedburner&utm_medium=feed&utm_campaign=Feed%3A+Motorauthority2+%28Motorauthority+Master+Feed%29","4375c6e7686712603f8231852cbdecc1427f28d4215a09cf75d885027fae45f6","36092111aaef8669381409eb0c6eb307"
"2021 F1 Mexico City Grand Prix preview: Championship enters final 5 rounds","The Car Connection","Round 18 of the 2021 Formula One World Championship takes place this weekend in Mexico. Previously known as the Mexican Grand Prix, the race has been renamed the Mexico City Grand Prix to reflect its presence in the Mexican capital. The annual race, which was skipped last year due to Covid-19 restrictions, runs on the Autodromo Hermanos Rodriguez...","2021-11-05 14:00:00","Cars","https://www.motorauthority.com/news/1134079_2021-f1-mexico-city-grand-prix-preview?utm_source=feedburner&utm_medium=feed&utm_campaign=Feed%3A+Motorauthority2+%28Motorauthority+Master+Feed%29","4375c6e7686712603f8231852cbdecc1427f28d4215a09cf75d885027fae45f6","06cd8995379a81f922e7fc7f228adaa1"
"Rare 1965 Shelby Cobra Factory Stage III 289 Dragonsnake heads to auction","The Car Connection","A rare Shelby Cobra, one of just six like it, is headed to Mecum's auction running January 6-15 in Kissimmee, Florida. The car is a 1965 Shelby Cobra Factory Stage III 289 Dragonsnake originally built by Shelby for drag racing, and it was part of the Steven Juliano estate sale held by Mecum in 2019. The car failed to meet its reserve and is now...","2021-11-05 13:00:00","Cars","https://www.motorauthority.com/news/1134078_rare-1965-shelby-cobra-factory-stage-iii-289-dragonsnake-heads-to-auction?utm_source=feedburner&utm_medium=feed&utm_campaign=Feed%3A+Motorauthority2+%28Motorauthority+Master+Feed%29","4375c6e7686712603f8231852cbdecc1427f28d4215a09cf75d885027fae45f6","3e0687662b0f0f716f768743991fcebb"
"How the Audi RS 2 Avant came to be thanks to Porsche","The Car Connection","The Audi RS 2 Avant launched the automaker's RS (now Audi Sport) performance sub-brand, but the hot wagon was developed with lots of help from Porsche, as recounted in a deep dive from that firm. Audi and Porsche are now nestled closely together under the Volkswagen Group umbrella, but prior to that Porsche sometimes took on projects for other...","2021-11-05 15:45:00","Cars","https://www.motorauthority.com/news/1132943_how-the-audi-rs-2-avant-came-to-be-thanks-to-porsche?utm_source=feedburner&utm_medium=feed&utm_campaign=Feed%3A+Motorauthority2+%28Motorauthority+Master+Feed%29","4375c6e7686712603f8231852cbdecc1427f28d4215a09cf75d885027fae45f6","8a4e06df6a631aae93e43531d9ad429d"
"2022 Audi Q5 E-Tron, 2022 Toyota Tundra, 2024 VW ID.Buzz: Car News Headlines","The Car Connection","Audi will soon launch on the Chinese market a twin to the Volkswagen ID.6 X electric crossover. Audi's version is called a Q5 E-Tron, and we've just spotted a prototype. Toyota's Tundra full-size pickup truck has been redesigned for the 2022 model year, and we having pricing information. The third-generation pickup has lost the V-8 but a pair of...","2021-11-05 15:00:00","Cars","https://www.motorauthority.com/news/1134080_2022-audi-q5-e-tron-2022-toyota-tundra-2024-vw-id-buzz-car-news-headlines?utm_source=feedburner&utm_medium=feed&utm_campaign=Feed%3A+Motorauthority2+%28Motorauthority+Master+Feed%29","4375c6e7686712603f8231852cbdecc1427f28d4215a09cf75d885027fae45f6","31da0b510c150073cca862e14b0fe9b9"
"Apollo previews new hypercar and electric coupe","The Car Connection","After making its mark in the world in 2019 with the insane Intensa Emozione hypercar, Apollo is now pressing ahead with a successor model code-named Project Evo, as well as an expansion into the rapidly growing electric-vehicle segment. The company on Friday presented several concepts at the China International Import Expo 2021 trade show...","2021-11-05 17:00:00","Cars","https://www.motorauthority.com/news/1134081_apollo-previews-new-hypercar-and-electric-coupe?utm_source=feedburner&utm_medium=feed&utm_campaign=Feed%3A+Motorauthority2+%28Motorauthority+Master+Feed%29","4375c6e7686712603f8231852cbdecc1427f28d4215a09cf75d885027fae45f6","7e2672710e992e480028d4482e539b0b"
"2021 Ford Bronco Wildtrak, SEMA, 2023 Ford Ranger: The Week In Reverse","The Car Connection","We spent more time in the 2021 Ford Bronco, Ford showed a fleet of modified vehicles at the 2022 SEMA show, and the 2023 Ford Ranger was teased. It's the Week in Reverse, right here at Motor Authority. We lived with the 2021 Ford Bronco two-door Wildtrak for a week and experienced its strengths and weaknesses. It has the right retro-inspired look...","2021-11-05 18:00:00","Cars","https://www.motorauthority.com/news/1134076_2021-ford-bronco-wildtrak-sema-2023-ford-ranger-the-week-in-reverse?utm_source=feedburner&utm_medium=feed&utm_campaign=Feed%3A+Motorauthority2+%28Motorauthority+Master+Feed%29","4375c6e7686712603f8231852cbdecc1427f28d4215a09cf75d885027fae45f6","bd56e2f081cec279b63af39312aa7fb6"
"8 Volkswagen concept cars the world forgot about","The Car Connection","After their moment in the spotlight is over, concept cars are often forgotten. But Volkswagen recently took a look back at eight of its concepts from the past 30 years, including some fairly unusual ones the world has forgotten about. One of the earliest concepts in VW's retrospective is also one of the weirdest. Unveiled in 1986, the Italdesign...","2021-11-07 13:00:00","Cars","https://www.motorauthority.com/news/1133598_8-volkswagen-concept-cars-the-world-forgot-about?utm_source=feedburner&utm_medium=feed&utm_campaign=Feed%3A+Motorauthority2+%28Motorauthority+Master+Feed%29","4375c6e7686712603f8231852cbdecc1427f28d4215a09cf75d885027fae45f6","704c1b5fc762b5a671c0852e2dd9ca7f"
"1954 Explorer dream car is world’s rarest Plymouth","The Car Connection","The Petersen Automotive Museum, located in Los Angeles, California, is home to some of the rarest classic and collector cars from all over the world. Every so often the museum gives us a close look at one of the cars it houses in the Vault, a space in the museum presented by Hagerty that holds over 250 iconic and rare cars. In a recent video from...","2021-11-07 11:00:00","Cars","https://www.motorauthority.com/news/1134086_1954-explorer-dream-car-is-world-s-rarest-plymouth?utm_source=feedburner&utm_medium=feed&utm_campaign=Feed%3A+Motorauthority2+%28Motorauthority+Master+Feed%29","4375c6e7686712603f8231852cbdecc1427f28d4215a09cf75d885027fae45f6","316f4008bf37092b93dd71990bb20843"
"Aston Martin Valkyrie, Ford Bronco DR, Volkswagen ID.5: This Week's Top Photos","The Car Connection","Ford unveiled a V-8 powered Bronco this week, but you won't be able to drive it on the street. That's because it's a customer race car designed for desert racing, and to prove its capability Ford will enter one in the Heavy Metal class of the 2022 Baja 1000. Aston Martin announced this week that it has completed the first customer example of its...","2021-11-06 12:00:00","Cars","https://www.motorauthority.com/news/1134091_aston-martin-valkyrie-ford-bronco-dr-volkswagen-id-5-this-week-s-top-photos?utm_source=feedburner&utm_medium=feed&utm_campaign=Feed%3A+Motorauthority2+%28Motorauthority+Master+Feed%29","4375c6e7686712603f8231852cbdecc1427f28d4215a09cf75d885027fae45f6","26fd38b740d644acd79a25d7a967012e"
"Acura Integra prototype debut set for Nov. 11","The Car Connection","A prototype of of the planned modern Integra will debut on November 11 in Los Angeles, Acura said on Friday. Acura first announced the Integra's return in August during Monterey Car Week, where the automaker also unveiled the 2022 NSX Type S that will be the hybrid supercar's swan song. Acura has released additional teasers over the past few...","2021-11-06 10:00:00","Cars","https://www.motorauthority.com/news/1134089_acura-integra-prototype-debut-set-for-nov-11?utm_source=feedburner&utm_medium=feed&utm_campaign=Feed%3A+Motorauthority2+%28Motorauthority+Master+Feed%29","4375c6e7686712603f8231852cbdecc1427f28d4215a09cf75d885027fae45f6","fc2bff12e0a89fbd82c38ebe4d33f56c"
"2022 Acura MDX Type S to cost high $60,000s, have 355 hp","The Car Connection","Acura on Friday revealed the first details of the 2022 MDX Type S. Pricing for the SUV will start in the high-$60,000 range, with deliveries scheduled to start in December, Acura said in a press release. Instead of the standard MDX's naturally aspirated 3.5-liter V-6, the Type S gets the same turbocharged 3.0-liter V-6 as the TLX Type S sedan...","2021-11-05 19:21:00","Cars","https://www.motorauthority.com/news/1134084_2022-acura-mdx-type-s-to-cost-high-60-000s-have-355-hp?utm_source=feedburner&utm_medium=feed&utm_campaign=Feed%3A+Motorauthority2+%28Motorauthority+Master+Feed%29","4375c6e7686712603f8231852cbdecc1427f28d4215a09cf75d885027fae45f6","345a864c05f4ac48cadaef3874fc7764"
"Verstappen's brilliant start serves up win at 2021 F1 Mexico City Grand Prix","The Car Connection","Red Bull Racing's Max Verstappen extended his lead in the 2021 Formula One World Championship on Sunday with a decisive win at the Mexico City Grand Prix, formerly the Mexican Grand Prix. Starting from the second row, Verstappen made a brilliant move on the outside going into Turn 1 to take over Mercedes-Benz AMG's Valtteri Bottas and Lewis...","2021-11-08 11:00:00","Cars","https://www.motorauthority.com/news/1134095_2021-formula-one-mexico-city-grand-prix-results?utm_source=feedburner&utm_medium=feed&utm_campaign=Feed%3A+Motorauthority2+%28Motorauthority+Master+Feed%29","4375c6e7686712603f8231852cbdecc1427f28d4215a09cf75d885027fae45f6","623845cbd0900d2f7622dd559cdd39ac"
"2024 Porsche 911 Turbo S E-Hybrid spy shots and video: Electrified 911 starts testing","The Car Connection","Porsche has ruled out an electric 911, at least for now, but hybrid technology is definitely on the cards. In fact, it's planned for the current 992 generation. The latest spy shots and video reveal that Porsche is already evaluating early test mules for a 911 hybrid. The car being tested may look like a current 911 Turbo, but the yellow sticker...","2021-11-08 12:00:00","Cars","https://www.motorauthority.com/news/1120250_2024-porsche-911-turbo-s-e-hybrid-spy-shots-video?utm_source=feedburner&utm_medium=feed&utm_campaign=Feed%3A+Motorauthority2+%28Motorauthority+Master+Feed%29","4375c6e7686712603f8231852cbdecc1427f28d4215a09cf75d885027fae45f6","7bb504d3d2cda7b93877ab5394c6e1e6"
"Next BMW 7-Series to feature Level 3 self-driving system","The Car Connection","BMW is currently developing a redesign for its 7-Series. The new flagship sedan is due in the second half of 2022, meaning we'll likely see it arrive as a 2023 model. BMW has been quiet on its plans for the car apart from it having a battery-electric variant, which the automaker will likely christen the i7. However, new BMW R&D chief Frank...","2021-11-08 13:00:00","Cars","https://www.motorauthority.com/news/1134097_next-bmw-7-series-to-feature-level-3-self-driving-system?utm_source=feedburner&utm_medium=feed&utm_campaign=Feed%3A+Motorauthority2+%28Motorauthority+Master+Feed%29","4375c6e7686712603f8231852cbdecc1427f28d4215a09cf75d885027fae45f6","acfd05155a56822d87ab66615da5f2f6"
"Kia EV9: Concept for big, boxy electric SUV to debut Nov. 11","The Car Connection","Kia is just days out from revealing the Concept EV9. No details have been released, but a teaser image posted to the automaker's social media outlets on Sunday confirm a November 11 reveal and suggest we're looking at a big, boxy SUV not unlike the current Telluride. The “EV9” in the name also points to the concept being an electric...","2021-11-08 13:45:00","Cars","https://www.motorauthority.com/news/1134098_kia-ev9-concept-for-big-boxy-electric-suv-to-debut-nov-11?utm_source=feedburner&utm_medium=feed&utm_campaign=Feed%3A+Motorauthority2+%28Motorauthority+Master+Feed%29","4375c6e7686712603f8231852cbdecc1427f28d4215a09cf75d885027fae45f6","842694c151d5f671b4a470423c3a4f0a"
"More than one third of Cadillac dealerships bail on brand's electric future","The Car Connection","General Motors is betting big on battery-electric vehicles, and its Cadillac brand has been tasked with spearheading their rollout. The automaker has already revealed the 2023 Cadillac Lyriq mid-size crossover due in early 2022 and confirmed four additional EVs for the luxury brand, including a flagship sedan dubbed the Celestiq. Cadillac could...","2021-11-08 15:00:00","Cars","https://www.motorauthority.com/news/1130408_more-than-one-third-of-cadillac-dealerships-bail-on-brand-s-electric-future?utm_source=feedburner&utm_medium=feed&utm_campaign=Feed%3A+Motorauthority2+%28Motorauthority+Master+Feed%29","4375c6e7686712603f8231852cbdecc1427f28d4215a09cf75d885027fae45f6","944c1398b2cf9b2ccf492c0702bd3d11"
"Porsche 911 hybrid, self-driving BMW 7-Series, Kia EV9: Today's Car News","The Car Connection","The Porsche 911 is about to undergo its biggest change since the introduction of water-cooled engines. A hybrid 911 is currently out testing and is expected to arrive in the next couple of years, likely in 911 Turbo guise. A new spy video suggests a lot of work still needs to be done. The redesigned BMW 7-Series due in 2022 is set to offer a Level...","2021-11-08 16:00:00","Cars","https://www.motorauthority.com/news/1134099_porsche-911-hybrid-self-driving-bmw-7-series-kia-ev9-today-s-car-news?utm_source=feedburner&utm_medium=feed&utm_campaign=Feed%3A+Motorauthority2+%28Motorauthority+Master+Feed%29","4375c6e7686712603f8231852cbdecc1427f28d4215a09cf75d885027fae45f6","99387220cd84693d623c5e65d1816e42"
"Dodge revives performance parts program, announces specialist dealerships","The Car Connection","Dodge is making moves to cement itself as the place for performance in the Stellantis fold, both today and as the automaker adopts electrification in the years ahead. The latest salvo was the announcement on Monday of Never Lift, a two-year plan that will see Dodge make at least one major product announcement or other enthusiast-related news item...","2021-11-08 18:00:00","Cars","https://www.motorauthority.com/news/1134102_dodge-revives-performance-parts-program-announces-specialist-dealerships?utm_source=feedburner&utm_medium=feed&utm_campaign=Feed%3A+Motorauthority2+%28Motorauthority+Master+Feed%29","4375c6e7686712603f8231852cbdecc1427f28d4215a09cf75d885027fae45f6","eaf0b44223139bb0f0b8baa2e17d6964"
"Paolo Barilla commissions 2022 Porsche 911 GT3 to honor Le Mans-winning 956","The Car Connection","Porsche recently completed a custom 2022 911 GT3 for pasta heir and racing driver Paolo Barilla inspired by the 956 he drove to victory at the 1985 24 Hours of Le Mans. Barilla commissioned the GT3 for his 60th birthday, Porsche said in a press release. The project was part of Porsche's new Sonderwunsch (German for special request) customization...","2021-11-08 16:45:00","Cars","https://www.motorauthority.com/news/1134100_paolo-barilla-commissions-2022-porsche-911-gt3-to-honor-le-mans-winning-956?utm_source=feedburner&utm_medium=feed&utm_campaign=Feed%3A+Motorauthority2+%28Motorauthority+Master+Feed%29","4375c6e7686712603f8231852cbdecc1427f28d4215a09cf75d885027fae45f6","87f4953c4f54de4353a37bfc1dff71fb"
