"Preview: 2022 VW Jetta GLI gets tweaked looks, more safety features for $31,990","The Car Connection","Volkswagen on Monday unveiled an updated Jetta . The updates are due for the 2022 model year and extend to our favorite variant, the Jetta GLI. The updates bring revised fascias including a more aggressive design for the range-topping GLI, along with new colors and wheel patterns, but the big news is the addition of new driver-assist features as...","2021-11-01 19:13:00","Cars","https://www.motorauthority.com/news/1133325_2022-volkswagen-jetta-gli-price-specs-review-photos-info?utm_source=feedburner&utm_medium=feed&utm_campaign=Feed%3A+Motorauthority2+%28Motorauthority+Master+Feed%29","4375c6e7686712603f8231852cbdecc1427f28d4215a09cf75d885027fae45f6","e665085213736313ecd9e4848bd8ee9b"
"Chevrolet Beast desert runner concept headlines SEMA lineup with Camaro ZL1 power","The Car Connection","Chevrolet's not messing around with its SEMA lineup this year. It created a beast. On Monday, Chevrolet announced its truck and SUV lineup that will be on display at the SEMA show in Las Vegas, and the headliner is a custom-built concept dubbed The Chevy Beast. Created with the goal of dominating in the desert while remaining grounded in reality...","2021-11-01 19:02:00","Cars","https://www.motorauthority.com/news/1134038_chevrolet-beast-desert-runner-concept-headlines-sema-lineup-with-camaro-zl1-power?utm_source=feedburner&utm_medium=feed&utm_campaign=Feed%3A+Motorauthority2+%28Motorauthority+Master+Feed%29","4375c6e7686712603f8231852cbdecc1427f28d4215a09cf75d885027fae45f6","b2a70ba42fa82a1c4d762e5b4dc1516d"
"Mopar '22 Dodge Durango limited edition debuts at SEMA","The Car Connection","Stellantis on Monday unveiled its latest Mopar limited-edition model. The Mopar '22 Dodge Durango makes its public debut at the 2021 SEMA show this week, and will be available to order in the first quarter of 2022. The Mopar '22 Dodge Durango is the 12th Mopar-edition model, and it arrives in time for the parts division's 85th anniversary. The...","2021-11-01 18:05:00","Cars","https://www.motorauthority.com/news/1134036_mopar-22-dodge-durango-limited-edition-debuts-at-sema?utm_source=feedburner&utm_medium=feed&utm_campaign=Feed%3A+Motorauthority2+%28Motorauthority+Master+Feed%29","4375c6e7686712603f8231852cbdecc1427f28d4215a09cf75d885027fae45f6","7b5c19cac5b931bfcc7eb0b031a8912c"
"Ferrari sued Mansory, and won, for copying the LeFerrari FXX K's design","The Car Connection","Ferrari on Thursday won a legal dispute with German tuner Mansory Design after a European court agreed that Mansory illegally copied the design of the Ferrari FXX K track car for one of its tuned vehicles, Reuters reported. The case centered around the Mansory 4XX Siracusa, a Ferrari 488 GTB with a body kit that, Ferrari argued, was too close to...","2021-11-01 17:00:00","Cars","https://www.motorauthority.com/news/1134033_ferrari-sued-mansory-and-won-for-copying-the-leferrari-fxx-k-s-design?utm_source=feedburner&utm_medium=feed&utm_campaign=Feed%3A+Motorauthority2+%28Motorauthority+Master+Feed%29","4375c6e7686712603f8231852cbdecc1427f28d4215a09cf75d885027fae45f6","712bdb95773aea43eee851ffc6399ede"
"Preview: 2022 Lexus LC benefits from suspension tuning, greater customization","The Car Connection","Lexus is continuing its practice of further refining the LC with each successive model year. After a substantial round of updates for 2021, which included the addition of a convertible body style, Lexus has kept the updates for 2022 somewhat subdued. The key change for the new model year is sharped suspension for the V-8-powered LC 500 grade aimed...","2021-11-01 15:45:00","Cars","https://www.motorauthority.com/news/1134032_2022-lexus-lc-price-specs-review-photos-info?utm_source=feedburner&utm_medium=feed&utm_campaign=Feed%3A+Motorauthority2+%28Motorauthority+Master+Feed%29","4375c6e7686712603f8231852cbdecc1427f28d4215a09cf75d885027fae45f6","3a8818d5f2ea435f5a437da4314b6f28"
"2023 Ford Ranger, 2023 Subaru Solterra, Audi A8 L Horch: Car News Headlines","The Car Connection","Ford has two new pickup trucks on its hands. One is the compact Maverick that's just gone on sale. The other is a redesign of the mid-size Ranger, which is just around the corner. This time around the Ranger will come in high-performance Ranger Raptor guise here in the U.S., and a hybrid option is also likely. Buyers keen on battery-electric power...","2021-11-01 15:00:00","Cars","https://www.motorauthority.com/news/1132458_2023-ford-ranger-2023-subaru-solterra-audi-a8-l-horch-car-news-headlines?utm_source=feedburner&utm_medium=feed&utm_campaign=Feed%3A+Motorauthority2+%28Motorauthority+Master+Feed%29","4375c6e7686712603f8231852cbdecc1427f28d4215a09cf75d885027fae45f6","995b0c80793fb66d84c5bcf0e36698b0"
"Hyundai Motor Group partners with America's Factorial on solid-state batteries","The Car Connection","Solid-state batteries promise to improve range, charging and safety aspects of electric vehicles compared to liquid-type batteries in use today, which is why most major automakers are working on the technology, both independently and in partnerships. The latest to announce its involvement in the space is Hyundai Motor Group which last week said it...","2021-11-01 14:00:00","Cars","https://www.motorauthority.com/news/1134031_hyundai-motor-group-partners-with-america-s-factorial-on-solid-state-batteries?utm_source=feedburner&utm_medium=feed&utm_campaign=Feed%3A+Motorauthority2+%28Motorauthority+Master+Feed%29","4375c6e7686712603f8231852cbdecc1427f28d4215a09cf75d885027fae45f6","bd796f4c6ca3201997ce061b8c4d90a4"
"2023 Ford Ranger teased ahead of Nov. 24 debut","The Car Connection","Ford is nearing the end of development of a next-generation Ranger pickup truck and on Monday confirmed the reveal date as November 24. That's the date of the reveal in Australia, where most of the development has taken place. Due to timezone differences, we may see the reveal take place a day earlier in the U.S. The version being revealed is the...","2021-11-01 12:45:00","Cars","https://www.motorauthority.com/news/1130933_2023-ford-ranger-teased-ahead-of-nov-24-debut?utm_source=feedburner&utm_medium=feed&utm_campaign=Feed%3A+Motorauthority2+%28Motorauthority+Master+Feed%29","4375c6e7686712603f8231852cbdecc1427f28d4215a09cf75d885027fae45f6","644b40c93234d4e8a57f15c2f5b0fd66"
"Redesigned Mercedes-Benz AMG GT sharing platform with 2022 SL still coming","The Car Connection","Even though Mercedes-Benz AMG has just replaced its GT Roadster with a redesigned 2022 SL, the coupe version of the GT sports car will stick around and soon be redesigned itself. The information was confirmed by Mercedes-Benz design chief Gorden Wagener in an interview with Road & Track following last week's reveal of the 2022 SL, a car that...","2021-11-01 12:00:00","Cars","https://www.motorauthority.com/news/1134030_redesigned-mercedes-benz-amg-gt-sharing-platform-with-2022-sl-still-coming?utm_source=feedburner&utm_medium=feed&utm_campaign=Feed%3A+Motorauthority2+%28Motorauthority+Master+Feed%29","4375c6e7686712603f8231852cbdecc1427f28d4215a09cf75d885027fae45f6","888799c17eb5415a374340aa94ad4d94"
"2023 Subaru Solterra debuts Nov. 10, shares design with Toyota BZ4X","The Car Connection","Just as the jointly developed Subaru BRZ and Toyota GR86 feature common styling inside and out, Subaru's upcoming Solterra battery-electric crossover will match the Toyota model developed alongside it, the BZ4X. The BZ4X was first shown as a concept in April and finally revealed in production guise last week. The Solterra is confirmed for its own...","2021-11-01 11:00:00","Cars","https://www.motorauthority.com/news/1132214_2023-subaru-solterra-price-specs-review-photos-info?utm_source=feedburner&utm_medium=feed&utm_campaign=Feed%3A+Motorauthority2+%28Motorauthority+Master+Feed%29","4375c6e7686712603f8231852cbdecc1427f28d4215a09cf75d885027fae45f6","32ccb259aa1fe9689f0439bb53f02e42"
"Updated Audi A8 revealed in Horch ultra-luxury grade","The Car Connection","Audi will use the 2021 Auto Guangzhou in late November for a revival of historic German marque Horch as an ultra-luxury sub-brand to challenge Mercedes-Benz Maybach. The Horch name will be attached to a range-topping version of an updated A8. While we won't see the Horch grade in the U.S., the rest of the updated A8 range will arrive here in 2022...","2021-11-01 10:00:00","Cars","https://www.motorauthority.com/news/1103805_updated-audi-a8-revealed-in-horch-ultra-luxury-grade?utm_source=feedburner&utm_medium=feed&utm_campaign=Feed%3A+Motorauthority2+%28Motorauthority+Master+Feed%29","4375c6e7686712603f8231852cbdecc1427f28d4215a09cf75d885027fae45f6","4d8f5cf7ed708f00f31798380860da3f"
"Deep dive: 2023 Chevy Corvette Z06 V-8 features most powerful naturally aspirated production V-8 ever","The Car Connection","The 2023 Chevrolet Corvette Z06 debuted earlier this week with some impressive features, including the most powerful naturally aspirated production V-8 ever. Engineering Explained host Jason Fenske provides a deep dive into this 5.5-liter V-8, and compares it to the old Z06's supercharged engine. Code-named LT6, the C8 Z06 engine produces 670 hp...","2021-10-31 12:00:00","Cars","https://www.motorauthority.com/news/1134004_deep-dive-2023-chevy-corvette-z06-v-8-features-most-powerful-naturally-aspirated-production-v-8-ever?utm_source=feedburner&utm_medium=feed&utm_campaign=Feed%3A+Motorauthority2+%28Motorauthority+Master+Feed%29","4375c6e7686712603f8231852cbdecc1427f28d4215a09cf75d885027fae45f6","eba1110578311a4e19ee453044369193"
"Antarctic trek in prepped Porsche 356 set to begin in early December","The Car Connection","The starting date has been set for extreme racer Renee Brinkerhoff’s 356-mile trek across Antarctic ice driving the 1956 Porsche 356 in which she and her Valkyrie Racing team have challenged every other continent on Earth in grueling cross-country racing and rally events. Dubbed the Project 356 World Rally Ice Challenge, the trek across the...","2021-10-31 10:00:00","Cars","https://www.motorauthority.com/news/1134022_antarctic-trek-in-prepped-porsche-356-set-to-begin-in-early-december?utm_source=feedburner&utm_medium=feed&utm_campaign=Feed%3A+Motorauthority2+%28Motorauthority+Master+Feed%29","4375c6e7686712603f8231852cbdecc1427f28d4215a09cf75d885027fae45f6","bcb05dc298d6f3aba77857379a56ece2"
"2022 Land Rover Range Rover, 2022 Mercedes-Benz AMG SL, 1971 Datsun 240Z: This Week's Top Photos","The Car Connection","Land Rover revealed a redesigned Range Rover this week, with the new fifth-generation model to arrive at dealerships next spring as a 2022 model. While the exterior styling hasn't changed all that much, underneath is a new platform that supports battery-electric powertrains and perhaps eventually hydrogen-electric powertrains. Chevrolet's new...","2021-10-30 15:30:00","Cars","https://www.motorauthority.com/news/1130092_2022-land-rover-range-rover-2022-mercedes-benz-amg-sl-1971-datsun-240z-this-week-s-top-photos?utm_source=feedburner&utm_medium=feed&utm_campaign=Feed%3A+Motorauthority2+%28Motorauthority+Master+Feed%29","4375c6e7686712603f8231852cbdecc1427f28d4215a09cf75d885027fae45f6","59372dbe56c846ee350214033d343067"
"Ford's 2021 SEMA fleet shows off Maverick and Mustang Mach-E","The Car Connection","Like many automakers, Ford brings a fleet of concept vehicles to the annual SEMA show to advertise their aftermarket potential. Scheduled for November 2-5, the 2021 SEMA show is no different. A Ford press release said more than 40 modified vehicles will be on display, but this year the emphasis seems to be on the newly launched 2022 Maverick...","2021-10-30 10:00:00","Cars","https://www.motorauthority.com/news/1134021_ford-s-2021-sema-fleet-shows-off-maverick-and-mustang-mach-e?utm_source=feedburner&utm_medium=feed&utm_campaign=Feed%3A+Motorauthority2+%28Motorauthority+Master+Feed%29","4375c6e7686712603f8231852cbdecc1427f28d4215a09cf75d885027fae45f6","1ba429856c7b7e3f2f29ac34cb73159a"
"Preview: Updated Audi A8 arrives with new styling, Horch range-topper","The Car Connection","Audi on Tuesday unveiled an updated version of its A8. The current A8 is the fourth generation of the flagship sedan and its latest updates constitute a mid-cycle refresh. The current A8 has been on sale since the 2019 model year and we should see this updated version arrive in 2022 as a 2022 or 2023 model. The changes are subtle, which is normal...","2021-11-02 10:00:00","Cars","https://www.motorauthority.com/news/1134041_audi-a8-price-specs-review-photos-info?utm_source=feedburner&utm_medium=feed&utm_campaign=Feed%3A+Motorauthority2+%28Motorauthority+Master+Feed%29","4375c6e7686712603f8231852cbdecc1427f28d4215a09cf75d885027fae45f6","b15a7fb7cadc15cdb2f2d9893168b594"
"2023 Ford Bronco DR is your V-8-powered, mid-$200,000 desert racer","The Car Connection","Ford has finally delivered on a factory-built modern Bronco with V-8 power, only it isn't street-legal and you'll need to front up a mid-$200,000 figure to own one. It's known as the Bronco Desert Racer, or Bronco DR for short, and Ford is developing it as a turnkey racer to take on the Baja 1000. In fact, a prototype version will start competing...","2021-11-02 11:45:00","Cars","https://www.motorauthority.com/news/1134043_2023-ford-bronco-dr-price-specs-review-photos-info?utm_source=feedburner&utm_medium=feed&utm_campaign=Feed%3A+Motorauthority2+%28Motorauthority+Master+Feed%29","4375c6e7686712603f8231852cbdecc1427f28d4215a09cf75d885027fae45f6","08ca1471421dc8da5bd958d181134373"
"New company Bugatti Rimac starts operations","The Car Connection","The new company Bugatti Rimac was officially launched on Tuesday, only four months after it was first announced. Bugatti Rimac is a joint venture between Porsche and Rimac Group to oversee the running of the Bugatti and Rimac car brands. Porsche, a member of the Volkswagen Group, which previously oversaw the running of Bugatti, owns 45% of the new...","2021-11-02 11:00:00","Cars","https://www.motorauthority.com/news/1134042_new-company-bugatti-rimac-starts-operations?utm_source=feedburner&utm_medium=feed&utm_campaign=Feed%3A+Motorauthority2+%28Motorauthority+Master+Feed%29","4375c6e7686712603f8231852cbdecc1427f28d4215a09cf75d885027fae45f6","7833adcba481a6883fb9362f8d4c3908"
"Rivian IPO could value company at almost $55B","The Car Connection","Rivian's first product, the 2022 R1T full-size pickup, is now in production and initial impressions, including from us, are positive. That should bode well for the company's efforts to raise additional funds by launching an initial public offering, the prospectus for which was filed in October and amended on Monday. The IPO is expected to be...","2021-11-02 12:45:00","Cars","https://www.motorauthority.com/news/1133395_rivian-ipo-could-value-company-at-almost-55b?utm_source=feedburner&utm_medium=feed&utm_campaign=Feed%3A+Motorauthority2+%28Motorauthority+Master+Feed%29","4375c6e7686712603f8231852cbdecc1427f28d4215a09cf75d885027fae45f6","ce730bfea438c1e09ecb751c4cc632d7"
"Tesla opens charging stations to other brands for first time","The Car Connection","Tesla has opened 10 of its Supercharger charging stations in the Netherlands to electric vehicles from other brands as part of a pilot program, the automaker said on Monday. It follows a tweet in July from CEO Elon Musk that Tesla would start making its stations open to owners of vehicles from other brands later this year. Tesla will use the pilot...","2021-11-02 14:00:00","Cars","https://www.motorauthority.com/news/1111158_tesla-opens-charging-stations-to-other-brands-for-first-time?utm_source=feedburner&utm_medium=feed&utm_campaign=Feed%3A+Motorauthority2+%28Motorauthority+Master+Feed%29","4375c6e7686712603f8231852cbdecc1427f28d4215a09cf75d885027fae45f6","daf202e80c584b25407a191156a93dcc"
"Toyota AE86 parts headed back into production","The Car Connection","Toyota is making reproduction parts for many of its classic models, and on Monday the automaker announced that it will add AE86 parts to the catalog. Discontinued parts for the AE86 are going back into production under the GR Heritage Parts Project, which is already reproducing parts for the A70 and A80 Supra, 40 Series Land Cruiser, and the...","2021-11-02 15:45:00","Cars","https://www.motorauthority.com/news/1134044_toyota-ae86-parts-headed-back-into-production?utm_source=feedburner&utm_medium=feed&utm_campaign=Feed%3A+Motorauthority2+%28Motorauthority+Master+Feed%29","4375c6e7686712603f8231852cbdecc1427f28d4215a09cf75d885027fae45f6","dc8a441aacb14868fba601074ed7db78"
"2023 Ford Bronco DR, updated Audi A8, Rivian IPO: Today's Car News","The Car Connection","Ford has unveiled a V-8 powered Bronco but you won't be able to drive it on the street. It's a customer race car designed for desert racing. To prove its capability, Ford will enter a prototype in the Heavy Metal class of the 2022 Baja 1000. Audi has updated the A8 and among the changes is a new Horch-branded range-topper for the Chinese market...","2021-11-02 15:00:00","Cars","https://www.motorauthority.com/news/1134045_2023-ford-bronco-dr-updated-audi-a8-rivian-ipo-today-s-car-news?utm_source=feedburner&utm_medium=feed&utm_campaign=Feed%3A+Motorauthority2+%28Motorauthority+Master+Feed%29","4375c6e7686712603f8231852cbdecc1427f28d4215a09cf75d885027fae45f6","bcf93d77c9b6f1c00e6648b9e8755ccf"
"Ford snags trio of 2021 SEMA show awards","The Car Connection","The SEMA show, the annual gathering of the aftermarket industry and one of the biggest events for tuning firms on the automotive calendar, is currently underway in Las Vegas, Nevada. And as in previous years, the organizers held the SEMA Awards, the winners of which were announced on Monday and are as follows: Car of the Year - Ford Mustang Sport...","2021-11-02 17:00:00","Cars","https://www.motorauthority.com/news/1134046_ford-snags-trio-of-2021-sema-show-awards?utm_source=feedburner&utm_medium=feed&utm_campaign=Feed%3A+Motorauthority2+%28Motorauthority+Master+Feed%29","4375c6e7686712603f8231852cbdecc1427f28d4215a09cf75d885027fae45f6","420093d93fac9c1dbc639413e4505f3b"
"Viper V-10-powered 2005 Jeep Wrangler Unlimited for sale","The Car Connection","Before the Hellcat was spawned, the Dodge Viper's 8.3-liter V-10 was the top Mopar motor. Someone decided to swap one of those engines into a 2005 Jeep Wrangler Unlimited, and the result is now up for auction via Hemmings. Note that this is the original Wrangler Unlimited. So instead of four doors, like the current version, it has two doors and a...","2021-11-02 18:00:00","Cars","https://www.motorauthority.com/news/1134048_viper-v-10-powered-2005-jeep-wrangler-unlimited-for-sale?utm_source=feedburner&utm_medium=feed&utm_campaign=Feed%3A+Motorauthority2+%28Motorauthority+Master+Feed%29","4375c6e7686712603f8231852cbdecc1427f28d4215a09cf75d885027fae45f6","569eb33511fc86770485f9084ee5503d"
"First look at redesigned Mini Hardtop due in 2023","The Car Connection","Mini is preparing the fourth generation of its modern lineup, and the automaker on Tuesday provided an early look at the new design for its signature Hardtop two-door hatchback. The vehicle is set for launch in 2023, meaning we'll likely see it arrive as a 2024 model, and once again there will be both gas and electric options. In fact, the...","2021-11-03 10:00:00","Cars","https://www.motorauthority.com/news/1134052_first-look-at-redesigned-mini-hardtop-due-in-2023?utm_source=feedburner&utm_medium=feed&utm_campaign=Feed%3A+Motorauthority2+%28Motorauthority+Master+Feed%29","4375c6e7686712603f8231852cbdecc1427f28d4215a09cf75d885027fae45f6","deb4d90f1234e255fba9d8ecb3e433a0"
"2023 BMW 3-Series Touring spy shots: Updated wagon spied","The Car Connection","BMW plans to update its 3-Series soon, and our latest spy shots show a prototype for the Touring wagon body style that's offered overseas. The current 3-Series, the nameplate's seventh generation, arrived in 2018 as a 2019 model. The updated version, which represents a mid-cycle refresh, should arrive in 2022 as a 2023 model. Sadly, we don't...","2021-11-03 11:00:00","Cars","https://www.motorauthority.com/news/1134051_2023-bmw-3-series-touring-spy-shots?utm_source=feedburner&utm_medium=feed&utm_campaign=Feed%3A+Motorauthority2+%28Motorauthority+Master+Feed%29","4375c6e7686712603f8231852cbdecc1427f28d4215a09cf75d885027fae45f6","f69b43c2effa4e83b7652e5f72914683"
"1978 Ford F-100 with Eluminator electric crate motor shows the future of restomodding","The Car Connection","Ford on Tuesday unveiled its Eluminator electric crate motor at the SEMA show currently underway in Las Vegas, Nevada. But rather than just show off the crate motor on a stand, the automaker installed two of them in a custom 1978 F-100 pickup truck. Chevrolet did the same thing back in 2019 with a custom 1962 C-10 and then again in 2020 with a...","2021-11-03 12:45:00","Cars","https://www.motorauthority.com/news/1134053_1978-ford-f-100-with-eluminator-electric-crate-motor-shows-the-future-of-restomodding?utm_source=feedburner&utm_medium=feed&utm_campaign=Feed%3A+Motorauthority2+%28Motorauthority+Master+Feed%29","4375c6e7686712603f8231852cbdecc1427f28d4215a09cf75d885027fae45f6","d924ec562b904f5874e5d882ac0c5f92"
"Review update: 2021 Ford Bronco Wildtrak delivers on Ford’s promise","The Car Connection","Activate the Wayback Machine and set it to January 2017. That’s when Ford confirmed the Bronco (and Ranger pickup) were coming back. The Blue Oval promised the Bronco would be a true four-wheel-drive vehicle with an off-road focus capable of tackling the Rubicon trail. Ford has delivered on that promise with the 2021 Bronco. With bona fide...","2021-11-03 12:00:00","Cars","https://www.motorauthority.com/news/1134027_review-update-2021-ford-bronco-wildtrak-delivers-on-ford-s-promise?utm_source=feedburner&utm_medium=feed&utm_campaign=Feed%3A+Motorauthority2+%28Motorauthority+Master+Feed%29","4375c6e7686712603f8231852cbdecc1427f28d4215a09cf75d885027fae45f6","5597eeec679583f29908be6da539ed8d"
"Preview: Volkswagen ID.5 spices up the ID.4 with coupe-like profile","The Car Connection","Volkswagen on Wednesday unveiled the ID.5, a battery-electric coupe-like crossover related to the ID.4 compact crossover. The ID.5 starts sales in Europe in 2022 but is not yet confirmed for the U.S. There's a good chance we see it here as the ID.4 is already on sale locally and will soon start production here as well. We're also due to receive...","2021-11-03 14:00:00","Cars","https://www.motorauthority.com/news/1134055_volkswagen-id-5-price-specs-review-photos-info?utm_source=feedburner&utm_medium=feed&utm_campaign=Feed%3A+Motorauthority2+%28Motorauthority+Master+Feed%29","4375c6e7686712603f8231852cbdecc1427f28d4215a09cf75d885027fae45f6","54abed81f459400737ff339eddc23e85"
"Next-gen Mini, electric Ford F-100, VW ID.5: Car News Headlines","The Car Connection","Mini has released the first photos of its next-generation Hardtop. It's coming in 2023 and will be the last to feature internal-combustion power. That's because Mini has confirmed that it will only launch electric vehicles after 2025. Ford is now offering an electric motor from the Mustang Mach-E GT in crate form. It delivers 281 hp and 317 lb-ft...","2021-11-03 15:00:00","Cars","https://www.motorauthority.com/news/1134057_next-gen-mini-electric-ford-f-100-vw-id-5-car-news-headlines?utm_source=feedburner&utm_medium=feed&utm_campaign=Feed%3A+Motorauthority2+%28Motorauthority+Master+Feed%29","4375c6e7686712603f8231852cbdecc1427f28d4215a09cf75d885027fae45f6","7130d599a56c1340ecd59a831a15a836"
"Preview: 2022 Jeep Grand Cherokee 2-row costs $39,185, 4xe plug-in hybrid and V-8 on options list","The Car Connection","Jeep kicked off the arrival of its redesigned Grand Cherokee earlier this year by launching a new three-row variant dubbed the Grand Cherokee L. It's already at dealerships and is priced to start at $38,690, including destination. The regular two-row version of the redesigned Grand Cherokee was revealed on Wednesday, and is due to reach...","2021-11-03 14:23:00","Cars","https://www.motorauthority.com/news/1132495_2022-jeep-grand-cherokee-price-specs-review-photos-info?utm_source=feedburner&utm_medium=feed&utm_campaign=Feed%3A+Motorauthority2+%28Motorauthority+Master+Feed%29","4375c6e7686712603f8231852cbdecc1427f28d4215a09cf75d885027fae45f6","1ba7c7e84a83aa1518429d0d0cafbcc8"
"Toyota Tacoma Tacozilla takes SEMA lineup back in time","The Car Connection","The SEMA show is back, and Toyota's lineup of concepts is heavy on off-roading and overhanding-themed builds this year. The automaker is bringing four new concepts to the 2021 SEMA show, headlined by a Tacoma-based camper build. Dubbed Tacozilla, the overlanding rig pays tribute to pay campers of the 1970s and 1980s with its retro graphics. Atop...","2021-11-03 15:45:00","Cars","https://www.motorauthority.com/news/1134056_toyota-tacoma-tacozilla-takes-sema-lineup-back-in-time?utm_source=feedburner&utm_medium=feed&utm_campaign=Feed%3A+Motorauthority2+%28Motorauthority+Master+Feed%29","4375c6e7686712603f8231852cbdecc1427f28d4215a09cf75d885027fae45f6","4ccf6c83cc6dd0bdef192cb567f404c2"
"2023 Audi Q9 spy shots and video: Full-size SUV in the works?","The Car Connection","Most of the major luxury brands now offer full-size SUVs but the option is still missing at Audi, though that situation may change in the near future. Audi engineers are testing a prototype for a full-size SUV. Although in many circles it is being referred to as a Q9, the vehicle may end up being called a Q7 L, or perhaps Q8 L. We still can't rule...","2021-11-03 18:00:00","Cars","https://www.motorauthority.com/news/1110956_2023-audi-q9-spy-shots-video?utm_source=feedburner&utm_medium=feed&utm_campaign=Feed%3A+Motorauthority2+%28Motorauthority+Master+Feed%29","4375c6e7686712603f8231852cbdecc1427f28d4215a09cf75d885027fae45f6","a44a1ad4b338f97b0a27b6a995e37cbe"
