"Odell Beckham Jr. Signs With Rams After Browns Cut","TMZ","The deal is done -- OBJ to L.A. has been finalized, the team just announced. A deal is not yet official, but LeBron James is already welcoming Odell to L.A. -- writing on social media Thursday, Welcome to LA my brother @obj! It's GO TIME!! Odell…","2021-11-11 21:01:27","Entertainment","https://www.tmz.com/2021/11/11/odell-beckham-los-angeles-rams-contract-signing-browns-giants/","6240c290bff374a27027518cd58a4147772c1aec20b754ef99637a2916f129e9","73cbf3e8f645a54ee165d16a1e548d99"
"9th Person Dies from Injuries Suffered at Travis Scott's Astroworld Festival","TMZ","22-year-old Bharti Shahani has died ... making her the 9th casualty from Travis Scott's Astroworld Festival. Shahani, who was a senior at Texas A&M University passed away Thursday after injuries sustained at the event Friday night in Houston…","2021-11-11 19:50:48","Entertainment","https://www.tmz.com/2021/11/11/9th-person-dies-after-suffering-injuries-at-astroworld-festival/","6240c290bff374a27027518cd58a4147772c1aec20b754ef99637a2916f129e9","36ff03039a7c7bc708449645f9b9f466"
"$600 Million Yacht Will Feature 39 Luxury Condos","TMZ","This 728-foot superyacht is going to be a floating paradise for those rich enough to snag one of the rooms luxury condos on board -- and this first look at life on the Somnio is incredible!!! Ya gotta check out the gallery to see what folks are…","2021-11-11 18:11:49","Entertainment","https://www.tmz.com/2021/11/11/600-million-dollar-yacht-liner-somnio-condo-renderings/","6240c290bff374a27027518cd58a4147772c1aec20b754ef99637a2916f129e9","1be072ffe7014ca604adedaf6552b3f7"
"Olympics Star Suni Lee Says She Was Pepper Sprayed In Anti-Asian Attack","TMZ","Olympic gold medalist Suni Lee says she was a recent target of anti-Asian hate ... claiming she was pepper-sprayed and had racist slurs hurled at her. 18-year-old Lee detailed the altercation in an interview with Pop Sugar released this week ...…","2021-11-11 17:54:47","Entertainment","https://www.tmz.com/2021/11/11/olympics-star-suni-lee-pepper-sprayed-anti-asian-attack/","6240c290bff374a27027518cd58a4147772c1aec20b754ef99637a2916f129e9","53c2edd8f8f6c62b34d3d91db07937f8"
"Winter the Dolphin from 'Dolphin Tale' Dead at 16 After Infection","TMZ","The aquarium says Winter passed away around 8 PM as a veterinarians was prepping her for what they hoped would be a lifesaving surgery. Clearwater Marine Aquarium said a team of 15 vets and technicians were going to attempt to treat the…","2021-11-11 14:38:09","Entertainment","https://www.tmz.com/2021/11/11/winter-the-dolphin-tale-critical-condition-infection/","6240c290bff374a27027518cd58a4147772c1aec20b754ef99637a2916f129e9","b5d9402c2738a9c6ec23a35df97fd1dd"
"Paris Hilton Marries Carter Reum in Celeb-Studded Private Ceremony","TMZ","Paris Hilton is a married woman -- walking down the aisle and saying her I Do's -- with Carter Reum in a celeb studded ceremony ... with plenty more wedding celebrations to come! Hilton and Reum tied the knot Thursday night at Paris' late…","2021-11-12 12:47:19","Entertainment","https://www.tmz.com/2021/11/12/paris-hilton-marries-carter-reum-bel-air-wedding-ceremony/","6240c290bff374a27027518cd58a4147772c1aec20b754ef99637a2916f129e9","f986ce62be06bad6c8e083f10221d7c0"
"Britney Spears Wears #FreeBritney Shirt Ahead of Conservatorship Hearing","TMZ","Britney Spears is not playing her cards close to the vest ... in fact, she's wearing them on her t-shirt -- she wants out of her conservatorship, and it could happen today. Britney and her fiance, Sam Asghari, mugs for the cam with the words,…","2021-11-12 13:19:26","Entertainment","https://www.tmz.com/2021/11/12/britney-spears-wears-freebritney-shirt-end-conservatorship-hearing/","6240c290bff374a27027518cd58a4147772c1aec20b754ef99637a2916f129e9","1cd8cb16f37f584dc6526602cf708ff9"
"Travis Scott Lawyer, Rapper Didn't Know Scope of Astroworld Tragedy Till Next Day","TMZ","Travis Scott and his team were oblivious to the mass casualties in the crowd at his show while he continued to perform, so says his attorney, who claims emergency workers never relayed the message ... and Travis didn't know the scope of what…","2021-11-12 14:42:10","Entertainment","https://www.tmz.com/2021/11/12/travis-scott-astroworld-tragedy-concert-9-dead-next-morning/","6240c290bff374a27027518cd58a4147772c1aec20b754ef99637a2916f129e9","dcb8b538c1f7c47a844b9149c81d2cd3"
"Raiders Owner Mark Davis Attends Henry Ruggs Car Crash Victim's Funeral","TMZ","Mark Davis was one of about 100 people who attended the funeral services for Tina Tintor on Thursday ... paying respects to the woman who died in a car crash that authorities say his former player, Henry Ruggs, caused. The Las Vegas Raiders owner…","2021-11-12 14:18:43","Entertainment","https://www.tmz.com/2021/11/12/mark-davis-tina-tintor-henry-ruggs-las-vegas-raiders-owner-car-crash/","6240c290bff374a27027518cd58a4147772c1aec20b754ef99637a2916f129e9","6f3a487d65c58d6081507b00c09eee81"
"Shannon Sharpe Says Henry Ruggs' NFL Career 'Probably' Over After Crash","TMZ","Henry Ruggs' NFL career is likely over ... so says Shannon Sharpe, who tells TMZ Sports he believes the former Raiders star's fatal car crash will probably cost him his spot in the league. The Hall of Famer broke it down at LAX earlier this week…","2021-11-12 08:30:42","Entertainment","https://www.tmz.com/2021/11/12/shannon-sharpe-henry-ruggs-car-crash-nfl-career-las-vegas-raiders/","6240c290bff374a27027518cd58a4147772c1aec20b754ef99637a2916f129e9","a9f4e208cf1d9a98a8e254e796ba0c9d"
"Donald Trump Defends Capitol Rioters Who Wanted to Hang Pence","TMZ","Donald Trump seemingly defended the Capitol insurrectionists who were out to hang then Vice President Mike Pence, claiming they were understandably angry. Trump did an interview with ABC's Jonathan Karl, who asked 45 whether he was worried for the…","2021-11-12 15:34:15","Entertainment","https://www.tmz.com/2021/11/12/donald-trump-defends-capitol-rioters-who-wanted-to-hang-pence/","6240c290bff374a27027518cd58a4147772c1aec20b754ef99637a2916f129e9","a554122040c4fc6d014d223f405e302d"
"'Morning Show' Star Nestor Carbonell Says Show Mocks Cancel Culture in Season 2","TMZ","Nestor Carbonell, the weather guy on The Morning Show, says his character is the new poster child for cancel culture -- and how out of control it's gotten -- which was the whole point of season 2. Nestor plays Yanko Flores on the Apple TV+ drama,…","2021-11-12 15:30:14","Entertainment","https://www.tmz.com/2021/11/12/nestor-carbonell-morning-show-cancel-culture/","6240c290bff374a27027518cd58a4147772c1aec20b754ef99637a2916f129e9","0859f2668f00cd781edb25c63224518d"
"Dwayne Johnson Says He Pees In Water Bottles During Workouts, Here's Why","TMZ","Water is squeezed out of The Rock ... and into a water bottle??? Dwayne Johnson says that's exactly what happens during his famous workouts ... revealing in a new interview this week that he does, in fact, piss in bottles at the gym. The Rock…","2021-11-12 15:12:49","Entertainment","https://www.tmz.com/2021/11/12/dwayne-johnson-the-rock-pee-water-bottle-workouts/","6240c290bff374a27027518cd58a4147772c1aec20b754ef99637a2916f129e9","c85db14f5288529dace40e77c478a3ca"
"Photos Inside Paris Hilton's Wedding to Carter Reum, Dancing, Kim K and More!","TMZ","Paris Hilton is a married woman -- walking down the aisle and saying her I Do's -- with Carter Reum in a celeb-studded ceremony ... with plenty more wedding celebrations to come! Hilton and Reum tied the knot Thursday night at Paris' late…","2021-11-12 12:47:19","Entertainment","https://www.tmz.com/2021/11/12/paris-hilton-marries-carter-reum-bel-air-wedding-ceremony/","6240c290bff374a27027518cd58a4147772c1aec20b754ef99637a2916f129e9","7157870d4739c3f117e9af49378bbeb8"
"Olivia Munn Sued For Wrongful Death at House She Owns, Roof Worker Fell","TMZ","A man replacing the roof at a house owned by Olivia Munn fell to his death ... and now she and her mom are being sued by his family. According to a new lawsuit, obtained by TMZ, Olivia and her mother, Kim Schmid, hired Celso Merida to work on…","2021-11-12 19:49:37","Entertainment","https://www.tmz.com/2021/11/12/olivia-munn-sued-wrongful-death-house-she-owns-worker-fell-roof/","6240c290bff374a27027518cd58a4147772c1aec20b754ef99637a2916f129e9","ce09f78d513a8757f81984f0a655b730"
"Adele Gushes Over Relationship With BF Rich Paul, 'Incredible, Openhearted'","TMZ","There's a fire starting in Adele's heart -- the singer is opening up on dating NBA super-agent Rich Paul ... saying it's the most incredible, openhearted, and easiest relationship she's ever been in. The Easy On Me artist -- who started dating…","2021-11-12 19:12:49","Entertainment","https://www.tmz.com/2021/11/12/adele-gushes-over-relationship-boyfriend-rich-paul/","6240c290bff374a27027518cd58a4147772c1aec20b754ef99637a2916f129e9","cd41a65061676ba19af09a6df8163007"
"Travis Scott Holed Up at Home, Giving Victims' Families Room to Grieve","TMZ","Travis Scott has locked himself away in his Houston home, still devastated by the events that took place one week ago ... according to his attorney. Ed McPherson joined TMZ Live Friday to talk about Travis and what happened at Astroworld. While…","2021-11-12 20:52:02","Entertainment","https://www.tmz.com/2021/11/12/travis-scott-locked-away-at-home-astroworld-ed-mcpherson/","6240c290bff374a27027518cd58a4147772c1aec20b754ef99637a2916f129e9","71a3a03556065b66d2433ba4f98987b7"
"Jon Gruden Sues NFL & Roger Goodell, You Destroyed My Career","TMZ","Jon Gruden is accusing the NFL and Roger Goodell of conducting a malicious and orchestrated campaign ... to destroy [his] career and reputation. It's all spelled out in a new lawsuit, obtained by TMZ Sports, filed in a Nevada court on Thursday…","2021-11-12 20:27:03","Entertainment","https://www.tmz.com/2021/11/12/jon-gruden-lawsuit-las-vegas-raiders-nfl-roger-goodell/","6240c290bff374a27027518cd58a4147772c1aec20b754ef99637a2916f129e9","0668f4a8893e0fe1bf95c7af85c696fe"
"Man Who Went to Space with William Shatner Dies in Plane Crash","TMZ","One of the men who went to space aboard Jeff Bezos' Blue Origin ship -- and was joined by William Shatner on the voyage -- has died in a plane crash. Authorities say Glen de Vries died Thursday in a small plane crash. De Vries and Thomas P. Fischer…","2021-11-12 20:12:57","Entertainment","https://www.tmz.com/2021/11/12/man-who-went-to-space-with-william-shatner-dies-in-plane-crash/","6240c290bff374a27027518cd58a4147772c1aec20b754ef99637a2916f129e9","335ecb11de07e8724bb40d1eb25c1023"
"Fate of Britney Spears' Conservatorship About to Be Decided in Court Hearing","TMZ","Britney's attorney, Mathew Rosengart just arrived at the courthouse, and while he didn't directly answer our question -- he still gave a big smile and was met with applause from Britney supporters. Britney Spears has been praying for it, her fans…","2021-11-12 21:39:48","Entertainment","https://www.tmz.com/2021/11/12/britney-spears-conservatorship-hearing-court-judge-mental-evaluation/","6240c290bff374a27027518cd58a4147772c1aec20b754ef99637a2916f129e9","db78134bc5f939b1871a0f2ad3f61f83"
"Britney Spears Wants to Record Music Again After Conservatorship","TMZ","Britney Spears is already making plans once her conservatorship ends, and they involve recording music ... sources with direct knowledge tell TMZ. Our sources say Britney has made her intentions clear ... she wants to go back in the studio, but…","2021-11-12 20:59:38","Entertainment","https://www.tmz.com/2021/11/12/britney-spears-conservatorship-record-music-dance/","6240c290bff374a27027518cd58a4147772c1aec20b754ef99637a2916f129e9","644223d046f99736ee14c087a23dc071"
"Britney Spears Conservatorship Terminated","TMZ","Britney Spears is now a free woman, because the judge has swiftly ended her conservatorship ... effective immediately. The judge terminated the conservatorship without requiring any further mental evaluation ... something Britney was adamant about.…","2021-11-12 21:39:48","Entertainment","https://www.tmz.com/2021/11/12/britney-spears-conservatorship-hearing-court-judge-mental-evaluation/","6240c290bff374a27027518cd58a4147772c1aec20b754ef99637a2916f129e9","6507a0532263658da74d746610771fb6"
"9-Year-Old Boy Trampled at Astroworld Dies","TMZ","The 9-year-old boy who was trampled at Astroworld Fest and left fighting for his life has sadly died from his injuries -- making him the 10th death from the festival. Ezra Blount passed away Sunday at Texas Children's Hospital, after being on life…","2021-11-15 04:50:27","Entertainment","https://www.tmz.com/2021/11/14/9-year-old-boy-ezra-blount-trampled-astroworld-dead-dies-ben-crump/","6240c290bff374a27027518cd58a4147772c1aec20b754ef99637a2916f129e9","5ff4922967e97ac78903487999250345"
"SZA Stops Show to Check on Fan, Talks Astroworld as 10th Victim Dies","TMZ","9-year-old Ezra Blount has reportedly died ... this per ABC13. Reporter Stefania Okolie shared the news Sunday, writing ... My heart 9 YO Ezra Blount who was trampled after falling from his fathers shoulders at AstroWorld has passed away at Texas…","2021-11-15 01:50:47","Entertainment","https://www.tmz.com/2021/11/14/sza-stops-utah-show-to-address-passed-out-fan-talks-astroworld-fest/","6240c290bff374a27027518cd58a4147772c1aec20b754ef99637a2916f129e9","9043fe380d90e4251857cabc5607b087"
"Halle Berry Crowns Cardi B Queen of Hip Hop, Winnie Harlow Says No","TMZ","Halle Berry gave Cardi B a crown many feel belongs to Nicki Minaj -- and while Winnie Harlow vouched for the latter on live TV ... CB seems to want no part of the debate. This is all started Saturday, when Halle and co. were hosting a premiere for…","2021-11-15 01:22:17","Entertainment","https://www.tmz.com/2021/11/14/halle-berry-cardi-b-queen-of-hip-hop-winnie-harlow-nicki-minaj/","6240c290bff374a27027518cd58a4147772c1aec20b754ef99637a2916f129e9","227c5cc36cd9f0438ad9d1f90df27e36"
"Shia LaBeouf at Chuck E. Cheese with Seemingly Pregnant Mia Goth","TMZ","Shia LaBeouf may soon be living the dad life -- assuming he and Mia Goth are expecting ... and it sure looks like they are from this. The actor was spotted at a Chuck E. Cheese restaurant Saturday with none other than his on-again, off-again…","2021-11-14 22:00:08","Entertainment","https://www.tmz.com/2021/11/14/shia-labeouf-chuck-e-cheese-pregnant-mia-goth-girlfriend-wife/","6240c290bff374a27027518cd58a4147772c1aec20b754ef99637a2916f129e9","1af7309deabbb03ad2916139a718cb95"
"Kanye West Clones Take Over NYC Ahead of 'DONDA' Deluxe Release","TMZ","Kanye West is seeing double -- and so are the people of NYC, it seems, after an army of would-be clones took to the streets ... in what appears to be a tease of new music to come. On Saturday night, a good dozen or more people were spotted near…","2021-11-14 20:09:53","Entertainment","https://www.tmz.com/2021/11/14/kanye-west-clones-take-over-nyc-donda-deluxe-release/","6240c290bff374a27027518cd58a4147772c1aec20b754ef99637a2916f129e9","0fc1538d6c4469aee6a764b85b8a240d"
"Nicole Kidman Wows Critic-Heavy Audience as Lucille Ball in New Movie","TMZ","Nicole Kidman has a lot of doubters over her turn as Lucille Ball in a new movie about the iconic actress -- but those folks will be silenced ... so say critics, who were blown away. Aaron Sorkin's new flick, Being the Ricardos, got its first…","2021-11-14 19:20:24","Entertainment","https://www.tmz.com/2021/11/14/nicole-kidman-wows-sag-heavy-audience-lucille-ball-new-movie/","6240c290bff374a27027518cd58a4147772c1aec20b754ef99637a2916f129e9","aca087ead60fc896f16739578198a34e"
"Mr. T Says He Got the Vaccine Booster Shot, Still Playing It Safe","TMZ","Mr. T seems to be going from the A-Team to the B-Team in this pandemic -- and B is for booster shot ... something the man says he's now happily been injected with. The actor announced Saturday that he'd been inoculated anew with a new round of…","2021-11-14 18:50:15","Entertainment","https://www.tmz.com/2021/11/14/mr-t-booster-vaccine-shot-covid-coronavirus-mask-safe-distance/","6240c290bff374a27027518cd58a4147772c1aec20b754ef99637a2916f129e9","35e577f7ff0fd67e58d3fe0054e9c395"
"Elon Musk Says He Forgets Bernie Sanders is Alive After Tax Demand","TMZ","Bernie Sanders reiterated his demand for the top 1% to pay more taxes -- and Elon Musk slammed him ... saying the Senator may as well be 6 feet under as far as he's concerned. The saucy exchange went down between Saturday and Sunday -- with Senator…","2021-11-14 18:24:59","Entertainment","https://www.tmz.com/2021/11/14/elon-musk-forget-bernie-sanders-alive-tax-demand/","6240c290bff374a27027518cd58a4147772c1aec20b754ef99637a2916f129e9","79ddcd3f7f3f71aedd74447b80cc08f4"
"Jeff Bezos Says Humans Will Inhabit Space, Earth Will Be Vacation Destination","TMZ","Jeff Bezos is a super-smart guy, so you just can't dismiss what he says out of hand, but this one is mind-bending. Bezos thinks planet earth is going to be more like Disneyland in the future rather than home base. In other words, he doesn't think…","2021-11-14 14:52:09","Entertainment","https://www.tmz.com/2021/11/14/jeff-bezos-earth-inhabit-space-vacation-blue-origin/","6240c290bff374a27027518cd58a4147772c1aec20b754ef99637a2916f129e9","0bb9e6de6c81c3e9bf4660f9910bfcbd"
"Queen Elizabeth Sprains Back, Misses Remembrance Sunday Service","TMZ","Queen Elizabeth continues to struggle with medical woes ... this time it's a sprained back that has sidelined her from a big event. The Queen was MIA from the Remembrance Sunday service ... which honors Britain's war dead. The Palace said it was…","2021-11-14 14:26:07","Entertainment","https://www.tmz.com/2021/11/14/queen-elizabeth-back-sprain-rememberance-service-cancels/","6240c290bff374a27027518cd58a4147772c1aec20b754ef99637a2916f129e9","a05a27510a073fc3fd65f441d4255d99"
"Paris Hilton and Carter Reum Celebrate Marriage Third Night in a Row","TMZ","Paris Hilton continues to ride the wedding train ... and the third night was off the hook! Paris and her new hubby, Carter Reum, went back to their wedding venue -- the Bel-Air estate of her late grandfather Barron Hilton -- and the party was as…","2021-11-14 14:15:14","Entertainment","https://www.tmz.com/2021/11/14/paris-hilton-carter-reum-wedding-marriage-celebration-estate/","6240c290bff374a27027518cd58a4147772c1aec20b754ef99637a2916f129e9","db2cd32b3c735f09ffc0b396cd1981f1"
"Taylor Swift Performs 'All Too Well' on SNL, Cameo in Pete Davidson Sketch","TMZ","Taylor Swift appeared on 'SNL' Saturday night, singing a 10-minute version of the song about her breakup with Jake Gyllenhaal ... and wow, the words and the emotions behind it are biting. Swift performed All Too Well (Taylor's Version), a cut…","2021-11-14 13:59:34","Entertainment","https://www.tmz.com/2021/11/14/taylor-swift-snl-all-too-well-pete-davidson-red/","6240c290bff374a27027518cd58a4147772c1aec20b754ef99637a2916f129e9","1d5f6e1b63a4bd035a23486f6fcb7291"
"Beanie Sigel Says Kanye West Doesn't Owe Him Money for Yeezy Nickname","TMZ","Ye has gone by a lot of nicknames throughout his career, but none have stuck quite like Yeezy ... and now the man who created it is naming his price for the moniker that made Kanye billions. Philly rapper Beanie Sigel is the man Ye recently…","2021-11-14 09:00:33","Entertainment","https://www.tmz.com/2021/11/14/beanie-sigel-ye-kanye-west-yeezy-nickname/","6240c290bff374a27027518cd58a4147772c1aec20b754ef99637a2916f129e9","0288a961fd2d9d2e29e68142ab799a34"
"Erika Jayne Doesn't Want to Date Another Lawyer, Will Never Remarry","TMZ","Erika Jayne is eliminating one specific kind of suitor ... telling us she would be hard-pressed to date another lawyer like her estranged husband Tom Girardi. We got the 'RHOBH' star leaving Jolie in Los Angeles and our photog asked her how her…","2021-11-14 08:50:01","Entertainment","https://www.tmz.com/2021/11/14/erika-jayne-wont-date-another-lawyer-estranged-husband-tom-girardi-real-housewives-beverly-hills-rhobh/","6240c290bff374a27027518cd58a4147772c1aec20b754ef99637a2916f129e9","29f58889e04806924fdc4bf71d7cc202"
"Jake Paul Shoots Down Tyron Woodley Rematch, 'He Had His Chance'","TMZ","Sorry, Tyron Woodley -- that I love Jake Paul tattoo was all for naught ... 'cause Jake Paul tells TMZ Sports he's officially slamming the door on giving the former UFC champ a rematch. Of course, Woodley held up his end of a tattoo bet he made…","2021-11-14 08:40:32","Entertainment","https://www.tmz.com/2021/11/14/jake-paul-shoots-down-tyron-woodley-rematch/","6240c290bff374a27027518cd58a4147772c1aec20b754ef99637a2916f129e9","8503f83169fc54adb772a320f5dcab4a"
"Chico DeBarge Arrested for Meth Possession, Motorhome Impounded","TMZ","Chico DeBarge got busted for drug possession ... and the motorhome the R&B singer was living in is now impounded. Law enforcement sources tell TMZ ... cops got a call back on Nov. 6 about a man causing a disturbance inside a motorhome, and when…","2021-11-14 08:30:37","Entertainment","https://www.tmz.com/2021/11/14/chico-debarge-arrested-meth-drugs-motorhome-impounded/","6240c290bff374a27027518cd58a4147772c1aec20b754ef99637a2916f129e9","26b24f20c6aada5e7e41b50b6fe77329"
"Stars On The Sidelines -- Famous NFL Fans Have A Field Day!","TMZ","It's football Sunday and these famous NFL fans are heading to the stadium to show their support ... and they always get the best seat in the house! Whether they are celebrating with their significant others like Kaitlyn Bristowe and Jason Tartick,…","2021-11-14 08:01:44","Entertainment","https://www.tmz.com/2021/11/14/sidelined-stars-nfl-fans-have-a-field-day/","6240c290bff374a27027518cd58a4147772c1aec20b754ef99637a2916f129e9","bca74ce20ddad45ea56ff851ccf74bdd"
"Comedian Affion Crockett's Stand-Up Set Interrupted by So-Called 'Karen'","TMZ","A comedian's stand-up show came to an abrupt halt after a dissatisfied satisfied appears to have waded her way onto the stage ... just to let him know, she wasn't digging his jokes. Affion Crockett was performing Friday at the Comedy Zone in…","2021-11-14 00:15:42","Entertainment","https://www.tmz.com/2021/11/13/comedian-affion-crockett-standup-set-interrupted-woman-karen/","6240c290bff374a27027518cd58a4147772c1aec20b754ef99637a2916f129e9","0536f768048ee3d168bd0aebb8ca1834"
"Chris Daughtry's Daughter's Death, Detectives Told Family It's Homicide","TMZ","Sources directly connected to the Daughtry family tell TMZ ... detectives have told the family Hannah’s death was a homicide. The sources also tell us Bobby Jolly was Hannah's boyfriend. Now, law enforcement tells us Jolly was arrested at…","2021-11-13 19:09:33","Entertainment","https://www.tmz.com/2021/11/13/chris-daughtry-daughter-dead-25-tour-postponed/","6240c290bff374a27027518cd58a4147772c1aec20b754ef99637a2916f129e9","82c604bd8811b5fcf93f7c68c82ca431"
"Renée Zellweger Renting Home Across Street from Boyfriend Ant Anstead","TMZ","Renée Zellweger and boyfriend Ant Anstead are getting closer ... she just moved in across the street from his Laguna Beach home, and they will soon be under one roof. TMZ has learned the actress recently started renting a 5-bedroom home in Laguna…","2021-11-15 08:50:00","Entertainment","https://www.tmz.com/2021/11/15/renee-zellweger-renting-home-across-street-boyfriend-ant-anstead/","6240c290bff374a27027518cd58a4147772c1aec20b754ef99637a2916f129e9","c51d35b69ce8e76f87f062a9864ed507"
"Serena Williams Pumped For Naomi Osaka's Return To Tennis","TMZ","Even if Naomi Osaka's return to tennis means more competition for Serena Williams ... the G.O.A.T. tells TMZ Sports she's still stoked for the 24-year-old's comeback!!! Oh my goodness, the tennis legend said out in Beverly Hills. It's gonna be…","2021-11-15 08:40:50","Entertainment","https://www.tmz.com/2021/11/15/serena-williams-pumped-naomi-osaka-tennis-return/","6240c290bff374a27027518cd58a4147772c1aec20b754ef99637a2916f129e9","bf555477f0f8401e73ca14dca5a9396c"
"Rapper Polo G Has 3 Charges Dropped in Miami Cop Attack Case","TMZ","Rapper Polo G could soon be off the hook for allegedly beating the crap out of a Miami cop, because the bulk of the charges against him are now dropped. Prosecutors tossed 2 felony charges against Polo -- battery of a police officer and threatening…","2021-11-15 08:30:06","Entertainment","https://www.tmz.com/2021/11/15/rapper-polo-g-felony-charges-dropped-miami-cop-attack-case/","6240c290bff374a27027518cd58a4147772c1aec20b754ef99637a2916f129e9","a5dcb4a84c0da1fa6359d725052053c5"
"Guess Who This Rosy Runt Turned Into!","TMZ","Before this blushing beauty was smacking down her opponents in the ring, she was just another rosy runt ready for her close-up in Calgary, Alberta, Canada. This little lady is best known for being a fierce fighter and an epic threat to anyone…","2021-11-15 08:01:52","Entertainment","https://www.tmz.com/2021/11/15/guess-who-this-rosy-runt-turned-into/","6240c290bff374a27027518cd58a4147772c1aec20b754ef99637a2916f129e9","82f5b9f367e7e8631573a2f455818b68"
"'Rust' Set Worker's Arm Saved From Spider Bite, Working on Workers' Comp","TMZ","The Rust film worker who suffered horrific injuries from a spider bite on the job won't need to have his arm amputated ... and it sounds like he's going to get some workers' comp. The film worker, Jason Miller, tells TMZ ... his left arm will be…","2021-11-15 09:00:05","Entertainment","https://www.tmz.com/2021/11/15/rust-set-worker-spider-bite-arm-save-no-amputation-workers-compensation/","6240c290bff374a27027518cd58a4147772c1aec20b754ef99637a2916f129e9","5986fcb14d4e0dcae8ecd7539adae715"
