"Carole Baskin Sues Netflix Over 'Tiger King 2' Footage","TMZ","Carole Baskin is putting her foot down over Netflix's sequel to 'Tiger King' -- insisting the producers and Netflix cut out all footage of her for their latest offering. The big cat advocate -- who was heavily featured in the OG series last year --…","2021-11-01 21:11:54","Entertainment","https://www.tmz.com/2021/11/01/carole-baskin-sues-netflix-tiger-king-2-footage/","6240c290bff374a27027518cd58a4147772c1aec20b754ef99637a2916f129e9","8209558b774d3daf205f3634930acfb3"
"MSG's James Dolan's Son Buys Kendall Jenner's Old Hollywood Hills Mansion","TMZ","A house with some seriously famous past owners -- including Kendall Jenner, John Krasinski and Emily Blunt -- just added another well-known name to its address, James Dolan's son, Ryan, now holds the keys. Ryan Dolan, son of the owner of the New…","2021-11-01 20:31:22","Entertainment","https://www.tmz.com/2021/11/01/james-dolan-son-buys-kendall-jenners-old-home-ariana-grande/","6240c290bff374a27027518cd58a4147772c1aec20b754ef99637a2916f129e9","0b910e48077b005a2b5e4a03a8fbbcd5"
"Influencer Hayes Grier Won't Be Charged in Alleged Assault","TMZ","Former Vine star and all-around influencer Hayes Grier will NOT be prosecuted for allegedly beating the crap out of a guy and jacking his phone. According to new legal docs, obtained by TMZ, prosecutors in North Carolina dismissed the case against…","2021-11-01 20:23:11","Entertainment","https://www.tmz.com/2021/11/01/hayes-grier-assault-case-dismissed-influencer-vine-star/","6240c290bff374a27027518cd58a4147772c1aec20b754ef99637a2916f129e9","f6e25041b8a8eb98cdd9a119311d80a1"
"'Housewives' Star Rick Leventhal Defends Cowboy Alec Baldwin Halloween Costume","TMZ","Rick Leventhal is digging his heels in over his decision to dress as Alec Baldwin in a cowboy costume with a gun for Halloween ... taking some serious jabs at the guy. RL did NOT back down from his outfit choice for the holiday -- despite getting…","2021-11-01 18:46:23","Entertainment","https://www.tmz.com/2021/11/01/fox-news-rick-leventhal-defend-cowboy-alec-baldwin-halloween-costume/","6240c290bff374a27027518cd58a4147772c1aec20b754ef99637a2916f129e9","b91aebd76a76451bb024de2e68624334"
"Alessandra Ambrosio's Friend Warns Trick or Treaters to 'F*** Off'","TMZ","Turns out Alessandra's not the Halloween-Scrooge she appears to be ... we're told the pics show her in front of a friend's house in Santa Monica. She and her fam went there to visit and trick or treat -- but the sign was not her handiwork.…","2021-11-01 17:46:15","Entertainment","https://www.tmz.com/2021/11/01/alessandra-ambrosio-no-trick-or-treat-f-off-halloween/","6240c290bff374a27027518cd58a4147772c1aec20b754ef99637a2916f129e9","4f3603b993beed3b580b61e4835c598b"
"Kal Penn Says Friends More Shocked by His NASCAR Love Than His Coming Out","TMZ","Kal Penn says he's sharing his life story -- including the fact he's gay -- to let others know that you can do anything while being true to yourself, like say ... being a gay NASCAR fan. We got the actor, politico and now author leaving 30 Rock…","2021-11-01 16:14:00","Entertainment","https://www.tmz.com/2021/11/01/kal-penn-why-share-story-new-book-coming-out/","6240c290bff374a27027518cd58a4147772c1aec20b754ef99637a2916f129e9","2818d5bc405173388ddd87adb39658fb"
"NASCAR's Kyle Busch Apologizes For Using R-Word In Post-Race Interview","TMZ","More trouble for NASCAR -- Kyle Busch is apologizing for using the r-word in a post-race interview on Sunday ... saying he should have never used the derogatory term. Busch was furious with Brad Keselowski after making contact with the driver at…","2021-11-01 14:53:06","Entertainment","https://www.tmz.com/2021/11/01/kyle-busch-apologizes-using-r-word-interview-nascar/","6240c290bff374a27027518cd58a4147772c1aec20b754ef99637a2916f129e9","bd17015baacf21fa7597bc540574440a"
"Ben Affleck & J Lo Trick or Treat on Same Block as Jennifer Garner","TMZ","Ben Affleck's worlds are colliding, especially as it relates to the Jennifers in his life ... and it all came together on Halloween. Ben and J Lo were trick or treating with their kids Sunday in the private, gated Malibu colony ... where her son,…","2021-11-01 14:19:14","Entertainment","https://www.tmz.com/2021/11/01/ben-affleck-and-j-lo-trick-or-treat-in-same-hood-as-jennifer-garner/","6240c290bff374a27027518cd58a4147772c1aec20b754ef99637a2916f129e9","8f8db7914f61ad28f00289fad59aab57"
"Donald Trump Parties With Dustin Johnson, Paulina Gretzky At Mar-a-Lago","TMZ","A POTUS, a golf superstar and a model walk into a party ... That's what went down Sunday night ... 'cause former President Donald Trump schmoozed it up with golfer Dustin Johnson and Paulina Gretzky during a Halloween bash at his Mar-a-Lago Club in…","2021-11-01 13:58:44","Entertainment","https://www.tmz.com/2021/11/01/president-trump-parties-dustin-johnson-paulina-gretzky-mar-a-lago-halloween/","6240c290bff374a27027518cd58a4147772c1aec20b754ef99637a2916f129e9","613783d729d5e44bd36dc018762a62e4"
"Halyna Hutchins After Shooting on 'Rust' Set, 'That Was No Good'","TMZ","Halyna Hutchins' words to the Rust crew after being shot prove she had a wicked sense of humor -- albeit a dark one -- and maintained it right up to her tragic end. The slain cinematographer uttered something in response to a boom operator after…","2021-11-01 13:37:38","Entertainment","https://www.tmz.com/2021/11/01/halyna-hutchins-rust-set-alec-baldwin-final-words/","6240c290bff374a27027518cd58a4147772c1aec20b754ef99637a2916f129e9","631e15f182f1195960a5c7b3f038ccd4"
"Halloween 2021 Celeb Costumes and Parties","TMZ","Halloween 2021 is officially in the books, and the stars certainly took advantage of having a year off from celebrating, putting a ton of effort in for this year's bashes. Megan Thee Stallion -- dressed as a fairy -- hosted a huge event at Ysabel…","2021-11-01 13:34:21","Entertainment","https://www.tmz.com/2021/11/01/halloween-celebs-party-costumes-hollywood/","6240c290bff374a27027518cd58a4147772c1aec20b754ef99637a2916f129e9","c9ad4a74e0af87e36a9643d2f45c64d7"
"'Meta' Trademark Applicants Will Sell to Facebook For $20M","TMZ","It might not be smooth sailing for Mark Zuckerberg in his quest to change Facebook's identity, because we've learned someone was already ahead of him in trying to grab the Meta trademark ... and they're willing to give it up to Zuck for a steep…","2021-11-01 08:00:57","Entertainment","https://www.tmz.com/2021/11/01/meta-trademark-applicants-will-sell-to-mark-zuckerberg-for-20m/","6240c290bff374a27027518cd58a4147772c1aec20b754ef99637a2916f129e9","d56195849c4d13880f978e837337983a"
"Black Eyed Peas' Taboo Says Petito Case Highlights Media's Racial Bias","TMZ","The Gabby Petito saga has raised questions about who the media focuses on in cases like these, and it seems disproportionally white ... so says a member of the Black Eyed Peas. We talked to Taboo (Jaime Luis Gomez) -- who is of Mexican descent and…","2021-11-01 07:50:58","Entertainment","https://www.tmz.com/2021/11/01/jaime-luis-gomez-taboo-black-eyed-peas-gabby-petito-racial-bias/","6240c290bff374a27027518cd58a4147772c1aec20b754ef99637a2916f129e9","b2a04a984632bdb5f52d6b53c4a530cf"
"Master P Says Zaire Wade Is Taking Advantage Of G League Spot, Working Hard!","TMZ","Master P has a message for the haters who think Dwyane Wade got his son, Zaire, a spot in the G League ... telling TMZ Sports, Life ain't fair. As we previously reported, the former Sierra Canyon standout joined the Salt Lake City Stars earlier…","2021-11-01 07:40:45","Entertainment","https://www.tmz.com/2021/11/01/master-p-g-league-zaire-wade-dwyane-wade/","6240c290bff374a27027518cd58a4147772c1aec20b754ef99637a2916f129e9","a4b7c28ea3505fca07a1d97a34cf89c2"
"Ron Perlman Keeps Tesla, Gives Up House and Benz in Divorce Settlement","TMZ","Ron Perlman is walking away from his marriage with one of Elon Musk's cars ... but his ex-wife is keeping the family home in their divorce. According to new legal docs, obtained by TMZ ... the judge signed off on Ron and Opal Stone Perlman's…","2021-11-01 07:30:34","Entertainment","https://www.tmz.com/2021/11/01/ron-perlman-divorce-settlement-keeps-tesla-gives-up-los-angeles-home-mercedes-benz-judgment/","6240c290bff374a27027518cd58a4147772c1aec20b754ef99637a2916f129e9","9b7584911f1a213e296113c042b7dad6"
"Famous Frights At Night -- Haunted Hollywood!","TMZ","These spooked stars are getting the daylight scared out of them! Popular nighttime attractions -- such as Universal Studio's Hollywood Horror Nights, Knott's Scary Farms, Haunt O'Ween, and more -- were scatted with spooked stars this month. Some…","2021-11-01 07:05:00","Entertainment","https://www.tmz.com/2021/11/01/famous-frights-at-night-boo/","6240c290bff374a27027518cd58a4147772c1aec20b754ef99637a2916f129e9","a8fe23c159ba8e608c96dcf353a584cd"
"Guess Who This Hungry Kid Turned Into!","TMZ","Before this hungry kid was serving up talented performances in television and film, she was just another grinning girl who was licking her plate clean in Oakland, California. This foodie female got her start in the industry by showcasing her…","2021-11-01 07:01:01","Entertainment","https://www.tmz.com/2021/11/01/guess-who-this-hungry-kid-turned-into/","6240c290bff374a27027518cd58a4147772c1aec20b754ef99637a2916f129e9","b4d19a02bf3c6d4509d9525a10070a83"
"White House Press Secretary Jen Psaki Positive for COVID","TMZ","President Biden's press secretary, Jen Psaki, says she's come down with COVID-19 ... but is away from POTUS and has been for several days now. Psaki revealed Sunday that she'd tested positive for the virus -- this after multiple days of testing…","2021-10-31 22:15:30","Entertainment","https://www.tmz.com/2021/10/31/white-house-press-secretary-jen-psaki-positive-for-covid/","6240c290bff374a27027518cd58a4147772c1aec20b754ef99637a2916f129e9","b47ad38afe1e7e8669c5c259f906b856"
"Kal Penn Comes Out as Gay in Surprise Engagement Announcement","TMZ","Kal Penn has come out of the closet in the most surprising of ways -- announcing he's gay in a new book of his, which reveals that he's actually getting married as well. The actor shared the news through his forthcoming offering, You Can't Be…","2021-10-31 21:59:25","Entertainment","https://www.tmz.com/2021/10/31/kal-penn-comes-out-as-gay-in-surprise-engagement-announcement/","6240c290bff374a27027518cd58a4147772c1aec20b754ef99637a2916f129e9","9416fa5da08cf0251c99ad5bc3109319"
"Kanye West Invites Marilyn Manson to Latest Sunday Service","TMZ","Kanye West is continuing his friendship with Marilyn Manson -- going so far as to invite the guy to his newest Sunday Service ... and even going in on a prayer together. Ye kicked off a new round of worship and gospel singing Sunday -- and he…","2021-10-31 20:54:32","Entertainment","https://www.tmz.com/2021/10/31/kanye-west-invites-marilyn-manson-to-latest-sunday-service/","6240c290bff374a27027518cd58a4147772c1aec20b754ef99637a2916f129e9","0fe690dd9443bcfd621ba579f9b1babf"
"Superman Artists, Studio Call for LAPD Patrols After Bi Backlash & Threats","TMZ","Superman's bisexuality is having real-world consequences -- outraged fans targeting the folks behind the new comic series ... and cops stepping in to make sure things don't escalate. Law enforcement sources tell TMZ ... LAPD officers were recently…","2021-11-02 07:40:04","Entertainment","https://www.tmz.com/2021/11/02/superman-artists-animators-lapd-patrol-protection-bisexual-threats/","6240c290bff374a27027518cd58a4147772c1aec20b754ef99637a2916f129e9","d1e90ba24052e2a177752ce390aa67ce"
"LGBTQ Org Signs Off on DaBaby Performing Again, Condemns Dave Chappelle","TMZ","DaBaby is A-OK to hit live stages again, because he's come a long way since his homophobic rants ... so says one LGBTQ org which is cool with him, but NOT Dave Chappelle. The CEO for Relationship Unleashed, Gwendolyn D. Clemons, tells TMZ ... she…","2021-11-02 07:30:48","Entertainment","https://www.tmz.com/2021/11/02/lgbtq-org-support-dababy-performing-condemns-dave-chappelle/","6240c290bff374a27027518cd58a4147772c1aec20b754ef99637a2916f129e9","1618fb8ee7fae8a8ac1e0ab716a68166"
"Lindsay Lohan Will Not Be On 'The Real Housewives of Dubai'","TMZ","Lindsay Lohan will not be joining the cast of the upcoming Real Housewives of Dubai ... even though she's already living in the country, and would provide instant star power and drama. Sources with direct knowledge tell TMZ ... Lindsay is NOT…","2021-11-02 07:20:12","Entertainment","https://www.tmz.com/2021/11/02/lindsay-lohan-will-not-be-on-the-real-housewives-of-dubai/","6240c290bff374a27027518cd58a4147772c1aec20b754ef99637a2916f129e9","dda57b8651deb95977df40d7d7784433"
"Dana White Says He's 100% Down To Make Khamzat vs. Nate Diaz Fight","TMZ","Nate Diaz vs. Khamzat Chimaev could be coming to an Octagon near you very soon ... 'cause Dana White tells TMZ Sports he's down to make the fight, and plans to talk to the Stockton fighter. After 27-year-old Chimaev put on another DOMINATING…","2021-11-02 07:10:40","Entertainment","https://www.tmz.com/2021/11/02/dana-white-down-to-make-khamzat-chimaev-vs-nate-diaz-fight-ufc/","6240c290bff374a27027518cd58a4147772c1aec20b754ef99637a2916f129e9","b1ef9f6058284a44355d2891f9c51ca3"
"Trish on 'Austin & Ally' 'Memba Her?!","TMZ","Lone Star state actor Raini Rodriguez was still a teenager when she locked in the role as the spunky best friend Trish -- who also acts as the musical manager while alongside the up-and-coming artist tackling the entertainment industry -- in the…","2021-11-02 07:01:52","Entertainment","https://www.tmz.com/2021/11/02/raini-rodriguez-trish-austin-and-ally-disney-then-and-now-photos/","6240c290bff374a27027518cd58a4147772c1aec20b754ef99637a2916f129e9","358ff504a9b7e6c1ba36cb271d18a0ec"
"'Whose Line Is It Anyway?' Colin Mochrie Hits Fan Over Head With VHS Tape","TMZ","Colin Mochrie turned a videotape into a weapon ... using it to rain blows on a fan's head in a curbside autograph session gone haywire ... and we have it all on video. The bizarre incident unfolded Monday afternoon in Bev Hills, where the Whose…","2021-11-02 00:41:47","Entertainment","https://www.tmz.com/2021/11/01/colin-mochrie-attack-hits-fan-over-head-vhs-tape-whose-line-is-it-anyway/","6240c290bff374a27027518cd58a4147772c1aec20b754ef99637a2916f129e9","a18058a0d5212e5b3209109c00f4efe5"
"Kim Kardashian Shows Off Halloween Costume, Sexy Space 'CowBot'","TMZ","Kim Kardashian is finally revealing what she dressed up as for Halloween ... and it looks like she let her imagination run wild, mixing the old West with the future!!! Kim just showed off her full costume on social media, and she's calling it a…","2021-11-01 23:29:10","Entertainment","https://www.tmz.com/2021/11/01/kim-kardashian-shows-off-halloween-costume-space-cowboy-robot/","6240c290bff374a27027518cd58a4147772c1aec20b754ef99637a2916f129e9","60cb7ec0ae4c4a58aaf8f898105a6885"
"Britney Spears' Marriage to Sam, Prenup On Hold Pending Conservatorship Ruling","TMZ","Britney Spears wants to get married, buy a house and have kids ... but those plans are all on hold until the judge in her conservatorship case decides if it should end ... TMZ has learned. Britney and Sam Asghari are engaged, but sources with…","2021-11-02 08:00:30","Entertainment","https://www.tmz.com/2021/11/02/britney-spears-life-plans-marriage-to-sam-put-on-hold-end-conservatorship/","6240c290bff374a27027518cd58a4147772c1aec20b754ef99637a2916f129e9","2d12facc92955f701914f5763016b47f"
"Scott Disick, Son Mason Go Boating in Miami","TMZ","Scott Disick is processing Kourtney Kardashian's engagement with a little QT with his eldest son -- who are in the same boat as they navigate these choppy waters ... literally. Papa bear was out with his kid, Mason, Monday in Miami -- where they…","2021-11-02 13:27:21","Entertainment","https://www.tmz.com/2021/11/02/scott-disick-mason-miami-beach-boating/","6240c290bff374a27027518cd58a4147772c1aec20b754ef99637a2916f129e9","f0e2b51dbef6900dea92e0dd8b538961"
"Rev. Jesse Jackson Hospitalized After Hitting Head in Fall","TMZ","Rev. Jesse Jackson is back in the hospital -- though this time not COVID-related -- instead, for a nasty fall. Jackson was visiting Howard University in Washington D.C. Monday when his team says he fell and hit his head as he entered a building on…","2021-11-02 13:21:45","Entertainment","https://www.tmz.com/2021/11/02/rev-jesse-jackson-hospitalized-fall-head-injury-howard-university/","6240c290bff374a27027518cd58a4147772c1aec20b754ef99637a2916f129e9","be21bef22a5f4a5175c311a7d44b7a25"
"Jason Momoa Quarantines with Pro Skateboarder After Catching COVID","TMZ","Jason Momoa is killing time as he quarantines after contracting COVID-19 -- but he at least has some good (and skilled) company that'll flip his wig ... not to mention flipping a board. The Aquaman star is isolating at his crib -- this after…","2021-11-02 14:44:08","Entertainment","https://www.tmz.com/2021/11/02/jason-momoa-quarantines-with-pro-skateboarder-after-catching-covid/","6240c290bff374a27027518cd58a4147772c1aec20b754ef99637a2916f129e9","a040e0efb32f6cbf09d6c208784b3002"
"Nick Lachey Won't Read Jessica Simpson's Book, 'I Lived it,' No Use for Her 'Version'","TMZ","Nick Lachey says he's not the least bit curious about what his ex-wife, Jessica Simpson's written about their time together -- but hints her memory of it is far different from his. Nick seems to be warning readers of Jessica's Open Book that the…","2021-11-02 14:12:54","Entertainment","https://www.tmz.com/2021/11/02/nick-lachey-has-not-read-jessica-simpsons-book-open/","6240c290bff374a27027518cd58a4147772c1aec20b754ef99637a2916f129e9","7a220ce972f05028d996063cfc03dc3c"
"Kim Kardashian Dons Brown Leather Dress at WSJ Innovator Awards in NYC","TMZ","Kim Kardashian was browning out in NYC -- where she received honors for being a trailblazing entrepreneur ... at an event where she and her team also had to think on their feet. KK was in the Big Apple Monday for the Wall Street Journal Magazine's…","2021-11-02 14:08:31","Entertainment","https://www.tmz.com/2021/11/02/kim-kardahian-brown-leather-dress-wsj-innovator-awards-nyc/","6240c290bff374a27027518cd58a4147772c1aec20b754ef99637a2916f129e9","b3e491be1909674688cb4e8d2ea3a9cb"
"Alec and Hilaria Baldwin's Cat is Missing as they Deal with 'Rust' Shooting","TMZ","When it rains it pours ... as Alec Baldwin reels from the fatal shooting on the 'Rust' set, his wife just revealed a member of their family is MIA. Hilaria Baldwin just posted, We can't find our cat, Emilio. If anyone sees him, please help him get…","2021-11-02 14:04:58","Entertainment","https://www.tmz.com/2021/11/02/alec-baldwin-hilaria-cat-missing-rust-shooting/","6240c290bff374a27027518cd58a4147772c1aec20b754ef99637a2916f129e9","50cdb992ed122ce0cd179740d60c1761"
"Texas Longhorns Coach's GF's Monkey Allegedly Attacks Kid On Halloween","TMZ","As if Texas' football season couldn't get any worse -- a monkey belonging to Longhorns special teams coach Jeff Banks' GF is being accused of attacking a young trick or treater on Halloween ... but the woman says it's all the kid's fault. A report…","2021-11-02 15:00:18","Entertainment","https://www.tmz.com/2021/11/02/texas-longhorns-coach-jeff-banks-girlfriend-monkey-allegedly-bites-kid-halloween/","6240c290bff374a27027518cd58a4147772c1aec20b754ef99637a2916f129e9","9b7c057f0c01adc39e3891b7dc136926"
"Scott Disick and Son Mason Hang Out in Miami, Scott Goes Speedboating","TMZ","Scott Disick is processing Kourtney Kardashian's engagement with a little QT with his eldest son -- who are in the same boat as they navigate these choppy waters ... literally. Papa bear was out with his kid, Mason, Monday in Miami -- where they…","2021-11-02 13:27:21","Entertainment","https://www.tmz.com/2021/11/02/scott-disick-mason-miami-beach-boating/","6240c290bff374a27027518cd58a4147772c1aec20b754ef99637a2916f129e9","05597e7c8e45d890892ba5c97945c1fa"
"Britney Spears' Lawyer Demands Answers from Jamie Over Bedroom Listening Device","TMZ","Britney Spears' lawyer says Jamie Spears has done an about-face -- now urging the judge to end the conservatorship -- to save his own hide from what might come out in a deposition. Mathew Rosengart filed legal docs essentially calling out Jamie,…","2021-11-02 16:46:18","Entertainment","https://www.tmz.com/2021/11/02/britney-spears-lawyer-jamie-spears-bedroom-listening-device/","6240c290bff374a27027518cd58a4147772c1aec20b754ef99637a2916f129e9","88a2135c4f8b6a273fc455141c5218b9"
"Henry Ruggs Involved In Car Crash, To be Charged With DUI Resulting In Death","TMZ","Cops tells us Ruggs was behind the wheel, driving his Chevrolet Corvette, when he crashed into a Toyota Rav4 around 3:39 AM. The Toyota caught on fire ... and first responders located a deceased person in the SUV. Ruggs was transported to a local…","2021-11-02 17:42:51","Entertainment","https://www.tmz.com/2021/11/02/las-vegas-raiders-henry-ruggs-involved-in-serious-car-accident/","6240c290bff374a27027518cd58a4147772c1aec20b754ef99637a2916f129e9","d9bd5d0643cb7cc118f6789faba05cf4"
"Henry Ruggs Involved in Fatal Crash, To Be Charged With DUI Resulting In Death","TMZ","We've just obtained photos from the crash site taken just minutes after the collision. An eyewitness tells us the two men in the left of the photo were attempting to put out the blaze with a fire extinguisher, but it was too much for them to…","2021-11-02 18:48:08","Entertainment","https://www.tmz.com/2021/11/02/las-vegas-raiders-henry-ruggs-involved-in-serious-car-accident/","6240c290bff374a27027518cd58a4147772c1aec20b754ef99637a2916f129e9","deb2d5a3ff60de672f2a2283001b8841"
"Kal Penn Says Obamas Congratulated Him on New Book, Engagement","TMZ","Kal Penn says his ol' White House boss gave him props for announcing his engagement in a new book -- but it sounds like Barack and Michelle Obama had the tea long before the rest of us. The actor and now-author shared some inside political baseball…","2021-11-02 19:43:53","Entertainment","https://www.tmz.com/2021/11/02/kal-penn-obamas-congratulate-engagement-new-book/","6240c290bff374a27027518cd58a4147772c1aec20b754ef99637a2916f129e9","c80c180ab1d541cabf5b0f09ffe50fd1"
"Brian Laundrie Probably Committed Suicide, Police Say","TMZ","Brian Laundrie took his own life before the nationwide manhunt ... at least that's what cops in Florida are saying. Sarasota County Sheriff Kurt Hoffman told folks in town Brian went out there and by all accounts probably committed suicide and he…","2021-11-02 19:19:18","Entertainment","https://www.tmz.com/2021/11/02/brian-laundrie-died-by-suicide-took-own-life-police-say-gabby-petito-case/","6240c290bff374a27027518cd58a4147772c1aec20b754ef99637a2916f129e9","a3e91dee643b3ff95d7731c5e270e1a8"
"Alec and Hilaria Baldwin Find Missing Cat, Now Has Broken Leg","TMZ","Hilaria and Alec Baldwin have been reunited with their Bengal cat ... but he's on the mend after an apparent injury. HB says Emilio is back in their custody, but also says he seems to have a broken leg. She thanks folks who helped out behind the…","2021-11-02 19:03:10","Entertainment","https://www.tmz.com/2021/11/02/alec-baldwin-hilaria-cat-missing-rust-shooting/","6240c290bff374a27027518cd58a4147772c1aec20b754ef99637a2916f129e9","a26833633b7b6a16808d089ae76bd8a1"
"Britney Spears' Judge Has Famous Son, Speaks on Death Threats to His Mom","TMZ","There's a new Hollywood twist to the Britney Spears conservatorship ... turns out the judge on the case is the mother of a famous producer, and now he's breaking his silence on death threats aimed at his mom. Prentice Penny is an executive producer…","2021-11-02 21:26:50","Entertainment","https://www.tmz.com/2021/11/02/britney-spears-judge-has-famous-son-speaks-on-death-threats-to-mom/","6240c290bff374a27027518cd58a4147772c1aec20b754ef99637a2916f129e9","d2d0507b6f3bda4ddc2b0c562db8b45c"
"Kobe Crash Victims' Families Settle with L.A. County Over Photos","TMZ","Two of the families whose loved ones perished in the Kobe Bryant helicopter crash just agreed to settlements with L.A. County over the alleged sharing of crash site photos of remains -- but Vanessa Bryant is still at war. The Los Angeles County…","2021-11-02 21:04:14","Entertainment","https://www.tmz.com/2021/11/02/kobe-crash-victims-families-score-settlement-from-l-a-county-over-photo-sharing/","6240c290bff374a27027518cd58a4147772c1aec20b754ef99637a2916f129e9","b4a99354e53ce9c12c24470b1d9e6303"
"Jamie Spears Demands Britney's Conservatorship End Today, Doesn't Want Money","TMZ","Jamie Spears is throwing in the towel on all things related to Britney Spears' conservatorship -- making it crystal clear to the judge in the case that he's tired of fighting ... and is all good with ending the conservatorship STAT. Brit's father…","2021-11-02 22:58:37","Entertainment","https://www.tmz.com/2021/11/02/jamie-spears-britney-conservatorship-end-now-payment-release/","6240c290bff374a27027518cd58a4147772c1aec20b754ef99637a2916f129e9","99bd7efffcbaf3437d6f8baebfe7cd09"
"Tennis Star Mardy Fish Says Wife Saved Him From 'Really Bad Place'","TMZ","Tennis legend Mardy Fish says he might not be alive if it weren't for his wife ... crediting her with getting him out of a really bad place with his mental health struggles. Mardy joined us on TMZ Live Tuesday and got real with us about some of…","2021-11-02 22:39:01","Entertainment","https://www.tmz.com/2021/11/02/tennis-star-mardy-fish-thanks-wife-saving-life-us-open/","6240c290bff374a27027518cd58a4147772c1aec20b754ef99637a2916f129e9","ade56ecca13712b7f482000e2a6bdcfb"
