"Anheuser-Busch Launches All-Natural NÜTRL Vodka Seltzer","Hypebeast","Anheuser-Busch is headed into the seltzer category with an all-new beverage: the NÜTRL Vodka Seltzer.The gluten-free drink, which recently launched in the U.S., boasts a simple and straightforward recipe: real vodka, real juice and real seltzer, nothing else. NÜTRL is available in three flavors — pineapple, raspberry and watermelon — and contains 4.5% alcohol inside a 355mL can, with no added sugar. In total, each can contains only 100 calories and 2.4g of sugar.Anheuser-Busch is one of the larg","2021-11-15 05:55:59","Fashion","https://hypebeast.com/2021/11/nutrl-vodka-seltzer-amheuser-busch-launch","79d9597b677f44a6d27796b62163c07a0aafac53a6e4779f3dbfdec28f8c7fcb","9b4007cdec037b3fb924eca4b23e3b45"
"Kanye West Drops 'DONDA (Deluxe)' With Verses From André 3000, KayCyy and More","Hypebeast","Kanye West has delivered the deluxe version of his latest full-length album, DONDA.Clocking in at just a little over two hours, the new edition arrives with a whopping 32 tracks and features verses from André 3000 on the controversial cut Life Of The Party, KayCyy on Keep My Spirit Alive pt. 2 and Kid Cudi on Remote Control pt. 2 to name a few. DONDA (Deluxe) also includes a selection of new cuts such as Up From The Ashes and Never Abandon Your Family.Over the weekend, TIDAL took to Tw","2021-11-15 04:15:22","Fashion","https://hypebeast.com/2021/11/kanye-west-donda-deluxe-album-stream-tidal-apple-music-spotify","79d9597b677f44a6d27796b62163c07a0aafac53a6e4779f3dbfdec28f8c7fcb","f9950ef2c96e27b60eca160d414bdc8a"
"Discord Suspends NFT Integration After User Community Backlash","Hypebeast","Following widespread community backlash, Discord has now decided to suspend its plans to integrate cryptocurrencies and NFTs into its platform.The original announcement came from Discord CEO Jason Citron himself, who took to Twitter to post a screenshot of the company's app showing support for MetaMask and WalletConnect. Unfortunately, the post backfired with many users in the community criticizing the decision.Mirroring many's sentiments, one user replied Man, can't wait to tell my friends tha","2021-11-15 03:50:15","Fashion","https://hypebeast.com/2021/11/discord-nft-integration-community-backlash","79d9597b677f44a6d27796b62163c07a0aafac53a6e4779f3dbfdec28f8c7fcb","b37c667cc2aa6a36861a5b1b4cf3fd2a"
"Disney+ Releases New Trailer for 'The Proud Family: Louder and Prouder'","Hypebeast","Disney+ is tugging at heartstrings and tapping into the early 200s nostalgia with the revival of The Proud Family. Over a decade and a half after the original series aired in 2005, the show's spin-off The Proud Family: Louder and Prouder take fans back to the days of young Penny Proud as a teenager as she navigates life and family interactions with old favorites like Oscar Proud, Trudy Proud and Suga Mama.In the new Disney+ series, The Proud Family: Louder and Prouder see the original cast membe","2021-11-15 03:49:39","Fashion","https://hypebeast.com/2021/11/disney-plus-the-proud-family-louder-and-prouder-trailer-release","79d9597b677f44a6d27796b62163c07a0aafac53a6e4779f3dbfdec28f8c7fcb","33fe0e179af63c082e7c37915f69f97a"
"Tesla EV Severely Damaged After Full Self-Driving Beta Mode-Induced Crash","Hypebeast","In the latest reports of the November 3rd crash in California involving a Tesla Model Y in Full-Self-Driving (FSD) beta mode, it has now been considered as the first incident involving the new feature. While no one was injured, the vehicle suffered irreversible damages.The initial accident was reported by the National Highway Traffic Safety Administration and coincided with the ongoing investigation regarding Tesla's Autopilot system. The Verge reported that,The Vehicle was in FSD Beta mode and","2021-11-15 03:49:14","Fashion","https://hypebeast.com/2021/11/tesla-model-y-crash-full-self-driving-beta-mode-cause-california","79d9597b677f44a6d27796b62163c07a0aafac53a6e4779f3dbfdec28f8c7fcb","0850cbe34e7781eef77dd2d834bb8b7f"
"Second 'Spider-Man: No Way Home' Trailer Premiering This Week","Hypebeast","The second trailer for Marvel and Sony Pictures' Spider-Man: No Way Home is set to drop on November 16.The visual, which reportedly clocks in at around three minutes, will debut at a fan event at the Regal Sherman Oaks Galleria in the neighborhood Sherman Oaks, Los Angeles. Twitter user Spidey_Updates shared the invite to the event, which states that fans who plan on attending can expect big surprises.Many are speculating that Andrew Garfield and Tobey Maguire will appear in the trailer as lea","2021-11-15 03:48:10","Fashion","https://hypebeast.com/2021/11/marvel-sony-pictures-spider-man-no-way-home-second-trailer-release-date","79d9597b677f44a6d27796b62163c07a0aafac53a6e4779f3dbfdec28f8c7fcb","437eb0149d68542ecb15c4f85e4659c1"
"A Closer Look at Louis Vuitton's Rainbow Watercolor Monogram Skateboard Trunk","Hypebeast","After taking a look at Louis Vuitton's custom Vanity Mahjong Set, we now head to the world of skateboarding with the Louis Vuitton Hard-Sided Skateboard Trunk.As one of the subcultures Virgil Abloh has been consistently trying to adopt into his work over at the French fashion house -- merging street with luxury -- the Skateboard Trunk is one of the many elevated takes on the sport. This release sees a full skateboard trunk that's been treated to the rainbow-color Watercolor Monogram and has been","2021-11-15 03:45:53","Fashion","https://hypebeast.com/2021/11/louis-vuitton-skateboard-trunk-closer-look","79d9597b677f44a6d27796b62163c07a0aafac53a6e4779f3dbfdec28f8c7fcb","ddfd6a2a103ef2c84bc676164c83ebd7"
"Beanie Sigel Now Claims Kanye West Does Not Owe Him for Coining YEEZY","Hypebeast","In his first Drink Champs interview, Kanye West revealed that Beanie Sigel gave the rapper his YEEZY nickname and that he owed him millions for coming up with the billion-dollar brand name.While Sigel responded to Ye in a recent club appearance, stating that the DONDA artist would technically owe him around $50 million USD and 5% of YEEZY stock, Sigel recently said in an interview that there is no bad blood between them, despite the lack of compensation. Sigel said, As far as his business min","2021-11-15 02:43:52","Fashion","https://hypebeast.com/2021/11/kanye-west-does-not-owe-beanie-sigel-for-coining-yeezy","79d9597b677f44a6d27796b62163c07a0aafac53a6e4779f3dbfdec28f8c7fcb","ba519baf734d1fb3c44be1c82574cbe7"
"SpaceX's Starlink Unveils All-New Internet Satellite Dish","Hypebeast","SpaceX's satellite internet company Starlink has unveiled an all-new user terminal, which customers can now receive with their starter kit.The new rectangular dish, which offers a thinner and lighter alternative to Starlink's previous circular dish, allows users to tap into the company's ever-expanding satellite constellation in low Earth orbit. The dish has received Federal Communications regulatory approval, several months following SpaceX president Gwynne Shotwell's announcement that the comp","2021-11-14 20:56:17","Fashion","https://hypebeast.com/2021/11/spacex-starlink-new-internet-satellite-dish","79d9597b677f44a6d27796b62163c07a0aafac53a6e4779f3dbfdec28f8c7fcb","60c2e5cd53feda6499da63356ab73eb2"
"Stephen Curry Passes Ray Allen for Most Career Three-Pointers in NBA History","Hypebeast","Stephen Curry has passed basketball legend Ray Allen for the most three-pointers scored in NBA games, including playoffs, in the league's history.Curry scored nine three-point shots during the Golden State Warriors' 119-93 win against the Chicago Bulls on Friday, raising his total tally for regular season and playoff game three-pointers to 3,366, beating out Allen's previous record of 3,358.Curry started the game just one three-point score behind Allen's record and ultimately tied his number dur","2021-11-14 19:45:05","Fashion","https://hypebeast.com/2021/11/stephen-curry-passes-ray-allen-most-three-pointers-nba-history","79d9597b677f44a6d27796b62163c07a0aafac53a6e4779f3dbfdec28f8c7fcb","95abe5d8eec5faf4b77af331a8798222"
"G-Dragon Officially Reveals the PEACEMINUSONE x Nike Kwondo 1","Hypebeast","G-Dragon's highly anticipated PEACEMINUSONE x Nike Kwondo 1 collaboration has finally received an official release date. Earlier this month, the K-Pop star unveiled limited-edition friends and family pairs of the shoe in various color renditions.The collaborative silhouette comes in white leather and features wingtip brogue details on the toe boxes that are inspired by the Nike Tiempo or classic golf shoes. The pair take on a lower cut and features uppers that are primarily constructed with smoo","2021-11-15 08:52:24","Fashion","https://hypebeast.com/2021/11/g-dragon-peaceminusone-nike-kwondo-1-release-info","79d9597b677f44a6d27796b62163c07a0aafac53a6e4779f3dbfdec28f8c7fcb","9eb7ab07d2cfce8021cf48b6b59e3111"
"Here's An On-Foot Look At the Pass~Port x Nike SB Dunk High Workboot","Hypebeast","Following its Sid Pro collaboration with Vans, Pass~Port has linked up with Nike SB to debut a special edition SB Dunk High dubbed as the Workboot. The Australian brand's sample shoe was previewed back in the summer and now thanks to the Instagram account YankeeKicks, we get a full on-foot look at the latest offering.As its name suggests, the pair is equipped with embellishments adopted from hiking boots such as the multi-colored rope laces following in theme with the color palette which loops","2021-11-15 08:51:10","Fashion","https://hypebeast.com/2021/11/passport-nike-sb-dunk-high-workboot-collaboration-info","79d9597b677f44a6d27796b62163c07a0aafac53a6e4779f3dbfdec28f8c7fcb","3ab7e64e22ba4a0a9f6a0aaee2b34cdb"
"Adult Swim and Studio DEEN Delivers 'Rick and Morty' Short Samurai & Shogun Part 2","Hypebeast","Adult Swim and Studio DEEN have dropped off the second part to the animated Rick and Morty short, Samurai & Shogun.Clocking in a little under six minutes, the sequel is helmed by Kaichi Satō and hears Youhei Tadano and Keisuke Chiba reprise their roles as Rick WTM72 and Shogun Morty, respectively:Paying homage to the classic tale Lone Wolf and Cub, Samurai Rick defends Shogun Morty against all comers. In part one, we learned that Rick WTM-72 is not to be underestimated. In the finale, his sav","2021-11-15 08:50:31","Fashion","https://hypebeast.com/2021/11/rick-and-morty-samurai-and-shogun-part-2-stream-release","79d9597b677f44a6d27796b62163c07a0aafac53a6e4779f3dbfdec28f8c7fcb","0dc9c60679b43790fbfab3dd70d5c162"
"BELIEF Moscow Taps Kirill KTO for Artful Skateboard Release","Hypebeast","For its latest collaboration, BELIEF Moscow has delivered a release that marries the worlds of art and skateboarding. Tapping contemporary artist Kirill KTO, in partnership with ABSURD and Notfoundgallery, the retailer has put together a series of artful skateboard decks.Celebrating the enduring and evolving culture of Moscow, BELIEF looked towards ABSURD, a Russian skate team founded in 2008, and Notfoundgallery, a local gallery specializing in global support and development of contemporary art","2021-11-15 08:36:17","Fashion","https://hypebeast.com/2021/11/notfoundgallery-belief-moscow-kirill-kto-absurd-skate-deck-release-info","79d9597b677f44a6d27796b62163c07a0aafac53a6e4779f3dbfdec28f8c7fcb","8f33b498c1f8c49ae842432230049192"
"Kanye West Pays Elon Musk a Visit at SpaceX","Hypebeast","Earlier last week, Kanye West and Wack 100 were spotted visiting SpaceX and appeared to receive a private tour from Elon Musk himself. Ye's visit was documented by the CEO of Kano, Alex Kleinis while Wack took to Instagram to post his own photo with the founder to thank him for the visit.Wack expressed his appreciation and wrote, @elonmusk I appreciate the hospitality appreciate the Invite appreciate the business tips, appreciate the welcoming. I'm deaf to what's beneath me. Shit just got diffe","2021-11-15 09:59:39","Fashion","https://hypebeast.com/2021/11/kanye-west-visits-elon-musk-at-spacex","79d9597b677f44a6d27796b62163c07a0aafac53a6e4779f3dbfdec28f8c7fcb","da680a308ba64fca8e86d04f9dd2f2c0"
"Official Images of the KAWS x sacai Nike Blazer Low in Blue Have Surfaced","Hypebeast","Along with the Team Red/Neptune Blue and recently unveiled edition in purple, the KAWS x sacai Nike Blazer Low collection is believed to release by December and official images of the blue variation have just surfaced the internet.Following the Brooklyn artist and Chitose Abe's brand's Wearable Art capsule collection, the duo linked up with Nike to drop a trio of the classic silhouette with a signature sacai treatment of layering accompanied by playful colorways care of KAWS.This latest offe","2021-11-15 09:50:07","Fashion","https://hypebeast.com/2021/11/kaws-sacai-nike-blazer-low-dm7901-600-dm7901-400-official-images","79d9597b677f44a6d27796b62163c07a0aafac53a6e4779f3dbfdec28f8c7fcb","d548a8e17bfbb4c7c244a3cef003310d"
"Tesla To Deliver EVs Without USB Ports in Lieu of Chip Shortages","Hypebeast","In a recent report, Tesla Model 3 and Model Y owners have been duped out having USB-C ports in its electric vehicles. Some customers have only said that they only made the realization after purchasing the cars.Tesla's own delivery specialists have said that the lack of USB ports is due to the chip shortages that are currently affecting tech companies globally. Electrek has reported that the company has been telling some customers that Tesla will install the missing ports in December. However, th","2021-11-15 09:49:25","Fashion","https://hypebeast.com/2021/11/tesla-deliver-electric-vehicles-without-usb-ports-chip-shortages","79d9597b677f44a6d27796b62163c07a0aafac53a6e4779f3dbfdec28f8c7fcb","cc2eb4f90c1546573f7d826a2bc5a299"
"The Supreme x Nike By Any Means in Black/White as Seen on Foot","Hypebeast","Following the on-foot look of the Brazil edition, YankeeKicks gives us a 360 view of the Supreme x Nike SB Dunk High By Any Means in black and white. Along with a Navy and Red installment, the trio of sneakers is reported to debut in the upcoming weeks.Shaped up in the signature two-toned colorway, this offering resembles that of the Panda design which reverses the shades by opting for a black leather base with white overlays including the main lateral Swoosh. As a nod to the brand's 2008 ","2021-11-15 09:48:48","Fashion","https://hypebeast.com/2021/11/supreme-nike-sb-dunk-high-by-any-means-black-white-dn3741-002-on-foot","79d9597b677f44a6d27796b62163c07a0aafac53a6e4779f3dbfdec28f8c7fcb","e75b28affb8160172a471cc832ebbe9b"
"Take an Official Look at the Nike Air Max 90 Siempre Familia","Hypebeast","In anticipation of the Nike Dunk Low “Siempre Familia” edition release which follows a green and lizard skin upper, a new Air Max 90 will be added to the Día de los Muertos festive collection.The latest offering from Nike sees a black faux fur assembly with white ribcage, skeleton-like embroidery, and tonal overlays in suede. A textured green Swoosh can be seen at the sidewall as well as a jewel-eyed skull at the heel. The words “Siempre Familia” – which means “Always Family” – along with a skul","2021-11-15 09:37:24","Fashion","https://hypebeast.com/2021/11/nike-air-max-90-siempre-familia-do2154-010-release-date","79d9597b677f44a6d27796b62163c07a0aafac53a6e4779f3dbfdec28f8c7fcb","f5335d3449f3b54a3cd431d799f97a4e"
"'Marvel's Avengers' Drops First Trailer Introducing Spider-Man","Hypebeast","Earlier this month, Square Enix announced its upcoming content release schedule for Marvel's Avengers, and one of the highlights was the introduction of your friendly neighborhood Spider-Man. Now, the developer has dropped a fresh trailer offering fans of the game a first look at the character and how he'll fit into the universe.Featured above, the almost two-minute clip showcases a cinematic sequence of Spidey fighting off AIM agents in his iconic acrobatic, web-slinging ways before uniting wit","2021-11-15 09:30:13","Fashion","https://hypebeast.com/2021/11/square-enix-marvels-avengers-spider-man-trailer","79d9597b677f44a6d27796b62163c07a0aafac53a6e4779f3dbfdec28f8c7fcb","a505f32479d148d35d95df7d1c5e76f1"
"Goodhood Drops Third Chapter of Its Collaborative “T-SHIRTNOW” Project","Hypebeast","Goodhood has followed up its recent HERESY capsule by unveiling the third chapter in its collaborative apparel project: “T-SHIRTNOW”. Designed to celebrate the humble graphic tee, the notorious East London boutique has teamed up with a variety of artists and designers to create a concise limited-edition capsule.From Tokyo-based graffiti artist label Have A Good Time and creative collective Brain Dead, to Dutch post-pop artist Piet Parra and Palace graphic designer Will Bankhead’s line The Trilog","2021-11-15 09:27:44","Fashion","https://hypebeast.com/2021/11/goodhood-tshirtnow-parra-brain-dead-have-a-good-time-release-info","79d9597b677f44a6d27796b62163c07a0aafac53a6e4779f3dbfdec28f8c7fcb","20324ced7bec28a19ede4971eea30c48"
"HBX Opens Pre-Orders for the Highly-Limited SECRET BASE Swarovski 'Astro Boy' Figure","Hypebeast","HBX has just announced the pre-order for a special item with SECRET BASE. Part of the ongoing HIGH-END LOW pop-up at HBX in Hong Kong, this pre-order is for a luxurious version of Osamu Tezuka's Astro Boy character.Standing a little over 18 inches in height, this Astro Boy figure is completely covered in colored Swarovski crystals to perfectly capture the black, peach, green and red that make up the Mighty Atom. Fans and collectors of Astro Boy can find the pre-order in-store at HBX Hong Kong ","2021-11-15 09:25:31","Fashion","https://hypebeast.com/2021/11/hbx-hong-kong-secret-base-swarovski-astro-boy-figure","79d9597b677f44a6d27796b62163c07a0aafac53a6e4779f3dbfdec28f8c7fcb","e82f7ff3737ac8ee375e830dcf746b41"
"BLACK Scandal Yohji Yamamoto and PEACE AND AFTER Collide for a Capsule","Hypebeast","For its latest collaboration, PEACE AND AFTER has teamed up with sub-label BLACK Scandal Yohji Yamamoto on a concise capsule collection. Built off of the evocative dark styling associated with Yohji Yamamoto, BLACK Scandal Yohji Yamamoto explores street-leaning unisex designs centered around striking prints.Comprised of a hoodie, crewneck sweatshirt and T-shirt, the special range sees PEACE AND AFTER take on evocative motifs from BLACK Scandal Yohji Yamamoto with its flourishes. Centered around ","2021-11-15 09:11:26","Fashion","https://hypebeast.com/2021/11/yohji-yamamoto-peace-and-after-capsule-release","79d9597b677f44a6d27796b62163c07a0aafac53a6e4779f3dbfdec28f8c7fcb","3bf304c6a7be41f45a17b15d3108ca1d"
"GmbH Taps Into Jack Wolfskin's Outdoors Heritage","Hypebeast","After opening its archives to mark its 40th anniversary, German outdoors label Jack Wolfskin has continued the celebrations by working with GmbH. For this collection, GmbH founders Serhat Isik and Benjamin A. Huseby channelled their own experience of the outdoors and aimed to challenge the misconception that BIPOC and immigrants do not enjoy the outdoors.The collection itself incorporates Jack Wolfskin technologies with GmbH aesthetics, with eye-catching patterns and quilting covering technica","2021-11-15 09:06:36","Fashion","https://hypebeast.com/2021/11/gmbh-jack-wolfskin-fall-winter-2021-details","79d9597b677f44a6d27796b62163c07a0aafac53a6e4779f3dbfdec28f8c7fcb","108c4cf1ea3015b2938c3fd33387376d"
"10 Designers Have Reimagined RIMOWA’s Suitcases and Bags","Hypebeast","RIMOWA has an extensive history of bringing designers and creatives from the world of streetwear into its orbit: the LVMH-owned luggage maker has embarked on projects with Virgil Abloh, Kim Jones, Supreme, and even Rihanna, who was the face of a brand campaign earlier this year.Now, the brand is launching one of its most ambitious collaborative programmes yet: ‘Vol. 1’, a series of exclusive RIMOWA pieces that have been reimagined and reworked by ten global fashion designers. The 26 one-of-a-kin","2021-11-15 10:53:32","Fashion","https://hypebeast.com/2021/11/rimowa-vol-1-collaborations-hbx","79d9597b677f44a6d27796b62163c07a0aafac53a6e4779f3dbfdec28f8c7fcb","9e5818a85bde622a3e09b2e3ff690e01"
"Gucci and Balenciaga's Hacker Project Is Finally here","Hypebeast","After Gucci and Balenciaga announced their joint Hacker Project back in April of this year, the two houses have now released the co-branded collection. Described as an exploration on ideas of authenticity and appropriation within the fashion industry, the new capsule from the two Kering stablemates sees classic Gucci and Balenciaga silhouettes and codes combined to create something new.Stand-outs include a rework of Gucci's GG logo -- transformed into a double B logo -- which appears on puff","2021-11-15 10:27:58","Fashion","https://hypebeast.com/2021/11/gucci-balenciaga-hacker-project-release-details","79d9597b677f44a6d27796b62163c07a0aafac53a6e4779f3dbfdec28f8c7fcb","56e541705972281721f5f22dbd9442f7"
"LeBron James, Drake and Naomi Osaka Team Up To Invest in Sports Technology Company, Potentially Worth Billions","Hypebeast","LeBron James, Drake and Naomi Osaka have linked up to invest in a sports technology company called StatusPro. Started by two former football players, Andrew Hawkins and Troy Jones, the firm describes themselves as a sports tech and gaming company that incorporates player's data and augmented and virtual reality to create a bevvy of training and fan engagement products.According to the press release, the sports tech firm is part of a growing industry that is projected to be worth $57 billion USD ","2021-11-15 10:15:19","Fashion","https://hypebeast.com/2021/11/lebron-james-drake-naomi-osaka-statuspro-sport-tech-company-investment-news","79d9597b677f44a6d27796b62163c07a0aafac53a6e4779f3dbfdec28f8c7fcb","1b916125723aa71b9392bb32804c5f59"
"Snoop Dogg Unveils Stacked Tracklist for 19th Studio Album 'Algorithm'","Hypebeast","With a new record on the way, Snoop Dogg has shared the official tracklist for Algorithm.The stacked 25-track project marks his first release as Def Jam's Executive Creative and Strategic Consultant and will feature appearances from the likes of Mary J Blige, Ty Dolla $ign, Benny The Butcher, Jadakiss, Busta Rhymes and supergroup Mount Westmore with Ice Cube, E-40 and Too Short. Algorithm will mark Snoop's second full-length release of the year following From tha Streets 2 tha Suites, which drop","2021-11-15 10:05:17","Fashion","https://hypebeast.com/2021/11/snoop-dogg-algorithm-new-album-tracklist-features-mary-j-blige-ty-dolla-sign","79d9597b677f44a6d27796b62163c07a0aafac53a6e4779f3dbfdec28f8c7fcb","8de0a09211c8e880093f229fc7af815d"
"Shoe Palace Updates New Balance’s 327 With Patches of Paisley","Hypebeast","Fresh from its collaboration with Joshua Vides on the 327 sneaker, New Balance returns to the heritage silhouette for two striking takes alongside retailer Shoe Palace.Dubbed the Unity Pack, the capsule draws inspiration from traditional bandana prints, with the first take dressed in New Balance’s signature grey colorway with a contrasting “N” logo atop a paisley assortment of blues, greys, and blacks.The second iteration provides a splash of color, with red, yellow, blue and green pops making","2021-11-15 11:36:02","Fashion","https://hypebeast.com/2021/11/new-balance-shoe-palace-327-sneaker-collab-release-info","79d9597b677f44a6d27796b62163c07a0aafac53a6e4779f3dbfdec28f8c7fcb","4815be9c66d67886892d1bf8afa6a379"
"The 'KAWS:HOLIDAY' Singapore Installation is Set to Reopen","Hypebeast","Two days after it was reported that an installation by the contemporary artist KAWS in Singapore had been ordered to stop as a result of a court order, its organizers have shared that it is now set to reopen tomorrow, November 16.After a hearing, the injunction against the KAWS:HOLIDAY installation (which had been brought by the non-profit organization The Ryan Foundation, citing breach of intellectual property rights and misuse of confidential information), was discharged, according to a releas","2021-11-15 12:37:23","Fashion","https://hypebeast.com/2021/11/kaws-holiday-singapore-reopening","79d9597b677f44a6d27796b62163c07a0aafac53a6e4779f3dbfdec28f8c7fcb","8dc428c77dbbfe06b7dce2c809f915c8"
"Moncler Listed as One of the World's Most Sustainable Brands","Hypebeast","Moncler has been unveiled as one of the world’s most sustainable brands for the third year in a row, according to the S&P Global Corporate Sustainability Assessment 2021.The Italian luxury label, which obtained the highest score out of the textiles, apparel and luxury goods’ industry, has been reporting on its sustainability performances and targets each year, and even presented its new strategic sustainability plan ‘Moncler Born To Protect’ project in 2020.“If I look back and think about every ","2021-11-15 13:31:06","Fashion","https://hypebeast.com/2021/11/moncler-sustainability-brand-sp-global-information","79d9597b677f44a6d27796b62163c07a0aafac53a6e4779f3dbfdec28f8c7fcb","c8c4e1e3ad1b3f65d22aef22879d3f74"
"Extra Butter Links With UGG For Classic Renaissance-Themed Collection","Hypebeast","New York-based boutique Extra Butter has linked up with UGG this season for a unisex footwear collaboration inspired by renaissance art while, also promoting creators of color.The duo -- who are both fresh off the back of collaborations with adidas Originals and Telfar respectively -- have honed in on classic UGG silhouettes for Fall/Winter 2021, reimagining the Neumel “Marble” Boot, Tasman “Still Life” Slipper, Fluff It “Fresco” Slipper and Duffield Throw “Marble”.The collaboration will be acco","2021-11-15 09:26:54","Fashion","https://hypebeast.com/2021/11/extra-butter-ugg-fw21-collaboration-release-info","79d9597b677f44a6d27796b62163c07a0aafac53a6e4779f3dbfdec28f8c7fcb","04cfea3e222eb5984f34429bdc457613"
