"Baccarat Drops a $25,000 USD Crystal Pikachu","Hypebeast","The Pokémon Company has teamed up with Baccarat for a crystal Pikachu that will set collectors back $25,000 USD.Standing nearly one foot in height, the Pikachu was co-designed by Hiroshi Fujiwara of fragment design has been cut with a variety of sides to reflect light at different angles. The front of the faceless piece is kept clean and fully clear, while the back comes engraved with the fragment's lightning bolt logo.Another option is a smaller Pikachu figurine with more details on the face, t","2021-11-09 10:30:43","Fashion","https://hypebeast.com/2021/11/pokemon-fragment-design-hiroshi-fujiwara-baccarat-glass-pikachu","79d9597b677f44a6d27796b62163c07a0aafac53a6e4779f3dbfdec28f8c7fcb","a873b3af663e823085b335b8b724cf75"
"Mercedes-Benz x Proenza Schouler Collaboration Draws Inspiration From the Great American Road Trip","Hypebeast","Mercedes-Benz has partnered with New York-based fashion label Proenza Schouler to bring a new meaning to luxury with their latest collection. The collaboration is heavily inspired by the ability to travel on the open road, embracing adventure at every corner.The limited collection amalgamates Proenza Schouler's minimalistic silhouettes and Mercedes-Benz's sleek design into one capsule. Featuring seven gender-neutral styles, the brands are elevating fashion classics crafted for luxury travelers' ","2021-11-09 09:55:25","Fashion","https://hypebeast.com/2021/11/mercedes-benz-proenza-schouler-collaboration-release-lookbook","79d9597b677f44a6d27796b62163c07a0aafac53a6e4779f3dbfdec28f8c7fcb","f44d0169453a97fe303394a5ded81ff4"
"Pop-Tarts Hits Up Banner Butter To Launch a Full Range Butter Kit","Hypebeast","If you've ever buttered your Pop-Tarts and have converted to a believer of the trend, you can now rejoice as the iconic toaster pastries brand teamed up with Banner Butter to launch a Butter Kit collaboration.Thanks to social media, the trend has been in full force till this day, and now with the latest join effort, fans can play around with three fan-favorite flavors namely the Frosted Strawberry, Frosted Brown Sugar Cinnamon, and Frosted Chocolate Fudge and top them with a curation of six kind","2021-11-09 09:45:01","Fashion","https://hypebeast.com/2021/11/pop-tarts-banner-butter-kit-release-info","79d9597b677f44a6d27796b62163c07a0aafac53a6e4779f3dbfdec28f8c7fcb","c2b653db9b7ac714f0789b04be505553"
"ONLY WATCH 2021 Raises $32 Million USD","Hypebeast","The numbers are now in following the conclusion of this year's ONLY WATCH.In front of an audience of 850 watch enthusiasts, 52 one-off watches were auctioned off for a total of $32 million USD towards the research of muscular dystrophy. With 25 participating counties, this ninth edition of ONLY WATCH has raised more than $110 million USD for the cause.In the lots, five timepiees surpassed the one million dollar mark -- Patek Philippe ($10.4 million USD), F.P.Journe ($4.92 million USD), Audemars ","2021-11-09 13:38:27","Fashion","https://hypebeast.com/2021/11/only-watch-2021-chf-30-million-results","79d9597b677f44a6d27796b62163c07a0aafac53a6e4779f3dbfdec28f8c7fcb","6bd2e43041bf8a8b5e6ff241a67031bd"
"Watch Industry Oscars Defies Status Quo With Unexpected Honors","Hypebeast","This year’s Grand Prix d’Horlogerie turned up more than a few surprises with the normally insular Swiss awards ceremony defying convention and looking at the wider watch world for once.The biggest shake-ups came early on with the first award of the night, the Challenge prize for watches priced at CHF 3,500 or less ($3,800 USD), going to the relatively unknown Chinese brand CIGA Design and the Men’s watch award going to the Grand Seiko SLGH005.The Swiss industry as a whole isn’t big on admitting ","2021-11-09 13:16:59","Fashion","https://hypebeast.com/2021/11/watch-industry-oscars-awards-ceremony-gphg-2021-geneva","79d9597b677f44a6d27796b62163c07a0aafac53a6e4779f3dbfdec28f8c7fcb","d6cc33113aa20cd183942cf52b850e89"
"Baracuta Hits The Road For European Tour With Latest Jaguar Partnership","Hypebeast","Following the release of sought-after collaborations with the likes of WACKO MARIA and Needles, heritage British brand Baracuta has teamed up with luxury car manufacturer Jaguar for its latest campaign “The Next Classic Guide”.Inspired by the intersection of fashion, art and architecture, the brand enlists content curator and brand consultant Samutaro to inaugurate the unique project. Beginning at the Jaguar Design Studio in the U.K. the two brands are set to travel across Europe visiting German","2021-11-09 14:59:40","Fashion","https://hypebeast.com/2021/11/baracuta-jaguar-europe-tour-guide-samutaro-release-info","79d9597b677f44a6d27796b62163c07a0aafac53a6e4779f3dbfdec28f8c7fcb","56d1c7a548a72797c1de702bf5e40303"
"Nigel Cabourn Adds Military Notes to Yogi’s Finn II Silhouette","Hypebeast","Fresh from its “Madchester”-inspired capsule with London-based label YMC, Yogi Footwear returns for Spring/Summer 2022 alongside cult British designer Nigel Cabourn for four takes of its Finn II silhouette.Drawing on Cabourn’s renowned military-inspired approach to both apparel and footwear, the duo have crafted a selection of environmentally-friendly leather and suede combined shoes, which fuse the ethos behind both brands.Complete with a close attention to detail and neat embroidery on the upp","2021-11-09 14:51:37","Fashion","https://hypebeast.com/2021/11/nigel-cabourn-yogi-footwear-ss22-footwear-collaboration-release-info","79d9597b677f44a6d27796b62163c07a0aafac53a6e4779f3dbfdec28f8c7fcb","b97d3a723257e1f482344709d88efde5"
"Wales Bonner Reimagines Archival adidas Originals Styles For FW21","Hypebeast","Grace Wales Bonner and adidas Originals are reuniting for Fall/Winter 2021.The designer -- who released a capsule with the brand earlier this year -- again draws inspiration from the diasporic radical thinkers of the 1980s, to design and present an elevated take on a series of classic archival adidas silhouettes.This latest release is the third time the two have collaborated and forms a part of Bonner’s “Black Sunlight” collection, completing a trilogy alongside “Lovers Rock” in Fall/Winter 2020","2021-11-09 14:30:13","Fashion","https://hypebeast.com/2021/11/adidas-originals-wales-bonner-fall-winter-2021-collaboration-release-info","79d9597b677f44a6d27796b62163c07a0aafac53a6e4779f3dbfdec28f8c7fcb","5e3f79740957e3451680757185401996"
"Nitty Gritty and Barena Venezia Look Into the Archives","Hypebeast","Stockholm-based retailer Nitty Gritty has unveiled a new partnership with Barena Venezia. The collaboration takes inspiration from the Italian label's archive, with classic Barena silhouettes -- which mix traditional workwear aesthetics with looser fits, soft tailoring and luxurious fabrics -- have been given subtle twists.The collection features five pieces -- an overcoat, waistcoat, overshirt, shirt and trousers -- all of which are based on styles from previous mens and womenswear collections.","2021-11-09 14:28:53","Fashion","https://hypebeast.com/2021/11/nitty-gritty-stockholm-barena-venezia-release-details","79d9597b677f44a6d27796b62163c07a0aafac53a6e4779f3dbfdec28f8c7fcb","74fe4cf254ce18e9c58d6e94873d43b7"
"Vans and Tierra Whack Link Up for a Full Footwear and Apparel Collection","Hypebeast","Following a joint effort with MOCA to unveil a new collection featuring designs by a trio of Californian artists, Vans taps rapper Tierra Whack for an exclusive collaboration consisting of both apparel and footwear celebrating creativity and childhood.In hand with Whack's longtime stylist Shirley Kurata, the duo combines the brand's heritage with a 1980s style to form pieces that exude the Philadelphia rapper's unique and vibrant personal fashion sense and music. Molded with a variety of colors,","2021-11-09 09:04:48","Fashion","https://hypebeast.com/2021/11/tierra-whack-vans-footwear-apparel-collection","79d9597b677f44a6d27796b62163c07a0aafac53a6e4779f3dbfdec28f8c7fcb","498afaca2d1c1d6d2f970c8658b680d0"
"Fear of God Home Debuts Its Modern Loungewear Collection","Hypebeast","Fear of God Home presents its debut loungewear collection that elevates spending time around the house. Jerry Lorenzo’s flagship brand is characterized by its minimalist and modern approach to apparel, and the loungewear options stay true to that signature aesthetic.Composed of Italian handcrafted fabrics and materials, the relaxed collection features a knit waffle robe, cotton and silk sleepwear and a set of boxer briefs. The collection comes in cement and black colorways and includes a Fear of","2021-11-09 01:31:33","Fashion","https://hypebeast.com/2021/11/fear-of-god-loungewear-collection-info","79d9597b677f44a6d27796b62163c07a0aafac53a6e4779f3dbfdec28f8c7fcb","ee05e979448e5ef1939b09b9133c2213"
"Official Look at the Rui Hachimura x Air Jordan 8","Hypebeast","The start of the NBA season has been a little uncertain for Rui Hachimura as he missed out on training camp and the first several regular season games due to personal issues. However, the Washington Wizards recently announced that he will be reintegrated into the lineup in the coming weeks, and timing couldn't have been better as his forthcoming Air Jordan 8 collaboration has also just been officially unveiled.For his first retro collaboration, Hachimura shines a light on his Japanese background","2021-11-09 15:58:24","Fashion","https://hypebeast.com/2021/11/rui-hachimura-air-jordan-8-do2496-700-release-date","79d9597b677f44a6d27796b62163c07a0aafac53a6e4779f3dbfdec28f8c7fcb","3bbb832bcf56dfe16ab77e4fe804788c"
"Where I'm From: Kai Nguyen Sheds Light on Cross-Cultural Connections Made with Lumières","Hypebeast","The cool aura that surrounds Kai Nguyen and his brand Lumières has birthed a curiosity for the designer's thought process and how his background plays out in his work. While images from Vietnam, where he was born and raised until about 11 years old, consistently appear in his designs, Nguyen weaves in influences from biker culture and futuristic styling to give a unique touch to Lumières. The label's aesthetic is an extension of Nguyen's personal identity: highly functional apparel with bold slo","2021-11-09 15:30:18","Fashion","https://hypebeast.com/2021/11/kai-nguyen-dao-yi-chow-adobe-diverse-voices-interview","79d9597b677f44a6d27796b62163c07a0aafac53a6e4779f3dbfdec28f8c7fcb","17aff300d98fb46b67f1f3fd732a1a85"
"Virgil Abloh's Off-White™ x Air Jordan 2 Low Capsule Oversees This Week's Best Footwear Drops","Hypebeast","November 2021 has transitioned into its second week, and amid the celebrations of the Veterans Day holiday, a handful of sneaker brands have lined up a compelling assortment of new releases. This week, we're going to witness Jordan Brand, Nike, New Balance and others bring out some heaters for your rotation, but before we break those down, let's take a moment to first reflect on all of the biggest sneaker news stories that popped up last week.For new HYPEBEAST exclusives, our Sole Mates editoria","2021-11-09 15:19:00","Fashion","https://hypebeast.com/2021/11/best-sneaker-releases-november-week-2-off-white-air-jordan-2-low-adidas-yeezy-knit-runner-boot-sulfur","79d9597b677f44a6d27796b62163c07a0aafac53a6e4779f3dbfdec28f8c7fcb","97543ff954c56c5ccbe4abd333782be0"
"Exclusive: 24kGoldn and Lil Tecca Share BTS for 'Prada' Music Video","Hypebeast","24kGoldn and Lil Tecca take a high-end approach to the traditional teenage mall hang-out in their music video for Prada. Dressed exclusively in Prada, the two rising stars rap about getting guala, being ballers and spending it all at the mall.To create a fun contrast to the song's lyrics, the music video presents 24KGoldn and Lil Tecca in a surprisingly nerdy Prada outfit as they run through the shopping mall. After watching the behind-the-scenes footage, HYPEBEAST talked to 24KGoldn to learn ","2021-11-09 17:01:11","Fashion","https://hypebeast.com/2021/11/exclusive-24kgoldn-lil-tecca-bts-prada-music-video","79d9597b677f44a6d27796b62163c07a0aafac53a6e4779f3dbfdec28f8c7fcb","b6dc959d90eea85a0a15351d2c589a43"
"'Squid Game' Creator Confirms Second Season","Hypebeast","Squid Game will officially return for a second season, according to the series' creator Hwang Dong-hyuk in an interview with the Associated Press.So, there's been so much pressure, so much demand, and so much love for a second season. So I almost feel like you leave us no choice, he said. But, I will say there will indeed be a second season. It's in my head right now. I'm in the planning process currently. But I do think it's too early to say when and how that's going to happen.In addition t","2021-11-09 16:51:33","Fashion","https://hypebeast.com/2021/11/squid-game-creator-confirms-season-two","79d9597b677f44a6d27796b62163c07a0aafac53a6e4779f3dbfdec28f8c7fcb","0fdb5fa7677c69d09d368bf509f775b6"
"Rick Owens DRKSHDW Revisits the Converse Chuck Taylor for DRKSTR Collaboration","Hypebeast","Rick Owens has continued his partnership with Converse, continuing to evolve the Chuck Taylor silhouette with exaggerated proportions and details. Dubbed the DRKSTR, the new design follows on from the collaborative TURBODRK Chuck 70 which saw Owens give the Chuck Taylor its first square-toed design.The DRKSTR Chuck 70 comes in both Hi and Ox constructions, both of which feature a dimensionalized rounded toe cap. Other features include an upper constructed from heavy-weight 18 ox cotton twill, as","2021-11-09 16:34:08","Fashion","https://hypebeast.com/2021/11/rick-owens-drkshdw-converse-chuck-taylor-drkstr-release-details","79d9597b677f44a6d27796b62163c07a0aafac53a6e4779f3dbfdec28f8c7fcb","c198669290ebb636379df3534772aa72"
"Mister SFC Drops Official Naruto Jewelry","Hypebeast","The acclaimed San Francisco men’s jewelry brand Mister SFC is famed for its anime and manga jewelry collabs. This time, the brand extends its bandwidth to Naruto fans, dropping an officially-licensed Naruto jewelry collection.Drawing inspiration from the fandom of the cult-favorite Japanese manga series, the Naruto x Mister SFC™ collaboration comes into fruition as a full range of jewelry consisting of a ring, earrings, necklace, bracelet, and pendant. The special-edition collection features som","2021-11-09 16:17:42","Fashion","https://hypebeast.com/2021/11/mister-sfc-official-naruto-jewelry","79d9597b677f44a6d27796b62163c07a0aafac53a6e4779f3dbfdec28f8c7fcb","297bf82ca83a8be2c32f420b595db82f"
"6 MONCLER 1017 ALYX 9SM’s Third Collection Collides Light and Dark","Hypebeast","Moncler Genius and Matthew M Willaims’ 1017 ALYX 9SM have teamed up for the third iteration of their 6 MONCLER 1017 ALYX 9SM collaboration that centers on hypertechnical garments and accessories.The collaborative collection sees Williams’ emphasis on fusing innovative construction and design details with eye-catching hardware for an elevated utilitarian silhouette. With the third iteration, the 1017 ALYX 9SM and Givenchy creative director plays with the relationship between contrasting elements ","2021-11-09 17:36:32","Fashion","https://hypebeast.com/2021/11/6-moncler-1017-alyx-9sm-third-collection-info","79d9597b677f44a6d27796b62163c07a0aafac53a6e4779f3dbfdec28f8c7fcb","bab0317c3d83ccdad9a8eae931454205"
"Official Images of the Air Jordan 6 Midnight Navy","Hypebeast","It's been 30 years since Tinker Hatfield unleashed his design for the iconic Air Jordan 6 model, and 2021 has brought us some striking colorways for its anniversary celebrations. However, it appears as though the classic silhouette will be carrying over its momentum into the new year as the Air Jordan 6 Midnight Navy will finally be making its glorious return to the shelves. The last time this colorway dropped was in 2000, and it hasn't seen a retro comeback since.The palette for this impendin","2021-11-09 17:01:52","Fashion","https://hypebeast.com/2021/11/air-jordan-6-midnight-navy-ct8529-141-release-date","79d9597b677f44a6d27796b62163c07a0aafac53a6e4779f3dbfdec28f8c7fcb","ce77b6ceb4c427efacb8c87c49679959"
"Umar Rashid Paints the Fictitious History of the Frenglish Empire","Hypebeast","Umar Rashid is a painter and storyteller who draws from disparate cultures to create alternative historical narratives. Also known by his alias Frohawk Two Feathers, Rashid presents his first solo exhibition with Los Angeles' Blum & Poe, titled En Garde / On God. Rashid recounts the fictitious history of the Frenglish Empire (1648-1880) through a series of large-scale paintings and sculptures. The work is replete with iconography — from art historical references, such as Renaissance portraitur","2021-11-09 18:53:05","Fashion","https://hypebeast.com/2021/11/umar-rashid-en-garde-oh-god-blum-and-poe","79d9597b677f44a6d27796b62163c07a0aafac53a6e4779f3dbfdec28f8c7fcb","75b0043f7027f27741cb2a094751c3d9"
"New Balance 57/40 Protection Pack Emerges With Gray and Orange Color-Blocking","Hypebeast","Despite the fact that it's only been on the market for less than a year now, the New Balance 57/40 has already take the sneaker world by storm with the release of striking collaborations and a barrage of GR colorways. After recently being clad with sturdy CORDURA materials, the lifestyle-centric model is now returning to the spotlight in the form of an understated gray and orange colorway.Multiple materials are responsible for making up the uppers of this iteration. Underlays are formatted with ","2021-11-09 18:07:09","Fashion","https://hypebeast.com/2021/11/new-balance-m5740-protection-pack-rc1","79d9597b677f44a6d27796b62163c07a0aafac53a6e4779f3dbfdec28f8c7fcb","10eeb1ceee80d7b0cb8c326bc14a4419"
"J Balvin Shares First Look at His Glow-In-the-Dark Air Jordan 2 Collaboration","Hypebeast","Jordan Brand is about to go full force with its Air Jordan 2 as more collaborations are starting to pop up out of the woodworks. Following in the footsteps of Virgil Abloh and his Off-White™ imprint and Union LA comes Latino artist J Balvin whom has just provided a first glimpse at his own rendition. The reggaeton icon first kicked off his partnership with Jordan Brand in 2020 by completely revamping the Air Jordan 1 High with a multi-colored aesthetic and playful graphics that gave off a vibrat","2021-11-09 20:42:28","Fashion","https://hypebeast.com/2021/11/j-balvin-air-jordan-2-glow-in-the-dark","79d9597b677f44a6d27796b62163c07a0aafac53a6e4779f3dbfdec28f8c7fcb","15282b1def2627faa9e4b73fd2fe2a54"
"Damien Hirst Presents Emergency Paintings, Danger Paintings, Hazard Pictures, and Seizures","Hypebeast","Damien Hirst presents the third installment of his year-long partnership at the Gagosian London's Brittania Street location. In his latest exhibition, titled Emergency Paintings, Danger Paintings, Hazard Pictures, and Seizures, the acclaimed British artist has created a series of work related to the visual experiences of warning, danger, crime, rescue, and death.The show follows two earlier installments — Fact Paintings and Fact Sculptures, which were exhibited in April, along with Relics and ","2021-11-09 20:30:01","Fashion","https://hypebeast.com/2021/11/damien-hirst-emergency-paintings-danger-paintings-hazard-pictures-and-seizures-gagosian","79d9597b677f44a6d27796b62163c07a0aafac53a6e4779f3dbfdec28f8c7fcb","726218a39a04e9c5c23a949f49749ce5"
"Rick Owens DRKSHDW Revisits the Converse Chuck Taylor for DRKSTAR Collaboration","Hypebeast","Rick Owens has continued his partnership with Converse, continuing to evolve the Chuck Taylor silhouette with exaggerated proportions and details. Dubbed the DRKSTAR, the new design follows on from the collaborative TURBODRK Chuck 70 which saw Owens give the Chuck Taylor its first square-toed design.The DRKSTAR Chuck 70 comes in both Hi and Ox constructions, both of which feature a dimensionalized rounded toe cap. Other features include an upper constructed from heavy-weight 18 ox cotton twill, ","2021-11-09 20:22:50","Fashion","https://hypebeast.com/2021/11/rick-owens-drkshdw-converse-chuck-taylor-drkstar-release-details","79d9597b677f44a6d27796b62163c07a0aafac53a6e4779f3dbfdec28f8c7fcb","00cd59959febb7c06ef00469e65e83dc"
"Summer Walker Performs Unloyal on 'The Tonight Show Starring Jimmy Fallon'","Hypebeast","On Monday, November 8, Summer Walker performed Unloyal from her latest studio album Still Over It on The Tonight Show Starring Jimmy Fallon.Walker's intimate performance was accompanied by her bandmates in a red velvet-clad room. The song that champions independence and not letting a lover waste your time also features R&B artist Ari Lennox. However, Lennox was not a part of The Tonight Show performance. Before the album's November 5 release, Walker took to Instagram to convey that Unloyal w","2021-11-09 20:04:00","Fashion","https://hypebeast.com/2021/11/summer-walker-unloyal-performance-fallon-watch","79d9597b677f44a6d27796b62163c07a0aafac53a6e4779f3dbfdec28f8c7fcb","d1b84d9a4af46e7400692d070f9a0f29"
"Netflix Unveils Plans to Expand Japanese Content With Feature Films","Hypebeast","Netflix on Tuesday announced that it is expanding its stale of Japanese titles with a slew of ambitious projects and collaborations with top creators and talent during its Japan Festival 2021.Throughout the two-day event, the streaming giant is expected to reveal further details about 50 new titles. Day one presentations will center around animation, and day two will focus on live-action. Netflix currently has 90 Japanese titles available on its platform.The upcoming lineup includes celebrated f","2021-11-09 19:41:49","Fashion","https://hypebeast.com/2021/11/netflix-expand-japanese-content-feature-films","79d9597b677f44a6d27796b62163c07a0aafac53a6e4779f3dbfdec28f8c7fcb","33f4aaad6f4d2b8d73e22a9026ecc6a5"
"Netflix Games Are Coming to iOS Devices Tomorrow","Hypebeast","Netflix is rolling out its games on iOS devices worldwide following the launch for Android users.A dedicated “Games” row is added to the Netflix app where you have unlimited access without in-app purchases or ads, as it is included in your membership.Netflix Games is set to debut on Apple mobile devices at 1 p.m. ET tomorrow. You can now download small games individually through the App Store and expect to see them on the Netflix app when launched.Netflix Games is coming to iOS! Starting tomorro","2021-11-10 07:59:43","Fashion","https://hypebeast.com/2021/11/netflix-games-iphone-ipad-ios-apps","79d9597b677f44a6d27796b62163c07a0aafac53a6e4779f3dbfdec28f8c7fcb","9a27ab08c692e986a47f7d38742f77e9"
"Netflix's Live-Action 'YuYu Hakusho' Is Coming December 2023","Hypebeast","From Gundam, Avatar, Cowboy Bebop, and even One-Piece, Netflix has been on a roll in creating live-action renditions of some of the most iconic animes.Now, fans of Yoshihiro Togashi's '90s Weekly Shōnen Jump classic YuYu Hakusho have reason to celebrate as it has just been announced that a live-action adaptation is slated for a December 2023 release. The live-action will see Teru Morii as producer, Kazutaka Sakamoto as executive producer, while ROBOT will be working on the production. The story ","2021-11-10 07:56:43","Fashion","https://hypebeast.com/2021/11/netflix-yuyu-hakusho-live-action-december-2023-release","79d9597b677f44a6d27796b62163c07a0aafac53a6e4779f3dbfdec28f8c7fcb","3f0f071fd89ba7dd3c09c84032791663"
"An NFT Enthusiast Just Placed a $10.8 Million USD Bid for CryptoPunk 635","Hypebeast","In the world of NFTs, CryptoPunks have continued to see an increase in value over time.The most recent CryptoPunk to receive a large bid is Punk 635. According to Larva Labs, the NFT was first claimed on June 23, 2017 by User 0xc352b5. As time years went by, multiple bids were announced. However, it was not until approximately two years later in 2019 that the CryptoPunk saw bids in the thousands. As cryptocurrency and NFTs began picking up steam, 2020 saw a large spike in bids for Punk 635. The ","2021-11-10 07:56:28","Fashion","https://hypebeast.com/2021/11/nft-cryptopunk-635-recentten-million-usd-bid-announced","79d9597b677f44a6d27796b62163c07a0aafac53a6e4779f3dbfdec28f8c7fcb","08ab9182f4ee16bb816042b09b894bb4"
"Will Ferrell's 'Elf' Costume Sold for Nearly $300,000 USD at Auction","Hypebeast","Just in time for the holidays, one lucky Elf fan will now be celebrating the holiday the most festive way possible.Prop Store recently auctioned of the most iconic holiday film costumes. Will Ferrell's Buddy the Elf costume was expected to sell between $27,600 to $41,000 USD. However, it exceeded expectations and the winner of the bid paid an astounding $296,702.66 USD for the iconic outfit.The outfit features a green pointed hat that comes with a yellow pleated sash and red feather. A matching ","2021-11-10 07:55:01","Fashion","https://hypebeast.com/2021/11/will-ferrell-elf-costume-sold-for-300k-at-prop-store-auction-announcement","79d9597b677f44a6d27796b62163c07a0aafac53a6e4779f3dbfdec28f8c7fcb","238255f3755396472c0dba69e5016353"
"LEGO Star Wars Ultimate Collector Series Unveils Massive 6,785-Piece AT-AT Model","Hypebeast","LEGO has officially unveiled its intricate 6,785-piece AT-AT model, releasing under the Star Wars Ultimate Collector Series collection.Standing at over 24.5 inches high, 27 inches long and and 9.5 inches wide, this AT-AT is modeled after the vehicle seen in the Battle of Hoth in Star Wars: The Empire Strikes Back. The figure features posable legs and heads, opening hatches, cannons, rotating cannons, a bomb-drop hatch and a hook that can be attached to Luke Skywalker, while its interior can fit ","2021-11-10 07:54:26","Fashion","https://hypebeast.com/2021/11/lego-star-wars-ultimate-collector-series-at-at-75313-release-info","79d9597b677f44a6d27796b62163c07a0aafac53a6e4779f3dbfdec28f8c7fcb","725117a476fd4a8051b6b574ac690e49"
