"Rick Owens and Veja Reunite for More Sustainable Sneakers","Hypebeast","Rick Owens has continued his collaboration with Veja, linking up with the brand for a fifth time to create an all-new sustainable footwear capsule. This season's collaboration focuses on two silhouettes -- the Performance Runner and the Hiking Style -- both of which bring Owens' signature design touches to Veja's vegan ethos.The Performance Runner is an adaptation of Veja's Marlin silhouette, with an understated upper sitting atop a technical midsole that nods to its performance origins. The sne","2021-11-01 12:20:50","Fashion","https://hypebeast.com/2021/11/rick-owens-veja-performance-runner-hiking-style-sustainability-vegan-recycled","79d9597b677f44a6d27796b62163c07a0aafac53a6e4779f3dbfdec28f8c7fcb","3b31bbb27cb1f369b6d1ee74906d9db9"
"Peggs & Son. Taps Armor Lux For Autumnal Maritime-Inspired Collaboration","Hypebeast","Brighton-based retailer Peggs & Son. has teamed up with French heritage brand Armor Lux to rework a selection of the latter’s iconic nautical-themed apparel.Founded in 1938, Armor Lux became made its name in northern France when it found itself creating maritime clothing for local sailors and fishermen. Soon Armor Lux was considered as one of the icons of quintessential French style, thanks to the Breton shirt, Sailor sweater and Fisherman’s smock, to name a few.Over 80 years later, the brand te","2021-11-04 13:57:35","Fashion","https://hypebeast.com/2021/11/peggs-and-son-armor-lux-fw21-collaboration-release-info","79d9597b677f44a6d27796b62163c07a0aafac53a6e4779f3dbfdec28f8c7fcb","7fa68b310c04255fd9dba328c8e7d802"
"Roger Dubuis Drops Race-Ready Excalibur Spider Huracàn Automatic","Hypebeast","Roger Dubuis has created a watch fit for Lamborghini’s Huracán Super Trofeo EVO2 racing supercar.The limited edition Excalibur Spider Huracàn Automatic has been developed for the launch of the latest car involved in Lamborghini’s Super Trofeo GT racing series and uses a 45mm carbon case with black DLC titanium bezel.The 4Hz balance of the RD630 calibre is inclined at 12 degrees, while twin barrels contain a maximum power reserve of 60 hours and the movement’s automatic winding rotor, visible thr","2021-11-04 13:49:07","Fashion","https://hypebeast.com/2021/11/roger-dubuis-drops-race-ready-excalibur-spider-huracan-automatic","79d9597b677f44a6d27796b62163c07a0aafac53a6e4779f3dbfdec28f8c7fcb","e76d63dc02a47adbbc28d8f2225b35b0"
"Travis Scott Teases That He Has New Music Dropping Tonight","Hypebeast","Travis Scott announces he has new music dropping at tonight via a recent post to Instagram. View this post on Instagram A post shared by flame (@travisscott)The post by the Houston rapper showcases a news-style front page with a gremlin-like version of Scott and the headline The True Dystopia Is Here! Also, appearing on the front page is When The End Arrives Its Really The Begining and the question Who knows what lies beneath the surface? It is unclear whether the forthcoming music is a si","2021-11-04 15:52:08","Fashion","https://hypebeast.com/2021/11/travis-scott-announces-new-music-info","79d9597b677f44a6d27796b62163c07a0aafac53a6e4779f3dbfdec28f8c7fcb","3233c421eb1e40dafd972a5f7701c30d"
"PUMA Debuts Re:Suede Sneaker as Part of Sustainable Experiment","Hypebeast","PUMA has launched a sustainability-focused iteration of its classic Suede silhouette, which is due to launch as part of a pilot scheme early next year. Dubbed the Re:Suede, the sneaker will incorporate a range of innovative materials, including Zeology tanned suede, biodegradable TPE and hemp fibres.The Re:Suede sneaker will make its debut as part of PUMA's upcoming pilot scheme looking at circularity in this space and aiming to produce a biodegradable shoe. 500 participants from across Germany ","2021-11-04 15:38:45","Fashion","https://hypebeast.com/2021/11/puma-re-suede-sustainable-circular-sneaker-footwear-pilot-scheme","79d9597b677f44a6d27796b62163c07a0aafac53a6e4779f3dbfdec28f8c7fcb","f1ab9ec91fbd134ebd48bbb03028dff2"
"Sivasdescalzo Links With 11 by Boris Bidjan Saberi and Salomon for a Bamba 2 High GTX Collab","Hypebeast","Reaching the 10-year mark for any business in and of itself is a major accomplishment, but especially in the world of streetwear and footwear where brands are erupting every day and trends come and vanish so swiftly. So for Spain-based imprint and retailer Sivasdescalzo, it's taking every chance it can get to celebrate, and to ring in the month of November, it has just unveiled its latest footwear and apparel collaboration with 11 by Boris Bidjan Saberi and Salomon.For this fresh assortment, the","2021-11-04 15:12:30","Fashion","https://hypebeast.com/2021/11/sivasdescalzo-11-by-boris-bidjan-saberi-salomon-bamba-2-high-gtx-release-date","79d9597b677f44a6d27796b62163c07a0aafac53a6e4779f3dbfdec28f8c7fcb","b01b8fc917167f6bc1e611d8add5060f"
"Detailed Look at the 'Gundam' x Nike SB Dunk High Banshee","Hypebeast","Dunks continue to be the talk of the town in the sneaker space, especially when it comes to the collaborations that spring up from Nike and its popular SB label. The skateboarding division recently unveiled its trio of By Any Means colorways with world-renowned streetwear label Supreme, and now it's gearing up for its two-pieced SB Dunk High collection with Gundam. One of the installments in the pack is the Banshee colorway which draws inspiration from the anime franchise's Unicorn Gundam, a","2021-11-04 16:56:03","Fashion","https://hypebeast.com/2021/11/gundam-nike-sb-dunk-high-banshee-dh7717-100-release-info","79d9597b677f44a6d27796b62163c07a0aafac53a6e4779f3dbfdec28f8c7fcb","06d57275eacb2f76c7b9192c70dd14d2"
"New Balance 991 Arrives With a Clean Olive and Gray Color Scheme","Hypebeast","New Balance has been able to maintain a strong momentum in recent years for aligning with impactful collaborators and making use of its garnered attraction by continuing to produce general release colorways that are clean and versatile. In line with the latter, one of the silhouettes that's continuing to push the tempo is the New Balance 991, and it has just arrived in a crisp olive green and gray colorway.The arrival of this newest installment couldn't have been more timely as Autumn is nearing","2021-11-04 16:22:16","Fashion","https://hypebeast.com/2021/11/new-balance-991-olive-gray-m991olg-release-date","79d9597b677f44a6d27796b62163c07a0aafac53a6e4779f3dbfdec28f8c7fcb","8834181cbf2a2f1ccff961846a971b4e"
"RIOTDIVISION Announces Its FW22 SECOND HORIZON Collection","Hypebeast","If you've followed along the journey of RIOTDIVISON — a technical apparel imprint that's based in the Ukraine — you'd know that it tends to show a penchant for referencing past artworks, books and more to influence its collections. Its last FRACTALIZATION capsule that released of SS21 drew from Benoit Mandelbrot’s book “Fractal Geometry of Nature”, and now it has just announced its all new FW22 SECOND HORIZON that pays homage to the artworks of Laszlo Moholy-Nagy, more specifically his “Comp","2021-11-04 17:57:03","Fashion","https://hypebeast.com/2021/11/riotdivision-fw22-second-horizon-collection-release-info","79d9597b677f44a6d27796b62163c07a0aafac53a6e4779f3dbfdec28f8c7fcb","72551e0431aabbb65122491eaaf54ec7"
"Joakim Ojanen Releases 'HURRY UP, TIME TO PANIC!'","Hypebeast","Joakim Ojanen's latest sculpture personifies the same anxieties that many of us face on a daily basis.  No time for breakfast...the inbox is full again...I'll skip lunch today...more coffee. As the latest edition in his steady partnership with Case Studyo, the Swedish artist has released HURRY UP, TIME TO PANIC!Cast in bronze, the three-toned patina sculpture emits a warm, but slightly subdued range of blues and lavender. The figure is in line with many of Ojanen's humorously grotesque charact","2021-11-04 17:12:43","Fashion","https://hypebeast.com/2021/11/joakim-ojanen-hurry-up-time-to-panic-case-studyo","79d9597b677f44a6d27796b62163c07a0aafac53a6e4779f3dbfdec28f8c7fcb","c6b49a3ea51b17fbaf64f0b77d2f21f0"
"Hebru Brantley Presents Two New Exhibitions at NANZUKA","Hypebeast","Acclaimed American artist Hebru Brantley has unveiled two new exhibitions at NANZUKA. Born in Chicago and based in Los Angeles, Brantley is world-renown for recontextualizing pop culture references with his proud Black heritage. By doing so, the artist seeks to challenge preconceived ideas around nostalgia, power and mental psyche and instill a sense of hope in his audience. Housed at NANUKA's 2G location, the series of paintings, drawings and sculptures ruminates on the question of manhood. By ","2021-11-04 18:59:42","Fashion","https://hypebeast.com/2021/11/hebru-brantley-mythos-opus-nanzuka-exhibitions","79d9597b677f44a6d27796b62163c07a0aafac53a6e4779f3dbfdec28f8c7fcb","b9edacd0384a87903943e27589e1422f"
"NFT Platform Bitski Teams Up With PLEASURES for Digital Fashion Collaboration","Hypebeast","NFT platform Bitski has teamed up with streetwear brand PLEASURES for a capsule collection titled WAGMI -- a crypto term short for We’re All Gonna Make It.The collection, composed of a hoodie, cap and dog tag necklace, features holographic accents and heavily features the WAGMI acronym across its digital pieces. The wearables can be worn within digital games or other metaverse platforms.In addition, Bitski recently announced that it is opening up its platform for all creators, brands and dev","2021-11-04 18:59:26","Fashion","https://hypebeast.com/2021/11/nft-platform-bitski-pleasures-nft-fashion-collaboration","79d9597b677f44a6d27796b62163c07a0aafac53a6e4779f3dbfdec28f8c7fcb","e3fad227ce2a1138e5c270b59c679ba2"
"Nike ACG Air Mowabb Receives a Muted Off Noir Makeover","Hypebeast","When Nike practices bringing back some of its retro silhouettes, it tends to have a tradition of releasing its memorable OG colorways first, and then later on rolling out modernized takes. And that's definitely been the case for the ACG Air Mowabb — a model that in 2021 is celebrating its 30th anniversary — and to keep its momentum trucking along, the Swoosh has just brought word that it will be dropping in a new Off Noir colorway.Unlike its throwback “Rattan Birch” and Gravity Purple colorw","2021-11-04 19:54:03","Fashion","https://hypebeast.com/2021/11/nike-acg-air-mowabb-off-noir-olive-green-dm0840-001-release-date","79d9597b677f44a6d27796b62163c07a0aafac53a6e4779f3dbfdec28f8c7fcb","fc26d77aea84d67d95a46eb9762701a7"
"Tiffany & Co. Drops $150,000 USD Advent Calendar","Hypebeast","Tiffany & Co. is following up on their first advent calendar with a new iteration that features Jean-Michel Basquiat's iconic Equals Pi painting. The seldom-seen artwork was recently spotted in an ad Tiffany's ran with Beyoncé and Jay-Z.For those unfamiliar, advent calendars are used to count down the days till Christmas — with each day unraveling a new gift. Standing at 4-feet tall, the calendar is slightly larger than last year's iteration. The white oak cabinet is constructed in New York and ","2021-11-04 19:51:59","Fashion","https://hypebeast.com/2021/11/tiffany-co-2021-advent-calendar-christmas","79d9597b677f44a6d27796b62163c07a0aafac53a6e4779f3dbfdec28f8c7fcb","4021ee8839c20403ce449d215faacf99"
"Meanswhile’s FW21 Hybrid Down Series Blends Style and Warmth","Hypebeast","For the Fall/Winter 2021 season, Meanswhile presents its new hybrid down series that was inspired by art and design from the post-Industrial Revolution and the creation of Bauhaus in 1919. Designer Naohiro Fujisaki encapsulates the principle “form follows function” for a collection that fuses style and warmth -- including a hybrid down jacket, transformable blanket poncho and a muffler.Leading the collection is the 750-fill Thinsulate hybrid down jacket that fuses down and synthetic insulation. ","2021-11-04 19:49:57","Fashion","https://hypebeast.com/2021/11/meanswhile-fall-winter-2021-down-series-info","79d9597b677f44a6d27796b62163c07a0aafac53a6e4779f3dbfdec28f8c7fcb","ae89f2ffbc960e56bdae9c6f58400b8c"
"Chapter 2 of Stone Island’s FW21 Shadow Project Pushes Contemporary Menswear Forward","Hypebeast","Stone Island has unveiled chapter two of its Shadow Project collection for Fall/Winter 2021 that strives to evolve contemporary menswear. Building upon chapter one that made its debut in August of this year, the next chapter includes a range of revitalized outerwear, knitwear, fleecewear, shirts, pants, shoes and accessories.Outerwear takes form in garment-dyed nylon coats and jackets in icy blue, pistachio green, tobacco, jade green, garnet and black with the collection highlight being a lobste","2021-11-04 20:59:18","Fashion","https://hypebeast.com/2021/11/stone-island-fall-winter-2021-shadow-project-chapter-two-info","79d9597b677f44a6d27796b62163c07a0aafac53a6e4779f3dbfdec28f8c7fcb","a81ff984ff148913e0bebfaa27906fc8"
"Kanye West Calls Signing Big Sean The Worst Thing He's Ever Done","Hypebeast","Kanye West took the mic during his recent Drink Champs interview where he bared a lot of previously unknown information about DONDA, his marriage with Kim Kardashian and his relationship with Big Sean and John Legend.The artist now known as Ye revealed that he doesn't rock with neither Big Sean or John Legend because they did not support him during his presidential bid, going as far calling them sellouts and his move to sign Big Sean as the worst thing he's ever done. I already decided th","2021-11-05 07:55:31","Fashion","https://hypebeast.com/2021/11/kanye-west-not-rocking-with-big-sean-john-legend-soulja-boy-comments-drink-champs-interview","79d9597b677f44a6d27796b62163c07a0aafac53a6e4779f3dbfdec28f8c7fcb","b85fc3d8754efa41cbdb707bdd0b62a8"
"Taking a Closer Look at Rolex's Legendary Deep Sea Special","Hypebeast","With the Phillips' Geneva Watch Auction: XIV kicking off today, we take a look at one of the rarest and obscure watches in their lots.The mother of all dive watches from Rolex -- a just because we can watch -- the Rolex Deep Sea Special represents the brand's affinity for diving, its developments of the Oyster case, and military and exploration applications, all turned to 11. A watch that rarely makes it to public auction, the Rolex Deep Sea Special was worked on with Swiss oceanographer and e","2021-11-05 07:49:43","Fashion","https://hypebeast.com/2021/11/rolex-deep-sea-special-phillips-auction-wuppertaler-uhren-museum-number-35-auction-closer-look","79d9597b677f44a6d27796b62163c07a0aafac53a6e4779f3dbfdec28f8c7fcb","c482c9a427d8da5862a69fe9c97f8ab0"
"The World's First USB-C iPhone Is Currently Going for $100,000 USD on eBay","Hypebeast","Despite ever-increasing demand from fans, Apple has yet to create an iPhone with a USB-C charging port, and so robotics engineer Ken Philonel decided to just build his own, and the final product is now worth at least $100,000 USD.Posting the entire modification process up on YouTube, the master's degree student showcased exactly how he went about swapping the usual proprietary Apple Lightning port with a universal USB-C port instead, giving you a full breakdown of the phone's internals and how y","2021-11-05 07:39:34","Fashion","https://hypebeast.com/2021/11/apple-iphone-x-usb-c-custom-build-ebay-auction","79d9597b677f44a6d27796b62163c07a0aafac53a6e4779f3dbfdec28f8c7fcb","7b15cefa1d2e72480e92a5659e935414"
"The Nike LeBron 9 “Watch the Throne” Is Now Set to Officially Release","Hypebeast","Originally designed exclusively for Kanye West and JAY-Z to celebrate the release of their collaborative studio album and accompanying tour back in 2011, the Nike LeBron 9 Watch The Throne is now set to see an official release. The PE colorway of LeBron James' ninth signature shoe was gifted to the rappers and other friends of the basketball starLauded by sneakerheads when it was first revealed, the shoe features a black base accented by elements of gold and Riccardo Tisci-era Givenchy-like fu","2021-11-05 07:17:43","Fashion","https://hypebeast.com/2021/11/nike-lebron-9-watch-the-throne-release-info-do9353-001","79d9597b677f44a6d27796b62163c07a0aafac53a6e4779f3dbfdec28f8c7fcb","3b6834ea9b35f099333b48e2b6615d6d"
"Summer Walker Is 'Still Over It' With Sophomore Album","Hypebeast","Summer Walker's sophomore studio record Still Over It has arrived.Clocking in at just a little over an hour, the 20-track project is billed as a chronological progression of stories evidenced by the song titles. Still Over It boasts an impressive slate of guest appearances from the likes of Cardi B on Bitter, JT From City Girls on Ex For A Reason, SZA on No Love, Ari Lennox on Unloyal, Lil Durk on Toxic, Pharrell and the Neptunes on Dat Right There, Omarion on Screwin and Ciara o","2021-11-05 06:47:22","Fashion","https://hypebeast.com/2021/11/summer-walker-still-over-it-album-stream","79d9597b677f44a6d27796b62163c07a0aafac53a6e4779f3dbfdec28f8c7fcb","41cd65e71d7f3a4611a45cdeb6f2c3be"
"New Balance Clads Its 57/40 With CORDURA and Earth Tones","Hypebeast","New Balance has given its 57/40 a CORDURA treatment for this latest women's exclusive offering. The Boston-based sportswear powerhouse has decked a number of its silhouettes with the durable fabric technology such as the 996 collaboration with the Japanese clothing brand Journal Standard and a trio of CM997H models.The latest offering is part of the All-Terrain Pack with black and gray editions along with another trio of 574s as a nod to the brand's hiking legacy. Despite the construction utiliz","2021-11-05 06:46:24","Fashion","https://hypebeast.com/2021/11/new-balance-57-40-cordura-m5740cd1-release-info","79d9597b677f44a6d27796b62163c07a0aafac53a6e4779f3dbfdec28f8c7fcb","2ef1f77155cd74965193dde0b62624f0"
"Anderson .Paak Launches His Own Record Label APESHIT INC.","Hypebeast","Grammy Award-winning artist Anderson .Paak has officially launched his new record label, APESHIT INC.In a pre-recorded press conference video, the artist announced that he wants to focus on raw talent and highlight artists who can play their own instruments. Paak feels as if there is currently a gap in the market for these kinds of artists and hopes that APESHIT INC. provides new-age musicians with a label that helps them flourish. In the clip, the artist can be heard describing the ethos of h","2021-11-05 06:15:03","Fashion","https://hypebeast.com/2021/11/anderson-paak-launches-own-record-label-apeshit-inc-announcement","79d9597b677f44a6d27796b62163c07a0aafac53a6e4779f3dbfdec28f8c7fcb","4ec997a3b762bbd333393442e1d366a1"
"Taika Waititi Reveals Plans To Adapt Alejandro Jodorowsky's Graphic Novel 'The Incal'","Hypebeast","Taika Waititi is set to adapt Alejandro Jodorowsky's graphic novel The Incal.The original 1970s novel is the first in the series, is a collaborative piece between Jodorowsky and cult filmmaker Moebius. The Incal was what launched the Jodoverse and includes titles such as The Metabarons and Megalex in the comics. Waititi could potentially give a guiding hand in bringing the Jodoverse to film and television. In a recent interview with The Hollywood Reporter, Waititi mentioned that he received the ","2021-11-05 06:13:59","Fashion","https://hypebeast.com/2021/11/taika-waititi-adapt-alejandro-jodorowsky-graphic-novel-the-incal-announcement","79d9597b677f44a6d27796b62163c07a0aafac53a6e4779f3dbfdec28f8c7fcb","915510af048164fde89d7f22ff0b2671"
"Travis Scott Releases Updated Version of ESCAPE PLAN and New Track MAFIA With J. Cole","Hypebeast","Travis Scott has delivered the updated version of ESCAPE PLAN and the brand new single entitled MAFIA, the latter of which features an appearance from J. Cole.ESCAPE PLAN was first debuted live by Scott at Rolling Loud New York, when he publicly performed the new verse, after several teasers. Meanwhile, MAFIA hears production from Jahaan Sweet and Boi-1da and a contribution from J. Cole. Scott initially teased the release of new music on social media just before Astroworld Festival, writ","2021-11-05 04:59:37","Fashion","https://hypebeast.com/2021/11/travis-scott-escape-plan-mafia-stream","79d9597b677f44a6d27796b62163c07a0aafac53a6e4779f3dbfdec28f8c7fcb","e48756f60366224a3d851f7efb9e1d79"
"BEAMS Taps Matsuzaki Bokken Workshop for a Bespoke Wooden Sword","Hypebeast","For its latest specialty offering, Japanese retailer and label BEAMS enlists Matsuzaki Bokken Workshop for a bespoke red oak wooden sword.Matsuzaki Bokuto Seisakujo, which translates to Matsuzaki Bokken Workshop, is a small family business founded by Matsuzaki Yoshinori who began manufacturing Bokken swords used for Kendo training in 1968. At 64 years old, he's a second-generation master who runs the shop with his son and wife. This particular sword is made by hand from the red oaks of Southern ","2021-11-05 04:40:48","Fashion","https://hypebeast.com/2021/11/beams-japan-matsuzaki-wood-sword-factory-bespoke-red-oak-sword-56-78-0701-784-release-info","79d9597b677f44a6d27796b62163c07a0aafac53a6e4779f3dbfdec28f8c7fcb","d5927903e5190bd832d9e3c05ffd1b38"
"'League of Legends' Celebrates 'Arcane' Premiere With a Jinx 'Fortnite' Skin","Hypebeast","The premiere of Netflix and Riot Games' Arcane animated series is just around the corner, and now League of Legends is celebrating its launch by collaborating with Epic Games by creating a Jinx skin for the massively popular battle royale Fortnite.Aside from creating a screen-accurate character model of Jinx based on her look from Arcane, as usual the game is also offering a range of items based on her, including a Dream Monkey Back Bling, a Pow Pow Crusher Pickaxe, an instrumental Playground Lo","2021-11-05 04:38:34","Fashion","https://hypebeast.com/2021/11/league-of-legends-arcane-jinx-fortnite-skin-release","79d9597b677f44a6d27796b62163c07a0aafac53a6e4779f3dbfdec28f8c7fcb","5e8075aacdbc9dd38964ad0ebe7a748f"
"Spider-Man Joins 'Marvel's Avengers' as a PlayStation Exclusive","Hypebeast","More than a year after the game's original release, your friendly neighborhood Spider-Man is finally joining the team on Square Enix and Crystal Dynamics' Marvel's Avengers.Unveiling its roadmap for the game over on Twitter, the developer revealed that a whole range of new updates will be dropping on November 30, including a special hero event that will introduce Spider-Man into the Avengers lineup — but only for those on the PlayStation 4 or PlayStation 5. The addition shouldn't come as a surpr","2021-11-05 04:33:21","Fashion","https://hypebeast.com/2021/11/square-enix-marvels-avengers-spider-man-playstation-exclusive","79d9597b677f44a6d27796b62163c07a0aafac53a6e4779f3dbfdec28f8c7fcb","483906dad036edbcf2e51899f83a29c3"
"A Truck Full of NVIDIA RTX 30 Series Graphics Cards Was Robbed","Hypebeast","Between being affected by supply chain delays, global microchip shortages and increased interest in cryptocurrency mining, demand for graphics cards has skyrocketed, with secondary market prices soaring. Unfortunately, in light of this, some have resorted to crime, and now a truckload of NVIDIA graphics cards has been stolen.The news broke on EVGA's own forum, where product manager Jacob Freeman revealed that at the end of October, a shipment of its GeForce RTX 30 series graphics cards had been ","2021-11-05 04:27:47","Fashion","https://hypebeast.com/2021/11/evga-nvidia-rtx-30-series-graphics-cards-truck-shipment-robbed","79d9597b677f44a6d27796b62163c07a0aafac53a6e4779f3dbfdec28f8c7fcb","f924f113526d59b65c83f5e97be27217"
"LeBron James Expected To Miss At Least One Week of Games Due To Abdominal Injury","Hypebeast","Los Angeles Lakers superstar, LeBron James is officially missing even more games at the start of the season due to an abdominal injury.Just a couple of weeks ago, James suffered a minor ankle injury that caused him to miss a few games. However, he was able to make it back to the starting lineup and help the Lakers to a few wins before now, having to sit out once again, due to another injury. The Lakers have had a rough start to the NBA season despite their wins. With James ruled out for the game","2021-11-05 04:26:19","Fashion","https://hypebeast.com/2021/11/nba-los-angeles-lakers-lebron-james-abdominal-injury-report","79d9597b677f44a6d27796b62163c07a0aafac53a6e4779f3dbfdec28f8c7fcb","c46f2e2b578651e9b416354cf3fdfd40"
"Waymo's Self-Driving Vehicles Arrive on New York City Streets","Hypebeast","After rolling out in several cities including San Francisco, Google's Waymo brings its self-driving vehicles to the bustling New York City streets.As the most densely populated city in the United States with unusual road geometrics, complex intersections, and constantly evolving layouts, the Waymo Driver arrives in New York City to build on its learnings and map the city for the first time. Driving through ice and snow conditions in the city this coming winter will allow Waymo Driver to apply ","2021-11-05 04:25:46","Fashion","https://hypebeast.com/2021/11/waymo-driver-new-york-city-arrival-news","79d9597b677f44a6d27796b62163c07a0aafac53a6e4779f3dbfdec28f8c7fcb","493588dbd279aa576b40402762463479"
"Silk Sonic Is Smokin' Out the Window With Latest Single","Hypebeast","Anderson .Paak and Bruno Mars have delivered their brand new Silk Sonic single, Smokin' Out the Window.Clocking in at over three minutes, the cut arrives with an accompanying music video co-directed by Mars and John Esparza, which sees the pair continuing their '70s motif complete with orange and brown hues. Smokin' Out the Window follows predecessor singles Skate and Leave the Door Open, with all three singles set to appear on their forthcoming debut album An Evening With Silk Sonic.The","2021-11-05 04:22:07","Fashion","https://hypebeast.com/2021/11/silk-sonic-anderson-paak-bruno-mars-smokin-out-the-window-single-stream-music-video","79d9597b677f44a6d27796b62163c07a0aafac53a6e4779f3dbfdec28f8c7fcb","ee32ad837e7e129de65931b6586be874"
