"Spalding's 'Fundamentals' Collection Fuses On and Off-Court Style","Hypebeast","Known for its signature basketball equipment, Spalding is expanding its apparel offerings with the launch of its new “Fundamentals” collection.The latest clothing offering from the brand features a selection of staple pieces like hoodies, sweatpants, shorts and t-shirts - coming in black, cream, dusty blue and light purple. Fit for the street or a basketball court, the collection garments are constructed from heavyweight brushed fleece and feature a new silicone Spalding logo. Topping off the co","2021-11-01 21:42:46","Fashion","https://hypebeast.com/2021/11/spalding-fundamentals-collection-info","79d9597b677f44a6d27796b62163c07a0aafac53a6e4779f3dbfdec28f8c7fcb","7e5b0ec5b51cef383c658dd52cbe08a2"
"Salt & Straw Turns Traditional Thanksgiving Meals Into Savory Ice Cream Flavors","Hypebeast","Salt & Straw — the world's largest small-batch ice cream company — has transformed traditional Thanksgiving meals into a selection of ice cream flavors ahead of the holiday.Dubbed the Friendsgiving Series, the brand's latest batch of flavors breathes new life into classic recipes. Parker House Rolls with Salted Buttercream smears buttery rolls with fresh-churned buttercream and a pinch of flaky sea salt. From there, the ice cream makers gently churn the spongy rolls into salted sweet cream. ","2021-11-01 21:27:12","Fashion","https://hypebeast.com/2021/11/salt-and-straw-thanksgiving-ice-cream-flavors","79d9597b677f44a6d27796b62163c07a0aafac53a6e4779f3dbfdec28f8c7fcb","da1839b5086565b4a44a05f542d268db"
"Students Launches Inaugural First On The Tee Box Collection","Hypebeast","Following weeks of styled looks on Instagram, Huntington Beach, CA based golf brand Students, founded by Michael Huynh, has now entirely unveiled its inaugural collection.Students Collection 001 is titled First On The Tee Box Collection with its Fall/Winter 2021 range outlined by prominent graphic-driven T-shirts designs and offerings. Attributes that are found throughout the tops and bottoms follow an athletic fashion. While Students' process is to elevate and excite the emotional endeavor th","2021-11-01 21:23:06","Fashion","https://hypebeast.com/2021/11/students-first-on-the-tee-box-collection","79d9597b677f44a6d27796b62163c07a0aafac53a6e4779f3dbfdec28f8c7fcb","aa97808cb1eb5d06c768df986df2d17e"
"HANON Partners With Mizuno and Nagoya Grampus for a Soccer-Inspired Capsule","Hypebeast","Over the last year, Mizuno and Japanese soccer team Nagoya Grampus have collaborated on a series of capsule collections that pay homage to the club’s ‘93 jersey. Now, HANON has joined in on the effort to redesign the signature jersey.For the collaborative capsule, the brands illustrate Nagoya Grampus’ history through the usage of city-related symbolism. The soccer team’s name comes from the two holden Grampus dolphins on top of Nagoya Castle and the Maru-Hachi, which is the city’s official symbo","2021-11-01 21:07:22","Fashion","https://hypebeast.com/2021/11/hanon-mizuno-nagoya-grampus-soccer-capsule-collection-info","79d9597b677f44a6d27796b62163c07a0aafac53a6e4779f3dbfdec28f8c7fcb","0a1bd195d23ef405df2647fd9ce41eb0"
"EVISU Celebrates Its 30th Anniversary With New Denim Essentials","Hypebeast","Throughout its history, Japanese brand EVISU has become known for its denim offerings and the brand’s signature seagull print. For its 30th anniversary, EVISU presents a new capsule collection that furthers founder Hidehiko Yamane’s vision of elevated denim with a vintage twist.Featuring a Japanese numeral 30 to represent the anniversary, the new collection includes signature EVISU details like the multi-pocket style, colorful seagull, the Godhead and the Ebisu on a range of denim essentials. ","2021-11-01 20:16:01","Fashion","https://hypebeast.com/2021/11/evisu-30th-anniversary-capsule-collection-info","79d9597b677f44a6d27796b62163c07a0aafac53a6e4779f3dbfdec28f8c7fcb","fdc1cc51bc25b7b0b8a564a9333afeed"
"Elon Musk Offers to Sell $6 Billion USD of Tesla Stock to 'Solve World Hunger'","Hypebeast","Elon Musk has offered to sell $6 billion USD of Tesla stock to solve world hunger.Last month, David Beasley, the director of the United Nations' World Food Program challenged Musk to donate a portion of his wealth to help alleviate the global hunger crisis on Twitter.“Congratulations to @elonmusk for passing up @JeffBezos as the world’s richest person,” Beasley wrote. “Elon, to celebrate I’m offering you a once in a lifetime opportunity: help us save 42M people from starvation for just $6.6B!!","2021-11-01 19:54:10","Fashion","https://hypebeast.com/2021/11/elon-musk-offers-to-sell-6-billion-tesla-stock-solve-world-hunger","79d9597b677f44a6d27796b62163c07a0aafac53a6e4779f3dbfdec28f8c7fcb","bf2d4a032a93b0fbc0187664cd19f7a8"
"Nike Officially Unveils the 2021-22 NBA City Edition Uniforms","Hypebeast","The 2021-2022 NBA season officially kicked off, and it's already been quite electrifying seeing the teams battle it out on the floor with high-flying dunks, multiple overtimes and even new referee rules when it comes to drawing fouls. And as the season proceeds along with its 75th anniversary celebrations, it's tapped its official sponsors at Nike to manufacture a brand new City Edition uniform for each of the 30 teams, all of which have now been officially unveiled.Both parties have been linked","2021-11-01 19:17:27","Fashion","https://hypebeast.com/2021/11/nike-nba-city-edition-uniforms-2021-22-release-info","79d9597b677f44a6d27796b62163c07a0aafac53a6e4779f3dbfdec28f8c7fcb","e06fa2419e0ca89fb1d917c94d6f85c9"
"Moncler and HOKA Elevate the Mafate Speed 2 Trail Running Shoe","Hypebeast","Performance footwear and apparel brand HOKA has teamed up with Moncler to reimagine the Mafate Speed 2 running shoe.The redesigned silhouette is suited for the mountains with an all-terrain performance-ready construction. The shoe features a white and silver design with HOKA’s signature geometry and the Moncler and HOKA names. With a focus on technical terrains, the shoe features a thick midsole for support and a Vibram Megagrip outsole for added traction. The footwear is finished off with Moncl","2021-11-01 18:57:35","Fashion","https://hypebeast.com/2021/11/moncler-x-hoka-mafate-speed-2-info","79d9597b677f44a6d27796b62163c07a0aafac53a6e4779f3dbfdec28f8c7fcb","a12366089ad6c249d17351e10aaa93a1"
"George Condo Unveils Ideals of the Unfound Truth at Hauser & Wirth","Hypebeast","As one of the premier contemporary artists working today, George Condo recently unveiled a massive exhibition at Shanghai's impressive Long Museum. To follow, the New York-based artist has debuted a new series of drawings and paintings at Hauser & Wirth London, titled Ideals of the Unfound Truth. The exhibition features an array of Condo's invented characters who represent different states of mind captured in an abstract web that reveals the complex humanity that is riddled within the psyche. ","2021-11-01 18:49:08","Fashion","https://hypebeast.com/2021/11/george-condo-ideals-of-the-unfound-truth-hauser-and-wirth","79d9597b677f44a6d27796b62163c07a0aafac53a6e4779f3dbfdec28f8c7fcb","b25a1c76a8fc6af6d675dcfa6485a6c8"
"Here's What Jupiter's 'Beautiful and Violent Atmosphere' Looks Like in 3D","Hypebeast","NASA's Juno probe has captured a deeper view of Jupiter's atmosphere.Scientists have developed the first three-dimensional look at Jupiter's atmospheric layers, showcasing the mechanics of the planet's turbulence in greater detail. The results examine the inner workings of the belts and zones of clouds that circle the planet, along with its polar cyclones and its Great Red Spot.“These new observations from Juno open up a treasure chest of new information about Jupiter’s enigmatic observable feat","2021-11-01 18:11:36","Fashion","https://hypebeast.com/2021/11/nasa-juno-spacecraft-jupiter-3d-images","79d9597b677f44a6d27796b62163c07a0aafac53a6e4779f3dbfdec28f8c7fcb","351f9a652bab9ac642c461e2d3669759"
"Drake's New Insanely Colorful Diamond Chain Is Made Up of 23 Emojis","Hypebeast","Drake is doubling up on new chains this time of the year with a colorful emoji piece from NYC Luxury. This news comes just days after his birthday celebration where Young Thug gifted him a diamond Adonis chain by Eliantte.One of his most colorful pieces of jewelry to date, this choker-length chain features many of Drake's most used emojis in a bevy of colored precious stones. From the Certified Lover Boy emoji, owl, brain, splashing sweat, piano keys, mending heart, eggplant, devil, money bag,","2021-11-01 18:10:04","Fashion","https://hypebeast.com/2021/11/drake-new-nyc-luxury-emoji-chain","79d9597b677f44a6d27796b62163c07a0aafac53a6e4779f3dbfdec28f8c7fcb","c7f204649a83dfd5162bc7cf256e95c4"
"Globe-Trotter Updates Home Accessories Line With New Poker Box and Alessi Cocktail Set","Hypebeast","Globe-Trotter is adding two new premium home goods to its lineup in time for the Holidays season. Set around the festive times when entertaining guests is a must -- either through drink or games -- the lifestyle accessories arrive in the form of the Centenary Poker Box and the Globe-Trotter x Alessi Cocktail Set. The former set features five premium dice, four sets of poker chips, two sets of Globe-Trotter’s north star logo-branded playing cards, and a leather dealer counter. The second offering","2021-11-01 17:30:31","Fashion","https://hypebeast.com/2021/11/globe-trotter-centenary-poker-box-alessi-cocktail-set-release","79d9597b677f44a6d27796b62163c07a0aafac53a6e4779f3dbfdec28f8c7fcb","8e4f0a725bcdeb2f6137b8d5e81eee71"
"Taschen Chronicles the History of Witchcraft in New Art Book","Hypebeast","Halloween may be over, but that doesn't mean the spookiness needs to stop. Global artbook purveyor, Taschen, has released Witchcraft: The Library of Esoterica, which chronicles the history of folklore from its ancient roots to its modern incarnations. Edited by Jessica Hundley, and co-edited by author, scholar, and practitioner Pam Grossman, the book takes a deep dive into the many archetypes the witch has taken throughout the course of time. From the legend of Odysseus and the Celtic seductress","2021-11-01 17:20:46","Fashion","https://hypebeast.com/2021/11/tascen-witchcraft-the-library-of-estorica","79d9597b677f44a6d27796b62163c07a0aafac53a6e4779f3dbfdec28f8c7fcb","dd3eec06dfc7a85fca123c501200d831"
"Detailed Shots of the Off-White™ x Nike Air Force 1 Mid in White","Hypebeast","Even after creating a whopping 50 Dunk colorways with Nike, Virgil Abloh has plenty of footwear collaborations in his cannon that he plans on unloading in the coming months and in 2022. Up next for the talented designer are Off-White™ x Nike Air Force 1 Mid makeups, and its white colorway has just surfaced again by way of detailed imagery.The Air Force 1 Mid is often seen as a clean and classic silhouette that's build with smooth leather uppers and crisp bottoms, but given that this is another t","2021-11-01 17:18:25","Fashion","https://hypebeast.com/2021/11/off-white-nike-air-force-1-mid-white-do6290-100","79d9597b677f44a6d27796b62163c07a0aafac53a6e4779f3dbfdec28f8c7fcb","ef8110ce8078658b7f6a7785ea864d2c"
"SUBU. and Garbstore Has Your Winter Footwear Sorted","Hypebeast","Described as “packable, warm down-jackets for your feet”, SUBU.’s winter slippers are about as cozy as they come. Following the launch of the Japanese label’s extensive Fall/Winter 2021 collection, it’s now teamed up with London-based retailer Garbstore for a striking tie-dye iteration.SUBU. — which is a shortened version of the Japanese expression sutto haku būtsu, which means slip-on shoes — was only founded in 2018, but has already garnered quite the reputation thanks to its warm, packable fo","2021-11-01 17:00:17","Fashion","https://hypebeast.com/2021/11/subu-garbstore-winter-sandals-collab-release-info","79d9597b677f44a6d27796b62163c07a0aafac53a6e4779f3dbfdec28f8c7fcb","4764613c9d1d6f858dfef8e09432de33"
"White Mountaineering’s Yosuke Aizawa on Family, Functionality, and Collaboration","Hypebeast","When Yosuke Aizawa founded White Mountaineering in 2006, it was a shining example of how to turn a passion into a career. Aged just 22 at the time, Aizawa -- who is an alumnus of Tokyo’s Tama Art University and a former protégée of Junya Watanabe -- merged his admiration for the outdoors with a love for design and fashion, to create what is now regarded as one of the most innovative outerwear labels on the market.Alongside its seasonal releases, the Tokyo-based label has become renowned for its ","2021-11-01 16:13:50","Fashion","https://hypebeast.com/2021/11/white-mountaineering-yosuke-aizawa-uniqlo-feature-interview","79d9597b677f44a6d27796b62163c07a0aafac53a6e4779f3dbfdec28f8c7fcb","e2a77bd4bc25b3ab912a9f5183e8b447"
"First Look at Rui Hachimura's Air Jordan 8 SE Collaboration","Hypebeast","Rui Hachimura has yet to play a single minute in the 2021-2022 NBA season due to personal reasons that caused him to miss training camp and the first week of regular season games. And despite his playing career being a little foggy at the moment, one thing that is for certain is that his footwear collaborations with Jordan Brand will be pushing forward with new styles soon. The latest to appear is the Rui Hachimura x Air Jordan 8 SE, which is a refreshing sight to see considering that most of th","2021-11-01 16:06:20","Fashion","https://hypebeast.com/2021/11/rui-hachimura-air-jordan-8-se-release-date","79d9597b677f44a6d27796b62163c07a0aafac53a6e4779f3dbfdec28f8c7fcb","5f7db89e387084c754834b9732f20be7"
"Another Travis Scott x Nike Air Max 1 Colorway Has Surfaced","Hypebeast","After aligning with Hiroshi Fujiwara and his fragment design label for a duo of Air Jordan 1 collaborations, Travis Scott is in preparation to expand upon his highly sought after footwear catalog by now connecting back with the Nike family. Up next for La Flame and the Swoosh is a full collection of Air Max 1s, and the latest colorway has just surfaced.This newest makeup to emerge bears close resemblance to the Baroque Brown rendition, but it features tiny tweaks in its upper presentation that","2021-11-01 15:23:26","Fashion","https://hypebeast.com/2021/11/travis-scott-nike-air-max-1-do9392-701-release-info","79d9597b677f44a6d27796b62163c07a0aafac53a6e4779f3dbfdec28f8c7fcb","8497f059d7c5298fac053b1c0709d2e0"
"'The Book of Boba Fett' Trailer Uncovers the Bounty Hunter's Next Chapter","Hypebeast","Disney+ has dropped the official trailer for The Book of Boba Fett, Lucasfilm's latest series that was first announced in the end-credit sequence after the season two finale of The Mandalorian.The trailer plays into the The Madalorian's mixture of past and present, making several mentions of characters, names and places from the original film and introducing a new underworld plot that will be added to the franchise.The series “finds legendary bounty hunter Boba Fett and mercenary Fennec Shand na","2021-11-01 15:10:35","Fashion","https://hypebeast.com/2021/11/the-book-of-boba-fett-official-trailer","79d9597b677f44a6d27796b62163c07a0aafac53a6e4779f3dbfdec28f8c7fcb","a3d076b3b188e5ab80bce3fdd3253565"
"Tropicana Is Resolving the Unpalatable Combination of O.J. and Toothpaste","Hypebeast","When you bring together two individually great things, sometimes you get an even better combination, like peanut butter and chocolate or a burger and fries. On the contrary, a bad pairing has the opposite effect. Take for example, the classic morning glass of orange juice with the typical A.M. task of brushing one’s teeth, which has long been a hot topic of conversation on social media. Thankfully, Tropicana is making mornings brighter with its new limited-edition Tropicana Toothpaste, which dro","2021-11-01 14:56:59","Fashion","https://hypebeast.com/2021/11/tropicana-limited-edition-toothpaste-orange-juice-friendly","79d9597b677f44a6d27796b62163c07a0aafac53a6e4779f3dbfdec28f8c7fcb","dd2f4e77ad4640a00382b8a0572692d2"
"Facebook Recently Verified a Bitcoin Scammer Posing as Elon Musk","Hypebeast","Facebook recently mistakenly verified a fan page for Elon Musk as the tech mogul's own official account.The Verge reported that the fan account had 153,000 followers but at the time of reporting, the page has been taken down. To clarify, the page had clearly stated that it was a fan page in its About section,Musk owns a Tesla Roadster car 0001 (the first one off the production line) from Tesla Motors, a company in which he is an early investor. The Roadster is a battery electric sportscar wit","2021-11-02 07:24:41","Fashion","https://hypebeast.com/2021/11/facebook-verified-bitcoin-scammer-posing-as-elon-musk","79d9597b677f44a6d27796b62163c07a0aafac53a6e4779f3dbfdec28f8c7fcb","b384679c0a5db009ba8d916ad1bd2263"
"Coca-Cola Reported to Buy BodyArmor Stake from Kobe Bryant Estate for $400 Million USD","Hypebeast","Earlier this week, Coca-Cola announced its acquisition of BodyArmor in its largest-ever brand acquisition, with a $5.6 billion USD price tag. The full 85% acquisition filed with the Federal Trade Commission comes after Coca-Cola acquired a 15% stake in the company back in 2018.It is interesting to note that the sale could see Kobe Bryant's estate receive over $400 million USD to settle the late basketball star's stake in the sports drink brand. Back in 2014, Bryant invested $6 million USD in Bod","2021-11-02 07:24:29","Fashion","https://hypebeast.com/2021/11/coca-cola-kobe-bryant-estate-400-million-usd-bodyarmor-stake-sale-info","79d9597b677f44a6d27796b62163c07a0aafac53a6e4779f3dbfdec28f8c7fcb","4aaa71a07fabb534f41241f7f64bf4d3"
"Take a First Look at the CLOT x Air Jordan 5 Low","Hypebeast","Continuing its storied relationship with Nike, CLOT is now rumored to be releasing an Air Jordan 5 Low collaboration.Either set to round up the year or kick off the new year, the upcoming team-up follows the streetwear imprint's Air Jordan 14 Low Terracotta and Air Jordan 35 Warrior Jade releases seen earlier this year.The take on Jordan Brand's AJ5 Low model features a black nubuck base accented by red sockliners and laces. Additional detailing comes in the form of 3M reflective tongues, ja","2021-11-02 07:22:15","Fashion","https://hypebeast.com/2021/11/clot-air-jordan-5-low-first-look-release-info","79d9597b677f44a6d27796b62163c07a0aafac53a6e4779f3dbfdec28f8c7fcb","99d1d2445acd669e308b588b80b7a6df"
"Burger King Japan Launches Cheddarich Cheese-Filled Chicken Nuggets","Hypebeast","Adding to its unique limited menu offerings, Burger King Japan has now introduced Cheddarich Chicken Nuggets.Perfect for cheese lovers, the golden fried morsels of juicy chicken are filled with melted cheddar cheese. The Cheddarich Chicken Nuggets are set to be available for a limited time only and serve as an inventive take on the common fast-food side. Most recently, Burger King Japan added Guilty Butter Burgers and Clown Chocolate Fries to its menu to redefine guilty pleasures.Priced at ¥21","2021-11-02 07:16:22","Fashion","https://hypebeast.com/2021/11/burger-king-japan-cheddarich-cheese-filled-chicken-nuggets-launch-info","79d9597b677f44a6d27796b62163c07a0aafac53a6e4779f3dbfdec28f8c7fcb","63ef4afe3043368c1385b757309d3b37"
"Norman Reedus and Sean Patrick Flanery Are Returning for 'Boondock Saints III'","Hypebeast","It is official. Norman Reedus and Sean Patrick Flanery will be reprising their roles as the MacManus brothers -- Murphy and Connor -- for Boondock Saints III.According to Deadline, creator Troy Duffy will be directing the third instalment and co-wrote the story with Sean Patrick Flanery with Reedus serving as one of the executive producers.Duffy comments, The fans have loved these characters for twenty years. They use terms of endearment like 'the Brothers' or 'the Boys.' We left them in jail a","2021-11-02 07:08:00","Fashion","https://hypebeast.com/2021/11/boondock-saints-3-norman-reedus-sean-patrick-flanery-reprise-roles","79d9597b677f44a6d27796b62163c07a0aafac53a6e4779f3dbfdec28f8c7fcb","79b084fe0b2c1e9858810bacb285d40a"
"Diego Rivera's City of Arts in Mexico Realized After 80 Years","Hypebeast","After 80 long years, Diego Rivera's City of Arts has finally come to fruition in an effort to provide a vast sanctuary for like-minded individuals come together and enjoy art in varying forms and activities. The oasis is 64,600 square feet composed of gardens, workshops, and performance and exhibition spaces that surround the Anahuacalli Museum found in Coyoacán, Mexico as per newspaper publication El País.Although the Mexican artist passed away in 1957 without seeing the completion of the Ana","2021-11-02 07:07:24","Fashion","https://hypebeast.com/2021/11/diego-rivera-city-of-the-arts-anahuacalli-museum","79d9597b677f44a6d27796b62163c07a0aafac53a6e4779f3dbfdec28f8c7fcb","f983505218854146666b381b2ea623ba"
"Rolling Stone Unveils First Ever Digital Cover NFTs With Bored Ape Yacht Club","Hypebeast","Rolling Stone is officially diving into the world of NFTs, announcing its first ever digital cover NFT created in partnership with Bored Ape Yacht Club (BAYC).The publication and BAYC will mint a digital cover image as an NFT, and will serve as one of two pieces from the collaboration that utilizes Rolling Stone's logo. The full collection will feature a total of seven NFTs, including the two logo-infused animated cover designs by Yuga Labs and five commissioned pieces by NFT artists, each of wh","2021-11-02 07:06:28","Fashion","https://hypebeast.com/2021/11/rolling-stone-bored-ape-yacht-club-digital-cover-nfts-announcement","79d9597b677f44a6d27796b62163c07a0aafac53a6e4779f3dbfdec28f8c7fcb","0d53a586abf250e64f1ecc3d7ccacb39"
"INVINCIBLE and The North Face Release Joint METAVERSE EXPLORER Capsule","Hypebeast","For the duo's third consecutive winter collaboration, Taiwanese streetwear boutique INVINCIBLE continues its relationship with The North Face with a new METAVERSE EXPLORER capsule, enlisting Japanese stylist Akio Hasegawa for the project to inject a unique point of view.The upcoming collection drapes The North Face's classic Mountain Light Jacket and Nuptse Jacket in neon virtual galaxy visuals. Revolving around the concept, imagination of the future in the 20th century, the bold outwear pie","2021-11-02 06:40:28","Fashion","https://hypebeast.com/2021/11/invincible-north-face-collab-collection-release-info","79d9597b677f44a6d27796b62163c07a0aafac53a6e4779f3dbfdec28f8c7fcb","388e87a7f1e8a0537c8bbb7ff88553d2"
"Chris Pratt Set to Star as Garfield in New Animated Feature","Hypebeast","Chris Pratt has officially signed on to voice the titular, lasagna-loving, orange feline Garfield in a new animated movie.Jim Davis, who created the Garfield character first published the comics in 1978. The lazy, Monday-hating cat was known to cause trouble for his human owner, Jon Arbuckle and their household dog Odie. Garfield debuted in 41 newspapers and presently holds the record for the most widely syndicated comic strip in the world. The script for the new animated film is written by Fi","2021-11-02 06:14:11","Fashion","https://hypebeast.com/2021/11/chris-pratt-voice-garfield-new-animated-feature-announcement","79d9597b677f44a6d27796b62163c07a0aafac53a6e4779f3dbfdec28f8c7fcb","56768a30876fdc32251ad641b64acb30"
"It's Seto Kaiba Versus Yami Yugi in Seiko's New 'Yu-Gi-Oh!' Watch Release","Hypebeast","Yu-Gi-Oh! is teaming up with Seiko for more celebratory collaborations. Themed on Seto Kaiba/Kaiba Corp. and Yami Yugi, the 40mm watches are powered by a quartz movement and are joined with a calfskin strap.Each watch maintains the character's color scheme as seen in the gold-colored case of the Yami Yugi model -- referencing the Millennial Puzzle. Other details include a Millennial Puzzle print at 12 o'clock, a black dial, Yu-Gi-Oh! engraving at the caseback, a Yami Yugi display box, and both t","2021-11-02 04:33:34","Fashion","https://hypebeast.com/2021/11/yu-gi-oh-duel-monsters-seiko-yami-yugi-seto-kaiba-release","79d9597b677f44a6d27796b62163c07a0aafac53a6e4779f3dbfdec28f8c7fcb","4365359fdf7cde16d2edb53a955bfb93"
"Denver Broncos Trade Von Miller to Los Angeles Rams for Two 2022 NFL Draft Picks","Hypebeast","Denver Broncos have officially announced the trade of their star linebacker Von Miller. Miller will be heading to the Los Angeles Rams in exchange for two draft picks for the 2022 NFL season.Miller has spent the past decade playing for the Broncos and has been a staple amongst NFL fans. While the news may be surprising for many to see the player that helped the Broncos to their 2016 Super Bowl win go to Los Angeles, Miller has been dealing with many injuries in the last few years. These injuries","2021-11-02 04:33:25","Fashion","https://hypebeast.com/2021/11/nfl-von-miller-denver-broncos-trade-to-los-angeles-rams-announcement","79d9597b677f44a6d27796b62163c07a0aafac53a6e4779f3dbfdec28f8c7fcb","6a801e5bad3a29ea4018e2331f033bda"
"Catch Some Ghosts With Three New 'Luigi's Mansion' LEGO Sets","Hypebeast","LEGO has unveiled a series of new Luigi's Mansion sets, scheduled to arrive in 2022.The brand will be offering three Expansion Sets focused on the popular Nintendo series, namely the Luigi’s Mansion™ Lab and Poltergust Expansion Set, Luigi’s Mansion™ Entryway Expansion Set and Luigi’s Mansion™ Haunt-and-Seek Expansion Set. Players can use a LEGO Luigi or a LEGO Mario interactive figure from the previously-released Starter Courses for additional immersive sounds, music and extra interactivity.The","2021-11-02 04:32:30","Fashion","https://hypebeast.com/2021/11/three-new-luigis-mansion-lego-sets-release-info","79d9597b677f44a6d27796b62163c07a0aafac53a6e4779f3dbfdec28f8c7fcb","70e81d0beff125ee8a27b84817df89d0"
