"‘Typist Artist Pirate King’: Monica Dolan, Kelly Macdonald & Gina McKee Set For Carol Morley Road Movie; Jane Campion Among Exec Producers — AFM","Deadline","EXCLUSIVE: BAFTA-nominee Carol Morley (Out Of Blue) is underway in Yorkshire, England, on under-the-radar new feature Typist Artist Pirate King, which will star BAFTA winner Monica Dolan (The Dig), Golden Globe and BAFTA nominee Kelly Macdonald (Boardwalk Empire) and BAFTA winner Gina McKee (Phantom Thread). Metro International has boarded sales on the feature and is […]","2021-11-04 11:05:17","Entertainment","https://deadline.com/2021/11/carol-morley-new-movie-monica-dolan-kelly-macdonald-jane-campion-1234867794/","7c15b03e7e61924c90edf327f30419ea9fa75d891484e9164931e717298b4fb9","be5ff6380c657e94b339b40e33addebe"
"‘The Challenge’: Russia’s Klim Shipenko & Yulia Peresild Talk Shooting First Film In Space – “It’s A Four-Dimensional World Up There”","Deadline","EXCLUSIVE: Last month Russian director Klim Shipenko and actor Yulia Peresild became the first ever film crew to boldly go into outer space to shoot scenes for their upcoming project The Challenge. The duo blasted off to the International Space Station in a Russian Soyuz on October 5 along with Russian cosmonaut Anton Shkaplerov where they […]","2021-11-04 13:00:54","Entertainment","https://deadline.com/2021/11/the-challenge-russia-klim-shipenko-yulia-peresild-first-film-space-four-dimensional-reality-1234867822/","7c15b03e7e61924c90edf327f30419ea9fa75d891484e9164931e717298b4fb9","50173c3f84d7c7c64378478924d1b605"
"Taika Waititi To Adapt Alejandro Jodorowsky’s Graphic Novel ‘The Incal’ As Film","Deadline","Oscar winner Taika Waititi (Jojo Rabbit, Reservation Dogs) has signed on to direct the first feature adaptation of Alejandro Jodorowsky and Mœbius’ bestselling graphic novel, The Humanoids, for Humanoids and Primer Entertainment. Waititi will also co-write the script for the project, marking Humanoids’ first foray into film, with his frequent collaborator Jemaine Clement (What We Do in […]","2021-11-04 13:00:20","Entertainment","https://deadline.com/2021/11/taika-waititi-to-adapt-alejandro-jodorowsky-graphic-novel-the-incal-as-film-1234867589/","7c15b03e7e61924c90edf327f30419ea9fa75d891484e9164931e717298b4fb9","f6860a89cb6e69eee1727774fdd032f1"
"Japan Society & ACA Cinema Project Series To Screen Works From Naomi Kawase, Sadao Yamanaka & More","Deadline","EXCLUSIVE: The second ACA Cinema Project series, “Flash Forward: Debut Works and Recent Films by Notable Japanese Directors,” has set its lineup for a hybrid program that will run from December 3-23. Presented by the New York-based non-profit Japan Society and the Japanese government’s Agency for Cultural Affairs, in collaboration with the Visual Industry Promotion […]","2021-11-04 12:50:32","Entertainment","https://deadline.com/2021/11/japan-society-aca-cinema-project-series-lineup-naomi-kawase-sadao-yamanaka-1234867799/","7c15b03e7e61924c90edf327f30419ea9fa75d891484e9164931e717298b4fb9","554f77d68e9241c96bb96bae956cd82e"
"ViacomCBS Reports Streaming Growth In Q3 But Overall Results Are Subdued","Deadline","ViacomCBS cracked the $1 billion mark in streaming revenue in the third quarter, but overall results were more subdued, with total revenue rising 13% to $6.6 billion and earnings per share declining to 69 cents. The revenue number just slipped past Wall Street analysts’ expectations, while the earnings-per-share tally, down from 92 cents in the […]","2021-11-04 11:34:05","Entertainment","https://deadline.com/2021/11/viacomcbs-third-quarter-earnings-streaming-paramount-plus-1234867826/","7c15b03e7e61924c90edf327f30419ea9fa75d891484e9164931e717298b4fb9","2249bf53a833adc00875083a8ad08849"
"Anonymous Content Signs ‘Azor’ Filmmaker Andreas Fontana","Deadline","EXCLUSIVE: Anonymous Content has signed Gotham Award-nominated filmmaker Andreas Fontana, whose feature debut Azor has played to acclaim at festivals including Berlin, San Sebastian and London. The Swiss writer-director was recently nominated for a Gotham Award for Best International Feature for Azor, which played in the Berlinale’s Encounters section and was then picked up by […]","2021-11-04 13:35:49","Entertainment","https://deadline.com/2021/11/anonymous-content-signs-azor-filmmaker-andreas-fontana-1234867842/","7c15b03e7e61924c90edf327f30419ea9fa75d891484e9164931e717298b4fb9","d86bb62f501b197f19626d98502ce109"
"Joe Biden’s Administration Sets January 4 As Vaccination Deadline For Large Companies","Deadline","Joe Biden’s administration has set January 4 as the deadline for large companies to ensure that their employees have been fully vaccinated or, if not, that the workers submit to testing at least once a week. The president announced in September that his administration would seek the new requirement, as the Delta variant surged and […]","2021-11-04 13:18:48","Entertainment","https://deadline.com/2021/11/joe-biden-vaccination-deadline-1234867867/","7c15b03e7e61924c90edf327f30419ea9fa75d891484e9164931e717298b4fb9","545b1782ff2afb65bd3ba2b537989434"
"Bollywood’s ‘Sooryavanshi’ Breaks Overseas Records; Sky Renews Code 404 – Global Briefs","Deadline","Bollywood’s ‘Sooryavanshi’ Breaks Overseas Records Bollywood’s Sooryavanshi by Rohit Shetty has been handed the largest international distribution of all time for an Indian pic, with 1300 screens set to air the film across 66 countries. The latest addition to Shetty’s ‘Cop-Universe’ franchise has secured 520 screens across 490 locations in North America alone. It will […]","2021-11-04 13:07:11","Entertainment","https://deadline.com/2021/11/sooryavanshi-overseas-records-global-briefs-1234867863/","7c15b03e7e61924c90edf327f30419ea9fa75d891484e9164931e717298b4fb9","c09f28fd4fa63f11e9bced0be0e45fc9"
"Holiday-Themed Candy House Unscripted Series Heads To Hulu","Deadline","EXCLUSIVE: Hulu has ordered Christmas-themed unscripted property series Candified: Home for the Holidays. The streamer has picked up the four-part series and will launch it on December 1. The series follows Candy Queen Jackie Sorkin and her team of candy artists design, glue, melt and shape hundreds of thousands of sweet pieces to build a […]","2021-11-04 15:00:04","Entertainment","https://deadline.com/2021/11/holiday-themed-candy-house-unscripted-series-heads-to-hulu-1234867548/","7c15b03e7e61924c90edf327f30419ea9fa75d891484e9164931e717298b4fb9","64bb70fd40c30d1dade9feb307273029"
"Saban Films Acquires Thriller ‘Dig’ For North America, France, Germany & More – AFM","Deadline","EXCLUSIVE: Saban Films has picked up North American rights to K. Asher Levin’s thriller Dig, starring Thomas Jane, Harlow Jane, Emile Hirsch and Liana Liberato. Saban has also taken French, German, Spanish and Scandinavian rights for the title and will distribute them via their respective global partners Splendid, Ace Entertainment, Mis.Label and Key2Media. Dig follows […]","2021-11-04 14:55:02","Entertainment","https://deadline.com/2021/11/saban-films-acquires-thriller-dig-north-america-france-germany-more-1234867917/","7c15b03e7e61924c90edf327f30419ea9fa75d891484e9164931e717298b4fb9","13aeed1c2a5b81e5a2224568fd3dcd62"
"‘Fiddler’s Journey To The Big Screen’: Jeff Goldblum-Narrated Doc About Norman Jewison Classic ‘Fiddler On The Roof’ Gets U.S. Deal","Deadline","EXCLUSIVE: Jeff Goldblum-narrated documentary Fiddler’s Journey To The Big Screen, about Norman Jewison classic Fiddler On The Roof, is getting U.S. distribution via Zeitgeizst Films and Kino Lorber. The movie charts the story behind director Norman Jewison’s quest to recreate the lost world of Jewish life in Tsarist Russia and re-envision the beloved stage hit […]","2021-11-04 14:35:34","Entertainment","https://deadline.com/2021/11/jeff-goldblum-fiddler-on-the-roof-documentary-us-release-1234867815/","7c15b03e7e61924c90edf327f30419ea9fa75d891484e9164931e717298b4fb9","c0060f099f4a024240c800e675bf6886"
"ViacomCBS Reports Q3 Streaming Growth But Subdued Overall Results; CEO Bob Bakish Says Release Windows Will Continue To Vary, Ad Revenue Hit By Supply Chain Issues – Update","Deadline","UPDATED with executive comments. ViacomCBS cracked the $1 billion mark in streaming revenue in the third quarter, but overall results were more subdued, with total revenue rising 13% to $6.6 billion and earnings per share declining to 69 cents. The revenue number just slipped past Wall Street analysts’ expectations, while the earnings-per-share tally, down from […]","2021-11-04 14:07:05","Entertainment","https://deadline.com/2021/11/viacomcbs-third-quarter-earnings-streaming-paramount-plus-1234867826/","7c15b03e7e61924c90edf327f30419ea9fa75d891484e9164931e717298b4fb9","520d18946343205ebf8ee702d6abc548"
"John Hyams To Adapt David Drayer’s Novella ‘Attachment’ For Paperclip","Deadline","EXCLUSIVE: Yeardley Smith and Ben Cornwell’s Paperclip Ltd., Nat Mundel’s Voyage Media and Chris Goldberg’s Winterlight Pictures have partnered to option David Drayer’s self-published novella Attachment for film, setting Black Summer creator-showrunner John Hyams to write and direct the adaptation. Attachment is a psychological horror story following a troubled psychologist who must leave his rationality behind […]","2021-11-04 16:00:55","Entertainment","https://deadline.com/2021/11/john-hyams-to-adapt-david-drayer-novella-attachment-for-paperclip-1234867890/","7c15b03e7e61924c90edf327f30419ea9fa75d891484e9164931e717298b4fb9","568e6fb9e338155af9c14ae8a426503c"
"‘The Masked Singer’ Creator Wonwoo Park Signs First-Look Deal With Fox, Developing U.S. Version Of Korean Talent Format ‘Lotto Singer’","Deadline","The Masked Singer creator Wonwoo Park has signed a first-look development deal with Fox Alternative Entertainment and has set his sights on his first project. The producer will develop series with Fox’s unscripted production division for the U.S. and international territories via his Seoul-based production company DiTurn. It comes after Park previously struck a first-look […]","2021-11-04 16:00:32","Entertainment","https://deadline.com/2021/11/the-masked-singer-creator-wonwoo-park-fox-lotto-singer-1234867910/","7c15b03e7e61924c90edf327f30419ea9fa75d891484e9164931e717298b4fb9","469557c265bd9abdbaa5170e2ecfa971"
"Filmmaker Robert Greenwald “Heavily Into Production” On Documentary About Abbie Hoffman, Activist And Counterculture Icon","Deadline","EXCLUSIVE: It’s been more than 40 years, but filmmaker Robert Greenwald remembers the call that came in from a man on the run. The caller, one of America’s most famous fugitives, used an assumed name. “Robert, it’s Barry,” the man said in a gravelly voice. It wasn’t long before Greenwald discerned he was speaking with […]","2021-11-04 16:00:25","Entertainment","https://deadline.com/2021/11/i-am-abbie-hoffman-documentary-director-robert-greenwald-interview-news-1234867775/","7c15b03e7e61924c90edf327f30419ea9fa75d891484e9164931e717298b4fb9","4603bbb5a9573fb8798435875284beac"
"ESPN Classic Sets Date For Shutdown, Capping Nearly Three-Decade Run","Deadline","ESPN Classic will go dark on January 1 of 2022, ending a nearly three-decade run of nostalgic pay-TV sports programming. The network was founded as Classic Sports Network in 1995 and was acquired by ESPN in 1997. The decision to shut it down follows several years of declining distribution. Several major providers had dropped the […]","2021-11-04 15:47:43","Entertainment","https://deadline.com/2021/11/espn-classic-shutdown-sports-cable-tv-1234867955/","7c15b03e7e61924c90edf327f30419ea9fa75d891484e9164931e717298b4fb9","cf7e6a2d3c0efd1f162a39ef8ce041e0"
"Composer Joshua Moshier Taps Into Twisted Dynamic Between Psychiatrist & Client With Score For ‘The Shrink Next Door’ – Hear An Exclusive Track","Deadline","EXCLUSIVE: Deadline has the first exclusive track from Joshua Moshier’s score for The Shrink Next Door, which is set for digital release via Lakeshore Records on November 12, as the first three episodes of the limited series become available for streaming on Apple TV+. The eight-episode dark comedy based on the original Wondery podcast of the […]","2021-11-04 15:36:32","Entertainment","https://deadline.com/2021/11/the-shrink-next-door-first-exclusive-track-from-apple-series-score-joshua-moshier-1234867935/","7c15b03e7e61924c90edf327f30419ea9fa75d891484e9164931e717298b4fb9","2c055dbdfae48f3b2285c252a7ff808d"
"C.S. Lewis Biopic ‘The Most Reluctant Convert’ Sees $1.2M+ Box Office For One Night Event, Adds Shows","Deadline","EXCLUSIVE: The Most Reluctant Convert: The Untold Story of C.S. Lewis grossed $1.205 million Wednesday night at special showings in 400+ theaters across North America (a $2,863 per-screen average) and has added more cinemas/runs through Nov. 18. The biopic, directed by Emmy and BAFTA Award-winning filmmaker Norman Stone, traces the spiritual journey of renowned author […]","2021-11-04 15:30:28","Entertainment","https://deadline.com/2021/11/c-s-lewis-most-reluctant-convert-box-office-1234867567/","7c15b03e7e61924c90edf327f30419ea9fa75d891484e9164931e717298b4fb9","de44afcf21ebbf22c0b4cadd0f1ce1d6"
"‘Venom: Let There Be Carnage’ Tears Past $400M At Global Box Office","Deadline","Sony’s Venom: Let There Be Carnage has crossed the $400M worldwide mark, grossing $191.6M domestically and $212.5M at the international box office for a $404.1M cume through Tuesday. This makes the Andy Serkis-directed sequel the fifth Hollywood movie to top the four-century worldwide milestone since the beginning of the pandemic — and it still has […]","2021-11-04 15:23:29","Entertainment","https://deadline.com/2021/11/venom-let-there-be-carnage-crosses-400-million-global-box-office-1234867905/","7c15b03e7e61924c90edf327f30419ea9fa75d891484e9164931e717298b4fb9","0d1bcc05dc63b59f08c4f37f0de8fa24"
"Knopf Publicity & Marketing Exec Paul Bogaards To Step Down After 32 Years","Deadline","Paul Bogaards, the storied publicity and marketing exec at Alfred A. Knopf, will step down from his job after a 32-year career with the publishing house. His departure, effective Jan. 1, 2022, was announced today by Reagan Arthur, EVP, Publisher, at Knopf. “Paul’s unparalleled impact on scores of best-selling and now-classic books cannot be overstated,” […]","2021-11-04 15:17:41","Entertainment","https://deadline.com/2021/11/knopf-pubpaul-bogaards-knopf-publisher-retirement-1234867903/","7c15b03e7e61924c90edf327f30419ea9fa75d891484e9164931e717298b4fb9","ffed8389dfbe1ecf8a5d85bdea750174"
"‘Eternals’ Won’t Be Playing Saudi Arabia, Qatar, Kuwait, Bahrain & Oman","Deadline","The anticipated robust overseas box office of Disney/Marvel’s Eternals, which posted a first day of $7.6M, will definitely not have Saudi Arabia, Qatar, Kuwait, Bahrain and Oman in its future release plans. Eternals was originally scheduled to open in the region on Nov. 11. While official reasons weren’t provided by either the studio or the local territories, […]","2021-11-04 17:01:18","Entertainment","https://deadline.com/2021/11/eternals-banned-saudi-arabia-qatar-kuwait-bahrain-oman-1234867992/","7c15b03e7e61924c90edf327f30419ea9fa75d891484e9164931e717298b4fb9","7c797b1dc6609f09351f57335acbd2e6"
"Mel Gibson Boards Family Adventure ‘Boys of Summer’","Deadline","Mel Gibson has come onboard to star in the fantasy-adventure, Boys of Summer, written by Cornelius Uliano and Bryan Schulz. Mason Thames is also on board. David Henrie will direct. The film is being produced by Mark Fasano of Nickel City Pictures and James Henrie of Novo Media Group and will be financed and executive […]","2021-11-04 17:00:48","Entertainment","https://deadline.com/2021/11/mel-gibson-boys-of-summer-1234867611/","7c15b03e7e61924c90edf327f30419ea9fa75d891484e9164931e717298b4fb9","76ec374a7ab18e334d2ae4e27df08466"
"Benjamin Hall Named Fox News State Department Correspondent; Rich Edson Named Senior National Correspondent","Deadline","Fox News Channel has named Benjamin Hall as its State Department correspondent, and Rich Edson has been promoted to senior national correspondent. Hall will relocate to Washington, D.C., from London, where he has been foreign affairs correspondent since joining the network in 2015. He most recently reported from Kabul to report on the U.S. exit […]","2021-11-04 16:53:42","Entertainment","https://deadline.com/2021/11/benjamin-hall-fox-news-state-department-correspondent-1234868065/","7c15b03e7e61924c90edf327f30419ea9fa75d891484e9164931e717298b4fb9","187f6c2d82418f42395c16759f330f9d"
"‘Survivor’ & ‘The Masked Singer’ Retake Top Wednesday Demo Post-World Series; ‘Chicago’ Trio Leads Viewership","Deadline","After the hype of the 2021 World Series, which saw the Atlanta Braves take home the championship on Tuesday, primetime assumed regular programming with the usual suspects back at the top. Survivor and The Masked Singer, after losing out to the World Series last week, were the highest-rated programs of the evening, tying with a […]","2021-11-04 16:43:34","Entertainment","https://deadline.com/2021/11/survivor-chicago-trio-leads-viewership-1234865276/","7c15b03e7e61924c90edf327f30419ea9fa75d891484e9164931e717298b4fb9","47d9f6f8db1a0ce7228c51c7c1b4f0e8"
"‘Eternals’ Amasses $7.6M On First Day Of Overseas Play – International Box Office","Deadline","Debuting in an initial 14 international box office markets on Wednesday, Disney/Marvel’s Eternals opened to an estimated $7.6M with No. 1s across the vast majority. First-day results on the Chloe Zhao-directed pic put it 85% ahead of Shang-Chi And The Legend Of The Ten Rings and 20% ahead of Black Widow on a like-for-like basis. […]","2021-11-04 16:40:35","Entertainment","https://deadline.com/2021/11/eternals-opening-weekend-international-box-office-disney-marvel-1234867961/","7c15b03e7e61924c90edf327f30419ea9fa75d891484e9164931e717298b4fb9","b3bfe713d87ceaa7a2917e03f03459d7"
"BritBox Picks Up North American Rights To ITV’s ‘The Tower’ Starring ‘Game Of Thrones” Gemma Whelan","Deadline","EXCLUSIVE: BritBox North America has picked up exclusive North American rights to Game of Thrones star Gemma Whelan’s upcoming ITV thriller The Tower. All episodes of Mammoth Screen/Windhover Films’ three-parter, which also stars The Haunting of Bly Manor’s Tahirah Sharif and Kate & Koji lead Jimmy Akingbola, will be released simultaneously on the platform on […]","2021-11-04 16:12:43","Entertainment","https://deadline.com/2021/11/the-tower-britbox-north-america-1234867888/","7c15b03e7e61924c90edf327f30419ea9fa75d891484e9164931e717298b4fb9","f388e835a84130639f9d748f60935f72"
"ABC Developing CIA Drama ‘Candygram’ From Katie Stone, David Daitch, Derek Kolstad & Rebelle Media","Deadline","ABC has taken in for development Candygram, a spy drama from writing duo Katie Stone and David Daitch (Shooter), John Wick scribe Derek Kolstad, Rebelle Media (Long Weekend) and 20th Television. Written by Stone and Daitch, Candygram revolves around a street smart local learns that her unique skill set is exactly what the CIA needs […]","2021-11-04 18:00:58","Entertainment","https://deadline.com/2021/11/abc-developing-cia-drama-candygram-katie-stone-david-daitch-derek-kolstad-rebelle-media-1234868161/","7c15b03e7e61924c90edf327f30419ea9fa75d891484e9164931e717298b4fb9","aee32260c1c64435776591d0763b9896"
"Deon Taylor’s Hidden Empire To Develop Scripted Series On Hip-Hop Mogul Master P; Matthew Carnahan Set As Showrunner","Deadline","EXCLUSIVE: Deon Taylor and Roxanne Avent Taylor’s Hidden Empire Film Group (Black and Blue, The Intruder) is developing a scripted series centered on Percy Miller, the hip-hop mogul best known as Master P. It will chart his journey from childhood to the heights of his success in the music business. Matthew Carnahan (House of Lies) […]","2021-11-04 17:26:23","Entertainment","https://deadline.com/2021/11/deon-taylor-to-develop-master-p-scripted-series-matthew-carnahan-writing-1234867997/","7c15b03e7e61924c90edf327f30419ea9fa75d891484e9164931e717298b4fb9","d156df9ba8390304511e754b85ed4b4b"
"Cardinal Trio Pictures Closes Financing Deal With Bakrr Media Group – AFM","Deadline","EXCLUSIVE:  Cardinal Trio Pictures principals –actor/filmmaker Chasen Parker, former Universal executive John C. Hall, and Lokal Media co-founder Nick Scherma– have secured a financing deal with Bakrr Media Group. Cardinal Trio Pictures will be receiving up to €15 million a year ($17.3M) for projects for a five-year term. “We’re incredibly grateful to be aligning with […]","2021-11-04 17:26:13","Entertainment","https://deadline.com/2021/11/cardinal-trio-pictures-bakrr-media-group-1234868139/","7c15b03e7e61924c90edf327f30419ea9fa75d891484e9164931e717298b4fb9","8de4c3c453e5ff653ae9a6ac0661f1a7"
"Netflix Hires EMEA Director Theatrical Distribution; Israeli Oscar Entry North America Deal; Discovery+ Brazil Launch — Global Briefs","Deadline","Netflix Appoints Hamish Moseley As Distribution Exec London-based Hamish Moseley has been tapped as Director Of Distribution, theatrical, for EMEA, reporting to Spencer Klein, Head of Distribution at the streamer. The distribution vet most recently helped establish Altitude’s distribution arm, acquiring titles including Oscar-winners Moonlight and Minari, and helped to get the UK theatrical supply […]","2021-11-04 17:25:12","Entertainment","https://deadline.com/2021/11/netflix-hires-emea-director-theatrical-distribution-1234868111/","7c15b03e7e61924c90edf327f30419ea9fa75d891484e9164931e717298b4fb9","3ebfe6545df6adffd488735859ffc7c8"
"Billy Preston Getting Docu Film Treatment In Paris Barclay-Helmed ‘Fifth Beatle’ From White Horse & Homegrown Pictures","Deadline","EXCLUSIVE: White Horse Pictures and Homegrown Pictures have teamed on Fifth Beatle, a documentary feature about the legendary musician and genius keyboardist Billy Preston. The title refers to a nickname for Preston, the only non-member ever to be credited on a Beatles recording. He had plenty of his own hits and co-wrote the song Joe […]","2021-11-04 17:24:13","Entertainment","https://deadline.com/2021/11/billy-preston-documentary-fifth-beatle-paris-barclay-cheo-hodari-coker-1234868062/","7c15b03e7e61924c90edf327f30419ea9fa75d891484e9164931e717298b4fb9","8758900aca0699e14332f28d1917656f"
"‘Monarch’: Reshma Shetty, Damon Dayoub, D.W. Moffett Join Fox Musical Drama","Deadline","EXCLUSIVE: Reshma Shetty (Royal Pains), Damon Dayoub (Stitchers) and D.W. Moffett (Switched at Birth) have been cast in heavily recurring roles opposite Susan Sarandon, Anna Friel, Trace Adkins and Beth Ditto in Fox’s upcoming musical drama Monarch. Created by Melissa London Hilfers, Monarch is described as a Texas-sized, multigenerational musical drama about America’s first family […]","2021-11-04 17:15:01","Entertainment","https://deadline.com/2021/11/monarch-reshma-shetty-damon-dayoub-d-w-moffett-fox-musical-drama-1234867442/","7c15b03e7e61924c90edf327f30419ea9fa75d891484e9164931e717298b4fb9","0767130e073dabd226f4d62d09283b03"
"Korean Graphic Novel ‘Moms’ Set To Be Adapted As TV Series By Playground Entertainment","Deadline","EXCLUSIVE: Playground Entertainment, the company behind Damian Lewis period drama Wolf Hall, is to adapt acclaimed South Korean graphic novel Moms as a television series. Moms, which comes from Yeong-shin Ma, tells the story of Lee Soyeon and her two best friends, three Korean women in their 50’s struggling with the loneliness of middle age. […]","2021-11-04 17:14:18","Entertainment","https://deadline.com/2021/11/graphic-novel-moms-tv-series-playground-entertainment-1234868130/","7c15b03e7e61924c90edf327f30419ea9fa75d891484e9164931e717298b4fb9","3e298651f829859020558451e147afb0"
"Mel Gibson Boards Family Adventure ‘Boys Of Summer’","Deadline","Mel Gibson has come onboard to star in the fantasy-adventure Boys of Summer, written by Cornelius Uliano and Bryan Schulz. Mason Thames is also on board. David Henrie will direct. The film is being produced by Mark Fasano of Nickel City Pictures and James Henrie of Novo Media Group and will be financed and executive […]","2021-11-04 17:00:48","Entertainment","https://deadline.com/2021/11/mel-gibson-boys-of-summer-1234867611/","7c15b03e7e61924c90edf327f30419ea9fa75d891484e9164931e717298b4fb9","69298fbfbd1befcf8af3db0ecc65c404"
"‘Abbott Elementary’: William Stanford Davis Joins ABC Comedy As Recur","Deadline","EXCLUSIVE: William Stanford Davis has joined the cast of ABC’s upcoming workplace comedy Abbot Elementary, opposite stars Quinta Brunson, Tyler James Williams and Janelle James. In Abbott Elementary, a group of dedicated, passionate teachers — and a slightly tone-deaf principal — are brought together in a Philadelphia public school where, despite the odds stacked against […]","2021-11-04 19:00:19","Entertainment","https://deadline.com/2021/11/abbott-elementary-william-stanford-davis-abs-recur-1234867445/","7c15b03e7e61924c90edf327f30419ea9fa75d891484e9164931e717298b4fb9","2af661fed74cf83fc19f8f1be847e2e5"
"‘Grace And Frankie’ Wraps Filming For Seventh & Final Season","Deadline","Grace and Frankie’s time is coming to a close as the Netflix series wrapped filming for its upcoming seventh and final season. Crew members of the Netflix comedy shared behind-the-scenes photos of the series’ final moments on-set at Hollywood’s Sunset Gower Studios. “When your whole #family agrees to an #epic #selfie #farewell #graceandfrankie I love […]","2021-11-04 18:59:22","Entertainment","https://deadline.com/2021/11/grace-and-frankie-wraps-filming-seventh-final-season-1234868201/","7c15b03e7e61924c90edf327f30419ea9fa75d891484e9164931e717298b4fb9","5748c81335f72bc6ab6f474624513f85"
