"Ben Crump Files Nearly 100 New Lawsuits On Behalf Of Astroworld Attendees, Total Count Now Tops 200 – Updated","Deadline","UPDATED: Today Ben Crump, the lawyer best known for his representation of the family of George Floyd and Trayvon Martin, announced at a press conference that he and other attorneys filed a lawsuit on behalf of 90 people who attended Travis Scott’s Astroworld festival. Nine people have died as a result of injuries sustained at […]","2021-11-12 20:36:55","Entertainment","https://deadline.com/2021/11/astroworld-lawsuit-110-plaintiffs-travis-scott-drake-live-nation-1234871896/","7c15b03e7e61924c90edf327f30419ea9fa75d891484e9164931e717298b4fb9","ebdf5b851bb00f8057fbb2d2f42eddda"
"‘The Harper House’: Animated Comedy Canceled At Paramount+","Deadline","The Harper House is closing its doors. Paramount+ has canceled the animated comedy after one season. It comes a week after the ten episode show, which premiered on September 16, wrapped up its season on November 4. Creator Brad Neely broke the news on social media, “The Harper House is cancelled. I’ll always appreciate the […]","2021-11-12 20:36:17","Entertainment","https://deadline.com/2021/11/the-harper-house-canceled-paramount-plus-1234873236/","7c15b03e7e61924c90edf327f30419ea9fa75d891484e9164931e717298b4fb9","73ea1eca592c313cdcd4878c1eb63c7a"
"‘Squid Game’ Triggers Feeding Frenzy As Hollywood Agencies Chase Creator & Stars Of Netflix Mega Hit","Deadline","The phenomenal success of Netflix’s Squid Game came seemingly out of nowhere, catapulting its writer-director, Hwang Dong-hyuk, and cast to global stardom and making them the hottest commodity in Hollywood. That has created a stampede among the major agencies to sign Hwang and the actors, the vast majority of whom have no Hollywood representation. That […]","2021-11-12 20:31:31","Entertainment","https://deadline.com/2021/11/squid-game-hollywood-agencies-chase-creator-stars-netflix-mega-hit-hwang-dong-hyuk-lee-jung-jae-jung-hoyeon-and-park-hae-soo-1234873099/","7c15b03e7e61924c90edf327f30419ea9fa75d891484e9164931e717298b4fb9","a1dbc10b45fd5d0f023c7b7cf43cd286"
"‘Yellowstone’ Season 4 Premiere Draws 12.7 Million Total Viewers In Live+3","Deadline","The Nielsen Live+3 ratings numbers are in, and Yellowstone has smashed more of its own records. Sunday night’s Season 4 premiere drew 12.7 million total viewers across Paramount Network and three simulcasts on CMT, Pop and TV Land. That is up 66% vs the Season 3 premiere (7.6 million). Including encores, the season opener drew […]","2021-11-12 20:16:31","Entertainment","https://deadline.com/2021/11/yellowstone-season-4-premiere-draws-12-7-million-total-viewers-in-live3-1234873188/","7c15b03e7e61924c90edf327f30419ea9fa75d891484e9164931e717298b4fb9","bae3e869c116b1534ffe4ec89667caab"
"Int’l Critics Line: Mexico’s Oscar Entry ‘Prayers For The Stolen’","Deadline","Young girls hide from drug cartels in Prayers For The Stolen, Mexico’s powerful entry to the International Feature Oscar race. Directed by Tatiana Huezo and loosely based on Jennifer Clement’s novel, the film, which screens at AFI Fest on November 14 and releases theatrically and on Netflix in the U.S. and select regions on November 17, centers on three girls living […]","2021-11-12 20:15:50","Entertainment","https://deadline.com/2021/11/prayers-for-the-stolen-review-mexico-oscar-entry-netflix-international-critics-line-1234873068/","7c15b03e7e61924c90edf327f30419ea9fa75d891484e9164931e717298b4fb9","0de2ff994268af33e82ae66bb2c4314f"
"‘Night Court’: NBC Skeds Sitcom For 2022-23 Season","Deadline","Night Court, the follow-up to the classic legal sitcom, will air on NBC in the 2022-23 season. When the series, which stars and is exec produced by The Big Bang Theory’s Melissa Rauch, was first ordered, the broadcast network had yet to decide whether it would air in midseason or in the next season. After launching […]","2021-11-12 20:08:32","Entertainment","https://deadline.com/2021/11/night-court-nbc-2022-23-season-1234873200/","7c15b03e7e61924c90edf327f30419ea9fa75d891484e9164931e717298b4fb9","ec1f538fda1b8e7be2690f07f4ce2a8b"
"Glen De Vries, Who Flew To Space With William Shatner, Dies In Airplane Crash","Deadline","Glen de Vries, the 49-year-old entrepreneur who flew to space with actor William Shatner last month aboard a flight launched by Jeff Bezos’ Blue Origin, died Thursday in a small-plane crash in New Jersey. A statement tweeted by Blue Origin said, “We are devastated to hear of the sudden passing of Glen de Vries. He […]","2021-11-12 21:34:43","Entertainment","https://deadline.com/2021/11/glen-de-vries-dead-blue-origin-william-shatner-1234873272/","7c15b03e7e61924c90edf327f30419ea9fa75d891484e9164931e717298b4fb9","64067b3cb872975482fd875de1ac22af"
"Steve Bannon Indicted On Charges Of Contempt Of Congress","Deadline","Steve Bannon, the former adviser to President Donald Trump, was indicted Friday on charges of contempt of Congress, after he failed to comply with a subpoena issued by a committee investigating the January 6 Capitol riots. Bannon, a former film producer and current podcast host, has claimed through his attorney that he has executive privilege […]","2021-11-12 21:15:34","Entertainment","https://deadline.com/2021/11/steve-bannon-january-6th-congress-1234873277/","7c15b03e7e61924c90edf327f30419ea9fa75d891484e9164931e717298b4fb9","344b8fe50159dc2242757a29b59f2f15"
"Dominion Voting Systems Sues Fox Corp. In Latest Defamation Lawsuit Over False Election Claims","Deadline","Dominion Voting Systems filed suit this week against Fox Corp., as it seeks to establish that Rupert and Lachlan Murdoch bore responsibility when Fox News guests and personalities made false claims about the election systems company’s role in the 2020 presidential election. The lawsuit, which was filed  Monday in Delaware Superior Court (read it here), […]","2021-11-12 21:07:29","Entertainment","https://deadline.com/2021/11/dominion-voting-sues-fox-corp-rupert-murdoch-lachlan-murdoch-1234873193/","7c15b03e7e61924c90edf327f30419ea9fa75d891484e9164931e717298b4fb9","cd14688c4b7e4ef2c730fb215afedf18"
"‘Chicago Fire’: EP Andrea Newman Upped To Co-Showrunner Of NBC Firefighter Drama","Deadline","EXCLUSIVE: Chicago Fire executive producer Andrea Newman has been promoted to co-showrunner of the veteran NBC drama, joining co-creator, executive producer and longtime showrunner Derek Haas. Newman, who joined Chicago Fire after the pilot as co-executive producer, has been on the show for its entire 10-season run to date. She was promoted to executive producer […]","2021-11-12 23:00:55","Entertainment","https://deadline.com/2021/11/chicago-fire-ep-andrea-newman-upped-co-showrunner-nbc-derek-haas-1234872364/","7c15b03e7e61924c90edf327f30419ea9fa75d891484e9164931e717298b4fb9","c5899b5e31bf57355e55b597d8fcea2e"
"Britney Spears Formally Free From Conservatorship, Judge Rules","Deadline","After 13 years, #FreeBritney is now more than just a hashtag. “The court agrees to the termination of the conservatorship,” ruled Judge Brenda Penny for Britney Spears this afternoon. With some self-described “administrative” matters to wrap everything up, the packed hearing Friday in Los Angeles Superior Court puts an effective end to the conservatorship that […]","2021-11-12 22:10:53","Entertainment","https://deadline.com/2021/11/britney-spears-conservatorship-hearing-termination-1234873024/","7c15b03e7e61924c90edf327f30419ea9fa75d891484e9164931e717298b4fb9","a5620d43896335413f5a93df9783130d"
"Megan Hilty Steps In As Replacement For Covid-Struck Jane Krakowski In ‘Annie Live!’","Deadline","EXCLUSIVE Jane Krakowski has stepped down from the role of Lily St. Regis in NBC’s upcoming Annie Live! after being diagnosed with a breakthrough case of Covid, the network said. Smash star Megan Hilty will step into the role. “I am beyond thrilled to join this all-star cast, crew and creative team,” said Hilty in […]","2021-11-12 22:04:46","Entertainment","https://deadline.com/2021/11/megan-hilty-jane-krakowski-annie-live-covid-1234873310/","7c15b03e7e61924c90edf327f30419ea9fa75d891484e9164931e717298b4fb9","72033777095e97a7e6ca6a0bf8aedbc9"
"Hero Nation: Deconstructing Disney+ Day; How ‘Resident Evil: Welcome To Raccoon City’ Filmmaker Johannes Roberts Changed The Game","Deadline","It’s not easy to reboot a cinema franchise, especially one which is close to 20 years old and based on a video game series that’s 25 years old. But when it came to tackling a new iteration of Constantin/Screen Gems’ Resident Evil after longtime collaborators filmmaker Paul W.S. Anderson and star Milla Jovovich hung up […]","2021-11-12 23:42:12","Entertainment","https://deadline.com/2021/11/disney-day-resident-evil-welcome-to-raccoon-city-johannes-roberts-podcast-interview-1234873345/","7c15b03e7e61924c90edf327f30419ea9fa75d891484e9164931e717298b4fb9","a975bcd7ce43732c3c6fc0b7bf8975fa"
"Britney Spears Proclaims “Best Day Ever” As Long Consevatorship Ends; Hollywood Reacts","Deadline","Britney Spears is taking a victory lap today after a judge officially ended the singer’s 13-year conservatorship. “I think I’m gonna cry the rest of the day,” she wrote on Instagram Friday as fans celebrated on the streets outside the DTLA courtroom. “Best day ever.” Here is the once Princess of Pop’s post, along with […]","2021-11-12 23:19:50","Entertainment","https://deadline.com/2021/11/britney-spears-conservatorship-hollywood-reaction-1234873338/","7c15b03e7e61924c90edf327f30419ea9fa75d891484e9164931e717298b4fb9","41830b74c88c7bf67f84687de439107a"
"Jennifer Garner To Star In ‘The Last Thing He Told Me’ Apple Limited Series From Hello Sunshine In Recasting","Deadline","EXCLUSIVE: Jennifer Garner is set to headline and executive produce Apple TV+ limited series The Last Thing He Told Me. Based on the New York Times No. 1 bestseller, the series is produced by Reese Witherspoon’s Hello Sunshine, who optioned the book from author Laura Dave and serves as the studio on the project with […]","2021-11-12 23:04:56","Entertainment","https://deadline.com/2021/11/jennifer-garner-the-last-thing-he-told-me-apple-limited-series-recasting-julia-roberts-1234873334/","7c15b03e7e61924c90edf327f30419ea9fa75d891484e9164931e717298b4fb9","31afbdd51f85d7f6355b59c00793c07b"
"Los Angeles Will Not Lift Covid Masking Or Vaccination Restrictions By End Of Year, Says Top Health Official","Deadline","“We will not reach the 80% threshold by the beginning of the year,” said Los Angeles County Health Director Barbara Ferrer today about the county’s vaccination progress. She then noted, “This is one of the 4 measures we must meet to lift restrictions.” Translation: L.A.’s indoor public masking and vaccination requirements will be in place […]","2021-11-13 00:59:51","Entertainment","https://deadline.com/2021/11/los-angeles-will-not-lift-covid-restrictions-1234873356/","7c15b03e7e61924c90edf327f30419ea9fa75d891484e9164931e717298b4fb9","fabcd98d967f5576c0a0dc838bd97f07"
"Taylor Swift Releases Full Version Of New ‘All Too Well’ Short Film With Dylan O’Brien & Sadie Sink","Deadline","UPDATE:  Taylor Swift has now released the full version of her new short film, All Too Well. EARLIER: A new music video short film written and directed by Taylor Swift for her song “All Too Well” was teased by the singer on social media today, and will be released Nov. 12. The short stars Swift […]","2021-11-13 00:30:52","Entertainment","https://deadline.com/2021/11/taylor-swift-releases-all-too-well-short-film-dylan-obrien-sadie-sink-1234868884/","7c15b03e7e61924c90edf327f30419ea9fa75d891484e9164931e717298b4fb9","0496b03b54617c931b7269b04864b6cf"
"Peter Johnson Joins Skydance Television","Deadline","EXCLUSIVE: Industry veteran Peter Johnson has joined Skydance as a television executive reporting to Skydance Television President Bill Bost. Johnson previously did a two-year stint as President of Television Development at MRC. Before that, Johnson served as EVP scripted at Legendary TV for four years. There, he oversaw such series as Colony for USA, Love for Netflix, Lost in […]","2021-11-13 00:09:33","Entertainment","https://deadline.com/2021/11/peter-johnson-skydance-television-1234873395/","7c15b03e7e61924c90edf327f30419ea9fa75d891484e9164931e717298b4fb9","0686beb91b7ae58bd1369203fa56d4c2"
"Former HBO Europe CEO Linda Jensen & ‘Harry Potter’ Producer David Barron Join International-Focused Content Company Envision Entertainment","Deadline","EXCLUSIVE: UK-based production house Envision Entertainment has significantly expanded its ranks by appointing two key executives. Former HBO Europe CEO Linda Jensen, who pioneered the U.S. company’s growth into local-language programming, and experienced UK producer David Barron, whose credits include the Harry Potter franchise, have both joined the company to focus on distinct areas. At […]","2021-11-15 08:01:26","Entertainment","https://deadline.com/2021/11/former-hbo-europe-ceo-linda-jensen-harry-potter-producer-david-barron-international-focused-content-company-envision-entertainment-1234873046/","7c15b03e7e61924c90edf327f30419ea9fa75d891484e9164931e717298b4fb9","4e15746b7d7e480ca44c1f888fe6de59"
"‘Last Week Tonight’: John Oliver Lampoons Capitol Rioter Who Thought Being White Would Indemnify Her","Deadline","In the season finale of Last Week Tonight, John Oliver opened the show by mocking a certain Jan. 6 rioter. After briefly ridiculing an FBI-wanted suspect seeking political asylum in Belarus, the Emmy Award-winning host zeroed in on a Capital riot attendee, Jenna Ryan, who expressed a humorous lack of self-awareness. Ryan, a Texas real […]","2021-11-15 05:56:16","Entertainment","https://deadline.com/2021/11/john-oliver-capitol-rioter-white-1234874187/","7c15b03e7e61924c90edf327f30419ea9fa75d891484e9164931e717298b4fb9","dee019272d463b50fec7cfe310fd7b6f"
"Deadline Contenders L.A. Arrivals: Nicole Kidman, Benedict Cumberbatch, Jennifer Hudson & More – Photo Gallery","Deadline","Deadline’s Contenders L.A. returned for an in-person edition Sunday at the DGA Theater, with 31 buzzy awards-season titles showing off their wares in panels that featured the likes of Nicole Kidman, Benedict Cumberbatch, Jennifer Hudson, Kristen Stewart, Javier Bardem, Adam McKay, Lady Gaga, Mahershala Ali, Ben Affleck, Kenneth Branagh, Pedro Almodóvar, Penélope Cruz, Simon Rex, […]","2021-11-15 03:49:52","Entertainment","https://deadline.com/2021/11/deadline-contenders-l-a-arrivals-nicole-kidman-benedict-cumberbatch-jennifer-hudson-more-photo-gallery-1234874172/","7c15b03e7e61924c90edf327f30419ea9fa75d891484e9164931e717298b4fb9","4b90cd7d8ed5445215ef6d654a210000"
"Nine-Year-Old Succumbs To Injuries Sustained At Astroworld Festival; Death Toll Rises To 10 – Update","Deadline","UPDATED Nov. 14: A nine year-old boy died on Sunday after sustaining injuries from Travis Scott’s Astroworld concert in Houston, according to Houston Mayor Sylvestor Turner. Ezra Blount was in a medically induced coma shortly after receiving injury to his heart, lungs and brain after being trampled at the Houston concert that has taken nine […]","2021-11-15 03:06:01","Entertainment","https://deadline.com/2021/11/travis-scott-astroworld-eight-dead-in-stampede-1234869385/","7c15b03e7e61924c90edf327f30419ea9fa75d891484e9164931e717298b4fb9","ce086e3f7dc205e8a4f4076365d29ba7"
"‘Leave No Traces’ Director Calls Infamous 1983 Killing Of Polish Teen “Kafkaesque” – Contenders L.A.","Deadline","Leave No Traces director Jan P. Matuszynski said that although the Polish population might know about the murder of Grzegorz Przemyk, most didn’t understand the full scope of the operation. Matuszynski and lead actor Tomasz Zietek joined film critic Todd McCarthy to talk about the political drama during Deadline’s Contenders Film: Los Angeles award-season event […]","2021-11-15 02:00:54","Entertainment","https://deadline.com/2021/11/leave-no-traces-tomasz-ziete-jan-p-matuszynski-contenders-los-angeles-1234873461/","7c15b03e7e61924c90edf327f30419ea9fa75d891484e9164931e717298b4fb9","45906947998c139b05a55e2fede77ff0"
"Javier Bardem Tapped Into Psychology Of Abusers “Like Harvey Weinstein” For Spanish Oscar Entry ‘The Good Boss’ – Contenders L.A.","Deadline","On The Good Boss, Oscar-winning actor Javier Bardem reteamed with filmmaker Fernando León de Aranoa to examine “the abuse of power that some people have in their relationships with others,” from the perspective of an abuser. In the Spanish-language dark comedy distributed by Cohen Media Group, Bardem stars as Blanco, a charismatic but controlling factory […]","2021-11-15 01:57:20","Entertainment","https://deadline.com/2021/11/the-good-boss-javier-bardem-fernando-leon-de-aranoa-contenders-los-angeles-1234873452/","7c15b03e7e61924c90edf327f30419ea9fa75d891484e9164931e717298b4fb9","ce6c8aee1ea128099c77a93cb23b0814"
"Unexpected Connections Aligned Perfectly To Bring Director Elaine Bogan & Her Voice Cast to ‘Spirit Untamed’ – Contenders L.A.","Deadline","For Elaine Bogan’s animated feature film directorial debut, DreamWorks Animation’s Spirit Untamed, it seemed like there was a constant bit of kismet at play. “When I was first called and contacted to become part of the Spirit franchise, I jumped out of my car,” Bogan told Deadline’s Contenders Film: Los Angeles on Sunday while sharing […]","2021-11-15 01:45:16","Entertainment","https://deadline.com/2021/11/spirit-untamed-elaine-bogan-amie-doherty-contenders-los-angeles-1234873467/","7c15b03e7e61924c90edf327f30419ea9fa75d891484e9164931e717298b4fb9","ada27343fbdd814acecd8c39f5daaa2f"
"‘The Boss Baby: Family Business’ Was Personal This Time For Director Tom McGrath – Contenders L.A.","Deadline","When developing a sequel to the animated hit and Oscar-nominated The Boss Baby, director Tom McGrath drew on his own relationship with his brother, a dynamic that came up as McGrath and producer Jeff Hermann discussed The Boss Baby: Family Business on Sunday at Deadline’s Contenders Film: Los Angeles awards-season event. “We fought all the […]","2021-11-15 01:40:02","Entertainment","https://deadline.com/2021/11/the-boss-baby-family-business-tom-mcgrath-interview-contenders-los-angeles-1234873465/","7c15b03e7e61924c90edf327f30419ea9fa75d891484e9164931e717298b4fb9","9471b48b60853f5bd3ab3271c43421c4"
"‘Swan Song’s Mahershala Ali & Benjamin Cleary Contemplate Grief & Replicas For Apple Film – Contenders L.A.","Deadline","Benjamin Cleary said his upcoming film Swan Song originated from his experience of losing three friends and his own existential questions about grief. “When something like that happens, you see the grief emanate out and affect everyone else around you,” Cleary said Sunday during Deadline’s Contenders Film: Los Angeles panel at the DGA Theater. “In a […]","2021-11-15 01:30:05","Entertainment","https://deadline.com/2021/11/swan-song-mahershala-ali-naomie-harris-benjamin-cleary-contenders-l-a-1234873458/","7c15b03e7e61924c90edf327f30419ea9fa75d891484e9164931e717298b4fb9","7853994f665e3452f7a6b82704caeef8"
"‘CODA’s Sian Heder, Marlee Matlin & Emilia Jones On Exploring Deaf Culture And “Displaying Emotions In So Many New Ways” – Contenders L.A.","Deadline","CODA writer-director Siân Heder was joined by stars Marlee Matlin and Emilia Jones at Deadline’s Contenders Film: Los Angeles to discuss the drama, which set a record when Apple paid $25 million-plus to acquire the film after its opening-night premiere at Sundance, “When I watched the original film,” said Heder of the 2014 French movie, […]","2021-11-15 01:21:55","Entertainment","https://deadline.com/2021/11/coda-marlee-matlin-sian-heder-emilia-jones-contenders-los-angeles-1234870892/","7c15b03e7e61924c90edf327f30419ea9fa75d891484e9164931e717298b4fb9","3be6126540ecaa2fee467b203e054d78"
"L.A. County Public Health Covid-19 Report: 6 New Deaths, 979 New Positive Cases – Sunday Update","Deadline","SUNDAY UPDATE: On Sunday, the Los Angeles County Department of Public Health reported 6 new deaths from Covid-19, as well as 979 new positive cases. The number of deaths and confirmed cases reported today may reflect delays in weekend reporting. But at present, 604 County residents are said to be hospitalized with Covid-19. COVID-19 Daily Update:November […]","2021-11-15 01:10:49","Entertainment","https://deadline.com/2021/11/la-coronavirus-update-19-new-deaths-1378-new-positive-cases-1234873627/","7c15b03e7e61924c90edf327f30419ea9fa75d891484e9164931e717298b4fb9","ddfa559cd9b43a1fa696238195b312e4"
"‘The Tragedy Of Macbeth’ Production Deisgner & Costume Designer Created “Abstraction” – Contenders L.A.","Deadline","Production designer Stefan Dechant and costume designer Mary Zophres said director Joel Coen instructed them to make his film The Tragedy of Macbeth more abstract than a literal adaptation. Zophres and Dechant spoke with Deadline’s Justin Kroll at The Contenders Film: Los Angeles event Sunday. “One of the first things he said was he didn’t […]","2021-11-15 01:01:37","Entertainment","https://deadline.com/2021/11/the-tragedy-of-macbeth-production-deisgner-costume-designer-created-abstraction-contenders-l-a-1234873420/","7c15b03e7e61924c90edf327f30419ea9fa75d891484e9164931e717298b4fb9","4b94a3d100f449fb2d4282ded0adf0b8"
"Cineworld Reports Positive Cash Flow In October As Revenues Hit Pandemic High","Deadline","“There are real grounds for optimism in our industry,” Cineworld CEO Mooky Greidinger beamed today as the world’s second largest exhibitor issued a trading update. The company reached “an important milestone” in its recovery, generating positive cash flow in October, it said in the statement. Although it didn’t get into exact figures, Cineworld did report […]","2021-11-15 08:04:36","Entertainment","https://deadline.com/2021/11/cineworld-revenues-positive-cash-flow-pandemic-high-mooky-greidinger-trading-update-1234874202/","7c15b03e7e61924c90edf327f30419ea9fa75d891484e9164931e717298b4fb9","e7b79691704b51e7013e9b6a2c8321c6"
"UK TV Producers Head To The U.S. As Covid Travel Restrictions Ease","Deadline","EXCLUSIVE: A flood of UK TV execs have headed to the U.S. in the past few days for pitch meetings as UK citizens are finally allowed to enter the country for the first time in almost two years. Deadline understands senior figures from the likes of BBC Studios and Night on Earth producer Plimsoll Productions have […]","2021-11-15 09:41:01","Entertainment","https://deadline.com/2021/11/uk-tv-producers-head-to-the-us-1234874214/","7c15b03e7e61924c90edf327f30419ea9fa75d891484e9164931e717298b4fb9","cc79d29ab38e4eedf7687ffec2c0e8e5"
"Global Networks Swoop For Fremantle South Africa Drama ‘Reyka’; Dixon, David,  Jama Join ‘Walk The Line’, BBC To Tell Dolly The Sheep Story – Global Briefs","Deadline","Global Networks Swoop For Fremantle South Africa Drama ‘Reyka’ Fremantle’s debut South African drama Reyka has sold to UK’s Channel 4, Canada’s CBC, Canal+ in Europe and HBO LatAm. The news comes as BritBox North America prepares to launch the show, which comes from South African network M-Net and Fremantle with Harriet Gavshon for Quizzical and […]","2021-11-15 10:33:50","Entertainment","https://deadline.com/2021/11/reyka-global-briefs-1234874224/","7c15b03e7e61924c90edf327f30419ea9fa75d891484e9164931e717298b4fb9","95c56663d31a325995fcd0cd49f3e1ce"
"Tennor Group Appoints Ron Meyer & Sophie Jordan CEO And Co-CEO Of Wild Bunch AG","Deadline","Tennor Group, the diversified global investment house, has appointed Ron Meyer and Sophie Jordan to be CEO and Co-CEO of the indie film distribution and production services company Wild Bunch AG. Wild Bunch CEO Vincent Grimond will stay on in an advisory capacity and work closely with Meyer and Jordan, the company said. It becomes […]","2021-11-15 13:40:14","Entertainment","https://deadline.com/2021/11/ron-meyer-sophie-jordan-wild-bunch-ag-tennor-group-1234874183/","7c15b03e7e61924c90edf327f30419ea9fa75d891484e9164931e717298b4fb9","22252c4bf540e0b3a9c287398f59cc3d"
"Liberty University Sexual Assault Scandal Explored In Non-Fiction Series From Talos Films","Deadline","EXCLUSIVE: Talos Films, the production company behind series including HBO’s Torn Apart and Discovery+’s Queen of Meth, is to explore the Liberty University sexual assault scandal in a new unscripted series. The company has signed an exclusive deal with the women at the center of the case and the series will document their fight for […]","2021-11-15 15:00:44","Entertainment","https://deadline.com/2021/11/liberty-university-sexual-assault-scandal-non-fiction-series-talos-films-1234873274/","7c15b03e7e61924c90edf327f30419ea9fa75d891484e9164931e717298b4fb9","2a1bb5f756d4fc539577f808cbb97fff"
"Broadway’s ‘For Colored Girls Who Have Considered Suicide/When The Rainbow Is Enuf’ Sets Spring Opening Date","Deadline","The first Broadway revival of Ntozake Shange’s groundbreaking for colored girls who have considered suicide/when the rainbow is enuf will begin preview performances at the Booth Theatre on Friday, March 4, 2022, with the opening night set for Thursday, March 24, producers announced today. Casting for the production, directed and choreographed by Camille A. Brown, […]","2021-11-15 15:00:33","Entertainment","https://deadline.com/2021/11/broadway-for-colored-girls-who-have-considered-suicide-when-the-rainbow-is-enuf-opening-date-1234874251/","7c15b03e7e61924c90edf327f30419ea9fa75d891484e9164931e717298b4fb9","957f9b5d85220162c696f0b3471f40d5"
