"Scott Bakula Remembers ‘Quantum Leap’ Co-Star Dean Stockwell: “He Made Me A Better Human Being”","Deadline","Scott Bakula, who co-starred with the late Dean Stockwell in the beloved sci-fi series Quantum Leap, remembers Stockwell as a dear friend and mentor in this statement provided to Deadline. Read Bakula’s statement in full: I met Dean at his audition for Quantum Leap in 1988. He had agreed to ‘read’ for the Network, I […]","2021-11-09 18:58:15","Entertainment","https://deadline.com/2021/11/dean-stockwell-scott-bakula-tribute-1234870757/","7c15b03e7e61924c90edf327f30419ea9fa75d891484e9164931e717298b4fb9","03911cea430b41cebbdc6dfcf5bc8396"
"‘NCIS’ Pays Tribute To Longtime Audience Liaison Harriet Margulies","Deadline","NCIS paid tribute Monday night to the CBS show’s longtime audience liaison Harriet Margulies, who died October 30 in Northridge after suffering a stroke. She was 94. The show honored Margulies with an “In Memoriam” tribute card at the end of Monday night’s episode. Born in Brooklyn, Margulies began her career as a publicist in […]","2021-11-09 18:56:46","Entertainment","https://deadline.com/2021/11/ncis-tribute-longtime-audience-liaison-harriet-margulies-died-1234870727/","7c15b03e7e61924c90edf327f30419ea9fa75d891484e9164931e717298b4fb9","3a4240d118d0d6ecefaa60abd16a5bcf"
"Channing Tatum, Tom Hardy In Universal Deal For George Nolfi-Scripted Afghanistan Evacuation Pic","Deadline","EXCLUSIVE: Universal Pictures has acquired an untitled original pitch from George Nolfi, a ripped from the headlines fact-based drama about the Afghanistan evacuation. Channing Tatum and Tom Hardy are attached to star. The story is based on recently reported true stories, this one focusing on three former special forces team members who jump back into […]","2021-11-09 18:17:53","Entertainment","https://deadline.com/2021/11/channing-tatum-tom-hardy-afghanistan-evacuation-universal-movie-george-nolfi-script-1234870585/","7c15b03e7e61924c90edf327f30419ea9fa75d891484e9164931e717298b4fb9","971485937bab7e986f11a6896f87b585"
"Dean Stockwell Remembered: David Lynch Recommends ‘Blue Velvet’ Song ‘Honky Tonk, Part 1’ In Honor; Co-Stars Pay Tribute","Deadline","Refresh for updates… Dean Stockwell, the Quantum Leap, Blue Velvet and Married to the Mob star who died Sunday at 85, is being remembered today, with filmmaker David Lynch honoring the actor in his usual idiosyncratic way, and lifelong friend Russ Tamblyn offering a poignant goodbye. Lynch, who directed Stockwell in the actor’s great latter-career […]","2021-11-09 18:16:34","Entertainment","https://deadline.com/2021/11/dean-stockwell-tributes-hollywood-remembers-1234870633/","7c15b03e7e61924c90edf327f30419ea9fa75d891484e9164931e717298b4fb9","6102e8ef0b3510b1a6f9ca1eea5d1451"
"‘The Resident’: Aneesha Joshi Joins Fox Medical Drama As Recurring","Deadline","EXCLUSIVE: It will be a family affair on the set of Fox’s The Resident. Aneesha Joshi will join her sister, series regular Anuji Joshi, on the medical drama. Aneesha will recur as Padma Devi, the sister of Dr. Leela Devi, played by her real-life sister Anuja. Joshi’s Padma Devi shakes things up in Leela’s life […]","2021-11-09 18:13:11","Entertainment","https://deadline.com/2021/11/the-resident-aneesha-joshi-fox-medical-drama-recurring-anuja-joshi-sister-1234870247/","7c15b03e7e61924c90edf327f30419ea9fa75d891484e9164931e717298b4fb9","ec779c243596c78cebc819dcaa066fcf"
"TV Academy Invites Location Managers To Join For First Time After Tweaking Producers Peer Group Eligibility","Deadline","The Television Academy said Tuesday that it has updated eligibility requirements for its Producers Peer Group, moves that includes adding a Location Managers Subgroup. It means that for the first time, qualifying location managers and assistant location managers will be eligible for either active or associate membership. The Producers Peer Group tweaks also include redefining […]","2021-11-09 18:09:40","Entertainment","https://deadline.com/2021/11/television-academy-location-managers-subgroup-added-membership-1234870681/","7c15b03e7e61924c90edf327f30419ea9fa75d891484e9164931e717298b4fb9","6878ad5564d07b8b0112a53ffada375c"
"Unusual Negotiations For Unusual Times: In Fending Off Rollback Demands, IATSE Says Media Conglomerates Came To Bargaining Table With “Good Amount Of Arrogance”","Deadline","Contract negotiations leading up to the tentative agreement that IATSE members will be voting on this weekend were unlike any that had come before. Conducted after the film and TV industry roared back to life from the darkest days of the pandemic, the giant media conglomerates came to the bargaining table demanding a wide range […]","2021-11-09 18:06:47","Entertainment","https://deadline.com/2021/11/unusual-negotiations-for-unusual-times-in-fending-off-rollback-demands-iatse-says-media-conglomerates-came-to-bargaining-table-with-a-good-amount-of-arrogance-1234870607/","7c15b03e7e61924c90edf327f30419ea9fa75d891484e9164931e717298b4fb9","2e285b5b4acc5ec877727cd7a35693c4"
"Maxim Swinton Joins ‘Raymond And Ray’; Seamus Dever Boards ‘Invitation To A Murder’; Bethlehem Million, More To Star In ‘Trim Season’","Deadline","EXCLUSIVE: Maxim Swinton (Halston) has joined the cast of Raymond and Ray, writer-director Rodrigo García’s (Four Good Days) film for Apple Studios. He joins an ensemble that includes Ewan McGregor, Ethan Hawke, Maribel Verdú and Sophie Okonedo, as previously announced. The film currently in production in Virginia centers on Raymond (McGregor) and Ray (Hawke), half-brothers […]","2021-11-09 17:57:07","Entertainment","https://deadline.com/2021/11/raymond-and-ray-invitation-to-a-murder-trim-season-castings-1234870591/","7c15b03e7e61924c90edf327f30419ea9fa75d891484e9164931e717298b4fb9","24c6488e964b508662eaed99d175f3b3"
"Kayleigh McEnany, Stephen Miller Among Latest Trump Administration Figures Subpoenaed By January 6th Committee","Deadline","Kayleigh McEnany, the former White House press secretary who is now a co-host of Fox News’ Outnumbered, is among the former Donald Trump administration figures subpoenaed by a House committee investigating the siege on the Capitol on January 6. McEnany was still serving as White House press secretary and an adviser to Trump’s campaign at […]","2021-11-09 20:46:59","Entertainment","https://deadline.com/2021/11/kayleigh-mcenany-january-6th-committee-subpoena-1234870872/","7c15b03e7e61924c90edf327f30419ea9fa75d891484e9164931e717298b4fb9","513d765f7de4d37a33d0ecda2b732b9f"
"Apple CEO Tim Cook On His Favorite ‘Ted Lasso’ Line","Deadline","Here’s Apple CEO Tim Cook’s favorite line from the first two seasons of Ted Lasso: “There’s two buttons I never like hitting. That’s panic and, snooze.” (Says Jason Sudeikis’ Coach Lasso when asked about his team’s losing streak). “I love that. I love that,” Cook told The New York Times DealBook Online Summit. “He has […]","2021-11-09 20:40:53","Entertainment","https://deadline.com/2021/11/apple-ceo-tim-cook-ted-lasso-apple-tv-steve-jobs-cryptocurrency-1234870859/","7c15b03e7e61924c90edf327f30419ea9fa75d891484e9164931e717298b4fb9","68f19f2273a74a75266dc182cf6aa084"
"‘Ke Nui Road’: HBO Max Sets Full Cast For Lifeguard Drama Pilot From John Wells & Matt Kester","Deadline","EXCLUSIVE: HBO Max has set the full cast for its lifeguard drama pilot Ke Nui Road. Robbie Magasiva (Spreadsheet, Wentworth), Andrew Creer (Lethal Weapon, You), Tessa de Josselin (Mr. Inbetween, Paper Champions), Kekoa Scott Kekumano (The White Lotus, Aquaman), Koa Tom, Rachel Ogechi Kanu (My Best Friend’s Exorcism), Z’aree Pu’ukani Loganbill, Ethan Rich (Hawaiian Vacation, […]","2021-11-09 20:30:21","Entertainment","https://deadline.com/2021/11/ke-nui-road-hbo-max-cast-lifeguard-drama-pilot-john-wells-matt-kester-1234870773/","7c15b03e7e61924c90edf327f30419ea9fa75d891484e9164931e717298b4fb9","c5ea3a4c80ee8478214328edd802e16b"
"Gavin Newsom Says Kids Asked Him To Stay Home From U.N. Conference To Trick Or Treat: “I Had To Cancel”","Deadline","On Tuesday, California Governor Gavin Newsom participated in a fireside chat at the 2021 California Economic Summit sponsored by California Forward. It was his first public appearance in two weeks. He began by addressing “questions” that have swirled recently about the sudden cancelation of his trip to Scotland November 1-3 for the U.N. Climate Change […]","2021-11-09 20:11:04","Entertainment","https://deadline.com/2021/11/gavin-newsom-kids-acancel-u-n-conference-1234870832/","7c15b03e7e61924c90edf327f30419ea9fa75d891484e9164931e717298b4fb9","06dc7c047e0b4cc074a09b6752f60a20"
"‘Cyrano’: UAR/MGM Positions Joe Wright Musical With Mid-December Awards Season Qualification, Wider Break In Early 2022","Deadline","EXCLUSIVE: United Artists Releasing is pivoting its awards season release of MGM’s Joe Wright feature musical Cyrano. Instead of the Peter Dinklage-Haley Bennett movie going limited on Dec. 31, UAR will qualify the movie for Oscars with a one week run in Los Angeles on Dec. 17. The pic, which already counts 86% fresh on […]","2021-11-09 20:06:40","Entertainment","https://deadline.com/2021/11/cyrano-peter-dinklage-movie-release-date-change-1234870827/","7c15b03e7e61924c90edf327f30419ea9fa75d891484e9164931e717298b4fb9","4b1146aa9fc8c50707617da1e2e78dd1"
"‘Search Party’: HBO Series Will End With Season 5, Streamer Sets Premiere Date & Unveils First-Look","Deadline","HBO Max will bring in the new year with the final season of popular dark comedy Search Party. The streamer revealed that season five will be the final season. It comes as it set the premiere date for its return and unveiled a first look at the season. Created by Charles Rogers and Sarah-Violet Bliss, […]","2021-11-09 20:00:58","Entertainment","https://deadline.com/2021/11/search-party-season-5-final-season-premiere-date-first-look-photos-hbo-max-1234870650/","7c15b03e7e61924c90edf327f30419ea9fa75d891484e9164931e717298b4fb9","7346da5208c6ff326cd2a2ee689c26fd"
"TriStar’s ‘Woman King’ Starring Viola Davis Adds Four Including Angelique Kidjo","Deadline","EXCLUSIVE: Four-time Grammy Award winner Angelique Kidjo, Jimmy Odukoya, Thando Dlomo and Jordan Bolger have rounded out the ensemble of TriStar Pictures’ The Woman King, starring Academy Award-winning actress Viola Davis and Thuso Mbedu. Lashana Lynch, Adrienne Warren and John Boyega are also on board with Gina Prince-Bythewood directing. eOne is on board to co-finance the pic. […]","2021-11-09 20:00:38","Entertainment","https://deadline.com/2021/11/tristars-woman-king-viola-davis-angelique-kidjo-1234870755/","7c15b03e7e61924c90edf327f30419ea9fa75d891484e9164931e717298b4fb9","5737fec5dc8821f892a0ad788964b0d4"
"‘Red Notice’s Rawson Marshall Thurber Talks Covid Production Pivot, Ryan Reynolds’ Texts, And A Possible Return To ‘Dodgeball’ Universe – The Deadline QA","Deadline","EXCLUSIVE: Netflix’s action-adventure-comedy Red Notice has a number of exhilarating set pieces including a climatic chase scene that would rival Indiana Jones and the Temple of Doom mine cart sequence when it comes to thrills. What audiences might not realize is the heart-pounding roller-coaster ride the film’s director, Rawson Marshall Thurber, went through in making this project […]","2021-11-09 20:00:04","Entertainment","https://deadline.com/2021/11/rawson-marshall-thurber-1234865019/","7c15b03e7e61924c90edf327f30419ea9fa75d891484e9164931e717298b4fb9","2404696d5c40a4371d02dee75edc55c7"
"‘Saturday Night Live’ Ratings Slip With Host Kieran Culkin","Deadline","The Nov. 6 edition of Saturday Night Live, hosted by Succession star Kieran Culkin with musical guest Ed Sheeran, drew a 1.31 rating in the 18-49 demo and 5.7 million viewers for its linear telecasts as well as full-episode digital viewing through Sunday, Nov. 7, per multi-platform metric NBC is using for the venerable sketch […]","2021-11-09 19:59:56","Entertainment","https://deadline.com/2021/11/saturday-night-live-ratings-kieran-culkin-1234870823/","7c15b03e7e61924c90edf327f30419ea9fa75d891484e9164931e717298b4fb9","c0aba70e310ebe34583c279dbb92a624"
"David Krumholtz Signs With Paradigm, Scores Roles Including On Showtime’s ‘Super Pumped’","Deadline","EXCLUSIVE: The Deuce star David Krumholtz has found new representation and scored a couple of new roles. Krumholtz has signed with Paradigm and has joined Showtime’s Uber drama series Super Pumped and Peacock’s Angelyne. The actor, who is perhaps best known for his role in long-running CBS procedural Numb3rs, will recur as Google co-founder Sergey […]","2021-11-09 19:34:50","Entertainment","https://deadline.com/2021/11/david-krumholtz-signs-paradigm-joins-showtimes-super-pumped-1234870668/","7c15b03e7e61924c90edf327f30419ea9fa75d891484e9164931e717298b4fb9","1bbdcd87e25fed340cf126b2aef3f56e"
"House Speaker Nancy Pelosi Calls For Investigation Of Rep. Paul Gosar Over Violent Twitter Post","Deadline","House Speaker Nancy Pelosi called for investigations into Rep. Paul Gosar (R-AZ) after he posted an altered anime video in which he is depicted killing Rep. Alexandria Ocasio-Cortez (D-NY) and threatening President Joe Biden with swords. Meanwhile, some Democrats are calling on Twitter to take greater action against Gosar. House Speaker Nancy Pelosi wrote, “Threats […]","2021-11-09 19:33:20","Entertainment","https://deadline.com/2021/11/paul-gosar-twitter-video-alexandria-ocasio-cortez-joe-biden-anime-1234870746/","7c15b03e7e61924c90edf327f30419ea9fa75d891484e9164931e717298b4fb9","6539e7dbcf963d3523c30b348401b423"
"WeWork Co-Founder Adam Neumann On Apple TV+ ‘WeCrashed’ – Jared Leto Told Me Not To Watch","Deadline","WeWork co-founder and fallen CEO Adam Neumann said Jared Leto advised him not to watch the upcoming Apple TV+ miniseries WeCrashed where the actor plays the former high-flying executive whose company crashed in 2019 before being resurrected in a SPAC-led IPO last month. (Separately, lawyers for the much-dramatized Neumann convinced HBO to tweak some wording […]","2021-11-09 19:32:49","Entertainment","https://deadline.com/2021/11/wework-co-founder-adam-neumann-on-apple-tv-wecrashed-jared-leto-told-me-not-to-watch-1234870799/","7c15b03e7e61924c90edf327f30419ea9fa75d891484e9164931e717298b4fb9","a9e887df873498413c86992d084acc82"
"South Asian Streamer ZEE5 Global Launches ‘Desi Noir’ Anthology Series ‘Qatil Haseenaon Ke Naam’","Deadline","EXCLUSIVE: South Asian streaming platform ZEE5 Global is backing ‘Desi noir’ anthology series Qatil Haseenaon Ke Naam. The drama will be streamed on the app’s Zindagi vertical, which has been a digital bridge uniting Indian and Pakistani cinema creatives. Emphasizing the theme of female empowerment, the show focuses on the fearlessness of women and their […]","2021-11-10 06:38:20","Entertainment","https://deadline.com/2021/11/indian-streamer-zee5-launches-desi-noir-anthology-series-qaatil-haseenaon-ke-naam-1234871220/","7c15b03e7e61924c90edf327f30419ea9fa75d891484e9164931e717298b4fb9","93d5aab01f642852f951e02909dd1230"
"Brian Williams Addresses Pending Departure On ‘The 11th Hour’: “This Is The End Of A Chapter And The Beginning Of Another’","Deadline","Brian Williams devoted the closing segment of The 11th Hour to the news of his departure from NBC News and MSNBC. He suggested that the show will continue — just without him. “I ask all those of you who are a part of our loyal viewing audience to remain loyal,” Williams said on the show. […]","2021-11-10 05:18:47","Entertainment","https://deadline.com/2021/11/brian-williams-talks-about-leaving-nbc-msnbc-the-11th-hour-1234871205/","7c15b03e7e61924c90edf327f30419ea9fa75d891484e9164931e717298b4fb9","173b99c51d7abd8f01a6f49a2e052311"
"Reigning NBA MVP Nikola Jokic Suspended For On-Court Altercation","Deadline","Reigning NBA MVP Nikola Jokic has been suspended for one game by the league for an altercation that occurred during the Denver Nuggets’ game with the Miami Heat on Monday. As the 6’11” Jokic brought the ball up on a 5 on 4 fast break, the Heat’s Markieff Morris took a run at the 280-pound […]","2021-11-10 03:35:57","Entertainment","https://deadline.com/2021/11/nikola-jokic-suspended-fight-markieff-morris-1234871181/","7c15b03e7e61924c90edf327f30419ea9fa75d891484e9164931e717298b4fb9","6e79f4874827138f33d858033dcda0e9"
"‘Supergirl’ Finale: Empowering The Powerless Is Key In Supe Series Ender Full Of Familiar Faces","Deadline","SPOILER ALERT: This post contains details about the Supergirl two-parter series finale.  It’s all or nothing for Melissa Benoist’s Kara Danvers and her Super Friends in the final hours of the CW’s Supergirl. Kicking off with “The Last Gauntlet,” Supergirl picks up right were the previous installment left off – with Esme (Mila Jones) in […]","2021-11-10 03:00:20","Entertainment","https://deadline.com/2021/11/supergirl-series-finale-recap-1234870290/","7c15b03e7e61924c90edf327f30419ea9fa75d891484e9164931e717298b4fb9","e03cd11f0fd64e9ef4f67018bcc7d97f"
"‘The Wonder Years’ Premiere Demo Rating Nearly Quadrupled In Live+35 Multiplatform Viewing","Deadline","After 35 days of viewing across linear and digital platforms, the series debut of ABC’s The Wonder Years rose to a 2.56 rating among adults 18-49, growing by nearly four times over its initial Live+Same Day rating (0.67 rating to 2.56 rating, +282%). In total viewers, The Wonder Years debut grew to 8.0 million after […]","2021-11-10 01:59:22","Entertainment","https://deadline.com/2021/11/the-wonder-years-premiere-ratings-live35-multiplatform-viewing-1234871128/","7c15b03e7e61924c90edf327f30419ea9fa75d891484e9164931e717298b4fb9","c7eb16de4f36a4d6e13a1ff64b86a272"
"Dodger Stadium Testing Site Reopens For First Time Since May Amid Rising Covid Cases In L.A.","Deadline","Amid rising infection numbers in Los Angeles, health-care startup Curative has re-launched its Covid testing site at Dodger Stadium, the company announced today. The site began offering free, drive-thru PCR nasal tests on Monday. People can access the site by entering through the downtown Gate E entrance. Curative previously partnered with Sean Penn’s CORE for […]","2021-11-10 01:50:55","Entertainment","https://deadline.com/2021/11/dodger-stadium-covid-testing-reopens-1234871143/","7c15b03e7e61924c90edf327f30419ea9fa75d891484e9164931e717298b4fb9","2cdfa9a9ec95967183b1bb3926575b65"
"Amid ‘Eternals’ Dominance Of The Box Office, ‘Clifford The Big Red Dog’ Hopes To Leave Paw Print – Preview","Deadline","Paramount will continue to experiment with a theatrical day-and-date release model during the pandemic with eOne’s Clifford the Big Red Dog, a live-action CGI hybrid take of the 1963 Scholastic children’s book classic which hit theaters today at 1:30PM, goes wide tomorrow at 3,695 theaters and also drops on Paramount+. The movie is expected to do between […]","2021-11-10 01:49:51","Entertainment","https://deadline.com/2021/11/clifford-the-big-red-dog-weekend-box-office-preview-eternals-belfast-1234871094/","7c15b03e7e61924c90edf327f30419ea9fa75d891484e9164931e717298b4fb9","6ae6e1691d449dafeee659562fe89d6f"
"Brian Williams Leaving MSNBC & NBC News At Year’s End; He’ll Wrap As Host Of ‘The 11th Hour’","Deadline","Brian Williams is leaving MSNBC and NBC News at the end of the year but says he’ll “pop up again somewhere.” The news came in a memo to staff from MSNBC president Rashida Jones. “After nearly three decades as an award-winning journalist and anchor at MSNBC and NBC News, Brian Williams has informed us he […]","2021-11-10 01:32:09","Entertainment","https://deadline.com/2021/11/brian-williams-leaving-msnbc-nbc-news-11th-hour-1234871132/","7c15b03e7e61924c90edf327f30419ea9fa75d891484e9164931e717298b4fb9","d6c7c4061914fe8e4dac04d8258e8f93"
"‘Quantum Leap’ Creator Donald Bellisario Pays Tribute To Dean Stockwell: “He Always Gave Us A Great Time”","Deadline","Dean Stockwell, who died Sunday at the age of 85, already had a child star and movie star on his resume when he was cast as the co-lead opposite Scott Bakula in the 1989 sci-fi series Quantum Leap, created by Donald P. Bellisario. Stocklwell’s role as Albert “Al” Calavicci, USN on the show, which ran […]","2021-11-10 01:01:51","Entertainment","https://deadline.com/2021/11/quantum-leap-creator-donald-bellisario-dean-stockwell-tribute-1234871082/","7c15b03e7e61924c90edf327f30419ea9fa75d891484e9164931e717298b4fb9","ca0829bf621a7daaf1916577dcc028d9"
"USC-Cal Football Game Rescheduled Due To Team’s Covid Cases","Deadline","Two struggling college football teams will get a week off after Cal announced today that “additional” players “tested positive for Covid-19 and are unavailable to practice this week or play in the contest.” The Golden Bears (3-6) were to play USC (4-5) on Saturday. Even with those records, USC-Cal would have been a draw for […]","2021-11-10 00:55:26","Entertainment","https://deadline.com/2021/11/usc-cal-football-game-canceled-covid-1234871113/","7c15b03e7e61924c90edf327f30419ea9fa75d891484e9164931e717298b4fb9","e6257a2bd324c6f33a05c60dc16166e6"
"Aaron Rodgers Comes Face-To-Face With Pete Davidson’s ‘SNL’ Spoof Of Unvaxxed NFL QB","Deadline","(UPDATED with NFL fines information) ‘Oh man,” exhaled Aaron Rodgers when confronted today with Saturday Night Live’s scathing spoof this weekend of the now admittedly unvaccinated quarterback. Coming less than a week after the now much disparaged Green Bay Packers player admitted he hadn’t had the anti-Covid jabs despite declaring in the summer that he […]","2021-11-09 23:39:08","Entertainment","https://deadline.com/2021/11/aaron-rodgers-unvaccinated-pete-davidson-covid-snl-pat-mcafee-radio-1234871016/","7c15b03e7e61924c90edf327f30419ea9fa75d891484e9164931e717298b4fb9","e7a0fc82153b0a3c9776c99656381e7c"
"‘Snowfall’: Brandon Jay McLaren, DeVaughn Nixon & Tiffany Lonsdale Join Season 5 Of FX Series","Deadline","EXCLUSIVE: Brandon Jay McLaren (Turner & Hooch) DeVaughn Nixon (Prom) and Tiffany Lonsdale (Siren) are set for heavily recurring roles opposite Damson Idris in the upcoming fifth season of FX drama Snowfall. The series hails from the late Oscar- and Emmy-nominated director John Singleton & Eric Amadio and Dave Andron. In the most recent fourth […]","2021-11-09 23:26:30","Entertainment","https://deadline.com/2021/11/snowfall-brandon-jay-mclaren-devaughn-nixon-tiffany-lonsdale-season-5-fx-series-1234870963/","7c15b03e7e61924c90edf327f30419ea9fa75d891484e9164931e717298b4fb9","43d7e843b5e98974cae4119132b032b5"
"London TV Screenings To Return In-Person; Major Distributors On Board","Deadline","Major global distributors All3Media International, Banijay Rights, eOne, Fremantle and ITV Studios are to return for the London TV Screenings next year from February 28 to March 4 in person. A spokeswoman for the screenings, which took place virtually last year, said they will “provide an unforgettable experience for buyers across the globe” as the […]","2021-11-10 09:35:33","Entertainment","https://deadline.com/2021/11/london-screenings-return-1234871236/","7c15b03e7e61924c90edf327f30419ea9fa75d891484e9164931e717298b4fb9","6b0f9286755e0e87b5488554f2e90eed"
"ITV CEO Hails ‘Outstanding’ Nine Months As Revenues Rise 28%","Deadline","ITV chief executive Carolyn McCall has hailed an “outstanding” nine months of this calendar year following a 28% increase in revenues to £2.4BN ($3.3BN), although total TV viewing declined by 5%. Revenues were also up 8% compared to the pre-pandemic 2019 period, as the UK network returns to full health following an advertising downturn driven […]","2021-11-10 09:24:09","Entertainment","https://deadline.com/2021/11/itv-results-nine-months-1234871233/","7c15b03e7e61924c90edf327f30419ea9fa75d891484e9164931e717298b4fb9","54c078c65fc8c9338aa5f54e6cf837d1"
"Netflix Is Making An English-Language Version Of Its Dystopian Korean Thriller ‘Time To Hunt’, Marking A First For The Streamer","Deadline","EXCLUSIVE: Move over Squid Games, it’s Time To Hunt. In an interesting development, we can reveal that Netflix is remaking its Korean-language movie Time To Hunt, marking the first time the streamer has adapted one of its local-language movies into English. The studio has come full circle, you might say. Netflix has set director Adam […]","2021-11-10 10:51:20","Entertainment","https://deadline.com/2021/11/squid-games-netflix-remake-korean-movie-time-to-hunt-adam-randall-1234871237/","7c15b03e7e61924c90edf327f30419ea9fa75d891484e9164931e717298b4fb9","1e7d3c9a06951eb832a7ad3712f936c6"
"Netflix Teams With Hirokazu Kore-eda; Streamer Also Unveils Russian Drama Series & Acquires French Show ‘Coyotes’ – Global Briefs","Deadline","Netflix Makes Deal With ‘Shoplifters’ Director Netflix has struck a deal with top Japanese auteur Hirokazu Kore-eda to develop two projects, a film and a series. Kore-eda, who won the Palme d’Or in 2018 with Shoplifters, said he would serve as a showrunner and will direct several episodes of the series in a video address […]","2021-11-10 10:20:58","Entertainment","https://deadline.com/2021/11/netflix-hirokazu-kore-eda-streamer-unveils-russian-drama-series-french-show-coyotes-1234871241/","7c15b03e7e61924c90edf327f30419ea9fa75d891484e9164931e717298b4fb9","3fb1c7b00903172b817775f84e86e820"
