"Neon Names Jason Wald VP Of Acquisitions & Production","Deadline","Jason Wald has joined NEON as Vice President of Acquisitions and Production. Wald will report to Jeff Deutchman, EVP of Acquisitions and Production, and will help the team curate their slate as the company continues to ramp up production. Wald previously served as the Director of Acquisitions at Searchlight Pictures, identifying and acquiring films for […]","2021-11-01 22:02:16","Entertainment","https://deadline.com/2021/11/neon-names-jason-wald-vp-of-acquisitions-production-1234866044/","7c15b03e7e61924c90edf327f30419ea9fa75d891484e9164931e717298b4fb9","c74583de9f7106ecac2701e650c30a21"
"Sony Pictures Worldwide Acquisitions & Stage 6 Films Expand Ranks – AFM","Deadline","EXCLUSIVE:  As AFM kicks off, Deadline has learned about some executive changes at Sony Pictures Worldwide Acquisitions and Stage 6 Films. Jon Freedberg has been promoted to EVP, Content Strategy & Operations of the division. He began with Sony Pictures Worldwide Acquisitions in 2008, and has been instrumental in shaping the strategic direction of the […]","2021-11-01 21:53:07","Entertainment","https://deadline.com/2021/11/sony-pictures-worldwide-acquisitions-stage-6-films-jon-freedberg-katie-anderson-daniel-de-boulay-1234866005/","7c15b03e7e61924c90edf327f30419ea9fa75d891484e9164931e717298b4fb9","ec1ee13253f1ccffd5db3c2aa0df00ed"
"Jeremy Irons & Tobin Bell Lead Cast In Darren Lynn Bousman Horror ‘Cello’; Pic Among Growing Number Of Productions To Film In Saudi Arabia","Deadline","EXCLUSIVE: Here’s an interesting one. Production has just wrapped on Cello, an under-the-radar English and Arabic-language horror movie shot in Saudi Arabia by Saw filmmaker Darren Lynn Bousman. Oscar winner Jeremy Irons (House Of Gucci) and Saw star Tobin Bell lead cast alongside Syrian actor Samer Ismail (The Day I Lost My Shadow) and Saudi actress Elham Ali (Ashman), […]","2021-11-01 21:32:17","Entertainment","https://deadline.com/2021/11/jeremy-irons-tobin-bell-darren-bousman-horror-movie-cello-saudi-arabia-1234865759/","7c15b03e7e61924c90edf327f30419ea9fa75d891484e9164931e717298b4fb9","61a4d05e0d546bb06b942e7fdec0bcd2"
"Jeffrey Donovan To Star In ‘Law & Order’ Revival On NBC","Deadline","Former Burn Notice star Jeffrey Donovan has been tapped as a lead in NBC’s upcoming Law & Order revival. He will play a new character, an NYPD detective, on Season 21 of Dick Wolf’s venerable crime drama. Along with a couple of high-profile new cast additions, led by Donovan, the new season is expected to […]","2021-11-01 21:30:04","Entertainment","https://deadline.com/2021/11/jeffrey-donovan-star-law-order-revival-nbc-1234865979/","7c15b03e7e61924c90edf327f30419ea9fa75d891484e9164931e717298b4fb9","16e29c802882ba4f86a54da4ee48d736"
"Bradley Cooper Launches New Production Label; Sets ‘Hyperion’ At Warner Bros With Graham King","Deadline","EXCLUSIVE: Eight-time Oscar nominee Bradley Cooper is launching a new production banner with Weston Middleton, Deadline has learned. At the same time, the duo are set to produce Hyperion based on the four-volume series of Dan Simmons novels, a project which Cooper has had long in the works. Hyperion now moves over from Syfy Channel to Warner […]","2021-11-01 21:17:34","Entertainment","https://deadline.com/2021/11/bradley-cooper-set-hyperion-at-warner-bros-with-graham-king-1234865881/","7c15b03e7e61924c90edf327f30419ea9fa75d891484e9164931e717298b4fb9","cd7022db02e6341fa366e42e73ea4f4c"
"‘Overlord’s Julius Avery To Direct Sony Pictures’ ‘Gantz’, Based On Popular Manga Comic Series","Deadline","EXCLUSIVE: After recently wrapping production on the anticipated adaptation of the manga comic Bullet Train, Sony Pictures is eyeing another popular Japanese comic series adaptation. Sources tell Deadline that Julius Avery has been set to direct Gantz for the studio. Based on the manga series written and illustrated by Hiroya Oku, the script will be adapted […]","2021-11-01 21:00:43","Entertainment","https://deadline.com/2021/11/overlords-julius-avery-sony-pictures-gantz-1234865947/","7c15b03e7e61924c90edf327f30419ea9fa75d891484e9164931e717298b4fb9","5cbfe003de28c0270b0e377e774e4a9e"
"‘Rust’ First AD Says He Hopes “No One Is Ever Harmed Through The Creative Process Again”; Admitted He Didn’t Properly Check Gun Before Fatal Shooting","Deadline","The Rust First Assistant Director who admitted he didn’t properly check the gun that killed cinematographer Halyna Hutchins last month is now calling on the film industry to make sure “no one is harmed through the creative process again.” Speaking publicly for the first time since the fatal shooting by star-producer Alec Baldwin on the […]","2021-11-01 20:58:35","Entertainment","https://deadline.com/2021/11/alec-baldwin-shooting-david-halls-statement-halyna-hutchins-rust-1234865938/","7c15b03e7e61924c90edf327f30419ea9fa75d891484e9164931e717298b4fb9","5a2900727f17b696fb9ef4b6c3d18749"
"‘Garfield’: Chris Pratt To Voice Title Character In Alcon Entertainment’s Animated Film","Deadline","Chris Pratt has signed on to voice the title character in a new animated Garfield film from Alcon Entertainment, Alcon co-founders and co-CEOs Andrew Kosove and Broderick Johnson announced today. Mark Dindal (Chicken Little, Emperor’s New Groove) is directing the film, based on the iconic comic strip of the same name, from a script by […]","2021-11-01 20:51:14","Entertainment","https://deadline.com/2021/11/garfield-chris-pratt-to-play-title-character-in-alcon-animated-film-1234865972/","7c15b03e7e61924c90edf327f30419ea9fa75d891484e9164931e717298b4fb9","85035c9654afc8a0710e789ec8eb112c"
"Aimee Garcia & Freddie Prinze Jr. To Star In Netflix Holiday Rom-Com From Director Gabriela Tagliavini","Deadline","EXCLUSIVE: Aimee Garcia (Dexter, Lucifer) and Freddie Prinze Jr. (She’s All That, Scooby-Doo) have signed on to star in an untitled holiday rom-com that Gabriela Tagliavini (Despite Everything) is directing for Netflix. Pic centers on Angelina, a pop star feeling career burnout, who escapes to grant a young fan’s wish in small town New York. There, […]","2021-11-01 20:33:11","Entertainment","https://deadline.com/2021/11/aimee-garcia-freddie-prinze-jr-to-star-in-netflix-holiday-rom-com-1234865948/","7c15b03e7e61924c90edf327f30419ea9fa75d891484e9164931e717298b4fb9","2f3bf6c4007a98e9ab6a318ffb8b9002"
"Norman Reedus, Sean Patrick Flanery & Director Troy Duffy Reunite For ‘The Boondock Saints III’ – AFM","Deadline","EXCLUSIVE: The Boondock Saints are back. Director Troy Duffy has reunited with Norman Reedus and Sean Patrick Flanery for Boondock Saints III, a new installment of the saga of fraternal twin Irish brothers Connor and Murphy MacManus, who go on a vigilante track. That starts after they dispatch two Russian mobsters in self defense, and […]","2021-11-01 20:09:50","Entertainment","https://deadline.com/2021/11/boondock-saints-3-norman-reedus-sean-patrick-flanery-troy-duffy-reunite-hot-afm-title-1234865849/","7c15b03e7e61924c90edf327f30419ea9fa75d891484e9164931e717298b4fb9","c9e43082fd15e3a962ee6ba7f26a3f4a"
"John Skipper & Dan Le Batard’s Meadowlark Media Inks First-Look Deal With Apple TV+","Deadline","Former ESPN colleagues John Skipper and Dan Le Batard (Highly Questionable, The Dan Le Batard Show with Stugotz) are getting into business with Apple TV+. Skipper and Le Batard have signed a multi-year first-look deal with the Apple streaming service via their recently launched Meadowlark Media. Under the pact, Meadowlark will produce premium documentary films […]","2021-11-01 20:00:38","Entertainment","https://deadline.com/2021/11/john-skipper-dan-le-batards-meadowlark-media-inks-first-look-deal-with-apple-tv-1234865867/","7c15b03e7e61924c90edf327f30419ea9fa75d891484e9164931e717298b4fb9","db5d40cf8bd4be9f52556fe3d48e6ff7"
"‘The List’: Jonah Platt, Chrissie Fit, Will Peltz & Zach Reino Board Indie Comedy","Deadline","EXCLUSIVE: Jonah Platt (Being the Ricardos), Chrissie Fitt (I Know What You Did Last Summer), Will Peltz (13 Minutes) and Zach Reino (Brews Brothers) have joined Halston Sage, Christian Navarro and Gregg Sulkin in the cast of The List, the indie comedy from director Melissa Miller Costanzo. The film written by Rob Lederer and Steve Vitolo […]","2021-11-01 19:46:02","Entertainment","https://deadline.com/2021/11/jonah-platt-chrissie-fit-will-peltz-zach-reino-join-the-list-1234865909/","7c15b03e7e61924c90edf327f30419ea9fa75d891484e9164931e717298b4fb9","fa1cc87104ab32c8b6ad1095d13f0201"
"‘Tiger King’ Star Carole Baskin Loses Bid To Halt Netflix’s Release Of “Odious” Sequel Series, For Now – Update","Deadline","UPDATE, 11:55 PM: Netflix won’t have to worry about Carole Baskin and her just filed contract lawsuit pulling the plug on the November 17 launch of Tiger King 2, at least not for now. Mere hours after Baskin and her husband sued the streamer and producers Royal Goode Productions over what they are calling “unauthorized” […]","2021-11-02 06:55:20","Entertainment","https://deadline.com/2021/11/tiger-king-lawsuit-netflix-carole-baskin-sequel-joe-exotic-1234866025/","7c15b03e7e61924c90edf327f30419ea9fa75d891484e9164931e717298b4fb9","645284f6c283e69dc2a1e5b4c5e29a72"
"30,000 Visitors Locked Inside Shanghai Disneyland For Hours By Chinese Government After 1 Positive Covid Case","Deadline","One woman who visited Shanghai Disneyland on Saturday either later tested positive for Covid or came into contact with someone who had it, according to reports. As a result, more than 30,000 visitors were locked in the park Sunday by Chinese government officials and forced to test negative before they were allowed to leave. According […]","2021-11-02 03:03:03","Entertainment","https://deadline.com/2021/11/shanghai-disneyland-visitors-locked-in-covid-1234866167/","7c15b03e7e61924c90edf327f30419ea9fa75d891484e9164931e717298b4fb9","1e3f5fd32b0d9ea325225c6f711af8ce"
"Montclair Honors ‘The Worst Person In The World; ‘Disfluency’ Wins Narrative Award At Austin Film Festival  – Fest Briefs","Deadline","The Montclair Film Festival (MFF) unveiled its 2021 winners, with Joachim Trier’s The Worst Person In The World taking the top prize. This year’s festival featured four competitive categories: Fiction, Documentary, Future/ Now, and New Jersey Filmmaking. Additionally, the Fiction and Documentary juries also awarded films for the festival’s Short Film competitions. The MFF also […]","2021-11-02 01:57:15","Entertainment","https://deadline.com/2021/11/austin-film-festival-monclair-1234866159/","7c15b03e7e61924c90edf327f30419ea9fa75d891484e9164931e717298b4fb9","cb908aa83a1e79bfc62d27d892c78e6b"
"‘Camp Friends’ Comedy Gets HBO Max Pilot Order","Deadline","EXCLUSIVE: HBO Max has picked up to pilot the half-hour family comedy Camp Friends (working title). The project, which was put in development by the WarnerMedia streamer earlier this year, is written by Lauren Herstik (American Vandal, Pearson) and produced by Adam Goodman for Invisible Narratives and Jax Media. The comedy revolves around four lifelong “camp […]","2021-11-01 23:34:12","Entertainment","https://deadline.com/2021/11/camp-friends-comedy-hbo-max-pilot-order-1234866095/","7c15b03e7e61924c90edf327f30419ea9fa75d891484e9164931e717298b4fb9","a404851bb7c6f905b96f9c2214afe6a9"
"Kevin Hart & Woody Harrelson Action Comedy ‘Man From Toronto’ Heads To Late Summer 2022","Deadline","UPDATED, 4:09 PM: The Man From Toronto is walking away from MLK weekend 2022 where Kevin Hart has traditionally launched his Ride Along movies and will now open on Aug. 12, 2022. Man From Toronto leaves behind Spyglass and Paramount’s reboot of Scream on MLK, as well as the Ben Affleck and Ana de Armas 20th Century Studios […]","2021-11-01 23:09:02","Entertainment","https://deadline.com/2021/11/kevin-hart-woody-harrelson-action-comedy-the-man-from-toronto-sets-mlk-2022-debut-1234733058/","7c15b03e7e61924c90edf327f30419ea9fa75d891484e9164931e717298b4fb9","f1ddd600ab9a8987a750bd70c3a05671"
"‘The Rookie’: Jenna Dewan Upped To Series Regular On ABC Series","Deadline","EXCLUSIVE: Jenna Dewan has been promoted to series regular for the current fourth season of ABC cop drama The Rookie. Dewan plays firefighter Bailey Nune. Fun and unpredictable with a subversive sense of humor, Bailey was asked out by Nolan (Nathan Fillion) after a meet-cute in the Season 3 finale. Dewan, who has recurred heavily […]","2021-11-01 22:05:44","Entertainment","https://deadline.com/2021/11/the-rookie-jenna-dewan-promoted-series-regular-bailey-nune-abc-1234865930/","7c15b03e7e61924c90edf327f30419ea9fa75d891484e9164931e717298b4fb9","e7e8c2dfc5ebd89be292655174b7a673"
"Neon Names Jason Wald VP Acquisitions & Production","Deadline","Jason Wald has joined Neon as VP Acquisitions and Production, reporting to Jeff Deutchman, EVP Acquisitions and Production. Wald will assist the team in curating the studio’s slate as it continues to ramp up production. Wald previously served as Director of Acquisitions at Searchlight Pictures, identifying and acquiring features for the label’s theatrical slate and […]","2021-11-01 22:02:16","Entertainment","https://deadline.com/2021/11/neon-names-jason-wald-vp-of-acquisitions-production-1234866044/","7c15b03e7e61924c90edf327f30419ea9fa75d891484e9164931e717298b4fb9","31c0406a89eb433da45fc7e008df8c5b"
"Robert Durst Indicted In New York In Death Of Wife Kathie Durst — Update","Deadline","UPDATED, 3 PM: Millionaire real estate heir Robert Durst was indicted for murder on Monday by a grand jury in Westchester County, New York, in the death of his former wife, Kathie, who disappeared in 1982. The second-degree murder indictment follows a criminal complaint that was filed against the 78-year-old Durst last month. Durst, the […]","2021-11-01 22:00:54","Entertainment","https://deadline.com/2021/11/robert-durst-charged-with-1982-murder-of-wife-kathie-durst-1234860687/","7c15b03e7e61924c90edf327f30419ea9fa75d891484e9164931e717298b4fb9","f31d6963cde4c672b610e5997e6f7951"
"Bradley Cooper Launches Production Label; Sets ‘Hyperion’ At Warner Bros With Graham King","Deadline","EXCLUSIVE: Eight-time Oscar nominee Bradley Cooper is launching a new production banner, Deadline has learned. At the same time, Cooper and Weston Middleton at the new label are set to produce Hyperion based on the four-volume series of Dan Simmons novels, a project Cooper has had long in the works. Hyperion now moves over from TV’s […]","2021-11-01 21:17:34","Entertainment","https://deadline.com/2021/11/bradley-cooper-set-hyperion-at-warner-bros-with-graham-king-1234865881/","7c15b03e7e61924c90edf327f30419ea9fa75d891484e9164931e717298b4fb9","a39a88122ec27088127398017a60540c"
"Keshet Productions’ Rebranded Unscripted Arm Interstellar Secures ITV Dance Format Pilot; ‘All Star Dance Off’ To Air At Christmas","Deadline","EXCLUSIVE: Keshet Productions’ rebranded UK non-scripted arm Interstellar has picked up an ITV pilot commission for a celebrity dance format. All Star Dance Off will most likely air around the Christmas period on youth-skewing portfolio channel ITV2, according to an ITV spokesman who confirmed the order. The format is in its early stages and Deadline […]","2021-11-02 09:00:21","Entertainment","https://deadline.com/2021/11/keshet-interstellar-itv2-pilot-1234865658/","7c15b03e7e61924c90edf327f30419ea9fa75d891484e9164931e717298b4fb9","5d16076e970255cee78f969b071d4fbc"
"‘Chernobyl’ Producer Sister Hires In-House Covid Supervisor","Deadline","EXCLUSIVE: Elisabeth Murdoch, Jane Featherstone and Stacy Snider’s Chernobyl producer Sister has hired an in-house Covid Supervisor for at least the next six months to oversee protocols on set. Neil Chordia, who runs Urban Hymn producer ChorMedia but has been Covid-supervising on various productions since the pandemic started, commences with an initial six-month contract having performed […]","2021-11-02 10:00:34","Entertainment","https://deadline.com/2021/11/chernobyl-and-the-split-producer-sister-signs-in-house-covid-supervisor-1234865677/","7c15b03e7e61924c90edf327f30419ea9fa75d891484e9164931e717298b4fb9","73a7405cfbfb322e2350524a6be00573"
"Former RTL Group CEO Bert Habets To Head Up Antenna Group","Deadline","EXCLUSIVE: Former RTL Group CEO Bert Habets has been appointed CEO of global media outfit Antenna Group. He replaces Jonathan Procter, who has returned to his native South Africa to be Group CEO of Primedia Group after a lengthy stint in charge of Antenna. Habets, who left Fremantle owner RTL in 2019, will oversee the […]","2021-11-02 09:30:20","Entertainment","https://deadline.com/2021/11/habets-to-head-antenna-group-1234866210/","7c15b03e7e61924c90edf327f30419ea9fa75d891484e9164931e717298b4fb9","02439e1d07101f7a910815de3fb91d32"
"Keshet Productions’ Rebranded Non-Scripted Arm Interstellar Secures ITV Dance Format Pilot; ‘All Star Dance Off’ To Air At Christmas","Deadline","EXCLUSIVE: Keshet Productions’ rebranded UK non-scripted arm Interstellar has picked up an ITV pilot commission for a celebrity dance format. All Star Dance Off will most likely air around the Christmas period on youth-skewing portfolio channel ITV2, according to an ITV spokesman who confirmed the order. The format is in its early stages and Deadline […]","2021-11-02 09:00:21","Entertainment","https://deadline.com/2021/11/keshet-interstellar-itv2-pilot-1234865658/","7c15b03e7e61924c90edf327f30419ea9fa75d891484e9164931e717298b4fb9","475ec6ffd16d85ddbcd5da4428fa658c"
"Gugu Mbatha-Raw and Edgar Ramírez To Star In Isabel Coixet’s ‘Nobody’s Heart’ – AFM","Deadline","Loki star Gugu Mbatha-Raw and Girl on the Train’s Edgar Ramírez are to star in passionate love story Nobody’s Heart from The Bookshop director Isabel Coixet. London sales house WestEnd Films has this week launched international sales on the pic, which enters production in January in Portugal and is being introduced at the American Film Market. […]","2021-11-02 12:00:02","Entertainment","https://deadline.com/2021/11/gugu-mbatha-raw-and-edgar-ramirez-to-star-in-isabel-coixets-nobodys-heart-afm-1234866219/","7c15b03e7e61924c90edf327f30419ea9fa75d891484e9164931e717298b4fb9","abea63fa4f411c48c4e02675c835b3d5"
"Mariah Carey Returns To AppleTV+ For Xmas Special ‘Mariah’s Christmas: The Magic Continues’","Deadline","Mariah Carey is returning for an AppleTV+ Christmas special for a second year in a row and is set to perform new single Fall In Love At Christmas exclusively alongside Khalid and Kirk Franklin. Mariah’s Christmas: The Magic Continues follows last year’s Mariah Carey’s Magical Christmas Special, which is still available on the SVoD platform. That special also […]","2021-11-02 13:00:11","Entertainment","https://deadline.com/2021/11/mariah-carey-returns-christmas-apple-1234866226/","7c15b03e7e61924c90edf327f30419ea9fa75d891484e9164931e717298b4fb9","7274f9039a5adb6cf1e9cc8bd15d3391"
"A24 Heads To ‘The Beach’, A Slow TV Docuseries From Warwick Thornton","Deadline","EXCLUSIVE: Warwick Thornton, one of Australia’s most celebrated filmmakers with features including Samson and Delilah and Sweet Country, self-isolated in a beach shack on the north-west coast of Australia in 2019. The Beach, a docuseries whose only subjects are Thornton, three chickens, a dog, and a mud crab, is the result and it is coming […]","2021-11-02 12:55:54","Entertainment","https://deadline.com/2021/11/a24-heads-to-the-beach-a-slow-tv-docuseries-from-warwick-thornton-1234866152/","7c15b03e7e61924c90edf327f30419ea9fa75d891484e9164931e717298b4fb9","45e713198d8c3a34bfb12681ec0fb8e8"
"John Morayniss & Former eOne Execs Launch Blink Studios With Endeavor Content Backing","Deadline","Former eOne Television chief John Morayniss has launched a new production venture with a handful of his former colleagues and backing from Endeavor Content. Morayniss, Patrice Theroux, Jeff Lynas and Nelson Kuo-Lee have established Blink Studios, headquartered in Toronto with offices in LA. The studio will develop and produce scripted and unscripted content for the […]","2021-11-02 14:00:00","Entertainment","https://deadline.com/2021/11/john-morayniss-former-eone-execs-launch-blink-studios-endeavor-content-1234866016/","7c15b03e7e61924c90edf327f30419ea9fa75d891484e9164931e717298b4fb9","2e63f680b481de5f550f57021e6876c4"
"Help! Beatles Manager Movie ‘Midas Man’ Shuts Down Mid-Shoot With Director Jonas Akerlund Unlikely To Continue","Deadline","EXCLUSIVE: The biopic of Beatles manager Brian Epstein, Midas Man, has shut down mid-shoot with director Jonas Akerlund unlikely to continue, we can reveal. Filming on the project began in Liverpool last month with cast including The Queen’s Gambit star Jacob Fortune-Lloyd as Epstein, Emily Watson, Eddie Marsan, Lukas Gage, Rosie Day and Bill Milner. […]","2021-11-02 13:42:10","Entertainment","https://deadline.com/2021/11/beatles-movie-midas-man-shuts-down-jonas-akerlund-director-1234866220/","7c15b03e7e61924c90edf327f30419ea9fa75d891484e9164931e717298b4fb9","8d8124585350b552828018fbcaf2962b"
"‘Morbius’ Trailer: Jared Leto Goes Full Vampire, Name Drops Venom In New Clip","Deadline","Talk about bad blood. Jared Leto’s Dr. Michael Morbius, suffering from a rare blood disorder, undergoes his own experimental treatment only to find an inner darkness unleashed. That’s all the backstory you’ll need for this new trailer from Columbia Pictures for Morbius, the upcoming installment in the Sony Pictures Universe of Marvel Characters set for […]","2021-11-02 13:33:58","Entertainment","https://deadline.com/2021/11/morbius-trailer-jared-leto-1234866234/","7c15b03e7e61924c90edf327f30419ea9fa75d891484e9164931e717298b4fb9","3c30d0b55e8887972ddbebf5c03e6223"
"Mariah Carey Returns To AppleTV+ For Holiday Special ‘Mariah’s Christmas: The Magic Continues’","Deadline","Mariah Carey is returning for an AppleTV+ Christmas special for a second year in a row and is set to perform new single Fall In Love At Christmas exclusively alongside Khalid and Kirk Franklin. Mariah’s Christmas: The Magic Continues follows last year’s Mariah Carey’s Magical Christmas Special, which is still available on the SVoD platform. That special also […]","2021-11-02 13:00:11","Entertainment","https://deadline.com/2021/11/mariah-carey-returns-christmas-apple-1234866226/","7c15b03e7e61924c90edf327f30419ea9fa75d891484e9164931e717298b4fb9","1bc8f52c5130fe8217109d10f788c6b1"
"Bahman Ghobadi’s ‘The Four Walls’ Trailer Unveiled On Tokyo International Film Fest Debut","Deadline","EXCLUSIVE: Here’s a trailer for Bahman Ghobadi’s highly-anticipated The Four Walls, which launched today at the Tokyo International Film Festival as part of its Main Competition. The film is produced by Roger Waters and follows Boran, a musician working in Istanbul away from his family. His wife has never seen the sea and he has worked […]","2021-11-02 14:38:26","Entertainment","https://deadline.com/2021/11/tokyo-four-walls-trailer-1234866268/","7c15b03e7e61924c90edf327f30419ea9fa75d891484e9164931e717298b4fb9","100ebdc7e1864603643b5be3aba8320c"
"Nexstar Media Group Posts Solid Q3 Results As Core Advertising Gains Offset 2020 Political Windfall","Deadline","Top U.S. local TV station owner Nexstar Media Group reported solid third-quarter results, with distribution and core advertising gains offsetting record 2020 political ad spending. The company’s total revenue gained 3.5% in the quarter compared with the same period a year ago, reaching $1.16 billion. Diluted earnings per share dipped to $3.90 from $4.08, but […]","2021-11-02 14:30:39","Entertainment","https://deadline.com/2021/11/nexstar-media-group-q3-results-political-advertisting-1234866235/","7c15b03e7e61924c90edf327f30419ea9fa75d891484e9164931e717298b4fb9","8925f70deface844142dccb16b71abf1"
"Red Sea International Film Fest Unveils Arab Spectacular; HanWay Films Strikes ‘Master Gardener’ Deals – Global Briefs","Deadline","Red Sea International Film Fest Unveils Arab Spectacular  Titles from Rashid Masharawi, Dhafer L’Abidine and Joana Hadjithomas comprise the eight initial films selected under the Red Sea International Film Festival’s (RedSeaIFF) Arab Spectacular strand. The inaugural edition of the festival will take place in Jeddah, Saudi Arabia from December 6-15. Titles within the Arab Spectacular […]","2021-11-02 14:22:11","Entertainment","https://deadline.com/2021/11/red-sea-film-fest-global-briefs-1234866248/","7c15b03e7e61924c90edf327f30419ea9fa75d891484e9164931e717298b4fb9","70a41604a1142c30b3e2e0279b2456e8"
"Ridley Scott To Be Honored With Cinema Audio Society’s Filmmaker Award","Deadline","Four-time Oscar nominee Ridley Scott will receive the Cinema Audio Society Filmmaker Award at the 58th Annual CAS Awards, taking place at the InterContinental Los Angeles Downtown on March 19, 2022. The prolific director-producer who most recently helmed 20th Century Studios’ The Last Duel and MGM and United Artists Releasing’s House of Gucci is being […]","2021-11-02 16:00:49","Entertainment","https://deadline.com/2021/11/ridley-scott-to-receive-cinema-audio-society-filmmaker-award-1234866040/","7c15b03e7e61924c90edf327f30419ea9fa75d891484e9164931e717298b4fb9","f3d1349b056b02f5ae49da921ee5af3a"
