"An Elite Athlete Shared the Workout He Hopes Will Help Him Break the Burpee World Record","Men's Health","Matt Sallis is gunning for a Guinness World Record of 7,500 reps in 12 hours. ","2021-11-09 15:02:00","Health","https://www.menshealth.com/fitness/a38198917/sas-who-dares-wins-matt-sallis-world-record-burpees/","85fa2e5fb8fdbe64416b0df0ad55951cce7e5a9cda8f2fb30236e0475f0a3b09","4c830cd8a8c94bb2883d7ddbf10266f2"
"Jonathan Majors Talks ‘Baptism By Fire’ Into the MCU and Gunwork on The Harder They Fall","Men's Health","The 32-year-old actor is starring in a brand new western, and might just be the Marvel Cinematic Universe's next big bad. And he's ready to talk about it. ","2021-11-09 16:22:00","Health","https://www.menshealth.com/entertainment/a38191210/jonathan-majors-the-harder-they-fall-snl-interview/","85fa2e5fb8fdbe64416b0df0ad55951cce7e5a9cda8f2fb30236e0475f0a3b09","e673cb908680bd12c1a20026b83b61ff"
"You Can Save Up to $150 Off on Amazon Televisions Right Now","Men's Health","As if you needed another reason to binge-watch your latest Netflix show.","2021-11-09 19:54:00","Health","https://www.menshealth.com/technology-gear/a38192349/amazon-television-sale/","85fa2e5fb8fdbe64416b0df0ad55951cce7e5a9cda8f2fb30236e0475f0a3b09","f7c9337eb895c4951deb575f6d293820"
"Burna Boy’s West African Diet Is the Healthiest Cheat Day","Men's Health","When you eat like Burna, every day feels like a cheat day.","2021-11-09 19:46:00","Health","https://www.menshealth.com/entertainment/a38199672/burna-boy-diet/","85fa2e5fb8fdbe64416b0df0ad55951cce7e5a9cda8f2fb30236e0475f0a3b09","96383b55a3cd685215aec0c2a24b19a3"
"The Voice at the End of Eternals Was Mahershala Ali's Blade","Men's Health","“That was the voice of one of my favorite superheroes, Mr. Blade himself, director Chloé Zhao said in an interview. Blade, Blade, Blade, yeah!”","2021-11-09 19:43:00","Health","https://www.menshealth.com/entertainment/a38200415/who-was-voice-end-eternals-mahershala-ali-blade/","85fa2e5fb8fdbe64416b0df0ad55951cce7e5a9cda8f2fb30236e0475f0a3b09","3cc5c385138df428f75de956a1a20cd4"
"This 4-Week Challenge Will Boost Your Sexual Intimacy","Men's Health","Think of it as a roadmap back to your partner. You know you need it.","2021-11-09 21:09:00","Health","https://www.menshealth.com/sex-women/a38201899/sexual-intimacy-challenge-mh-mvp/","85fa2e5fb8fdbe64416b0df0ad55951cce7e5a9cda8f2fb30236e0475f0a3b09","226151bc54bcbabc1ca2cdf1052d2e1f"
"Two Physical Therapists Demonstrate Why You're Probably Walking All Wrong","Men's Health","These little mistakes can add up over time and lead to pain, injuries, and more.  ","2021-11-10 15:54:00","Health","https://www.menshealth.com/health/a38210951/how-to-walk-physical-therapist-bob-brad-video/","85fa2e5fb8fdbe64416b0df0ad55951cce7e5a9cda8f2fb30236e0475f0a3b09","b14b9b4bc58b43112d1113b09fba45ea"
"Billy Joel Returns to Stage, Reveals That He Underwent Painful Back Surgery Earlier This Year","Men's Health","The 72-year-old returned to Madison Square Garden for the first time since the COVID-19 pandemic began, and since his painful back surgery that resulted in a 50 pound weight loss.","2021-11-10 15:28:00","Health","https://www.menshealth.com/health/a38210712/billy-joel-reveals-back-surgery-weight-loss/","85fa2e5fb8fdbe64416b0df0ad55951cce7e5a9cda8f2fb30236e0475f0a3b09","3349bb25f5aef30c177638d7999e529a"
"Scottie Pippen's Memoir Serves as Epilogue for The Last Dance","Men's Health","Nearly two years after Michael Jordan called the small forward's character into question, Unguarded fires back. ","2021-11-10 15:20:00","Health","https://www.menshealth.com/entertainment/a38210633/scottie-pippen-unguarded-memoir-the-last-dance-michael-jordan/","85fa2e5fb8fdbe64416b0df0ad55951cce7e5a9cda8f2fb30236e0475f0a3b09","50298cd821342a386802f4f8dd6d1a9d"
"What to Watch Out for the First Time You Visit a Tattoo Shop","Men's Health","Cheap tattoos aren't good and good tattoos aren't cheap.","2021-11-10 15:08:00","Health","https://www.menshealth.com/grooming/a38202848/tattoo-shop-red-flags/","85fa2e5fb8fdbe64416b0df0ad55951cce7e5a9cda8f2fb30236e0475f0a3b09","f95c02497ad280a71bc0a7e596d870b7"
"Watch Tyson Fury Batter His Brother With a Medicine Ball While Training to Fight Jake Paul","Men's Health","Tommy Fury is training hard ahead of his fight with the YouTuber-turned-boxer.","2021-11-10 15:02:00","Health","https://www.menshealth.com/fitness/a38210360/tyson-fury-tommy-fury-jake-paul-training/","85fa2e5fb8fdbe64416b0df0ad55951cce7e5a9cda8f2fb30236e0475f0a3b09","6ff248990e5f06b3742544f0a860975f"
"We Tested the iPhone 13 for Everyday Users","Men's Health","We tested the new smartphone for a few weeks to find out what really makes it tick for everyday users. ","2021-11-10 16:51:00","Health","https://www.menshealth.com/technology-gear/a38192598/iphone-13-review-test/","85fa2e5fb8fdbe64416b0df0ad55951cce7e5a9cda8f2fb30236e0475f0a3b09","ea690a9580f0da567f743867b0f5689d"
"These Are the Signs You're Dealing With a 'Low Grade' Narcissist","Men's Health","Psychologist Ramani Durvasula reveals how they differ from malignant narcissists. ","2021-11-10 16:12:00","Health","https://www.menshealth.com/sex-women/a38211285/narcissism-low-grade-signs-doctor-ramani-durvasula/","85fa2e5fb8fdbe64416b0df0ad55951cce7e5a9cda8f2fb30236e0475f0a3b09","a9075b9b33cb142ade9277c1eff024a7"
"13 Ways To Smoke Your Back Using Dumbbells","Men's Health","Pullups and chinups aren't the only way to add muscle and strength to your lats and midback.","2021-11-10 20:54:00","Health","https://www.menshealth.com/fitness/a28941843/best-dumbbell-back-exercises/","85fa2e5fb8fdbe64416b0df0ad55951cce7e5a9cda8f2fb30236e0475f0a3b09","6cbe8113587af2c72043fd6b753c272b"
"Paul Rudd Named Sexiest Man Alive at Age 52","Men's Health","I'm getting business cards made, the Ant-Man star said ","2021-11-10 19:20:00","Health","https://www.menshealth.com/entertainment/a38213163/paul-rudd-sexiest-man-alive-age-52-ant-man/","85fa2e5fb8fdbe64416b0df0ad55951cce7e5a9cda8f2fb30236e0475f0a3b09","e975d0ced46a9bf28d023ae77e0340d7"
"The 11 Best Feeling Condoms for Pleasure","Men's Health","The best prophylactics for pleasure.","2021-11-10 19:16:00","Health","https://www.menshealth.com/sex-women/a19529719/4-best-feeling-condoms/","85fa2e5fb8fdbe64416b0df0ad55951cce7e5a9cda8f2fb30236e0475f0a3b09","f280003f60deca236e2754af1d16505d"
"Yep, That's Hugh Jackman Playing a Penis With Abs in Big Mouth","Men's Health","He said the abs were nonnegotiable.","2021-11-10 19:14:00","Health","https://www.menshealth.com/entertainment/a38212501/hugh-jackman-big-mouth-penis/","85fa2e5fb8fdbe64416b0df0ad55951cce7e5a9cda8f2fb30236e0475f0a3b09","4d65ec0a5328fca7cbd22ec63f066037"
"Celebrities React to Paul Rudd Being Named People’s Sexiest Man Alive","Men's Health","I have mixed emotions about this, Judd Apatow said. ","2021-11-10 17:48:00","Health","https://www.menshealth.com/entertainment/a38210882/paul-rudd-sexiest-man-alive-reactions/","85fa2e5fb8fdbe64416b0df0ad55951cce7e5a9cda8f2fb30236e0475f0a3b09","5193e17a7b6d95935a2844b4e71cd359"
"Buck Mason Just Released Your New Favorite Winter Coat","Men's Health","The line of responsibly-made down outerwear will make you feel like the outdoorsman you aspire to be.","2021-11-10 17:33:00","Health","https://www.menshealth.com/style/a38164177/buck-mason-responsible-down-jacket-vest-cascade-news/","85fa2e5fb8fdbe64416b0df0ad55951cce7e5a9cda8f2fb30236e0475f0a3b09","4d06c4351cc61e5aad909a4150f7884e"
"Everything You Need to Do to Be Healthy After Getting a Tattoo","Men's Health","Keep your skin and your tat looking good with these tips.","2021-11-11 12:53:00","Health","https://www.menshealth.com/style/a38199553/tattoo-aftercare-guide/","85fa2e5fb8fdbe64416b0df0ad55951cce7e5a9cda8f2fb30236e0475f0a3b09","a0a2003d3738ae525cd18d4a162201db"
"Sexplain It: I Broke My Ex's Heart. Now We Have to Spend a Holiday Together.","Men's Health","In this week's column, Zachary Zane answers the age-old question: How can you stay friends with an ex?  ","2021-11-11 14:00:00","Health","https://www.menshealth.com/sex-women/a38189576/sexplain-it-friends-with-an-ex/","85fa2e5fb8fdbe64416b0df0ad55951cce7e5a9cda8f2fb30236e0475f0a3b09","e902ee96d09b1affdf66360bc2f9a430"
"The Rock's Stunt Double Talks About Training to Keep Up With an Action Icon","Men's Health","Two decades as Dwayne Johnson’s stunt performer have taught Tanoi Reed one major lesson: Always be ready for action.","2021-11-11 14:00:00","Health","https://www.menshealth.com/fitness/a38213676/tanoai-reed-the-rock-stuntman-workout/","85fa2e5fb8fdbe64416b0df0ad55951cce7e5a9cda8f2fb30236e0475f0a3b09","76b2cdee2670cb402325d5d5186c5288"
"A Bodybuilder Dubbed the ‘Iranian Hulk’ Is Punching Concrete Walls to Prepare for His Boxing Match","Men's Health","Misguided, innovative, or impressive? You decide. ","2021-11-11 13:38:00","Health","https://www.menshealth.com/fitness/a38221868/iranian-hulk-shares-video-of-him-punching-concrete-walls/","85fa2e5fb8fdbe64416b0df0ad55951cce7e5a9cda8f2fb30236e0475f0a3b09","bc1a5d18a30f4e98da6aa796a58b034f"
"Sylvester Stallone Says He Almost Died After His Rocky IV Fight With Dolph Lundgren","Men's Health","The actor recalled spending several days in the ICU after his co-star pulverized him.","2021-11-11 14:56:00","Health","https://www.menshealth.com/entertainment/a38222252/sylvester-stallone-dolph-lundgren-rocky-4-fight-icu/","85fa2e5fb8fdbe64416b0df0ad55951cce7e5a9cda8f2fb30236e0475f0a3b09","c79f7278fa39a1cab42eb489b79bfee4"
"This Spider-Man Theory Predicts How Andrew Garfield and Tobey Maguire Could Appear Together in 'No Way Home'","Men's Health","Spider-Me(ta) 🕷","2021-11-11 14:38:00","Health","https://www.menshealth.com/entertainment/a38222350/spider-man-no-way-home-andrew-garfield-tobey-maguire-cameo-actors/","85fa2e5fb8fdbe64416b0df0ad55951cce7e5a9cda8f2fb30236e0475f0a3b09","3f25cf70b7f9835fbcf8729ea8ccdf81"
"This 72-Year-Old Powerlifter Just Broke 4 World Records—for the Second Time","Men's Health","Rudy Kadlub hit several lifting milestones at a recent world meet, and made history in the progress.","2021-11-11 15:41:00","Health","https://www.menshealth.com/fitness/a38222672/powerlifter-rudy-kadlub-4-world-records-age-72/","85fa2e5fb8fdbe64416b0df0ad55951cce7e5a9cda8f2fb30236e0475f0a3b09","ef72c8334eca2bdeb81934c7b21f5bf7"
"Henry Cavill Wants to ‘Explore the Psyche of Superman’","Men's Health","'The Witcher' star says he would ‘love the opportunity’ to play Superman again. ","2021-11-11 15:14:00","Health","https://www.menshealth.com/entertainment/a38222686/the-witcher-henry-cavill-superman-future-psyche-cape-closet/","85fa2e5fb8fdbe64416b0df0ad55951cce7e5a9cda8f2fb30236e0475f0a3b09","776eb61baec17f585d8f4e58a43a1edb"
"Sexplain It Live: I'll Forgive My GF for Cheating With a Woman if We Can Have a Threesome","Men's Health","Zachary Zane and Whoreible Decision's Mandii B discuss cheating and bisexual threesomes.","2021-11-11 15:09:00","Health","https://www.menshealth.com/sex-women/a38213645/sexplain-it-bisexual-threesome/","85fa2e5fb8fdbe64416b0df0ad55951cce7e5a9cda8f2fb30236e0475f0a3b09","6d481073e81bf0067d3d041f473cceea"
"Here's How the NYC Marathon's Oldest Finisher Crushed His Race at 83","Men's Health","Stephen Wertheimer, a still-practicing orthopedic surgeon, offered up his two best pieces of advice. ","2021-11-11 21:54:00","Health","https://www.menshealth.com/fitness/a38226576/new-york-marathon-oldest-finisher-stephen-wertheimer/","85fa2e5fb8fdbe64416b0df0ad55951cce7e5a9cda8f2fb30236e0475f0a3b09","0a19648a3a91e7e4d225bb41c3e1c585"
"A Top Trainer Shared His Simple Hack for Building Greater Strength and Size","Men's Health","Jeff Cavaliere explains the training technique that can help to boost your gains with just one key shift.","2021-11-11 21:23:00","Health","https://www.menshealth.com/fitness/a38223216/compensatory-acceleration-training-jeff-cavaliere-athlean-x/","85fa2e5fb8fdbe64416b0df0ad55951cce7e5a9cda8f2fb30236e0475f0a3b09","8ccc8f11da6d0843adde206a2742e928"
"We Can't Talk About MSG Without Talking About Racism","Men's Health","Monosodium glutamate has been blamed for everything from brain damage to cancer and heart palpitations. Except decades of research have established that MSG is generally safe. Why does the myth linger?","2021-11-11 20:00:00","Health","https://www.menshealth.com/health/a37808983/msg-racism-chinese-restaurant-syndrome/","85fa2e5fb8fdbe64416b0df0ad55951cce7e5a9cda8f2fb30236e0475f0a3b09","770118ec5a874d59c91cff7a5db70018"
"The Ultimate Guide to the Best Jackets for Men","Men's Health","They're all about excess, but in the best possible way.","2021-11-11 19:54:00","Health","https://www.menshealth.com/style/a38056860/best-jackets-for-men/","85fa2e5fb8fdbe64416b0df0ad55951cce7e5a9cda8f2fb30236e0475f0a3b09","148ab9a13a1b52b89fa2d48579b765d7"
"This Yellowstone Fan Theory Says a Major Character Is Actually a Ghost","Men's Health","It's probably not true, but let's wildly speculate, anyway.","2021-11-11 19:46:00","Health","https://www.menshealth.com/entertainment/a38224205/yellowstone-theory-is-kayce-dead/","85fa2e5fb8fdbe64416b0df0ad55951cce7e5a9cda8f2fb30236e0475f0a3b09","240a6ff8b6602d1eaeff8d3ae1aec9b0"
"Burger King's Cult-Favorite Italian Original Chicken Sandwich Is Back. Here's How Healthy It Is","Men's Health","How does it stack up to the OG?","2021-11-11 19:24:00","Health","https://www.menshealth.com/nutrition/a38224347/burger-kings-italian-original-chicken-sandwich-healthy/","85fa2e5fb8fdbe64416b0df0ad55951cce7e5a9cda8f2fb30236e0475f0a3b09","42fc763b4e3b1962a4bbe440e0f9b05a"
"Nike is Having a Secret Early Black Friday Sale Right Now","Men's Health","We're talking shoes, workout gear, and clothing for up to 40 percent off. ","2021-11-11 19:03:00","Health","https://www.menshealth.com/technology-gear/a38211596/nike-black-friday-deals/","85fa2e5fb8fdbe64416b0df0ad55951cce7e5a9cda8f2fb30236e0475f0a3b09","0645ae08dbe69c59acb7108ca97b542c"
"Godfather of Bodybuilding Charles Glass Breaks Down an Arm-Building Superset","Men's Health","Crush your bis and tris with this pump-producing workout. ","2021-11-11 18:44:00","Health","https://www.menshealth.com/fitness/a38223034/bodybuilding-charles-glass-biceps-triceps-workout/","85fa2e5fb8fdbe64416b0df0ad55951cce7e5a9cda8f2fb30236e0475f0a3b09","87b504a121e37341eeb84b533a5b4946"
"A Renowned Cannabis Scientist Shared His Best Advice for Using Weed to Treat Stress and Anxiety","Men's Health","If the past year pushed you toward THC, you're not alone. Here's what you need to know.","2021-11-11 17:14:00","Health","https://www.menshealth.com/health/a38222581/marijuana-cannabis-thc-stress-anxiety-doctor-igor-grant/","85fa2e5fb8fdbe64416b0df0ad55951cce7e5a9cda8f2fb30236e0475f0a3b09","1c7447a76e4b9138d83aa8068cd74b07"
"Zac Efron Is Sporting an Epic Moustache in His New Movie 'The Greatest Beer Run Ever'","Men's Health","Is someone doing Movember?","2021-11-12 13:54:00","Health","https://www.menshealth.com/entertainment/a38233935/the-greatest-beer-run-ever-zac-efron-facial-hair/","85fa2e5fb8fdbe64416b0df0ad55951cce7e5a9cda8f2fb30236e0475f0a3b09","cf1147f8ce3f72911c2cf273cc351528"
"This Tattoo Shop Removed My Racist Ink for Free","Men's Health","My kids can be proud of who I am now. Looking at my body, because of the new tattoos, I can finally see beauty.","2021-11-12 15:00:00","Health","https://www.menshealth.com/trending-news/a38172086/michael-kent-tattoo-cover-up/","85fa2e5fb8fdbe64416b0df0ad55951cce7e5a9cda8f2fb30236e0475f0a3b09","dc9459045592f829706f3239046aa5a6"
"This 'Anxious Millennial Cowboy' Is the Future of Pro Wrestling","Men's Health","Before he could reach the All Elite Wrestling World Championship, Adam Page had to grapple with himself.","2021-11-12 14:30:00","Health","https://www.menshealth.com/trending-news/a38225563/adam-page-hangman-aew/","85fa2e5fb8fdbe64416b0df0ad55951cce7e5a9cda8f2fb30236e0475f0a3b09","d7f769da2f3d2fe6a789a9b2a14910f6"
"4 Winter Outfits for Men to Elevate Their Casual Style","Men's Health","The ideal layering equations to stay warm and look cool. ","2021-11-12 14:25:00","Health","https://www.menshealth.com/style/a35569545/winter-outfits-for-men/","85fa2e5fb8fdbe64416b0df0ad55951cce7e5a9cda8f2fb30236e0475f0a3b09","f33a04565d8f0ca88551ad0b2fa2f93a"
"Restomod Treatment Elevates 1980s Hyundai Grandeur to a New Level","Men's Health","Hyundai reached into its past and turned this boxy sedan into a retro-futuristic EV.","2021-11-12 15:24:00","Health","https://www.menshealth.com/technology-gear/a38235114/hyundai-grandeur-restomod-ev/","85fa2e5fb8fdbe64416b0df0ad55951cce7e5a9cda8f2fb30236e0475f0a3b09","33e8dc31cfc183ca590f9c01f24f2e7b"
"Joe Rogan Says He's 'Flexible' Enough to Go Down on Himself","Men's Health","More like Blow Rogan, amirite? *Ba-doom-tss!*","2021-11-12 16:56:00","Health","https://www.menshealth.com/entertainment/a38236152/joe-rogan-auto-fellatio/","85fa2e5fb8fdbe64416b0df0ad55951cce7e5a9cda8f2fb30236e0475f0a3b09","01a2f6fb7c70c5bdf0ed49a6b6528c89"
"The Rock Pranks Ryan Reynolds After Red Notice Premiere","Men's Health","Ryan Reynolds Uses His Mom's Netflix Account, a billboard said. ","2021-11-12 17:30:00","Health","https://www.menshealth.com/entertainment/a38235013/dwayne-johnson-pranks-ryan-reynolds-red-notice/","85fa2e5fb8fdbe64416b0df0ad55951cce7e5a9cda8f2fb30236e0475f0a3b09","a17193a51e708cfc1acb39dd0b2f3a71"
"Dwayne ‘The Rock’ Johnson Finally Explains Why He Pees in Water Bottles During His Workouts","Men's Health","I usually stay pretty hydrated, Johnson said. I need to go to the bathroom a lot","2021-11-12 17:17:00","Health","https://www.menshealth.com/fitness/a38236278/the-rock-johnson-pees-in-water-bottles-workouts-explanation/","85fa2e5fb8fdbe64416b0df0ad55951cce7e5a9cda8f2fb30236e0475f0a3b09","4bfe9462bc7f979b3d13954935180378"
"5 Life Tips From a Former Navy SEAL","Men's Health","What military life taught this vet about mental toughness and refusing to quit.","2021-11-12 20:30:00","Health","https://www.menshealth.com/trending-news/a38188468/5-life-tips-from-a-former-navy-seal/","85fa2e5fb8fdbe64416b0df0ad55951cce7e5a9cda8f2fb30236e0475f0a3b09","d66daf8543b921b67191e956790cf6b3"
"Anti-Vaxxers Are Trying to 'Undo' Their Vaccines by Bathing in Borax","Men's Health","An osteopathic doctor is seen on video encouraging the bath.","2021-11-12 20:03:00","Health","https://www.menshealth.com/health/a38237415/borax-detox-bath-undo-vaccine/","85fa2e5fb8fdbe64416b0df0ad55951cce7e5a9cda8f2fb30236e0475f0a3b09","c22231f84b50eb3fb4d4998ee84ca389"
"How to Find the Best Deals During Black Friday and Cyber Monday 2021","Men's Health","Get the top holiday discounts from Amazon, Best Buy, Walmart, and more.","2021-11-12 21:42:00","Health","https://www.menshealth.com/technology-gear/a38235900/black-friday-cyber-monday-deals-sales/","85fa2e5fb8fdbe64416b0df0ad55951cce7e5a9cda8f2fb30236e0475f0a3b09","9a7ee7689c41ba93ce63c7537b975c79"
"A Top Trainer Shares Why He Trains to Failure","Men's Health","You'll make gains by leaving reps in the tank—but you need to know where how much it takes for you to fail.  ","2021-11-12 21:41:00","Health","https://www.menshealth.com/fitness/a38237766/workout-to-failure-eugene-teo/","85fa2e5fb8fdbe64416b0df0ad55951cce7e5a9cda8f2fb30236e0475f0a3b09","7a555d8fcfbfb7bb9977dd944b15978e"
"Dress Like a Yellowstone Character with These Fall Staples and Merch","Men's Health","It's all about layers—and that iconic sweater.","2021-11-12 21:17:00","Health","https://www.menshealth.com/style/a38234202/yellowstone-show-merchandise/","85fa2e5fb8fdbe64416b0df0ad55951cce7e5a9cda8f2fb30236e0475f0a3b09","da99aafe9f8086985920e03a8e48a08b"
"Marvel Reveals First Look at Oscar Isaac in Moon Knight Series on Disney+","Men's Health","Isaac will face off with another A-lister in the upcoming Disney+ series. ","2021-11-12 22:46:00","Health","https://www.menshealth.com/entertainment/a34484059/moon-knight-disney-plus-cast-details/","85fa2e5fb8fdbe64416b0df0ad55951cce7e5a9cda8f2fb30236e0475f0a3b09","bdd6b84d3f0990a32d27b6d058dd9f65"
"How to Watch Shang-Chi and the Legend of the Ten Rings on Disney+ Right Now","Men's Health","Good, because you need to watch Tony Leung's badass villain as soon as possible. ","2021-11-12 22:13:00","Health","https://www.menshealth.com/entertainment/a38238993/how-to-watch-shang-chi/","85fa2e5fb8fdbe64416b0df0ad55951cce7e5a9cda8f2fb30236e0475f0a3b09","6c974083784cd0039904a710590c6abd"
"Is Red Notice Getting a Sequel? What We Know About Red Notice 2","Men's Health","The film's producer has intimated it could become a franchise. ","2021-11-12 23:30:00","Health","https://www.menshealth.com/entertainment/a38212010/red-notice-2-release-date-cast-news/","85fa2e5fb8fdbe64416b0df0ad55951cce7e5a9cda8f2fb30236e0475f0a3b09","c7f0f381f9809faa607b3c6b5884ab7b"
"Are the Three Cleopatra Eggs in Red Notice Real? Here Is the True Story of the Cleopatra Eggs.","Men's Health","Still, the movie’s story was so convincing, many Hollywood producers believed it.","2021-11-13 00:30:00","Health","https://www.menshealth.com/entertainment/a38211491/red-notice-cleopatra-eggs-true-story/","85fa2e5fb8fdbe64416b0df0ad55951cce7e5a9cda8f2fb30236e0475f0a3b09","cc75981399ac5288d683bf38f2409c82"
"What Happened Last Night onYellowstone? Here's Our Recap of Season 4 Episode 3.","Men's Health","It was a bloodbath.","2021-11-15 02:00:00","Health","https://www.menshealth.com/entertainment/a38235169/yellowstone-season-4-episode-3-recap/","85fa2e5fb8fdbe64416b0df0ad55951cce7e5a9cda8f2fb30236e0475f0a3b09","5ff5a2c959096c64c866f2561e66af38"
"Mayor of Kingstown's Kingstown Isn't Real, But Places Like It Are","Men's Health","Co-creator Hugh Dillon says it's based on his hometown. ","2021-11-14 17:00:00","Health","https://www.menshealth.com/entertainment/a38238286/mayor-of-kingstown-is-kingstown-real/","85fa2e5fb8fdbe64416b0df0ad55951cce7e5a9cda8f2fb30236e0475f0a3b09","a7bd59d155b520686bb1cc6066f216f2"
"A Top Trainer Shared His Simple 4-Week Plan to Burn Serious Belly Fat","Men's Health","Jeremy Ethier explains how to lose weight sustainably in four simple steps.  ","2021-11-14 15:00:00","Health","https://www.menshealth.com/fitness/a38245165/lose-belly-fat-four-week-plan-jeremy-ethier-top-trainer/","85fa2e5fb8fdbe64416b0df0ad55951cce7e5a9cda8f2fb30236e0475f0a3b09","d4aab49766194ff0dc67fe47512c0825"
"Here's Exactly What Happens When You Quit Porn","Men's Health","Science YouTuber Greg Brown breaks down what happens to your brain and your body when you stop watching porn.","2021-11-14 14:30:00","Health","https://www.menshealth.com/sex-women/a38244822/quitting-porn-side-effects/","85fa2e5fb8fdbe64416b0df0ad55951cce7e5a9cda8f2fb30236e0475f0a3b09","956498e943e29cca1214f2c53b7dffda"
"Pete Davidson Spoofed Joe Rogan in a Hilarious and Biting SNL Sketch","Men's Health","I used to host 'Fear Factor' and now doctors fear me.","2021-11-14 14:05:00","Health","https://www.menshealth.com/entertainment/a38245247/pete-davidson-joe-rogan-snl/","85fa2e5fb8fdbe64416b0df0ad55951cce7e5a9cda8f2fb30236e0475f0a3b09","6a47cdf09ce54b93c8f2dba0984341b0"
"The Simpsons Will Finally Give Smithers a Boyfriend","Men's Health","Mr. Burns' long-suffering right-hand man will fall in love in this year's Thanksgiving episode.","2021-11-14 14:00:00","Health","https://www.menshealth.com/entertainment/a38244794/the-simpsons-smithers-boyfriend-openly-gay/","85fa2e5fb8fdbe64416b0df0ad55951cce7e5a9cda8f2fb30236e0475f0a3b09","bb783825d419ba285b8e2a80bb28ce41"
"Fans Have a Lot to Say After Seeing Sam Elliott, Faith Hill, and Tim McGraw in the New '1883' Trailer","Men's Health","Yellowstone fans in particular can’t wait for the December 19 premiere.","2021-11-14 13:20:00","Health","https://www.menshealth.com/entertainment/a38245096/1883-yellowstone-spinoff-trailer-fan-reactions/","85fa2e5fb8fdbe64416b0df0ad55951cce7e5a9cda8f2fb30236e0475f0a3b09","366e277b648c9cad4141129414545e2b"
"Twitter Roasts Jake Gyllenhaal as Taylor Swift Releases a 10-Minute Version of 'All Too Well'","Men's Health","How I'm sleeping tonight knowing I’m not Jake Gyllenhaal’s publicist.","2021-11-14 13:14:00","Health","https://www.menshealth.com/entertainment/a38245181/twitter-roasts-jake-gyllenhaal-taylor-swift-all-too-well/","85fa2e5fb8fdbe64416b0df0ad55951cce7e5a9cda8f2fb30236e0475f0a3b09","18b3e102b7c6a8ceb22c9d8f07e16cc0"
"Dwayne 'The Rock' Johnson Explained The Thought Process Behind His Crazy Cheat Meals","Men's Health","There's a method to the madness.","2021-11-14 13:05:00","Health","https://www.menshealth.com/entertainment/a38245160/what-dwayne-the-rock-johnson-eats-in-a-day/","85fa2e5fb8fdbe64416b0df0ad55951cce7e5a9cda8f2fb30236e0475f0a3b09","b62bbc87e58bb52883955be804a06ca4"
"49 Tons of Trader Joe’s Chicken Patties Recalled After Reports of Bone Fragments","Men's Health","You may want to check your freezer before making dinner tonight.","2021-11-14 13:00:00","Health","https://www.menshealth.com/health/a38245156/trader-joes-chicken-patties-recall-due-to-bone-fragments/","85fa2e5fb8fdbe64416b0df0ad55951cce7e5a9cda8f2fb30236e0475f0a3b09","7c506807919bd9519233313f19088ae1"
"Watch This Guy Try to Wear a 150-Pound Weighted Vest for an Entire Day","Men's Health","YouTuber Brandon William tests how well he can run, swim, and jump in the world's heaviest weighted vest.","2021-11-13 16:17:00","Health","https://www.menshealth.com/fitness/a38242475/weight-vest-workout-150-pounds-brandon-william-youtube/","85fa2e5fb8fdbe64416b0df0ad55951cce7e5a9cda8f2fb30236e0475f0a3b09","31123f41f229d4189ac1d76b449afc53"
"Patrick Schwarzenegger Showed Off His Jacked Arms in a New Workout Video","Men's Health","Personal trainer Ben Bruno shared a clip of Schwarzenegger's arm day gunshow.","2021-11-13 15:45:00","Health","https://www.menshealth.com/fitness/a38242397/patrick-schwarzenegger-biceps-arms-workout-ben-bruno-video/","85fa2e5fb8fdbe64416b0df0ad55951cce7e5a9cda8f2fb30236e0475f0a3b09","11b4655c7596d8d9f91875bff6385d72"
