"PSA: Mirror is Taking $500 Off its Home Gym System","Men's Health","Oh, and did we mention there's free shipping?","2021-11-01 20:56:00","Health","https://www.menshealth.com/technology-gear/a35059058/mirror-deal-holiday-sale/","85fa2e5fb8fdbe64416b0df0ad55951cce7e5a9cda8f2fb30236e0475f0a3b09","be11263f428feb351784ffdf88138a26"
"Watch This Bodybuilder Try Track & Field for the First Time in 10 Years","Men's Health","He was previously a competitive long and triple jumper—but now he's almost 30 pounds heavier.","2021-11-01 20:24:00","Health","https://www.menshealth.com/fitness/a38122385/bodybuilder-track-and-field-matt-does-fitness/","85fa2e5fb8fdbe64416b0df0ad55951cce7e5a9cda8f2fb30236e0475f0a3b09","6a5a218e50414c4ead601308c9e519cb"
"A Doctor Explains Jameis Winston's 'Season-Ending' Knee Injury","Men's Health","Dr. Brian Sutterer explains the damage in a new video.","2021-11-01 20:04:00","Health","https://www.menshealth.com/health/a38126296/jameis-winston-knee-injury/","85fa2e5fb8fdbe64416b0df0ad55951cce7e5a9cda8f2fb30236e0475f0a3b09","0eadadcd1cf2800b3f0b8dcb99adb606"
"Bose Wireless Headphones Are $100 Off on Amazon Right Now","Men's Health","Tune out the world with these top-rated noise-canceling headphones.","2021-11-01 19:59:00","Health","https://www.menshealth.com/technology-gear/a38124155/bose-wireless-headphones-sale/","85fa2e5fb8fdbe64416b0df0ad55951cce7e5a9cda8f2fb30236e0475f0a3b09","6d8fb88ab286de269c13ae39630705a4"
"Join Men's Health and Women's Health for a Virtual Turkey Trot This Year","Men's Health","It's all going down on Thanksgiving day.","2021-11-01 19:19:00","Health","https://www.menshealth.com/trending-news/a34313954/virtual-turkey-trot-1/","85fa2e5fb8fdbe64416b0df0ad55951cce7e5a9cda8f2fb30236e0475f0a3b09","79224f65dc982b2bcd9092607a44a1d3"
"The New Beats Earbuds Are Perfect for Your Workout","Men's Health","The Beats Fit Pros rethink the ear loop to deliver the security and comfort you want when you train.","2021-11-01 19:16:00","Health","https://www.menshealth.com/technology-gear/a38123121/beats-fit-pro-wireless-earbuds-review/","85fa2e5fb8fdbe64416b0df0ad55951cce7e5a9cda8f2fb30236e0475f0a3b09","6dc0107ad711e3e0f69172b5ef54a960"
"Is Hans Wagner From Army of Thieves Real?","Men's Health","The zombie franchise's backstory explained.","2021-11-01 17:54:00","Health","https://www.menshealth.com/entertainment/a38123870/hans-wagner-army-of-thieves/","85fa2e5fb8fdbe64416b0df0ad55951cce7e5a9cda8f2fb30236e0475f0a3b09","be6fba91c8c45ab60603c4733c4a405d"
"The 21 Best White Sneakers for Men to Stay On-Trend This Year","Men's Health","Because the right shoes can make all the difference.","2021-11-01 17:35:00","Health","https://www.menshealth.com/style/a19521820/white-sneakers-for-men/","85fa2e5fb8fdbe64416b0df0ad55951cce7e5a9cda8f2fb30236e0475f0a3b09","724d06cbc0b02e129c8ab9518c8511c2"
"The 18 Best Hiking Boots and Sneakers for Hitting the Trail","Men's Health","Brave any tough terrain with comfort and style.","2021-11-01 17:29:00","Health","https://www.menshealth.com/trending-news/a19538395/best-hiking-boots/","85fa2e5fb8fdbe64416b0df0ad55951cce7e5a9cda8f2fb30236e0475f0a3b09","f309d8d9e0913f6fe6e5581d9968fead"
"The 54 Best Gifts for Gamers This Holiday Season","Men's Health","They'll never leave the couch.  ","2021-11-01 17:28:00","Health","https://www.menshealth.com/trending-news/a19544873/video-game-gifts/","85fa2e5fb8fdbe64416b0df0ad55951cce7e5a9cda8f2fb30236e0475f0a3b09","554cbe6c0d68604ca1970612a617bcc2"
"Bill Murray Responds to Revealing His MCU Debut In Ant-Man and the Wasp: Quantumania","Men's Health","Jimmy Kimmel drilled the comedy legend during a recent late night appearance. ","2021-11-01 17:27:00","Health","https://www.menshealth.com/entertainment/a38124822/bill-murray-confirms-marvel-rumors-ant-man-and-the-wap-quantumania/","85fa2e5fb8fdbe64416b0df0ad55951cce7e5a9cda8f2fb30236e0475f0a3b09","4c944422031fde14fb520c94788e95df"
"Chris Hemsworth Went as a Terrifying TV Monster for Halloween","Men's Health","The actor paid tribute to 'Stranger Things' at a costume party with his wife Elsa Pataky. ","2021-11-01 17:02:00","Health","https://www.menshealth.com/entertainment/a38124200/chris-hemsworth-stranger-things-demogorgon-halloween-costume/","85fa2e5fb8fdbe64416b0df0ad55951cce7e5a9cda8f2fb30236e0475f0a3b09","97df2f352f1bc49daf83416f3fbbeca5"
"CrossFit Champs and a Returning Strongman Ruled the Rogue Invitational","Men's Health","Martins Licis made a triumphant return to competition, while CrossFit's top winners extended their reign.","2021-11-01 16:50:00","Health","https://www.menshealth.com/fitness/a38122468/rogue-invitational-2021-winners/","85fa2e5fb8fdbe64416b0df0ad55951cce7e5a9cda8f2fb30236e0475f0a3b09","168ff35cea2c4ced6f5af91d8ba0fcd0"
"Powerbeats Pro Earbuds Are at Their Best Price Ever on Amazon","Men's Health","They'll be your go-to headphones for workouts. ","2021-11-01 16:39:00","Health","https://www.menshealth.com/technology-gear/a34976503/beats-powerbeats-pro-sale/","85fa2e5fb8fdbe64416b0df0ad55951cce7e5a9cda8f2fb30236e0475f0a3b09","e19f634844cbdd0fe5c8e52d31d51ed2"
"Cop The Latest Roomba Model for Its Lowest Price Ever on Amazon","Men's Health","Invest in this Roomba model and be the robot overlord of your dreams.","2021-11-01 16:28:00","Health","https://www.menshealth.com/technology-gear/a38122630/roomba-j7-sale-amazon/","85fa2e5fb8fdbe64416b0df0ad55951cce7e5a9cda8f2fb30236e0475f0a3b09","46140f790a631323e2b91c5132e19eb1"
"Sexologist Jaiya From Sex, Love & Goop Explains How She Can Orgasm Without Being Touched","Men's Health","It's like a vibration moving through my whole body, says Jaiya from 'Sex, Love & Goop.'","2021-11-01 16:12:00","Health","https://www.menshealth.com/sex-women/a38122110/jaiya-sex-love-and-goop-interview/","85fa2e5fb8fdbe64416b0df0ad55951cce7e5a9cda8f2fb30236e0475f0a3b09","3da03b6b418d9fed7ab0bb3a62d9cf3a"
"Scientists Think Your Fingers Can Predict Your Penis Size","Men's Health","A new kind of golden ratio.","2021-11-01 16:08:00","Health","https://www.menshealth.com/health/a38123633/index-finger-penis-size-ratio-tiktok/","85fa2e5fb8fdbe64416b0df0ad55951cce7e5a9cda8f2fb30236e0475f0a3b09","ada013416688a819da5d6f2193ec75e7"
"A Doctor Explains How to Get Rid of an Unwanted Boner in Just 30 Seconds","Men's Health","Dr. Karan Raj shares the science-approved way of unpitching your tent.","2021-11-01 15:50:00","Health","https://www.menshealth.com/sex-women/a38123537/unwanted-boner-doctor-explains-karan-raj/","85fa2e5fb8fdbe64416b0df0ad55951cce7e5a9cda8f2fb30236e0475f0a3b09","1fafd008c4eeccd729afc65b0a18a2a1"
"Luke Evans Shows Off His Shredded Six-Pack in Shirtless Gym Selfie","Men's Health","The actor's muscle transformation is on full display in his latest Monday motivation post.","2021-11-01 15:24:00","Health","https://www.menshealth.com/fitness/a38123066/luke-evans-six-pack-abs-shirtless-selfie/","85fa2e5fb8fdbe64416b0df0ad55951cce7e5a9cda8f2fb30236e0475f0a3b09","6d0e8b32e8695e480ae3fb7fd4bfb082"
"This 650-HP Chevy Beast Looks Like a Real-Life Halo Warthog","Men's Health","Chevy is showing off this off-road concept at the SEMA show, and it's powered by the same supercharged V-8 as the C7 Corvette Z06.  ","2021-11-02 04:00:00","Health","https://www.menshealth.com/entertainment/a38126196/chevy-beast-concept-revealed/","85fa2e5fb8fdbe64416b0df0ad55951cce7e5a9cda8f2fb30236e0475f0a3b09","b7343feb62571e350160ad3215826523"
"These High-Tech Outfits Will Get You Through Winter","Men's Health","Climate controlled.","2021-11-02 04:00:00","Health","https://www.menshealth.com/style/a38063074/winter-trends-for-men/","85fa2e5fb8fdbe64416b0df0ad55951cce7e5a9cda8f2fb30236e0475f0a3b09","a8e0055b4d0d5ce73aa53527baf3469c"
"Don Lee Taps His Fighter's Strength for Marvel's Eternals","Men's Health","The MCU's Gilgamesh started as a boxer and fight trainer—and he keeps that intensity as he preps for hard-hitting movie roles. ","2021-11-02 13:00:00","Health","https://www.menshealth.com/fitness/a38125010/don-lee-eternals-workout/","85fa2e5fb8fdbe64416b0df0ad55951cce7e5a9cda8f2fb30236e0475f0a3b09","6de339ac402df8e4b02daa838e463b64"
"David Goggins Just Shared How a Brutal Leg Injury Only Made Him Stronger","Men's Health","We must learn to adapt and overcome any and all obstacles that are in front of us.","2021-11-02 13:00:00","Health","https://www.menshealth.com/health/a38133320/david-goggins-leg-injury-instagram-video/","85fa2e5fb8fdbe64416b0df0ad55951cce7e5a9cda8f2fb30236e0475f0a3b09","ad9f63edebc452ad7cfc1975041c7719"
"“All Hell Was Breaking Loose”: Inside the Day Camp Fire Ravaged Paradise High's Football Program","Men's Health","When Coach Rick Prinz woke up on November 8, 2018, he had no idea the day ahead of him would change his life. ","2021-11-02 13:00:00","Health","https://www.menshealth.com/entertainment/a38123374/bill-plaschke-book-paradise-found/","85fa2e5fb8fdbe64416b0df0ad55951cce7e5a9cda8f2fb30236e0475f0a3b09","8a2fc136f0ff6d905a2640373b951595"
"Succession's Nicholas Braun Explained What He Shares in Common With Cousin Greg","Men's Health","I generally have the same haircut...","2021-11-02 12:34:00","Health","https://www.menshealth.com/entertainment/a38125525/succession-nicholas-braun-similarities-character/","85fa2e5fb8fdbe64416b0df0ad55951cce7e5a9cda8f2fb30236e0475f0a3b09","401a6cdd8add7b5d95a6d4e5a8b0067f"
"This New Morbius Trailer Teases Numerous Spider-Man Villains","Men's Health","Dr Michael Morbius, at your service.","2021-11-02 14:58:00","Health","https://www.menshealth.com/entertainment/a38134532/morbius-trailer-2-spider-man-venom-reference-villains-breakdown/","85fa2e5fb8fdbe64416b0df0ad55951cce7e5a9cda8f2fb30236e0475f0a3b09","32083c2f8eb4127f8569a0727edec2c9"
"Amazon Just Knocked $100 Off the Fitbit Sense for Its Lowest Price Yet","Men's Health","Now's your chance to get this top-rated smartwatch at a discount.","2021-11-02 14:26:00","Health","https://www.menshealth.com/technology-gear/a37374686/fitbit-sense-amazon-deal/","85fa2e5fb8fdbe64416b0df0ad55951cce7e5a9cda8f2fb30236e0475f0a3b09","ca71abd860f244db6dc939295f2db323"
"Colin in Black & White Is Redefining Black Masculinity","Men's Health","Ava DuVernay and the show's directors reveal how they brought Colin Kaepernick's untold story to Netflix.","2021-11-02 14:16:00","Health","https://www.menshealth.com/entertainment/a38107468/colin-in-black-and-white-ava-duvernay-interview/","85fa2e5fb8fdbe64416b0df0ad55951cce7e5a9cda8f2fb30236e0475f0a3b09","155b96bba104f770f3823a3a0932ac31"
"1 in 4 Women Say Cyberflashing Has Increased During the Pandemic","Men's Health","Whipping out your member for an impromptu solo photo shoot is illegal in various places, FYI.","2021-11-02 14:12:00","Health","https://www.menshealth.com/sex-women/a38134222/cyberflashing-has-increased-during-the-pandemic/","85fa2e5fb8fdbe64416b0df0ad55951cce7e5a9cda8f2fb30236e0475f0a3b09","bb2ed3511997b85cb1f8e36286bb6176"
"A Doctor Explains What to Expect From Titan Derrick Henry's Foot Surgery","Men's Health","Dr. David Abbasi shares what you need to know about the running back's Jones fracture and expected recovery time.","2021-11-02 14:10:00","Health","https://www.menshealth.com/health/a38133799/nfl-derrick-henry-foot-surgery-doctor-explains-david-abbasi/","85fa2e5fb8fdbe64416b0df0ad55951cce7e5a9cda8f2fb30236e0475f0a3b09","29a5917dd1f07bf46e2cab1c0b53c8e6"
"Upgrade Your Sweats With Allbirds' Simple (But Not Boring) New R&R Line","Men's Health","All the pieces are effortless, laid-back, and perfect basics to add to your wardrobe.","2021-11-02 15:10:00","Health","https://www.menshealth.com/style/a38081440/allbirds-r-and-r-loungewear-news/","85fa2e5fb8fdbe64416b0df0ad55951cce7e5a9cda8f2fb30236e0475f0a3b09","8159dffe68c5405d9478f9b6cfd6397d"
"Men Over 40 Can Build Stronger Shoulders With the L-Raise","Men's Health","Build 3D shoulder muscles with this joint-friendly exercise.  ","2021-11-02 15:10:00","Health","https://www.menshealth.com/fitness/a38134287/men-over-40-l-raise/","85fa2e5fb8fdbe64416b0df0ad55951cce7e5a9cda8f2fb30236e0475f0a3b09","526e27c174c6eac2c0278b8e7260f69d"
"The One 'Pimple' You Absolutely Shouldn't Pop","Men's Health","Unless you want a gnarly toe infection.","2021-11-02 17:32:00","Health","https://www.menshealth.com/health/a38136786/toe-pimple-you-should-not-pop/","85fa2e5fb8fdbe64416b0df0ad55951cce7e5a9cda8f2fb30236e0475f0a3b09","97a1f3667ae4c134b4e1fa9a2364faac"
"'Godfather of Bodybuilding' Charles Glass Shares a Simple Muscle-Building Pushup Hack","Men's Health","The training legend demonstrates a pushup variation that can help to boost your chest gains.","2021-11-02 17:15:00","Health","https://www.menshealth.com/fitness/a38134680/bodybuilding-charles-glass-pushup-muscle-advice/","85fa2e5fb8fdbe64416b0df0ad55951cce7e5a9cda8f2fb30236e0475f0a3b09","6e623b70476626edbda3ee30a73b9bb9"
"Here Are All the Major Filming Locations Paramount Uses to Shoot Yellowstone","Men's Health","You can even spend the night at the real Dutton Ranch.","2021-11-02 18:20:00","Health","https://www.menshealth.com/entertainment/a38135070/yellowstone-filming-locations/","85fa2e5fb8fdbe64416b0df0ad55951cce7e5a9cda8f2fb30236e0475f0a3b09","3680c2a547249820064d0820caa2fbf8"
"How Morbius Could Be Part of the MCU—Or Another Spider-Man Universe","Men's Health","Jared Leto's blood-sucking vampire seems to be opening a lot of different doors. ","2021-11-02 17:56:00","Health","https://www.menshealth.com/entertainment/a38135479/is-morbius-part-of-the-mcu/","85fa2e5fb8fdbe64416b0df0ad55951cce7e5a9cda8f2fb30236e0475f0a3b09","a33ca6ce4d7182564e1140f225bf2ad4"
"Canelo Álvarez Shares the Workout He Uses to Build Knockout Power","Men's Health","The world's top pound-for-pound boxer shares his workout regimen.","2021-11-02 19:52:00","Health","https://www.menshealth.com/fitness/a38135580/canelo-alvarez-workout-boxing-training/","85fa2e5fb8fdbe64416b0df0ad55951cce7e5a9cda8f2fb30236e0475f0a3b09","f3536c507332874a905b2494c48ae5fb"
"Chris Hemsworth Revealed His Hulk-Size Biceps in a New Boxing Workout Photo","Men's Health","The actor unloaded on the heavy bag while fighting his way through jet lag. ","2021-11-02 19:23:00","Health","https://www.menshealth.com/fitness/a38137392/chris-hemsworth-biceps-boxing-workout-photo/","85fa2e5fb8fdbe64416b0df0ad55951cce7e5a9cda8f2fb30236e0475f0a3b09","dc8ed12c1ced4bdd7fe85c7a99255f6b"
"Conor McGregor Shared a New Angle of His Horrible Leg Break While Fighting Dustin Poirier","Men's Health","Can see the leg was broke before I even stood up.","2021-11-03 12:53:00","Health","https://www.menshealth.com/health/a38145408/conor-mcgregor-shares-new-angle-of-horror-leg-break/","85fa2e5fb8fdbe64416b0df0ad55951cce7e5a9cda8f2fb30236e0475f0a3b09","fb0a1db55216bd2996908d9029364f2b"
"Homer Meets Goofy in Disney's First Look at the 'Simpsons' Crossover Special","Men's Health","An unprecedented event.","2021-11-03 12:43:00","Health","https://www.menshealth.com/entertainment/a38145272/the-simpsons-disney-crossover-short/","85fa2e5fb8fdbe64416b0df0ad55951cce7e5a9cda8f2fb30236e0475f0a3b09","1096e8b7721bf94e54e4f11793517907"
"The Navy Just Set Up a Hospital in a Norwegian Cave","Men's Health","The U.S. Military spends a surprising amount of time underground in Norway.","2021-11-03 12:35:00","Health","https://www.menshealth.com/health/a38133366/us-navy-hospital-norwegian-cave/","85fa2e5fb8fdbe64416b0df0ad55951cce7e5a9cda8f2fb30236e0475f0a3b09","c2c7b9076fa09895742ebace30a581f9"
"Hafþór 'Thor' Björnsson Shares the Diet and Cardio Workout Behind His 110-Pound Weight Loss","Men's Health","Champion strongman Hafþór Björnsson reveals the daily diet and endurance session that are responsible for his new lean physique.","2021-11-03 12:34:00","Health","https://www.menshealth.com/weight-loss/a38145207/hafthor-thor-bjornsson-shares-diet-and-cardio-workout/","85fa2e5fb8fdbe64416b0df0ad55951cce7e5a9cda8f2fb30236e0475f0a3b09","764e17b3dbc8d8d15ea026960ff972ec"
"Rapper Cordae Just Showed Off His Weight Loss in a 'Before and After' Photo","Men's Health","The musician, who is dating tennis star Naomi Osaka, said he has been working on elevating his mind, body, and spirit.","2021-11-03 13:59:00","Health","https://www.menshealth.com/weight-loss/a38145692/cordae-weight-loss-transformation-before-after-instagram/","85fa2e5fb8fdbe64416b0df0ad55951cce7e5a9cda8f2fb30236e0475f0a3b09","9e5ab28b432581a76957178f66826b72"
"A Detailed Look at Every Upcoming MCU Movie and TV Series","Men's Health","We've still got another Disney+ series and a major cinematic event ahead of us in 2021. ","2021-11-03 14:42:00","Health","https://www.menshealth.com/entertainment/a35795140/upcoming-marvel-movies-tv-shows-release-schedule/","85fa2e5fb8fdbe64416b0df0ad55951cce7e5a9cda8f2fb30236e0475f0a3b09","e78aa34fc24d0451453280a63fa97f3a"
"Powerlifter Mark Bell Says a Charles Poliquin-Style Workout Made John Cena Puke","Men's Health","He discussed the routine on his podcast with functional bodybuilding trainer Marcus Filly.","2021-11-03 14:25:00","Health","https://www.menshealth.com/fitness/a38146130/mark-bell-john-cena-marcus-filly-charles-poliquin-workout/","85fa2e5fb8fdbe64416b0df0ad55951cce7e5a9cda8f2fb30236e0475f0a3b09","6f30b51e9ae9a44378779d5375bb03a9"
"The Angels of Michigan","Men's Health","The demand for organ transplants—kidneys, livers, hearts, lungs—is at an all-time high, and with more rural hospitals closing in recent years, the role of air-medicine teams is evolving rapidly. These elite nurses and surgeons may one day be your lifeline. Here are 24 hours with one of the nation’s top air-medicine units.","2021-11-03 16:00:00","Health","https://www.menshealth.com/trending-news/a37928414/survival-flight-michigan-air-medicine/","85fa2e5fb8fdbe64416b0df0ad55951cce7e5a9cda8f2fb30236e0475f0a3b09","5750cfd68d9c2cdb522ffd21d08fbbc5"
"Your Genes Play a Role in Why You're Obsessed With Coffee","Men's Health","The hardwired reason you can't go a day without your cuppa.","2021-11-03 16:48:00","Health","https://www.menshealth.com/health/a38147357/genes-that-make-you-love-coffee/","85fa2e5fb8fdbe64416b0df0ad55951cce7e5a9cda8f2fb30236e0475f0a3b09","9d5bedcee329277911955fb6b33e0e0c"
"A Top Trainer Ranked Shoulder Exercises From Best to Worst","Men's Health","Jeff Cavaliere of Athlean-X breaks down his picks shoulder-building moves that will give you maximum gains—and which exercises to avoid. ","2021-11-03 17:47:00","Health","https://www.menshealth.com/fitness/a38146533/shoulder-exercises-ranked-jeff-cavaliere-athlean-x/","85fa2e5fb8fdbe64416b0df0ad55951cce7e5a9cda8f2fb30236e0475f0a3b09","8615c86c5231cad49e8868bce1f35170"
"Sony's Top-Rated WH-1000XM4 Headphones Are On Sale for Its Cheapest Price Yet","Men's Health","Get a head start on holiday shopping (for someone special or yourself) with this incredible deal. ","2021-11-03 18:37:00","Health","https://www.menshealth.com/technology-gear/a36397204/sony-wireless-headphones-deal-amazon/","85fa2e5fb8fdbe64416b0df0ad55951cce7e5a9cda8f2fb30236e0475f0a3b09","3c25892bf93be2fe204d6fc4925387b7"
"The Best Makeup for Men to Put Your Best Face Forward","Men's Health","Think of it as camo for your face.  ","2021-11-03 19:13:00","Health","https://www.menshealth.com/grooming/a25334947/best-makeup-for-men/","85fa2e5fb8fdbe64416b0df0ad55951cce7e5a9cda8f2fb30236e0475f0a3b09","a45fe3934f0072160f53c6a31508a47b"
"The Tacozilla Tacoma Camper Is Retro Overlanding Perfection","Men's Health","It's the coolest Toyota truck we've seen all year. ","2021-11-04 04:00:00","Health","https://www.menshealth.com/entertainment/a38145399/tacozilla-tacoma-camper-is-an-overlanding-home/","85fa2e5fb8fdbe64416b0df0ad55951cce7e5a9cda8f2fb30236e0475f0a3b09","acc90019bd47c6a031156374809a7ed9"
"The Gun-Toting Nat Love From The Harder They Fall Was a Real Cowboy—But He Didn't Have a Gang","Men's Health","The real version of the man played on screen by Jonathan Majors was a well-known hero of the Old West. ","2021-11-03 22:00:00","Health","https://www.menshealth.com/entertainment/a38149364/the-harder-they-fall-nat-love-gang/","85fa2e5fb8fdbe64416b0df0ad55951cce7e5a9cda8f2fb30236e0475f0a3b09","a26a3c63f6397548020895ad5d5db3e7"
"'Game of Thrones' Star Gemma Whelan Says Filming Sex Scenes Was a 'Frenzied Mess'","Men's Health","Between the actors there was always an instinct to check in with each other.","2021-11-04 12:48:00","Health","https://www.menshealth.com/entertainment/a38145374/game-of-thrones-gemma-whelan-sex-scenes/","85fa2e5fb8fdbe64416b0df0ad55951cce7e5a9cda8f2fb30236e0475f0a3b09","d7b6995c0103b78a88b0cd42eb1c6c8d"
"The Sopranos Creator David Chase Finally Explained Tony's Fate","Men's Health","The cut-to-black moment has been contested by fans for years. The show's creator has now revealed exactly what happens after.","2021-11-04 12:47:00","Health","https://www.menshealth.com/entertainment/a38151003/sopranos-ending-tony-fate-explained-david-chase-interview/","85fa2e5fb8fdbe64416b0df0ad55951cce7e5a9cda8f2fb30236e0475f0a3b09","4cc5210d50787743165c19fa1e9bf4c7"
"Pollution May Be Lowering Your Sperm Count, Scientists Warn","Men's Health","New research connects the dots on how breathing polluted air impacts fertility. ","2021-11-04 12:45:00","Health","https://www.menshealth.com/health/a38133382/pollution-may-be-lowering-your-sperm-count/","85fa2e5fb8fdbe64416b0df0ad55951cce7e5a9cda8f2fb30236e0475f0a3b09","e9090475bcd3721fded8239288202ae5"
"Adidas Collaborated With Xbox on a Console-Inspired Sneaker","Men's Health","What do gamers and sneakerheads have in common? They'll all want this shoe.","2021-11-04 14:00:00","Health","https://www.menshealth.com/style/a38150741/adidas-xbox-360-sneakers/","85fa2e5fb8fdbe64416b0df0ad55951cce7e5a9cda8f2fb30236e0475f0a3b09","8dbb734ba35fc3501d8b0f8b812dc7f1"
"CrossFit and the CICO Diet Helped Me Lose 165 Pounds and Get Fit","Men's Health","I’m more comfortable with travel and social situations now. I’ve truly started to love myself. ","2021-11-04 13:38:00","Health","https://www.menshealth.com/health/a38147400/crossfit-cico-diet-weight-loss-transformation-success-story/","85fa2e5fb8fdbe64416b0df0ad55951cce7e5a9cda8f2fb30236e0475f0a3b09","8c8da5703ae163bb68ace9f2c1c9b265"
"This Challenging Core Flow Hits Every Part of Your Abs","Men's Health","Build core strength and challenge hip mobility with this windmill flow variation. ","2021-11-04 13:00:00","Health","https://www.menshealth.com/fitness/a38151016/kettlebell-windmill-core/","85fa2e5fb8fdbe64416b0df0ad55951cce7e5a9cda8f2fb30236e0475f0a3b09","36a2ea2690aab4408b61f6574c0d9bf4"
"Don't Count on Leaving Your Family Death Benefits if You're Unvaccinated","Men's Health","You’re trying to protect yourselves and your employees, both from themselves and the general public.”","2021-11-04 15:56:00","Health","https://www.menshealth.com/health/a38160740/unvaccinated-death-benefits-covid/","85fa2e5fb8fdbe64416b0df0ad55951cce7e5a9cda8f2fb30236e0475f0a3b09","a10cafde388ecec98b06037c6cb3c5cd"
"Papa John's Founder John Schnatter Says He's Had 800 Pizzas in the Last 18 Months","Men's Health","He's determined to prove that the quality has deteriorated since his departure from the company.","2021-11-04 15:53:00","Health","https://www.menshealth.com/nutrition/a38160429/papa-johns-john-schnatter-800-pizzas-18-months/","85fa2e5fb8fdbe64416b0df0ad55951cce7e5a9cda8f2fb30236e0475f0a3b09","6e8ac5dfba8f706f1d8e6f60585175ad"
"8 Pushup Variations That Will Boost Your Workout","Men's Health","Try these spins on the basic exercise to target different muscles, ratchet up the difficulty, and crush monotony. ","2021-11-04 15:48:00","Health","https://www.menshealth.com/fitness/a38151180/push-up-variations/","85fa2e5fb8fdbe64416b0df0ad55951cce7e5a9cda8f2fb30236e0475f0a3b09","d7fd0e5be39f5a4125158d8674d67bb7"
"A 60-Day Fitness Challenge Helped This Guy Jump More Than 4 Inches Higher","Men's Health","YouTuber Brendan Jones spent two months training his lower body in order to improve his performance on the basketball court.","2021-11-04 15:25:00","Health","https://www.menshealth.com/fitness/a38158397/jump-higher-fitness-challenge-60-days-goal-guys/","85fa2e5fb8fdbe64416b0df0ad55951cce7e5a9cda8f2fb30236e0475f0a3b09","1e59f9a1526a1e0d0090e14192ec21fc"
"Get the Garmin Venu Smartwatch for $150 Off on Amazon","Men's Health","Since the watch is at its best price ever, you can guarantee zero buyers remorse, champ.","2021-11-04 16:35:00","Health","https://www.menshealth.com/technology-gear/a38159119/garmin-venu-smartwatch-sale/","85fa2e5fb8fdbe64416b0df0ad55951cce7e5a9cda8f2fb30236e0475f0a3b09","cefa144c516a0c7d14700f3e99e48f34"
"Don’t Believe All the Bone Broth Hype","Men's Health","I’m a dietitian who loves the stuff—but influencers want you to think it’s magic.","2021-11-04 16:25:00","Health","https://www.menshealth.com/nutrition/a38158686/bone-broth-health-benefits/","85fa2e5fb8fdbe64416b0df0ad55951cce7e5a9cda8f2fb30236e0475f0a3b09","7a2a735cfff0cfd3ccdb633e9e940a37"
"The 10 Best Hairstyles For Men With Thinning Hair","Men's Health","Experts share their tips for working with what you got. ","2021-11-04 16:25:00","Health","https://www.menshealth.com/grooming/a34849191/thin-hair-mens-hairstyles/","85fa2e5fb8fdbe64416b0df0ad55951cce7e5a9cda8f2fb30236e0475f0a3b09","f5a0635993fb29d81593392feb98df29"
"The Rock Pledges to Stop Using Real Guns in All of His Future Movies","Men's Health","Following the death of Halyna Hutchins on the set of 'Rust', Hollywood is taking a serious look at its safety practices.","2021-11-04 16:19:00","Health","https://www.menshealth.com/entertainment/a38160789/the-rock-dwayne-johnson-movie-set-gun-ban/","85fa2e5fb8fdbe64416b0df0ad55951cce7e5a9cda8f2fb30236e0475f0a3b09","701ba1fa2675f0a6709a662603c912d8"
