"Upsets Happen In College Football. ‘Trap Games’? Not So Much.","FiveThirtyEight - Sports","Mel Tucker was ready. His Michigan State football team had just delivered a statement win, rallying from 16 points down to beat rival Michigan 37-33. The Spartans had soared to No. 5 in the AP Top 25 poll and would be unveiled at No. 3 in the season’s first College Football Playoff rankings. And their […]","2021-11-12 11:00:00","Sports","https://fivethirtyeight.com/features/upsets-happen-in-college-football-trap-games-not-so-much/","9d72044fbd7218714a72f0a80f70e10a205f0547cc5ca0ecd2c7963a71e1f712","0331221c7c60f576ae700d03b4dcc70c"
"Alex Ovechkin Isn’t Too Old To Be (And Beat) A Great One","FiveThirtyEight - Sports","Famed Washington Capitals left wing Alexander Ovechkin has been zooming up the NHL’s all-time goal-scoring ranks lately. Going into the 2021-22 season, Ovechkin was sixth on the career goals list with 730, which trailed No. 5 Marcel Dionne by a goal and No. 4 Brett Hull by 11. Fast-forward four weeks, and Ovechkin has long […]","2021-11-12 15:24:35","Sports","https://fivethirtyeight.com/features/alex-ovechkin-isnt-too-old-to-be-and-beat-a-great-one/","9d72044fbd7218714a72f0a80f70e10a205f0547cc5ca0ecd2c7963a71e1f712","12329a0b9ebe4e487467dea4ac7a1e99"
"One Group Of Student-Athletes Is Conspicuously Absent From NIL Deals","FiveThirtyEight - Sports","Nouredin Nouili woke up on July 1 nervous and excited. It was the first day in the 115-year history of the NCAA that athletes would be afforded the same fundamental rights as their college peers: the ability to monetize their names, images and likenesses. Overnight, nearly half a million athletes across all 50 states could […]","2021-11-15 11:00:00","Sports","https://fivethirtyeight.com/features/one-group-of-student-athletes-is-conspicuously-absent-from-nil-deals/","9d72044fbd7218714a72f0a80f70e10a205f0547cc5ca0ecd2c7963a71e1f712","d02d2558a53a0c525240145f9bbc6df6"
"Are We Buying Or Selling The Patriots?","FiveThirtyEight - Sports","sara.ziegler (Sara Ziegler, sports editor): It seems like each week of this NFL season has ended with more questions than answers, and Week 10 fit that bill. Tampa Bay looked like a shadow of its former self against a pretty uninspiring Washington Football Team; a Kansas City offense that had struggled against everyone suddenly couldn’t […]","2021-11-15 18:32:14","Sports","https://fivethirtyeight.com/features/are-we-buying-or-selling-the-patriots/","9d72044fbd7218714a72f0a80f70e10a205f0547cc5ca0ecd2c7963a71e1f712","9546400418469ec82d902e4e50b55560"
"Royce O’Neale Is The Latest Midcareer Player To Break Out For The Jazz","FiveThirtyEight - Sports","When Quin Snyder was hired to coach the Utah Jazz prior to the 2014-15 season as part of the franchise’s first real “rebuild” in decades, he came with a clear mandate for player development. Seven-plus years in, his track record here is getting hard to ignore. While a young star like Donovan Mitchell often draws […]","2021-11-16 11:00:00","Sports","https://fivethirtyeight.com/features/royce-oneale-is-the-latest-midcareer-player-to-break-out-for-the-jazz/","9d72044fbd7218714a72f0a80f70e10a205f0547cc5ca0ecd2c7963a71e1f712","7bdc82dc0d8af7001b6808e64871261d"
"It’s Early, But The Carolina Hurricanes Are Playing Like Stanley Cup Favorites","FiveThirtyEight - Sports","Among the usual favorites — the talent-stacked Colorado Avalanche, perennial-powerhouse Vegas Golden Knights and two-time-defending-champ Tampa Bay Lightning — there’s a somewhat unexpected name atop our Stanley Cup forecast with nearly one-fifth of the regular season completed: the Carolina Hurricanes, who have won 11 of their 13 contests this year and now have a league-best […]","2021-11-16 18:43:04","Sports","https://fivethirtyeight.com/features/its-early-but-the-carolina-hurricanes-are-playing-like-stanley-cup-favorites/","9d72044fbd7218714a72f0a80f70e10a205f0547cc5ca0ecd2c7963a71e1f712","b3e007c76a90d9c93d1f03494935f672"
"Brothers Are Lighting Up The NFL. Which Pair Had The Best Single Season?","FiveThirtyEight - Sports","It’s been a fraternal season in the NFL. Off the field, Peyton and Eli Manning have brought the Thanksgiving Uncle Aesthetic — preplanned zingers nevertheless delivered several beats late, whole industrial bolts of checkered fabric — to the cutting edge of sports multicasting. On it, Trevon Diggs has spent his sophomore year building a reputation […]","2021-11-17 11:00:00","Sports","https://fivethirtyeight.com/features/brothers-are-lighting-up-the-nfl-which-pair-had-the-best-single-season/","9d72044fbd7218714a72f0a80f70e10a205f0547cc5ca0ecd2c7963a71e1f712","b57a01c16009f82d55e4a7d3708dbe9b"
"The Utah Jazz Keep Finding Gems Among Midcareer Players","FiveThirtyEight - Sports","When Quin Snyder was hired to coach the Utah Jazz prior to the 2014-15 season as part of the franchise’s first real “rebuild” in decades, he came with a clear mandate for player development. Seven-plus years in, his track record here is getting hard to ignore. While a young star like Donovan Mitchell often draws […]","2021-11-16 11:00:00","Sports","https://fivethirtyeight.com/features/royce-oneale-is-the-latest-midcareer-player-to-break-out-for-the-jazz/","9d72044fbd7218714a72f0a80f70e10a205f0547cc5ca0ecd2c7963a71e1f712","7710d4db461d579824357d9671e3a97d"
"How Can The Chargers Help Justin Herbert?","FiveThirtyEight - Sports","Halfway through the longest NFL regular season in history, Los Angeles Chargers fans must feel like they’ve already lived through two miniseasons: the one where their team had an .800 winning percentage and one of the NFL’s most effective quarterbacks, and the one where they played .250 football with Justin Herbert in the midst of […]","2021-11-18 18:35:47","Sports","https://fivethirtyeight.com/features/how-can-the-chargers-help-justin-herbert/","9d72044fbd7218714a72f0a80f70e10a205f0547cc5ca0ecd2c7963a71e1f712","ef3767d6b76e99d052c2f2b90e45a1a8"
"Tyler Herro Went Through A Sophomore Slump. Now He’s Making A Junior Jump.","FiveThirtyEight - Sports","One of the most universally accepted NBA truisms is that improvement is not necessarily linear. Players all develop at different paces, sometimes gradually and sometimes in fits and starts. But despite knowing that to be true, it’s still disappointing when a young player does not show the kind of improvement that we would reasonably expect […]","2021-11-18 17:43:18","Sports","https://fivethirtyeight.com/features/tyler-herro-went-through-a-sophomore-slump-now-hes-making-a-junior-jump/","9d72044fbd7218714a72f0a80f70e10a205f0547cc5ca0ecd2c7963a71e1f712","d8b46bcba370b2c089aaef811679c9aa"
