"Dubai EDITION Opens As… E Hotel Dubai?!?","One Mile at a Time","EDITION is Marriott’s modern luxury hotel brand, which is growing at a good pace. We knew that the EDITION Dubai was supposed to open in late 2021. Well, the property will be opening this week, but it won’t be known as the EDITION Dubai… for now.","2021-11-14 13:51:06","Travel","https://onemileatatime.com/news/dubai-edition-e-hotel-dubai/","ad89245cfe08f403d69c50b38cb63d4b56fac97a112e2b5a0a49eb32267e58ab","3273f05044ef493d267240a8d7efd8c4"
"Capital One Venture X Cell Phone Protection Details","One Mile at a Time","Link: Apply now for the Capital One Venture X Rewards Credit Card (this is the best publicly available offer for the card, and we appreciate your support if you use our link)","2021-11-13 15:19:35","Travel","https://onemileatatime.com/guides/capital-one-venture-x-cell-phone-protection/","ad89245cfe08f403d69c50b38cb63d4b56fac97a112e2b5a0a49eb32267e58ab","d098597932905bcd99bf3a41353ac42a"
"Transfer Citi ThankYou Points To American AAdvantage (Last Chance?)","One Mile at a Time","In mid-July we saw a fantastic development to the Citi ThankYou program, whereby it’s possible to transfer points to American AAdvantage for a limited time. This feature is due to expire today, so in this post I wanted to recap this feature, including my take on whether or not it makes sense to speculatively transfer points, along with the odds of this feature being extended.","2021-11-13 13:05:16","Travel","https://onemileatatime.com/deals/transfer-citi-points-american-aadvantage/","ad89245cfe08f403d69c50b38cb63d4b56fac97a112e2b5a0a49eb32267e58ab","e34d2fb3d4edea28eea451894d0daa85"
"Earn Status Miles When You Transfer To Etihad Guest","One Mile at a Time","Etihad Guest has launched a promotion that can earn you bonus status miles when you transfer points to the program.","2021-11-15 10:48:46","Travel","https://onemileatatime.com/deals/etihad-guest-transfer-status-promotion/","ad89245cfe08f403d69c50b38cb63d4b56fac97a112e2b5a0a49eb32267e58ab","e1315dbb0eb1ce0bcf2c739a22eccfd5"
"Revealed: New Etihad A350 Business Class Seats With Doors","One Mile at a Time","Etihad Airways has just unveiled its new business class product, and it looks pretty good to me!","2021-11-15 12:05:16","Travel","https://onemileatatime.com/news/etihad-a350-business-class/","ad89245cfe08f403d69c50b38cb63d4b56fac97a112e2b5a0a49eb32267e58ab","5bb21f7ea64ea29b20fa9e0c3e0eb06a"
"Trump Hotel DC To Become Waldorf Astoria","One Mile at a Time","One of Washington DC’s most famous (and definitely most controversial) hotels is in the process of being sold and rebranded.","2021-11-15 11:29:55","Travel","https://onemileatatime.com/news/trump-hotel-dc-waldorf-astoria/","ad89245cfe08f403d69c50b38cb63d4b56fac97a112e2b5a0a49eb32267e58ab","d7c7694a0b47cd8a5867b3b3b73d2c89"
"American Airlines Cuts 18 New York City Routes","One Mile at a Time","While American Airlines is building up its long haul presence in New York (with new flights to Delhi, Tel Aviv, etc.), the airline has updated its schedule over the weekend to reflect quite a few short haul route cuts.","2021-11-15 13:17:31","Travel","https://onemileatatime.com/news/american-airlines-cuts-new-york-routes/","ad89245cfe08f403d69c50b38cb63d4b56fac97a112e2b5a0a49eb32267e58ab","0a722599917d8578226556760c9e05e1"
"Details: Capital One Venture X 10,000 Anniversary Bonus Miles","One Mile at a Time","Link: Apply now for the Capital One Venture X Rewards Credit Card (this is the best publicly available offer for the card, and we appreciate your support if you use our link)","2021-11-15 15:28:11","Travel","https://onemileatatime.com/guides/capital-one-venture-x-anniversary-bonus-miles/","ad89245cfe08f403d69c50b38cb63d4b56fac97a112e2b5a0a49eb32267e58ab","c979f27fbeaf6ee538cd93a622545692"
"Review: Capital One SavorOne Credit Card (2021)","One Mile at a Time","In this post I wanted to review the Capital One SavorOne Cash Rewards Credit Card, which is a fantastic no annual fee card that I’d argue has just become even more lucrative than ever before. Let’s get right into the review…","2021-11-15 17:26:11","Travel","https://onemileatatime.com/reviews/credit-cards/capital-one/capital-one-savorone-cash-rewards-credit-card/","ad89245cfe08f403d69c50b38cb63d4b56fac97a112e2b5a0a49eb32267e58ab","f62eefcfc60f4534f4c9309576554bee"
"British Airways Wants To Fly To Indianapolis","One Mile at a Time","It looks like British Airways’ next destination in the United States may be… Indianapolis?!","2021-11-15 18:16:10","Travel","https://onemileatatime.com/news/british-airways-indianapolis-flights/","ad89245cfe08f403d69c50b38cb63d4b56fac97a112e2b5a0a49eb32267e58ab","d52e2360e21a68b15b4d6b4fc5aa6800"
"Ouch: Cathay Pacific Crews Put Into Quarantine Camp For 21 Days, As A Precaution","One Mile at a Time","While most of the world is moving on from a zero-tolerance approach to coronavirus, Hong Kong is remaining steadfast, and some Cathay Pacific employees are suffering the consequences of that right now.","2021-11-15 19:29:16","Travel","https://onemileatatime.com/news/cathay-pacific-crews-quarantine/","ad89245cfe08f403d69c50b38cb63d4b56fac97a112e2b5a0a49eb32267e58ab","1a50ff803229d2b24eb08567dd322325"
"Hyatt & Exhale Ending Partnership As Of 2022","One Mile at a Time","World of Hyatt will be dropping a partner as of early 2022…","2021-11-16 12:11:12","Travel","https://onemileatatime.com/news/hyatt-exhale-ending-partnership/","ad89245cfe08f403d69c50b38cb63d4b56fac97a112e2b5a0a49eb32267e58ab","bf2b859293cddfc8d2cd6d51820b7dce"
"Emirates Installing Premium Economy On 105 Planes, Plus Possible New 777 Business Class","One Mile at a Time","Emirates has just announced major plans to reconfigure existing aircraft. This update is great news overall, though I also have some concerns.","2021-11-16 11:19:18","Travel","https://onemileatatime.com/news/emirates-premium-economy-rollout/","ad89245cfe08f403d69c50b38cb63d4b56fac97a112e2b5a0a49eb32267e58ab","948cdcdc7e24480edc3800bd6963c860"
"Singapore Airlines’ New 737 Flat Bed Business Class","One Mile at a Time","Singapore Airlines has just revealed its new Boeing 737 MAX interiors, and the business class cabin looks gorgeous.","2021-11-16 12:48:07","Travel","https://onemileatatime.com/news/singapore-airlines-737-business-class/","ad89245cfe08f403d69c50b38cb63d4b56fac97a112e2b5a0a49eb32267e58ab","3578a0c606095a0dd1af8463445f21d0"
"United Airlines “Money + Miles” Awards: Worth It?","One Mile at a Time","In August 2021, United Airlines announced the concept of Money + Miles awards, giving members a new way to redeem MileagePlus miles. This redemption option has now been rolled out on a widespread basis, so I wanted to take a look at the value proposition.","2021-11-16 14:21:59","Travel","https://onemileatatime.com/news/united-airlines-money-miles-awards/","ad89245cfe08f403d69c50b38cb63d4b56fac97a112e2b5a0a49eb32267e58ab","025451bde3a605789dbe102b194a952f"
"Dubai EDITION Opens… What About The E Hotel?!?","One Mile at a Time","Well this is mighty suspicious. The Dubai EDITION is now open, even though just a couple of days ago this hotel was supposed to be branded differently.","2021-11-16 13:31:44","Travel","https://onemileatatime.com/news/dubai-edition-e-hotel-dubai/","ad89245cfe08f403d69c50b38cb63d4b56fac97a112e2b5a0a49eb32267e58ab","cd6fabfd59ddb2be26f0a45eb09a6206"
"Whoa: Vietnam Airlines Launching San Francisco Flights","One Mile at a Time","This is major — after (literally) decades of talking about it, it looks like Vietnam Airlines will finally start offering regularly scheduled flights to the United States.","2021-11-16 20:40:47","Travel","https://onemileatatime.com/news/vietnam-airlines-san-francisco-flights/","ad89245cfe08f403d69c50b38cb63d4b56fac97a112e2b5a0a49eb32267e58ab","8493775c931cbd5813af1359af6e61ff"
"French Bee Launching Paris To Los Angeles Flights","One Mile at a Time","Low cost carrier French Bee will be launching yet another route to the United States.","2021-11-16 19:54:17","Travel","https://onemileatatime.com/news/french-bee-los-angeles-flights/","ad89245cfe08f403d69c50b38cb63d4b56fac97a112e2b5a0a49eb32267e58ab","628c0883027bf83c5f22101cb3ca4ec2"
"6 Best Credit Card Duos For Maximizing Points (2021)","One Mile at a Time","Some of us go great lengths to maximize our credit card rewards, in some cases having dozens of cards, and making our pursuit of rewards points basically a part-time job.","2021-11-16 19:07:10","Travel","https://onemileatatime.com/guides/best-credit-card-duos/","ad89245cfe08f403d69c50b38cb63d4b56fac97a112e2b5a0a49eb32267e58ab","16afba4f8969fdb0dde5dfbb9d7f6e09"
"Huge United Airlines Credit Card Limited Time Offers","One Mile at a Time","Chase and United have a suite of co-branded credit cards, and we’ve just seen some fantastic new limited time welcome bonuses rolled out on these cards.","2021-11-16 18:07:54","Travel","https://onemileatatime.com/deals/united-airlines-credit-card-limited-time-offers/","ad89245cfe08f403d69c50b38cb63d4b56fac97a112e2b5a0a49eb32267e58ab","37e91c88a32e8fed5468c68ea756fcaf"
"Transfer Credit Card Points To LifeMiles With 25% Bonus","One Mile at a Time","LifeMiles is one of my favorite Star Alliance frequent flyer programs, thanks to the great redemption rates on Star Alliance partners, plus all the ways there are to earn miles with the program. Not only does LifeMiles often have promotions on purchased miles, but the program also partners with major transferable points currencies. At the moment there’s a bonus when converting points to LifeMiles.","2021-11-16 16:16:22","Travel","https://onemileatatime.com/deals/lifemiles-credit-card-transfer-bonus/","ad89245cfe08f403d69c50b38cb63d4b56fac97a112e2b5a0a49eb32267e58ab","fb59a2b317456b717192d9832c425769"
"St. Regis & EDITION Coming To Red Sea, Saudi Arabia (With Overwater Bungalows)","One Mile at a Time","Marriott plans to open two luxury hotels in Saudi Arabia, and I’m almost tempted… but not really.","2021-11-16 15:49:31","Travel","https://onemileatatime.com/news/marriott-red-sea-saudi-arabia/","ad89245cfe08f403d69c50b38cb63d4b56fac97a112e2b5a0a49eb32267e58ab","87e800cb300e8f11295b1ee988629f71"
"19 Best Credit Card Offers November 2021","One Mile at a Time","Every month I make a post with what I consider to be the best credit card offers at the time, with a particular focus on the best travel credit cards.","2021-11-15 13:59:00","Travel","https://onemileatatime.com/guides/best-credit-cards/","ad89245cfe08f403d69c50b38cb63d4b56fac97a112e2b5a0a49eb32267e58ab","defb24e75debc722c4718a73a788e590"
"JetBlue & Qatar Airways Expand Partnership, Introduce Reciprocal Mileage Earning","One Mile at a Time","Earlier this year, JetBlue and Qatar Airways announced plans to expand their partnership. This followed American and Qatar Airways launching a strategic partnership, and American and JetBlue launching a strategic partnership. JetBlue and Qatar Airways have now taken their relationship to the next level, and have introduced reciprocal mileage earning. Let’s go over all the details.","2021-11-17 12:58:35","Travel","https://onemileatatime.com/news/jetblue-qatar-airways-partnership/","ad89245cfe08f403d69c50b38cb63d4b56fac97a112e2b5a0a49eb32267e58ab","c7d334c4ac1e7c675be9bf5f0d4c872a"
"My Great Use Of IHG Free Night Awards","One Mile at a Time","It has been a while since I’ve redeemed an IHG credit card free night certificate, though I just got a great value redeeming several of these, and wanted to share the details of that.","2021-11-17 15:13:38","Travel","https://onemileatatime.com/insights/great-use-ihg-free-night-award/","ad89245cfe08f403d69c50b38cb63d4b56fac97a112e2b5a0a49eb32267e58ab","ec77f5af234d8ff8512944e8ad3ed3d9"
"United Club Infinite Card Review: Lounge Access & 100K Miles","One Mile at a Time","United Airlines and Chase issue several co-branded credit cards, and in this post wanted to take a closer look at the United Club Infinite Card, which is the most premium personal card issued with this partnership.","2021-11-17 17:03:34","Travel","https://onemileatatime.com/reviews/credit-cards/chase/united-club-infinite-card/","ad89245cfe08f403d69c50b38cb63d4b56fac97a112e2b5a0a49eb32267e58ab","8af1ed8040fd8a7e16d92d48ad46d86d"
"Lynx Air, Canada’s New Ultra Low Cost Carrier","One Mile at a Time","Canada may soon be getting yet another ultra low cost carrier.","2021-11-17 16:05:12","Travel","https://onemileatatime.com/news/lynx-air-canada/","ad89245cfe08f403d69c50b38cb63d4b56fac97a112e2b5a0a49eb32267e58ab","991fe9f2cfbfac5fa500f758720c6d4f"
"Credit Card Application Rules By Bank (2021)","One Mile at a Time","All of the major credit card issuers have different rules when it comes to applying for their cards. Furthermore, these rules are constantly changing, as banks try to optimize their strategy as to what kind of card members they’re looking for.","2021-11-17 18:43:27","Travel","https://onemileatatime.com/guides/credit-card-application-rules/","ad89245cfe08f403d69c50b38cb63d4b56fac97a112e2b5a0a49eb32267e58ab","f492fd313e94fb9aecdfdd357f21a784"
"Review: Capital One Lounge DFW (WOW!)","One Mile at a Time","Capital One opened its first airport lounge a few weeks ago, coinciding with the launch of the new Capital One Venture X Rewards Credit Card. While there were some reports of the lounge being great based on a media preview event, personally I always like to check out a lounge when it’s actually in operation, to see what kind of an experience the average guest has. Well, I’m fortunate that I had the chance to check out the lounge this morning.","2021-11-18 21:35:00","Travel","https://onemileatatime.com/reviews/capital-one-lounge-dfw/","ad89245cfe08f403d69c50b38cb63d4b56fac97a112e2b5a0a49eb32267e58ab","a4ce4d576d34a9e9fca6895f6b90700c"
"Review: Hyatt Regency Mainz, Germany","One Mile at a Time","In addition to staying at Hotel Fiester Hannes (near my aunt’s house), we also spent a couple of nights at the 268-room Hyatt Regency Mainz. I last reviewed this hotel over a decade ago, and based on my experience, I don’t need to return for another decade. Interesting side note — this is the layover hotel where the three Cathay Pacific cargo pilots who tested positive for coronavirus stayed (they ended up getting fired).","2021-11-18 15:51:23","Travel","https://onemileatatime.com/reviews/hyatt-regency-mainz/","ad89245cfe08f403d69c50b38cb63d4b56fac97a112e2b5a0a49eb32267e58ab","53b55ca5322b13dd65e414df9d88c95e"
"Best-Ever $40 Bonus For New Rakuten Members","One Mile at a Time","Online shopping portals can be a great way to pick up additional points for purchases youd make anyway. Just for following a specific link you can earn bonus points or cash back in addition to the rewards youd earn for credit card spending.","2021-11-18 12:39:48","Travel","https://onemileatatime.com/rakuten-new-member-bonus/","ad89245cfe08f403d69c50b38cb63d4b56fac97a112e2b5a0a49eb32267e58ab","eacfdff66066d82a7ed1d928c89fb3b3"
"Brussels Airlines Reveals New Livery & Brand Identity","One Mile at a Time","Brussels Airlines has just revealed the details of a major rebranding, including the introduction of a new livery.","2021-11-18 12:03:32","Travel","https://onemileatatime.com/news/brussels-airlines-new-livery/","ad89245cfe08f403d69c50b38cb63d4b56fac97a112e2b5a0a49eb32267e58ab","ded0ee6eba5c54403952e06e340b191d"
"Cathay Pacific Fires Pilots Who Got Coronavirus During Layover","One Mile at a Time","A few days ago I wrote about how Cathay Pacific put a bunch of employees into a 21-day quarantine, after three pilots tested positive for coronavirus following a layover at the same hotel in Germany. There’s an interesting update on that story.","2021-11-18 11:14:59","Travel","https://onemileatatime.com/news/cathay-pacific-fires-pilots-coronavirus/","ad89245cfe08f403d69c50b38cb63d4b56fac97a112e2b5a0a49eb32267e58ab","c6f271ab7fd648eac75d2e7466a20a47"
