"'Rust' film armorer says someone may have put bullet in gun","The Washington Times","The woman in charge of weapons on the movie set where actor Alec Baldwin fatally shot cinematographer Halyna Hutchins said Wednesday night that she had inspected the gun Baldwin shot but doesn’t know how a live bullet ended up inside. “Who put those in there and why is the central ...","2021-11-04 05:32:57","Top News","https://www.washingtontimes.com/news/2021/nov/4/rust-film-armorer-says-someone-may-have-put-bullet/?utm_source=RSS_Feed&utm_medium=RSS","b1b18d660b716e63dbee65dac0aca446d7fd4ebf8d197937998aa78d785e6dc0","66e84950747a87f312915c143b5c6508"
"Biden vaccine mandate issued for private employers: Jan. 4 deadline for workers to get COVID shots","The Washington Times","The Biden administration published a rule Thursday that requires workers at large companies and institutions to get fully vaccinated for COVID-19 by Jan. 4 or face weekly testing. Persons who refuse to get vaccinated would also have to wear masks while on the job under the long-awaited regulation from the ...","2021-11-04 12:47:09","Top News","https://www.washingtontimes.com/news/2021/nov/4/biden-vaccine-mandate-issued-private-employers-jan/?utm_source=RSS_Feed&utm_medium=RSS","b1b18d660b716e63dbee65dac0aca446d7fd4ebf8d197937998aa78d785e6dc0","d3c32709e77c3b49317d2a9ab9863044"
"Tennis star accuses China ex-vice premier of sexual assault","The Washington Times","BEIJING (AP) — Chinese authorities have squelched virtually all online discussion of sexual assault accusations apparently made by a Chinese professional tennis star against a former top government official, showing how sensitive the ruling Communist Party is to such charges. In a lengthy social media post that disappeared quickly, Peng ...","2021-11-04 11:58:37","Top News","https://www.washingtontimes.com/news/2021/nov/4/tennis-star-accuses-china-ex-vice-premier-sexual-a/?utm_source=RSS_Feed&utm_medium=RSS","b1b18d660b716e63dbee65dac0aca446d7fd4ebf8d197937998aa78d785e6dc0","78218a03e15bcf6d1fa3e4213e88614a"
"Iran marks anniversary of 1979 takeover of US Embassy","The Washington Times","TEHRAN, Iran (AP) – Thousands of Iranians gathered on Tehran streets Thursday for the anniversary of the 1979 seizure of the U.S. Embassy, chanting “Death to America and Death to Israel, and burning American and Israeli flags. The embassy takeover triggered a 444-day hostage crisis and break in diplomatic relations ...","2021-11-04 09:38:47","Top News","https://www.washingtontimes.com/news/2021/nov/4/iran-marks-anniversary-of-1979-takeover-of-us-emba/?utm_source=RSS_Feed&utm_medium=RSS","b1b18d660b716e63dbee65dac0aca446d7fd4ebf8d197937998aa78d785e6dc0","09d17c35cb44bea1216e570388b5b395"
"Half of Americans burned out by screens, turn to podcasts: study","The Washington Times","Americans increasingly are closing their eyes and opening their ears for their entertainment, says a new study of pandemic-fueled trends. Half of consumers feel burned out by screens and now listen to digital audio podcasts in their free time, according to the National Research Group, a global strategy firm focusing ...","2021-11-04 13:30:23","Top News","https://www.washingtontimes.com/news/2021/nov/4/half-americans-burned-out-screens-turn-podcasts-st/?utm_source=RSS_Feed&utm_medium=RSS","b1b18d660b716e63dbee65dac0aca446d7fd4ebf8d197937998aa78d785e6dc0","b3fbbde4791438c028e599ff7bb1e495"
"Thousands of Border Patrol agents at risk of being fired over vaccine mandate, Arizona AG warns","The Washington Times","Thousands of Border Patrol agents could be fired over failing to meet President Biden’s COVID-19 vaccine mandate for federal employees, Arizona’s attorney general warned in a new letter calling on the administration to relax its unprecedented shots-or-else approach. Mark Brnovich, the state's Republican attorney general, said it is a calamitous ...","2021-11-04 13:22:42","Top News","https://www.washingtontimes.com/news/2021/nov/4/thousands-border-patrol-agents-risk-being-fired-ov/?utm_source=RSS_Feed&utm_medium=RSS","b1b18d660b716e63dbee65dac0aca446d7fd4ebf8d197937998aa78d785e6dc0","8ae4875364afec2133d683170a22d4fe"
"ATF security failures enabled contractor to steal guns, thousands of parts, IG says","The Washington Times","The Bureau of Alcohol, Tobacco, Firearms and Explosives' failure to properly secure a federal firearms destruction facility allowed a contracted security guard to steal guns, thousands of gun parts and ammunition, according to the Department of Justice watchdog. Department Inspector General Michael E. Horowitz said this week that “vulnerabilities” at ...","2021-11-04 12:56:07","Top News","https://www.washingtontimes.com/news/2021/nov/4/atf-security-failures-enabled-contractor-steal-gun/?utm_source=RSS_Feed&utm_medium=RSS","b1b18d660b716e63dbee65dac0aca446d7fd4ebf8d197937998aa78d785e6dc0","6ddd50f26a9becd649ad9de67abddbc1"
"Iran marks anniversary of 1979 takeover of U.S. Embassy","The Washington Times","TEHRAN, Iran (AP) – Thousands of Iranians gathered on Tehran streets Thursday for the anniversary of the 1979 seizure of the U.S. Embassy, chanting “Death to America and Death to Israel, and burning American and Israeli flags. The embassy takeover triggered a 444-day hostage crisis and break in diplomatic relations ...","2021-11-04 09:38:47","Top News","https://www.washingtontimes.com/news/2021/nov/4/iran-marks-anniversary-of-1979-takeover-of-us-emba/?utm_source=RSS_Feed&utm_medium=RSS","b1b18d660b716e63dbee65dac0aca446d7fd4ebf8d197937998aa78d785e6dc0","daf681494f2536b702afcf824ef48f9f"
"George Soros among several billionaires who got COVID-19 stimulus checks","The Washington Times","Several billionaires, including liberal activist George Soros, received stimulus checks during the COVID-19 pandemic, despite income caps that would have otherwise disqualified them. Internal Revenue Service data shows tax loopholes allowed at least 18 billionaires to receive the $1,200 checks meant for those making under $75,000, according to a report ...","2021-11-04 14:46:17","Top News","https://www.washingtontimes.com/news/2021/nov/4/george-soros-among-several-billionaires-who-got-co/?utm_source=RSS_Feed&utm_medium=RSS","b1b18d660b716e63dbee65dac0aca446d7fd4ebf8d197937998aa78d785e6dc0","61d8dac2c271b06afe36a2c3a7fbdd04"
"Voting technology firm Smartmatic sues Newsmax, OAN over 2020 election claims","The Washington Times","Voting machine manufacturer Smartmatic has filed defamation lawsuits against conservative news outlets Newsmax and One America News, citing “a continuous stream of falsehoods” by the networks alleging manipulated vote totals for President Biden in the 2020 presidential election. The announcement adds to the growing number of claims against conservative news ...","2021-11-04 14:10:45","Top News","https://www.washingtontimes.com/news/2021/nov/4/voting-technology-firm-smartmatic-sues-newsmax-oan/?utm_source=RSS_Feed&utm_medium=RSS","b1b18d660b716e63dbee65dac0aca446d7fd4ebf8d197937998aa78d785e6dc0","4cfaf072d8c53f26dd3c98608192b59c"
"Missouri AG to sue Biden administration over private employer COVID-19 vaccine mandate","The Washington Times","Missouri Attorney General Eric Schmitt announced plans to file a lawsuit on Friday against the Biden administration over its COVID-19 vaccine mandate for private employers. The Republican, who is running for U.S. Senate, said the federal government can't order private employers to issue vaccine mandates — and also to pay ...","2021-11-04 13:59:54","Top News","https://www.washingtontimes.com/news/2021/nov/4/missouri-ag-sue-biden-administration-over-private-/?utm_source=RSS_Feed&utm_medium=RSS","b1b18d660b716e63dbee65dac0aca446d7fd4ebf8d197937998aa78d785e6dc0","e2bf4466588a2f260ca6946e0ff615b7"
"Kentucky Chipotle temporarily closes amid staff walkout","The Washington Times","A Chipotle fast-food outlet in Louisville, Kentucky, temporarily shuttered its doors this week after half of its staff, including the manager, walked out, according to a report.  A sign in the restaurant's window read, Half our staff walked out including the manager and we are no longer able to remain ...","2021-11-04 13:53:00","Top News","https://www.washingtontimes.com/news/2021/nov/4/kentucky-chipotle-temporarily-closes-amid-staff-wa/?utm_source=RSS_Feed&utm_medium=RSS","b1b18d660b716e63dbee65dac0aca446d7fd4ebf8d197937998aa78d785e6dc0","71bda4d5ba989303e1f537ce51220964"
"Daily Wire challenges Joe Biden's private employer COVID-19 vaccine mandate","The Washington Times","The Daily Wire, a conservative news site, is challenging the Biden administration’s COVID-19 vaccine mandate for private employers by suing in the U.S. Circuit Court of Appeals for the 6th Circuit, the company announced Thursday. The lawsuit argues the federal government violates the Constitution and federal law by requiring private ...","2021-11-04 15:37:07","Top News","https://www.washingtontimes.com/news/2021/nov/4/daily-wire-challenges-joe-bidens-private-employer-/?utm_source=RSS_Feed&utm_medium=RSS","b1b18d660b716e63dbee65dac0aca446d7fd4ebf8d197937998aa78d785e6dc0","1bfc24f32b773a42561e72175a73a2c7"
"Russian analyst who was source for Steele dossier arrested in Durham probe","The Washington Times","A Russian analyst who served as a source for a dossier of unverified allegations against former President Trump was arrested Thursday on charges arising out of special counsel John Durham’s probe into the origins of the Trump-Russia investigation. It was not clear what charges would be filed against Igor Danchenko, ...","2021-11-04 15:23:17","Top News","https://www.washingtontimes.com/news/2021/nov/4/russian-analyst-who-was-source-steele-dossier-arre/?utm_source=RSS_Feed&utm_medium=RSS","b1b18d660b716e63dbee65dac0aca446d7fd4ebf8d197937998aa78d785e6dc0","1471f22df1c5cdf5875197b26e52c42a"
"Biden: I wished vaccine mandates had 'not become necessary'","The Washington Times","President Biden defended his decision to issue sweeping COVID-19 vaccine mandates Thursday by saying he did not want to resort to heavy-handed rules, but too many people remained on the sidelines, threatening both public health and the economy. Vaccination is the single best pathway out of this pandemic, the president ...","2021-11-04 15:02:00","Top News","https://www.washingtontimes.com/news/2021/nov/4/biden-i-wished-vaccine-mandates-had-not-become-nec/?utm_source=RSS_Feed&utm_medium=RSS","b1b18d660b716e63dbee65dac0aca446d7fd4ebf8d197937998aa78d785e6dc0","d29318554fe531fe1a07bc081018f1b6"
"Pope: Church, shamed by sex abuse, must better protect kids","The Washington Times","VATICAN CITY (AP) – Pope Francis on Thursday called on all those who work with children to join together in an alliance to better protect sexual and other abuse of minors. In a message to a conference in Rome about keeping children safe, Francis said the church’s own efforts are ...","2021-11-04 14:48:05","Top News","https://www.washingtontimes.com/news/2021/nov/4/pope-church-shamed-by-sex-abuse-must-better-protec/?utm_source=RSS_Feed&utm_medium=RSS","b1b18d660b716e63dbee65dac0aca446d7fd4ebf8d197937998aa78d785e6dc0","caa7e0f96230aad0182cb4b1ce513c52"
"Pelosi 'heartbroken' over McAuliffe loss in Virginia governor's race","The Washington Times","House Speaker Nancy Pelosi said she is “heartbroken” over Democrat Terry McAuliffe’s loss in the Virginia governor’s race this week. Mrs. Pelosi, California Democrat, expressed her disappointment to reporters on Thursday, though she remained confident about Democrats’ chances in the 2022 midterms just a year away. “I’m heartbroken because Terry ...","2021-11-04 16:43:40","Top News","https://www.washingtontimes.com/news/2021/nov/4/pelosi-heartbroken-over-mcauliffe-loss-virginia-go/?utm_source=RSS_Feed&utm_medium=RSS","b1b18d660b716e63dbee65dac0aca446d7fd4ebf8d197937998aa78d785e6dc0","0231a2858434ae38679a36c59df3e163"
"Biden's $50,000-per-year journalist tax credit estimated to cost taxpayers $1.6B","The Washington Times","The lucrative $50,000-per-year journalist tax break that Democrats have tucked within President Biden’s multi-trillion dollar social welfare bill is estimated to cost taxpayers more than $1.6 billion over the next decade. A new analysis of the legislation by the Joint Committee on Taxation, a special congressional panel made up of ...","2021-11-04 15:59:40","Top News","https://www.washingtontimes.com/news/2021/nov/4/bidens-50000-year-journalist-tax-credit-estimated-/?utm_source=RSS_Feed&utm_medium=RSS","b1b18d660b716e63dbee65dac0aca446d7fd4ebf8d197937998aa78d785e6dc0","f54802b5b04bd9a402be47c611ed1ce9"
"Democrats block GOP attempt to derail Biden's $450,000 payments to illegal immigrants","The Washington Times","Republicans moved this week to block $450,000 payments to illegal immigrants who were part of family separations during the Trump administration, but they saw their first attempt quashed by Senate Democrats. The payments are being pondered by President Biden's task force assigned to help reunify and compensate families snared by ...","2021-11-04 15:50:00","Top News","https://www.washingtontimes.com/news/2021/nov/4/democrats-block-gop-attempt-derail-bidens-450000-p/?utm_source=RSS_Feed&utm_medium=RSS","b1b18d660b716e63dbee65dac0aca446d7fd4ebf8d197937998aa78d785e6dc0","1f1ab93bf593609f851ab2fe8c6aa1cd"
"EXCLUSIVE: 'It's a death trap': ICE officers file OSHA complaint over illegal immigrant COVID risks","The Washington Times","The labor union for ICE officers has filed two workplace safety complaints over the Biden administration’s handling of illegal immigrants and COVID at the border, saying federal employees forced to process and release the migrants face conditions that amount to “a death trap.” The complaints say many of the federal ...","2021-11-04 15:46:48","Top News","https://www.washingtontimes.com/news/2021/nov/4/exclusive-its-death-trap-ice-officers-file-osha-co/?utm_source=RSS_Feed&utm_medium=RSS","b1b18d660b716e63dbee65dac0aca446d7fd4ebf8d197937998aa78d785e6dc0","3a811801fad3c52e05abd37e11289092"
"D.C. Mayor Bowser seeking a third term in office","The Washington Times","D.C. Mayor Muriel Bowser on Thursday announced that she is seeking another four years in office.  The two-term Democratic mayor confirmed on Twitter that she is running again, touting her efforts to push for more affordable housing, better education, women’s rights and public safety as well as recovery from the ...","2021-11-04 17:20:09","Top News","https://www.washingtontimes.com/news/2021/nov/4/dc-mayor-bowser-seeking-third-term-office/?utm_source=RSS_Feed&utm_medium=RSS","b1b18d660b716e63dbee65dac0aca446d7fd4ebf8d197937998aa78d785e6dc0","02d900f3adf2efa0d5424979d51bc799"
"China upholding Iranian regime with oil purchases","The Washington Times","Chinese purchases of Iranian oil have steadily increased since President Biden arrived in office, with Beijing's blatant flouting of U.S. sanctions on the Islamic republic providing an economic lifeline to hardliners in Tehran. The White House has come under increasing criticism for tolerating Beijing's purchases, which analysts say amount to ...","2021-11-04 17:12:00","Top News","https://www.washingtontimes.com/news/2021/nov/4/china-upholding-iranian-regime-oil-purchases/?utm_source=RSS_Feed&utm_medium=RSS","b1b18d660b716e63dbee65dac0aca446d7fd4ebf8d197937998aa78d785e6dc0","1870778c2cd5c169bd7f22f880d97ffe"
"Lucrative tax break for organized labor would cost taxpayers nearly $1.8 billion","The Washington Times","President Biden’s push to reward one of his biggest allies, organized labor, with a lucrative tax break will cost taxpayers nearly $1.8 billion over the next decade, according to a new analysis. The Joint Committee on Taxation released an in-depth analysis of the tax proposals included within Mr. Biden’s 10-year, ...","2021-11-04 17:11:47","Top News","https://www.washingtontimes.com/news/2021/nov/4/lucrative-tax-break-organized-labor-would-cost-tax/?utm_source=RSS_Feed&utm_medium=RSS","b1b18d660b716e63dbee65dac0aca446d7fd4ebf8d197937998aa78d785e6dc0","94031eb79510e2b9c1351cc124b52fd2"
"Youngkin vows to raise school standards, protect campus free speech in education plan","The Washington Times","Virginia Gov.-elect Glenn Youngkin on Thursday unveiled an expansive education plan that he said he wants to implement “from Day One” of his new administration in January. Mr. Youngkin, who narrowly defeated Democrat Terry McAuliffe in Tuesday’s election, said he wants to raise school standards, expand charter schools and raise ...","2021-11-04 18:46:13","Top News","https://www.washingtontimes.com/news/2021/nov/4/youngkin-vows-raise-school-standards-protect-campu/?utm_source=RSS_Feed&utm_medium=RSS","b1b18d660b716e63dbee65dac0aca446d7fd4ebf8d197937998aa78d785e6dc0","0084fa06dfb713ee0cf3f8f27721c128"
"Colorado parents' advocate rejects critical race theory explanation for school board wins","The Washington Times","A Colorado parents' advocate on Thursday rejected critical race theory as an explanation for conservatives flipping eight county school boards and for the victory of Republican Glenn Youngkin in Virginia's gubernatorial race. Tyler Sandberg, vice president of the educational reform nonprofit Ready Colorado, said Tuesday's parent-driven conservative wins in Colorado ...","2021-11-04 18:27:00","Top News","https://www.washingtontimes.com/news/2021/nov/4/colorado-parents-advocate-rejects-critical-race-th/?utm_source=RSS_Feed&utm_medium=RSS","b1b18d660b716e63dbee65dac0aca446d7fd4ebf8d197937998aa78d785e6dc0","677388c804036982df59928c53d50e40"
"Budget hawks warn that Biden's social-welfare bill could cost more than administration says","The Washington Times","Two leading fiscal watchdogs are raising alarms about the true cost of President Biden’s social welfare and climate change bill, arguing the total price tag is far higher than the $1.75 trillion that Democrats have estimated.A new budget model released by the University of Pennsylvania's Wharton School of ...","2021-11-04 18:24:32","Top News","https://www.washingtontimes.com/news/2021/nov/4/budget-hawks-warn-bidens-social-welfare-bill-costs/?utm_source=RSS_Feed&utm_medium=RSS","b1b18d660b716e63dbee65dac0aca446d7fd4ebf8d197937998aa78d785e6dc0","44953b0c8106671c148cd792ee936238"
"Appeals court agrees city can't ban Catholic group's rally","The Washington Times","A federal appeals court has upheld a judge's ruling that Baltimore city officials cannot ban a conservative Roman Catholic media outlet from holding a rally at a city-owned pavilion during a U.S. bishops’ meeting. St. Michael's Media Inc. signed a contract with a city vendor Thursday for its Nov. 16 ...","2021-11-04 18:04:59","Top News","https://www.washingtontimes.com/news/2021/nov/4/appeals-court-agrees-city-cant-ban-catholic-groups/?utm_source=RSS_Feed&utm_medium=RSS","b1b18d660b716e63dbee65dac0aca446d7fd4ebf8d197937998aa78d785e6dc0","052389409cceb28d818300371129d71a"
"American Girl Dolls, Risk, sand make it to Toy Hall of Fame","The Washington Times","ROCHESTER, N.Y. (AP) – American Girl Dolls and the strategy board game Risk were inducted into the National Toy Hall of Fame on Thursday in recognition of their influence on the toy industry. Sand, which the group called perhaps the most universal and oldest toy in the world, was also ...","2021-11-04 14:39:37","Top News","https://www.washingtontimes.com/news/2021/nov/4/american-girl-dolls-risk-sand-make-it-to-toy-hall-/?utm_source=RSS_Feed&utm_medium=RSS","b1b18d660b716e63dbee65dac0aca446d7fd4ebf8d197937998aa78d785e6dc0","3edfd162d831fa644cf37e82b3674ca0"
"Afghan girls, faraway relatives worry over dreams disrupted","The Washington Times","From her home in Illinois, Asma Yawari has built a relationship with her younger cousin in Afghanistan that’s made the geographic distance between the two teenagers' worlds seem, well, not quite so distant. They never met but have bonded over phone calls and messages -- swapping family photos and language ...","2021-11-04 14:24:18","Top News","https://www.washingtontimes.com/news/2021/nov/4/afghan-girls-faraway-relatives-worry-over-dreams-d/?utm_source=RSS_Feed&utm_medium=RSS","b1b18d660b716e63dbee65dac0aca446d7fd4ebf8d197937998aa78d785e6dc0","2fcf97a50f4ede3b3118e91ada347396"
"Democrats play musical chairs","The Washington Times","Muriel Bowser wants her supporters to know she still isn't scared of the Big Boys. To prove herself, Miss Bowser pulled up her Big Girl slacks on Thursday, stiffened her back and blasted the guys ... via Twitter. “We’ve pushed for more affordable housing, for better schools, for women’s rights, ...","2021-11-04 19:43:09","Top News","https://www.washingtontimes.com/news/2021/nov/4/democrats-play-musical-chairs/?utm_source=RSS_Feed&utm_medium=RSS","b1b18d660b716e63dbee65dac0aca446d7fd4ebf8d197937998aa78d785e6dc0","926e0072886386db286e0802c6e40402"
"Democrats' plan to cut taxes for wealthy blue state residents will cost $200B by 2025","The Washington Times","A proposal by vulnerable House Democrats to restore a lucrative deduction for wealthy blue state residents will cost taxpayers more than $200 billion by 2025. The Joint Committee on Taxation detailed the figure in a Thursday report analyzing the tax proposals House Democrats want to include in President Biden's social ...","2021-11-04 18:51:00","Top News","https://www.washingtontimes.com/news/2021/nov/4/democrats-plan-cut-taxes-wealthy-blue-state-reside/?utm_source=RSS_Feed&utm_medium=RSS","b1b18d660b716e63dbee65dac0aca446d7fd4ebf8d197937998aa78d785e6dc0","91be2a3ad718acdbcaaf0985cbdd4f9a"
"Budget hawks warn that Biden's social-welfare bill could cost more than $4 trillion","The Washington Times","Two leading fiscal watchdogs are raising alarms about the true cost of President Biden’s social welfare and climate change bill, arguing the total price tag is far higher than the $1.75 trillion that Democrats have estimated.A new budget model released by the University of Pennsylvania's Wharton School of ...","2021-11-04 18:24:32","Top News","https://www.washingtontimes.com/news/2021/nov/4/budget-hawks-warn-bidens-social-welfare-bill-costs/?utm_source=RSS_Feed&utm_medium=RSS","b1b18d660b716e63dbee65dac0aca446d7fd4ebf8d197937998aa78d785e6dc0","02915aeb5973261775960b515a5bf639"
"Campaign takes on BlackRock for alleged hypocrisy investing in Chinese companies","The Washington Times","A consumer watchdog group has unveiled a multi-million-dollar campaign against BlackRock, the world's biggest money managers, for hectoring American businesses about leftist causes while simultaneously investing in Chinese companies with poor records on human rights and the environment. Consumers’ Research is rolling out advertisements, billboards in New York City and ...","2021-11-04 20:44:14","Top News","https://www.washingtontimes.com/news/2021/nov/4/campaign-takes-blackrock-alleged-hypocrisy-investi/?utm_source=RSS_Feed&utm_medium=RSS","b1b18d660b716e63dbee65dac0aca446d7fd4ebf8d197937998aa78d785e6dc0","1458f5899a4ab6565440d9dc3d0ba707"
"USS Connecticut submarine top officers fired after underwater collision","The Washington Times","The senior leaders of a nuclear-powered U.S. Navy submarine were fired following the investigation into an underwater collision in the South China Sea, Navy officials said Thursday. The commander, executive officer and senior enlisted sailor of the USS Connecticut were removed from their positions after the Seawolf-class fast attack submarine ...","2021-11-04 20:37:57","Top News","https://www.washingtontimes.com/news/2021/nov/4/uss-connecticut-submarine-top-officers-fired-after/?utm_source=RSS_Feed&utm_medium=RSS","b1b18d660b716e63dbee65dac0aca446d7fd4ebf8d197937998aa78d785e6dc0","384fdc1f3dd77408eaf6f8ddb458bf30"
"Biden COVID-19 vaccine mandate unprecedented, legal scholars say","The Washington Times","Republican attorneys general and a conservative news site are fighting President Biden’s COVID-19 vaccine mandate for private employers, a government mandate that legal scholars say is unprecedented.  “I don’t know of any federal vaccination mandate until COVID comes along,” said David Miller, a labor and employment law attorney with Bryant ...","2021-11-04 20:23:42","Top News","https://www.washingtontimes.com/news/2021/nov/4/biden-covid-19-vaccine-mandate-unprecedented-legal/?utm_source=RSS_Feed&utm_medium=RSS","b1b18d660b716e63dbee65dac0aca446d7fd4ebf8d197937998aa78d785e6dc0","379886a59e4f0042e535420c86927675"
"Biden administration teams up with Big Tech to fend off cyberattacks","The Washington Times","The Biden administration is working aggressively to enlist tech companies to help fight hackers and ransomware attackers, saying a cybersecurity public-private partnership is the best way to protect America's critical infrastructure. Cybersecurity and Infrastructure Security Agency Director Jen Easterly is touting the administration's new Joint Cyber Defense Collaborative (JCDC) as ...","2021-11-04 20:05:00","Top News","https://www.washingtontimes.com/news/2021/nov/4/biden-administration-teams-big-tech-fend-cyberatta/?utm_source=RSS_Feed&utm_medium=RSS","b1b18d660b716e63dbee65dac0aca446d7fd4ebf8d197937998aa78d785e6dc0","148490379efc85e8b80d04593bc19e64"
"Jennifer Leigh Ryan sentenced to prison for storming U.S. Capitol","The Washington Times","A real estate agent from suburban Dallas who flaunted her participation in the Jan. 6 riot at the U.S. Capitol on social media and later bragged she wasn't going to jail because she is White, has blond hair and a good job was sentenced on Thursday to two months behind ...","2021-11-04 20:03:25","Top News","https://www.washingtontimes.com/news/2021/nov/4/jennifer-leigh-ryan-sentenced-prison-storming-us-c/?utm_source=RSS_Feed&utm_medium=RSS","b1b18d660b716e63dbee65dac0aca446d7fd4ebf8d197937998aa78d785e6dc0","30ecb282888a5ed809c5aed1072dc9de"
