"Supreme Court weighs condemned killer's demand for pastor to touch him during execution","The Washington Times","John Henry Ramirez will almost certainly be executed by Texas for having robbed a convenience store worker of $1.25 then stabbing him 29 times, killing him. His lawyer went before the Supreme Court on Tuesday to ask the justices to rule that, when the time comes, he's allowed to have ...","2021-11-09 20:30:00","Top News","https://www.washingtontimes.com/news/2021/nov/9/supreme-court-weighs-condemned-killers-demand-past/?utm_source=RSS_Feed&utm_medium=RSS","b1b18d660b716e63dbee65dac0aca446d7fd4ebf8d197937998aa78d785e6dc0","dd2625195716b88e99be7a20826dbaa7"
"Pfizer asks FDA to OK COVID-19 booster shots for all adults","The Washington Times","Pfizer asked U.S. regulators Tuesday to allow boosters of its COVID-19 vaccine for anyone 18 or older, a step that comes amid concern about increased spread of the coronavirus with holiday travel and gatherings. Older Americans and other groups particularly vulnerable to the virus have had access to a third ...","2021-11-09 20:03:52","Top News","https://www.washingtontimes.com/news/2021/nov/9/pfizer-asks-fda-to-ok-covid-19-booster-shots-for-a/?utm_source=RSS_Feed&utm_medium=RSS","b1b18d660b716e63dbee65dac0aca446d7fd4ebf8d197937998aa78d785e6dc0","1c9af826d6999bee6d03e6cb60900013"
"Nebraska AG report on clergy abuse rocks Catholics","The Washington Times","A report released last week by the Nebraska attorney general's office has rocked the U.S. Catholic church, documenting credible allegations by 258 victims against 57 church officials dating back to 1978. But Nebraska Attorney General Doug Peterson has said none of the cases in the report will be prosecuted. The ...","2021-11-09 20:03:00","Top News","https://www.washingtontimes.com/news/2021/nov/9/nebraska-ag-report-clergy-abuse-rocks-catholics/?utm_source=RSS_Feed&utm_medium=RSS","b1b18d660b716e63dbee65dac0aca446d7fd4ebf8d197937998aa78d785e6dc0","df466765a116ba7d35abc1b8bac441b8"
"Student charged as adult in stabbing at Montgomery County high school","The Washington Times","Montgomery County Police have charged a student as an adult in the stabbing of another student Monday at Montgomery Blair High School, according to a media report. Maycol Coyoy, 16, of Silver Spring, has been charged with attempted second-degree murder, first-degree assault and reckless endangerment, WTOP reported. He is accused ...","2021-11-09 20:02:07","Top News","https://www.washingtontimes.com/news/2021/nov/9/student-charged-adult-stabbing-montgomery-county-h/?utm_source=RSS_Feed&utm_medium=RSS","b1b18d660b716e63dbee65dac0aca446d7fd4ebf8d197937998aa78d785e6dc0","3c34f0ebd21aae141836711b338dfbd1"
"Georgia Senate GOP passes map to retain Republican majority","The Washington Times","ATLANTA (AP) - Georgia Senate Republicans pushed through a map Tuesday on a 34-21 party line vote designed to maintain their strong majority in the chamber, despite Democratic cries that the plan doesn't reflect Georgia's nearly 50-50 partisan split and denies opportunities to nonwhite voters. Sen. John Kennedy, a Macon ...","2021-11-09 19:34:14","Top News","https://www.washingtontimes.com/news/2021/nov/9/georgia-senate-gop-passes-map-to-retain-republican/?utm_source=RSS_Feed&utm_medium=RSS","b1b18d660b716e63dbee65dac0aca446d7fd4ebf8d197937998aa78d785e6dc0","1d13372c2c1e3d4067e45c4c590143e8"
"Connecticut Gov. Ned Lamont says he's definitely seeking a second term","The Washington Times","NEW BRITAIN, Conn. (AP) – Connecticut Gov. Ned Lamont made it clear Tuesday he plans to seek a second term, a day after the Democrat said he had filed the necessary paperwork to begin the process of a possible reelection bid. “I love the job. I think we’re making a ...","2021-11-09 19:29:08","Top News","https://www.washingtontimes.com/news/2021/nov/9/connecticut-gov-ned-lamont-says-hes-definitely-see/?utm_source=RSS_Feed&utm_medium=RSS","b1b18d660b716e63dbee65dac0aca446d7fd4ebf8d197937998aa78d785e6dc0","ea2892618e3323c0eb1b0d9d4c44fab6"
"'Tiger King' star Carole Baskin sues Netflix over sequel","The Washington Times","ST. PETERSBURG, Fla. (AP) – The founder of a Florida big cat sanctuary featured in the popular “Tiger King” series is suing Netflix and a production company to prevent the use of interviews and footage involving her in an upcoming sequel. Netflix counters that nonprofit Big Cat Rescue founder Carole ...","2021-11-09 19:04:29","Top News","https://www.washingtontimes.com/news/2021/nov/9/tiger-king-star-carole-baskin-sues-netflix-over-se/?utm_source=RSS_Feed&utm_medium=RSS","b1b18d660b716e63dbee65dac0aca446d7fd4ebf8d197937998aa78d785e6dc0","20a173f667029445142e5344ae7a3a0f"
"Ethiopia detains UN staffers, accuses them of 'terror act'","The Washington Times","NAIROBI, Kenya (AP) – At least 16 United Nations local employees have been detained in Ethiopia’s capital, the U.N. said Tuesday, and a government spokesman said they were held because of their participation in terror” under the new state of emergency as the country’s yearlong war escalates. All the detained ...","2021-11-09 18:38:21","Top News","https://www.washingtontimes.com/news/2021/nov/9/ethiopia-detains-un-staffers-accuses-them-of-terro/?utm_source=RSS_Feed&utm_medium=RSS","b1b18d660b716e63dbee65dac0aca446d7fd4ebf8d197937998aa78d785e6dc0","62ce8d5109d9dd55fa1a0b0970a5387a"
"California Governor Gavin Newsom to end rare hiatus from public view","The Washington Times","SACRAMENTO, Calif. (AP) – With pressure mounting following a nearly two-week absence from public life, California Gov. Gavin Newsom planned to speak at an economic conference on Tuesday – his first public appearance since abruptly canceling a trip to an international climate conference for unspecified family obligations. Newsom has been ...","2021-11-09 18:23:45","Top News","https://www.washingtontimes.com/news/2021/nov/9/california-governor-gavin-newsom-to-end-rare-hiatu/?utm_source=RSS_Feed&utm_medium=RSS","b1b18d660b716e63dbee65dac0aca446d7fd4ebf8d197937998aa78d785e6dc0","33a7653611371ba48b62b642e47068b9"
"Veterans' fundraiser draws Bruce Springsteen and Jon Stewart","The Washington Times","NEW YORK (AP) – Long before Bruce Springsteen took the stage at the annual Stand Up for Heroes benefit in New York, Bob and Lee Woodruff joked about how they get The Boss to perform so frequently. “Sometimes, I have done things I’m not proud of,” joked Lee Woodruff. “Wait ...","2021-11-09 16:32:07","Top News","https://www.washingtontimes.com/news/2021/nov/9/veterans-fundraiser-draws-bruce-springsteen-and-jo/?utm_source=RSS_Feed&utm_medium=RSS","b1b18d660b716e63dbee65dac0aca446d7fd4ebf8d197937998aa78d785e6dc0","340a266f883bea3168b320ff2e7d1308"
"Brian Williams says he's leaving NBC News","The Washington Times","NEW YORK — Brian Williams, who remade his career as an MSNBC host after losing his job as NBC “Nightly News” anchor for making false claims about a wartime story, is leaving the network after 28 years. Williams said in a note to colleagues that “following much reflection,” he had ...","2021-11-10 01:46:07","Top News","https://www.washingtontimes.com/news/2021/nov/9/brian-williams-says-hes-leaving-nbc-news/?utm_source=RSS_Feed&utm_medium=RSS","b1b18d660b716e63dbee65dac0aca446d7fd4ebf8d197937998aa78d785e6dc0","4487885e6fcd8613783d8d8c82d1ee20"
"Elizabeth Warren sued by 'The Truth About COVID-19' publisher","The Washington Times","SEATTLE — A small publishing company in Vermont is suing Sen. Elizabeth Warren, saying her chastising Amazon over the sale of a book that promotes misinformation about COVID-19 amounted to censorship. The company, Chelsea Green, published a book called “The Truth About COVID-19,” which accuses the “global elite” of using ...","2021-11-10 00:20:43","Top News","https://www.washingtontimes.com/news/2021/nov/9/elizabeth-warren-sued-by-the-truth-about-covid-19-/?utm_source=RSS_Feed&utm_medium=RSS","b1b18d660b716e63dbee65dac0aca446d7fd4ebf8d197937998aa78d785e6dc0","4889a04e79bd21a722628c45d6b93615"
"National Cherry Blossom Festival to return in person for spring 2022","The Washington Times","The National Cherry Blossom Festival will return live and in-person this spring after two years of going virtual and hybrid due to the COVID-19 pandemic, officials announced Tuesday.  “D.C. is open. We’ve been through a lot, but we’re open,” said D.C. Mayor Muriel Bowser, speaking at an event at The ...","2021-11-10 00:10:18","Top News","https://www.washingtontimes.com/news/2021/nov/9/national-cherry-blossom-festival-return-person-spr/?utm_source=RSS_Feed&utm_medium=RSS","b1b18d660b716e63dbee65dac0aca446d7fd4ebf8d197937998aa78d785e6dc0","206b94c6895eb2d9156f10bf4c08ac2f"
"Winsome Sears, Jason Miyares' historic wins in Virginia illuminate growing diversity in GOP ranks","The Washington Times","The historic election wins by Lt. Gov.-elect Winsome Sears and Attorney General-elect Jason Miyares in Virginia showcased the increasing diversity among Republicans and the party’s success recruiting women and minority candidates to deliver a conservative message of freedom and opportunity. Ms. Sears, the first black woman elected statewide in Virginia, ...","2021-11-10 00:00:17","Top News","https://www.washingtontimes.com/news/2021/nov/9/winsome-sears-jason-miyares-historic-wins-virginia/?utm_source=RSS_Feed&utm_medium=RSS","b1b18d660b716e63dbee65dac0aca446d7fd4ebf8d197937998aa78d785e6dc0","b4206427b5c99aaf063cb9554507bc4a"
"Parole recommended for Leslie Van Houten, Charles Manson follower","The Washington Times","SACRAMENTO, Calif — A California parole panel on Tuesday recommended for the fifth time that Charles Manson follower Leslie Van Houten be freed from prison, decisions previously rejected by two governors. Van Houten, 72, is serving a life sentence for helping Manson and other cult members kill Los Angeles grocer ...","2021-11-09 23:16:02","Top News","https://www.washingtontimes.com/news/2021/nov/9/parole-recommended-for-leslie-van-houten-charles-m/?utm_source=RSS_Feed&utm_medium=RSS","b1b18d660b716e63dbee65dac0aca446d7fd4ebf8d197937998aa78d785e6dc0","bf0ca76488ab99aad2dd0d0c1e153a92"
"Veteran homelessness a focus as nation honors those who served","The Washington Times","The tent city outside the West Los Angeles Veterans Affairs Medical Center campus just off the 405 Freeway resembled more a military encampment than a makeshift shantytown thrown up by vagrants. The tents were lined up with a soldierly precision, and each sported a prominent American flag. The impressive display ...","2021-11-09 23:08:16","Top News","https://www.washingtontimes.com/news/2021/nov/9/veteran-homelessness-focus-nation-honors-those-who/?utm_source=RSS_Feed&utm_medium=RSS","b1b18d660b716e63dbee65dac0aca446d7fd4ebf8d197937998aa78d785e6dc0","a3a10bfb79615aa47d677b4aee859ca4"
"13 Trump officials in violation of Hatch Act, federal investigators find","The Washington Times","More than a dozen Trump administration officials, including Cabinet secretaries and top White House aides, overstepped the legal line meant to separate official government activities and campaigning in the leadup to the 2020 presidential election, the U.S. Office of Special Counsel found in a report released Tuesday. The report names ...","2021-11-09 23:02:53","Top News","https://www.washingtontimes.com/news/2021/nov/9/13-trump-officials-violation-hatch-act-federal-inv/?utm_source=RSS_Feed&utm_medium=RSS","b1b18d660b716e63dbee65dac0aca446d7fd4ebf8d197937998aa78d785e6dc0","f661e8582f1a69813d0ec1c6f63de9d8"
"Inside the Beltway: America's fractured political landscape","The Washington Times","Political division in the U.S. is no longer limited to disagreements between two political parties. An extensive new study released Tuesday by the Pew Research Center is intended as a “road map to today’s fractured political landscape” and reveals nine distinct partisan callings among Americans in general, spanning the ideological ...","2021-11-09 22:49:40","Top News","https://www.washingtontimes.com/news/2021/nov/9/inside-beltway-americas-fractured-political-landsc/?utm_source=RSS_Feed&utm_medium=RSS","b1b18d660b716e63dbee65dac0aca446d7fd4ebf8d197937998aa78d785e6dc0","756665748facd60300808693d4650500"
"Navy SEALs cite religious concerns in suit against vaccine mandate","The Washington Times","Twenty-six members of the elite Navy SEALs filed a lawsuit sued Tuesday claiming the government is arbitrarily refusing their requests for religious exemptions from the Biden administration's COVID-19 vaccination mandate. Nine other Navy personnel involved in special operations joined the action, according to the complaint filed in ...","2021-11-09 22:02:57","Top News","https://www.washingtontimes.com/news/2021/nov/9/navy-seals-cite-religious-concerns-suit-against-va/?utm_source=RSS_Feed&utm_medium=RSS","b1b18d660b716e63dbee65dac0aca446d7fd4ebf8d197937998aa78d785e6dc0","c22a983ed0eef60de0826deb16f115e3"
"Pelosi slammed for officiating lavish wedding of Getty oil heiress","The Washington Times","House Speaker Nancy Pelosi recently officiated at the lavish wedding of oil heiress Ivy Getty and went maskless at the ceremony at San Francisco City Hall, which made her the target of the mob on social media. The wedding was featured Tuesday in a spread in Vogue headlined Inside Ivy ...","2021-11-09 21:13:00","Top News","https://www.washingtontimes.com/news/2021/nov/9/pelosi-slammed-officiating-lavish-wedding-getty-oi/?utm_source=RSS_Feed&utm_medium=RSS","b1b18d660b716e63dbee65dac0aca446d7fd4ebf8d197937998aa78d785e6dc0","e8ae5b2ae9b78fcfac41c8a2c306fc08"
"Congressional deadlines threaten to sideline Biden social welfare bill","The Washington Times","Democrats are facing a slew of budget and spending deadlines in early December as they struggle to finalize President Biden's multitrillion-dollar social welfare and climate change bill. Both the House and Senate are scheduled to leave Washington for a holiday break starting on Dec. 10, giving lawmakers just over four ...","2021-11-09 21:12:00","Top News","https://www.washingtontimes.com/news/2021/nov/9/congressional-deadlines-threaten-sideline-biden-so/?utm_source=RSS_Feed&utm_medium=RSS","b1b18d660b716e63dbee65dac0aca446d7fd4ebf8d197937998aa78d785e6dc0","9430705a364ea2ce42beb80142c9bf92"
"House Jan. 6 panel subpoenas 10 former WH aides, including Stephen Miller and Kayleigh McEnany","The Washington Times","The House Select Committee investigating the Jan. 6 riot at the Capitol on Tuesday issued subpoenas targeting former White House press secretary Kayleigh McEnany, senior advisor Stephen Miller and eight others linked to former President Trump. Tuesday’s demands come a day after the committee issued a round of subpoenas targeting ...","2021-11-09 21:11:22","Top News","https://www.washingtontimes.com/news/2021/nov/9/house-jan-6-panel-subpoenas-10-former-wh-aides-inc/?utm_source=RSS_Feed&utm_medium=RSS","b1b18d660b716e63dbee65dac0aca446d7fd4ebf8d197937998aa78d785e6dc0","5c86d12295c864d9a8cffb01780c06fd"
"DOJ investigates charge of racial bias in Alabama wastewater programs","The Washington Times","The Justice Department on Monday launched an investigation into whether the Alabama Public Health Department is operating wastewater and infectious disease programs in a rural county in a way that discriminates against Black residents. Investigators will also examine whether the policies and practices of the state health department and the ...","2021-11-09 21:10:13","Top News","https://www.washingtontimes.com/news/2021/nov/9/doj-investigates-charge-racial-bias-alabama-wastew/?utm_source=RSS_Feed&utm_medium=RSS","b1b18d660b716e63dbee65dac0aca446d7fd4ebf8d197937998aa78d785e6dc0","4714a0748dbf171e3a4ecdcff2efe8c4"
"Trump takes credit for GOP win in Virginia","The Washington Times","Former President Donald Trump is claiming kingmaker status, contending that Republican Glenn Youngkin won the Virginia governor's race last week because of him and his supporters. Mr. Trump was largely absent on the trail in Virginia when Mr. Youngkin, an investment banker and political newcomer, campaigned and eventually won the ...","2021-11-09 20:53:00","Top News","https://www.washingtontimes.com/news/2021/nov/9/trump-takes-credit-gop-win-virginia/?utm_source=RSS_Feed&utm_medium=RSS","b1b18d660b716e63dbee65dac0aca446d7fd4ebf8d197937998aa78d785e6dc0","866f94d925a65e846134f3f5f4686807"
"Bipartisan legislation tackles tech companies' algorithms that select what info to display","The Washington Times","A bipartisan group of House lawmakers wants to force tech companies to give users options for algorithms — the formulas that determine what information reaches users and the order in which data such as Google search results are presented. Legislation introduced Tuesday would make the tech companies offer alternative algorithms ...","2021-11-09 20:49:00","Top News","https://www.washingtontimes.com/news/2021/nov/9/bipartisan-legislation-tackles-tech-companies-algo/?utm_source=RSS_Feed&utm_medium=RSS","b1b18d660b716e63dbee65dac0aca446d7fd4ebf8d197937998aa78d785e6dc0","be076a51ef7cfad04eac502faea74f8c"
"Jake Sullivan outed as 'foreign policy adviser' in Durham indictment: Report","The Washington Times","White House National Security Adviser Jake Sullivan is the “foreign policy adviser” identified in special counsel John Durham’s indictment of Democratic lawyer Michael Sussmann, according to a report Tuesday. The revelation, reported by Fox News, is significant because it is the strongest connection Mr. Durham has made linking the Clinton ...","2021-11-09 20:37:00","Top News","https://www.washingtontimes.com/news/2021/nov/9/jake-sullivan-outed-foreign-policy-adviser-durham-/?utm_source=RSS_Feed&utm_medium=RSS","b1b18d660b716e63dbee65dac0aca446d7fd4ebf8d197937998aa78d785e6dc0","8133a20c71b7a8115f9bb1d4b33a5549"
"NASA bumps astronaut moon landing to 2025 at earliest","The Washington Times","CAPE CANAVERAL, Fla. (AP) — NASA on Tuesday delayed putting astronauts back on the moon until 2025 at the earliest, missing the deadline set by the Trump administration. The space agency had been aiming for 2024 for the first moon landing by astronauts in a half-century. In announcing the delay, ...","2021-11-09 22:01:12","Top News","https://www.washingtontimes.com/news/2021/nov/9/nasa-bumps-astronaut-moon-landing-to-2025-at-earli/?utm_source=RSS_Feed&utm_medium=RSS","b1b18d660b716e63dbee65dac0aca446d7fd4ebf8d197937998aa78d785e6dc0","66120630914afe35bea0d59fd1c42eff"
"Federal judge refuses Trump request to block Jan. 6 records","The Washington Times","WASHINGTON (AP) — A federal judge rejected former President Donald Trump's request to block the release of documents to the House committee investigating the Jan. 6 Capitol riot. In denying a preliminary injunction, U.S. District Judge Tanya Chutkan said Tuesday that Congress had a strong public interest in obtaining records ...","2021-11-10 11:06:59","Top News","https://www.washingtontimes.com/news/2021/nov/10/federal-judge-refuses-trump-request-block-jan-6-re/?utm_source=RSS_Feed&utm_medium=RSS","b1b18d660b716e63dbee65dac0aca446d7fd4ebf8d197937998aa78d785e6dc0","8603d2c014fd9d5ffdcb476dcedade07"
"76% of Americans think Facebook making society worse: CNN poll","The Washington Times","Three-quarters of Americans think Facebook is making U.S. society worse and nearly half say they know someone who was led to believe a conspiracy theory due to content on the social media platform, a CNN poll conducted by SSRS said Wednesday. The belief that Facebook harms society, ...","2021-11-10 12:44:49","Top News","https://www.washingtontimes.com/news/2021/nov/10/76-americans-think-facebook-making-society-worse-c/?utm_source=RSS_Feed&utm_medium=RSS","b1b18d660b716e63dbee65dac0aca446d7fd4ebf8d197937998aa78d785e6dc0","56e773f3588b4ca2c106cc2fd19a2d13"
"U.S. food banks struggle to feed hungry amid surging prices","The Washington Times","OAKLAND, Calif. (AP) — U.S. food banks already dealing with increased demand from families sidelined by the pandemic now face a new challenge — surging food prices and supply chain issues walloping the nation. The higher costs and limited availability mean some families may get smaller servings or substitutions for ...","2021-11-10 05:05:54","Top News","https://www.washingtontimes.com/news/2021/nov/10/us-food-banks-struggle-to-feed-hungry-amid-surging/?utm_source=RSS_Feed&utm_medium=RSS","b1b18d660b716e63dbee65dac0aca446d7fd4ebf8d197937998aa78d785e6dc0","467fbff8b16717f1f24cc60a845bbe20"
"People magazine names Paul Rudd as 2021's Sexiest Man Alive","The Washington Times","LOS ANGELES (AP) — Paul Rudd has been crowned as 2021’s Sexiest Man Alive by People magazine. Rudd, known for his starring roles in Marvel’s “Ant-Man” films, “This is 40” and “Clueless,” was revealed as this year’s winner Tuesday night on CBS' ”The Late Show with Stephen Colbert. The actor ...","2021-11-10 05:14:41","Top News","https://www.washingtontimes.com/news/2021/nov/10/people-magazine-names-paul-rudd-as-2021s-sexiest-m/?utm_source=RSS_Feed&utm_medium=RSS","b1b18d660b716e63dbee65dac0aca446d7fd4ebf8d197937998aa78d785e6dc0","8bf0288dec542f3ba5ef11b7468846df"
"Igor Danchenko, charged in Durham probe, pleads not guilty","The Washington Times","Igor Danchenko, a Russian analyst who provided salacious, unverified rumors to British ex-spy Christopher Steele’s anti-Trump dossier, pleaded not guilty Wednesday to charges of lying to the FBI in a 2017 meeting. Mr. Danchenko is the third defendant in the 2½-year probe of special counsel John Durham, who is investigating ...","2021-11-10 14:45:38","Top News","https://www.washingtontimes.com/news/2021/nov/10/igor-danchenko-charged-durham-probe-pleads-not-gui/?utm_source=RSS_Feed&utm_medium=RSS","b1b18d660b716e63dbee65dac0aca446d7fd4ebf8d197937998aa78d785e6dc0","3f3bff3acc6b31fbb31b805b1c977134"
"Pelosi celebrates Trump court defeat in Jan. 6 inquiry","The Washington Times","House Speaker Nancy Pelosi on Wednesday praised a federal judge's ruling rejecting former President Trump's request to block the National Archives from turning over documents sought by the House select committee investigating the Capitol riot on Jan. 6. The District Court has delivered an important victory for the Constitution, the ...","2021-11-10 14:44:00","Top News","https://www.washingtontimes.com/news/2021/nov/10/pelosi-celebrates-trump-court-defeat-jan-6-inquiry/?utm_source=RSS_Feed&utm_medium=RSS","b1b18d660b716e63dbee65dac0aca446d7fd4ebf8d197937998aa78d785e6dc0","dcfa2dd509cad4badab69401cb88c14e"
"Fumio Kishida reelected Japan's PM in parliamentary vote","The Washington Times","TOKYO (AP) — Fumio Kishida was reelected as Japan's prime minister on Wednesday after his governing party scored a major victory in key parliamentary elections. Elected just over a month ago by parliament, Kishida called a quick election in which his Liberal Democratic Party secured 261 seats in the 465-member ...","2021-11-10 14:40:27","Top News","https://www.washingtontimes.com/news/2021/nov/10/fumio-kishida-reelected-japans-pm-parliamentary-vo/?utm_source=RSS_Feed&utm_medium=RSS","b1b18d660b716e63dbee65dac0aca446d7fd4ebf8d197937998aa78d785e6dc0","8e0993ad414c09a74f37cc73490ff9df"
"Pfizer's booster request sets up pivotal decision for FDA","The Washington Times","Pfizer’s request to offer COVID-19 booster shots to vaccinated persons 18 or older poses a key test for the Food and Drug Administration, which must determine whether to seek the counsel of outside advisers who pumped the brakes on a similar push less than two months ago. The Biden administration ...","2021-11-10 14:24:22","Top News","https://www.washingtontimes.com/news/2021/nov/10/pfizers-booster-request-sets-pivotal-decision-fda/?utm_source=RSS_Feed&utm_medium=RSS","b1b18d660b716e63dbee65dac0aca446d7fd4ebf8d197937998aa78d785e6dc0","380729080f9b1caab53e14a410974de1"
"Germany recommends Pfizer over Moderna for those younger than 30","The Washington Times","German authorities said Wednesday they will recommend the Pfizer-BioNTech vaccine instead of Moderna's for persons younger than 30 due to the small risk of inflammation of the heart muscle, or myocarditis. The Standing Committee on Vaccination (STIKO) said it based its decision on studies showing a lower number of myocarditis ...","2021-11-10 13:51:15","Top News","https://www.washingtontimes.com/news/2021/nov/10/germany-recommends-pfizer-over-moderna-those-young/?utm_source=RSS_Feed&utm_medium=RSS","b1b18d660b716e63dbee65dac0aca446d7fd4ebf8d197937998aa78d785e6dc0","3068801c9286c34ddae2529cf8d6c394"
"U.S. consumer prices soared 6.2% in past year, most since 1990","The Washington Times","WASHINGTON (AP) — Prices for U.S. consumers jumped 6.2% in October compared with a year earlier as surging costs for food, gas and housing left Americans grappling with the highest inflation rate since 1990. The year-over-year increase in the consumer price index exceeded the 5.4% rise in September, the Labor ...","2021-11-10 13:46:18","Top News","https://www.washingtontimes.com/news/2021/nov/10/us-consumer-prices-soared-62-in-past-year-most-sin/?utm_source=RSS_Feed&utm_medium=RSS","b1b18d660b716e63dbee65dac0aca446d7fd4ebf8d197937998aa78d785e6dc0","b2fc02442950a9f8d096c7abb1edaf15"
