"Pentagon tracking 'debris-generating event' in space","The Washington Times","The Pentagon is tracking a recent debris-generating event in outer space, military officials said, sparking fear of a major missile test in orbit. U.S. Space Command offered few details on the event, but defense officials have previously warned that Russian anti-satellite weapons testing could create large debris fields and spark ...","2021-11-15 17:21:00","Top News","https://www.washingtontimes.com/news/2021/nov/15/pentagon-tracking-debris-generating-event-space/?utm_source=RSS_Feed&utm_medium=RSS","b1b18d660b716e63dbee65dac0aca446d7fd4ebf8d197937998aa78d785e6dc0","e6543b4b39820210d5f332c7b509e17b"
"Alex Jones liable for defamation in Sandy Hook 'hoax' case","The Washington Times","Infowars host and conspiracy theorist Alex Jones was found liable Monday for damages in lawsuits brought by parents of children killed in the Sandy Hook Elementary School shooting over Jones' claims that the massacre was a hoax. Judge Barbara Bellis took the rare step of defaulting Jones in the defamation ...","2021-11-15 17:17:29","Top News","https://www.washingtontimes.com/news/2021/nov/15/alex-jones-liable-defamation-sandy-hook-hoax-case/?utm_source=RSS_Feed&utm_medium=RSS","b1b18d660b716e63dbee65dac0aca446d7fd4ebf8d197937998aa78d785e6dc0","6b43cea3fc25c61ebb146399a47a86b5"
"Maggie McIntosh, longtime Maryland state lawmaker, won't seek reelection","The Washington Times","ANNAPOLIS — A longtime Maryland state lawmaker who chairs a key budget panel says she won’t be running for reelection. Del. Maggie McIntosh, a Baltimore Democrat, announced she will retire at the end of 2022. She wrote Monday in The Baltimore Sun that when she finishes this term, she will ...","2021-11-15 16:58:00","Top News","https://www.washingtontimes.com/news/2021/nov/15/maggie-mcintosh-longtime-maryland-state-lawmaker-w/?utm_source=RSS_Feed&utm_medium=RSS","b1b18d660b716e63dbee65dac0aca446d7fd4ebf8d197937998aa78d785e6dc0","f7632e0104bfd4374bb65421dbd85fb7"
"Zephyr Teachout announces run for New York attorney general","The Washington Times","NEW YORK (AP) — Law professor Zephyr Teachout, who lost the 2018 Democratic primary for New York state attorney general to Letitia James, announced Monday that she will seek the nomination again next year. “My name is Zephyr Teachout, and I am running to be the next attorney general of ...","2021-11-15 16:27:13","Top News","https://www.washingtontimes.com/news/2021/nov/15/zephyr-teachout-announces-run-for-new-york-attorne/?utm_source=RSS_Feed&utm_medium=RSS","b1b18d660b716e63dbee65dac0aca446d7fd4ebf8d197937998aa78d785e6dc0","9bab6d4a2c1154a2b3858929854b35ce"
"Tensions flare in Arbery death trial as Jesse Jackson visits","The Washington Times","BRUNSWICK, Ga. (AP) — A judge denied mistrial requests on Monday at the trial of three White men charged with murdering Ahmaud Arbery after defense attorneys claimed jurors were tainted by weeping from the gallery where the slain Black man's parents sat with the Rev. Jesse Jackson. The morning's testimony ...","2021-11-15 15:39:40","Top News","https://www.washingtontimes.com/news/2021/nov/15/defense-fails-to-oust-jesse-jackson-from-arbery-de/?utm_source=RSS_Feed&utm_medium=RSS","b1b18d660b716e63dbee65dac0aca446d7fd4ebf8d197937998aa78d785e6dc0","f5743bccbe5765a5976b0aa8ed246aa9"
"Max Linn, mask-shredding ex-Senate hopeful, due in court in gun case","The Washington Times","ELLSWORTH, Maine — A former U.S. Senate candidate is due in court for a hearing about allegations he pointed a gun at a former campaign staffer. Max Linn ran as a conservative independent in a 2020 Senate race that was won by incumbent Republican Sen. Susan Collins. He gained notoriety ...","2021-11-15 15:28:00","Top News","https://www.washingtontimes.com/news/2021/nov/15/max-linn-mask-shredding-ex-senate-hopeful-due-in-c/?utm_source=RSS_Feed&utm_medium=RSS","b1b18d660b716e63dbee65dac0aca446d7fd4ebf8d197937998aa78d785e6dc0","5a657fa343b41c828e4757462c7df8bc"
"U.K. says Liverpool taxi blast was a bomb, raises threat level","The Washington Times","LONDON (AP) — British authorities raised the country's threat level to its second-highest rung on Monday, after police said a blast in a taxi outside a Liverpool hospital was caused by a homemade bomb. Investigators said they were treating Sunday's explosion — which killed the suspected bombmaker and injured the ...","2021-11-15 11:48:51","Top News","https://www.washingtontimes.com/news/2021/nov/15/uk-police-blast-outside-hospital-was-terrorist-inc/?utm_source=RSS_Feed&utm_medium=RSS","b1b18d660b716e63dbee65dac0aca446d7fd4ebf8d197937998aa78d785e6dc0","9d9dfad8b69dd54b195b967fcb8f49e8"
"Most Americans say it's OK to correct others' words: Study","The Washington Times","Most Americans get annoyed by misused words or phrases and think it's OK to correct someone's pronunciation without being asked, according to a recent survey of common English mistakes. Sixty-six percent of 2,000 native English speakers said it was OK to correct someone, even if they weren't asked to do ...","2021-11-15 20:35:00","Top News","https://www.washingtontimes.com/news/2021/nov/15/most-americans-say-its-ok-correct-others-words-stu/?utm_source=RSS_Feed&utm_medium=RSS","b1b18d660b716e63dbee65dac0aca446d7fd4ebf8d197937998aa78d785e6dc0","22472c6d47960b0704aa1f9301c08d32"
"Maryland Gov. Larry Hogan announces steps to address anti-Asian hate crimes","The Washington Times","ANNAPOLIS, Md. (AP) – Maryland Gov. Larry Hogan announced actions on Monday to address anti-Asian hate and bias crimes that have increased since 2019. The initiatives are the product of a workgroup the Republican governor formed in April. They include enhanced safety and enforcement measures, increased access to community resources ...","2021-11-15 19:44:39","Top News","https://www.washingtontimes.com/news/2021/nov/15/maryland-gov-larry-hogan-announces-steps-to-addres/?utm_source=RSS_Feed&utm_medium=RSS","b1b18d660b716e63dbee65dac0aca446d7fd4ebf8d197937998aa78d785e6dc0","4e3e764f2ef601421eecebf2647de29a"
"U.S. says Russian space weapon debris puts space station in danger","The Washington Times","Russia on Monday tested a major anti-satellite weapon in outer space, U.S. officials said, creating more than 1,500 large pieces of debris and potentially endangering American and Russian astronauts aboard the International Space Station. U.S. Space Command first confirmed the debris-generating event, and Biden administration officials later said that it ...","2021-11-15 17:21:00","Top News","https://www.washingtontimes.com/news/2021/nov/15/pentagon-tracking-debris-generating-event-space/?utm_source=RSS_Feed&utm_medium=RSS","b1b18d660b716e63dbee65dac0aca446d7fd4ebf8d197937998aa78d785e6dc0","02859de4064931f0864b4a72e867a264"
"Biden signs $1T infrastructure bill into law, opening up funds for roads, ports","The Washington Times","President Biden signed his $1.2 trillion bipartisan infrastructure package into law on Monday, opening up federal funds for railroads, bridges, mass transit, broadband and utilities. For too long, we've talked about having the best economy in the world, Mr. Biden said at a White House signing ceremony on the South ...","2021-11-15 21:34:00","Top News","https://www.washingtontimes.com/news/2021/nov/15/biden-signs-1t-infrastructure-bill-law-opening-fun/?utm_source=RSS_Feed&utm_medium=RSS","b1b18d660b716e63dbee65dac0aca446d7fd4ebf8d197937998aa78d785e6dc0","559a482ab07ef777b0e7bf055a65cf00"
"Defense attorney: Rittenhouse feared for his life in Kenosha","The Washington Times","KENOSHA, Wis. — Kyle Rittenhouse provoked bloodshed on the streets of Kenosha by bringing a semi-automatic rifle to a protest and menacing others, and when the shooting stopped, he walked off like a hero in a Western, a prosecutor said in closing arguments Monday at Rittenhouse's murder trial. But Rittenhouse's ...","2021-11-15 21:15:00","Top News","https://www.washingtontimes.com/news/2021/nov/15/defense-attorney-rittenhouse-feared-his-life-kenos/?utm_source=RSS_Feed&utm_medium=RSS","b1b18d660b716e63dbee65dac0aca446d7fd4ebf8d197937998aa78d785e6dc0","b829c65dcf2b28d1a4a4549ebae05e6a"
"Idaho lawmakers meet to take on federal vaccine requirements","The Washington Times","BOISE, Idaho (AP) – Idaho lawmakers in a first-ever move in state history called themselves back into session Monday to reconvene the Legislature after more than five months off to put forward about three dozen bills dealing with COVID-19 vaccine and mask requirements. The House never formally adjourned and came ...","2021-11-15 20:40:26","Top News","https://www.washingtontimes.com/news/2021/nov/15/idaho-lawmakers-meet-to-take-on-federal-vaccine-re/?utm_source=RSS_Feed&utm_medium=RSS","b1b18d660b716e63dbee65dac0aca446d7fd4ebf8d197937998aa78d785e6dc0","04f190e5430e2989ffd1b22c7f1a4092"
"Raffle drum will decide final 12 Kyle Rittenhouse jurors","The Washington Times","KENOSHA, Wis. — The judge in Kyle Rittenhouse's murder trial will use a raffle drum that sat in the courtroom throughout the two-week trial to select jurors who will be dismissed from the pool of 18 to get to the final 12 who will decide the case. Schroeder told jurors ...","2021-11-16 03:43:49","Top News","https://www.washingtontimes.com/news/2021/nov/15/raffle-drum-will-decide-final-12-kyle-rittenhouse-/?utm_source=RSS_Feed&utm_medium=RSS","b1b18d660b716e63dbee65dac0aca446d7fd4ebf8d197937998aa78d785e6dc0","7152b5eb1b20e1478c8042643ac523db"
"Michael McCaul requests interviews with Biden officials on Afghan withdrawal","The Washington Times","Republicans on the House Foreign Affairs Committee are requesting that 34 Biden administration officials appear for transcribed interviews regarding the botched withdrawal from Afghanistan in an escalation of the lawmakers’ probe after “months of delayed and often incomplete responses” from senior State Department officials. In a scathing letter Monday to ...","2021-11-16 02:36:56","Top News","https://www.washingtontimes.com/news/2021/nov/15/michael-mccaul-requests-interviews-biden-officials/?utm_source=RSS_Feed&utm_medium=RSS","b1b18d660b716e63dbee65dac0aca446d7fd4ebf8d197937998aa78d785e6dc0","2e77891a4c345aa162a5300f5dff74b8"
"Joe Biden says 'guardrails' needed to prevent conflict with China","The Washington Times","President Biden on Monday told Chinese President Xi Jinping that “guardrails” are needed so that tensions between the two nations do not “veer into conflict.” “As I said before, it seems to be our responsibility — as leaders of China and the United States — to ensure that the competition ...","2021-11-16 01:27:45","Top News","https://www.washingtontimes.com/news/2021/nov/15/joe-biden-says-guardrails-needed-prevent-conflict-/?utm_source=RSS_Feed&utm_medium=RSS","b1b18d660b716e63dbee65dac0aca446d7fd4ebf8d197937998aa78d785e6dc0","c19c5f6b73088ae111455fffe18d89b4"
"Border chaos continues in October with record-setting arrests","The Washington Times","The Border Patrol apprehended nearly 160,000 illegal immigrants jumping the southern border in October, Homeland Security announced Monday, toppling yet another monthly record for President Biden. That still marked a bit of an improvement compared to the summer, when monthly apprehensions flirted with 200,000. And key yardsticks of illegal activity, ...","2021-11-16 00:20:25","Top News","https://www.washingtontimes.com/news/2021/nov/15/border-chaos-continues-october-record-setting-arre/?utm_source=RSS_Feed&utm_medium=RSS","b1b18d660b716e63dbee65dac0aca446d7fd4ebf8d197937998aa78d785e6dc0","8c474d2e0eca02cbf4afc7e3465c38e2"
"China, Russia used pandemic disinformation to undermine U.S., report says","The Washington Times","China and Russia spread disinformation about the COVID-19 pandemic in a bid to undermine the United States and support Chinese and Russian narratives around the world, according to a report by the RAND Corp. made public Monday. The report by the defense think tank stated that the disinformation has contributed ...","2021-11-15 23:52:25","Top News","https://www.washingtontimes.com/news/2021/nov/15/china-russia-used-pandemic-disinformation-undermin/?utm_source=RSS_Feed&utm_medium=RSS","b1b18d660b716e63dbee65dac0aca446d7fd4ebf8d197937998aa78d785e6dc0","aa64fefaa26b58688290207563f1eb18"
"Cargo ship backup worsens after Biden attempts to untangle supply chain","The Washington Times","The throng of container ships anchored off the coast of Southern California grew by 43% since President Biden’s announcement a month ago that the ports there would start working around the clock and ease supply chain woes. A record 83 cargo ships sat off the coast Friday awaiting offload at ...","2021-11-15 23:45:22","Top News","https://www.washingtontimes.com/news/2021/nov/15/cargo-ship-backup-worsens-after-biden-attempts-unt/?utm_source=RSS_Feed&utm_medium=RSS","b1b18d660b716e63dbee65dac0aca446d7fd4ebf8d197937998aa78d785e6dc0","7e28b35f424e0549be51c5965833ef5b"
"Nancy Pelosi pushing futile vote on multi-trillion-dollar spending bill","The Washington Times","House Speaker Nancy Pelosi is gearing up for a vote this week on President Biden’s multi-trillion-dollar social welfare legislation, but strong divisions remain among Democrats over the size and scope of the final bill. Mrs. Pelosi told reporters Monday that she was eager to push through the legislation during an ...","2021-11-15 23:34:20","Top News","https://www.washingtontimes.com/news/2021/nov/15/nancy-pelosi-pushing-futile-vote-multi-trillion-do/?utm_source=RSS_Feed&utm_medium=RSS","b1b18d660b716e63dbee65dac0aca446d7fd4ebf8d197937998aa78d785e6dc0","0373bf3efc9ab71dcfacfc14fe37fc7e"
"A manufactured border crisis puts Belarus back in the spotlight","The Washington Times","Outrage among European Union officials who say Belarus is deliberately trying to flood Middle Eastern migrants into Poland and Lithuania reached new heights Monday, with the EU announcing it will sanction airlines that arranged special deals to fly the migrants into Belarus in recent months. The announcement comes after European ...","2021-11-15 23:27:34","Top News","https://www.washingtontimes.com/news/2021/nov/15/manufactured-border-crisis-puts-belarus-back-spotl/?utm_source=RSS_Feed&utm_medium=RSS","b1b18d660b716e63dbee65dac0aca446d7fd4ebf8d197937998aa78d785e6dc0","78248bc55b35dd2120f8c86e051c940c"
"Democrats preparing to fight GOP to be 'party of the parents' in 2022 midterms","The Washington Times","Democratic Party officials insist they’re ready for the debate over education after parental anger at public schools helped Republicans score a string of upset victories in the Virginia elections this month. Democrats say what happened in Virginia was a fluke and they will fight in the 2022 midterm elections for ...","2021-11-15 22:58:42","Top News","https://www.washingtontimes.com/news/2021/nov/15/democrats-preparing-fight-gop-be-party-parents-202/?utm_source=RSS_Feed&utm_medium=RSS","b1b18d660b716e63dbee65dac0aca446d7fd4ebf8d197937998aa78d785e6dc0","ad9e288ede4e50f0c6c21ba2dc3d3dab"
"Wyoming GOP stops recognizing Liz Cheney as Republican","The Washington Times","CASPER, Wyo. —The Wyoming Republican Party will no longer recognize Liz Cheney as a member of the GOP in its second formal rebuke for her criticism of former President Donald Trump. The 31-29 vote Saturday in Buffalo, Wyoming, by the state party central committee followed votes by local GOP officials ...","2021-11-15 22:55:40","Top News","https://www.washingtontimes.com/news/2021/nov/15/wyoming-gop-stops-recognizing-liz-cheney-as-republ/?utm_source=RSS_Feed&utm_medium=RSS","b1b18d660b716e63dbee65dac0aca446d7fd4ebf8d197937998aa78d785e6dc0","3035d66e78d33f1aa5f50aa9be0a7aa9"
"Merrick Garland to probe underreporting of American Indians missing or murdered","The Washington Times","No one is quite sure how many American Indians are killed or go missing every year — and the Biden administration wants to know why. Attorney General Merrick Garland announced Monday the Justice Department will set up a committee after President Biden called for federal agencies to get involved in an executive order ...","2021-11-15 22:54:57","Top News","https://www.washingtontimes.com/news/2021/nov/15/merrick-garland-probe-underreporting-american-indi/?utm_source=RSS_Feed&utm_medium=RSS","b1b18d660b716e63dbee65dac0aca446d7fd4ebf8d197937998aa78d785e6dc0","a77d288b99c67e99fcbcdf7a6af4892d"
"GOP lawmakers to Christopher Wray: Be prepared to talk about Durham probe, school board memo","The Washington Times","Republican lawmakers get a chance to ask FBI Director Christopher Wray about the Durham probe and the controversial Justice Department school board memo during a hearing on Tuesday. In a letter sent Monday to Mr. Wray, Rep. Devin Nunes outlined the topics that GOP members of the House Permanent Select ...","2021-11-15 22:52:32","Top News","https://www.washingtontimes.com/news/2021/nov/15/gop-lawmakers-christopher-wray-be-prepared-talk-ab/?utm_source=RSS_Feed&utm_medium=RSS","b1b18d660b716e63dbee65dac0aca446d7fd4ebf8d197937998aa78d785e6dc0","b8ec8f50f6b2b209c724c8f3fb05568b"
"Iranian helicopter buzzes USS Essex in Gulf of Oman","The Washington Times","An Iranian military helicopter buzzed a U.S. warship in the Gulf of Oman last week, coming within 25 yards of the USS Essex in an act that Pentagon officials said was unsafe and unprofessional. The Iranian Navy helicopter circled the ship three times on Nov. 11 before finally veering off. ...","2021-11-15 22:46:00","Top News","https://www.washingtontimes.com/news/2021/nov/15/iranian-helicopter-buzzes-uss-essex-gulf-oman/?utm_source=RSS_Feed&utm_medium=RSS","b1b18d660b716e63dbee65dac0aca446d7fd4ebf8d197937998aa78d785e6dc0","8dc3e45c99afe84971394a6c5be0aa74"
"Activists warn Democrats: Full amnesty or expect election losses","The Washington Times","Immigrant-rights advocates demanded Monday that Democrats revive a plan for a broad amnesty measure in President Biden’s budget bill, saying unless illegal immigrants see a full pathway to citizenship their allies will have less reason to turn out to vote in 2022.  The warning came as Democrats tried to finalize ...","2021-11-15 22:34:42","Top News","https://www.washingtontimes.com/news/2021/nov/15/activists-warn-democrats-full-amnesty-or-expect-el/?utm_source=RSS_Feed&utm_medium=RSS","b1b18d660b716e63dbee65dac0aca446d7fd4ebf8d197937998aa78d785e6dc0","bb644bfbb2ad99c5a4d44a82e2a63ade"
"White House skips introduction of 'key partner' Kamala Harris at bill signing","The Washington Times","The White House insisted Monday that Vice President Kamala Harris is an important part of President Biden’s team, but staffers botched the introduction of the vice president hours later at a high-profile bill-signing ceremony. White House press secretary Jen Psaki rejected reports that Ms. Harris is unhappy in her role, ...","2021-11-15 22:23:56","Top News","https://www.washingtontimes.com/news/2021/nov/15/white-house-skips-introduction-key-partner-kamala-/?utm_source=RSS_Feed&utm_medium=RSS","b1b18d660b716e63dbee65dac0aca446d7fd4ebf8d197937998aa78d785e6dc0","3100cfdaa042b07102507523e0d4f5d3"
"Arkansas expands booster eligibility to age 18 and older","The Washington Times","LITTLE ROCK, Ark. (AP) – Arkansas is expanding the eligibility for COVID-19 vaccine boosters to anyone aged 18 and older, Gov. Asa Hutchinson announced Monday. The state joins several others that are making the additional shot available to more people. California, Colorado and New Mexico have also expanded eligibility for ...","2021-11-15 22:11:55","Top News","https://www.washingtontimes.com/news/2021/nov/15/arkansas-expands-booster-eligibility-to-age-18-and/?utm_source=RSS_Feed&utm_medium=RSS","b1b18d660b716e63dbee65dac0aca446d7fd4ebf8d197937998aa78d785e6dc0","dacba2138fbf69b56fad08c075d34ec9"
"Inside the Beltway: Sean Spicer's advice for Republicans","The Washington Times","Former White House press secretary Sean Spicer has a new book out, with a timely title: “Radical Nation: Joe Biden and Kamala Harris’s Dangerous Plan for America.” It chronicles the progressive agenda now gripping the White House and provides grassroots guidelines for those who want to push back against it. ...","2021-11-15 22:11:52","Top News","https://www.washingtontimes.com/news/2021/nov/15/inside-beltway-sean-spicers-advice-republicans/?utm_source=RSS_Feed&utm_medium=RSS","b1b18d660b716e63dbee65dac0aca446d7fd4ebf8d197937998aa78d785e6dc0","005754cad9159bb768281745f471c7fb"
"Ryan Guillen, Texas Democrat, defects to GOP","The Washington Times","FLORESVILLE, Texas (AP) - A longtime Democratic lawmaker from South Texas switched parties Monday, giving Republicans another boost in their aggressive attempts to make inroads with voters along the U.S.-Mexico border. State Rep. Ryan Guillen has been one of the most conservative Democrats in the Texas House of Representatives since ...","2021-11-15 21:55:59","Top News","https://www.washingtontimes.com/news/2021/nov/15/ryan-guillen-texas-democrat-defects-to-gop/?utm_source=RSS_Feed&utm_medium=RSS","b1b18d660b716e63dbee65dac0aca446d7fd4ebf8d197937998aa78d785e6dc0","6efeb4846fa2be3f6062b360ad29b6e5"
"Biden signs $1.2T infrastructure bill into law, opening up funds for roads, ports","The Washington Times","President Biden signed his $1.2 trillion bipartisan infrastructure package into law on Monday, opening up federal funds for railroads, bridges, mass transit, broadband and utilities. For too long, we've talked about having the best economy in the world, Mr. Biden said at a White House signing ceremony on the South ...","2021-11-15 21:34:00","Top News","https://www.washingtontimes.com/news/2021/nov/15/biden-signs-1t-infrastructure-bill-law-opening-fun/?utm_source=RSS_Feed&utm_medium=RSS","b1b18d660b716e63dbee65dac0aca446d7fd4ebf8d197937998aa78d785e6dc0","cae6eeb899760267089ad73a0a72d1be"
"Mayorkas faces questions over honesty as Senate panel prepares to grill him on border crisis","The Washington Times","Homeland Security Secretary Alejandro Mayorkas will take the witness seat in Congress on Tuesday facing new questions about the Biden administration’s handling of the border crisis and his own truthfulness in previous testimony about efforts to control the surge of illegal immigrants. Sen. James Lankford released a letter late Monday ...","2021-11-16 10:14:42","Top News","https://www.washingtontimes.com/news/2021/nov/16/mayorkas-faces-questions-over-honesty-senate-panel/?utm_source=RSS_Feed&utm_medium=RSS","b1b18d660b716e63dbee65dac0aca446d7fd4ebf8d197937998aa78d785e6dc0","1c41d94db198a01428a2d6a8b63303f8"
"Netanyahu appears in court as ex-aide prepares to take stand","The Washington Times","JERUSALEM (AP) — Former Israeli Prime Minister Benjamin Netanyahu appeared in court for the first time in over half a year on Tuesday as a one-time confidant prepared to take the stand against him in a high-profile corruption case. But the long-awaited testimony was delayed until next week after a ...","2021-11-16 09:33:14","Top News","https://www.washingtontimes.com/news/2021/nov/16/netanyahu-appears-in-court-as-ex-aide-prepares-to-/?utm_source=RSS_Feed&utm_medium=RSS","b1b18d660b716e63dbee65dac0aca446d7fd4ebf8d197937998aa78d785e6dc0","9e29cffbbaf9fad79f8a22c9fbf91c4f"
"Khalifa Hifter, key Libya commander, announces candidacy for president","The Washington Times","CAIRO (AP) — Libya’s powerful commander, Khalifa Hifter, filed Tuesday as a candidate in the country’s presidential elections next month, as the long-waited vote faces growing uncertainty. Hifter submitted his candidacy papers Tuesday in the eastern city of Benghazi and announced the move in a video. He said he's seeking ...","2021-11-16 08:41:41","Top News","https://www.washingtontimes.com/news/2021/nov/16/key-libya-commander-announces-candidacy-for-presid/?utm_source=RSS_Feed&utm_medium=RSS","b1b18d660b716e63dbee65dac0aca446d7fd4ebf8d197937998aa78d785e6dc0","07595ac0e41a4c8733e0fb62d4429c16"
"2 explosions heard in the Ugandan capital, Kampala","The Washington Times","KAMPALA, Uganda (AP) — Two loud explosions were heard in the Ugandan capital, Kampala, early Tuesday, witnesses reported. They said one blast happened near a police station and another along a street near the parliamentary building. That blast appeared to target a building housing an insurance company, and the subsequent ...","2021-11-16 07:43:32","Top News","https://www.washingtontimes.com/news/2021/nov/16/2-explosions-heard-in-the-ugandan-capital-kampala/?utm_source=RSS_Feed&utm_medium=RSS","b1b18d660b716e63dbee65dac0aca446d7fd4ebf8d197937998aa78d785e6dc0","200f611b0449f8c1b9e3e8aa01045ab9"
"Cargo ship backup worsens after Joe Biden attempts to untangle supply chain","The Washington Times","The throng of container ships anchored off the coast of Southern California grew by 43% since President Biden’s announcement a month ago that the ports there would start working around the clock and ease supply chain woes. A record 83 cargo ships sat off the coast Friday awaiting offload at ...","2021-11-15 23:45:22","Top News","https://www.washingtontimes.com/news/2021/nov/15/cargo-ship-backup-worsens-after-biden-attempts-unt/?utm_source=RSS_Feed&utm_medium=RSS","b1b18d660b716e63dbee65dac0aca446d7fd4ebf8d197937998aa78d785e6dc0","02789829c63d71933887d470a9042c77"
