"Navy SEALs running for Congress lay into Biden's foreign policy: 'Why don't they mandate we rescue our citizens over in Afghanistan?'","The Blaze","A group of former U.S. Navy SEALs who are now running for Congress dressed down the Biden administration for foreign policy decisions, including the tumultuous Afghanistan withdrawal. Retired Navy SEALs – Ryan Zinke, Eli Crane, Morgan Luttrell, Brady Duke, and Derrick Van Orden – appeared on Fox News this week. The Navy SEALs turned congressional candidates ripped President Joe Biden for leaving Americans in Afghanistan. Ryan Zinke – former Secretary of Interior – called for congressional invest","2021-11-14 00:34:55","Top News","https://www.theblaze.com/news/navy-seals-congress-afghanistan-biden","b23bca1c4ac14c8aa186910036a47936d6756c56d8c814e6a49752a488f2d020","7c153e3b0b4b564e40c7d7b061b7476d"
"CNN host asks key Rittenhouse trial witness to 'clarify his testimony.' But it doesn't go over well.","The Blaze","CNN anchor Anderson Cooper invited Gaige Grosskreutz, a key witness in the Kyle Rittenhouse trial, to clarify his testimony this week after he seemingly contradicted himself during an interview on Good Morning America.What happened?Cooper confronted Grosskreutz Thursday about his statements on Good Morning America that appeared to contradict his sworn testimony at the Rittenhouse trial on Monday.Specifically, Grosskreutz testified under oath that Rittenhouse only fired on him when he adva","2021-11-13 23:30:00","Top News","https://www.theblaze.com/news/gaige-grosskreutz-cnn-interview-perjury-accusation","b23bca1c4ac14c8aa186910036a47936d6756c56d8c814e6a49752a488f2d020","ece63356d0d516d1423ffbaa16f063e9"
"Kyle Rittenhouse's mom issues six-word response when asked if they will sue Joe Biden for 'defaming' Rittenhouse","The Blaze","The mother of Kyle Rittenhouse suggested Saturday that her attorneys are considering a lawsuit against President Joe Biden for allegedly associating her son with white supremacy.What are the details?During an interview on Fox News' Fox & Friends, Wendy Rittenhouse was asked if the Rittenhouse team plans to take any action against powerful Americans — including Biden — for interfering in the justice system and defaming the 18-year-old Rittenhouse.The elder Rittenhouse had a six word respons","2021-11-13 22:30:00","Top News","https://www.theblaze.com/news/kyle-rittenhouse-mom-biden-defamation-lawsuit","b23bca1c4ac14c8aa186910036a47936d6756c56d8c814e6a49752a488f2d020","c9bafceed92af7a662face82c21bd154"
"Aaron Rodgers cleared to play on Sunday, only days after COVID diagnosis and Joe Rogan medical advice controversy","The Blaze","Aaron Rodgers is set to be back on the gridiron on Sunday after he tested negative for COVID-19. Only days after his COVID-19 diagnosis, Rodgers will return as quarterback for the Green Bay Packers for their home game against the Seattle Seahawks at Lambeau Field on Sunday, according to NFL.com.Rodgers is reportedly set to be activated off the reserve/COVID-19 list, just 10 days after he tested positive for coronavirus — the earliest he was eligible to return. Throughout the week leading up to ","2021-11-13 21:30:00","Top News","https://www.theblaze.com/news/aaron-rodgers-covid-joe-rogan","b23bca1c4ac14c8aa186910036a47936d6756c56d8c814e6a49752a488f2d020","ebd38630d183fc57013242c2b389b09a"
"Appeals court cites WH chief of staff's Twitter activity in handing Biden another loss on vaccine mandate","The Blaze","	Is a retweet by White House chief of staff Ron Klain partly responsible for President Joe Biden's COVID-19 vaccine mandate taking another loss in federal court?What happened?	The U.S. Court of Appeals for the Fifth Circuit again ruled against President Joe Biden's COVID-19 vaccine mandate Friday.	According to the court, the mandate — which is enforced as an emergency temporary standard via the Occupational Safety and Health Administration — is likely unconstitutional.	The court expla","2021-11-13 20:30:13","Top News","https://www.theblaze.com/news/ron-klain-retweet-vaccine-mandate","b23bca1c4ac14c8aa186910036a47936d6756c56d8c814e6a49752a488f2d020","49f16ab2b6486353c7c15d6bc422f009"
"Washington Post columnist ripped to shreds for suggesting unvaccinated be prosecuted: 'This is demented beyond words'","The Blaze","Longtime Washington Post columnist Gene Weingarten was castigated online for suggesting that those who are not vaccinated against COVID-19 should be prosecuted. Throughout the COVID-19 pandemic, Weingarten has expressed disdain to Americans who did not receive the coronavirus vaccine. It is hard but not impossible to refrain from hating the stupidly unvaccinated, people who are dragging us back into pandemic, the WaPo columnist wrote on Twitter in July. It is impossible, however, to refrain f","2021-11-13 19:15:00","Top News","https://www.theblaze.com/news/wapo-unvaccinated-prosecuted-twitter-reactions","b23bca1c4ac14c8aa186910036a47936d6756c56d8c814e6a49752a488f2d020","1b3891fc9ec09e1684fdf4a6471bc949"
"Liberal law professor excoriates prosecutors, media over 'crash and burn' of Kyle Rittenhouse trial","The Blaze","Jonathan Turley, a professor at George Washington University Law School and self-described liberal, published a scathing essay this week about the Kyle Rittenhouse trial, taking to task the prosecution for its crash and burn and the media for its biased coverage.What about the prosecution?Writing in USA Today, Turley compared the trial to the parable of the blind men and the elephant.The trial of Kyle Rittenhouse increasingly seems like a legal version of the parable of the blind men and ","2021-11-13 17:30:00","Top News","https://www.theblaze.com/news/jonathan-turley-kyle-rittehouse-trial","b23bca1c4ac14c8aa186910036a47936d6756c56d8c814e6a49752a488f2d020","c7dfb93e72ac119af55fdb955c78b08e"
"Jen Psaki says record inflation is being weaponized as a 'political cudgel' against Biden, claims massive spending bills will lower inflation","The Blaze","White House press secretary Jen Psaki attempted to defend the Biden administration against rising concerns about record inflation. Psaki also asserted that President Joe Biden's Build Back Better agenda would help alleviate inflation and not exacerbate it. During Friday's White House press briefing, Psaki was asked about inflation and how it adversely affects Americans. Psaki dismissed a lot of talk about inflation and claimed it is being weaponized as a political cudgel and it shouldn't be","2021-11-13 16:30:00","Top News","https://www.theblaze.com/news/inflation-jen-psaki-spending-bills","b23bca1c4ac14c8aa186910036a47936d6756c56d8c814e6a49752a488f2d020","28070ef767d9c4f6a2a39634fc2e5d79"
"Truck driver who beat powerful Democrat leaves Tucker Carlson in stitches over what he told defeated opponent","The Blaze","Edward Durr, the truck driver who dethroned one of New Jersey's most powerful Democratic politicians, left Fox News host Tucker Carlson in stitches Thursday after revealing what he told his political opponent.What is the background?New Jersey state State President Steve Sweeney (D) initially refused to concede to Durr after the Associated Press declared Durr the winner of their election contest.But on Wednesday, six days after the AP called the race, Sweeney, the second most-powerful politician ","2021-11-13 15:15:00","Top News","https://www.theblaze.com/news/edward-durr-tucker-carlson-laugh","b23bca1c4ac14c8aa186910036a47936d6756c56d8c814e6a49752a488f2d020","1079e1a195daecdce66bf3d6b8a65b31"
"Social media takes Jen Psaki to task after she defends VP Kamala Harris following damning CNN report","The Blaze","	Much of social media tore into White House press secretary Jen Psaki on Sunday evening after she scrambled to defend Vice President Kamala Harris amid a 	damning report that suggested Harris and her White House allies are blaming President Joe Biden and his administration for not letting her lead.What are the details? 	Psaki tweeted Sunday, For anyone who needs to hear it. @VP is not only a vital partner to @POTUS but a bold leader who has taken on key, important challenges facing the coun","2021-11-15 14:47:00","Top News","https://www.theblaze.com/news/social-media-jen-psaki-defends-kamala-harris","b23bca1c4ac14c8aa186910036a47936d6756c56d8c814e6a49752a488f2d020","3838598e176fa9c33e28fe7f902fbdcc"
"China overtakes US as richest nation in 'national balance sheet' study","The Blaze","China has seen its global wealth skyrocket over the past two decades and has now overtaken the U.S. as the wealthiest nation worldwide, according to a new economic analysis on the national balance sheets of the world's richest nations. What are the details?Between 2000 and 2020, China's net worth soared from $7 trillion to $120 trillion, accounting for an eye-popping one-third of the global increase, global management consulting firm McKinsey & Company reported this month.Meanwhile, the U.S. s","2021-11-15 15:43:58","Top News","https://www.theblaze.com/news/china-overtakes-us-as-richest-nation","b23bca1c4ac14c8aa186910036a47936d6756c56d8c814e6a49752a488f2d020","f34e56ca2998b7fad3900d18639d9111"
"CNN host hit with swift lesson after attempting to downplay the supply chain crisis with mocking tweet","The Blaze","CNN's Brian Stelter received a swift lesson in supply chain function and self-awareness over the weekend after he attempted to downplay the seriousness of the supply chain crisis.What is the background?Supply chain issues have plagued the United States for months. Backlogged ports and trucker shortages have resulted in empty shelves and have contributed to rising prices of goods across the nation in most industries.The Biden administration has blamed the COVID-19 pandemic for the problems. Repub","2021-11-15 15:01:00","Top News","https://www.theblaze.com/news/cnn-brian-stelter-supply-chain-mocking-tweet","b23bca1c4ac14c8aa186910036a47936d6756c56d8c814e6a49752a488f2d020","88cc60d7b5a10663cb02b28a5c573375"
"White House chief of staff says 'things are a lot better in this country than they were a year ago' regarding economy, COVID — and gets torched","The Blaze","	White House chief of staff Ron Klain told CNN's Jake Tapper that things are a lot better in this country than they were a year ago in regard to the economy and COVID-19 — and observers ripped Klain for his assessment.What are the details?	Klain made his claim in an interview last week on The Lead With Jake Tapper, in which Tapper hit the chief of staff right off the bat with inflation numbers, noting that it's at a 30-year high and up 6.2%. That's worse than had been feared.	Tapper","2021-11-15 16:00:00","Top News","https://www.theblaze.com/news/white-house-chief-of-staff-says-things-are-a-lot-better-in-this-country-than-they-were-a-year-ago","b23bca1c4ac14c8aa186910036a47936d6756c56d8c814e6a49752a488f2d020","5fee7ca4232fd5507cf8e3a80e261661"
"N-word, threat found in porta-potty at Facebook construction site; all 1,300 workers sent home; $50,000 reward offered to find culprit","The Blaze","	After the N-word and a threat were found scrawled in a porta-potty at a Facebook data center construction site in Utah, all 1,300 workers were sent home and a $50,000 reward was offered to identify the guilty party, 	KUTV-TV reported.Image source: KATU-TV video screenshotWhat are the details?The message on the door facing the inside of the porta-potty in Eagle Mountain reads, Kill a ****** day 11/29, the station said.Image source: KATU-TV video screenshot	Upon discovery of the slur","2021-11-15 19:52:22","Top News","https://www.theblaze.com/news/n-word-threat-found-in-porta-potty-at-facebook-construction-site-all-1300-workers-sent-home-50000-reward-offered-to-find-culprit","b23bca1c4ac14c8aa186910036a47936d6756c56d8c814e6a49752a488f2d020","2ce955bf56aeba4394fb1de35f003b3d"
"Alex Jones found liable in fourth defamation case brought by Sandy Hook victims' families","The Blaze","A Connecticut judge has ruled Infowars host Alex Jones liable for damages in a defamation lawsuit brought by the parents of children killed in the Sandy Hook Elementary School massacre over Jones' claims that the shooting was a false flag operation. According to the New York Times and the Associated Press, Judge Barbara Bellis on Monday entered a default judgment against Jones because he refused to follow court orders to turn over documents, including his financial records. Because of Jones' fa","2021-11-15 19:25:00","Top News","https://www.theblaze.com/news/alex-jones-found-liable-in-fourth-defamation-case-brought-by-sandy-hook-victims-families","b23bca1c4ac14c8aa186910036a47936d6756c56d8c814e6a49752a488f2d020","782c7dd47d56bfa4b7217ad706dc89e8"
"'SNL' triggers backlash after skit mocks Joe Rogan for taking 'horse medicine': 'Lazy mediocre hacks'","The Blaze","NBC's famed comedy sketch show Saturday Night Live triggered a tsunami of backlash and mockery on Sunday over a sketch mocking Joe Rogan.What happened?The sketch, which aired over the weekend, mocked Rogan from several angles, poking fun of Rogan for taking supplements, being an advocate of psychedelic drugs, and for recently stating that he could perform oral sex on himself — although never actually having done so.Unfortunately, the skit also claimed that Rogan took horse medicine, a refere","2021-11-15 19:10:00","Top News","https://www.theblaze.com/news/snl-backlash-skit-mocks-joe-rogan-horse-medicine","b23bca1c4ac14c8aa186910036a47936d6756c56d8c814e6a49752a488f2d020","8715f8435c6a5d4d1e4c59a06b6d3724"
"Judge dismisses Rittenhouse gun charge. It was considered the state's easiest to prove.","The Blaze","The judge presiding over the Kyle Rittenhouse trial in Kenosha, Wisconsin, dismissed a lesser gun charge against the teenager on Monday ahead of closing arguments and jury deliberations.What are the details?The charge, possession of a dangerous weapon by a person under 18, was considered to be the prosecution's easiest charge to prove in court, and so its dismissal may well spell doom for the state's case against Rittenhouse.Rittenhouse is facing multiple felony murder charges for fatally shooti","2021-11-15 18:55:00","Top News","https://www.theblaze.com/news/judge-dismisses-rittenhouse-gun-charge","b23bca1c4ac14c8aa186910036a47936d6756c56d8c814e6a49752a488f2d020","8d178a98076b7a320a041d63c70eecd9"
"Blaring automatic 'trigger warning' siren used in classrooms and universities sounds alarm when it detects 'offensive' language","The Blaze","	A new trigger warning detector called Themis is being tested in classrooms and universities, according to a recent report from the Daily Mail. What are the details? Zinah Issa, the innovator behind Themis, recently debuted the device at Dubai Design Week and explained that she named the system after Themis — the Greek goddess of social order and justice. The Daily Mail reported that some people are testing the device in classrooms and universities, as well as in more intimate, home-based sit","2021-11-15 18:40:00","Top News","https://www.theblaze.com/news/blaring-trigger-warning-siren-for-classrooms-universities-and-more-sounds-alarm-when-it-detects-offensive-language","b23bca1c4ac14c8aa186910036a47936d6756c56d8c814e6a49752a488f2d020","b2fa6cc7dc9f356c15b6f31407bebe22"
"Six armed intruders break into home after midnight — but resident grabs own gun, blows one of them away, and the rest take off running","The Blaze","	The resident of an Oceanside, California, home was badly outnumbered when an armed group broke in after midnight last week as part of an attempted robbery.	But this particular resident also was armed — and foiled the crooks' plan after pulling the trigger with deadly accuracy.What happened?	Oceanside officers were called to the home on Moonstone Bay Drive near Marblehead Bay Drive just after 1:15 a.m. and determined that the resident retrieved a gun and shot at the suspects, hitting at l","2021-11-15 18:10:00","Top News","https://www.theblaze.com/news/armed-intruders-resident-grabs-own-gun-blows-one-away-rest-take-off","b23bca1c4ac14c8aa186910036a47936d6756c56d8c814e6a49752a488f2d020","b6f582879bbd1270cfc5377f387b56c7"
"CRT supporter allegedly threatens parents, says he's got '1,000 soldiers ready to go ... locked and loaded'","The Blaze","A Fort Worth, Texas, parent supportive of teaching critical race theory in classrooms recently reportedly threatened other parents during a school board meeting, saying he's got over 1,000 soldiers ready to go and that he'd be locked and loaded next time.What happened?Officers were called on to escort the enraged parent, Malikk Austin, from the Fort Worth Independent School District board meeting on Nov. 9 after he turned around to face other parents in the room and shouted at them repeatedl","2021-11-15 17:55:00","Top News","https://www.theblaze.com/news/crt-supporter-allegedly-threatens-parents-1000-soldiers-locked-and-loaded","b23bca1c4ac14c8aa186910036a47936d6756c56d8c814e6a49752a488f2d020","b3b77b1faf62a46cc38b4966c6052a7c"
"Religious groups raise concerns over Biden's child care plan: 'It will be detrimental to our ability to participate'","The Blaze","Conservative religious groups are working to have a non-discrimination provision removed from President Joe Biden's proposed universal child care plan, arguing the way the bill is written threatens their ability to serve families with young children. American leaders of the Catholic Church and the Union of Orthodox Jewish Congregations of America say that the strings attached to the pre-kindergarten and child care plans in Biden's $1.85 trillion Build Back Better plan could force religious gro","2021-11-15 17:39:05","Top News","https://www.theblaze.com/news/religious-groups-raise-concerns-over-biden-s-child-care-plan","b23bca1c4ac14c8aa186910036a47936d6756c56d8c814e6a49752a488f2d020","efb59079f3d02a659ef559457208b245"
"Kyle Rittenhouse's mother argues that her son would have been murdered during riots if he hadn't been armed","The Blaze","	Wendy Rittenhouse says that her son, 18-year-old Kyle Rittenhouse, would be dead if he hadn't defended himself during 2020's violent unrest on the city streets of Kenosha, Wisconsin, NBC News reported. What are the details? Wendy told Nightly News Sunday night that her son would have been murdered if he weren't carrying his rifle on the fateful night he said he was attacked. A lot of people shouldn't have been there, Wendy insisted of the riots. He brung that gun for protection, and to th","2021-11-15 17:20:00","Top News","https://www.theblaze.com/news/kyle-rittenhouse-mother-son-would-have-been-murdered","b23bca1c4ac14c8aa186910036a47936d6756c56d8c814e6a49752a488f2d020","991bf4074dccf1925298ce08f10dd9b5"
"Democratic political experts explain how the Philly suburbs paint a bleak picture for Dems in 2022","The Blaze","	As if election forecasts could get any worse for Democrats, a new report has discovered yet another angle revealing the grim outlook for Democrats in upcoming elections.What are the details?Democratic political experts who spoke with Politico expressed the belief that results in the Philly suburbs two weeks ago are the proverbial canary in the coal mine for Democrats.	Whereas Trump performed poorly the Philadelphia suburbs, which undoubtedly helped Democrats flip Pennsylvania blue, the pend","2021-11-15 17:04:42","Top News","https://www.theblaze.com/news/democratic-political-experts-explain-how-the-philly-suburbs-paint-a-bleak-picture-for-dems-in-2022","b23bca1c4ac14c8aa186910036a47936d6756c56d8c814e6a49752a488f2d020","330681d7430872b1b120afd0881fff9e"
"Analysis of Biden's Build Back Better bill says the plan could cost more than twice what White House claims","The Blaze","An analysis of President Joe Biden's Build Back Better framework finds that the multi-trillion dollar social spending plan could cost more than twice what the White House claims it will over the next decade. An estimate from the Committee for a Responsible Federal Budget found that the House Build Back Better Act as currently written will cost roughly $2.4 trillion with about $2.2 trillion in offsets. But the legislation relies on budget gimmicks, sunset provisions, and expirations of certain ta","2021-11-15 20:45:00","Top News","https://www.theblaze.com/news/build-back-better-twice-cost-white-house-claims","b23bca1c4ac14c8aa186910036a47936d6756c56d8c814e6a49752a488f2d020","299107c491cc26c562e46dca11a9772c"
"Rittenhouse prosecutor claims, contrary to law, that 'you lose the right to self-defense when you're the one who brought the gun'","The Blaze","The lead prosecutor in the Kyle Rittenhouse trial made an extremely puzzling claim involving guns and self-defense during his closing arguments to the jury Monday afternoon.What did he say?In an obvious affront to the second amendment rights of all Americans, Kenosha County Assistant District Attorney Thomas Binger argued that the defendant, Kyle Rittenhouse, gave up his right to self-defense when he chose to bring a gun to the Black Lives Matter riots in the Wisconsin city last summer.You can'","2021-11-15 21:15:00","Top News","https://www.theblaze.com/news/rittenhouse-prosecutor-self-defense-guns","b23bca1c4ac14c8aa186910036a47936d6756c56d8c814e6a49752a488f2d020","484724050d1804bbe8c5497227528f02"
"Authorities arrest Maryland mayor on charges of distributing at least 50 images of revenge porn","The Blaze","Police arrested Andrew Bradshaw — Mayor of Cambridge, Maryland —  on Monday and charged him with 50 counts of distributing revenge pornography.WBAL-TV reported that the state's Revenge Porn Statute prohibits the nonconsensual distribution of a private visual representation of another which exposes their intimate body parts or displays them engaged in sexual activity, with the intent to harm, harass, intimidate, threaten or coerce the person depicted. What are the details? 	Charging documents","2021-11-15 21:00:00","Top News","https://www.theblaze.com/news/authorities-arrest-maryland-mayor-revenge-porn","b23bca1c4ac14c8aa186910036a47936d6756c56d8c814e6a49752a488f2d020","9c163bb358cf39091881f0ed352c7488"
"U.S. decries Russia for targeting its own satellite in missile test, creating dangerous orbiting space debris","The Blaze","The U.S. is denouncing the nation of Russia for launching an anti-satellite missile into a Russian satellite, resulting in orbiting debris that will pose a risk to spacecraft and space travelers for years into the future.Russia has demonstrated a deliberate disregard for the security, safety, stability, and long-term sustainability of the space domain for all nations, U.S. Army Gen. James Dickinson, U.S. Space Command commander, said in a statement. He said that the debris will continue to po","2021-11-16 04:10:12","Top News","https://www.theblaze.com/news/u-s-condemns-russia-for-hitting-its-own-satellite-with-missile-creating-dangerous-space-debris","b23bca1c4ac14c8aa186910036a47936d6756c56d8c814e6a49752a488f2d020","d86f5169939cb111b495cd663a4a0419"
"Police made a horrifying discovery when a Bronx apartment resident reported maggots falling from her ceiling","The Blaze","	Police made a gruesome and horrifying discovery when a woman living in a downstairs apartment reported that there were maggots falling from her ceiling in the Bronx in New York City, New York. 	The woman called the building superintendent on Saturday about the maggots. She also told him that she had heard two gunshots and a loud thud from the apartment above her on Nov. 6 at about 6:50 p.m.	Ernesto Garcia, the superintendent, called the police and they came to  the upstairs apartment to per","2021-11-16 03:30:00","Top News","https://www.theblaze.com/news/bronx-maggots-murder-suicide-ducille","b23bca1c4ac14c8aa186910036a47936d6756c56d8c814e6a49752a488f2d020","ec1b911b03a88d9b23018f601ce5e977"
"Texas Democratic state lawmaker announces switch to the Republican Party","The Blaze","Long-serving Democratic Texas state Rep. Ryan Guillen has announced that he is running for re-election as a Republican.Throughout my entire career, creating a prosperous business climate, defending the second amendment, and protecting the lives of the unborn are the cornerstones of how I have represented my district, Guillen said in a statement. After much consideration and prayer with my family, I feel that my fiscally conservative, pro-business, and pro-life values are no longer in-step wit","2021-11-16 03:00:00","Top News","https://www.theblaze.com/news/texas-state-representative-switches-from-democrat-to-republican","b23bca1c4ac14c8aa186910036a47936d6756c56d8c814e6a49752a488f2d020","0b0228cbdf6476519cfce7d20e4d9857"
"Republican Party of Wyoming votes to no longer recognize Rep. Liz Cheney as a Republican","The Blaze","	The Republican Party of Wyoming voted on Saturday to no longer recognize Rep. Liz Cheney as a member of their party.	Cheney has been one of the most outspoken critics of former President Donald Trump. She was among the 10 Republican members of Congress who voted to impeach Trump the second time when Democrats brought up charges of inciting an insurrection on Jan. 6.	The state party central committee voted 31-29 during a meeting in Buffalo, Wyoming, to formally censure Cheney for the second","2021-11-16 02:05:00","Top News","https://www.theblaze.com/news/wyoming-gop-liz-cheney-vote","b23bca1c4ac14c8aa186910036a47936d6756c56d8c814e6a49752a488f2d020","a36792bd8ba4979d2b5805ba0395a712"
