"Judge rules against Trump in lawsuit trying to block Jan. 6 committee from obtaining his White House documents","The Blaze","	A U.S. federal judge ruled against former President Donald Trump in a lawsuit attempting to block his White House documents from being obtained by the congressional committee investigating the Jan. 6 rioting at the Capitol.	Attorneys for Trump argued that his documents from his one term as president should be protected by executive privilege despite current President Joe Biden refusing to extend that protection.	U.S. District Judge Tanya Chutkan in the District of Columbia disagreed and or","2021-11-10 00:33:07","Top News","https://www.theblaze.com/news/judge-trump-jan6-docs-sue","b23bca1c4ac14c8aa186910036a47936d6756c56d8c814e6a49752a488f2d020","8948a43b0beb2b96fff773671946a9d7"
"AOC calls GOP congressman 'a collection of wet toothpicks' after he posted a doctored anime clip that depicted him attacking her","The Blaze","Rep. Alexandria Ocasio-Cortez (D-NY) and other lawmakers have criticized Rep. Paul Gosar (R-Ariz.) for posting an edited video that includes a section in which Cortez's face is superimposed over a cartoon figure that gets attacked by a character that has Gosar's face superimposed on it.Another section shows a figure with Gosar's face is leaping to attack President Joe Biden, though the video pauses with the character in midair and the attack is not shown.Any anime fans out there? Gosar asked i","2021-11-10 00:00:00","Top News","https://www.theblaze.com/news/aoc-calls-gop-congressman-a-collection-of-wet-toothpicks-after-he-posted-a-doctored-anime-clip-of-him-attacking-her","b23bca1c4ac14c8aa186910036a47936d6756c56d8c814e6a49752a488f2d020","8737cbfebcc45d3ee8b7a4d012f634d0"
"Former Trump official forces Adam Schiff to answer for Steele dossier in fiery debate on 'The View'","The Blaze","	Former Trump State Department spokesperson Morgan Ortagus forced Rep. Adam Schiff (D-Calif.) to answer some tough questions about the Steele dossier during his appearance on The View Tuesday.	Schiff was on the show celebrating the passage of a massive spending bill by the Democrats while marketing his new book about the events of the rioting at the U.S. Capitol on Jan. 6.	You've been really prolific over the past few years being the head of the Intel Committee, and you defended, promote","2021-11-09 23:24:13","Top News","https://www.theblaze.com/news/morgan-ortagus-schiff-steele-view","b23bca1c4ac14c8aa186910036a47936d6756c56d8c814e6a49752a488f2d020","3b3be8fca7cf523bbc2adac8177328cc"
"Poll: Majority of voters say Biden endorsement would make them less likely to vote for a candidate","The Blaze","If Democratic candidates up for election in state and local races want to have any chance at winning their races, they should steer clear of President Joe Biden's endorsement.According to a new Rasmussen Reports survey, more than half of U.S. voters said recently that they would be less likely to vote for a candidate in their state if that candidate were endorsed by the sitting president.In fact, Biden's endorsement would be much less valuable in a state or local election than would be an endors","2021-11-09 22:32:00","Top News","https://www.theblaze.com/news/biden-endorsement-less-likely-to-vote","b23bca1c4ac14c8aa186910036a47936d6756c56d8c814e6a49752a488f2d020","36ea13311ab97d59f98a31fa0a0002a1"
"Twitter suspends Barstool Sports founder Dave Portnoy after he publishes email exchange with Insider editor","The Blaze","Twitter suspended Barstool Sports founder Dave Portnoy from its platform after he published an email exchange with an Insider editor. The apparent basis of the suspension was that the screenshot contained the email address of the editor in question. Meanwhile, the editor was not suspended by Twitter, even though he shared Portnoy's email address in a tweet he later deleted. 	Portnoy is currently embroiled in a scandal involving several sexual assault allegations and has been publicly railing ag","2021-11-09 22:17:00","Top News","https://www.theblaze.com/news/amid-sexual-assault-allegations-twitter-suspends-dave-portnoy-after-he-publishes-email-exchange-with-business-insider-editor","b23bca1c4ac14c8aa186910036a47936d6756c56d8c814e6a49752a488f2d020","e74c26c0bc94f339afa5017ad0d084f4"
"Fox News: Biden's national security adviser Jake Sullivan is the 'foreign policy advisor' mentioned in Durham probe indictment","The Blaze","White House national security adviser Jake Sullivan has been identified as the foreign policy advisor referred to in the indictment of former Hillary Clinton presidential campaign lawyer Michael Sussmann, Fox News reports. Back in September, Sussmann, a prominent cybersecurity lawyer with deep ties to the Democratic Party, was indicted on charges of lying to the FBI in a meeting with senior officials in 2016. Sussmann had reportedly brought evidence to the FBI he claimed connected the Trump Or","2021-11-09 22:02:00","Top News","https://www.theblaze.com/news/fox-news-biden-s-national-security-adviser-jake-sullivan-is-the-foreign-policy-advisor-mentioned-in-durham-probe-indictment","b23bca1c4ac14c8aa186910036a47936d6756c56d8c814e6a49752a488f2d020","e08b8fe100d4df212526d2fe3681fd1e"
"Virtue-signaling pizza parlor in Seattle shames unvaccinated people. Another in town requires vaccinations to enter — even if it's just for to-go orders.","The Blaze","	Apparently it wasn't enough for Windy City Pie in Seattle to declare proof of vaccination required for indoor AND outdoor dining  on its website. And apparently it wasn't enough for it to clearly state, PROOF OF VACCINATION REQUIRED FOR ENTRY.	No, this establishment took things a step further by communicating to prospective customers, IF YOU ARE VOLUNTARILY NOT VACCINATED, PLEASE EAT ELSEWHERE NOWHERE. (Yup, the site's message actually features a crossed-out elsewhere and adds a now","2021-11-09 21:47:00","Top News","https://www.theblaze.com/news/seattle-pizza-parlor-shames-unvaccinated","b23bca1c4ac14c8aa186910036a47936d6756c56d8c814e6a49752a488f2d020","23b9e441223c466037d12def9d489763"
"Pfizer CEO declares that people who spread 'misinformation' about vaccines are 'criminals'","The Blaze","	Pfizer CEO Albert Bourla does not appreciate people spreading what he calls misinformation about his company's COVID vaccine. He's so adamant about it that he has declared that people who share lies about vaccines are actually criminals in his mind.	According to Bourla, these miscreants are responsible for the deaths of millions of people.What's that now? 	Bourla, whose company has received billions of dollars from the U.S. government alone for its vaccine, made his comments Tuesday whil","2021-11-09 21:33:03","Top News","https://www.theblaze.com/news/pfizer-ceo-people-misinformation-vaccines-criminals","b23bca1c4ac14c8aa186910036a47936d6756c56d8c814e6a49752a488f2d020","5e9dcd9494dd2b76035f308be081fb15"
"Ex-elementary school principal charged with 5 felony counts of sexual misconduct with a minor","The Blaze","	A former Indiana elementary school principal is facing charges of sexual misconduct with a minor after reportedly engaging in sex acts with a 15-year-old student in the district.What are the details? 	Authorities arrested 34-year-old Ashley A. Breedlove of Farmland, Indiana, on Tuesday and charged her with five counts of sexual misconduct with a minor, the 	Muncie Star Press reported on Tuesday.	The outlet reported that one of the five charges is a Level 4 felony, which carries up to 12 y","2021-11-10 14:17:56","Top News","https://www.theblaze.com/news/ex-elementary-school-principal-charged-sexual-misconduct-minor","b23bca1c4ac14c8aa186910036a47936d6756c56d8c814e6a49752a488f2d020","ea02d566d7b3be54e5d719e03a142e12"
"Actor Matthew McConaughey comes out against vaccine mandates for children: 'I'm not vaccinating mine, I'll tell you that'","The Blaze","	Outspoken actor Matthew McConaughey says he believes the COVID-19 vaccine should not be mandated for children.	McConaughey, 52, has previously floated a possible campaign challenge to Texas Gov. Greg Abbott (R).What are the details? According to a report from The Hill, McConaughey said during Tuesday's New York Times DealBook summit that he does not believe in requiring children to be vaccinated against COVID-19.	I couldn't mandate having to vaccinate the younger kids, the actor — who h","2021-11-10 14:00:00","Top News","https://www.theblaze.com/news/matthew-mcconaughey-vaccine-mandates-children","b23bca1c4ac14c8aa186910036a47936d6756c56d8c814e6a49752a488f2d020","1807d53be92b869a2f574fcf048a6881"
"Unearthed videos: Biden Treasury nominee says she wants to 'bankrupt,' 'starve' the oil and gas industry to save the climate","The Blaze","In a pair of recently unearthed videos posted online, President Joe Biden's nominee for a key Treasury Department role admitted that she wants to starve and bankrupt oil and gas firms in order to save the climate.Saule Omarova — Biden's nominee to lead the Office of the Comptroller of the Currency — already faces an uphill climb toward confirmation in lieu of a Marxist paper she wrote in college and past support for radical, progressive initiatives such as the National Investment Authority p","2021-11-10 15:35:00","Top News","https://www.theblaze.com/news/biden-treasury-nominee-starve-bankrupt-oil-gas","b23bca1c4ac14c8aa186910036a47936d6756c56d8c814e6a49752a488f2d020","37adbeeb4257668a72dcb960f9552cd0"
"Trump leaves GOP lawmaker 'visibly shaken' after scolding Republicans who supported infrastructure bill","The Blaze","	At least one Republican lawmaker was reportedly left visibly shaken after former President Donald Trump dressed down members of the House Republican caucus for voting for President Joe Biden's infrastructure bill.What is the background?	The House approved Biden's signature $1.2 trillion infrastructure bill last Friday with support from 13 Republican lawmakers.	The package was approved in the House by a vote of 228-206 with six Democrats dissenting. That means that if the Republican caucu","2021-11-10 15:20:47","Top News","https://www.theblaze.com/news/gop-lawmaker-visibly-shaken-trump-scolds-republicans-infrastructure-bill","b23bca1c4ac14c8aa186910036a47936d6756c56d8c814e6a49752a488f2d020","37ce49aa7c5265f2363b2b45fa6bfc9d"
"Crook pulls gun on retired Chicago firefighter, demands property. But 77-year-old victim is a concealed carrier — and lethally turns the tables on crook.","The Blaze","	Once again, someone up to no good — this time figuring he could pull a gun on an elderly man and steal from him in broad daylight — didn't count on a victim exercising his Second Amendment rights and arming himself for protection.	And the crook in question won't have the opportunity to learn from his error in judgment, either.What happened?	A 77-year-old man who's a retired Chicago firefighter was in the garage of his South Side residence in the 500 block of East 89th Street around 12:24 p","2021-11-10 16:11:51","Top News","https://www.theblaze.com/news/crook-pulls-gun-on-armed-retired-chicago-firefighter","b23bca1c4ac14c8aa186910036a47936d6756c56d8c814e6a49752a488f2d020","60c480027dc7dcde68c3a09e8e368666"
"Innocent until proven guilty? Tweet on Rep. Hakeem Jeffries' campaign account declares: 'Lock up Kyle Rittenhouse and throw away the key'","The Blaze","A tweet posted Wednesday on the campaign Twitter account of Rep. Hakeem Jeffries (D-N.Y.) calls for Kyle Rittenhouse to be locked up.Lock up Kyle Rittenhouse and throw away the key, the tweet declares, apparently passing judgment before the conclusion of the widely-watched trial.Lock up Kyle Rittenhouse and throw away the key.— Hakeem Jeffries (@hakeemjeffries)          1636579848Jeffries is the chair of the House Democratic Caucus.Rittenhouse, who is now 18-years-old, fatally shot two peo","2021-11-11 04:30:00","Top News","https://www.theblaze.com/lock-up-kyle-rittenhouse-and-throw-away-the-key-tweet-from-rep-hakeem-jeffries-campaign-account-declares","b23bca1c4ac14c8aa186910036a47936d6756c56d8c814e6a49752a488f2d020","0d275540838d34f2073b2a3a8c4bc12f"
"Vermont becomes first state to require access to condoms for middle and high school students","The Blaze","	The state of Vermont became the first to require that condoms be made available to middle and high school students.	The new policy was signed into law by Gov. Phil Scott, a Republican, in 2020. 	Condoms should be available in locations that are safe and readily accessible for students, without barriers to obtaining condoms or stigma surrounding access (e.g., should be available through health office or classroom, athletic trainer's office, guidance office or other locations students can co","2021-11-11 04:10:00","Top News","https://www.theblaze.com/news/vermont-becomes-first-state-to-require-condoms-be-made-available-to-middle-and-high-school-students","b23bca1c4ac14c8aa186910036a47936d6756c56d8c814e6a49752a488f2d020","d58a130991bb3888131abcf08d416c38"
"Baby delivered at 21 weeks and 1 day breaks record for most premature infant to survive","The Blaze","A baby boy who was born in the state of Alabama at a gestational age of only 21 weeks and 1 day has earned the Guinness World Records title for being the most premature baby to survive.Curtis Zy-Keith Means was born on July 5, weighing in at less than a single pound, according to Guinness. Sadly, Curtis's twin sister C'Asya, who was also born at just 21 weeks and 1 day, did not survive, but died a day later.While the journey was long, after 275 days, Curtis was finally able to go home with his m","2021-11-11 03:49:51","Top News","https://www.theblaze.com/news/baby-delivered-at-21-weeks-and-1-day-breaks-record-for-most-premature-infant-to-survive","b23bca1c4ac14c8aa186910036a47936d6756c56d8c814e6a49752a488f2d020","d98b50eb1a085c863dec1ede3a6cc2d5"
"Twitter locked Libertarian party account over a tweet saying Kyle Rittenhouse did nothing wrong","The Blaze","	A rather innocuous tweet was reportedly censored by Twitter for glorifying violence by opining that Kyle Rittenhouse did nothing wrong.	The reprimand from Twitter was sent to the account for the Libertarian Party of Kentucky after they tweeted on Nov. 3. The tweet read, Watching this trial, it's ever more obvious that Kyle Rittenhouse did nothing wrong. The company said that the tweet had been in violation of their terms of service against glorifying violence and asked the account manage","2021-11-11 02:28:17","Top News","https://www.theblaze.com/news/rittenhouse-tweet-lock-censor","b23bca1c4ac14c8aa186910036a47936d6756c56d8c814e6a49752a488f2d020","6f8533b7fea005032600a9aaf20c004d"
"Liberals demand new judge in Rittenhouse case after his phone rings during trial with patriotic ringtone","The Blaze","	While many of the developments of the trial of Kyle Rittenhouse appeared to go south for the prosecution Wednesday, some on the left demanded a new judge after his phone rang during the trial and revealed a patriotic ringtone.	Rittenhouse is on trial for shooting three protesters during political unrest in August 2020 in the wake of the police shooting of Jacob Blake. Two of the three protesters died.	On Wednesday Kenosha County Circuit Court Judge Bruce Schroeder berated the assistant dis","2021-11-11 01:26:57","Top News","https://www.theblaze.com/news/rittenhouse-judge-ringtone-liberals-mistrial","b23bca1c4ac14c8aa186910036a47936d6756c56d8c814e6a49752a488f2d020","7849c1457929cbb0be1008678d26b962"
"'The inflation tax is real': Sen. Joe Manchin says Washington can't keep ignoring people's 'economic pain'","The Blaze","As Americans suffer the consequences of rising inflation, Democratic Sen. Joe Manchin of West Virginia is saying that the inflation tax is real and Washington cannot keep ignoring the financial hardships people are experiencing.By all accounts, the threat posed by record inflation to the American people is not transitory and is instead getting worse. From the grocery store to the gas pump, Americans know the inflation tax is real and DC can no longer ignore the economic pain Americans feel ","2021-11-11 00:37:44","Top News","https://www.theblaze.com/news/the-inflation-tax-is-real-manchin-says-washington-can-t-keep-ignoring-people-s-economic-pain","b23bca1c4ac14c8aa186910036a47936d6756c56d8c814e6a49752a488f2d020","07aebb4438388d7bb3f586122913adfb"
"TikTok video showing communist leader enjoying gold-flecked steak disappears after public outrage","The Blaze","	A top leader in the Communist Party of Vietnam faced the ire of his people after he was captured on a TikTok video enjoying a gold-flecked steak at a trendy chef's restaurant.	General To Lam can be seen in the video leaning in to bite the steak as its being fed to him by the celebrity chef Nusret Gokce, known online as Salt Bae. Afterwards the general gives the thumbs up sign of approval. Lam went to the high class London restaurant after making a pilgrimage to visit the grave of Karl Marx","2021-11-11 00:02:17","Top News","https://www.theblaze.com/news/tiktok-video-showing-communist-leader-enjoying-gold-flecked-steak-disappears-after-outrage-from-working-class","b23bca1c4ac14c8aa186910036a47936d6756c56d8c814e6a49752a488f2d020","6ae7b4820efb6dc7449ae955223f621f"
"Pentagon press secretary says China and climate change are 'equally important' threats","The Blaze","When asked on Wednesday whether the climate or China poses a bigger threat, Pentagon press secretary John Kirby said that both issues are equally important.Kirby, the assistant to the secretary of defense for public affairs, noted that the Defense Department considers China its top pacing challenge, but also pointed out that the secretary has described the climate issue as an existential threat.I think we get paid to examine all the threats to our national security. And I don't know that it d","2021-11-10 23:24:02","Top News","https://www.theblaze.com/china-and-climate-change-both-equally-important-pentagon-press-secretary-says-when-asked-which-represents-a-bigger-threat","b23bca1c4ac14c8aa186910036a47936d6756c56d8c814e6a49752a488f2d020","3147646c863952153032ac1b8220ff36"
"John Cleese cancels event at university over 'woke rules,' says he is 'blacklisting' himself for his Hitler impersonation","The Blaze","	John Cleese, one of the stars of legendary British comedic troupe Monty Python, is no stranger to making crude, insensitive, politically incorrect comments and jokes. He has made a career of it.	But that's a problem in today's woke world.	So when Cleese heard about an art historian being canceled at Cambridge University over an impersonation of Adolf Hitler that reportedly offended students, the world-famous comic actor decided to cancel himself from an upcoming speaking gig at Cambridge.","2021-11-10 22:15:00","Top News","https://www.theblaze.com/news/john-cleese-woke-rules-hitler-cambridge","b23bca1c4ac14c8aa186910036a47936d6756c56d8c814e6a49752a488f2d020","deb73339802c7b0e94be157c1290b672"
"Moderna to test COVID-19 vaccine on infants as young as 6 months old","The Blaze","Biotechnology company Moderna Therapeutics will soon begin large-scale testing of its COVID-19 vaccine on infants.The vaccine clinical trial, called KidCOVE, is being carried out at 79 locations across 13 states and will involve roughly 13,275 participants between the ages of 6 months and 11 years old in its entirety.The first phase — which has already been completed — involved children between the ages of 6 years to less than 12 years old. The study is now reportedly in its second phase, during","2021-11-10 22:00:00","Top News","https://www.theblaze.com/news/moderna-infant-covid-vaccine-trial","b23bca1c4ac14c8aa186910036a47936d6756c56d8c814e6a49752a488f2d020","9e7e83ce566e0413459af72d570af19b"
"CNN's Jeffrey Toobin says Kyle Rittenhouse is lucky it isn't 'illegal to be an idiot'","The Blaze","CNN chief legal analyst Jeffrey Toobin, who was caught masturbating on camera during a work Zoom call last October, said Wednesday that Kyle Rittenhouse is lucky he's not on trial for being an idiot.Rittenhouse is charged with first-degree intentional homicide, first-degree reckless homicide, and first-degree attempted intentional homicide for shooting three people — killing two and injuring the third — during a riot in Kenosha, Wisconsin, last year. Defense attorneys argue Rittenhouse, who wa","2021-11-10 21:45:36","Top News","https://www.theblaze.com/news/cnn-s-jeffrey-toobin-says-kyle-rittenhouse-is-lucky-it-isn-t-illegal-to-be-an-idiot","b23bca1c4ac14c8aa186910036a47936d6756c56d8c814e6a49752a488f2d020","54f536b08f71f03a4d2f5a4f063b0d32"
"Brothel in Austria offers customers who receive COVID-19 shots on site free 30-minute 'sauna club' sessions with 'lady of their choice'","The Blaze","	A brothel in Austria is offering customers who get COVID-19 vaccine shots at its on-site clinic a free 30-minute sauna club session with the lady of their choice, the Daily Mail reported.Image source: New York Post video screenshotWhat are the details?	The promotion at Fun Palast brothel in Vienna, which began Nov. 1, is an attempt to raise revenue after a dip in clients due to low vaccination rates, the outlet said, adding that about 65 percent of Austrians are fully vaccinated, while","2021-11-10 21:06:00","Top News","https://www.theblaze.com/news/brothel-austria-covid-shots-free-30-minute-sauna-club-sessions","b23bca1c4ac14c8aa186910036a47936d6756c56d8c814e6a49752a488f2d020","18fc9aeabf0c6e08cb5ea08cf25537e3"
"USC professor refuses to remove Thin Blue Line flag from office door: 'Blue lives protect black lives — and black lives are not at risk from police.'","The Blaze","Dr. James Moore, a professor of engineering at the University of Southern California, says he will not take down a Thin Blue Line-themed American flag from his office door because he believes blue lives are integral to protecting black lives. What are the details? In an interview with the College Fix, Moore — a self-described libertarian — said that he has faced heavy criticism for refusing to remove the flag from his door from both students and administrators. A recent article in the school's D","2021-11-10 20:51:00","Top News","https://www.theblaze.com/news/usc-professor-thin-blue-line-flag","b23bca1c4ac14c8aa186910036a47936d6756c56d8c814e6a49752a488f2d020","6e1ac53aa08f0ad27b962b0b699c90d5"
"Prosecutors want 'QAnon Shaman' Jacob Chansley sentenced to more than 4 years in prison","The Blaze","Federal prosecutors want Arizona resident Jacob Chansley, the QAnon Shaman who wore horns and paraded shirtless through the halls of the U.S. Capitol building on Jan. 6, to spend more than four years in prison for his role in the riot.In a 28-page sentencing memo filed Tuesday, prosecutors requested that Chansley be sentenced to 51 months in prison — the longest term allowed by guidelines — plus three years of supervised release and $2,000 in restitution fees, KTAR-FM reported.  The filing ref","2021-11-10 20:36:32","Top News","https://www.theblaze.com/news/prosecutors-want-qanon-shaman-jacob-chansley-sentenced-to-more-than-4-years-in-prison","b23bca1c4ac14c8aa186910036a47936d6756c56d8c814e6a49752a488f2d020","6963e4052a0b4a8f6b9fdf7fed1c7ba8"
"Rittenhouse judge shouts down prosecution as sparks fly at trial: 'Don't get brazen with me!'","The Blaze","Tensions boiled over in the Kyle Rittenhouse trial Wednesday afternoon as the presiding judge dismissed the jury twice to shout down the prosecution for courtroom conduct he deemed inappropriate and perhaps even unlawful.What happened?The first quarrel broke out while Kenosha County Assistant District Attorney Thomas Binger was cross-examining Rittenhouse. During the cross-examination, Binger engaged in a line of questioning with the apparent intention of proving that Rittenhouse's testimony had","2021-11-10 20:02:18","Top News","https://www.theblaze.com/news/rittenhouse-judge-schroeder-scolds-prosecution","b23bca1c4ac14c8aa186910036a47936d6756c56d8c814e6a49752a488f2d020","146cdfbdfd16cad6a29ee955116ea66d"
"Principal vows action after exam question lumps together KKK, Fox News, Florida, and Texas","The Blaze","A California high school principal is vowing to take action after a controversial exam question lumped together Fox News, Florida, Texas, and the KKK.What happened? Last week, a social science teacher at Whitney High School in Rocklin, California, administered a quiz that asked students to identify a complete group of idiots, providing the answer choices of KKK, all of Florida, Fox News, and Texans.An image of the question went viral on social media.A teacher at Whitney High School in","2021-11-10 19:48:05","Top News","https://www.theblaze.com/news/principal-vows-action-after-exam-question-lumps-together-kkk-fox-news-florida-texas","b23bca1c4ac14c8aa186910036a47936d6756c56d8c814e6a49752a488f2d020","6f9485cddbdda4e38939ef0ab83f08e0"
"Virginia school board orders libraries to remove 'sexually explicit' books","The Blaze","A local school board in Fredericksburg, Virginia, has ordered school libraries in the district to begin removing books containing sexually explicit material from the shelves and to report the number of books that are removed at a special meeting next week.The Spotsylvania County School Board issued the directive after a parent raised concerns at a board meeting on Monday about certain books available through a digital app for Riverbend High School's library, the Free Lance-Star reports.  Durin","2021-11-10 18:47:55","Top News","https://www.theblaze.com/news/virginia-school-board-orders-libraries-to-remove-sexually-explicit-books","b23bca1c4ac14c8aa186910036a47936d6756c56d8c814e6a49752a488f2d020","110633258e4f648846066dd15bfa5413"
