"How a no-name ‘idiot’ gained Trump’s trust, rose to power in final WH days","New York Post","A bombshell new book reveals how a no-name MAGA fanatic grabbed power in the final days of the Trump administration — becoming “deputy president’’ and creating a “Gestapo’’ to root out traitors.","2021-11-09 18:56:23","Top News","https://nypost.com/2021/11/09/book-reveals-how-johnny-mcentee-became-deputy-president-of-trump-wh/","b9fa5e07c0a0216c27d875b0d4fab6834c80f06eb01d93bc12e75987f7fecace","9a499255dacb054af1057a1bf0afe6e7"
"Pelosi insists ‘Build Back’ bill will pass next week — despite budget concerns","New York Post","Speaker Nancy Pelosi insisted Tuesday that the House will pass a sweeping $1.75 trillion social spending bill next week.","2021-11-09 18:52:51","Top News","https://nypost.com/2021/11/09/pelosi-insists-build-back-better-will-pass-week-of-nov-15th/","b9fa5e07c0a0216c27d875b0d4fab6834c80f06eb01d93bc12e75987f7fecace","929f8ade7f44482330dd037afda7d4b3"
"Travis Scott attended Dave & Buster’s party after Astroworld: report","New York Post","The rapper, arriving at an after-party, didn't know the severity of the situation when eight people were killed at his Astroworld music festival.","2021-11-10 05:53:04","Top News","https://nypost.com/2021/11/10/travis-scott-attended-dave-busters-party-after-astroworld-tragedy-report/","b9fa5e07c0a0216c27d875b0d4fab6834c80f06eb01d93bc12e75987f7fecace","ec6806123aee96c8cab8e94c631a5b84"
"Suspected Pulse nightclub memorial vandal arrested","New York Post","Mark Anthony Henson, 64, was charged with criminal mischief over the Oct. 12 blaze that destroyed three banners affixed to the memorial wall.","2021-11-10 05:39:41","Top News","https://nypost.com/2021/11/10/suspected-pulse-nightclub-memorial-vandal-suspected-pulse-nightclub-memorial-vandal-arrested-arrested/","b9fa5e07c0a0216c27d875b0d4fab6834c80f06eb01d93bc12e75987f7fecace","99811ee05201a1869b7bb4076fae5ea5"
"Parole board recommends release for Manson follower Leslie Van Houten for fifth time","New York Post","Leslie Van Houten, a follower of Charles Manson, received the recommendation for her release from a California prison for the fifth time amid a life sentence for her role in the 1969 murders of Leno and Rosemary LaBianca.","2021-11-10 04:52:42","Top News","https://nypost.com/2021/11/09/charles-manson-follower-leslie-van-houten-gets-prison-release-recommendation/","b9fa5e07c0a0216c27d875b0d4fab6834c80f06eb01d93bc12e75987f7fecace","6cfcf7fc15970d9c12279553bebd20f0"
"Progressives want Buffalo mayor removed from DNC post after write-in election win","New York Post","Progressives furious over Buffalo Mayor Byron Brown’s write-in campaign victory over Democratic socialist India Walton are aiming to remove the incumbent from his position in the Democratic National Committee.","2021-11-10 04:45:23","Top News","https://nypost.com/2021/11/09/progressives-aim-to-strip-buffalo-mayor-brown-from-dnc-over-campaign-victory/","b9fa5e07c0a0216c27d875b0d4fab6834c80f06eb01d93bc12e75987f7fecace","d10c06d43fdfda5d4c34edea6c969cb0"
"Judge refuses to block release of Jan. 6 records Trump sought to keep hidden","New York Post","The House committee is after a slew of documents, including call logs, talking points of Trump press secretary Kayleigh McEnanny and handwritten notes from Chief of Staff Mark Meadows.","2021-11-10 03:40:02","Top News","https://nypost.com/2021/11/09/judge-refuses-to-block-release-of-jan-6-records-trump-sought-to-keep-hidden/","b9fa5e07c0a0216c27d875b0d4fab6834c80f06eb01d93bc12e75987f7fecace","4847676d78398885432b2ef326b405bb"
"Donald Trump bashes 13 Republicans who backed infrastructure bill","New York Post","Former President Donald Trump ripped 13 congressional Republicans who backed a $1.2 trillion infrastructure bill during a lengthy speech Monday.","2021-11-10 02:46:00","Top News","https://nypost.com/2021/11/09/trump-bashes-13-republicans-who-backed-infrastructure-bill/","b9fa5e07c0a0216c27d875b0d4fab6834c80f06eb01d93bc12e75987f7fecace","729777145b23d7010fdca55c31146b93"
"Family of 9-year-old left in coma after Astroworld files suit against Travis Scott, promoters","New York Post","Ezra Blount, the 9-year-old from Tyler, Texas who attended the concert, has been left in an induced coma on life support, according to the lawsuit, which was filed in Harris County.","2021-11-10 02:17:23","Top News","https://nypost.com/2021/11/09/astroworld-family-of-child-left-in-coma-sues-travis-scott-promoters/","b9fa5e07c0a0216c27d875b0d4fab6834c80f06eb01d93bc12e75987f7fecace","32de6d886e7ba2355171ae7c12eec94a"
"Rep. Paul Gosar doubles down on AOC, Biden attack video","New York Post","Gosar, an Arizona Republican, is facing widespread condemnation for the post but he didn’t apologize on Tuesday.","2021-11-10 02:03:50","Top News","https://nypost.com/2021/11/09/rep-paul-gosar-doubles-down-on-aoc-biden-attack-video/","b9fa5e07c0a0216c27d875b0d4fab6834c80f06eb01d93bc12e75987f7fecace","78fa0cf0b18f4e1d62d481eb024ba1d0"
"Prince Harry claims he warned Twitter founder of  ‘coup’ before Capitol riot","New York Post","Prince Harry claimed in a panel discussion that he warned Twitter CEO Jack Dorsey about a “coup” being planned on the social media platform ahead of the Jan. 6 siege on the US Capitol. “Jack and I were emailing each other prior to January the 6th,” Harry said Tuesday during a virtual panel called “The...","2021-11-10 01:43:18","Top News","https://nypost.com/2021/11/09/prince-harry-claims-he-warned-twitter-founder-of-coup-before-capitol-riot/","b9fa5e07c0a0216c27d875b0d4fab6834c80f06eb01d93bc12e75987f7fecace","c0afb57c554f3584e8b19da52824287b"
"Turpin sisters to detail years of torture in parents’ ‘house of horrors,’ desperate effort to escape","New York Post","Two sisters who lived in a house of horrors with their 11 siblings and endured years of torture said they were close to death many times before their parents David and Louise Turpin were arrested.","2021-11-10 01:18:48","Top News","https://nypost.com/2021/11/09/turpin-sisters-to-detail-years-of-torture-in-parents-house-of-horrors/","b9fa5e07c0a0216c27d875b0d4fab6834c80f06eb01d93bc12e75987f7fecace","e5efda5d9672f16aace720d30e6adb09"
"Biden reportedly will attend virtual summit with China’s Xi next week","New York Post","President Biden and Chinese President Xi Jinping will hold a virtual summit next week, according to a report.","2021-11-10 01:16:41","Top News","https://nypost.com/2021/11/09/biden-and-chinas-xi-will-meet-in-virtual-summit-next-week/","b9fa5e07c0a0216c27d875b0d4fab6834c80f06eb01d93bc12e75987f7fecace","97d17a05b579e15fcdc0bfc674d69c7c"
"Video shows the moment couple was reunited with biological child after IVF mix-up","New York Post","Daphna and Alexander Cardinale said the moment they saw a picture of a blue-eyed, 4-month old baby girl, there was no doubt she was theirs. ","2021-11-10 00:59:38","Top News","https://nypost.com/2021/11/09/couple-reunited-with-biological-child-after-ivf-mix-up/","b9fa5e07c0a0216c27d875b0d4fab6834c80f06eb01d93bc12e75987f7fecace","b16731cb282906fb54d32ea96a515cf9"
"Cuomo dished about Kennedy sexcapades, AIDS to his staff, ‘Penis Politics’ claims","New York Post","Before Cuomo became known as an accused serial sex harasser, there was little he apparently considered taboo when it came to talking to his staff.","2021-11-09 23:54:06","Top News","https://nypost.com/2021/11/09/cuomo-joked-about-aids-anal-sex-clinton-cigars-and-kennedys-book/","b9fa5e07c0a0216c27d875b0d4fab6834c80f06eb01d93bc12e75987f7fecace","624b3dfe2e7a4d4dd93e95a7231d7062"
"Mom left fighting for her life, loses part of ear after being told sepsis was ‘probably the flu’","New York Post","A UK mother was left fighting for her life, and lost part of an ear, after she contracted sepsis during childbirth -- but a midwife told her she probably had the flu.","2021-11-09 23:31:12","Top News","https://nypost.com/2021/11/09/uk-mom-lost-part-of-ear-almost-died-after-getting-sepsis/","b9fa5e07c0a0216c27d875b0d4fab6834c80f06eb01d93bc12e75987f7fecace","1a3cbacf2bbae92d839d90f9e7d397ac"
"Why Netflix’s ‘Squid Game’ is a dream scenario for Kim Jong Un","New York Post","“Squid Game” is a wet dream for North Korean leader Kim Jong Un, according to outside observers of the regime. The wildly popular Netflix series about desperate, debt-ridden South Koreans playing a series of children’s games to see who will survive and win a multi-million dollar prize paints Seoul in a terrible light — just...","2021-11-09 23:23:45","Top News","https://nypost.com/2021/11/09/why-netflixs-squid-game-is-a-dream-scenario-for-kim-jong-un/","b9fa5e07c0a0216c27d875b0d4fab6834c80f06eb01d93bc12e75987f7fecace","f92172a514c3a874bed9e951b606b81f"
"Malala Yousafzai announces marriage to partner Asser Malik","New York Post","Malala Yousafzai, the world’s youngest winner of the Nobel peace prize, took to social media to announce her marriage to partner Asser Malik.","2021-11-09 23:07:57","Top News","https://nypost.com/2021/11/09/malala-yousafzai-marries-partner-asser-malik/","b9fa5e07c0a0216c27d875b0d4fab6834c80f06eb01d93bc12e75987f7fecace","5d7252acfd4f9b682afb3062bec55ddc"
"Two cops wounded, suspect dead after hours-long Boston standoff","New York Post","Two Boston police officers were wounded in a shootout involving a gunman who barricaded himself inside his family home in Dorchester for about six hours.","2021-11-09 22:35:12","Top News","https://nypost.com/2021/11/09/two-boston-cops-wounded-suspect-dead-after-standoff/","b9fa5e07c0a0216c27d875b0d4fab6834c80f06eb01d93bc12e75987f7fecace","4d7c01a66f510ffa5737cbb8eaaf470a"
"In Glasgow, they know she’s ‘AOC,’ but many don’t know what that means","New York Post","Rep. Alexandria Ocasio-Cortez is one of the most famous politicians in America, but her rep has not entirely preceded her overseas.","2021-11-09 22:30:09","Top News","https://nypost.com/2021/11/09/in-glasgow-they-know-shes-aoc-but-many-dont-know-what-that-means/","b9fa5e07c0a0216c27d875b0d4fab6834c80f06eb01d93bc12e75987f7fecace","9e40e7895b4f385d157c109375ce9cd6"
"Biden administration to send court notices to migrants waiting to be processed","New York Post","The Biden administration will begin sending court notices this week to tens of thousands of migrants who have yet to be processed for deportation after illegally crossing the South Border, according to a new report.","2021-11-09 22:16:49","Top News","https://nypost.com/2021/11/09/bidens-operation-horizon-to-send-migrants-court-notices/","b9fa5e07c0a0216c27d875b0d4fab6834c80f06eb01d93bc12e75987f7fecace","1341d34d673c4abe111545eb11477de0"
"China seeking to develop ‘world class’ military by 2049: Pentagon report","New York Post","China already has the world's largest navy, but the country is rapidly increasing ​its armed forces to fulfill President Xi Jinping's vow to develop a world class military by 2049.","2021-11-09 22:05:37","Top News","https://nypost.com/2021/11/09/china-seeking-world-class-military-by-2049-pentagon-report/","b9fa5e07c0a0216c27d875b0d4fab6834c80f06eb01d93bc12e75987f7fecace","e70c6f12d08d13d4e53e57d0d4d67c5b"
"Kishida re-elected Japan’s PM in parliamentary vote","New York Post","Fumio Kishida was re-elected as Japan’s prime minister on Wednesday after his governing party scored a major victory in key parliamentary elections.","2021-11-10 09:51:28","Top News","https://nypost.com/2021/11/10/fumio-kishida-re-elected-as-japans-pm-in-parliamentary-election/","b9fa5e07c0a0216c27d875b0d4fab6834c80f06eb01d93bc12e75987f7fecace","f8f30f2e8d24d23973a9549d51357ba9"
"Astroworld victim declared brain dead from injury: reports","New York Post","Bharti Shahani, a 22-year-old student at Texas A&M University, was declared brain dead after suffering injuries during the crowd surge that killed eight people, according to reports.","2021-11-10 09:24:48","Top News","https://nypost.com/2021/11/10/astroworld-victim-bharti-shahani-declared-brain-dead-from-injury-reports/","b9fa5e07c0a0216c27d875b0d4fab6834c80f06eb01d93bc12e75987f7fecace","59e90aa339d5c1edd25e391c5998d2e7"
"Astroworld staff told in event plan to refer to possible dead fans as ‘smurfs’","New York Post","The 56-page Event Operations Plan, which was obtained by CNN, instructs the personnel at NRG Park in Houston to never use the terms “dead” or “deceased” on the radio.","2021-11-10 12:22:11","Top News","https://nypost.com/2021/11/10/astroworld-staff-told-to-refer-to-possible-dead-fans-as-smurfs/","b9fa5e07c0a0216c27d875b0d4fab6834c80f06eb01d93bc12e75987f7fecace","a831728d4cc59d319901b3263ff126c4"
"Alec Baldwin takes NYC stroll with Hilaria, promotes podcast after ‘Rust’ shooting","New York Post","Alec Baldwin has returned to New York City, where he was spotted strolling with his family – before he promoted a new episode of his podcast.","2021-11-10 13:33:38","Top News","https://nypost.com/2021/11/10/alec-baldwin-takes-nyc-stroll-with-hilaria-promotes-podcast/","b9fa5e07c0a0216c27d875b0d4fab6834c80f06eb01d93bc12e75987f7fecace","6445bfa77810dba70396a287fcfb7628"
"Astroworld victim Bharti Shahani declared brain dead from injury: reports","New York Post","Bharti Shahani, a 22-year-old student at Texas A&M University, was declared brain dead after suffering injuries during the crowd surge that killed eight people, according to reports.","2021-11-10 09:24:48","Top News","https://nypost.com/2021/11/10/astroworld-victim-bharti-shahani-declared-brain-dead-from-injury-reports/","b9fa5e07c0a0216c27d875b0d4fab6834c80f06eb01d93bc12e75987f7fecace","c7872f3bc09ec74f7e3133af3e515710"
"76 percent of Americans think Facebook makes society worse: poll","New York Post","53 percent of Americans called for Facebook to face increased regulation by the federal government, while 35 percent said they believed no change was needed.","2021-11-10 14:23:37","Top News","https://nypost.com/2021/11/10/76-percent-of-americans-think-facebook-makes-society-worse/","b9fa5e07c0a0216c27d875b0d4fab6834c80f06eb01d93bc12e75987f7fecace","c48e31fd187ffc5c5f231ff3fd0819fe"
"Nancy Pelosi slammed as hypocrite for attending Ivy Getty’s wedding maskless","New York Post","Pelosi, who officiated the ceremony, faced backlash after photos of her mingling with other maskless guests were published by Vogue.","2021-11-10 14:03:18","Top News","https://nypost.com/2021/11/10/nancy-pelosi-slammed-for-attending-getty-wedding-maskless/","b9fa5e07c0a0216c27d875b0d4fab6834c80f06eb01d93bc12e75987f7fecace","08def33304ff65b61442aa0fcba47958"
"Astroworld victim Bharti Shahani declared brain-dead from injury: reports","New York Post","Bharti Shahani, a 22-year-old student at Texas A&M University, was declared brain dead after suffering injuries during the crowd surge that killed eight people, according to reports.","2021-11-10 09:24:48","Top News","https://nypost.com/2021/11/10/astroworld-victim-bharti-shahani-declared-brain-dead-from-injury-reports/","b9fa5e07c0a0216c27d875b0d4fab6834c80f06eb01d93bc12e75987f7fecace","e36555c4930a08fb9a5d85662e994624"
"Travis Scott repeatedly bragged about hurt, unconscious concertgoers","New York Post","The 30-year-old Sicko Mode star still has disturbing images on his social media celebrating previous scares.","2021-11-10 15:31:00","Top News","https://nypost.com/2021/11/10/travis-scott-repeatedly-bragged-about-hurt-unconscious-concertgoers/","b9fa5e07c0a0216c27d875b0d4fab6834c80f06eb01d93bc12e75987f7fecace","866d4a582df5d95334fef2399d752278"
"China may launch new high-tech aircraft carrier in early 2022: report","New York Post","China, which already has the world's largest navy, could launch a new high-tech aircraft carrier that rivals US warships by early next year, according to an analysis of satellite imagery. ​​","2021-11-10 15:27:04","Top News","https://nypost.com/2021/11/10/china-could-launch-new-high-tech-aircraft-carrier-in-2022/","b9fa5e07c0a0216c27d875b0d4fab6834c80f06eb01d93bc12e75987f7fecace","96e480500697b2913055c146716d2f12"
"Chinese authorities fear packages could be spreading COVID-19","New York Post","Chinese authorities have halted parcel deliveries in some parts of the country over fears packages could be spreading COVID-19 following several positive cases linked to clothing manufacturers.","2021-11-10 14:57:32","Top News","https://nypost.com/2021/11/10/china-fears-packages-could-be-spreading-covid-19/","b9fa5e07c0a0216c27d875b0d4fab6834c80f06eb01d93bc12e75987f7fecace","67e9e45f79943219ae4423a97dfccacc"
"US testing Iron Dome in Guam amid China attack fears: report","New York Post","The Iron Dome, which Israel used earlier this year, is part of the Biden administration's drive to increase their presence in the Pacific.","2021-11-10 14:49:12","Top News","https://nypost.com/2021/11/10/us-testing-iron-dome-in-guam-amid-china-attack-fears/","b9fa5e07c0a0216c27d875b0d4fab6834c80f06eb01d93bc12e75987f7fecace","a9c554fd9b5e27bc69c2d975e690fca9"
"‘Stop the show!’: Video captures Travis Scott fan pleading with Astroworld cameraman","New York Post","Distressing video shows a Travis Scott fan desperately shouting “Stop the show!” at a cameraman during the deadly stampede at the Astroworld Festival – but the operator ignores his pleas and yells at him to get off the platform.","2021-11-10 16:25:46","Top News","https://nypost.com/2021/11/10/video-travis-scott-fan-begged-cameraman-to-stop-deadly-show/","b9fa5e07c0a0216c27d875b0d4fab6834c80f06eb01d93bc12e75987f7fecace","ae87dcea7ad4e65d59cff334bac15967"
"Kyle Rittenhouse sobs in court as he testifies in own defense during murder trial","New York Post","Kyle Rittenhouse sobbed uncontrollably and struggled to get out words as he testified Wednesday about the moments leading up to shooting the first man that he killed during the unrest last year in Kenosha, Washington.","2021-11-10 15:50:14","Top News","https://nypost.com/2021/11/10/kyle-rittenhouse-testifies-in-own-defense/","b9fa5e07c0a0216c27d875b0d4fab6834c80f06eb01d93bc12e75987f7fecace","c21e18b78e480ea380257521a56b7ef1"
"Key Steele dossier source Igor Danchenko pleads not guilty to lying to FBI","New York Post","Igor Danchenko was arrested after he was indicted as part of Special Counsel John Durham’s investigation into the origins of the FBI probe of Donald Trump's 2016 presidential campaign.","2021-11-10 15:45:03","Top News","https://nypost.com/2021/11/10/igor-danchenko-dossier-source-pleads-not-guilty-to-lying-to-fbi/","b9fa5e07c0a0216c27d875b0d4fab6834c80f06eb01d93bc12e75987f7fecace","f3d77e835fdca24ed8288844839a578e"
"Michigan AG says she drank too much at football tailgate","New York Post","Michigan's attorney general apologized Wednesday and said she drank too much booze before last month's Michigan-Michigan State football game.","2021-11-11 06:41:36","Top News","https://nypost.com/2021/11/11/michigan-ag-dana-nessel-says-she-drank-too-much-at-football-tailgate/","b9fa5e07c0a0216c27d875b0d4fab6834c80f06eb01d93bc12e75987f7fecace","3c54043c47ae7cf38bc6789f6f612c15"
"Henry Ruggs’ lawyers argue to block medical records release","New York Post","LAS VEGAS — Attorneys for former Raiders receiver Henry Ruggs III launched a bid Wednesday to keep his medical records out of the hands of prosecutors charging him with driving under the influence in a fiery crash that killed a Las Vegas woman and cost Ruggs his spot on the team. Ruggs didn’t appear in...","2021-11-11 03:34:51","Top News","https://nypost.com/2021/11/10/henry-ruggs-lawyers-argue-to-block-medical-records-release/","b9fa5e07c0a0216c27d875b0d4fab6834c80f06eb01d93bc12e75987f7fecace","a12f6382ffbeb735c31b71c89c8fbf3a"
"Lawyer for ‘Rust’ armorer Hannah Gutierrez-Reed claims she was ‘framed’","New York Post","Rust armorer Hannah Gutierrez-Reed's attorney said that his client is being framed for the tragic death that occurred when Alec Baldwin shot the film's cinematographer.","2021-11-11 01:58:51","Top News","https://nypost.com/2021/11/10/lawyer-for-rust-armorer-hannah-gutierrez-reed-claims-she-was-framed/","b9fa5e07c0a0216c27d875b0d4fab6834c80f06eb01d93bc12e75987f7fecace","4003171b91dd5c15e4a279c20a8567ad"
"Biden concedes his COVID stimulus checks fueled spike in inflation","New York Post","President Biden insisted inflation is at a three-decade high because people have more money now as a result of his $1.9 trillion COVID-19 stimulus legislation.","2021-11-11 01:16:35","Top News","https://nypost.com/2021/11/10/biden-says-covid-stimulus-checks-fueled-spike-in-inflation/","b9fa5e07c0a0216c27d875b0d4fab6834c80f06eb01d93bc12e75987f7fecace","ad85ed36b9f3ee77b2be6067248a276f"
"Rep. Jeff Hoverson misses his anti-vaccine mandate rally after getting COVID-19","New York Post","North Dakota Rep. Jeff Hoverson assisted in organizing a “We the People” rally to protest the Biden administration's vaccine mandate — but was not able to attend because he contracted COVID-19.","2021-11-11 01:08:59","Top News","https://nypost.com/2021/11/10/rep-jeff-hoverson-misses-his-anti-mandate-rally-after-getting-covid/","b9fa5e07c0a0216c27d875b0d4fab6834c80f06eb01d93bc12e75987f7fecace","a8419db377aa0bdbcb8a2528b06bfb80"
"Hunter Biden makes flashy NYC art scene debut at gallery show for his pricey paintings","New York Post","First son Hunter Biden acted like a full-fledged member of the New York art scene Wednesday evening, making a flashy appearance at the gallery where his paintings are being displayed.","2021-11-11 01:02:37","Top News","https://nypost.com/2021/11/10/hunter-biden-makes-nyc-art-scene-debut-at-gallery-show-for-his-pricey-paintings/","b9fa5e07c0a0216c27d875b0d4fab6834c80f06eb01d93bc12e75987f7fecace","19f11bc7be0fb6417303ee8ccb7107ab"
"Five takeaways from Kyle Rittenhouse’s explosive testimony","New York Post","Kyle Rittenhouse took the stand in his own defense during his murder trial Wednesday, maintaining that he was acting in self defense when he killed two men and injured another in Kenosha, Wisconsin.","2021-11-11 00:18:52","Top News","https://nypost.com/2021/11/10/five-takeaways-from-kyle-rittenhouses-testimony/","b9fa5e07c0a0216c27d875b0d4fab6834c80f06eb01d93bc12e75987f7fecace","bfe3d6337f2a51c370c86ebf264ddac2"
"Biden to sign ‘urgent’ $1.2T infrastructure bill week later … on Monday","New York Post","President Biden will finally sign the long-awaited bipartisan infrastructure bill on Monday, the White House announced, after it has spent a week on his desk since being passed.","2021-11-11 00:14:39","Top News","https://nypost.com/2021/11/10/biden-to-sign-1-2t-infrastructure-bill-next-week/","b9fa5e07c0a0216c27d875b0d4fab6834c80f06eb01d93bc12e75987f7fecace","b24cc07136d9b5e04c81e2c77f332eef"
"Judge approves $626M settlement for Flint tainted-water lawsuit","New York Post","A Michigan judge on Wednesday signed off on a huge $626 million settlement in a class-action lawsuit filed by Flint residents over the city’s lead-tainted water supply. The bulk of the money will come from the Wolverine State, which was accused of looking the other way amid widespread reports of contamination in the city’s drinking...","2021-11-10 23:55:13","Top News","https://nypost.com/2021/11/10/judge-approves-626m-settlement-for-flint-tainted-water-lawsuit/","b9fa5e07c0a0216c27d875b0d4fab6834c80f06eb01d93bc12e75987f7fecace","7826862c7f685587d90c911e14165034"
"More than 35K Air Force members deal with physical or mental violence: study","New York Post","Nearly 37,000 Department of the Air Force workers have gone through psychological or physical violence in the past two years, according to a shocking new study released Tuesday.","2021-11-10 23:52:24","Top News","https://nypost.com/2021/11/10/more-than-35k-air-force-members-deal-with-physical-or-mental-violence-study/","b9fa5e07c0a0216c27d875b0d4fab6834c80f06eb01d93bc12e75987f7fecace","8f8f93065b056bcd553b269d3f1dc176"
"Kyle Rittenhouse’s testimony a ‘huge’ risk, but could score juror sympathy, experts say","New York Post","Kyle Rittenhouse's explosive testimony could be a win for the defense and score sympathy from jurors, but it's still a huge risk to put an emotional teen on the stand, legal experts told The Post Wednesday.","2021-11-10 23:36:34","Top News","https://nypost.com/2021/11/10/kyle-rittenhouses-testimony-huge-risk-but-could-score-juror-sympathy-experts/","b9fa5e07c0a0216c27d875b0d4fab6834c80f06eb01d93bc12e75987f7fecace","42d6c31f39f3cd202d19f211fbaf37f7"
"‘Send them to Delaware’: DeSantis threatens action over secret migrant flights","New York Post","Florida Gov. Ron DeSantis is threatening legal action after his administration claimed that the federal government sent 70 planes carrying young migrants to Jacksonville.","2021-11-10 23:33:39","Top News","https://nypost.com/2021/11/10/desantis-threatens-action-over-secret-migrant-flights/","b9fa5e07c0a0216c27d875b0d4fab6834c80f06eb01d93bc12e75987f7fecace","ec7ede5e4cf501bda37a132796510e9f"
"‘Majority makers’: Stefanik backs eight GOP women for Congress in ‘22","New York Post","House Republican Caucus chair Elise Stefanik (R-NY) released her first round of 2022 midterm endorsements Wednesday, vowing that GOP women will be majority makers next year.","2021-11-10 23:28:36","Top News","https://nypost.com/2021/11/10/elise-stefanik-endorsed-eight-republican-women-for-2022/","b9fa5e07c0a0216c27d875b0d4fab6834c80f06eb01d93bc12e75987f7fecace","09fa5a3ab918f1be7240711d62181f5c"
"Autistic Cambodian teen, jailed for online comments, freed","New York Post","An autistic Cambodian teenager vowed to continue to fight for his father’s freedom after completing his own prison sentence for social media comments.","2021-11-10 22:24:21","Top News","https://nypost.com/2021/11/10/autistic-cambodian-teen-jailed-for-online-comments-freed/","b9fa5e07c0a0216c27d875b0d4fab6834c80f06eb01d93bc12e75987f7fecace","24cf7b0e3674d73f4ef2ef06520869d6"
