"Akim Aliu's Lawyer: Daly's Comments Cause 'Serious Doubts' About Investigation","Bleacher Report","The attorney for former Calgary Flames forward Akim Aliu expressed surprise to learn the NHL has concluded its investigation into former Flames head coach Bill...","2021-11-02 08:11:45","Sports","https://bleacherreport.com/articles/10016925-akim-alius-lawyer-dalys-comments-cause-serious-doubts-about-investigation","c263352413bfac1c62fda09767ddc8050821e90c09a6f88ecfc4ac60037d0aa8","26a42477f6b8c66437080e57e14b975c"
"Damian Lillard on 76ers Fans' 'We Want Lillard' Chant: 'I've Got 10 Toes in Rip City'","Bleacher Report","Portland Trail Blazers star Damian Lillard was unmoved after hearing Philadelphia 76ers fans chant his name. In the first quarter of a 113-103 loss for...","2021-11-02 08:00:32","Sports","https://bleacherreport.com/articles/10016927-damian-lillard-on-76ers-fans-we-want-lillard-chant-ive-got-10-toes-in-rip-city","c263352413bfac1c62fda09767ddc8050821e90c09a6f88ecfc4ac60037d0aa8","85a84455fea199cac72bc911bbcb6ead"
"Donald Fehr Recommends NHLPA Hires Firm to Review Handling of Kyle Beach Allegations","Bleacher Report","Donald Fehr, executive director of the NHL Players' Association, recommended the union solicit the services of an outside law firm to evaluate how it handled...","2021-11-02 06:54:02","Sports","https://bleacherreport.com/articles/10016923-donald-fehr-recommends-nhlpa-hires-firm-to-review-handling-of-kyle-beach-allegations","c263352413bfac1c62fda09767ddc8050821e90c09a6f88ecfc4ac60037d0aa8","de1cb2b420893dcdcaaf86ebdd02bc50"
"Becky Lynch Defeats Bianca Belair to Retain Raw Women's Championship","Bleacher Report","Becky Lynch retained the Raw Women's Championship with a victory over Bianca Belair on Monday. Belair was looking to land the K.O.D., but Lynch grabbed the top...","2021-11-02 05:42:04","Sports","https://bleacherreport.com/articles/10016919-becky-lynch-defeats-bianca-belair-to-retain-raw-womens-championship","c263352413bfac1c62fda09767ddc8050821e90c09a6f88ecfc4ac60037d0aa8","3add8a1adbc36f04fb38e7f6a11ab7ef"
"Buccaneers' Tom Brady Says He's a 'Pain in the Ass' to Refs, 'Always' Complaining","Bleacher Report","Tom Brady seems to be in good spirits following the Tampa Bay Buccaneers' loss to the New Orleans Saints on Sunday. In the ","2021-11-02 05:27:07","Sports","https://bleacherreport.com/articles/10016920-buccaneers-tom-brady-says-hes-a-pain-in-the-ass-to-refs-always-complaining","c263352413bfac1c62fda09767ddc8050821e90c09a6f88ecfc4ac60037d0aa8","806d0a00258b87b80043d62e59287c35"
"Ranking Every New NBA City Edition Jersey","Bleacher Report","For this year's City Edition  NBA  jerseys, Nike and the 30 teams have gone all-in on the mashup concept, combining elements of different jersey designs from the respective franchises' histories...","2021-11-02 05:13:36","Sports","https://bleacherreport.com/articles/2950012-ranking-every-new-nba-city-edition-jersey","c263352413bfac1c62fda09767ddc8050821e90c09a6f88ecfc4ac60037d0aa8","896b4d247eda59056f555ad6f4045a4f"
"NASCAR's Kyle Busch Required to Take Sensitivity Training After Using R-Word","Bleacher Report","Kyle Busch will have to complete sensitivity training prior to the 2022 NASCAR Cup Series season after using the R-word during an on-track interview. The...","2021-11-02 04:38:34","Sports","https://bleacherreport.com/articles/10016910-nascars-kyle-busch-required-to-take-sensitivity-training-after-using-r-word","c263352413bfac1c62fda09767ddc8050821e90c09a6f88ecfc4ac60037d0aa8","31b73363f9fe01e38bad79c1589ff23c"
"WWE Raw Results: Winners, Grades, Reaction and Highlights from November 1","Bleacher Report","Welcome to Bleacher Report's coverage and recap for WWE Monday Night Raw.   Following his win in a Fatal 4-Way match last week against Finn Balor, Kevin Owens and  Rey Mysterio , Seth Rollins earned a future shot at the WWE Championship...","2021-11-02 04:30:01","Sports","https://bleacherreport.com/articles/2950010-wwe-raw-results-winners-grades-reaction-and-highlights-from-november-1","c263352413bfac1c62fda09767ddc8050821e90c09a6f88ecfc4ac60037d0aa8","07e806f6990a8da6179603e3c6faf074"
"Report: Zack Scott Won't Be Retained by Mets as Acting GM After DWI Arrest in August","Bleacher Report","Zack Scott's time as the acting general manager of the New York Mets is reportedly over. ","2021-11-02 04:29:28","Sports","https://bleacherreport.com/articles/10016906-report-zack-scott-wont-be-retained-by-mets-as-acting-gm-after-dwi-arrest-in-august","c263352413bfac1c62fda09767ddc8050821e90c09a6f88ecfc4ac60037d0aa8","3fc640a5b74b9b5133276b0fa7d12ff6"
"Paris Masters 2021: Andy Murray's 1st-Round Loss Headlines Monday's Results","Bleacher Report","The Paris Masters kicked off on Monday, and the day wasn't without some stunning upsets, including one major star bowing out early. Below, we'll break down the...","2021-11-02 04:28:21","Sports","https://bleacherreport.com/articles/10016905-paris-masters-2021-andy-murrays-1st-round-loss-headlines-mondays-results","c263352413bfac1c62fda09767ddc8050821e90c09a6f88ecfc4ac60037d0aa8","1dc50315d5b5d09b8ec472c850db6030"
"Steelers Trade Rumors: Melvin Ingram 'Doesn't Want to Be a Part of the Team'","Bleacher Report","The Pittsburgh Steelers may be parting ways with veteran edge-rusher Melvin Ingram very soon. NFL Network's Aditi Kinkhabwala says Ingram is not happy...","2021-11-02 04:24:30","Sports","https://bleacherreport.com/articles/10016904-steelers-trade-rumors-melvin-ingram-doesnt-want-to-be-a-part-of-the-team","c263352413bfac1c62fda09767ddc8050821e90c09a6f88ecfc4ac60037d0aa8","74008248bff61e441aa53a93060c6578"
"Honus Wagner T206 Baseball Card Graded PSA Authentic Sells for $1.1M at Auction","Bleacher Report","A T206 Honus Wagner card sold for $1.1 million at auction last weekend. Few cards have captured the imagination of collectors quite like the T206 Wagner, both...","2021-11-02 04:11:14","Sports","https://bleacherreport.com/articles/10016900-honus-wagner-t206-baseball-card-graded-psa-authentic-sells-for-11m-at-auction","c263352413bfac1c62fda09767ddc8050821e90c09a6f88ecfc4ac60037d0aa8","20bf1b29d185c3e1306246fe706ff829"
"Giants Legend Barry Bonds' 500th HR Ball Sells for $303K at Auction","Bleacher Report","Baseball's all-time home run king is still a valuable name in the sports memorabilia world. Sports Collectors Digest ","2021-11-02 04:05:55","Sports","https://bleacherreport.com/articles/10016901-giants-legend-barry-bonds-500th-hr-ball-sells-for-303k-at-auction","c263352413bfac1c62fda09767ddc8050821e90c09a6f88ecfc4ac60037d0aa8","74159180ff2acdad8848119a4c736a48"
"Von Miller Trade Vaults Rams Ahead of Packers, Cowboys, Cardinals, Bucs in NFC","Bleacher Report","The Los Angeles Rams swung their second major trade of 2021, sending the Denver Broncos second- and third-round picks in the 2022 draft in exchange for star pass-rusher  Von Miller , according to ESPN's  Adam Schefter ...","2021-11-02 03:59:21","Sports","https://bleacherreport.com/articles/2950014-von-miller-trade-vaults-rams-ahead-of-packers-cowboys-cardinals-bucs-in-nfc","c263352413bfac1c62fda09767ddc8050821e90c09a6f88ecfc4ac60037d0aa8","3614201b677d704f13a7842f0f49d47c"
"Celtics' Marcus Smart: Jayson Tatum, Jaylen Brown Are 'Going to Learn' to Pass","Bleacher Report","Boston Celtics guard Marcus Smart wants Jayson Tatum and Jaylen Brown to pass the ball more and believes they will with more experience. He ","2021-11-02 09:10:28","Sports","https://bleacherreport.com/articles/10016930-celtics-marcus-smart-jayson-tatum-jaylen-brown-are-going-to-learn-to-pass","c263352413bfac1c62fda09767ddc8050821e90c09a6f88ecfc4ac60037d0aa8","2c3fecfbeacbe68b82f10ad5800183d4"
"Derrick Gore, Darrel Williams' Updated Fantasy Outlook After Chiefs' Win Over Giants","Bleacher Report","Kansas City Chiefs running backs Derrick Gore and Darrel Williams both played key roles in Monday's 20-17 win over the New York Giants. So how should fantasy...","2021-11-02 08:36:09","Sports","https://bleacherreport.com/articles/10016926-derrick-gore-darrel-williams-updated-fantasy-outlook-after-chiefs-win-over-giants","c263352413bfac1c62fda09767ddc8050821e90c09a6f88ecfc4ac60037d0aa8","892d14143550de82317bcfdb714c49fd"
"Patrick Mahomes, Chiefs Edge Daniel Jones, Giants on Late FG, Improve to 4-4","Bleacher Report","The Kansas City Chiefs needed a win, and they got one Monday. Kansas City defeated the New York Giants 20-17 at Arrowhead Stadium and bounced back from a...","2021-11-02 08:22:29","Sports","https://bleacherreport.com/articles/10016882-patrick-mahomes-chiefs-edge-daniel-jones-giants-on-late-fg-improve-to-4-4","c263352413bfac1c62fda09767ddc8050821e90c09a6f88ecfc4ac60037d0aa8","2e22fe5e7a379a7c47fa6a39398d5c03"
"Patrick Mahomes, Chiefs Escape Giants, but Serious Flaws Impossible to Ignore","Bleacher Report","The  Kansas City Chiefs  and their fans will have to spend much of this abbreviated week reminding themselves that Monday night's matchup with the  New York Giants  indeed resulted in a win rather than a loss...","2021-11-02 09:26:45","Sports","https://bleacherreport.com/articles/2950025-patrick-mahomes-chiefs-escape-giants-but-serious-flaws-impossible-to-ignore","c263352413bfac1c62fda09767ddc8050821e90c09a6f88ecfc4ac60037d0aa8","3fc37058f3447a947cfebbc63188936d"
"Blazers' Damian Lillard Says Struggles Are an 'Opportunity to Show My True Character'","Bleacher Report","The Portland Trail Blazers fell to 3-4 on the season with Wednesday's 113-103 loss to the Philadelphia 76ers, and Damian Lillard shot just 7-for-20 from the...","2021-11-02 09:22:30","Sports","https://bleacherreport.com/articles/10016933-blazers-damian-lillard-says-struggles-are-an-opportunity-to-show-my-true-character","c263352413bfac1c62fda09767ddc8050821e90c09a6f88ecfc4ac60037d0aa8","ad95931c54459ae5561ae4d39d68916f"
"Von Miller Rumors: Rams Will Try to Sign LB to New Contract Beyond 2021 After Trade","Bleacher Report","The Los Angeles Rams showed they're all in on chasing a trip to Super Bowl LVI by acquiring eight-time Pro Bowl linebacker Von Miller from the Denver Broncos...","2021-11-02 09:11:44","Sports","https://bleacherreport.com/articles/10016931-von-miller-rumors-rams-will-try-to-sign-lb-to-new-contract-beyond-2021-after-trade","c263352413bfac1c62fda09767ddc8050821e90c09a6f88ecfc4ac60037d0aa8","f6011634ca111fb31491b422656585cc"
"UFC 268: Previewing Usman-Covington 2 and the Rest of the Card","Bleacher Report","While most fight fans are still digesting last weekend's epic UFC 267 card in  Abu   Dhabi , United Arab Emirates, the promotion is already serving up another heaped plate of  MMA  action on Saturday's UFC 268 card in New York City...","2021-11-02 16:00:05","Sports","https://bleacherreport.com/articles/2950018-ufc-268-previewing-usman-covington-2-and-the-rest-of-the-card","c263352413bfac1c62fda09767ddc8050821e90c09a6f88ecfc4ac60037d0aa8","76a40a345c343c2321d7bd05ac2ba6ee"
"Kevin Owens Teases Heel Turn, Bianca Belair Needs a Reset, More WWE Raw Fallout","Bleacher Report","WWE  Raw continues to reshape itself with a fresh roster, and the November 1 edition made that new look all the more clearer...","2021-11-02 17:00:02","Sports","https://bleacherreport.com/articles/2950027-kevin-owens-teases-heel-turn-bianca-belair-needs-a-reset-more-wwe-raw-fallout","c263352413bfac1c62fda09767ddc8050821e90c09a6f88ecfc4ac60037d0aa8","55dce6c2c3074f4a04afb6ddc886d16c"
"Jimmy Butler, Tyler Herro Pace Heat in 125-110 Win over Luka Doncic, Mavericks","Bleacher Report","The Miami Heat won their fifth straight game on Tuesday with a 125-110 win over the Dallas Mavericks at the American Airlines Center to move to 6-1 on...","2021-11-03 07:01:02","Sports","https://bleacherreport.com/articles/10017008-jimmy-butler-tyler-herro-pace-heat-in-125-110-win-over-luka-doncic-mavericks","c263352413bfac1c62fda09767ddc8050821e90c09a6f88ecfc4ac60037d0aa8","19a2e9ef31647d7ffc77b95b5fd06caa"
"UCLA Aware of Video Showing Jay Toia Threatening Students in Elevator","Bleacher Report","A spokesperson for the UCLA athletic department told Ben Bolch of the Los Angeles Times...","2021-11-03 06:31:46","Sports","https://bleacherreport.com/articles/10017053-ucla-aware-of-video-showing-jay-toia-threatening-students-in-elevator","c263352413bfac1c62fda09767ddc8050821e90c09a6f88ecfc4ac60037d0aa8","836f4a017433ba45e9ce470127911651"
"Von Miller Trade Part of 'A Long-Term Vision' for Rams, GM Les Snead Says","Bleacher Report","Von Miller is 32 years old and scheduled for free agency following the 2021 season. The Los Angeles Rams' decision to trade for him looked like a short-term...","2021-11-03 06:03:59","Sports","https://bleacherreport.com/articles/10017052-von-miller-trade-part-of-a-long-term-vision-for-rams-gm-les-snead-says","c263352413bfac1c62fda09767ddc8050821e90c09a6f88ecfc4ac60037d0aa8","0518002a0be5d9d726b73746099d6b6e"
"Blackhawks Discuss Settlement with Kyle Beach's Attorney After Aldrich Investigation","Bleacher Report","The Chicago Blackhawks held settlement talks Tuesday with an attorney who represents former Blackhawks player Kyle Beach, per ","2021-11-03 05:49:26","Sports","https://bleacherreport.com/articles/10017049-blackhawks-discuss-settlement-with-kyle-beachs-attorney-after-aldrich-investigation","c263352413bfac1c62fda09767ddc8050821e90c09a6f88ecfc4ac60037d0aa8","9aa017a5d20d1fb8f4fdf1360933fc7c"
"Suns' Deandre Ayton Ruled out for Pelicans Game with Leg Injury","Bleacher Report","Phoenix Suns big man Deandre Ayton suffered a right leg contusion in Saturday's game against the Cleveland Cavaliers and won't be...","2021-11-03 05:32:03","Sports","https://bleacherreport.com/articles/10016749-suns-deandre-ayton-ruled-out-for-pelicans-game-with-leg-injury","c263352413bfac1c62fda09767ddc8050821e90c09a6f88ecfc4ac60037d0aa8","ffea8b2a5c4028c35cace4098eae002c"
"Lincoln Riley: Gary Patterson, Matt Wells Firings 'Not Good for Our Game'","Bleacher Report","Oklahoma Sooners head football coach Lincoln Riley is not a fan of the recent coaching changes in the Big 12. Texas Tech fired head coach Matt Wells on Oct. 25...","2021-11-03 05:09:35","Sports","https://bleacherreport.com/articles/10017048-lincoln-riley-gary-patterson-matt-wells-firings-not-good-for-our-game","c263352413bfac1c62fda09767ddc8050821e90c09a6f88ecfc4ac60037d0aa8","cb9491bc1d29eb6c8ead7f4d3ad44aac"
"CFP Chairman: 'There Was a Lot of Consensus' in Ranking 1-Loss Alabama No. 2","Bleacher Report","The first set of 2021 College Football Playoff rankings dropped Tuesday evening, with...","2021-11-03 04:51:21","Sports","https://bleacherreport.com/articles/10017046-cfp-chairman-there-was-a-lot-of-consensus-in-ranking-1-loss-alabama-no-2","c263352413bfac1c62fda09767ddc8050821e90c09a6f88ecfc4ac60037d0aa8","f6b571412bac44a4ac93894df5633ee6"
"College Football Playoff Projections: Week 10 Rankings and Bowl Forecast","Bleacher Report","The first College Football Playoff Top 25 of the season is out, and what a feather in the cap for anyone who has ever argued about the importance of a singular head-to-head result...","2021-11-03 04:46:53","Sports","https://bleacherreport.com/articles/2949957-college-football-playoff-projections-week-10-rankings-and-bowl-forecast","c263352413bfac1c62fda09767ddc8050821e90c09a6f88ecfc4ac60037d0aa8","cd6281ec91e3fbc2001c20f620e94d76"
"CFP Chairman Says Committee Has 'Great Respect' for Cincinnati After No. 6 Ranking","Bleacher Report","The Cincinnati Bearcats are right in the middle of the College Football Playoff race at No. 6 after the release of the initial rankings on Tuesday, but some...","2021-11-03 04:46:17","Sports","https://bleacherreport.com/articles/10017045-cfp-chairman-says-committee-has-great-respect-for-cincinnati-after-no-6-ranking","c263352413bfac1c62fda09767ddc8050821e90c09a6f88ecfc4ac60037d0aa8","9aa713e1dcace5b1df651e90e1ceffd7"
"WWE NXT 2.0 Results: Winners, Grades, Reaction and Highlights from November 2","Bleacher Report","After a huge NXT Halloween Havoc, the landscape changed. Almost every NXT championship has changed hands in the last few weeks, and that made the November 2 edition a chance for new challengers to emerge...","2021-11-03 04:30:01","Sports","https://bleacherreport.com/articles/2949187-wwe-nxt-20-results-winners-grades-reaction-and-highlights-from-november-2","c263352413bfac1c62fda09767ddc8050821e90c09a6f88ecfc4ac60037d0aa8","3d4726d60fb88b37c6acd392e4b4454d"
"College Football Playoff Rankings 2021: Official Committee Releases Initial List","Bleacher Report","And so it begins. The selection committee that will eventually determine the four College Football Playoff teams this season released its first set of rankings...","2021-11-03 04:23:54","Sports","https://bleacherreport.com/articles/10017024-college-football-playoff-rankings-2021-official-committee-releases-initial-list","c263352413bfac1c62fda09767ddc8050821e90c09a6f88ecfc4ac60037d0aa8","5fe994af143831f8e1b46695d1988fc3"
"College Football Playoff Notebook: Cincinnati Isn't Out, but Things Look Bleak","Bleacher Report","Since the College Football Playoff began in 2014, we have wondered what it would require for a team outside of a major conference to crack the final four...","2021-11-03 07:48:39","Sports","https://bleacherreport.com/articles/2950063-college-football-playoff-notebook-cincinnati-isnt-out-but-things-look-bleak","c263352413bfac1c62fda09767ddc8050821e90c09a6f88ecfc4ac60037d0aa8","3c911731f79c4feb2c9d365f113cec6c"
"AEW's Jon Moxley Entering Inpatient Alcohol Treatment Program","Bleacher Report","Jon Moxley will be entering an inpatient alcohol treatment program. AEW president and CEO Tony Khan announced Moxley's decision Tuesday. Moxley received many...","2021-11-03 09:09:32","Sports","https://bleacherreport.com/articles/10017058-aews-jon-moxley-entering-inpatient-alcohol-treatment-program","c263352413bfac1c62fda09767ddc8050821e90c09a6f88ecfc4ac60037d0aa8","8774b979346c8395e016165944a193a1"
"Henry Ruggs III Released by Raiders After Arrest on Charge of DUI Resulting in Death","Bleacher Report","The Las Vegas Raiders announced they released wide receiver Henry Ruggs III, who is facing...","2021-11-03 09:06:49","Sports","https://bleacherreport.com/articles/10017059-henry-ruggs-iii-released-by-raiders-after-arrest-on-charge-of-dui-resulting-in-death","c263352413bfac1c62fda09767ddc8050821e90c09a6f88ecfc4ac60037d0aa8","c14c02cc95e6ce10e622b349ab5084c7"
"Braves' Jorge Soler Named 2021 World Series MVP","Bleacher Report","The Atlanta Braves won the 2021 World Series on Tuesday night with a convincing 7-0 win over the Houston Astros in Game 6, and right fielder Jorge Soler took...","2021-11-03 09:02:56","Sports","https://bleacherreport.com/articles/10017056-braves-jorge-soler-named-2021-world-series-mvp","c263352413bfac1c62fda09767ddc8050821e90c09a6f88ecfc4ac60037d0aa8","fce2622b21eab73485a43c86d7a1b200"
"Braves Win 2021 World Series: Highlights, Twitter Reaction to Celebration","Bleacher Report","The Atlanta Braves are World Series champions for the first time since 1995. It was easy to think they missed their chance when they blew a 4-0 lead at home...","2021-11-03 09:00:51","Sports","https://bleacherreport.com/articles/10017057-braves-win-2021-world-series-highlights-twitter-reaction-to-celebration","c263352413bfac1c62fda09767ddc8050821e90c09a6f88ecfc4ac60037d0aa8","c424df71d7e49c08819391e560250046"
"Braves Beat Astros in Game 6, Capture Franchise's 1st World Series Since 1995","Bleacher Report","The Atlanta Braves have won the World Series for the first time since 1995 after beating the host Houston Astros 7-0 in Game 6 of the Fall Classic at Minute...","2021-11-03 08:35:38","Sports","https://bleacherreport.com/articles/10017014-braves-beat-astros-in-game-6-capture-franchises-1st-world-series-since-1995","c263352413bfac1c62fda09767ddc8050821e90c09a6f88ecfc4ac60037d0aa8","6cb946f6f7261b53f92ecfb10fddfd27"
"LeBron James Drops 30 and 10 as Lakers Outlast Rockets for 3rd Straight Win","Bleacher Report","The Los Angeles Lakers earned their third straight win, topping the Houston Rockets 119-117 at the Staples Center on Tuesday. LeBron James had 30 points and 10...","2021-11-03 10:01:29","Sports","https://bleacherreport.com/articles/10017020-lebron-james-drops-30-and-10-as-lakers-outlast-rockets-for-3rd-straight-win","c263352413bfac1c62fda09767ddc8050821e90c09a6f88ecfc4ac60037d0aa8","05c0cf5b7da3a8ec837a81cdc26878e1"
"Chris Paul Passes Steve Nash on NBA's All-Time Assist List as Suns Down Pelicans","Bleacher Report","The defending Western Conference champions are putting their slow start behind them. The Phoenix Suns defeated the New Orleans Pelicans 112-100 in Tuesday's...","2021-11-03 09:17:36","Sports","https://bleacherreport.com/articles/10017029-chris-paul-passes-steve-nash-on-nbas-all-time-assist-list-as-suns-down-pelicans","c263352413bfac1c62fda09767ddc8050821e90c09a6f88ecfc4ac60037d0aa8","cb96f9dbeb4382e87fdf72b77a6823c7"
"From Afterthoughts to World Series Champs: How the Braves Shattered Expectations","Bleacher Report","At long last, a playoff result that hasn't left the hearts of Atlanta sports fans ","2021-11-03 10:16:38","Sports","https://bleacherreport.com/articles/10017041-from-afterthoughts-to-world-series-champs-how-the-braves-shattered-expectations","c263352413bfac1c62fda09767ddc8050821e90c09a6f88ecfc4ac60037d0aa8","629fc52f1fedd09866bbacda1ff096ac"
"Oklahoma State MBB Reportedly Banned from 2022 March Madness After FBI Probe","Bleacher Report","The Oklahoma State men's basketballteam will reportedly be banned from postseason play during the2021-22 season after the NCAA denied the program's appeal...","2021-11-03 19:06:20","Sports","https://bleacherreport.com/articles/10017078-oklahoma-state-mbb-reportedly-banned-from-2022-march-madness-after-fbi-probe","c263352413bfac1c62fda09767ddc8050821e90c09a6f88ecfc4ac60037d0aa8","9c650fdb9b269acf7fed7e830dc5d1db"
"Warriors Rumors: Wiseman, Kuminga Not Available to 76ers in Ben Simmons Trade Talks","Bleacher Report","If the Golden State Warriors pursue a trade for Ben Simmons, they reportedly won't include their top two draft picks from the past two years.  Appearing...","2021-11-03 19:00:38","Sports","https://bleacherreport.com/articles/10017077-warriors-rumors-wiseman-kuminga-not-available-to-76ers-in-ben-simmons-trade-talks","c263352413bfac1c62fda09767ddc8050821e90c09a6f88ecfc4ac60037d0aa8","9b4a58f89ff46f8b16ce40fef2fd2b56"
"NFL Trade Deadline 2021: Examining Top News and Rumors","Bleacher Report","The 2021  NFL  trade deadline came and went Tuesday without much fanfare after several key trades went down throughout the regular season to this point.    The deadline wasn't enough to force any teams into making any blockbusters...","2021-11-03 19:00:01","Sports","https://bleacherreport.com/articles/2950066-nfl-trade-deadline-2021-examining-top-news-and-rumors","c263352413bfac1c62fda09767ddc8050821e90c09a6f88ecfc4ac60037d0aa8","3141f1584b0787ab8a20f29d257a76c5"
"Report: JSU's Deion Sanders, Cowboys' Kellen Moore Among Candidates for TCU HC Job","Bleacher Report","The TCU Horned Frogs football team has reportedly identified a handful of candidates to replace head coach Gary Patterson, who ","2021-11-04 07:59:12","Sports","https://bleacherreport.com/articles/10017155-report-jsus-deion-sanders-cowboys-kellen-moore-among-candidates-for-tcu-hc-job","c263352413bfac1c62fda09767ddc8050821e90c09a6f88ecfc4ac60037d0aa8","2d15eb3e121dd74aa6c459bc661c23d0"
"Raiders' Derek Carr on Henry Ruggs III Crash: 'I Will Always Be Here for Him'","Bleacher Report","Las Vegas Raiders quarterback Derek Carr offered his support for former teammate Henry Ruggs III, who has been charged in a fatal car crash. I will always be...","2021-11-04 07:36:01","Sports","https://bleacherreport.com/articles/10017153-raiders-derek-carr-on-henry-ruggs-iii-crash-i-will-always-be-here-for-him","c263352413bfac1c62fda09767ddc8050821e90c09a6f88ecfc4ac60037d0aa8","692a3b0409d4098c2385b2afc0631b4b"
"Kevin Durant Drops 32 to Lead Nets Past Trae Young, Hawks for 3rd Straight Win","Bleacher Report","Kevin Durant scored 32 points on 13-of-20 shooting to lead the Brooklyn Nets to a 117-108 win over the visiting Atlanta Hawks on Wednesday in Barclays Center....","2021-11-04 06:56:04","Sports","https://bleacherreport.com/articles/10017130-kevin-durant-drops-32-to-lead-nets-past-trae-young-hawks-for-3rd-straight-win","c263352413bfac1c62fda09767ddc8050821e90c09a6f88ecfc4ac60037d0aa8","21a5adeaa4216d33ae4a8a3f23efedf1"
"Kamaru Usman Says Boxing Match vs. Canelo Alvarez Would Be 'Biggest Ever in History'","Bleacher Report","MMA superstar Kamaru Usman has a high-profile fighter on his wish list, and it might not be who you'd expect. Usman wants a bout with boxing superstar Canelo...","2021-11-04 06:31:40","Sports","https://bleacherreport.com/articles/10017149-kamaru-usman-says-boxing-match-vs-canelo-alvarez-would-be-biggest-ever-in-history","c263352413bfac1c62fda09767ddc8050821e90c09a6f88ecfc4ac60037d0aa8","04223534544850caefcfcd3db19ec828"
"5-Star LB Drayk Bowen Commits to Notre Dame Over Auburn, Clemson","Bleacher Report","The Notre Dame football team has reason to celebrate, as it landed one of the best recruits in the 2023 class. Five-star linebacker Drayk Bowen, the No. 2...","2021-11-04 06:30:12","Sports","https://bleacherreport.com/articles/10017151-5-star-lb-drayk-bowen-commits-to-notre-dame-over-auburn-clemson","c263352413bfac1c62fda09767ddc8050821e90c09a6f88ecfc4ac60037d0aa8","5de1052f40cd551721831ce8f33a6953"
"Kyle Kuzma Ruled Out of Wizards vs. Raptors After Suffering Forearm Injury","Bleacher Report","The Washington Wizards announced forward Kyle Kuzma was ruled out for the remainder of...","2021-11-04 05:46:43","Sports","https://bleacherreport.com/articles/10015557-kyle-kuzma-ruled-out-of-wizards-vs-raptors-after-suffering-forearm-injury","c263352413bfac1c62fda09767ddc8050821e90c09a6f88ecfc4ac60037d0aa8","a028e36ff4b9d26671998d4f9150f510"
