"No. 3 Kansas Downs MSU Behind Ochai Agbaji's 29 Points at Champions Classic","Bleacher Report","No. 3 Kansas kicked off its 2021-22 season with an 87-74 win over Michigan State in the Champions Classic on Tuesday. Ochai Agbaji led the way for the Jayhawks...","2021-11-10 07:16:33","Sports","https://bleacherreport.com/articles/10017717-no-3-kansas-downs-msu-behind-ochai-agbajis-29-points-at-champions-classic","c263352413bfac1c62fda09767ddc8050821e90c09a6f88ecfc4ac60037d0aa8","6a57fb578382023d50f130fa77ebc304"
"Report: Packers Fined $300K, Aaron Rodgers Fined $15K for Violating COVID Protocols","Bleacher Report","The NFL has fined the Green Bay Packers $300,000 and quarterback Aaron Rodgers $15,000 for violating the NFL and NFLPA's joint COVID-19 protocols, per ESPN's...","2021-11-10 06:24:28","Sports","https://bleacherreport.com/articles/10017735-report-packers-fined-300k-aaron-rodgers-fined-15k-for-violating-covid-protocols","c263352413bfac1c62fda09767ddc8050821e90c09a6f88ecfc4ac60037d0aa8","89591dfd680f026b8a8b072b23cb2b20"
"Kyler Murray Rumors: Cardinals QB Considered Week-To-Week with Ankle Injury","Bleacher Report","Arizona Cardinals quarterback Kyler Murray is considered week-to-week with an ankle injury, according to The Athletic's ","2021-11-10 06:15:56","Sports","https://bleacherreport.com/articles/10017732-kyler-murray-rumors-cardinals-qb-considered-week-to-week-with-ankle-injury","c263352413bfac1c62fda09767ddc8050821e90c09a6f88ecfc4ac60037d0aa8","6d673afc171e199ace5e18badedc519d"
"Dalvin Cook's Agent Says Vikings Running Back Victim of Domestic Abuse, Extortion","Bleacher Report","Zac Hiller, who is Minnesota Vikings running back Dalvin Cook's agent, said his client is the victim of domestic abuse and extortion. That news is per...","2021-11-10 05:48:59","Sports","https://bleacherreport.com/articles/10017728-dalvin-cooks-agent-says-vikings-running-back-victim-of-domestic-abuse-extortion","c263352413bfac1c62fda09767ddc8050821e90c09a6f88ecfc4ac60037d0aa8","37242ecee06e303935d721934c018a36"
"Odell Beckham Jr. Rumors: Patriots in Touch with WR After Browns Release","Bleacher Report","The New England Patriots have reportedly been in touch with Odell Beckham Jr.'s camp following the star wide receiver's release from the Cleveland Browns,...","2021-11-10 05:42:48","Sports","https://bleacherreport.com/articles/10017727-odell-beckham-jr-rumors-patriots-in-touch-with-wr-after-browns-release","c263352413bfac1c62fda09767ddc8050821e90c09a6f88ecfc4ac60037d0aa8","7efd52f414fb16c6635943bfb79f97a9"
"DJ Moore, Robby Anderson's Fantasy Outlook After Sam Darnold's Shoulder Injury","Bleacher Report","The Carolina Panthers are expected to be playing without quarterback Sam Darnold for several weeks after he suffered a fractured scapula, per the NFL Network's...","2021-11-10 05:37:09","Sports","https://bleacherreport.com/articles/10015891-dj-moore-robby-andersons-fantasy-outlook-after-sam-darnolds-shoulder-injury","c263352413bfac1c62fda09767ddc8050821e90c09a6f88ecfc4ac60037d0aa8","f35e63d9593f9e8bd3d93c3a63d79e77"
"WWE NXT 2.0 Results: Winners, Grades, Reaction and Highlights from November 9","Bleacher Report","Toxic Attraction is in control of  WWE NXT  2.0, but the target on the group's back only grows. The big match promoted ahead of the November 9 edition of NXT 2...","2021-11-10 05:30:00","Sports","https://bleacherreport.com/articles/2950022-wwe-nxt-20-results-winners-grades-reaction-and-highlights-from-november-9","c263352413bfac1c62fda09767ddc8050821e90c09a6f88ecfc4ac60037d0aa8","a36f091a8af9de3bf1d841d3da928762"
"Panthers' Sam Darnold Reportedly Set to Miss 'Several Weeks' with Shoulder Injury","Bleacher Report","Carolina Panthers quarterback Sam Darnold reportedly suffered a fractured scapula and is expected to miss several weeks with the right shoulder injury, per the...","2021-11-10 05:13:58","Sports","https://bleacherreport.com/articles/10017604-panthers-sam-darnold-reportedly-set-to-miss-several-weeks-with-shoulder-injury","c263352413bfac1c62fda09767ddc8050821e90c09a6f88ecfc4ac60037d0aa8","2ed9ed38914cb09f8cbe1b640f731d6e"
"Video Released of Suns' Robert Sarver Making Sexually Explicit Jokes at Memorial","Bleacher Report","Sports Illustrated obtained and released a nine-minute video of...","2021-11-10 08:54:03","Sports","https://bleacherreport.com/articles/10017739-video-released-of-suns-robert-sarver-making-sexually-explicit-jokes-at-memorial","c263352413bfac1c62fda09767ddc8050821e90c09a6f88ecfc4ac60037d0aa8","c71a0c5f9cc4c4623fb56b879fb8ae0f"
"CFP Chairman Backs Michigan Being Ranked over MSU Despite Spartans' Rivalry Win","Bleacher Report","The latest edition of the College Football Playoff rankings was revealed Tuesday, and there was a curious decision by the selection committee. Despite losing...","2021-11-10 08:18:13","Sports","https://bleacherreport.com/articles/10017738-cfp-chairman-backs-michigan-being-ranked-over-msu-despite-spartans-rivalry-win","c263352413bfac1c62fda09767ddc8050821e90c09a6f88ecfc4ac60037d0aa8","38a31527905212c6b8ff142b087f72cf"
"Trevor Keels, Paolo Banchero Lead No. 9 Duke to Opening Win vs. No. 10 Kentucky","Bleacher Report","The No. 9 Duke Blue Devils started off the season with a 79-71 win over the No. 10 Kentucky Wildcats at Madison Square Garden in the 11th annual Champions...","2021-11-10 09:52:54","Sports","https://bleacherreport.com/articles/10017719-trevor-keels-paolo-banchero-lead-no-9-duke-to-opening-win-vs-no-10-kentucky","c263352413bfac1c62fda09767ddc8050821e90c09a6f88ecfc4ac60037d0aa8","78fff6e1c2c2fc7f5d0eb743e779fdd4"
"Paul George, Reggie Jackson Power Clippers to Win vs. Damian Lillard, Trail Blazers","Bleacher Report","Paul George's 24-point, nine-rebound, seven-assist evening led the Los Angeles Clippers to a 117-109 win over the visiting Portland Trail Blazers on Tuesday at...","2021-11-10 10:18:04","Sports","https://bleacherreport.com/articles/10017697-paul-george-reggie-jackson-power-clippers-to-win-vs-damian-lillard-trail-blazers","c263352413bfac1c62fda09767ddc8050821e90c09a6f88ecfc4ac60037d0aa8","a75dbee7221abab698465c7eb067caaf"
"Report: Teams 'Outraged' by NFL's Handling of Aaron Rodgers' COVID-19 Violations","Bleacher Report","Some NFL teams are outraged over the league's punishment decisions regarding Green Bay Packers quarterback Aaron Rodgers' COVID-19 violations, per ","2021-11-10 10:12:58","Sports","https://bleacherreport.com/articles/10017742-report-teams-outraged-by-nfls-handling-of-aaron-rodgers-covid-19-violations","c263352413bfac1c62fda09767ddc8050821e90c09a6f88ecfc4ac60037d0aa8","51d110a0ca488e38a20e00c8712ba1ce"
"Nets' James Harden Says He's Getting His Bounce Back After Early Struggles","Bleacher Report","Brooklyn Nets guard James Harden looks to be getting back to his old self, notching a triple-double in Wednesday's win over the Orlando Magic. Harden, who had...","2021-11-11 08:01:27","Sports","https://bleacherreport.com/articles/10017839-nets-james-harden-says-hes-getting-his-bounce-back-after-early-struggles","c263352413bfac1c62fda09767ddc8050821e90c09a6f88ecfc4ac60037d0aa8","b878fca6a043fb7f06fc5c8d739f070f"
"Georgia's Adam Anderson Charged with Rape, Voluntarily Turns Himself in to Police","Bleacher Report","Georgia Bulldogs linebacker Adam Anderson has been charged with rape by the Athens-Clarke County police department, per ","2021-11-11 07:02:09","Sports","https://bleacherreport.com/articles/10017835-georgias-adam-anderson-charged-with-rape-voluntarily-turns-himself-in-to-police","c263352413bfac1c62fda09767ddc8050821e90c09a6f88ecfc4ac60037d0aa8","07361f67bdd7a984509b10ad830705da"
"Rockets Postpone 'Travis Scott Night,' Hold Moment of Silence for Astroworld Victims","Bleacher Report","The Houston Rockets held a moment of silence prior to their home game against the...","2021-11-11 07:01:47","Sports","https://bleacherreport.com/articles/10017832-rockets-postpone-travis-scott-night-hold-moment-of-silence-for-astroworld-victims","c263352413bfac1c62fda09767ddc8050821e90c09a6f88ecfc4ac60037d0aa8","c7949b86f4bfb2ef6f2fdab6b7a54d7b"
"DeSean Jackson 'Not Asking to Get the Ball 100 Times' After Signing with Raiders","Bleacher Report","Newly-signed Las Vegas Raiders wide receiver DeSean Jackson is ready for a fresh start. The 14-year-old veteran said he would accept any role his new team asks...","2021-11-11 07:00:37","Sports","https://bleacherreport.com/articles/10017836-desean-jackson-not-asking-to-get-the-ball-100-times-after-signing-with-raiders","c263352413bfac1c62fda09767ddc8050821e90c09a6f88ecfc4ac60037d0aa8","0ea0ca07b87e9e7bac26c19cc8eac2ef"
"Woj: John Wall Has ‘No Plans’ to Play for Rockets This Season; May Sit Out All Year","Bleacher Report","Houston Rockets point guard John Wall has yet to take the floor this season, and that doesn't look to be changing anytime soon. ESPN's ","2021-11-11 06:26:22","Sports","https://bleacherreport.com/articles/10017831-woj-john-wall-has-no-plans-to-play-for-rockets-this-season-may-sit-out-all-year","c263352413bfac1c62fda09767ddc8050821e90c09a6f88ecfc4ac60037d0aa8","695bb2edb7798f2d1fb1def5eb191919"
"Ducks' Bob Murray Resigns as GM, Will Enter Alcohol Use Program amid Misconduct Probe","Bleacher Report","Anaheim Ducks general manager Bob Murray resigned Wednesday and will enter an alcohol treatment program amid an investigation into alleged misconduct. I want...","2021-11-11 06:10:38","Sports","https://bleacherreport.com/articles/10017830-ducks-bob-murray-resigns-as-gm-will-enter-alcohol-use-program-amid-misconduct-probe","c263352413bfac1c62fda09767ddc8050821e90c09a6f88ecfc4ac60037d0aa8","5092c74f1c606abc43fa90ff4203adf5"
"Jalen Rose Apologizes for Comments About Suns' Robert Sarver on 'NBA Countdown'","Bleacher Report","After seemingly accusing Phoenix Suns owner Robert Sarver of using racist language toward Deandre Ayton during contract negotiations, ESPN's Jalen Rose has...","2021-11-11 05:52:51","Sports","https://bleacherreport.com/articles/10017826-jalen-rose-apologizes-for-comments-about-suns-robert-sarver-on-nba-countdown","c263352413bfac1c62fda09767ddc8050821e90c09a6f88ecfc4ac60037d0aa8","5128264711851940e3f6fda2a0482bda"
"Woj: Warriors' Klay Thompson Could Return from Achilles Injury Prior to Christmas","Bleacher Report","The Golden State Warriors may be getting shooting guard Klay Thompson back before Christmas Day, per ESPN's ","2021-11-11 05:44:14","Sports","https://bleacherreport.com/articles/10017825-woj-warriors-klay-thompson-could-return-from-achilles-injury-prior-to-christmas","c263352413bfac1c62fda09767ddc8050821e90c09a6f88ecfc4ac60037d0aa8","e2dd809332233a56ec7942a0cedbe3d3"
"Report: Kings' Marvin Bagley III Refused to Check into Game vs. Suns; Video Released","Bleacher Report","Sacramento Kings power forward Marvin Bagley III reportedly refused to enter the second half of Monday's 109-104 loss to the Phoenix Suns, per a report from...","2021-11-11 05:37:53","Sports","https://bleacherreport.com/articles/10017823-report-kings-marvin-bagley-iii-refused-to-check-into-game-vs-suns-video-released","c263352413bfac1c62fda09767ddc8050821e90c09a6f88ecfc4ac60037d0aa8","038c1e6224bcc7d813d6807c89cde8b6"
"Mel Kiper 2022 NFL Draft Big Board: Thibodeaux, Hamilton Top November Rankings","Bleacher Report","Kayvon Thibodeaux and Kyle Hampton are the class of the 2022 NFL draft, according to ESPN's ","2021-11-11 05:32:56","Sports","https://bleacherreport.com/articles/10017819-mel-kiper-2022-nfl-draft-big-board-thibodeaux-hamilton-top-november-rankings","c263352413bfac1c62fda09767ddc8050821e90c09a6f88ecfc4ac60037d0aa8","fa266bd5729ef4b356d96796083e9f57"
"AEW Dynamite Results: Winners, Grades, Reaction and Highlights from November 10","Bleacher Report","Just three days before Full Gear in Minneapolis, AEW hit the TNT airwaves with an episode of Dynamite that featured world champion Kenny Omega and top contender Hangman Adam Page signing the contract for their hotly anticipated clash on pay-per-view...","2021-11-11 05:30:01","Sports","https://bleacherreport.com/articles/2950319-aew-dynamite-results-winners-grades-reaction-and-highlights-from-november-10","c263352413bfac1c62fda09767ddc8050821e90c09a6f88ecfc4ac60037d0aa8","7565fabfc4e4f44475b1d77c8ba95c29"
"Liam Hendriks, Josh Hader Named MLB's 2021 MLB Relievers of the Year","Bleacher Report","MLB announced the winners of the Reliever of the Year Award on Wednesday. In the American League, Chicago White Sox closer Liam Hendriks took home the honors...","2021-11-11 05:28:04","Sports","https://bleacherreport.com/articles/10017824-liam-hendriks-josh-hader-named-mlbs-2021-mlb-relievers-of-the-year","c263352413bfac1c62fda09767ddc8050821e90c09a6f88ecfc4ac60037d0aa8","2d2c009f53dc0b5e1dc5dd3e6929b617"
"Odell Beckham Jr. Rumors: WR's Decision on Next Team Remains 'A Few Days Away'","Bleacher Report","Free-agent wide receiver Odell Beckham Jr. is going to take some time on deciding his new team, and that call could be a few days away. That's per ","2021-11-11 05:07:55","Sports","https://bleacherreport.com/articles/10017820-odell-beckham-jr-rumors-wrs-decision-on-next-team-remains-a-few-days-away","c263352413bfac1c62fda09767ddc8050821e90c09a6f88ecfc4ac60037d0aa8","d748ae65411828fa2f6e5d1d4600f4ed"
"Tom Thibodeau Says It's a 'Bunch of Bulls--t' That Knicks Starters Need Time to Jell","Bleacher Report","The starting five for the New York Knicks struggled mightily in Wednesday's 112-100 loss to the Milwaukee Bucks. Despite the off-night, Knicks head coach Tom...","2021-11-11 09:00:02","Sports","https://bleacherreport.com/articles/10017844-tom-thibodeau-says-its-a-bunch-of-bulls--t-that-knicks-starters-need-time-to-jell","c263352413bfac1c62fda09767ddc8050821e90c09a6f88ecfc4ac60037d0aa8","7c6fdc2b0e0473d23605d86c018c64c4"
"After Ugly Exchange with Ex-Coach, Pels Exec David Griffin's Job Is on the Brink","Bleacher Report","As the  New Orleans Pelicans  remain mired in one of the poorest starts to this  NBA  season, league-wide speculation has only increased about the job security of executive vice president of basketball operations David Griffin...","2021-11-11 08:38:43","Sports","https://bleacherreport.com/articles/2950333-after-ugly-exchange-with-ex-coach-pels-exec-david-griffins-job-is-on-the-brink","c263352413bfac1c62fda09767ddc8050821e90c09a6f88ecfc4ac60037d0aa8","e71fae4997b66cba0da7f038c3b1fcf3"
"Cade Cunningham Outduels Jalen Green as Pistons Beat Rockets","Bleacher Report","In the battle of the top two picks from the 2021 NBA draft, Round 1 went to Cade Cunningham. His Detroit Pistons got the best of Jalen Green's Houston Rockets...","2021-11-11 08:19:28","Sports","https://bleacherreport.com/articles/10017838-cade-cunningham-outduels-jalen-green-as-pistons-beat-rockets","c263352413bfac1c62fda09767ddc8050821e90c09a6f88ecfc4ac60037d0aa8","a677ff36c599996e11b68ddd16bfe5df"
"Pistons' Cade Cunningham Says Jalen Green's Trash Talk was 'All for the Cameras'","Bleacher Report","Detroit Pistons guard Cade Cunningham didn't seem too bothered by Houston Rockets guard Jalen Green's trash talk, if his postgame reaction following his team's...","2021-11-11 10:06:59","Sports","https://bleacherreport.com/articles/10017846-pistons-cade-cunningham-says-jalen-greens-trash-talk-was-all-for-the-cameras","c263352413bfac1c62fda09767ddc8050821e90c09a6f88ecfc4ac60037d0aa8","8c182a3a435e1a6660a5edab4e6b36ae"
"Jimmy Butler Exits Heat vs. Lakers; Ankle Injury Diagnosed as Sprain","Bleacher Report","The Miami Heat announced that forward Jimmy Butler suffered a sprained right ankle...","2021-11-11 09:36:14","Sports","https://bleacherreport.com/articles/10015915-jimmy-butler-exits-heat-vs-lakers-ankle-injury-diagnosed-as-sprain","c263352413bfac1c62fda09767ddc8050821e90c09a6f88ecfc4ac60037d0aa8","3b6c76c931ec3d1a9b01d4c155af953c"
"Draymond Green Out for Warriors vs. Timberwolves With Thigh Injury","Bleacher Report","The Golden State Warriors declared forward Draymond Green out for the remainder of his...","2021-11-11 10:11:39","Sports","https://bleacherreport.com/articles/10016527-draymond-green-out-for-warriors-vs-timberwolves-with-thigh-injury","c263352413bfac1c62fda09767ddc8050821e90c09a6f88ecfc4ac60037d0aa8","92ef5f46eab271e9b4952d7b301b2d2b"
"Anthony Davis, Russell Westbrook Power Lakers to OT Victory over Tyler Herro, Heat","Bleacher Report","Notable Performances Heat C Bam Adebayo: 28 points, 10 rebounds, 6 steals Heat G Tyler Herro: 27 points Heat G Kyle Lowry: 18 points, 11 assists, 7...","2021-11-11 11:12:31","Sports","https://bleacherreport.com/articles/10017805-anthony-davis-russell-westbrook-power-lakers-to-ot-victory-over-tyler-herro-heat","c263352413bfac1c62fda09767ddc8050821e90c09a6f88ecfc4ac60037d0aa8","9a366cc8d5f82918b0ed4eb263879a86"
"John Harbaugh Says Ravens' Loss to Dolphins 'Falls Squarely on Me'","Bleacher Report","The Baltimore Ravens suffered a surprising 22-10 loss to the Miami Dolphins on Thursday night, and head coach John Harbaugh is placing the blame solely on...","2021-11-12 10:09:25","Sports","https://bleacherreport.com/articles/10017963-john-harbaugh-says-ravens-loss-to-dolphins-falls-squarely-on-me","c263352413bfac1c62fda09767ddc8050821e90c09a6f88ecfc4ac60037d0aa8","9fcd9af90253cf090e9cc97141233808"
"Lamar Jackson, Ravens Struggle Mightily in 22-10 Loss to Dolphins on TNF","Bleacher Report","The first three quarters of Thursday night's NFL matchup between the Baltimore Ravens and Miami Dolphins was about as exciting as a cup of chamomile tea, or...","2021-11-12 09:52:39","Sports","https://bleacherreport.com/articles/10017954-lamar-jackson-ravens-struggle-mightily-in-22-10-loss-to-dolphins-on-tnf","c263352413bfac1c62fda09767ddc8050821e90c09a6f88ecfc4ac60037d0aa8","86e94fdf5170c1409672f8194de05367"
"Rudy Gobert, Donovan Mitchell, Myles Turner Ejected After Pacers vs. Jazz Altercation","Bleacher Report","A tussle between Utah Jazz center Rudy Gobert and Indiana Pacers big man Myles Turner led to four players being ejected Thursday evening. Gobert and Turner got...","2021-11-12 09:49:57","Sports","https://bleacherreport.com/articles/10017962-rudy-gobert-donovan-mitchell-myles-turner-ejected-after-pacers-vs-jazz-altercation","c263352413bfac1c62fda09767ddc8050821e90c09a6f88ecfc4ac60037d0aa8","5c2bbb27a52fb5e7134f40f13c39fa38"
"Odell Beckham Jr. Signing Is Biggest Boom-or-Bust Move of 2021 NFL Season","Bleacher Report","There is no shortage of words that one can associate with wide receiver  Odell Beckham Jr.     Talented. Explosive. Exciting. Mercurial. Dramatic. Highlight Reel King (OK, that was three words)...","2021-11-12 09:14:54","Sports","https://bleacherreport.com/articles/2950361-odell-beckham-jr-signing-is-biggest-boom-or-bust-move-of-2021-nfl-season","c263352413bfac1c62fda09767ddc8050821e90c09a6f88ecfc4ac60037d0aa8","185ce554180019f32048c7d7cb617452"
"Video: UC Riverside Drains Stunning Long-Distance Buzzer-Beater to Upset ASU","Bleacher Report","The UC Riverside men's basketball team earned an improbable upset road win over Arizona State on Thursday, as J.P. Moorman II drilled a game-winning...","2021-11-12 09:08:22","Sports","https://bleacherreport.com/articles/10017961-video-uc-riverside-drains-stunning-long-distance-buzzer-beater-to-upset-asu","c263352413bfac1c62fda09767ddc8050821e90c09a6f88ecfc4ac60037d0aa8","17296da9c4305daf9570ee66dfc6b904"
"Seattle University HC Jim Hayford Resigns After Allegedly Using Racial Slurs","Bleacher Report","Seattle University Director of Athletics Shaney Fink ","2021-11-12 08:30:31","Sports","https://bleacherreport.com/articles/10017956-seattle-university-hc-jim-hayford-resigns-after-allegedly-using-racial-slurs","c263352413bfac1c62fda09767ddc8050821e90c09a6f88ecfc4ac60037d0aa8","7b59ec9f7bd7917fc8bccde067ccd9dc"
"Dolphins' Jacoby Brissett Exits TNF with Knee Injury; Replaced by Tua Tagovailoa","Bleacher Report","Miami Dolphins quarterback Jacoby Brissett exited Thursday night's game against the Baltimore Ravens in the third quarter with a knee injury. He is...","2021-11-12 08:20:01","Sports","https://bleacherreport.com/articles/10017957-dolphins-jacoby-brissett-exits-tnf-with-knee-injury-replaced-by-tua-tagovailoa","c263352413bfac1c62fda09767ddc8050821e90c09a6f88ecfc4ac60037d0aa8","fb7115479493f331ec8527375a8e2f54"
"Odell Beckham Jr.'s Rams Contract Reportedly Worth Up to $4.25M for Rest of Season","Bleacher Report","Odell Beckham Jr.'s free agency was short-lived as he landed with the Los Angeles Rams on Thursday. Now, the details of his contract are emerging. ","2021-11-12 08:07:06","Sports","https://bleacherreport.com/articles/10017955-odell-beckham-jrs-rams-contract-reportedly-worth-up-to-425m-for-rest-of-season","c263352413bfac1c62fda09767ddc8050821e90c09a6f88ecfc4ac60037d0aa8","329811f6c35730e084dcd5d3ffb2e8a1"
"Impact Wrestling Results: Winners, Grades and Reaction from November 11","Bleacher Report","The road to  Impact Wrestling 's Turning Point continued Thursday night on AXS TV with a show that determined the No. 1 contender to both the world and tag team titles...","2021-11-12 08:02:21","Sports","https://bleacherreport.com/articles/2950356-impact-wrestling-results-winners-grades-and-reaction-from-november-11","c263352413bfac1c62fda09767ddc8050821e90c09a6f88ecfc4ac60037d0aa8","0b42e1a0f5449c65c1202e05da9cc1c1"
"Conor McGregor Slams Jorge Masvidal for Withdrawing from UFC 269: 'F--k Your Injury'","Bleacher Report","Conor McGregor criticized Jorge Masvidal on Twitter for dropping out of his...","2021-11-12 07:48:18","Sports","https://bleacherreport.com/articles/10017952-conor-mcgregor-slams-jorge-masvidal-for-withdrawing-from-ufc-269-f--k-your-injury","c263352413bfac1c62fda09767ddc8050821e90c09a6f88ecfc4ac60037d0aa8","21cfcac6df9791e67894b167e8bad0e7"
"Pistons' Kelly Olynyk out at Least 6 Weeks with Knee Injury Diagnosed as MCL Sprain","Bleacher Report","The Detroit Pistons are set to be without power forward Kelly Olynyk, who suffered a Grade 2 MCL sprain in his right knee Wednesday against the Houston...","2021-11-12 07:31:38","Sports","https://bleacherreport.com/articles/10015464-pistons-kelly-olynyk-out-at-least-6-weeks-with-knee-injury-diagnosed-as-mcl-sprain","c263352413bfac1c62fda09767ddc8050821e90c09a6f88ecfc4ac60037d0aa8","32b087abf0c9a51bc1e54a0124d0ee80"
"Shams: Joel Embiid, Doc Rivers Didn't Apologize to Ben Simmons for Game 7 Comments","Bleacher Report","Philadelphia 76ers head coach Doc Rivers and center Joel Embiid reportedly have not apologized to point guard Ben Simmons regarding their critical comments on...","2021-11-12 06:37:09","Sports","https://bleacherreport.com/articles/10017949-shams-joel-embiid-doc-rivers-didnt-apologize-to-ben-simmons-for-game-7-comments","c263352413bfac1c62fda09767ddc8050821e90c09a6f88ecfc4ac60037d0aa8","a3a5513da6f7421682096a0ce9f5fd2c"
"Rich Paul on Ben Simmons' Standoff with 76ers: 'This Is No Longer About a Trade'","Bleacher Report","Ben Simmons' agent, Rich Paul, believes the Philadelphia 76ers have made the player's mental health problems worse with their actions this season.  I...","2021-11-12 06:21:32","Sports","https://bleacherreport.com/articles/10017945-rich-paul-on-ben-simmons-standoff-with-76ers-this-is-no-longer-about-a-trade","c263352413bfac1c62fda09767ddc8050821e90c09a6f88ecfc4ac60037d0aa8","43f011692db2fd3ed8e6995d289e4804"
"Cam Newton Posts YouTube Video Marking Return to Panthers","Bleacher Report","Cam Newton agreed to a contract to return to the Carolina Panthers on...","2021-11-12 06:08:57","Sports","https://bleacherreport.com/articles/10017943-cam-newton-posts-youtube-video-marking-return-to-panthers","c263352413bfac1c62fda09767ddc8050821e90c09a6f88ecfc4ac60037d0aa8","8ebe1c077bddec019b5765a115d875a5"
"Deshaun Watson Trade Rumors: Dolphins Were Willing to Deal 3 1st-Round Picks, More","Bleacher Report","The Miami Dolphins apparently were at least willing to meet the Houston Texans' asking price for Deshaun Watson. Fox Sports' Jay Glazer (via ","2021-11-12 06:06:05","Sports","https://bleacherreport.com/articles/10017944-deshaun-watson-trade-rumors-dolphins-were-willing-to-deal-3-1st-round-picks-more","c263352413bfac1c62fda09767ddc8050821e90c09a6f88ecfc4ac60037d0aa8","2dae5b64e588cb9bfc7b512facde5f2a"
"Glazer: Odell Beckham Jr. Had Wanted to Join Rams Since They Hired Sean McVay","Bleacher Report","Newly signed Los Angeles Rams wide receiver Odell Beckham Jr. is reportedly finally with the team he's always desired. Fox Sports' ","2021-11-12 05:56:53","Sports","https://bleacherreport.com/articles/10017942-glazer-odell-beckham-jr-had-wanted-to-join-rams-since-they-hired-sean-mcvay","c263352413bfac1c62fda09767ddc8050821e90c09a6f88ecfc4ac60037d0aa8","c45e073f030cdf5309c9f40622587f90"
"Report: Jalen Ramsey, Matthew Stafford, More Helped Recruit Odell Beckham Jr. to Rams","Bleacher Report","A number of Los Angeles Rams players, including cornerback Jalen Ramsey, wideouts Robert Woods and Cooper Kupp and quarterback Matthew Stafford, helped recruit...","2021-11-12 05:51:51","Sports","https://bleacherreport.com/articles/10017941-report-jalen-ramsey-matthew-stafford-more-helped-recruit-odell-beckham-jr-to-rams","c263352413bfac1c62fda09767ddc8050821e90c09a6f88ecfc4ac60037d0aa8","173e4c4befc2ec1835bcd99f6f40c951"
"Patrick Mahomes, Baker Mayfield Headline Madden 22 Week 9 Player Ratings Update","Bleacher Report","Kansas City Chiefs star quarterback Patrick Mahomes has seen his Madden ranking slip for the second straight week. The video game franchise ","2021-11-12 05:26:43","Sports","https://bleacherreport.com/articles/10017939-patrick-mahomes-baker-mayfield-headline-madden-22-week-9-player-ratings-update","c263352413bfac1c62fda09767ddc8050821e90c09a6f88ecfc4ac60037d0aa8","9a08cba2e3aaf3d3d17e154c2ab65bc0"
