"Fantasy Football Week 9 Rankings: Projections to Love and Matchups to Exploit","Bleacher Report","With fantasy football stars, you sometimes have to temper your expectations. Even if a player should be started every week, it's possible a tough matchup could arise that may prevent him from putting up huge numbers...","2021-11-05 18:51:50","Sports","https://bleacherreport.com/articles/2950147-fantasy-football-week-9-rankings-projections-to-love-and-matchups-to-exploit","c263352413bfac1c62fda09767ddc8050821e90c09a6f88ecfc4ac60037d0aa8","120d41dc43d8b8133e6aa5f7b560685b"
"College Football Coaches Poll 2021: Complete Week 11 Rankings Released","Bleacher Report","Attention at this point of the season has turned to the College Football Playoff rankings, but the sport's coaches may have provided a Tuesday preview with the...","2021-11-07 22:43:59","Sports","https://bleacherreport.com/articles/10017440-college-football-coaches-poll-2021-complete-week-11-rankings-released","c263352413bfac1c62fda09767ddc8050821e90c09a6f88ecfc4ac60037d0aa8","e6439e9270a668d190cb47403f1b2ca0"
"LA Marathon 2021 Results: Men's and Women's Top Finishers","Bleacher Report","Two years after finishing second, John Korir bounced back to win the 2021 Los Angeles Marathon with a time of two hours, 12 minutes and 48 seconds....","2021-11-07 22:43:31","Sports","https://bleacherreport.com/articles/10017456-la-marathon-2021-results-mens-and-womens-top-finishers","c263352413bfac1c62fda09767ddc8050821e90c09a6f88ecfc4ac60037d0aa8","3cb4242f19ef131627adb7bd73beddae"
"Matt LaFleur Takes Blame for Jordan Love's Struggles in Packers' Loss vs. Chiefs","Bleacher Report","Green Bay Packers quarterback Jordan Love had a rough time in his first career start, a 13-7 loss to the Kansas City Chiefs on Sunday. After the game, Packers...","2021-11-08 08:44:56","Sports","https://bleacherreport.com/articles/10017511-matt-lafleur-takes-blame-for-jordan-loves-struggles-in-packers-loss-vs-chiefs","c263352413bfac1c62fda09767ddc8050821e90c09a6f88ecfc4ac60037d0aa8","ba7ab01a3d97a665d89763db10a5c83e"
"It's Not About Trey Lance or Jimmy Garoppolo; Kyle Shanahan's 49ers Are Broken","Bleacher Report","At a certain point, injuries just don't cut it as an excuse. Ditto for quarterback play.     We've reached that point with the San Francisco 49ers, who on Sunday dropped to 3-5 with ...","2021-11-08 08:37:58","Sports","https://bleacherreport.com/articles/2950233-its-not-about-trey-lance-or-jimmy-garoppolo-kyle-shanahans-49ers-are-broken","c263352413bfac1c62fda09767ddc8050821e90c09a6f88ecfc4ac60037d0aa8","2791694441aab8bfdd1a818ee6c80140"
"NFL Teams Who Reminded Us to Rethink Their Status After Week 9","Bleacher Report","If anything, we were reminded on the ninth Sunday of the 2021  NFL  regular season that it's a long campaign and drawing conclusions prior to November is unwise...","2021-11-08 08:36:06","Sports","https://bleacherreport.com/articles/2950230-nfl-teams-who-reminded-us-to-rethink-their-status-after-week-9","c263352413bfac1c62fda09767ddc8050821e90c09a6f88ecfc4ac60037d0aa8","ca70947dfc9c11c5b787b9b8c03bcbef"
"5-Star Guard Prospect Cason Wallace Commits to Kentucky over UTSA, Tennessee, Texas","Bleacher Report","Kentucky just improved its backcourt in a big way. Cason Wallace, a 5-star combo guard from Richardson, Texas, committed to the Wildcats...","2021-11-08 08:11:55","Sports","https://bleacherreport.com/articles/10015089-5-star-guard-prospect-cason-wallace-commits-to-kentucky-over-utsa-tennessee-texas","c263352413bfac1c62fda09767ddc8050821e90c09a6f88ecfc4ac60037d0aa8","026310b710e14dae20a598f528990006"
"Cowboys' Dak Prescott on Calf Injury After Loss: 'I Didn't Feel It. I'm Fine'","Bleacher Report","Dak Prescott struggled in his return to the field in a 30-16 loss to the Denver Broncos on Sunday after missing last weekend's win over the Minnesota Vikings...","2021-11-08 07:50:21","Sports","https://bleacherreport.com/articles/10017507-cowboys-dak-prescott-on-calf-injury-after-loss-i-didnt-feel-it-im-fine","c263352413bfac1c62fda09767ddc8050821e90c09a6f88ecfc4ac60037d0aa8","938bac78c5f1e50c19c91e2bbfd8e0f9"
"Clayton Kershaw Not Offered Qualifying Contract Offer by Dodgers Ahead of Deadline","Bleacher Report","The Los Angeles Dodgers ","2021-11-08 07:41:38","Sports","https://bleacherreport.com/articles/10017506-clayton-kershaw-not-offered-qualifying-contract-offer-by-dodgers-ahead-of-deadline","c263352413bfac1c62fda09767ddc8050821e90c09a6f88ecfc4ac60037d0aa8","7d38ebe07f344b8aac7813f732ed5ec5"
"MLB Gold Glove Awards 2021: Full List of Winners and Reaction","Bleacher Report","Major League Baseball celebrated its best defensive players from the 2021 season with the announcement of this year's Gold Glove winners. The St. Louis...","2021-11-08 07:38:34","Sports","https://bleacherreport.com/articles/10017485-mlb-gold-glove-awards-2021-full-list-of-winners-and-reaction","c263352413bfac1c62fda09767ddc8050821e90c09a6f88ecfc4ac60037d0aa8","f811ec53e1965d89eafad60fba15a6e6"
"Odell Beckham Jr. Rumors: WR Wants to Join Seahawks, Prefers Free Agency over Waivers","Bleacher Report","Cleveland Browns wide receiver Odell Beckham Jr. will be placed on waivers Monday, and it sounds like he's keen on teaming up with Russell Wilson.  Pro...","2021-11-08 06:23:15","Sports","https://bleacherreport.com/articles/10017502-odell-beckham-jr-rumors-wr-wants-to-join-seahawks-prefers-free-agency-over-waivers","c263352413bfac1c62fda09767ddc8050821e90c09a6f88ecfc4ac60037d0aa8","2734f9cc61bd24fb7c9ba48a3539d252"
"Week 10 Waiver Wire: Fantasy Football's Top Breakout Candidates and Pickups","Bleacher Report","Heading into the second half of the 2021 season, we'll see younger players with upside solidify themselves in decent roles. Fantasy managers should take a look at them before it's too late...","2021-11-08 06:00:05","Sports","https://bleacherreport.com/articles/2950229-week-10-waiver-wire-fantasy-footballs-top-breakout-candidates-and-pickups","c263352413bfac1c62fda09767ddc8050821e90c09a6f88ecfc4ac60037d0aa8","e9d23879cf4c73a811e8402c9fb18e70"
"Patrick Mahomes, Chiefs Beat Jordan Love, Packers with Aaron Rodgers out for GB","Bleacher Report","Well that wasn't the first start Jordan Love would have drawn up for himself. The second-year quarterback struggled in relief of Aaron Rodgers as the Green Bay...","2021-11-08 05:36:30","Sports","https://bleacherreport.com/articles/10017489-patrick-mahomes-chiefs-beat-jordan-love-packers-with-aaron-rodgers-out-for-gb","c263352413bfac1c62fda09767ddc8050821e90c09a6f88ecfc4ac60037d0aa8","d94097a2ef89c57719b5a53178d164de"
"Yankees Rumors: Former Mets Manager Luis Rojas Interviews for Base Coach Job","Bleacher Report","Former New York Mets manager Luis Rojas has interviewed with the New York Yankees for one of their vacant base coaching positions, per The Athletic's ","2021-11-08 05:29:48","Sports","https://bleacherreport.com/articles/10017499-yankees-rumors-former-mets-manager-luis-rojas-interviews-for-base-coach-job","c263352413bfac1c62fda09767ddc8050821e90c09a6f88ecfc4ac60037d0aa8","f5f7e9efe0d8bb9ad4fd3f0590663429"
"Collin Sexton Won't Return for Cavaliers vs. Knicks Because of Knee Injury","Bleacher Report","Cleveland Cavaliers point guard Collin Sexton left Sunday's game against the New York Knicks after ","2021-11-08 05:27:26","Sports","https://bleacherreport.com/articles/10017165-collin-sexton-wont-return-for-cavaliers-vs-knicks-because-of-knee-injury","c263352413bfac1c62fda09767ddc8050821e90c09a6f88ecfc4ac60037d0aa8","e0ad53cf54ddf0390c5e048e393b0fd7"
"NASCAR Monster Cup Winner 2021: Kyle Larson Tops Final Chase Standings and Grid","Bleacher Report","After a first-place finish at Phoenix Raceway on Sunday, Kyle Larson was crowned the winner of the 2021 NASCAR Cup Series Championship. It was Larson's 10th...","2021-11-08 05:08:20","Sports","https://bleacherreport.com/articles/10017483-nascar-monster-cup-winner-2021-kyle-larson-tops-final-chase-standings-and-grid","c263352413bfac1c62fda09767ddc8050821e90c09a6f88ecfc4ac60037d0aa8","92179426166fbaa96375540e1ea3b2f6"
"Report: Blazers' Investigation of Neil Olshey for Alleged Bullying Expanded, Extended","Bleacher Report","The law firm investigating the Portland Trail Blazers' workplace culture under general manager Neil Olshey is widening the scope of its inquiry, according to...","2021-11-08 10:00:45","Sports","https://bleacherreport.com/articles/10017515-report-blazers-investigation-of-neil-olshey-for-alleged-bullying-expanded-extended","c263352413bfac1c62fda09767ddc8050821e90c09a6f88ecfc4ac60037d0aa8","88d29d4694996c7ae1d87ba80200f570"
"Ryan Tannehill, Titans Beat Matthew Stafford, Rams in 1st Game Without Derrick Henry","Bleacher Report","Life without Derrick Henry may not be as difficult for the Tennessee Titans as some envisioned. The Titans improved to 7-2 with a 28-16 victory over the Los...","2021-11-08 09:33:02","Sports","https://bleacherreport.com/articles/10017480-ryan-tannehill-titans-beat-matthew-stafford-rams-in-1st-game-without-derrick-henry","c263352413bfac1c62fda09767ddc8050821e90c09a6f88ecfc4ac60037d0aa8","ef7e0d1114f9f31aaaca4f238497561a"
"Report: Coaches Todd Grantham, John Hevesy Fired by Florida after South Carolina Loss","Bleacher Report","The Florida Gators football program has reportedly fired defensive coordinator Todd Grantham and offensive line coach John Hevesy, sources told ESPN's ","2021-11-08 09:14:55","Sports","https://bleacherreport.com/articles/10017513-report-coaches-todd-grantham-john-hevesy-fired-by-florida-after-south-carolina-loss","c263352413bfac1c62fda09767ddc8050821e90c09a6f88ecfc4ac60037d0aa8","ee6cb24c6790f5492088cbf2fb56ed6b"
"Adrian Peterson Gives Father Game Jersey from 1st Game with Titans After Win vs. Rams","Bleacher Report","Tennessee Titans running back Adrian Peterson gave his game-used jersey from Sunday's 28-16 victory over the Los Angeles Rams to his father. The future Hall of...","2021-11-08 10:54:36","Sports","https://bleacherreport.com/articles/10017521-adrian-peterson-gives-father-game-jersey-from-1st-game-with-titans-after-win-vs-rams","c263352413bfac1c62fda09767ddc8050821e90c09a6f88ecfc4ac60037d0aa8","99b0b0bcfd6a9b9ff8362247f87d846a"
"Without Derrick Henry, Tennessee Titans Discover New Identity as Defensive Force","Bleacher Report","The Tennessee Titans lost the heart and soul of their team when running back Derrick Henry suffered what could very well be a season-ending broken foot.    No problem...","2021-11-08 10:48:11","Sports","https://bleacherreport.com/articles/2950239-without-derrick-henry-tennessee-titans-discover-new-identity-as-defensive-force","c263352413bfac1c62fda09767ddc8050821e90c09a6f88ecfc4ac60037d0aa8","68c87ed4672c8fbefa7cb12819e27c2d"
"A.J. Brown Calls out Rams' Jalen Ramsey: 'He Has My Number If He Wants to See Me'","Bleacher Report","The Tennessee Titans earned a 28-16 win over the Los Angeles Rams on Sunday night. Titans star wide receiver A.J. Brown got into it with Rams All-Pro...","2021-11-08 10:18:30","Sports","https://bleacherreport.com/articles/10017518-aj-brown-calls-out-rams-jalen-ramsey-he-has-my-number-if-he-wants-to-see-me","c263352413bfac1c62fda09767ddc8050821e90c09a6f88ecfc4ac60037d0aa8","07b44f66aed0c182b0bb83a88c0b10b0"
"Deshaun Watson Trade Rumors: Multiple Teams Offered 3 1st-Round Picks at Deadline","Bleacher Report","Multiple teams were willing to send three first-round picks to the Houston Texans in a trade for Deshaun Watson, according to ","2021-11-08 10:15:43","Sports","https://bleacherreport.com/articles/10017517-deshaun-watson-trade-rumors-multiple-teams-offered-3-1st-round-picks-at-deadline","c263352413bfac1c62fda09767ddc8050821e90c09a6f88ecfc4ac60037d0aa8","5eef711741bba16aaadba9582d66103c"
"Rutgers WBB HC C. Vivian Stringer to Sit out 2021-22 Season amid COVID-19 Concerns","Bleacher Report","Rutgers women's basketball coach C. Vivian Stringer will miss the 2021-22 season with continued concerns about the COVID-19 pandemic. Stringer ","2021-11-09 06:44:42","Sports","https://bleacherreport.com/articles/10017599-rutgers-wbb-hc-c-vivian-stringer-to-sit-out-2021-22-season-amid-covid-19-concerns","c263352413bfac1c62fda09767ddc8050821e90c09a6f88ecfc4ac60037d0aa8","ef4675ca5aa8cf02eecd682cfa656d74"
"Capitals' Alex Ovechkin Ties Brett Hull for 4th Place on NHL's All-Time Goals List","Bleacher Report","Washington Capitals star Alex Ovechkin continues to work his way up the NHL record books. With a goal in the second period of Monday's game against the Buffalo...","2021-11-09 06:43:57","Sports","https://bleacherreport.com/articles/10017600-capitals-alex-ovechkin-ties-brett-hull-for-4th-place-on-nhls-all-time-goals-list","c263352413bfac1c62fda09767ddc8050821e90c09a6f88ecfc4ac60037d0aa8","519fbd1da44956a6bf3be3da4265c7ce"
"Mother of HS Player Assaulted by Brad Aldrich Calls Kyle Beach 'So Courageous'","Bleacher Report","The mother of a former high school hockey player whom Brad Aldrich sexually assaulted in 2013 called former Chicago Blackhawks player Kyle Beach so...","2021-11-09 06:42:43","Sports","https://bleacherreport.com/articles/10017592-mother-of-hs-player-assaulted-by-brad-aldrich-calls-kyle-beach-so-courageous","c263352413bfac1c62fda09767ddc8050821e90c09a6f88ecfc4ac60037d0aa8","c2c9f39dadf980663380eb97f25b9d2b"
"Pete Carroll on If Odell Beckham Jr. Will Be Claimed by Seahawks: 'You'll See'","Bleacher Report","After being officially placed on waivers by the Cleveland Browns on Monday, Odell Beckham Jr.'s next destination is not yet known. But one team may have...","2021-11-09 06:34:13","Sports","https://bleacherreport.com/articles/10017598-pete-carroll-on-if-odell-beckham-jr-will-be-claimed-by-seahawks-youll-see","c263352413bfac1c62fda09767ddc8050821e90c09a6f88ecfc4ac60037d0aa8","37938009dab27163ae910096da0e64ae"
"BBWAA Awards 2021: Full List of Finalists Announced and Reaction","Bleacher Report","The Atlanta Braves are still basking in their World Series glory, but soon the spotlight will shine on the top individual performers in MLB across the 2021...","2021-11-09 06:04:59","Sports","https://bleacherreport.com/articles/10017587-bbwaa-awards-2021-full-list-of-finalists-announced-and-reaction","c263352413bfac1c62fda09767ddc8050821e90c09a6f88ecfc4ac60037d0aa8","2dc058db2f33d845852fc9321c54c16e"
"Scottie Pippen Talks Michael Jordan, Kobe Bryant, More in GQ Interview","Bleacher Report","Scottie Pippen joined GQ's Tyler Tynes for an extensive interview prior to the...","2021-11-09 05:35:07","Sports","https://bleacherreport.com/articles/10017591-scottie-pippen-talks-michael-jordan-kobe-bryant-more-in-gq-interview","c263352413bfac1c62fda09767ddc8050821e90c09a6f88ecfc4ac60037d0aa8","f01aa33fe96bd7f77a5fc8cb30b28a7c"
"WWE Raw Results: Winners, Grades, Reaction and Highlights from November 8","Bleacher Report","Just 13 days before Survivor Series, WWE Raw hit the USA Network airwaves with a show headlined by Kevin Owens vs. Seth Rollins as the familiar foes reignited a rivalry that saw them do battle on wrestling's grandest stage in 2020...","2021-11-09 05:30:00","Sports","https://bleacherreport.com/articles/2950269-wwe-raw-results-winners-grades-reaction-and-highlights-from-november-8","c263352413bfac1c62fda09767ddc8050821e90c09a6f88ecfc4ac60037d0aa8","fe355c97125dd000711f5d73341415b7"
"MLB Rumors: Nick Castellanos, Michael Conforto Decline $18.4M Qualifying Offers","Bleacher Report","New York Mets outfielder Michael Conforto and Cincinnati Reds outfielder Nick Castellanos were among the 14 free agents to receive an $18.4 million qualifying...","2021-11-09 05:12:18","Sports","https://bleacherreport.com/articles/10017590-mlb-rumors-nick-castellanos-michael-conforto-decline-184m-qualifying-offers","c263352413bfac1c62fda09767ddc8050821e90c09a6f88ecfc4ac60037d0aa8","efb378fb9fe0c7ecc7e0ef96ed9a9cc9"
"Steelers' Najee Harris Helps Renovate Homeless Shelter Where His Family Once Lived","Bleacher Report","Pittsburgh Steelers rookie running back Najee Harris has burst onto the scene this year, but what he's done off the field has been even more impressive. Harris...","2021-11-09 04:37:53","Sports","https://bleacherreport.com/articles/10017588-steelers-najee-harris-helps-renovate-homeless-shelter-where-his-family-once-lived","c263352413bfac1c62fda09767ddc8050821e90c09a6f88ecfc4ac60037d0aa8","2bf09ff8bb10b6072cd9dc898b88f4d4"
"Giants News: Jason Garrett Will Remain Offensive Play-Caller amid NYG's 3-6 Start","Bleacher Report","Through nine games, the New York Giants are averaging under 20 points. However, despite a 3-6 record, Giants offensive coordinator Jason Garrett will remain...","2021-11-09 08:57:37","Sports","https://bleacherreport.com/articles/10017609-giants-news-jason-garrett-will-remain-offensive-play-caller-amid-nygs-3-6-start","c263352413bfac1c62fda09767ddc8050821e90c09a6f88ecfc4ac60037d0aa8","876bbda748310e0881d37fc1404d2770"
"Becky Lynch vs. Liv Morgan Set for WWE Raw Women's Title Match","Bleacher Report","Liv Morgan won a Fatal 5-Way match to become the No. 1 contender for Raw Women's Champion Becky Lynch. Morgan outlasted Carmella, Bianca Belair, Rhea Ripley...","2021-11-09 08:43:02","Sports","https://bleacherreport.com/articles/10017607-becky-lynch-vs-liv-morgan-set-for-wwe-raw-womens-title-match","c263352413bfac1c62fda09767ddc8050821e90c09a6f88ecfc4ac60037d0aa8","ce0fa0b2d98ff1d5fbd697858e187de7"
"Vanessa Bryant's Attorneys Seek Sanctions Against L.A. County Over Destroyed Evidence","Bleacher Report","Attorneys for Vanessa Bryant are asking a federal court to sanction Los Angeles County in connection to first responders destroying photos of the crash that...","2021-11-09 08:42:08","Sports","https://bleacherreport.com/articles/10017606-vanessa-bryants-attorneys-seek-sanctions-against-la-county-over-destroyed-evidence","c263352413bfac1c62fda09767ddc8050821e90c09a6f88ecfc4ac60037d0aa8","49b165f73c35a6f264fcff0b88c158ee"
"Nuggets’ Nikola Jokic Ejected After Shoving Markieff Morris; Heat PF Also Tossed","Bleacher Report","The end of Monday's Miami Heat vs. Denver Nuggets game was mired by a confrontation between Heat forward Markieff Morris and Nuggets center Nikola Jokic. After...","2021-11-09 10:01:43","Sports","https://bleacherreport.com/articles/10017613-nuggets-nikola-jokic-ejected-after-shoving-markieff-morris-heat-pf-also-tossed","c263352413bfac1c62fda09767ddc8050821e90c09a6f88ecfc4ac60037d0aa8","5b769a7dd7057df23e25fc1330fb14ef"
"Ben Roethlisberger, Steelers Edge Justin Fields, Bears on Chris Boswell's GW FG","Bleacher Report","The Pittsburgh Steelers are rolling. Pittsburgh extended its winning streak to four in dramatic fashion with a 29-27 victory over the Chicago Bears in Monday's...","2021-11-09 09:37:26","Sports","https://bleacherreport.com/articles/10017594-ben-roethlisberger-steelers-edge-justin-fields-bears-on-chris-boswells-gw-fg","c263352413bfac1c62fda09767ddc8050821e90c09a6f88ecfc4ac60037d0aa8","a95a56e1dd2aa83e09060591e274b5d4"
"Report: Packers' Aaron Rodgers 'Very Unhappy' with Criticism of Vaccination Comments","Bleacher Report","Green Bay Packers star Aaron Rodgers was apparently taken aback by the reaction to his comments about not receiving the COVID-19 vaccine. People's ","2021-11-09 09:14:26","Sports","https://bleacherreport.com/articles/10017610-report-packers-aaron-rodgers-very-unhappy-with-criticism-of-vaccination-comments","c263352413bfac1c62fda09767ddc8050821e90c09a6f88ecfc4ac60037d0aa8","589e3260f7e5458872639177a65ed1bf"
"Don't Be Fooled by 5-3 Record, Ben Roethlisberger and Pittsburgh Steelers Stink","Bleacher Report","A win is a win. But not all wins should be treated the same.   The fact of the matter is the  Pittsburgh Steelers  were forced to hold their collective breaths as the  Chicago Bears ...","2021-11-09 11:00:11","Sports","https://bleacherreport.com/articles/2950274-dont-be-fooled-by-5-3-record-ben-roethlisberger-and-pittsburgh-steelers-stink","c263352413bfac1c62fda09767ddc8050821e90c09a6f88ecfc4ac60037d0aa8","2e0a3a44dda6270905f45ee9bbd7ab59"
"Lakers' Rajon Rondo Ejected for Flagrant-2 Foul on Hornets' Terry Rozier","Bleacher Report","Rajon Rondo's day came to an early end Monday. The Los Angeles Lakers guard was ejected from the game against the Charlotte Hornets for a flagrant foul. He...","2021-11-09 10:56:44","Sports","https://bleacherreport.com/articles/10017619-lakers-rajon-rondo-ejected-for-flagrant-2-foul-on-hornets-terry-rozier","c263352413bfac1c62fda09767ddc8050821e90c09a6f88ecfc4ac60037d0aa8","bb8a9bbb0541d088c58fdf4de5550936"
"Stephen Curry Drops 50 Points, 10 Assists in Warriors’ Win over Hawks","Bleacher Report","The Golden State Warriors might just be back, and they have a familiar face leading the way. Stephen Curry dropped 50 points while leading his team to a...","2021-11-09 10:53:57","Sports","https://bleacherreport.com/articles/10017618-stephen-curry-drops-50-points-10-assists-in-warriors-win-over-hawks","c263352413bfac1c62fda09767ddc8050821e90c09a6f88ecfc4ac60037d0aa8","e556c965725fbfebd368f4f1bc4d6597"
"Erik Spoelstra: Nikola Jokic's Shove on Markieff Morris Was 'Dangerous, Dirty Play'","Bleacher Report","Erik Spoelstra was not happy with Denver Nuggets big man Nikola Jokic after Monday's game. Jokic knocked Markieff Morris to the ground with a blindside hit...","2021-11-09 10:23:58","Sports","https://bleacherreport.com/articles/10017616-erik-spoelstra-nikola-jokics-shove-on-markieff-morris-was-dangerous-dirty-play","c263352413bfac1c62fda09767ddc8050821e90c09a6f88ecfc4ac60037d0aa8","c90383baa8b3085974d043cd40af776d"
"Anthony Davis, Carmelo Anthony, Lakers Hold Off LaMelo Ball, Hornets in OT","Bleacher Report","The Los Angeles Lakers stopped a two-game skid on Monday with a 126-123 overtime win at home over the Charlotte Hornets. Anthony Davis led the team with 32...","2021-11-09 11:29:05","Sports","https://bleacherreport.com/articles/10017589-anthony-davis-carmelo-anthony-lakers-hold-off-lamelo-ball-hornets-in-ot","c263352413bfac1c62fda09767ddc8050821e90c09a6f88ecfc4ac60037d0aa8","6b1a4ac1f8f701b5452c04ab52ccebf3"
"College Football Playoff Rankings 2021: Week 11 Top 25 Poll Twitter Reaction","Bleacher Report","Head-to-head wins matter to the  College Football Playoff  committee, or do they?    The second rankings release of the season left everyone's minds in a pretzel because of the configuration of four members of the top seven...","2021-11-10 08:05:21","Sports","https://bleacherreport.com/articles/2950298-college-football-playoff-rankings-2021-week-11-top-25-poll-twitter-reaction","c263352413bfac1c62fda09767ddc8050821e90c09a6f88ecfc4ac60037d0aa8","44bdec4de22998af7b09025ca0d001b9"
"Giannis Dominant as Bucks Outlast Depleted 76ers 118-109","Bleacher Report","After two straight losses, the Milwaukee Bucks got back on track Tuesday night with a 118-109 win over the Philadelphia 76ers at Wells Fargo Center to improve...","2021-11-10 07:57:16","Sports","https://bleacherreport.com/articles/10017688-giannis-dominant-as-bucks-outlast-depleted-76ers-118-109","c263352413bfac1c62fda09767ddc8050821e90c09a6f88ecfc4ac60037d0aa8","f835a1f1588b5dd9e858769319daf3e4"
"Nuggets' Nikola Jokic Suspended 1 Game, Markieff Morris Fined $50K for Altercation","Bleacher Report","Reigning NBA MVP Nikola Jokic will has been disciplined by the league for his actions against Markieff Morris in Monday's game against the Miami Heat. ...","2021-11-10 07:55:02","Sports","https://bleacherreport.com/articles/10017669-nuggets-nikola-jokic-suspended-1-game-markieff-morris-fined-50k-for-altercation","c263352413bfac1c62fda09767ddc8050821e90c09a6f88ecfc4ac60037d0aa8","bb25a2aca6e0158426873696f67930b2"
"College Football Playoff Projections: Week 11 Rankings and Bowl Forecast","Bleacher Report","Tucked in between a pair of college basketball games, we got a new batch of College Football Playoff rankings on Tuesday night, and the new Top Four is Georgia, Alabama, Oregon and Ohio State, in that order...","2021-11-10 07:48:29","Sports","https://bleacherreport.com/articles/2950223-college-football-playoff-projections-week-11-rankings-and-bowl-forecast","c263352413bfac1c62fda09767ddc8050821e90c09a6f88ecfc4ac60037d0aa8","cbd7ff5b94e4ded77cc30a7d56cbe703"
"College Football Playoff 2021: Predicting Final Four After Week 11 Rankings","Bleacher Report","The path to the  College Football Playoff  has not changed for any of the top title contenders in the FBS.    Even with the Michigan State Spartans' drop from No. 3 on Tuesday night, the route is clear for everyone at the top of the latest rankings...","2021-11-10 07:38:45","Sports","https://bleacherreport.com/articles/2950296-college-football-playoff-2021-predicting-final-four-after-week-11-rankings","c263352413bfac1c62fda09767ddc8050821e90c09a6f88ecfc4ac60037d0aa8","83b46407db4ddda98d6f3eaceec74290"
"College Football Playoff Rankings 2021: Official Committee's List Ahead of Week 11","Bleacher Report","Another week, another set of clues about who might ultimately make this year's College Football Playoff.  One pretty major upset shook up the rankings,...","2021-11-10 07:30:24","Sports","https://bleacherreport.com/articles/10017704-college-football-playoff-rankings-2021-official-committees-list-ahead-of-week-11","c263352413bfac1c62fda09767ddc8050821e90c09a6f88ecfc4ac60037d0aa8","90d093e1099ecd0f2ff5189f48398ba5"
"Markieff Morris Ruled out for Heat vs. Lakers with Whiplash After Jokic Altercation","Bleacher Report","Miami Heat forward Markieff Morris will miss his team's road game against the Los Angeles Lakers on Wednesday due to whiplash, per ","2021-11-10 07:23:20","Sports","https://bleacherreport.com/articles/10015869-markieff-morris-ruled-out-for-heat-vs-lakers-with-whiplash-after-jokic-altercation","c263352413bfac1c62fda09767ddc8050821e90c09a6f88ecfc4ac60037d0aa8","56ad09887cf159216f65c9b53127685c"
