"Report: PGA Tour Planning International Team-Oriented Events with Guaranteed Money","Bleacher Report","The PGA Tour is planning on staging a series of international events featuring the game's biggest stars beginning in 2023 or 2024, per an exclusive...","2021-11-12 05:13:32","Sports","https://bleacherreport.com/articles/10017933-report-pga-tour-planning-international-team-oriented-events-with-guaranteed-money","c263352413bfac1c62fda09767ddc8050821e90c09a6f88ecfc4ac60037d0aa8","08fe573ec16b61542db5d5476c5b009a"
"Ranking the 7 Best WR Trios of the 2021 NFL Season","Bleacher Report","On Thursday, the Los Angeles Rams made the latest in a series of win-now moves for the 2021 season. This one, though, didn't involve a trade, as the Rams  signed  free-agent wide receiver  Odell Beckham Jr...","2021-11-12 10:13:42","Sports","https://bleacherreport.com/articles/2950355-ranking-the-7-best-wr-trios-of-the-2021-nfl-season","c263352413bfac1c62fda09767ddc8050821e90c09a6f88ecfc4ac60037d0aa8","6caf28d7cb5e9fa65a0dea44070dcb87"
"NBA Rumors: Latest Buzz on Ben Simmons Trade Talks, Jaylen Brown, John Wall","Bleacher Report","A trio of NBA All-Stars—past and present—recently took a spin on the perpetually moving rumor mill.   One has been a constant there for months: Ben Simmons, who is anxiously awaiting a trade away from the Philadelphia 76ers...","2021-11-12 19:00:07","Sports","https://bleacherreport.com/articles/2950368-nba-rumors-latest-buzz-on-ben-simmons-trade-talks-jaylen-brown-john-wall","c263352413bfac1c62fda09767ddc8050821e90c09a6f88ecfc4ac60037d0aa8","52fc9446b7a94e8fd0b87705bd5b8f4d"
"Eagles' Rooting Guide for 2021 NFL Draft Implications of Week 10","Bleacher Report","The future of the  Philadelphia Eagles  franchise lies in the 2022  NFL  draft.   Sure, the coaches and front office can't afford to look too far ahead and would like to see progress made with the players on the roster right now...","2021-11-12 19:00:05","Sports","https://bleacherreport.com/articles/2950346-eagles-rooting-guide-for-2021-nfl-draft-implications-of-week-10","c263352413bfac1c62fda09767ddc8050821e90c09a6f88ecfc4ac60037d0aa8","d4e7e6a0dd3ed8069427d791c9ac9abc"
"Giants' Rooting Guide for 2021 NFL Draft Implications of Week 10","Bleacher Report","The  New York Giants  will sit back in Week 10 and hope their draft stock improves through a few wins from teams projected to pick around them.    Entering Sunday, the Giants have the No...","2021-11-12 19:00:05","Sports","https://bleacherreport.com/articles/2950377-giants-rooting-guide-for-2021-nfl-draft-implications-of-week-10","c263352413bfac1c62fda09767ddc8050821e90c09a6f88ecfc4ac60037d0aa8","2c8d44339507f357119c82bb9072e0bd"
"3 Takeaways from Ravens' Week 10 Loss","Bleacher Report","Many people probably did not expect Week 10 of the  NFL  season to begin like this. And that's because the  Baltimore Ravens  did not look anywhere near their best on Thursday night...","2021-11-12 19:00:04","Sports","https://bleacherreport.com/articles/2950371-3-takeaways-from-ravens-week-10-loss","c263352413bfac1c62fda09767ddc8050821e90c09a6f88ecfc4ac60037d0aa8","4eab410526635a02fe622913d92a214a"
"MLB Rumors: Latest on Bryan Reynolds Trade Buzz, New York Yankees and More","Bleacher Report","The 2021 Major League Baseball offseason is beginning to heat up, at least in terms of the rumor mill.   While the free-agent and trade markets are officially open, some parties will ...","2021-11-12 20:00:04","Sports","https://bleacherreport.com/articles/2950378-mlb-rumors-latest-on-bryan-reynolds-trade-buzz-new-york-yankees-and-more","c263352413bfac1c62fda09767ddc8050821e90c09a6f88ecfc4ac60037d0aa8","5748d17dc9a94269205680461aeec48a"
"Fantasy Football Week 10 Rankings: Projections for Players with Matchups We Love","Bleacher Report","Matchups may not be the first thing that comes to mind when thinking of the top-tier talents in fantasy football...","2021-11-12 20:00:03","Sports","https://bleacherreport.com/articles/2950358-fantasy-football-week-10-rankings-projections-for-players-with-matchups-we-love","c263352413bfac1c62fda09767ddc8050821e90c09a6f88ecfc4ac60037d0aa8","5495efa7acf986fc1a6d4f1b7ae76508"
"MLB Rumors: Corey Seager, Marcus Semien Could Sign Contracts Soon","Bleacher Report","Corey Seager and Marcus Semien, two ofthe top players on the MLB free-agent market, are reportedly increasingly likely to sign contracts before a...","2021-11-12 19:42:53","Sports","https://bleacherreport.com/articles/10017967-mlb-rumors-corey-seager-marcus-semien-could-sign-contracts-soon","c263352413bfac1c62fda09767ddc8050821e90c09a6f88ecfc4ac60037d0aa8","668dd4a808638ef13ff2780ba586286a"
"World Cup Qualifying: Players to Watch and Predictions for USA vs. Mexico","Bleacher Report","The United States vs. Mexico in World Cup qualifying. It doesn't get much better than this in our part of the world, and this latest installment should give us plenty to analyze as ...","2021-11-12 19:39:03","Sports","https://bleacherreport.com/articles/2950360-world-cup-qualifying-players-to-watch-and-predictions-for-usa-vs-mexico","c263352413bfac1c62fda09767ddc8050821e90c09a6f88ecfc4ac60037d0aa8","c517ef4b07a96f2683d6819574cb6808"
"Lakers Rumors: Latest Buzz on LeBron James' Recovery from Abdominal Injury","Bleacher Report","LeBron James  is getting closer to returning from the abdominal injury that has caused him to miss the  Los Angeles Lakers ' past four games. However, he isn't quite ready to come back yet...","2021-11-12 21:00:00","Sports","https://bleacherreport.com/articles/2950370-lakers-rumors-latest-buzz-on-lebron-james-recovery-from-abdominal-injury","c263352413bfac1c62fda09767ddc8050821e90c09a6f88ecfc4ac60037d0aa8","e99594bfa00734c3e0b836498f3cd403"
"Jets' Mike White on NFL Draft Position: If You Ask Me, I Should Have Been 1st Pick","Bleacher Report","New York Jets quarterback Mike White, afifth-round pick by the Dallas Cowboys in the 2018 NFL draft, isn'tsure why he didn't generate more respect as a...","2021-11-12 20:57:31","Sports","https://bleacherreport.com/articles/10017972-jets-mike-white-on-nfl-draft-position-if-you-ask-me-i-should-have-been-1st-pick","c263352413bfac1c62fda09767ddc8050821e90c09a6f88ecfc4ac60037d0aa8","6b63917adbd042e8931092bf7b90e3dd"
"Seahawks' Russell Wilson Says Finger Injury Didn't Cause Struggles vs. Packers","Bleacher Report","In his return from a three-game absence because of surgery on his middle finger, Seattle Seahawks quarterback Russell Wilson didn't look like his usual self in...","2021-11-15 07:40:58","Sports","https://bleacherreport.com/articles/10018171-seahawks-russell-wilson-says-finger-injury-didnt-cause-struggles-vs-packers","c263352413bfac1c62fda09767ddc8050821e90c09a6f88ecfc4ac60037d0aa8","8ef05b56bfc0a9c97151b7921adbd30c"
"Aaron Rodgers: 'I Feel Good' That Packers Were in the Mix to Sign Odell Beckham Jr.","Bleacher Report","Before Odell Beckham Jr. chose to sign with the Los Angeles Rams, the Green Bay Packers were among the teams in final contention to land the three-time Pro...","2021-11-15 07:00:19","Sports","https://bleacherreport.com/articles/10018169-aaron-rodgers-i-feel-good-that-packers-were-in-the-mix-to-sign-odell-beckham-jr","c263352413bfac1c62fda09767ddc8050821e90c09a6f88ecfc4ac60037d0aa8","8e5f1337b21724ad7a985126a6e67d8b"
"Packers' Aaron Rodgers Says There Were 'A Lot of Emotions' in Return From COVID-19","Bleacher Report","Green Bay Packers quarterback Aaron Rodgers was emotional after helping lead his team to a 17-0 victory over the Seattle Seahawks in Sunday's game after...","2021-11-15 06:42:54","Sports","https://bleacherreport.com/articles/10018167-packers-aaron-rodgers-says-there-were-a-lot-of-emotions-in-return-from-covid-19","c263352413bfac1c62fda09767ddc8050821e90c09a6f88ecfc4ac60037d0aa8","3c9511e9243a92e6497880d9a892b065"
"Teddy Bridgewater Explains Not Making Play on Darius Slay's Fumble Return for TD","Bleacher Report","During the Denver Broncos' 30-13 loss to the Philadelphia Eagles on Sunday, Eagles cornerback Darius Slay had a game-changing 83-yard fumble return for a...","2021-11-15 06:09:30","Sports","https://bleacherreport.com/articles/10018163-teddy-bridgewater-explains-not-making-play-on-darius-slays-fumble-return-for-td","c263352413bfac1c62fda09767ddc8050821e90c09a6f88ecfc4ac60037d0aa8","d7a732cd97b46e8483b478e778ef545f"
"Report: Cardinals' Kyler Murray Progressing in Injury Rehab; Could Play vs. Seahawks","Bleacher Report","Arizona Cardinals quarterback Kyler Murray appears to be inching closer toward a return.  Murray is reportedly making good progress in his recovery from...","2021-11-15 06:02:22","Sports","https://bleacherreport.com/articles/10018161-report-cardinals-kyler-murray-progressing-in-injury-rehab-could-play-vs-seahawks","c263352413bfac1c62fda09767ddc8050821e90c09a6f88ecfc4ac60037d0aa8","544a2801efedcb9fa3bd38669a284403"
"Cam Newton After 2 TDs in Panthers Return: 'You Can't Even Make Up a Lie This Good'","Bleacher Report","Cam Newton was already a Carolina Panthers legend long before he decided to come back this season, but he added to his legacy with the team during Sunday's...","2021-11-15 06:02:21","Sports","https://bleacherreport.com/articles/10018160-cam-newton-after-2-tds-in-panthers-return-you-cant-even-make-up-a-lie-this-good","c263352413bfac1c62fda09767ddc8050821e90c09a6f88ecfc4ac60037d0aa8","f4ca7cbc4064cf0b224360c044c3c351"
"Week 11 Waiver Wire: Early Pickups and Breakout Fantasy Football Candidates","Bleacher Report","Among the headline fantasy football pickups for Week 11, one of the most captivating  NFL  players in history tops the list...","2021-11-15 06:00:00","Sports","https://bleacherreport.com/articles/2950440-week-11-waiver-wire-early-pickups-and-breakout-fantasy-football-candidates","c263352413bfac1c62fda09767ddc8050821e90c09a6f88ecfc4ac60037d0aa8","e7224520e89d794f6d9e36915d98f4c4"
"Bruce Arians Calls Out Bucs' Mistakes After WFT Loss: 'The Stupidity Has to Go Away'","Bleacher Report","The defending champion Tampa Bay Buccaneers suffered a surprising 29-19 loss to the Washington Football Team on Sunday. Buccaneers head coach Bruce Arians...","2021-11-15 05:45:12","Sports","https://bleacherreport.com/articles/10018158-bruce-arians-calls-out-bucs-mistakes-after-wft-loss-the-stupidity-has-to-go-away","c263352413bfac1c62fda09767ddc8050821e90c09a6f88ecfc4ac60037d0aa8","875465a5aa7ca3084b0428e27d42e942"
"DK Metcalf Ejected From Seahawks vs. Packers After Late Altercation","Bleacher Report","Seattle Seahawks wide receiver DK Metcalf was ejected from Sunday's 17-0 loss to the...","2021-11-15 05:37:19","Sports","https://bleacherreport.com/articles/10018157-dk-metcalf-ejected-from-seahawks-vs-packers-after-late-altercation","c263352413bfac1c62fda09767ddc8050821e90c09a6f88ecfc4ac60037d0aa8","876a297e368c79e87befdbd5879539e1"
"Believe It; Tom Brady and the Tampa Bay Buccaneers Are in Trouble","Bleacher Report","It's true that the  Tampa Bay Buccaneers  were just 7-5 entering the home stretch last season before going on their Super Bowl run and that they remain in even better shape at 6-3 right now...","2021-11-15 05:35:06","Sports","https://bleacherreport.com/articles/2950441-believe-it-tom-brady-and-the-tampa-bay-buccaneers-are-in-trouble","c263352413bfac1c62fda09767ddc8050821e90c09a6f88ecfc4ac60037d0aa8","0082ba684b9402666e644c808a65fd41"
"Aaron Rodgers, Packers Beat Russell Wilson, Seahawks in Rodgers' Return from COVID","Bleacher Report","Maybe you thought the return of Russell Wilson to the Seattle Seahawks and Aaron Rodgers to the Green Bay Packers would be the storyline when the two teams met...","2021-11-15 05:31:44","Sports","https://bleacherreport.com/articles/10018154-aaron-rodgers-packers-beat-russell-wilson-seahawks-in-rodgers-return-from-covid","c263352413bfac1c62fda09767ddc8050821e90c09a6f88ecfc4ac60037d0aa8","4090fc952115be63e3ef4382affd8c92"
"Phil Mickelson Matches Jack Nicklaus Feat by Winning Charles Schwab Cup Championship","Bleacher Report","Tying Jack Nicklaus in anything is quite the accomplishment, even for one of the best golfers in PGA history. Phil Mickelson pulled even with the Golden Bear...","2021-11-15 08:44:12","Sports","https://bleacherreport.com/articles/10018174-phil-mickelson-matches-jack-nicklaus-feat-by-winning-charles-schwab-cup-championship","c263352413bfac1c62fda09767ddc8050821e90c09a6f88ecfc4ac60037d0aa8","69a73778557bd0296663c5d34097e481"
"Lakers Rumors: LeBron James Could Return From Abdominal Injury 'Soon'","Bleacher Report","The Los Angeles Lakers bounced back from a demoralizing loss to the Minnesota Timberwolves with a 114-106 win to the San Antonio Spurs on Sunday. It looks like...","2021-11-15 08:31:20","Sports","https://bleacherreport.com/articles/10018173-lakers-rumors-lebron-james-could-return-from-abdominal-injury-soon","c263352413bfac1c62fda09767ddc8050821e90c09a6f88ecfc4ac60037d0aa8","ff083e7b1649c0adfef2b17d39185585"
"The Biggest Things You Might’ve Missed in NFL Week 10","Bleacher Report","Aaron Rodgers  and  Russell Wilson  have returned, the defending champs are    in trouble    and  Cam Newton  is  baaack ...","2021-11-15 09:54:22","Sports","https://bleacherreport.com/articles/2950447-the-biggest-things-you-mightve-missed-in-nfl-week-10","c263352413bfac1c62fda09767ddc8050821e90c09a6f88ecfc4ac60037d0aa8","e2695a5ae4a4c230f59a3e1ea3c7dc17"
"DeSean Jackson, Bryan Edwards' Updated Fantasy Outlook After Raiders' Loss to Chiefs","Bleacher Report","The Las Vegas Raiders suffered a 41-14 loss to the Kansas City Chiefs on Sunday night. The Raiders offense struggled to get going for much of the night. So...","2021-11-15 09:42:57","Sports","https://bleacherreport.com/articles/10018178-desean-jackson-bryan-edwards-updated-fantasy-outlook-after-raiders-loss-to-chiefs","c263352413bfac1c62fda09767ddc8050821e90c09a6f88ecfc4ac60037d0aa8","8842969da3f4b4a718be05fa5506420d"
"Patrick Mahomes Throws 5 TDs as Chiefs Blow Out Derek Carr, Raiders in AFC West Clash","Bleacher Report","Don't look now, but the Kansas City Chiefs are rounding into form. Kansas City extended its winning streak to three with a 41-14 victory over the Las Vegas...","2021-11-15 09:24:16","Sports","https://bleacherreport.com/articles/10018148-patrick-mahomes-throws-5-tds-as-chiefs-blow-out-derek-carr-raiders-in-afc-west-clash","c263352413bfac1c62fda09767ddc8050821e90c09a6f88ecfc4ac60037d0aa8","54b8900b85043916231cd17f25ac1ecb"
"Deion Sanders Apologizes for JSU-Southern Postgame Scuffle: 'We Acted Like Idiots'","Bleacher Report","Deion Sanders is not happy with the way his Jackson State team handled itself at the end of Saturday's 21-17 victory over Southern. There was a scuffle when...","2021-11-15 11:03:54","Sports","https://bleacherreport.com/articles/10018183-deion-sanders-apologizes-for-jsu-southern-postgame-scuffle-we-acted-like-idiots","c263352413bfac1c62fda09767ddc8050821e90c09a6f88ecfc4ac60037d0aa8","2579350bc10af7c39bc6073a3444b61f"
"Patrick Mahomes Is Back and the Chiefs Are Coming for the AFC","Bleacher Report","Kansas City Chiefs quarterback  Patrick Mahomes  didn't suddenly become bad at football. The former league MVP was simply waiting for the right moment to level up against the competition...","2021-11-15 10:51:13","Sports","https://bleacherreport.com/articles/2950451-patrick-mahomes-is-back-and-the-chiefs-are-coming-for-the-afc","c263352413bfac1c62fda09767ddc8050821e90c09a6f88ecfc4ac60037d0aa8","00351cb6a35a44eacb499d90abb1b90c"
"Patrick Mahomes Says Chiefs 'Got Our Swag Back' in Blowout Win Over Raiders","Bleacher Report","Perhaps the Kansas City Chiefs are held to unfair expectations because of past accomplishments and the number of game-changing playmakers on the roster, but...","2021-11-15 10:23:14","Sports","https://bleacherreport.com/articles/10018181-patrick-mahomes-says-chiefs-got-our-swag-back-in-blowout-win-over-raiders","c263352413bfac1c62fda09767ddc8050821e90c09a6f88ecfc4ac60037d0aa8","1b751d87e9e374886123665c505faf7f"
"Darrel Williams' Updated Fantasy Outlook After Massive Game for Chiefs vs. Raiders","Bleacher Report","The Kansas City Chiefs looked to be in vintage form during Sunday night's 41-14 win over the Las Vegas Raiders. Patrick Mahomes had his best game of the...","2021-11-15 10:20:24","Sports","https://bleacherreport.com/articles/10018179-darrel-williams-updated-fantasy-outlook-after-massive-game-for-chiefs-vs-raiders","c263352413bfac1c62fda09767ddc8050821e90c09a6f88ecfc4ac60037d0aa8","0e844dd74b776fe711a52e3b95116769"
"Lakers News: Latest on LeBron James Rumors, Talen Horton-Tucker's Debut, More","Bleacher Report","The  Los Angeles Lakers  haven't gotten off to the hot start for which they might have hoped. However, L.A. continues to keep its head above water without star  LeBron James , who remains out with an abdominal strain...","2021-11-15 21:00:00","Sports","https://bleacherreport.com/articles/2950471-lakers-news-latest-on-lebron-james-rumors-talen-horton-tuckers-debut-more","c263352413bfac1c62fda09767ddc8050821e90c09a6f88ecfc4ac60037d0aa8","f89a0d4eeb84000b160da47ee4a7590a"
"Rams' Odell Beckham Jr. Says Every Detail of Browns Release Was 'Crazy' to Him","Bleacher Report","After being released by the Cleveland Browns last week, Los Angeles Rams receiver Odell Beckham Jr. made his team debut Monday night against the San Francisco...","2021-11-16 07:24:40","Sports","https://bleacherreport.com/articles/10018252-rams-odell-beckham-jr-says-every-detail-of-browns-release-was-crazy-to-him","c263352413bfac1c62fda09767ddc8050821e90c09a6f88ecfc4ac60037d0aa8","f8456dae2c98ca3823ae055e05b1cdb4"
"Knicks' Mitchell Robinson Ruled Out vs. Pacers with Ankle Injury","Bleacher Report","New York Knicks center Mitchell Robinson was ruled out for the remainder of Monday's...","2021-11-16 07:24:27","Sports","https://bleacherreport.com/articles/10016476-knicks-mitchell-robinson-ruled-out-vs-pacers-with-ankle-injury","c263352413bfac1c62fda09767ddc8050821e90c09a6f88ecfc4ac60037d0aa8","465687b84c8bad539f0c77374144e1fe"
"Liberty's Asia Durr Cleared to Play After Missing 2 Seasons Because of COVID-19","Bleacher Report","New York Liberty star Asia Durr announced Monday on Instagram Live she has been cleared to return to the WNBA. The 5'10 guard has missed the past two seasons...","2021-11-16 05:47:15","Sports","https://bleacherreport.com/articles/10018248-libertys-asia-durr-cleared-to-play-after-missing-2-seasons-because-of-covid-19","c263352413bfac1c62fda09767ddc8050821e90c09a6f88ecfc4ac60037d0aa8","bd71dc2c1f5ea50145850609bc89b004"
"WWE Raw Results: Winners, Grades, Reaction and Highlights from November 15","Bleacher Report","Welcome to Bleacher Report's coverage and recap of WWE Monday Night Raw.   This week's show did not have any matches advertised before the show, but  WWE.com  did give us a preview for some of the segments...","2021-11-16 05:30:02","Sports","https://bleacherreport.com/articles/2950492-wwe-raw-results-winners-grades-reaction-and-highlights-from-november-15","c263352413bfac1c62fda09767ddc8050821e90c09a6f88ecfc4ac60037d0aa8","bdfe5dda4c23c63d725fee960950fb63"
"MLB Rookies of the Year 2021: AL and NL Winners, Voting Results and Reaction","Bleacher Report","Cincinnati Reds second baseman Jonathan India and Tampa Bay Rays outfielder Randy Arozarena, as expected, were named the National League and American League...","2021-11-16 05:13:48","Sports","https://bleacherreport.com/articles/10018240-mlb-rookies-of-the-year-2021-al-and-nl-winners-voting-results-and-reaction","c263352413bfac1c62fda09767ddc8050821e90c09a6f88ecfc4ac60037d0aa8","b62e4b977b38ce98a563be38b09cbd94"
"Packers' Whitney Mercilus Reportedly Will Miss Rest of Season with Biceps Injury","Bleacher Report","The Green Bay Packers reportedly were dealt a blow to their defense. ESPN's Adam...","2021-11-16 04:34:20","Sports","https://bleacherreport.com/articles/10018244-packers-whitney-mercilus-reportedly-will-miss-rest-of-season-with-biceps-injury","c263352413bfac1c62fda09767ddc8050821e90c09a6f88ecfc4ac60037d0aa8","95970d949aa9e5d4bf7a06116a7e3bff"
"Jimmy Garoppolo, 49ers Rout Matthew Stafford, Rams in Odell Beckham Jr.'s Debut","Bleacher Report","The San Francisco 49ers may be finding their footing. San Francisco defeated the Los Angeles Rams  XX-XX in Monday's NFC West showdown at Levi's Stadium....","2021-11-16 09:07:18","Sports","https://bleacherreport.com/articles/10018247-jimmy-garoppolo-49ers-rout-matthew-stafford-rams-in-odell-beckham-jrs-debut","c263352413bfac1c62fda09767ddc8050821e90c09a6f88ecfc4ac60037d0aa8","326eb6a1b3ae8320adc309714214d474"
"Shams: Ben Simmons Fined by 76ers for Not Traveling with Team on 6-Game Road Trip","Bleacher Report","Ben Simmons has yet to rejoin the Philadelphia 76ers since ","2021-11-16 08:47:08","Sports","https://bleacherreport.com/articles/10018256-shams-ben-simmons-fined-by-76ers-for-not-traveling-with-team-on-6-game-road-trip","c263352413bfac1c62fda09767ddc8050821e90c09a6f88ecfc4ac60037d0aa8","bb90dc06c095026dfd5d440cd41f0218"
"Hockey Hall of Fame Class of 2021: Recap, Speech Highlights for Jarome Iginla, More","Bleacher Report","The Hockey Hall of Fame officially welcomed six new members. As with other sports, the COVID-19 pandemic forced Hall officials to delay the 2020 ceremony, thus...","2021-11-16 08:37:21","Sports","https://bleacherreport.com/articles/10018251-hockey-hall-of-fame-class-of-2021-recap-speech-highlights-for-jarome-iginla-more","c263352413bfac1c62fda09767ddc8050821e90c09a6f88ecfc4ac60037d0aa8","fda05e36045f4407e853d245ced833cc"
"Video: Draymond Green Trolls Peyton Manning for Being Cut by Colts on 'Manningcast'","Bleacher Report","Golden State Warriors forward Draymond Green is known as one of the best trash talkers in the NBA. So during his appearance on the Manning brothers' Monday...","2021-11-16 08:30:11","Sports","https://bleacherreport.com/articles/10018254-video-draymond-green-trolls-peyton-manning-for-being-cut-by-colts-on-manningcast","c263352413bfac1c62fda09767ddc8050821e90c09a6f88ecfc4ac60037d0aa8","8b03d3d7713b10b0715a0b8de013d9af"
"Luka Doncic Exits Mavericks' Win Over Nuggets Late After Suffering Ankle Injury","Bleacher Report","Dallas Mavericks star Luka Doncic suffered a left ankle injury with 44 seconds remaining in Monday's victory over the Denver Nuggets. ","2021-11-16 10:03:27","Sports","https://bleacherreport.com/articles/10015289-luka-doncic-exits-mavericks-win-over-nuggets-late-after-suffering-ankle-injury","c263352413bfac1c62fda09767ddc8050821e90c09a6f88ecfc4ac60037d0aa8","25427d3cdd4951e6e96dc05819497470"
"Celtics' Jayson Tatum: 'I Haven't Doubted Myself' Amid Early Shooting Struggles","Bleacher Report","Boston Celtics star Jayson Tatum isn't overly concerned about his slow shooting start this season. I haven't doubted myself—not once, he ","2021-11-16 09:37:11","Sports","https://bleacherreport.com/articles/10018262-celtics-jayson-tatum-i-havent-doubted-myself-amid-early-shooting-struggles","c263352413bfac1c62fda09767ddc8050821e90c09a6f88ecfc4ac60037d0aa8","61cbcc2aab671ec7cb0862fed327dadd"
"Austin Theory Replaces Rey Mysterio on Team Raw for 2021 WWE Survivor Series","Bleacher Report","Austin Theory found another way to antagonize the Mysterio family. WWE official Adam Pearce announced Theory will replace Rey Mysterio on Team Raw for the tag...","2021-11-16 09:36:47","Sports","https://bleacherreport.com/articles/10018261-austin-theory-replaces-rey-mysterio-on-team-raw-for-2021-wwe-survivor-series","c263352413bfac1c62fda09767ddc8050821e90c09a6f88ecfc4ac60037d0aa8","ab33f5b0a963f58c6149c5a1366f3606"
"Former Knicks G Iman Shumpert 1st NBA Player to Reach 'Dancing with the Stars' Finals","Bleacher Report","Iman Shumpert is no stranger to the NBA Finals thanks to three appearances during his time on the Cleveland Cavaliers. But he will be part of a different type...","2021-11-16 09:32:02","Sports","https://bleacherreport.com/articles/10018260-former-knicks-g-iman-shumpert-1st-nba-player-to-reach-dancing-with-the-stars-finals","c263352413bfac1c62fda09767ddc8050821e90c09a6f88ecfc4ac60037d0aa8","75b3824dd522c36743962fbb3ff1dc88"
"Report: Suns Employees to Be Granted Confidentiality in Probe of Team, Robert Sarver","Bleacher Report","Representatives from the law firm investigating Phoenix Suns managing partner Robert Sarver reached out to team employees to assure them they can receive...","2021-11-16 09:27:59","Sports","https://bleacherreport.com/articles/10018259-report-suns-employees-to-be-granted-confidentiality-in-probe-of-team-robert-sarver","c263352413bfac1c62fda09767ddc8050821e90c09a6f88ecfc4ac60037d0aa8","49d1c489591c834eaeb61ac1a3d2967a"
"NHL Commissioner Gary Bettman: What Happened to Kyle Beach in 2010 Was 'Unacceptable'","Bleacher Report","NHL Commissioner Gary Bettman took a moment during Monday's Hockey Hall of Fame ceremony to reflect on Kyle Beach and the sexual assault allegations he...","2021-11-16 09:15:54","Sports","https://bleacherreport.com/articles/10018257-nhl-commissioner-gary-bettman-what-happened-to-kyle-beach-in-2010-was-unacceptable","c263352413bfac1c62fda09767ddc8050821e90c09a6f88ecfc4ac60037d0aa8","80938525b1b4afdc33a153dd0d2fbcc3"
"Cavaliers' Evan Mobley Diagnosed With Elbow Sprain After Suffering Injury vs. Celtics","Bleacher Report","Cleveland Cavaliers big man Evan Mobley suffered a right elbow sprain during the third quarter of Monday's loss to the Boston Celtics, per ","2021-11-16 09:15:09","Sports","https://bleacherreport.com/articles/10016529-cavaliers-evan-mobley-diagnosed-with-elbow-sprain-after-suffering-injury-vs-celtics","c263352413bfac1c62fda09767ddc8050821e90c09a6f88ecfc4ac60037d0aa8","0dc3b40c926a37c0bd6c39da81aaca39"
