"SpaceX launches 53 Starlink internet satellites and lands rocket in foggy flight","Space.com","SpaceX launched its second rocket this week, this time carrying 53 Starlink satellites into orbit and landing a rocket on Saturday (Nov. 13).","2021-11-13 13:48:57","Science","https://www.space.com/spacex-starlink-satellites-launch-rocket-landing-november-2021","c2edd5eb4423abe382cba6f22ae12facdd16af369efc72723ae933dfd41d97c8","ad5c7dc3b1c1c487b05e9e6dbdae5235"
"Watch live! SpaceX delays Starlink internet satellite launch to weekend","Space.com","A SpaceX Falcon 9 rocket will launch a new fleet of Starlink internet satellites will launch Saturday, Nov. 13, and you can watch it live here.","2021-11-13 12:15:35","Science","https://www.space.com/17933-nasa-television-webcasts-live-space-tv.html","c2edd5eb4423abe382cba6f22ae12facdd16af369efc72723ae933dfd41d97c8","09d0cfca01d25cc354176679959b902c"
"Don't miss the longest partial lunar eclipse of the century next week","Space.com","This eclipse will be the longest one of the century, and of the past 580 years.","2021-11-13 12:04:01","Science","https://www.space.com/longest-partial-lunar-eclipse-november-2021","c2edd5eb4423abe382cba6f22ae12facdd16af369efc72723ae933dfd41d97c8","9876d3e883a89a58d59647fd6425c1ed"
"The Beaver Moon lunar eclipse on Nov. 19 will be the longest of the century. Here are its stages explained.","Space.com","Here are the stages of the Beaver Moon lunar eclipse of Nov. 19, which will be the longest lunar eclipse this century.","2021-11-15 10:50:50","Science","https://www.space.com/beaver-moon-lunar-eclipse-longest-of-century-phases","c2edd5eb4423abe382cba6f22ae12facdd16af369efc72723ae933dfd41d97c8","735296bd89e74f118bf3265e85619612"
"'Doughnut UFO' over Switzerland defies explanation","Space.com","A photographer in Zurich, Switzerland, spotted the glowing object while four SpaceX astronauts returned to Earth thousands of miles away.","2021-11-15 10:42:35","Science","https://www.space.com/switzerland-doughnut-ufo-defies-explanation","c2edd5eb4423abe382cba6f22ae12facdd16af369efc72723ae933dfd41d97c8","6ed73136276b6ca7ea4e85e0320f4a3b"
"If an asteroid really threatened the Earth, what would a planetary defense mission look like?","Space.com","Someday, tucked away gathering dust in a nondescript warehouse, there will perhaps be a spacecraft waiting to be called to the launch pad, even as its builders pray it never flies.","2021-11-15 10:29:57","Science","https://www.space.com/earth-asteroid-planetary-defense-dart-mission-reality","c2edd5eb4423abe382cba6f22ae12facdd16af369efc72723ae933dfd41d97c8","1e96e93d07672aefce5bd2ea1a07c4e3"
"On This Day in Space! Nov. 15, 1988: Green Bank's 300-Foot Telescope Collapses","Space.com","On Nov. 15, 1988, a 300-foot radio telescope in Green Bank, West Virginia suddenly collapsed. See how it happened in our On This Day In Space series.","2021-11-15 11:39:26","Science","https://www.space.com/39251-on-this-day-in-space.html","c2edd5eb4423abe382cba6f22ae12facdd16af369efc72723ae933dfd41d97c8","13edbfa2e53869b8e352cff28ac28b1d"
"Best VR space games","Space.com","Strap in and prepare to launch yourself into the best VR space games in the galaxy.","2021-11-15 11:34:08","Science","https://www.space.com/best-vr-space-games","c2edd5eb4423abe382cba6f22ae12facdd16af369efc72723ae933dfd41d97c8","416224487e53b90eb136a066dc5caaef"
"Black Friday VR headset deals: Oculus Quest 2, Valve Index, PSVR, and more","Space.com","We've been digging around for the best Black Friday VR headset deals in the runup to the big day.","2021-11-15 10:58:19","Science","https://www.space.com/vr-headset-deals","c2edd5eb4423abe382cba6f22ae12facdd16af369efc72723ae933dfd41d97c8","aab1c1621fd07471c27dd9bf80c9cc0d"
"Sony A7 III review","Space.com","The Sony A7 III is an impressive entry-level full-frame camera that offers photographers and videographers amazingly high performance for the price point","2021-11-15 12:14:28","Science","https://www.space.com/sony-a7-III-review","c2edd5eb4423abe382cba6f22ae12facdd16af369efc72723ae933dfd41d97c8","1b26419390838382e4e84572b02fbca2"
"Space debris forces astronauts on space station to take shelter in return ships","Space.com","The seven astronauts currently living and working on the International Space Station were forced to shelter in their transport vehicles when the station passed uncomfortably closed to orbital debris.","2021-11-15 15:31:17","Science","https://www.space.com/space-debris-astronauts-shelter-november-2021","c2edd5eb4423abe382cba6f22ae12facdd16af369efc72723ae933dfd41d97c8","7835b6ca9591f31d3a24bd34dcc8e525"
"Celestron TrailSeeker 8x42 binocular review","Space.com","The Celestron TrailSeeker 8x42 binocular is ideal for those after a compact binocular for astro-travel and all-round use","2021-11-15 16:48:21","Science","https://www.space.com/celestron-trailseeker-8x42-binocular-review","c2edd5eb4423abe382cba6f22ae12facdd16af369efc72723ae933dfd41d97c8","a12876d8ff77d4d71174236f9d625f8a"
"Kessler Syndrome and the space debris problem","Space.com","Here's a brief look at the Kessler Syndrome, which describes a snowballing cascade of space junk.","2021-11-15 19:18:04","Science","https://www.space.com/kessler-syndrome-space-debris","c2edd5eb4423abe382cba6f22ae12facdd16af369efc72723ae933dfd41d97c8","175177ca300d661293dea9a07a6b146e"
"Did Russia just launch an anti-satellite test that created a cloud of space junk?","Space.com","Suspicions swirl that Russia may have conducted an anti-satellite test that created the debris field that's causing astronauts on the International Space Station to seek refuge, reports suggest.","2021-11-15 18:17:47","Science","https://www.space.com/russia-asat-launch-test-space-debris-field","c2edd5eb4423abe382cba6f22ae12facdd16af369efc72723ae933dfd41d97c8","ad8fa5fc7a8d1020bb936b434b85e072"
"Black holes may be growing as the universe expands","Space.com","The hypothesis could help to explain the weird discrepancies spotted in space-time ripples from enormous black hole collisions.","2021-11-15 20:22:11","Science","https://www.space.com/black-holes-expanding-with-universe","c2edd5eb4423abe382cba6f22ae12facdd16af369efc72723ae933dfd41d97c8","2025df4bc9cb30a9ba7ec08c16e4f34b"
"Satellites discover huge amounts of undeclared methane emissions","Space.com","Huge amounts of uncounted emissions of highly warming greenhouse gas methane are being released by super-emitters, satellite observations reveal.","2021-11-15 19:56:44","Science","https://www.space.com/satellites-discover-huge-undeclared-methane-emissions","c2edd5eb4423abe382cba6f22ae12facdd16af369efc72723ae933dfd41d97c8","67f87f13e08f0e651bb9109b08cd9657"
"Russian anti-satellite test a 'dangerous and irresponsible' act that threatens astronauts, US says","Space.com","Russia conducted an anti-satellite test (ASAT), generating hundreds of thousands of pieces of debris and threatening the safety of astronauts on the International Space Station, the U.S. confirmed.","2021-11-15 21:16:51","Science","https://www.space.com/russia-asat-test-space-debris-dangerous-irresponsible","c2edd5eb4423abe382cba6f22ae12facdd16af369efc72723ae933dfd41d97c8","1b80959b7e95f95090e6ebad54322470"
"A chunk of a Chinese satellite almost hit the International Space Station. They dodged it — but the space junk problem is getting worse","Space.com","The satellite exploded into more than 3,500 pieces of debris, most of which are still orbiting.","2021-11-15 20:55:17","Science","https://www.space.com/chinese-satellite-debris-almost-hit-international-space-station","c2edd5eb4423abe382cba6f22ae12facdd16af369efc72723ae933dfd41d97c8","fc706de3bddaef82490bd6a934f79dd3"
"Leonid meteor shower: Bright fireballs in November","Space.com","The Leonids take place every year in November. Once a generation, it is possible for a storm of meteors to occur with a peak of about 1,000 an hour – or even more.","2021-11-16 00:42:04","Science","https://www.space.com/23296-leonid-meteor-shower.html","c2edd5eb4423abe382cba6f22ae12facdd16af369efc72723ae933dfd41d97c8","08d6d2e7d9bda14f65ae769078712e96"
"NASA chief Bill Nelson condemns Russian anti-satellite test","Space.com","NASA Administrator Bill Nelson has condemned a Russian anti-satellite test on Monday (Nov. 15) that put the International Space Station at risk of colliding with the resulting debris.","2021-11-16 00:36:03","Science","https://www.space.com/nasa-chief-condemns-russian-anti-satellite-test","c2edd5eb4423abe382cba6f22ae12facdd16af369efc72723ae933dfd41d97c8","910141146e19dd70b41737f0cd5509e4"
"Vega rocket will launch 3 satellites for the French military early Tuesday. Watch it live!","Space.com","The French military plans to launch three new satellites into Earth orbit early Tuesday (Nov. 16), and you can watch it live here.","2021-11-15 22:57:58","Science","https://www.space.com/arianespace-vega-rocket-ceres-satellites-launch","c2edd5eb4423abe382cba6f22ae12facdd16af369efc72723ae933dfd41d97c8","964620d202681bfac4a79caa1303ce9a"
"Journey into the making of 'Dune' with Insight Edition's 'The Art and Soul of Dune' (exclusive)","Space.com","Insight Editions delivers an exclusive look into the creative process of Denis Villeneuve's Dune.","2021-11-15 22:39:20","Science","https://www.space.com/the-art-and-soul-of-dune-movie-book","c2edd5eb4423abe382cba6f22ae12facdd16af369efc72723ae933dfd41d97c8","a0d943064f821235a97f0347caad2ada"
"Interstellar visitor 'Oumuamua wasn't a nitrogen iceberg, Harvard astrophysicists say","Space.com","The interstellar visitor 'Oumuamua might not be a nitrogen iceberg after all. But what is it?","2021-11-15 22:14:04","Science","https://www.space.com/oumuamua-not-nitrogen-iceberg","c2edd5eb4423abe382cba6f22ae12facdd16af369efc72723ae933dfd41d97c8","2f3ad7335414332ab64ce6a840211141"
"NASA will spend $93 billion on Artemis moon program by 2025, report estimates","Space.com","NASA's spending on its Artemis program of crewed lunar exploration will reach a total of $93 billion by 2025, according to a new audit by the NASA Office of Inspector General.","2021-11-15 21:59:55","Science","https://www.space.com/nasa-artemis-moon-program-93-billion-2025","c2edd5eb4423abe382cba6f22ae12facdd16af369efc72723ae933dfd41d97c8","9ac4b6f15438de4171b9f3bc48458a01"
"Arianespace Vega rocket launches 3 satellites into orbit for French military","Space.com","A Vega rocket launched three French military satellites from a South American spaceport Tuesday (Nov. 16).","2021-11-16 10:50:58","Science","https://www.space.com/arianespace-vega-rocket-ceres-satellites-launch","c2edd5eb4423abe382cba6f22ae12facdd16af369efc72723ae933dfd41d97c8","da54c62d458a44fb1fb69609a9ddf352"
"On This Day in Space! Nov. 16, 1974: Arecibo Observatory broadcasts interstellar message","Space.com","On Nov. 16, 1974, humans sent their first message to the stars in an attempt to contact extraterrestrials. See how it happened in our On This Day In Space series.","2021-11-16 11:20:26","Science","https://www.space.com/39251-on-this-day-in-space.html","c2edd5eb4423abe382cba6f22ae12facdd16af369efc72723ae933dfd41d97c8","83b17c34fdc6c50c5c7a084e48a6232e"
"FAA to wrap up SpaceX Starship environmental assessment by Dec. 31","Space.com","The U.S. Federal Aviation Administration intends to finish its environmental assessment of SpaceX's orbital launch activities at its South Texas site by Dec. 31.","2021-11-16 11:07:48","Science","https://www.space.com/faa-spacex-starship-starbase-review-deadline","c2edd5eb4423abe382cba6f22ae12facdd16af369efc72723ae933dfd41d97c8","5d679ad2b7c8336fa527dc7ace5d2bcc"
"The Orion Nebula","Space.com","The Orion Nebula (Messier 42) is the nearest star-forming region to Earth, about 1,350 light-years away. It is located in the Orion Constellation, just below Orion's Belt.","2021-11-16 11:05:09","Science","https://www.space.com/orion-nebula","c2edd5eb4423abe382cba6f22ae12facdd16af369efc72723ae933dfd41d97c8","2c4dc94230d9c08f67d8b113e03d9bca"
"NASA, ESA experts weigh in on diversity and inclusion in space","Space.com","During a panel discussion on diversity and inclusion in spaceflight, NASA and ESA experts discussed different ways they could work to become more diverse and inclusive.","2021-11-16 11:02:45","Science","https://www.space.com/spaceflight-diversity-nasa-esa","c2edd5eb4423abe382cba6f22ae12facdd16af369efc72723ae933dfd41d97c8","09fd9347638f68bed092fded877f4138"
"How many black holes are there in the universe?","Space.com","In a recent study, researchers determined that about 1% of all the normal (that is, not dark) matter in the universe is bound up inside black holes.","2021-11-16 11:01:32","Science","https://www.space.com/how-many-black-holes-universe","c2edd5eb4423abe382cba6f22ae12facdd16af369efc72723ae933dfd41d97c8","f11536b72acec28f8dbb3ca5a318e387"
"Martha Stewart helps NASA pick Deep Space Food Challenge winners","Space.com","NASA and the Canadian Space Agency have named the winners of the first Deep Space Food Challenge, a contest that sought novel food technologies.","2021-11-16 11:00:15","Science","https://www.space.com/nasa-deep-space-food-challenge_winners","c2edd5eb4423abe382cba6f22ae12facdd16af369efc72723ae933dfd41d97c8","be799d0e5efe9adf3221c7d3cb095802"
"Celestron UpClose G2 10x50 binoculars review","Space.com","Large objective lenses and 10x magnification on the Celestron UpClose G2 10x50 help these affordable binoculars appeal to anyone wanting to start stargazing.","2021-11-16 12:59:56","Science","https://www.space.com/celestron-upclose-g2-10x50-review","c2edd5eb4423abe382cba6f22ae12facdd16af369efc72723ae933dfd41d97c8","42a7f827441f23ccee1e859634924ae3"
"Black Friday Nerf gun deals","Space.com","Lock and load with awesome Black Friday Nerf gun deals, including Star wars, Halo, Fortnite blasters.","2021-11-16 14:11:30","Science","https://www.space.com/nerf-gun-deals","c2edd5eb4423abe382cba6f22ae12facdd16af369efc72723ae933dfd41d97c8","14ba9deed1f922bdd2dee1fae1bab021"
"How to stream Star Trek: Discovery in the US","Space.com","If you want to stream 'Star Trek: Discovery' in the US, you'll need a Paramount Plus subscription.","2021-11-16 15:26:08","Science","https://www.space.com/how-to-stream-star-trek-discovery","c2edd5eb4423abe382cba6f22ae12facdd16af369efc72723ae933dfd41d97c8","08ffd355109098ebe5e17ef969692c71"
"Hubble Space Telescope team continues troubleshooting instrument glitch","Space.com","The Hubble Space Telescope is on the road back from its latest glitch, but it's not close to the finish line yet.","2021-11-16 21:03:03","Science","https://www.space.com/hubble-space-telescope-glitch-troubleshooting-november-2021","c2edd5eb4423abe382cba6f22ae12facdd16af369efc72723ae933dfd41d97c8","6c5602faa2ae0f1c815add5fa074c8fe"
"Is there life at Alpha Centauri? New space telescope to seek out habitable planets around sun's neighboring star","Space.com","A new space mission announced today (Nov. 16) will look for habitable planets in the Alpha Centauri system, our closest stellar neighbors.","2021-11-16 20:58:21","Science","https://www.space.com/alpha-centauri-habitable-planets-space-telescope-toliman","c2edd5eb4423abe382cba6f22ae12facdd16af369efc72723ae933dfd41d97c8","4190e441ebb2b78ba16d2e844988320a"
"Space debris from Russian anti-satellite missile test spotted in telescope images and video","Space.com","Pieces of a shattered Russian satellite are visible in new telescope images after the country's anti-satellite weapons test on Nov. 15, 2021.","2021-11-16 20:38:02","Science","https://www.space.com/russia-anti-satellite-test-space-debris-images","c2edd5eb4423abe382cba6f22ae12facdd16af369efc72723ae933dfd41d97c8","82f0af43677553eebb046b194a91e59c"
"Leonid meteor shower 2021: When, where & how to see it","Space.com","In mid-November, the fickle Leonid meteor shower hits Earth once again. The annual shower will peak Nov. 16-17.","2021-11-16 20:20:39","Science","https://www.space.com/34500-leonid-meteor-shower-guide.html","c2edd5eb4423abe382cba6f22ae12facdd16af369efc72723ae933dfd41d97c8","a51eb3134898a5e1f6d4d4da1dd42d6e"
"The Leonid meteor shower peaks tonight! But don't expect to see much.","Space.com","The Leonids are likely to be a major disappointment in 2021, partly because of the expected lack of any significant activity, but mainly because of the full moon.","2021-11-16 20:07:56","Science","https://www.space.com/leonid-meteor-shower-2021-peaking-now","c2edd5eb4423abe382cba6f22ae12facdd16af369efc72723ae933dfd41d97c8","76b73b1492bcad2787ce341a4400ad67"
"Russia defends anti-satellite test amid US criticism","Space.com","Russia's defense ministry says there is no threat to International Space Station crews or nearby satellites","2021-11-16 19:38:06","Science","https://www.space.com/russia-defends-anti-satellite-test-amid-criticism","c2edd5eb4423abe382cba6f22ae12facdd16af369efc72723ae933dfd41d97c8","0594c4e964304accb0761a350470b3a3"
"Space debris from Russian anti-satellite test will be a safety threat for years","Space.com","Debris created by the anti-satellite missile test conducted by Russia yesterday will pose a threat to satellites in orbit as well as crews at the International Space Station for years to come.","2021-11-16 16:31:01","Science","https://www.space.com/russia-anti-satellite-test-space-debris-threat-for-years","c2edd5eb4423abe382cba6f22ae12facdd16af369efc72723ae933dfd41d97c8","361489e4d8a3aa32fbab8b10ff5849fe"
"NASA's Perseverance rover on Mars just collected its 3rd sample of the Red Planet (photos)","Space.com","The car-sized Perseverance rover drilled a core sample on Monday (Nov. 15), filling a titanium tube with Red Planet rock for the third time ever.","2021-11-17 11:47:47","Science","https://www.space.com/mars-rover-perseverance-collects-third-rock-sample","c2edd5eb4423abe382cba6f22ae12facdd16af369efc72723ae933dfd41d97c8","c5c1b86469094762416fa70297494b61"
"How the Beaver Moon lunar eclipse of Nov. 19 has shades of 1967","Space.com","Our upcoming lunar eclipse has a direct connection to an eclipse that occurred in the late 1960s.","2021-11-17 11:45:17","Science","https://www.space.com/beaver-moon-lunar-eclipse-throwback-1967","c2edd5eb4423abe382cba6f22ae12facdd16af369efc72723ae933dfd41d97c8","fa1e41f1602880d1eeb0b4b79762894e"
"Why is sci-fi so obsessed with asteroid impact disasters (and how to stop them)?","Space.com","For longer than science fiction has even existed, humans have been fascinated with (and terrified by) the prospect of space rocks falling to Earth. But why?","2021-11-17 11:43:22","Science","https://www.space.com/asteroid-impact-disasters-science-fiction-obsession","c2edd5eb4423abe382cba6f22ae12facdd16af369efc72723ae933dfd41d97c8","d9baf47e5517f880e9f3c41b62a79e16"
"DJI Mini 2 review","Space.com","The DJI Mini 2 builds on the success of the previous Mavic Mini, providing a much better video shoot quality, while retaining the straight out of the pocket flying capability.","2021-11-17 12:11:42","Science","https://www.space.com/dji-mini-2-review","c2edd5eb4423abe382cba6f22ae12facdd16af369efc72723ae933dfd41d97c8","a90577732a43a16f310f60bf726358e4"
"Smithsonian FUTURES exhibit examines space artifacts of the future","Space.com","A solar sail that tacked into the light, a keyboard used to navigate to the moon and a spacesuit-clad android are among the artifacts of the future in the new exhibit FUTURES at the Smithsonian.","2021-11-17 12:01:51","Science","https://www.space.com/smithsonian-futures-exhibit-space-artifacts","c2edd5eb4423abe382cba6f22ae12facdd16af369efc72723ae933dfd41d97c8","ab02f02569d02a22c3cfc27f63bded61"
"On This Day in Space! Nov. 17, 1967: 1st successful liftoff from lunar surface","Space.com","On Nov. 17, 1967, NASA's Surveyor 6 spacecraft made the first liftoff from the lunar surface. See how it happened in our On This Day In Space series.","2021-11-17 11:37:26","Science","https://www.space.com/39251-on-this-day-in-space.html","c2edd5eb4423abe382cba6f22ae12facdd16af369efc72723ae933dfd41d97c8","1d85abaa5841e656d5479de2543ef095"
"Best sci-fi movies based on books","Space.com","From the page to the big screen, these are the best sci-fi movies based on books.","2021-11-17 14:05:30","Science","https://www.space.com/best-sci-fi-movies-based-on-books","c2edd5eb4423abe382cba6f22ae12facdd16af369efc72723ae933dfd41d97c8","72ee7248dc56a6b1428dc6e4e30e3706"
"Valve Index review","Space.com","Valve still dominates the VR headset space with Valve Index, the most open-source and impressive virtual reality kit available.","2021-11-17 14:55:51","Science","https://www.space.com/valve-index-review","c2edd5eb4423abe382cba6f22ae12facdd16af369efc72723ae933dfd41d97c8","533113adb707d81d4ae21ba6ee674fa4"
"Best Black Friday binoculars deals for 2021","Space.com","We’ve scoured the internet to find the best Black Friday binoculars deals, with picks from the likes of Celestron, Nikon and more.","2021-11-17 17:39:38","Science","https://www.space.com/binoculars-deals-sale-discount","c2edd5eb4423abe382cba6f22ae12facdd16af369efc72723ae933dfd41d97c8","7118aac5e6830c4b94ff9b02de15b4c4"
"Lego Star Wars Razor Crest review","Space.com","If you want to replicate the Mandalorian’s struggle to keep his ship in one piece, the Lego Star Wars Razor Crest is for you.","2021-11-17 17:25:49","Science","https://www.space.com/lego-star-wars-razor-crest-75292-review","c2edd5eb4423abe382cba6f22ae12facdd16af369efc72723ae933dfd41d97c8","dcfb946555b2599a3fd2073cc2ead25e"
"Next SpaceX NASA crew launch adds rookie astronaut Jessica Watkins","Space.com","The roster for SpaceX's next NASA launch to the International Space Station is complete.","2021-11-17 17:10:46","Science","https://www.space.com/nasa-astronaut-jessica-watkins-joins-spacex-crew-4","c2edd5eb4423abe382cba6f22ae12facdd16af369efc72723ae933dfd41d97c8","c4d658d6924a2b24b3de1c6900cc984c"
"Northrop Grumman reveals plans for new astronaut moon buggy","Space.com","Aerospace giant Northrop Grumman announced on Tuesday (Nov. 16) that it's leading a private team designing a crewed moon buggy for potential use by NASA's Artemis program.","2021-11-17 17:04:18","Science","https://www.space.com/moon-buggy-nasa-artemis-program-northrop-grumman","c2edd5eb4423abe382cba6f22ae12facdd16af369efc72723ae933dfd41d97c8","3eae5da786890e696c8052f86e662518"
"Boba Fett is coming to Fortnite to celebrate 'The Book Of Boba Fett' Star Wars series on Disney Plus","Space.com","Boba Fett will drop on to the Fortnite island on Dec. 24 to mark the The Book Of Boba Fett Star Wars series on Disney Plus.","2021-11-17 18:14:51","Science","https://www.space.com/star-wars-boba-fett-fortnite-disney-plus","c2edd5eb4423abe382cba6f22ae12facdd16af369efc72723ae933dfd41d97c8","a0cf44546268aded68f71d0cdcf4b2f7"
"What time is the Beaver Moon lunar eclipse this week?","Space.com","Here's when you can watch the longest partial lunar eclipse in 580 years.","2021-11-17 19:48:14","Science","https://www.space.com/beaver-moon-lunar-eclipse-what-time","c2edd5eb4423abe382cba6f22ae12facdd16af369efc72723ae933dfd41d97c8","0cfe1fb40134d9ccf28eaff6d7736429"
"Watch live tonight! Rocket Lab to launch Electron booster and attempt recovery","Space.com","A Rocket Lab Electron booster will launch two Earth observation satellites tonight (Nov. 17) and you can watch it live online.","2021-11-17 20:09:26","Science","https://www.space.com/17933-nasa-television-webcasts-live-space-tv.html","c2edd5eb4423abe382cba6f22ae12facdd16af369efc72723ae933dfd41d97c8","5f2fdddaeeeac2b6833f219288e7b014"
"Russian anti-satellite missile test was the first of its kind","Space.com","Russia's latest anti-satellite test is unlike anything we've seen from the nation before.","2021-11-17 20:00:20","Science","https://www.space.com/russia-anti-satellite-missile-test-first-of-its-kind","c2edd5eb4423abe382cba6f22ae12facdd16af369efc72723ae933dfd41d97c8","235ecd6f7f335fa38e03bd210f07bd67"
"Beaver Moon lunar eclipse 2021: Here's how to watch it online","Space.com","If you're clouded out or too cold, we have solutions for you.","2021-11-17 19:56:51","Science","https://www.space.com/beaver-moon-lunar-eclipse-2021-webcasts","c2edd5eb4423abe382cba6f22ae12facdd16af369efc72723ae933dfd41d97c8","2c207668c6c8219b38e7b4271a1958cc"
"'The Expanse' dials the space drama up to 11 in new full trailer for Season 6","Space.com","The first full trailer for Season 6 of The Expanse has dropped and it shows an escalating, explosive and costly conflict in space.","2021-11-17 21:50:02","Science","https://www.space.com/the-expanse-season-6-full-trailer-amazon-prime","c2edd5eb4423abe382cba6f22ae12facdd16af369efc72723ae933dfd41d97c8","266a39ced17a3d4caefee0db8eeebb15"
"Elon Musk will give a SpaceX Starship update today and you can watch it live","Space.com","Elon Musk will give an update on SpaceX's new Starship rocket and you can watch it live online.","2021-11-17 21:42:52","Science","https://www.space.com/elon-musk-spacex-starship-update-webcast-2021","c2edd5eb4423abe382cba6f22ae12facdd16af369efc72723ae933dfd41d97c8","d3917f4ce58b295edea1c75600358760"
"Hear how NASA alerted astronauts to incoming space debris after Russian anti-satellite test","Space.com","Expedition 66 woke up to take shelter in their return ships following a Russian anti-satellite test.","2021-11-17 21:24:16","Science","https://www.space.com/space-station-crew-russian-space-debris-audio","c2edd5eb4423abe382cba6f22ae12facdd16af369efc72723ae933dfd41d97c8","3aba0bbfca046c8acc5274b843905cc7"
"November full moon 2021: A Beaver Moon lunar eclipse and bright planets","Space.com","November's full Beaver Moon will occur on Nov. 19 and will undergo a partial lunar eclipse.","2021-11-17 22:20:04","Science","https://www.space.com/38454-november-full-moon.html","c2edd5eb4423abe382cba6f22ae12facdd16af369efc72723ae933dfd41d97c8","92abab30b1f5f9c4b1d08ba95423da6c"
