"Amazon to launch 1st prototype internet satellites for Kuiper constellation in 2022","Space.com","Amazon aims to launch the first two prototype satellites for its huge Project Kuiper broadband constellation in 2022.","2021-11-01 20:50:14","Science","https://www.space.com/amazon-kuiper-prototype-internet-satellites-launch-2022","c2edd5eb4423abe382cba6f22ae12facdd16af369efc72723ae933dfd41d97c8","7b55429dd77ae32590853babc9e03a97"
"SpaceX's Crew-3 astronaut launch for NASA delayed by 'minor medical issue'","Space.com","SpaceX's Crew-3 astronaut launch for NASA has been delayed until at least Saturday (Nov. 6) by a minor medical issue affecting a crewmember.","2021-11-01 20:43:16","Science","https://www.space.com/spacex-crew-3-launch-astronaut-medical-issue-delay","c2edd5eb4423abe382cba6f22ae12facdd16af369efc72723ae933dfd41d97c8","fc0feb07d990cdd33a306570001dc076"
"SpaceX's Crew-3 astronaut mission for NASA: Live updates","Space.com","Read that latest news about SpaceX's Crew-3 mission to the International Space Station for NASA.","2021-11-01 20:04:10","Science","https://www.space.com/news/live/spacex-crew-dragon-mission-updates","c2edd5eb4423abe382cba6f22ae12facdd16af369efc72723ae933dfd41d97c8","c9ce511475e7fbba7883b728340f579f"
"Astronaut make zero-g tacos with 1st chile peppers grown in space. They look delicious.","Space.com","An astronaut declared the feast her best space tacos yet.","2021-11-01 19:35:07","Science","https://www.space.com/astronauts-eat-space-grown-chile-pepper-tacos","c2edd5eb4423abe382cba6f22ae12facdd16af369efc72723ae933dfd41d97c8","f6351ebcd26aef26195c91b8ed2e49d9"
"China's fresh moon rocks are younger than the Apollo samples and no one knows why","Space.com","New analyses of moon rocks delivered to Earth by China's Chang'e 5 mission confirm that volcanism occurred later than previously known, but also deepen the mysteries surrounding that activity.","2021-11-01 18:44:19","Science","https://www.space.com/china-change-5-moon-rocks-age-young","c2edd5eb4423abe382cba6f22ae12facdd16af369efc72723ae933dfd41d97c8","a516c58584ae7176f1b4f019feabd775"
"DJI Air 2S review","Space.com","Compact, lightweight and powerful in many ways, the DJI Air 2S is a small drone with big features","2021-11-01 18:07:54","Science","https://www.space.com/dji-air-2s-review","c2edd5eb4423abe382cba6f22ae12facdd16af369efc72723ae933dfd41d97c8","94707be2a4c8039aaab938e010b0503a"
"This awesome 834-piece Lego Darth Vader helmet is 20% off at Amazon","Space.com","The Lego Star Wars Darth Vader helmet is 20% off on Amazon and it comes with a display stand.","2021-11-01 17:24:50","Science","https://www.space.com/lego-star-wars-darth-vader-helmet-deal","c2edd5eb4423abe382cba6f22ae12facdd16af369efc72723ae933dfd41d97c8","d5eb6c8c589df7e4e78311977c23b32d"
"DJI Mavic 2 Pro drone review","Space.com","The DJI Mavic 2 Pro is an easy-to-use prosumer drone offering excellent stills and video capabilities","2021-11-01 13:43:35","Science","https://www.space.com/dji-mavic-2-pro-review","c2edd5eb4423abe382cba6f22ae12facdd16af369efc72723ae933dfd41d97c8","14596d4c33b1b0f2b889c06ed7040621"
"Pictures from space! Our image of the day","Space.com","Satellites play a key role in monitoring the Earth's rapidly changing climate. This image, taken in June this year by a European satellite, shows what a record-breaking heatwave in a Canadian town looked like from space.","2021-11-01 11:01:40","Science","https://www.space.com/34-image-day.html","c2edd5eb4423abe382cba6f22ae12facdd16af369efc72723ae933dfd41d97c8","1e01e7d631c4cefd53e64326316c8622"
"On This Day in Space! Nov. 1, 1962: Soviet Union launches Mars 1","Space.com","On Nov. 1, 1962, the Soviet Union launched the Mars 1 spacecraft on a mission to fly by the Red Planet. See how it happened in our On This Day In Space series.","2021-11-01 10:45:47","Science","https://www.space.com/39251-on-this-day-in-space.html","c2edd5eb4423abe382cba6f22ae12facdd16af369efc72723ae933dfd41d97c8","f2f3233b65b07f282298b1f587f0e78b"
"What would happen if the speed of light was much lower?","Space.com","Here's what would happen if the speed of light were orders of magnitude slower.","2021-11-01 10:36:21","Science","https://www.space.com/what-if-speed-of-light-slowed-down","c2edd5eb4423abe382cba6f22ae12facdd16af369efc72723ae933dfd41d97c8","05f668d2655e33c5f8540c79c0cb60a6"
"Opticron Adventurer T WP 8x42 review","Space.com","Opticron's Adventurer T WP 8x42 binoculars have great light-gathering power in a lightweight package, but lack either a bargain price or premium feel","2021-11-01 10:34:41","Science","https://www.space.com/opticron-adventurer-twp8x42-review","c2edd5eb4423abe382cba6f22ae12facdd16af369efc72723ae933dfd41d97c8","998655a6bc658270f3f79e00f1035497"
"Ultrahot, ultrafast explosion called 'the Camel' has astronomers puzzled","Space.com","An ultrabright, ultrafast explosion called the Camel lit up the sky for a month in 2020. Astronomers think it might have been the birth of a black hole or neutron star.","2021-11-01 10:22:28","Science","https://www.space.com/the-camel-explosion-black-hole-neutron-star","c2edd5eb4423abe382cba6f22ae12facdd16af369efc72723ae933dfd41d97c8","734e817ce3e24a4d886c1b3f594986a0"
"NASA's Juno probe reveals secrets of Jupiter's atmosphere in 3D","Space.com","We've got more information than ever on how the gas giant's cyclones and water operate, deep in the atmosphere.","2021-11-01 10:13:17","Science","https://www.space.com/juno-jupiter-atmosphere-3d","c2edd5eb4423abe382cba6f22ae12facdd16af369efc72723ae933dfd41d97c8","b3ceba55dfba6f6245fc67a76be5ce6b"
"Climate change takes center stage at COP26 summit in Scotland this week","Space.com","The United Nations Climate Change Conference (COP26) has kicked off in the Scottish city of Glasgow, welcoming world leaders, experts and activists to look for ways to slow down climate change.","2021-11-01 10:12:53","Science","https://www.space.com/climate-change-cop26-summit-2021","c2edd5eb4423abe382cba6f22ae12facdd16af369efc72723ae933dfd41d97c8","168b0541dd780872201dec73bf1f6856"
"Black Friday Lego deals: Space, Star Wars, Marvel, and DC Lego deals","Space.com","The annual sales event has returned and we've found the best Black Friday Lego deals for you.","2021-10-31 23:25:06","Science","https://www.space.com/38810-best-lego-deals.html","c2edd5eb4423abe382cba6f22ae12facdd16af369efc72723ae933dfd41d97c8","8ccaf07d98b2dc674efda9470dc0bfa8"
"Best lightsabers 2021: Toys, replicas, and props","Space.com","The best lightsabers you can actually buy. Credits will do fine.","2021-10-31 23:10:02","Science","https://www.space.com/best-lightsabers","c2edd5eb4423abe382cba6f22ae12facdd16af369efc72723ae933dfd41d97c8","3ce556816fb505d9fcb32333b2bba7c1"
"Best telescopes for beginners 2021: Top budget-friendly picks for viewing the planets, galaxies and more","Space.com","Looking for the best beginners telescope but unsure where to start? Space.com has made the search easier with our top pick of great reflectors, refractors and computerized telescopes","2021-10-31 17:51:10","Science","https://www.space.com/31229-best-beginner-telescopes.html","c2edd5eb4423abe382cba6f22ae12facdd16af369efc72723ae933dfd41d97c8","c7d731435650417fe0107ec8f0508d12"
"Best telescopes 2021: Top picks for viewing planets, galaxies, stars and more","Space.com","Our selection of the best telescopes will suit all budgets and needs — whether you're observing planets, stars, the moon or anything else in the night sky.","2021-10-31 17:45:46","Science","https://www.space.com/15693-telescopes-beginners-telescope-reviews-buying-guide.html","c2edd5eb4423abe382cba6f22ae12facdd16af369efc72723ae933dfd41d97c8","67883b5c592a95abe4f2c10ecbc0354e"
"Halloween in space! These wild astronaut costumes are just out of this world","Space.com","Halloween in space can be just as fun as the spooky holiday on Earth. Check out these amazing Halloween costumes by astronauts","2021-10-31 14:47:35","Science","https://www.space.com/halloween-space-astronaut-costumes-photos","c2edd5eb4423abe382cba6f22ae12facdd16af369efc72723ae933dfd41d97c8","0958c0ac6ae7bfc8d207e6befe508301"
"This astronaut is spending his SpaceX launch delay cleaning up a Florida beach","Space.com","A German astronaut is showing his love for Earth during a few extra days on the planet's surface before his first space mission.","2021-11-01 23:12:43","Science","https://www.space.com/spacex-crew-3-astronaut-cleans-beach-trash","c2edd5eb4423abe382cba6f22ae12facdd16af369efc72723ae933dfd41d97c8","dbe3ec7e7b70bc9c3b86c957c9059400"
"You can help NASA train Mars rovers for the Red Planet","Space.com","You can help NASA make its Mars rovers even better explorers.","2021-11-01 22:53:37","Science","https://www.space.com/nasa-wants-citizen-scientists-train-mars-rovers","c2edd5eb4423abe382cba6f22ae12facdd16af369efc72723ae933dfd41d97c8","17c62f4a5c24493f230da424a3c7997b"
"NASA scientists propose new 'alien life evidence' scale","Space.com","As the search for alien life heats up, scientists may need to step up their reporting game a bit.","2021-11-01 22:51:52","Science","https://www.space.com/alien-life-evidence-scale-proposed","c2edd5eb4423abe382cba6f22ae12facdd16af369efc72723ae933dfd41d97c8","22aa5d6f7a7d903fd0c76c901f436c9b"
"Astronaut makes zero-g tacos with 1st chile peppers grown in space. They look delicious.","Space.com","An astronaut declared the feast her best space tacos yet.","2021-11-01 19:35:07","Science","https://www.space.com/astronauts-eat-space-grown-chile-pepper-tacos","c2edd5eb4423abe382cba6f22ae12facdd16af369efc72723ae933dfd41d97c8","da8057a0c2bd38ce06eca0fbf461a111"
"Best cameras for astrophotography","Space.com","We've picked out the best cameras for astrophotography, which you'll need if you want to capture sharp images of the night sky.","2021-11-02 10:11:30","Science","https://www.space.com/best-cameras-for-astrophotography","c2edd5eb4423abe382cba6f22ae12facdd16af369efc72723ae933dfd41d97c8","9afe4a69e2a46af6573d9cd3927f25d6"
"Europe announces new satellite constellation to track human-made greenhouse gas emissions","Space.com","A new space mission will track human-made emissions of greenhouse gases from space to help keep the world on track to meet climate change mitigation targets.","2021-11-02 11:50:10","Science","https://www.space.com/europe-greenhouse-gas-monitoring-satellite-constellation","c2edd5eb4423abe382cba6f22ae12facdd16af369efc72723ae933dfd41d97c8","c2b5dfe205004fcd683d4f90ec69945d"
"The brightest planets in November's night sky: How to see them (and when)","Space.com","Here's how to see planets visible in November's night sky.","2021-11-02 11:26:46","Science","https://www.space.com/33619-visible-planets-guide.html","c2edd5eb4423abe382cba6f22ae12facdd16af369efc72723ae933dfd41d97c8","0f04c58e8729f54492e834cb33ebc736"
"'Balding' black holes prove Einstein right again on general relativity","Space.com","A new physics breakthrough shows how Einstein's theory of general relativity continues to hold up, even for balding black holes.","2021-11-02 11:26:33","Science","https://www.space.com/black-hole-balding-einstein-general-relativity","c2edd5eb4423abe382cba6f22ae12facdd16af369efc72723ae933dfd41d97c8","12551bdcdaf91e82e335619cc0229425"
"Long space missions could cause brain damage similar to concussions, study finds","Space.com","Staying in space for a long time can cause brain damage, according to a new study.","2021-11-02 11:26:00","Science","https://www.space.com/brain-damage-long-duration-spaceflight","c2edd5eb4423abe382cba6f22ae12facdd16af369efc72723ae933dfd41d97c8","120e205b77d256bc6381e6ace2292737"
"This mysterious comet's super-bright outbursts has astronomers puzzled","Space.com","One of the strangest comets in the solar system has been erupting with unpredictable bright outbursts since late September and nobody knows why.","2021-11-02 11:22:33","Science","https://www.space.com/comet-29p-strange-outbursts-puzzles-astronomers","c2edd5eb4423abe382cba6f22ae12facdd16af369efc72723ae933dfd41d97c8","40a61ecb7bc8217fa240f1dd22446247"
"Night sky, November 2021: What you can see this month [maps]","Space.com","Find out what's up in your night sky during November 2021 and how to see it in this Space.com stargazing guide.","2021-11-02 11:02:19","Science","https://www.space.com/16149-night-sky.html","c2edd5eb4423abe382cba6f22ae12facdd16af369efc72723ae933dfd41d97c8","a14d3c75156e4d51df33f120157f5beb"
"Best night sky events of November 2021 (stargazing maps)","Space.com","See what's up in the night sky for November 2021, including stargazing events and the moon's phases, in this Space.com gallery courtesy of Starry Night Software.","2021-11-02 11:00:36","Science","https://www.space.com/33974-best-night-sky-events.html","c2edd5eb4423abe382cba6f22ae12facdd16af369efc72723ae933dfd41d97c8","82e1ac1876ac2a487277f89305b4931f"
"On This Day in Space! Nov. 2, 2000: Expedition 1 arrives at the International Space Station","Space.com","On Nov. 2, 2000, the International Space Station welcomed its first long-term residents. See how it happened in our On This Day In Space series.","2021-11-02 12:22:33","Science","https://www.space.com/39251-on-this-day-in-space.html","c2edd5eb4423abe382cba6f22ae12facdd16af369efc72723ae933dfd41d97c8","35e542c62952acd283d8745df11b063e"
"Full moon calendar 2021: When to see the next full moon","Space.com","The full moon happens about once a month. Find out when.","2021-11-02 12:02:59","Science","https://www.space.com/16830-full-moon-calendar.html","c2edd5eb4423abe382cba6f22ae12facdd16af369efc72723ae933dfd41d97c8","f8a915c2f6136a3172dc48d259ad8d15"
"This mysterious comet's super-bright outbursts have astronomers puzzled","Space.com","One of the strangest comets in the solar system has been erupting with unpredictable bright outbursts since late September and nobody knows why.","2021-11-02 11:22:33","Science","https://www.space.com/comet-29p-strange-outbursts-puzzles-astronomers","c2edd5eb4423abe382cba6f22ae12facdd16af369efc72723ae933dfd41d97c8","c0bef640345a30e15d305e36309d0bc6"
"10 devastating signs of climate change satellites can see from space","Space.com","Climate change is already affecting Earth so seriously, its consequences can be seen from space.","2021-11-02 15:54:53","Science","https://www.space.com/climate-change-earth-signs-from-space-in-photos","c2edd5eb4423abe382cba6f22ae12facdd16af369efc72723ae933dfd41d97c8","3374fcba38897f5a4558b7d75eeec2a1"
"Blue Origin's 'Mannequin Skywalker' goes on display at Space Camp","Space.com","The first passenger to fly with Blue Origin on not just one, but multiple flights into space has retired to the home of Space Camp. Mannequin Skywalker was revealed at the U.S. Space & Rocket Center.","2021-11-02 15:26:06","Science","https://www.space.com/blue-origin-mannequin-skywalker-exhibit","c2edd5eb4423abe382cba6f22ae12facdd16af369efc72723ae933dfd41d97c8","1ea9e85d28eab83348854beeb074514f"
"Hubble telescope searches for aftermath of rare double star explosion (photo)","Space.com","Stellar explosions are messy affairs, so two consecutive supernovas in the same galaxy are bound to leave a mark.","2021-11-02 15:13:01","Science","https://www.space.com/hubble-telescope-double-supernova-photo","c2edd5eb4423abe382cba6f22ae12facdd16af369efc72723ae933dfd41d97c8","40f1a2c925d066b2cd8f6225ddca152d"
"LowePro Photosport Outdoor backpack 24L review","Space.com","An adventure-orientated outdoor backpack, the LowePro Photosport 24L could be the perfect companion for astrophotography trips into the backcountry","2021-11-02 17:38:17","Science","https://www.space.com/lowepro-photosport-outdoor-backpack-24l-review","c2edd5eb4423abe382cba6f22ae12facdd16af369efc72723ae933dfd41d97c8","577fb80109c2134dac755d61abd98089"
"NASA still working to figure out why Hubble's science instruments went dark","Space.com","NASA is still working to understand a glitch that took instruments on a venerable space observatory out of commission.","2021-11-02 17:24:44","Science","https://www.space.com/hubble-science-instruments-glitch-work-update","c2edd5eb4423abe382cba6f22ae12facdd16af369efc72723ae933dfd41d97c8","b9386b8fc810de8e1a6e48e83608bd8c"
"Top sci-fi movies and TV shows to watch on Amazon in November","Space.com","Time to catch up on some long overdue sci-fi, so here's our handy guide to what's on.","2021-11-02 18:15:03","Science","https://www.space.com/best-sci-fi-movies-tv-shows-amazon-prime.html","c2edd5eb4423abe382cba6f22ae12facdd16af369efc72723ae933dfd41d97c8","e91eb32f26b0e9a34f498e61aa966a97"
"Samuel Adams brews 'Space Craft' beer with Inspiration4-flown hops","Space.com","Samuel Adams is ready to toast the first all-civilian orbital spaceflight with a beer made with hops flown on the mission. The brewery has announced Space Craft, its Inspiration4-inspired release.","2021-11-02 20:37:45","Science","https://www.space.com/samuel-adams-inspiration4-space-craft-beer","c2edd5eb4423abe382cba6f22ae12facdd16af369efc72723ae933dfd41d97c8","f411b142a119293170fc6c042e7a47d5"
"Lego's Star Wars The Bad Batch shuttle set is $20 off at Best Buy right now","Space.com","This Lego Star Wars Bad Batch Attack Shuttle set also comes with buildable speeders.","2021-11-02 20:22:17","Science","https://www.space.com/lego-star-wars-bad-batch-attack-shuttle-deal","c2edd5eb4423abe382cba6f22ae12facdd16af369efc72723ae933dfd41d97c8","71fa97928cd8c027bb41db0591c7e4a9"
"Watch the first trailer for 'The Book Of Boba Fett' spin-off 'Star Wars' series on Disney Plus","Space.com","The first trailer for the standalone spin-off series The Book of Boba Fett has arrived and it gives us a lot of reasons to be excited.","2021-11-02 21:01:30","Science","https://www.space.com/the-book-of-boba-fett-first-trailer-disney-plus","c2edd5eb4423abe382cba6f22ae12facdd16af369efc72723ae933dfd41d97c8","a60c974cb86dfe17afd2f36c7381f376"
"An asteroid barely missed Earth last week, and no one knew it was coming","Space.com","Asteroid 2021 UA1, a space rock about the size of a refrigerator, made a surprise appearance when it recently flew past Earth.","2021-11-03 10:58:11","Science","https://www.space.com/surprise-asteroid-flyby-2021-ua1","c2edd5eb4423abe382cba6f22ae12facdd16af369efc72723ae933dfd41d97c8","6a2019dc12c45e8cf3759d0ce4eaed8a"
"Weird cosmic object keeps exploding over and over again, and scientists don't know why","Space.com","Researchers have watched a mysterious fast radio burst shoot out energy far more times than they thought was possible.","2021-11-03 10:53:16","Science","https://www.space.com/cosmic-object-exploding","c2edd5eb4423abe382cba6f22ae12facdd16af369efc72723ae933dfd41d97c8","1a779771f5cfa7c39159988bd2af95d4"
"Space solar power's time may finally be coming","Space.com","The idea of harvesting solar energy via power-beaming satellites has long intrigued researchers — and recent advances may help make it a reality relatively soon.","2021-11-03 10:49:40","Science","https://www.space.com/space-solar-power-research-advances","c2edd5eb4423abe382cba6f22ae12facdd16af369efc72723ae933dfd41d97c8","47663478ba4ca67e9b6ba0dcd63f1173"
"Tourists a (major) problem at Mars analog site","Space.com","Making a Red Planet simulation as realistic as possible is key to The Mars Society's research. Crews can accomplish this, but not with constant outside interference.","2021-11-03 10:30:50","Science","https://www.space.com/mars-analog-mission-site-tourist-problem","c2edd5eb4423abe382cba6f22ae12facdd16af369efc72723ae933dfd41d97c8","8cb5c884bf8d9b86d792cee94a6b4e32"
"There are roses in Mission Control! One family's NASA tradition continues with SpaceX after 30 years","Space.com","For more than 30 years, one Texas family has shown their support for NASA mission control with a simple gesture: sending flowers.","2021-11-03 10:30:21","Science","https://www.space.com/nasa-spacex-crew-3-shelton-family-flowers","c2edd5eb4423abe382cba6f22ae12facdd16af369efc72723ae933dfd41d97c8","0e4172f3c4c1e928c44eac24625b93e3"
"On This Day in Space! Nov. 3, 1957: Laika the dog launches with Sputnik 2","Space.com","On Nov. 3, 1957, a Soviet space dog named Laika became the first animal to orbit Earth. See how it happened in our On This Day In Space series.","2021-11-03 11:05:33","Science","https://www.space.com/39251-on-this-day-in-space.html","c2edd5eb4423abe382cba6f22ae12facdd16af369efc72723ae933dfd41d97c8","faca6a37aa35393e3a00d22383b656cd"
"Honda test-fires prototype engine for reusable rocket","Space.com","Honda began working on the rocket in late 2019 and already has some serious hardware to show for it — a brand-new engine.","2021-11-03 11:02:19","Science","https://www.space.com/honda-test-fires-engine-new-rocket","c2edd5eb4423abe382cba6f22ae12facdd16af369efc72723ae933dfd41d97c8","7463f3c7f88fdcda670a18c61db05f39"
"Do parallel universes exist? We might live in a multiverse.","Space.com","There are a few good theories for a multiverse — an infinite number of parallel universes besides our own.","2021-11-03 13:50:09","Science","https://www.space.com/32728-parallel-universes.html","c2edd5eb4423abe382cba6f22ae12facdd16af369efc72723ae933dfd41d97c8","ef515a6cb4738bdb6554bcaaffa40492"
"World leaders pledge a crackdown on methane emissions. Here's how satellites can help.","Space.com","Satellites will play a key role in helping the world slash its methane emissions in line with the global pledge introduced by the U.S. President Joe Biden at the COP26 climate change conference.","2021-11-03 14:00:47","Science","https://www.space.com/how-satellites-can-help-reduce-methane-emissions-cop26","c2edd5eb4423abe382cba6f22ae12facdd16af369efc72723ae933dfd41d97c8","015f15eb6fe0c33bddce736f2f769e59"
"This popular Lego Star Wars Advent Calendar is 20% off on Walmart","Space.com","Walmart have knocked 20% off this Lego Star Wars advent calendar so you can get it in time for December.","2021-11-03 15:29:21","Science","https://www.space.com/lego-star-wars-advent-calendar-2021-deal","c2edd5eb4423abe382cba6f22ae12facdd16af369efc72723ae933dfd41d97c8","c8b9fefe2475de425be76ad266e0bafd"
"Best camera backpacks for astrophotography, camping and more","Space.com","We look at the best camera backpacks on the market right now and pick our favorites from brands like LowePro, Vanguard and Peak Design.","2021-11-03 15:02:09","Science","https://www.space.com/best-camera-backpacks","c2edd5eb4423abe382cba6f22ae12facdd16af369efc72723ae933dfd41d97c8","e761b99251d2a582cfd5064483181570"
"There are over 300 ways that the new James Webb Space Telescope could fail, NASA says","Space.com","While NASA's James Webb Space Telescope has faced countless obstacles and delays in its more than decade in the making, the observatory's most difficult days lie ahead in the coming months.","2021-11-03 16:00:00","Science","https://www.space.com/james-webb-space-telescope-deployment-points-of-failure","c2edd5eb4423abe382cba6f22ae12facdd16af369efc72723ae933dfd41d97c8","a0c86be99961302a7c492f866d6885a1"
"Sun outburst goes 'cannibal' as fast new blob overtakes a slower one","Space.com","It's been a busy few days for our sun, which has produced three of the outbursts that scientists call coronal mass ejections since Monday (Nov. 1).","2021-11-03 17:34:39","Science","https://www.space.com/cannibal-coronal-mass-ejection-cme-november-2021","c2edd5eb4423abe382cba6f22ae12facdd16af369efc72723ae933dfd41d97c8","615e2a367d5e09c498951642075e8dbd"
"See the 1st full trailer for 'Moonfall,' Roland Emmerich's new sci-fi disaster film","Space.com","The Earth and everything on it face an extinction-level event from some kind of alien that's been living on the moon.","2021-11-03 19:38:55","Science","https://www.space.com/moonfall-movie-first-trailer","c2edd5eb4423abe382cba6f22ae12facdd16af369efc72723ae933dfd41d97c8","a4d26aee680be4cf8e30d8d247f8c27a"
"November new moon 2021: See Uranus at opposition and other bright planets in the moonless night sky","Space.com","The new moon occurs on Thursday (Nov. 4), at 5:14 p.m. EDT (2114 GMT).","2021-11-04 00:24:42","Science","https://www.space.com/17561-new-moon-explained-lunar-phases.html","c2edd5eb4423abe382cba6f22ae12facdd16af369efc72723ae933dfd41d97c8","280b85d2bddc1ab81e447d265c453bb3"
"Moon phases 2021: This year's moon cycles","Space.com","Learn about the moon phases and when you can see them.","2021-11-03 22:00:15","Science","https://www.space.com/18880-moon-phases.html","c2edd5eb4423abe382cba6f22ae12facdd16af369efc72723ae933dfd41d97c8","b386d7181a6df25d5ab49cfddce0a022"
"Save $10 on this Mechanical Engineering Robotic Arms set on Amazon","Space.com","This Mechanical Engineering Robotic Arms set is a great STEM set and is 17% off on Amazon.","2021-11-03 21:49:30","Science","https://www.space.com/mechanical-engineering-robotic-arms-stem-set-deal","c2edd5eb4423abe382cba6f22ae12facdd16af369efc72723ae933dfd41d97c8","e23d5dda9c0ccf59c5e4fe591bac78ba"
"French astronaut on space station calls for climate change action now","Space.com","We can only do this together, says space station commander as he prepares to wrap up another stay in orbit.","2021-11-03 21:37:33","Science","https://www.space.com/space-station-astronaut-climate-change-action","c2edd5eb4423abe382cba6f22ae12facdd16af369efc72723ae933dfd41d97c8","d863ba703de512ff397cfcd5dd09d134"
"This bizarre 'superbubble' spotted by the Hubble Space Telescope has scientists scratching their heads","Space.com","Scientists aren't exactly sure how it formed.","2021-11-03 21:05:49","Science","https://www.space.com/hubble-space-telescope-superbubble-nebula-image","c2edd5eb4423abe382cba6f22ae12facdd16af369efc72723ae933dfd41d97c8","8ee3f0675f7597ec18afc42cb6db84ba"
"The best sci-fi movies and TV shows to stream on Netflix in November","Space.com","A veritable treasure trove of sci-fi is available at your fingertips.","2021-11-03 21:00:27","Science","https://www.space.com/best-netflix-sci-fi-movies-shows.html","c2edd5eb4423abe382cba6f22ae12facdd16af369efc72723ae933dfd41d97c8","e169b65307fd4057253352a1e888ab02"
