"SpaceX's Crew-2 astronaut splashdown for NASA: Live updates","Space.com","Read that latest news about SpaceX's Crew-3 mission to the International Space Station for NASA.","2021-11-08 12:00:10","Science","https://www.space.com/news/live/spacex-crew-dragon-mission-updates","c2edd5eb4423abe382cba6f22ae12facdd16af369efc72723ae933dfd41d97c8","38a375c3120ee6f62bc33690f2405fc4"
"On This Day in Space! Nov. 8, 2005: Europe launches its 1st mission to Venus","Space.com","On Nov. 8, 2005, Europe launched its first mission to Venus. See how it happened in our On This Day In Space series.","2021-11-08 11:49:10","Science","https://www.space.com/39251-on-this-day-in-space.html","c2edd5eb4423abe382cba6f22ae12facdd16af369efc72723ae933dfd41d97c8","ba7ce1f0e074be347c36382a05245afe"
"How to watch SpaceX's Crew-2 astronauts return to Earth today","Space.com","The astronauts of SpaceX's Crew-2 mission are scheduled to leave the International Space Station on Monday afternoon (Nov. 8), and you can watch the action live online.","2021-11-08 11:40:03","Science","https://www.space.com/spacex-crew-2-return-to-earth-webcast","c2edd5eb4423abe382cba6f22ae12facdd16af369efc72723ae933dfd41d97c8","2ee5e0dbacf00322a0976c071133057c"
"'Cannibal' sun eruption gives departing astronauts their best aurora","Space.com","Astronauts at the International Space Station enjoyed the most spectacular aurora display of their entire mission over the weekend after a massive blast of material from the sun reached our planet.","2021-11-08 15:12:56","Science","https://www.space.com/crew-3-best-aurora-before-departure","c2edd5eb4423abe382cba6f22ae12facdd16af369efc72723ae933dfd41d97c8","411e7e32f74971aac628848f56def494"
"'Cannibal' sun eruption gives departing astronauts their best aurora views yet","Space.com","Astronauts at the International Space Station enjoyed the most spectacular aurora display of their entire mission over the weekend after a massive blast of material from the sun reached our planet.","2021-11-08 15:12:56","Science","https://www.space.com/crew-3-best-aurora-before-departure","c2edd5eb4423abe382cba6f22ae12facdd16af369efc72723ae933dfd41d97c8","66fe2da63684b148199f421dcbb85ce1"
"SpaceX Dragon capsule with Crew-2 astronauts splashes down in Gulf of Mexico","Space.com","SpaceX's Crew-2 astronauts returned to Earth late Monday (Nov. 8), splashing down off the Florida coast in a nighttime landing.","2021-11-09 04:00:36","Science","https://www.space.com/spacex-crew-2-dragon-nighttime-splashdown-success","c2edd5eb4423abe382cba6f22ae12facdd16af369efc72723ae933dfd41d97c8","cb36d3a0ae123beb1a8eb364c7a078b2"
"9 small satellites launch to orbit atop Japanese rocket","Space.com","Nine small satellites launched to Earth orbit atop a Japanese rocket tonight (Nov. 8), on a mission to test a variety of spaceflight technologies.","2021-11-09 01:57:05","Science","https://www.space.com/nine-satellites-launch-japanese-rocket-epsilon-5","c2edd5eb4423abe382cba6f22ae12facdd16af369efc72723ae933dfd41d97c8","536d0fb6f1256e7181dad39c51dc4a50"
"Hubble telescope team gets one science instrument running again, continues troubleshooting glitch","Space.com","Last month, Hubble suffered a problem with its internal communications, sending its five science instruments into safe mode. The Hubble team just brought one of those instruments back online.","2021-11-08 21:56:05","Science","https://www.space.com/hubble-space-telescope-acs-instrument-recovers-glitch","c2edd5eb4423abe382cba6f22ae12facdd16af369efc72723ae933dfd41d97c8","7771aeb30a582418b00361abd19827ce"
"SpaceX Crew-2 Dragon astronauts depart space station for return to Earth","Space.com","SpaceX's Crew-2 Dragon astronauts departed the International Space Station for an eight-hour trip back to Earth on Monday (Nov. 8).","2021-11-08 20:51:05","Science","https://www.space.com/spacex-crew-2-dragon-astronauts-depart-space-station","c2edd5eb4423abe382cba6f22ae12facdd16af369efc72723ae933dfd41d97c8","53dc12d2f14f02dea9db1c84dc4da1a0"
"You can see the moon line up with bright Venus, Jupiter and Saturn in the sky tonight","Space.com","Skywatchers a chance to see Venus and the moon line up with Jupiter and Saturn in the evening sky tonight (Nov. 8).","2021-11-08 20:22:58","Science","https://www.space.com/see-venus-moon-line-up-jupiter-saturn-november-2021","c2edd5eb4423abe382cba6f22ae12facdd16af369efc72723ae933dfd41d97c8","dc9377276efa799e640060e3b42df39a"
"NASA says a glitchy strap could be behind Lucy asteroid probe's solar array troubles","Space.com","NASA may be homing in on the glitch that kept a massive solar array on its new asteroid-bound spacecraft from properly deploying.","2021-11-08 19:53:13","Science","https://www.space.com/lucy-spacecraft-solar-array-lanyard-glitch","c2edd5eb4423abe382cba6f22ae12facdd16af369efc72723ae933dfd41d97c8","7f9898cf6f2bb67ddd8ded3698806f1b"
"Heinz debuts 'Marz' Edition ketchup made with tomatoes grown in Mars conditions","Space.com","Good news, future Mars' explorers! When humans set up camp on the Red Planet, they will be able to flavor their foods with a Mars-grown version of Earth's best-selling red condiment.","2021-11-08 17:43:12","Science","https://www.space.com/mars-heinz-tomato-ketchup","c2edd5eb4423abe382cba6f22ae12facdd16af369efc72723ae933dfd41d97c8","aae5714d62d66f4abdff3e9e823901d1"
"White dwarfs: Facts about the dense corpses of stars","Space.com","Most stars in the universe will eventually burn off all of their hydrogen and become dead husks called white dwarfs.","2021-11-08 17:33:00","Science","https://www.space.com/23756-white-dwarf-stars.html","c2edd5eb4423abe382cba6f22ae12facdd16af369efc72723ae933dfd41d97c8","be2399b5c58c484dada6c5c90dc431a6"
"Watch NASA's Mars helicopter Ingenuity take its 14th flight in this full video","Space.com","A new video shows NASA's Mars helicopter Ingenuity as it completed its latest daring brief flight hop in the thinning atmosphere of the Red Planet.","2021-11-08 17:32:52","Science","https://www.space.com/mars-helicopter-ingenuity-14th-flight-full-length-video","c2edd5eb4423abe382cba6f22ae12facdd16af369efc72723ae933dfd41d97c8","b95bd1b9e97df1377aaa71a77c528a2d"
"Disney Plus is now only $1.99 for the first month to celebrate Disney Plus Day","Space.com","The popular streaming service offers countless hours of sci-fi content and is now only $1.99 for the first month to celebrate Disney Plus Day.","2021-11-08 17:13:02","Science","https://www.space.com/disney-plus-day-offer-2021","c2edd5eb4423abe382cba6f22ae12facdd16af369efc72723ae933dfd41d97c8","a3c6de27d9198b33f3b520ed2a04c281"
"Best tripods 2021: For astrophotography, landscape, and more","Space.com","Every astrophotographer should have one of the best tripods in their kit bag – here are our favorites.","2021-11-08 17:12:58","Science","https://www.space.com/best-tripods","c2edd5eb4423abe382cba6f22ae12facdd16af369efc72723ae933dfd41d97c8","53ab42bbfd94eace2730792c858317ab"
"Watch live now: SpaceX Crew-2 astronauts headed back to Earth","Space.com","SpaceX's Crew-2 astronaut mission will undock from the International Space Station on Monday (Nov. 8) to return to Earth early Monday and you can watch it all live.","2021-11-08 16:28:48","Science","https://www.space.com/17933-nasa-television-webcasts-live-space-tv.html","c2edd5eb4423abe382cba6f22ae12facdd16af369efc72723ae933dfd41d97c8","f766feb2fef2f2e4f4764ff2fe1adc53"
"On This Day in Space! Nov. 9, 1967: Saturn V launches for 1st time with Apollo 4","Space.com","On Nov. 9, 1967, NASA launched the powerful new Saturn V rocket on its maiden voyage. See how it happened in our On This Day In Space series.","2021-11-09 12:24:26","Science","https://www.space.com/39251-on-this-day-in-space.html","c2edd5eb4423abe382cba6f22ae12facdd16af369efc72723ae933dfd41d97c8","5c9a8235c2b1675127f5f59fa54d8b7d"
"Best space exploration games","Space.com","Reach for the stars with the best space exploration games that let you discover alien worlds, dodge supermassive black holes, or become an interstellar trucker.","2021-11-09 12:20:10","Science","https://www.space.com/best-space-exploration-games","c2edd5eb4423abe382cba6f22ae12facdd16af369efc72723ae933dfd41d97c8","7fa09b2ad8eba8c57cb0d03501617940"
"Mars helicopter Ingenuity aces 15th Red Planet flight","Space.com","NASA's Mars helicopter Ingenuity completed its 15th Red Planet flight on Saturday (Nov. 6), staying aloft for more than 2 minutes.","2021-11-09 12:07:52","Science","https://www.space.com/mars-helicopter-ingenuity-15th-flight","c2edd5eb4423abe382cba6f22ae12facdd16af369efc72723ae933dfd41d97c8","51c981019b34a6997d7ebfc3fc0f3313"
"Gravitational wave treasure trove shows black holes, neutron stars colliding","Space.com","Scientists have released the largest catalog of gravitational wave detections to date, shedding new light on interactions of the most massive objects in the universe, black holes and neutron stars.","2021-11-09 12:00:11","Science","https://www.space.com/gravitational-waves-most-ligo-observations-yet","c2edd5eb4423abe382cba6f22ae12facdd16af369efc72723ae933dfd41d97c8","c538b85d789b0b5ae181aac0aee59026"
"Why are we still searching for intelligent alien life?","Space.com","Humans have scanned and searched the heavens for signs of other advanced civilizations in the universe. And we've found nothing. Absolutely nothing. Maybe we shouldn't focus on intelligent life.","2021-11-09 11:59:54","Science","https://www.space.com/why-humans-search-intelligent-alien-life-SETI","c2edd5eb4423abe382cba6f22ae12facdd16af369efc72723ae933dfd41d97c8","37103a5d716f021a0e2e79be3a7f58a7"
"The giant black hole of galaxy M87 shoots jets at nearly light speed","Space.com","The first (and only) black hole to ever have its snapshot taken from Earth shoots out vast jets of plasma that travel near the speed of light, new computer models show.","2021-11-09 11:59:10","Science","https://www.space.com/black-hole-m87-shoots-out-jets-light-speed","c2edd5eb4423abe382cba6f22ae12facdd16af369efc72723ae933dfd41d97c8","16ff6ee703922adf25a54f72675fb06e"
"Star Wars: Visions review – fresh perspective on classic Star Wars tropes","Space.com","Star Wars: Visions is a unique entry into the franchise that combines an amazing collection of artists with timeless Star Wars stories.","2021-11-09 13:45:02","Science","https://www.space.com/star-wars-visions-review","c2edd5eb4423abe382cba6f22ae12facdd16af369efc72723ae933dfd41d97c8","cab7f1db2d89b4aa78c3da3f9290ee11"
"Telescopes at Walmart: Black Friday discounts and stock","Space.com","We’ve sorted through all the telescopes at Walmart, picking out the top deals worthy of your money, and looking at stock for each one.","2021-11-09 13:26:07","Science","https://www.space.com/telescopes-at-walmart","c2edd5eb4423abe382cba6f22ae12facdd16af369efc72723ae933dfd41d97c8","342d036c184c87bba8e514b9ae6fce1a"
"How Russian Doll’s Quantum Immortality theory really works","Space.com","In another universe, Russian Doll never would have been made. Thankfully, we live in the universe where it did.","2021-11-09 14:00:40","Science","https://www.space.com/russian-doll-quantum-immortality","c2edd5eb4423abe382cba6f22ae12facdd16af369efc72723ae933dfd41d97c8","c7e2fc63af846514ee1c4f627d5e0e75"
"Let’s Jam! Watch the hip new trailer for Netflix's live-action 'Cowboy Bebop'","Space.com","Japan’s cult sci-fi anime show Cowboy Bebop becomes a new live-action series on Netflix on Nov. 19.","2021-11-09 15:15:31","Science","https://www.space.com/cowboy-bebop-netflix-live-action-series-trailer","c2edd5eb4423abe382cba6f22ae12facdd16af369efc72723ae933dfd41d97c8","fe76a57bae5be676728126baf8d2bcc8"
"Best telescopes for kids 2021: Top picks from Meade, Orion and Celestron","Space.com","These are the best telescopes for kids who are just starting to express an interest in astronomy.","2021-11-09 17:21:30","Science","https://www.space.com/29798-best-telescopes-for-kids.html","c2edd5eb4423abe382cba6f22ae12facdd16af369efc72723ae933dfd41d97c8","e3eae099983809de8be32d83cfb78cba"
"The solar system: A guide to things orbiting our sun","Space.com","Learn how our solar system formed, how it was discovered and the names of the planets, dwarf planets and regions of space that orbit our sun.","2021-11-09 18:52:08","Science","https://www.space.com/56-our-solar-system-facts-formation-and-discovery.html","c2edd5eb4423abe382cba6f22ae12facdd16af369efc72723ae933dfd41d97c8","718baca516fa3344df27eacb1301fc9f"
"Planet Earth: Facts about our home planet","Space.com","Earth is the only planet known to support life. Learn about what Earth is made of and where it came from.","2021-11-09 18:52:00","Science","https://www.space.com/54-earth-history-composition-and-atmosphere.html","c2edd5eb4423abe382cba6f22ae12facdd16af369efc72723ae933dfd41d97c8","a8384f97e290b36e7272719433077565"
"Stargazers spot SpaceX's Crew-2 Dragon streaking across the night sky in amazing photos","Space.com","It looks like New Orleans and Florida got quite the show.","2021-11-09 20:48:22","Science","https://www.space.com/spacex-crew-2-dragon-streaks-across-night-sky-photos","c2edd5eb4423abe382cba6f22ae12facdd16af369efc72723ae933dfd41d97c8","4528f40ceeb4a34590823ae739651867"
"This Lego Star Wars X-Wing is $10 off from Amazon as a pre-Black Friday deal","Space.com","Amazon are offering $10 off this 474-piece Lego Star Wars X-wing in a pre-Black Friday deal.","2021-11-09 19:38:01","Science","https://www.space.com/lego-star-wars-x-wing-black-friday-deal","c2edd5eb4423abe382cba6f22ae12facdd16af369efc72723ae933dfd41d97c8","d3b210569868f8f1a08dc2e3bda084f0"
"Listen live today: NASA to hold Artemis moon program update @ 3 pm ET","Space.com","NASA will hold a media teleconference today (Nov. 9) to update the public on its plans to return astronauts to the moon under the Artemis program.","2021-11-09 19:30:48","Science","https://www.space.com/17933-nasa-television-webcasts-live-space-tv.html","c2edd5eb4423abe382cba6f22ae12facdd16af369efc72723ae933dfd41d97c8","8a356aa4875af57b2f57be1d11d1d2f2"
"Watch live Wednesday: SpaceX to launch Crew-3 astronaut mission for NASA","Space.com","NASA and SpaceX will launch four new astronauts to the International Space Station on Wednesday, Nov. 10, and you can watch it live here, courtesy of NASA TV.","2021-11-10 04:50:48","Science","https://www.space.com/17933-nasa-television-webcasts-live-space-tv.html","c2edd5eb4423abe382cba6f22ae12facdd16af369efc72723ae933dfd41d97c8","88d91b1e40411a2a425abb130f1bfd1c"
"SpaceX's Crew-3 astronaut launch for NASA: Live updates","Space.com","Read that latest news about SpaceX's Crew-3 mission to the International Space Station for NASA.","2021-11-10 03:57:36","Science","https://www.space.com/news/live/spacex-crew-dragon-mission-updates","c2edd5eb4423abe382cba6f22ae12facdd16af369efc72723ae933dfd41d97c8","50c480b45e224ce69d04979ce2f498cb"
"'Twins' of NASA's Perseverance Mars rover and Ingenuity helicopter are touring the US","Space.com","Life-size replicas of NASA's Perseverance rover and Mars helicopter Ingenuity are touring the United States over the next year.","2021-11-09 23:41:14","Science","https://www.space.com/perseverance-rover-mars-helicopter-ingenuity-museum-show-dates","c2edd5eb4423abe382cba6f22ae12facdd16af369efc72723ae933dfd41d97c8","0050cf4d2fb1b717d4403e8d102934ab"
"Perseverance rover on Mars bites into layered rocks in hunt for clues of ancient water","Space.com","NASA's Perseverance rover on Mars has begun scraping away at an intriguing set of layered rocks that may have formed in liquid water.","2021-11-09 23:24:12","Science","https://www.space.com/perseverance-rover-drills-rocks-water-clues","c2edd5eb4423abe382cba6f22ae12facdd16af369efc72723ae933dfd41d97c8","8882fcd9c9cf8992ae674044671c497d"
"NASA's Artemis astronauts won't land on the moon by 2024 deadline","Space.com","NASA has let go of its goal to return humans to the moon's surface by 2024.","2021-11-09 23:07:33","Science","https://www.space.com/nasa-changes-artemis-moon-landing-goal-2024","c2edd5eb4423abe382cba6f22ae12facdd16af369efc72723ae933dfd41d97c8","3b42162debb4b8b171a1018f07312c19"
"Save $25 on an Amazon Fire TV Stick with Alexa Voice Remote from Best Buy","Space.com","Best Buy are offering a guaranteed Black Friday price on this Amazon Fire TV stick with Alexa Voice Remote.","2021-11-09 22:44:16","Science","https://www.space.com/amazon-4k-fire-tv-stick-deal","c2edd5eb4423abe382cba6f22ae12facdd16af369efc72723ae933dfd41d97c8","7b26096a66a9dc530739f2152c20ac1f"
"Celestron telescope & binocular deals: Black Friday discounts & what's in stock","Space.com","Hunting for a discount on a Celestron telescope or binocular? Here's what's in stock this Black Friday.","2021-11-09 22:29:54","Science","https://www.space.com/38901-celestron-deals-telescopes-binoculars.html","c2edd5eb4423abe382cba6f22ae12facdd16af369efc72723ae933dfd41d97c8","4a91c8f94057f50837a283d2acbc1c79"
"Pandemic lockdowns reduced greenhouse gas levels in some areas, satellite views show","Space.com","Satellite data shows small but highly specific decreases in atmospheric carbon dioxide due to pandemic-related lockdowns, a new study shows.","2021-11-09 22:20:11","Science","https://www.space.com/covid-19-pandemic-lockdowns-carbon-dioxide-pollution","c2edd5eb4423abe382cba6f22ae12facdd16af369efc72723ae933dfd41d97c8","f184545a52b53bfd7d84925ec43ba011"
"Marvel TV shows ranked, worst to best","Space.com","Here are 12 of the best Marvel TV shows from across Disney Plus and Netflix, ranked from worst to best.","2021-11-10 10:50:34","Science","https://www.space.com/marvel-tv-shows-ranked-worst-to-best","c2edd5eb4423abe382cba6f22ae12facdd16af369efc72723ae933dfd41d97c8","ba57906cecba442fc1fd44f87c8f08e0"
"Why the outdated technology in the Alien series makes sense","Space.com","Technology in the Alien franchise might seem a bit all over the place, but it all make sense when you think about it.","2021-11-10 11:37:53","Science","https://www.space.com/why-the-alien-movies-outdated-technology-makes-sense","c2edd5eb4423abe382cba6f22ae12facdd16af369efc72723ae933dfd41d97c8","6752040b8f58eca7c3c3dc6b6ceb1dfa"
"On This Day in Space! Nov. 10, 2013: Europe's GOCE Satellite falls from space","Space.com","On Nov. 10, 2013, Europe's GOCE satellite fell to Earth. See how it happened in our On This Day In Space series.","2021-11-10 12:24:26","Science","https://www.space.com/39251-on-this-day-in-space.html","c2edd5eb4423abe382cba6f22ae12facdd16af369efc72723ae933dfd41d97c8","fc9cf053c7e787c9ebdbdcfeb6b9909b"
"NASA engineers, scientists and more shine bright this Native American Heritage Month","Space.com","This November is Native American Heritage Month, and NASA is taking the opportunity to highlight its indigenous scientists, engineers and more.","2021-11-10 12:23:39","Science","https://www.space.com/nasa-native-american-heritage-month","c2edd5eb4423abe382cba6f22ae12facdd16af369efc72723ae933dfd41d97c8","6eb511c7e1c6e0e552d74f90832828b1"
"Rocket Lab to launch satellites, recover booster tonight. How to watch live.","Space.com","Rocket Lab plans to recover a booster after launching two satellites to orbit tonight (Nov. 10), and you can watch the action live.","2021-11-10 12:21:32","Science","https://www.space.com/rocket-lab-love-at-first-insight-launch-booster-recovery-webcast","c2edd5eb4423abe382cba6f22ae12facdd16af369efc72723ae933dfd41d97c8","5d2ed38e269045c185099daed1b568fd"
"Virgin Galactic sells 100 new tickets for space tourist launches","Space.com","About 100 people have bought a ticket to ride to suborbital space since Virgin Galactic reopened sales in August, at $450,000 apiece.","2021-11-10 12:14:34","Science","https://www.space.com/virgin-galactic-sells-100-space-tourist-tickets","c2edd5eb4423abe382cba6f22ae12facdd16af369efc72723ae933dfd41d97c8","70f948db6281cef18abe24fecbec5660"
"How to prepare for a SpaceX astronaut launch rescue (video)","Space.com","A lot goes into a SpaceX launch, and that includes preparing for the possibility that things might not go according to plan.","2021-11-10 12:13:10","Science","https://www.space.com/spacex-launch-rescue-how-to-prepare-video","c2edd5eb4423abe382cba6f22ae12facdd16af369efc72723ae933dfd41d97c8","2e613c2c468e3bf688324665db239044"
"SpaceX to launch Crew-3 astronauts for NASA today. Here's how to watch it live.","Space.com","SpaceX will launch a crew of four astronauts Wednesday evening (Nov. 10) on its third operational crewed flight for NASA, and you can watch the action online.","2021-11-10 12:10:36","Science","https://www.space.com/spacex-crew-3-astronaut-launch-webcast","c2edd5eb4423abe382cba6f22ae12facdd16af369efc72723ae933dfd41d97c8","6f39674624ddde5cddced0e3b4d6aa1f"
"Who owns the moon? One man's lunar claim","Space.com","Entrepreneur and adventurer Richard Garriott believes he has a fairly unique and supportable claim to a small part of the moon.","2021-11-10 15:45:58","Science","https://www.space.com/moon-property-rights-lunokhod-2-richard-garriott","c2edd5eb4423abe382cba6f22ae12facdd16af369efc72723ae933dfd41d97c8","640d7a047acf124a1fd9a36f8055c750"
"Space Station to dodge Chinese space junk before SpaceX Crew-3 astronaut launch","Space.com","The International Space Station will dodge a piece of Chinese space junk today (Nov. 10) just hours before SpaceX launches a new crew.","2021-11-10 15:10:36","Science","https://www.space.com/space-station-dodging-chinese-space-junk-spacex-crew-3","c2edd5eb4423abe382cba6f22ae12facdd16af369efc72723ae933dfd41d97c8","f9b50e5c0392da2bbf7385d72cb2edc2"
"Space station to dodge Chinese space junk before SpaceX Crew-3 astronaut launch","Space.com","The International Space Station will dodge a piece of Chinese space junk today (Nov. 10) just hours before SpaceX launches a new crew.","2021-11-10 15:10:36","Science","https://www.space.com/space-station-dodging-chinese-space-junk-spacex-crew-3","c2edd5eb4423abe382cba6f22ae12facdd16af369efc72723ae933dfd41d97c8","f18c3dc2a1ccb22e30400731f7f28548"
"In photos: SpaceX's Crew-3 astronaut launch for NASA","Space.com","On Nov. 10, 2021, SpaceX launched four astronauts to the International Space Station on the Crew-3 mission for NASA. Liftoff occurred at 9:03 p.m. EST from NASA's Pad 39A at the Kennedy Space Center in Florida.","2021-11-11 02:50:12","Science","https://www.space.com/spacex-crew-3-astronaut-mission-photos","c2edd5eb4423abe382cba6f22ae12facdd16af369efc72723ae933dfd41d97c8","fb19b49d65ed99d897025c9ae3d722a1"
"SpaceX launches Crew-3 astronauts to space station for NASA in nighttime liftoff","Space.com","A SpaceX Falcon 9 rocket and Crew Dragon launched four astronauts into space for NASA's Crew-3 mission on Nov. 10.","2021-11-11 02:37:08","Science","https://www.space.com/spacex-crew-3-dragon-astronauts-launch","c2edd5eb4423abe382cba6f22ae12facdd16af369efc72723ae933dfd41d97c8","053b981c5aad86fb4f5bb16c93c3dbb8"
"Get over $50 off this Celestron telescope in an early Black Friday deal from Walmart","Space.com","This early Black Friday deal from Walmart knocks a massive 40% off this Celestron telescope.","2021-11-11 00:40:20","Science","https://www.space.com/celestron-telescope-early-black-friday-deal","c2edd5eb4423abe382cba6f22ae12facdd16af369efc72723ae933dfd41d97c8","8b0a634053e7ff717dae477fcb585fc6"
"Watch live! SpaceX launches Crew-3 astronauts for NASA","Space.com","NASA and SpaceX will launch four new astronauts to the International Space Station on Wednesday, Nov. 10, and you can watch it live here, courtesy of NASA TV.","2021-11-11 00:11:40","Science","https://www.space.com/17933-nasa-television-webcasts-live-space-tv.html","c2edd5eb4423abe382cba6f22ae12facdd16af369efc72723ae933dfd41d97c8","0b544a2010ebb660f2f3f7edccbb071d"
"China launches new set of Yaogan Earth reconnaissance satellites","Space.com","China launched the first set of three satellites for a new series of classified Yaogan reconnaissance satellites on Saturday (Nov. 5).","2021-11-10 23:49:22","Science","https://www.space.com/china-yaogan-35-reconnaissance-satellites-launch-november-2021","c2edd5eb4423abe382cba6f22ae12facdd16af369efc72723ae933dfd41d97c8","541c9d331b761ae6f89a0777065d94f9"
"What's the most sunsets you could see on Earth in one day?","Space.com","Most people see only one sunset a day. How many more could you catch, if you really tried?","2021-11-10 23:04:06","Science","https://www.space.com/how-many-earth-sunsets-one-day","c2edd5eb4423abe382cba6f22ae12facdd16af369efc72723ae933dfd41d97c8","ea0be4cf586e07c68e107c66841b5df1"
"The moon, Venus, Jupiter and Saturn photobombed SpaceX's Crew-3 rocket and it's just stunning","Space.com","A SpaceX photo of its Crew-3 rocket and Dragon spaceship captures a stunning sight with the moon, Venus, Jupiter and Saturn.","2021-11-10 22:40:02","Science","https://www.space.com/spacex-crew-3-rocket-venus-jupiter-saturn-moon-photo","c2edd5eb4423abe382cba6f22ae12facdd16af369efc72723ae933dfd41d97c8","7adb1835dd12c195997400b84dd9faf9"
"Startup SpinLaunch completes first test flight with wild rocket-flinging launch system","Space.com","SpinLaunch performed the test flight of its novel kinetic-energy-based launch system in New Mexico on Oct. 22.","2021-11-10 22:24:15","Science","https://www.space.com/spinlaunch-first-test-flight-success","c2edd5eb4423abe382cba6f22ae12facdd16af369efc72723ae933dfd41d97c8","1eaf025cab6e6be440d794042e7842a4"
"You can see the moon near Saturn in the night sky tonight. Here's how.","Space.com","The crescent moon will swing by Saturn on Wednesday before making a close approach to Jupiter in Thursday's evening sky.","2021-11-10 20:52:51","Science","https://www.space.com/moon-saturn-conjunction-november-2021","c2edd5eb4423abe382cba6f22ae12facdd16af369efc72723ae933dfd41d97c8","2a7abb5db8698f6de096e73436c4a2c6"
