"Climate Crisis = Health Emergency: Air Pollution, Pandemics & Displacement Make the World Sick","Democracy Now!","Health leaders are warning governments of unimaginable health consequences from the climate crisis if world leaders don't take decisive action to decarbonize. This week at the U.N. climate summit in Glasgow, the Global Climate and Health Alliance presented a letter to the COP26 president signed by 46 million health workers who are calling for global climate action on health. Meanwhile, a delegation of mothers from Brazil, Britain, India, Nigeria, Poland and South Africa attended COP26 to deliv","2021-11-12 13:13:35","Top News","https://www.democracynow.org/2021/11/12/climate_health_pollution_decarbonize_cop26","d1b0054165f4d02823fdb00f91cc331da8dae73aabe6babaf241d408b2f0918a","92013e629d1a463deb8af4cc3aa739db"
"Blackness Itself Is the Crime: Bishop William Barber on Racism in the Ahmaud Arbery Murder Trial","Democracy Now!","We speak with Bishop William Barber of the Poor People's Campaign, who was one of the Black pastors who visited the trial of the three white men who hunted down and shot dead Ahmaud Arbery, where last week a defense attorney claimed Black pastors sitting with the Arbery family in the courtroom could be intimidating for the jury, which is almost all white. Barber says Arbery's killing and the trial proceedings expose that for many, Blackness itself is the crime. This Thursday, more than 100 B","2021-11-15 13:46:33","Top News","https://www.democracynow.org/2021/11/15/rev_dr_william_barber_ahmaud_arbery","d1b0054165f4d02823fdb00f91cc331da8dae73aabe6babaf241d408b2f0918a","8ddf07f6345a41ad7f248fbac65ce0cf"
"Indigenous Amazonian Leader: We Must End Fossil Fuel Extraction to Protect the Lungs of the Earth","Democracy Now!","Among the unprecedented moments for Indigenous participation in the U.N. climate summit in Glasgow were the protests to protect the Amazon rainforest, the largest remaining rainforest on the planet, that activists argue is on the brink of ecological collapse. We cannot win the battle against climate unless we protect the world's remaining rainforests, Atossa Soltani, founder and president of Amazon Watch, tells Democracy Now! We also speak with Uyunkar Domingo Peas Nampichkai, Indigenous Achua","2021-11-15 13:31:18","Top News","https://www.democracynow.org/2021/11/15/cop26_protests_to_protect_amazon_rainforests","d1b0054165f4d02823fdb00f91cc331da8dae73aabe6babaf241d408b2f0918a","acef478bceaf7c2f070b42287e45b37b"
"Glasgow Pact Slammed for Betraying the Global Poor Who Suffer Most from the Climate Emergency","Democracy Now!","The U.N. climate summit in Glasgow, Scotland, ended Saturday with over 190 nations agreeing to the Glasgow Climate Pact, which calls on governments to return next year in Egypt with stronger plans to curb their emissions and urges wealthy nations to provide more funds to vulnerable countries in the Global South. It also pushes countries to phase out fossil fuel subsidies and reduce the use of coal, but activists say the final language of the agreement is too weak to meaningfully reduce emissions","2021-11-15 13:13:05","Top News","https://www.democracynow.org/2021/11/15/cop26_glasgow_un_climate_summit_updates","d1b0054165f4d02823fdb00f91cc331da8dae73aabe6babaf241d408b2f0918a","923e02d7e384b8b945b2357ad36491d5"
"Headlines for November 15, 2021","Democracy Now!","COP26 Final Agreement Waters Down Coal Pledges, Leaves World on Track for Climate Disaster, NYT: U.S. Covered Up 2019 Syria Airstrikes That Killed 70 Women and Children, Austria Enacts Lockdown for the Unvaccinated as Europe Becomes Pandemic's Epicenter Again, COVID Cases Rising in Over Half of U.S. States; OK Nat'l Guard Defies Pentagon's Vaccine Mandate, Sudanese Military Kills Eight People During Latest Anti-Coup Protests, Detains Al Jazeera Bureau Head, Eight Refugees Found Dead, Dozens Othe","2021-11-15 13:00:00","Top News","https://www.democracynow.org/2021/11/15/headlines","d1b0054165f4d02823fdb00f91cc331da8dae73aabe6babaf241d408b2f0918a","b11b841c2a57dca3d49f6b5aa2295849"
"Historian Alfred McCoy Predicts the U.S. Empire is Collapsing as China's Power Grows","Democracy Now!","President Joe Biden’s virtual summit Monday with Chinese President Xi Jinping follows the two countries’ announcement just days earlier they will work together to confront the climate emergency after Xi did not attend the U.N. climate summit in Glasgow. Tension has been mounting between the two superpowers, especially over Taiwan and Hong Kong, with some speculating that a new Cold War is developing. “The United States, in the immediate future, is faced with the possibility of fighting a war ove","2021-11-16 13:36:47","Top News","https://www.democracynow.org/2021/11/16/us_china_meet_in_virtual_summit","d1b0054165f4d02823fdb00f91cc331da8dae73aabe6babaf241d408b2f0918a","a90ad3dd166f320d7ec1e7826ca73c01"
"“Hell on Earth”: Millions of Afghans Face Starvation as U.S. & West Freeze Billions in Gov't Funds","Democracy Now!","Humanitarian and economic conditions are rapidly deteriorating in Afghanistan, where the U.N. estimates that more than half of the population suffers from acute hunger. The country has fallen into an economic crisis after the U.S. and other Western countries cut off direct financial assistance to the government following the Taliban takeover in August. Taliban leaders are also unable to access billions of dollars in Afghan national reserves that are held in banks overseas. “Forty million civilia","2021-11-16 13:15:37","Top News","https://www.democracynow.org/2021/11/16/afghanistan_humanitarian_and_economic_conditions_update","d1b0054165f4d02823fdb00f91cc331da8dae73aabe6babaf241d408b2f0918a","8e93c928ec24a943e1162d86f6281134"
"Headlines for November 16, 2021","Democracy Now!","Biden Signs $1.2 Trillion Infrastructure Bill; Build Back Better Act Remains Stalled in Senate, Presidents Joe Biden and Xi Jinping Pledge Cooperation in U.S.-China Virtual Summit, Three Killed and Dozens Wounded as Suicide Bombers Strike Ugandan Capital City, Spanish Coast Guard Rescues More Refugees in Waters Near Canary Islands , Polish Border Guards Fire Tear Gas and Water Cannons at Asylum-Seekers , Thai Protesters Call for Reforms to Monarchy After Court Rules Against Activists, U.S. Conde","2021-11-16 13:00:00","Top News","https://www.democracynow.org/2021/11/16/headlines","d1b0054165f4d02823fdb00f91cc331da8dae73aabe6babaf241d408b2f0918a","3b83f3dd37de0f22082c92d0bcf7c923"
"Climate Colonialism: Why Was Occupied Western Sahara Excluded from COP26 U.N. Summit in Scotland?","Democracy Now!","Activists are criticizing the British government for excluding Western Sahara, occupied by Morocco since 1975, from the U.N. climate summit in Scotland. Meanwhile, Morocco is counting renewable energy developments in Western Sahara towards its own climate pledges. Sahwari activists and the Sahrawi government in exile known as SADR, the Sahrawi Arab Democratic Republic, have described this as climate colonialism. Negotiators from Western Sahara independently announced a plan to reduce carbon emis","2021-11-17 13:46:11","Top News","https://www.democracynow.org/2021/11/17/exclusion_of_western_sahara_cop26_scotland","d1b0054165f4d02823fdb00f91cc331da8dae73aabe6babaf241d408b2f0918a","04853851777890e221d3995fceb840c0"
"Rep. Gosar Faces Censure for AOC Murder Video, Refuses to Apologize. Sister Calls Him a “Sociopath.","Democracy Now!","We speak with Jennifer Gosar, the youngest sister of far-right Arizona Congressmember Paul Gosar, who faces censure in a House vote today for posting an animated video on social media that features him murdering Congressmember Alexandria Ocasio-Cortez and attacking President Biden with swords. Gosar will be required to stand in the well of the House while the resolution is read. His colleagues will also vote to strip him of his assignments on the Committee on Oversight and Reform, alongside Ocas","2021-11-17 13:34:41","Top News","https://www.democracynow.org/2021/11/17/youngest_sister_of_rep_paul_gosar","d1b0054165f4d02823fdb00f91cc331da8dae73aabe6babaf241d408b2f0918a","b368b5eb39e9472ab6bc11fc38cc266b"
"No Doubt That Julius Jones Is innocent: Supporters Demand Stay of Execution for Oklahoma Man","Democracy Now!","Advocates in Oklahoma are rallying outside the barricaded governor’s mansion ahead of the planned Thursday execution of prisoner Julius Jones, who was convicted of a 1999 murder but has maintained his innocence. Another man privately admitted to committing the murder and framing Jones, and Oklahoma's Pardon and Parole Board has recommended twice that his death sentence be commuted to life in prison with the possibility of parole but the final decision now rests with Governor Kevin Stitt. “There ","2021-11-17 13:32:12","Top News","https://www.democracynow.org/2021/11/17/julius_jones_protests_against_execution","d1b0054165f4d02823fdb00f91cc331da8dae73aabe6babaf241d408b2f0918a","3b1d8a27bd3fc60b18bd5122feb7a60c"
"Ari Berman: With Extreme Gerrymandering, the Republicans Are Rigging the Next Decade of Elections","Democracy Now!","Republicans are set to claim the House majority in next year’s midterm elections with help from heavily gerrymandered congressional district maps in states nationwide that could shape politics for the next decade, securing Republican wins even as the party's popular vote shrinks at the national level, says Mother Jones reporter Ari Berman. The same states that are pushing voter suppression are also pushing extreme gerrymandered maps to lock in white Republican power for the next decade at the s","2021-11-17 13:24:29","Top News","https://www.democracynow.org/2021/11/17/ari_berman_gop_gerrymandering","d1b0054165f4d02823fdb00f91cc331da8dae73aabe6babaf241d408b2f0918a","d3137bacced19b8d783ba885d71c1cc4"
"Protect Voting Rights Now! MLK’s Granddaughter, Ben Jealous & More Risk Arrest at White House Protest","Democracy Now!","Republicans may retake control of the House next year thanks largely to extreme gerrymandering by Republican state legislators, even as Republican opposition in Congress has impeded critical legislation to combat discriminatory voting practices and eliminate barriers to the ballot. As pressure grows for Democrats to pass two key voting rights bills, activists are holding the last in a series of protests at the White House, where nearly 100 have been arrested since August, including Rev. Martin L","2021-11-17 13:15:01","Top News","https://www.democracynow.org/2021/11/17/voting_rights_protest_dc_ben_jealous","d1b0054165f4d02823fdb00f91cc331da8dae73aabe6babaf241d408b2f0918a","d4714dccb9b3ae4ace9ab46d04878c83"
"Headlines for November 17, 2021","Democracy Now!","Pfizer Seeks Approval For COVID Pill, Agrees to Deal To Make it Available in 95 Poorer Countries, Record Flooding Kills One Person, Displaces 1,000s in British Columbia, Climate Activists Disrupt Operations at World's Largest Coal Port For 11 Straight Days, Jury in Rittenhouse Trial Enters Second Day of Deliberations, Medical Examiner Says Ahmaud Arbery Shot at Close Range as Prosecution Rests Case, Julius Jones Set to Be Executed on Nov. 18 Unless Clemency Granted, Despite Evidence of Innocence","2021-11-17 13:00:00","Top News","https://www.democracynow.org/2021/11/17/headlines","d1b0054165f4d02823fdb00f91cc331da8dae73aabe6babaf241d408b2f0918a","65a74e3cc0fac9dd71d849342ab5336f"
"The Dawn of Everything: David Wengrow & the Late David Graeber On a New History of Humanity","Democracy Now!","In an extended interview, we speak with archeologist David Wengrow, who co-authored the new book “The Dawn of Everything: A New History of Humanity” with the late anthropologist David Graeber. The book examines how Indigenous cultures contributed greatly to what we have come to understand as so-called Western ideas of democracy and equality, but argues these contributions have been erased from history. “What the broad sweep of history shows is that living in large-scale, densely populated, techn","2021-11-18 13:37:39","Top News","https://www.democracynow.org/2021/11/18/david_wengrow_the_dawn_of_everything","d1b0054165f4d02823fdb00f91cc331da8dae73aabe6babaf241d408b2f0918a","0a2a9af035dad7dfc62762ef8fd80a17"
"Three White Supremacy Trials: Dahlia Lithwick on Charlottesville, Rittenhouse & Arbery Murder Case","Democracy Now!","Jurors in Charlottesville, Virginia, are hearing closing arguments today in a civil trial that seeks to hold white supremacists accountable for organizing the deadly “Unite the Right” rally there in 2017, and conspiring to commit racially motivated violence. Two of the white supremacists have been defending themselves in the courtroom: Richard Spencer and Christopher Cantwell. They took the stand Tuesday, and tried unsuccessfully to have the judge dismiss the case for lack of evidence, even as t","2021-11-18 13:23:23","Top News","https://www.democracynow.org/2021/11/18/charlottesville_kyle_rittenhouse_and_ahmaud_arbery","d1b0054165f4d02823fdb00f91cc331da8dae73aabe6babaf241d408b2f0918a","0238448a22f53e7549d434ac12cdea76"
"Gosar Censured Over AOC Murder Video, As AOC Slams GOP: What Is So Hard About Saying This Is Wrong?","Democracy Now!","Republican Congressmember Paul Gosar is the first lawmaker to be censured in more than a decade for posting an animated video on social media where he murders Congressmember Alexandria Ocasio-Cortez and attacks President Biden. The U.S. House of Representatives also voted Tuesday to censure Gosar and strip him of committee assignments. He has refused to apologize and after the vote he retweeted the video. Speaking from the House floor before the vote Congressmember Ocasio-Cortez said: “This is n","2021-11-18 13:13:39","Top News","https://www.democracynow.org/2021/11/18/aoc_responds_to_gosar_house_floor","d1b0054165f4d02823fdb00f91cc331da8dae73aabe6babaf241d408b2f0918a","74425fc9b80d686fe08028d88d0167d5"
"Headlines for November 18, 2021","Democracy Now!","White House Plan Would Expand U.S. Vaccine Production by One Billion Doses a Year, House Censures Arizona Republican Rep. Paul Gosar for Violent Video Targeting AOC, QAnon Shaman Jacob Chansley Gets 41 Month Prison Term for Role in Capitol Riot, Attorneys for Teen Gunman Kyle Rittenhouse Ask Judge to Declare Mistrial, Travis McMichael, Who Shot and Killed Ahmaud Arbery, Testifies in Own Defense , Students Walk Out of Oklahoma Schools to Protest Planned Execution of Julius Jones, Two Men Convic","2021-11-18 13:00:00","Top News","https://www.democracynow.org/2021/11/18/headlines","d1b0054165f4d02823fdb00f91cc331da8dae73aabe6babaf241d408b2f0918a","84e8e31e3caa0b1285c0110b2218d5b8"
"Rep. Gosar Faces Censure for AOC Murder Video, Refuses to Apologize. Sister Calls Him a Sociopath.","Democracy Now!","We speak with Jennifer Gosar, the youngest sister of far-right Arizona Congressmember Paul Gosar, who faces censure in a House vote today for posting an animated video on social media that features him murdering Congressmember Alexandria Ocasio-Cortez and attacking President Biden with swords. Gosar will be required to stand in the well of the House while the resolution is read. His colleagues will also vote to strip him of his assignments on the Committee on Oversight and Reform, alongside Ocas","2021-11-17 13:34:41","Top News","https://www.democracynow.org/2021/11/17/youngest_sister_of_rep_paul_gosar","d1b0054165f4d02823fdb00f91cc331da8dae73aabe6babaf241d408b2f0918a","887e777b686fe9d9c7a151d1043fb189"
"No Doubt That Julius Jones Is Innocent: Supporters Demand Stay of Execution for Oklahoma Man","Democracy Now!","Advocates in Oklahoma are rallying outside the barricaded Governor's Mansion ahead of the planned Thursday execution of prisoner Julius Jones, who was convicted of a 1999 murder but has maintained his innocence. Another man privately admitted to committing the murder and framing Jones, and Oklahoma's Pardon and Parole Board has recommended twice that his death sentence be commuted to life in prison with the possibility of parole, but the final decision now rests with Governor Kevin Stitt. There","2021-11-17 13:32:12","Top News","https://www.democracynow.org/2021/11/17/julius_jones_protests_against_execution","d1b0054165f4d02823fdb00f91cc331da8dae73aabe6babaf241d408b2f0918a","db6a3921a22fcb9a9e908c1f63bcf964"
"Protect Voting Rights Now! MLK's Granddaughter, Ben Jealous & More Risk Arrest at White House Protest","Democracy Now!","Republicans may retake control of the House next year, thanks largely to extreme gerrymandering by Republican state legislators, even as Republican opposition in Congress has impeded critical legislation to combat discriminatory voting practices and eliminate barriers to the ballot. As pressure grows for Democrats to pass two key voting rights bills, activists are holding the last in a series of protests at the White House, where nearly 100 have been arrested since August, including Rev. Martin ","2021-11-17 13:15:01","Top News","https://www.democracynow.org/2021/11/17/voting_rights_protest_dc_ben_jealous","d1b0054165f4d02823fdb00f91cc331da8dae73aabe6babaf241d408b2f0918a","17cc67f09640edeffcec33addc35c3f4"
"Historian Alfred McCoy Predicts the U.S. Empire Is Collapsing as China's Power Grows","Democracy Now!","President Joe Biden's virtual summit Monday with Chinese President Xi Jinping follows the two countries' announcement just days earlier they will work together to confront the climate emergency, after Xi did not attend the U.N. climate summit in Glasgow. Tension has been mounting between the two superpowers, especially over Taiwan and Hong Kong, with some speculating that a new Cold War is developing. The United States, in the immediate future, is faced with the possibility of fighting a war ov","2021-11-16 13:36:47","Top News","https://www.democracynow.org/2021/11/16/us_china_meet_in_virtual_summit","d1b0054165f4d02823fdb00f91cc331da8dae73aabe6babaf241d408b2f0918a","96524e07da9c0db1ff156d63687516e6"
"Hell on Earth: Millions of Afghans Face Starvation as U.S. & West Freeze Billions in Gov't Funds","Democracy Now!","Humanitarian and economic conditions are rapidly deteriorating in Afghanistan, where the U.N. estimates that more than half of the population suffers from acute hunger. The country has fallen into an economic crisis after the U.S. and other Western countries cut off direct financial assistance to the government following the Taliban takeover in August. Taliban leaders are also unable to access billions of dollars in Afghan national reserves that are held in banks overseas. Forty million civilia","2021-11-16 13:15:37","Top News","https://www.democracynow.org/2021/11/16/afghanistan_humanitarian_and_economic_conditions_update","d1b0054165f4d02823fdb00f91cc331da8dae73aabe6babaf241d408b2f0918a","5ca8d46c8dd9b9f8186c01ce13b6c6e8"
