"Stain on the Moral Fiber of America: Military Jurors Decry Majid Khan's Torture at CIA Black Sites","Democracy Now!","In a major development, a Guantánamo Bay detainee described his torture at CIA black sites for the first time in court last week, prompting military jurors to call his treatment a stain on the moral fiber of America. On Thursday, Majid Khan became the first Guantánamo prisoner to describe publicly the torture he experienced after being detained in Pakistan and then being held at CIA black sites, including forced feedings, waterboarding and other physical and sexual abuse. Khan was sentenced Fr","2021-11-01 12:51:51","Top News","https://www.democracynow.org/2021/11/1/majid_khan_torture","d1b0054165f4d02823fdb00f91cc331da8dae73aabe6babaf241d408b2f0918a","ae7ab76b01cf74a24289eb9f16df4838"
"Protests at COP26 Climate Summit Call on U.K. to Block Massive Cambo Oil Field Off Scotland's Coast","Democracy Now!","As the U.K. government tries to claim the mantle of climate leadership at the U.N. Climate Change Conference, we speak with Mary Church, head of campaigns at Friends of the Earth Scotland. She describes how activists are calling on U.K. Prime Minister Boris Johnson to block the development of the giant Cambo oil field off the coast of Scotland, which would run counter to the U.N. goals of phasing out fossil fuels. We know that fossil fuels need to be phased out long, long before 2050, but this ","2021-11-01 12:39:29","Top News","https://www.democracynow.org/2021/11/1/mary_church_cop26","d1b0054165f4d02823fdb00f91cc331da8dae73aabe6babaf241d408b2f0918a","9725c3f6cbee69fe6a485f2f677e5d10"
"Many Voices from Global South Shut Out of U.N. Climate Summit as Vaccine Apartheid Limits Travel to U.K.","Democracy Now!","This year's U.N. Climate Change Conference in Glasgow may be the whitest and most privileged one ever, with thousands from the Global South unable to attend because of lack of access to COVID-19 vaccines and travel restrictions. The global inequity in vaccine access mirrors the disproportionate impact of the climate crisis that has fallen mostly on poor countries least responsible for emissions, says climate activist Dipti Bhatnagar in Mozambique. The people who need to be there, who need to ho","2021-11-01 12:29:33","Top News","https://www.democracynow.org/2021/11/1/dipti_bhatnagar_cop26","d1b0054165f4d02823fdb00f91cc331da8dae73aabe6babaf241d408b2f0918a","0bc44bbd92561f4e13cb996d55f1ba64"
"Rich Countries Bring Tough Talk on Climate to COP26 But No New Plans or Money to Curb Global Emissions","Democracy Now!","As U.S. President Joe Biden and other world leaders gather amid massive protests in Glasgow for COP26, the U.N. Climate Change Conference, we look at the growing pressure on countries to limit global temperature rise to 1.5 degrees Celsius and avert the most damaging effects of the climate crisis. Leaders of the G20, representing the 20 wealthiest nations, gathered ahead of COP26 and pledged to do more to curb emissions but offered few specifics on reaching that goal, despite representing the co","2021-11-01 12:13:07","Top News","https://www.democracynow.org/2021/11/1/asad_rehman_cop26","d1b0054165f4d02823fdb00f91cc331da8dae73aabe6babaf241d408b2f0918a","484d1f3b2f78bf0d10173e117b6aebb8"
"Headlines for November  1, 2021","Democracy Now!","World Leaders, Activists Descend on Glasgow for COP26 as Future of Humanity Hangs in the Balance, G20 Members Agree to Minimum Corporate Tax Rate, Vaccines Push, Make Little Progress on Climate, Global COVID Death Toll Tops 5 Million; FDA Approves Vaccines for 5- to 11-Year-Olds, SCOTUS Rejects Religious Objection to Vaccine for Maine Health Workers; NYC Mandate Takes Effect, Biden Admin Issues New Memo to End Remain in Mexico as Migrant Caravan Takes Break on Trek to U.S., Veteran Reporter Fr","2021-11-01 12:00:00","Top News","https://www.democracynow.org/2021/11/1/headlines","d1b0054165f4d02823fdb00f91cc331da8dae73aabe6babaf241d408b2f0918a","8e61a2db3730f1b9752383c3f3073cab"
"GOP Efforts to Ban Toni Morrison's Beloved Now at Center of Virginia Governor's Race","Democracy Now!","Virginia's Republican gubernatorial candidate Glenn Youngkin caused public uproar this week when he released a political ad featuring a white mother who advocated banning Toni Morrison's novel Beloved from schools. The woman, Laura Murphy, describes the book as some of the most explicit material you can imagine. In 2013, Murphy fought to have the Beloved bill passed, which was eventually vetoed by Governor Terry McAuliffe, who is running again for governor against Youngkin in the current r","2021-10-29 12:48:22","Top News","https://www.democracynow.org/2021/10/29/dana_williams_on_toni_morrison_beloved","d1b0054165f4d02823fdb00f91cc331da8dae73aabe6babaf241d408b2f0918a","b7c0c935be938cb291d9d78b1f2876d9"
"Virginia Governor's Race Tightens as Focus Grows on Parents' Rights, Abortion & Trump","Democracy Now!","We look at the Virginia gubernatorial race, where former Democratic Governor Terry McAuliffe is facing Republican Glenn Youngkin, the former CEO of a private equity firm. President Joe Biden, who has campaigned with McAuliffe, warns Youngkin is an extremist in the vein of former President Trump. A major point of contention is Youngkin's push for parents' rights — a catch-all phrase adopted by right-wing opponents of vaccine and mask mandates, transgender rights and critical race theory. Julia ","2021-10-29 12:42:35","Top News","https://www.democracynow.org/2021/10/29/virginias_governor_race_terry_mcauliffe_vs","d1b0054165f4d02823fdb00f91cc331da8dae73aabe6babaf241d408b2f0918a","59436e1c1843351618b1adf88f837b0c"
"Shadow Units: How Secretive Border Patrol Teams Shield Agents from Accountability","Democracy Now!","A human rights network of 60 organizations working along the U.S.-Mexico border released a letter to Congress on Wednesday urging them to investigate shadow police units that have helped cover up beatings and killings by Border Patrol agents for more than three decades. The shadow units, identified in the letter as Border Patrol Critical Incident Teams, are said to possibly be the largest and longest standing shadow police unit that is operating today in the federal government. New details","2021-10-29 12:29:27","Top News","https://www.democracynow.org/2021/10/29/border_patrol_shadow_unit","d1b0054165f4d02823fdb00f91cc331da8dae73aabe6babaf241d408b2f0918a","7ab32f0bdac531111fda7be2bde5ba80"
"A Pivotal Change: Economist Darrick Hamilton on What the Build Back Better Act Could Accomplish","Democracy Now!","Democrats in Washington remain divided over two key bills at the center of President Biden's domestic agenda: a $1 trillion bipartisan infrastructure bill and the $1.85 trillion Build Back Better plan, which has been cut down from $3.5 trillion. Even though Biden's latest framework is almost half the size of the original proposal, conservative Democratic Senators Joe Manchin of West Virginia and Kyrsten Sinema of Arizona are still refusing to commit to its passage. The new proposal strips out se","2021-10-29 12:14:50","Top News","https://www.democracynow.org/2021/10/29/democrats_divided_over_federal_budget_bills","d1b0054165f4d02823fdb00f91cc331da8dae73aabe6babaf241d408b2f0918a","4636627e583703bd546443e29336c241"
"Headlines for October 29, 2021","Democracy Now!","Biden Unveils Stripped-Down Build Back Better Act After Sens. Manchin, Sinema Demand Cuts, Big Oil Executives Grilled by House Democrats over Deception on Climate Crisis, As Climate Crisis Worsens, 10 World Heritage Forests Become Net Carbon Emitters, China Won't Commit to New Emissions Targets Ahead of COP26 Climate Summit , Protesters at Site of COP26 Climate Summit Demand Real Action to Limit Warming to 1.5°C, Ahead of G20, Protesters Demand Biden Make COVID-19 Vaccines Available to Poor Coun","2021-10-29 12:00:00","Top News","https://www.democracynow.org/2021/10/29/headlines","d1b0054165f4d02823fdb00f91cc331da8dae73aabe6babaf241d408b2f0918a","ba52f42edd4c2cc1b299b120141e4d9b"
"Vaccine Inequity: Meet the Doctor Refusing a Booster as Rich Nations Get 16x More Doses Than Poor","Democracy Now!","Wealthy nations have received over 16 times more COVID-19 vaccines per person than poorer nations dependent on the COVAX program backed by the World Health Organization, according to a new Financial Times analysis. COVAX, which was set up to ensure global equitable access to vaccines, has delivered only 400 million doses after promising 1.4 billion this year. Higher-income countries struck separate vaccine deals with manufacturers, leaving COVAX with less negotiating power. While the United Stat","2021-10-28 12:39:53","Top News","https://www.democracynow.org/2021/10/28/global_vaccine_inequity_covax","d1b0054165f4d02823fdb00f91cc331da8dae73aabe6babaf241d408b2f0918a","19c0c51a22ad4d81a6f88086bfdd3fe7"
"Tariq Ali: WikiLeaks' Julian Assange Must Not Be Extradited for Exposing War Crimes in Afghanistan","Democracy Now!","As an appeals court in London is deciding whether WikiLeaks founder Julian Assange should be extradited to the United States for publishing classified documents exposing U.S. war crimes, we go to London to speak with British writer and activist Tariq Ali. Assange faces up to 175 years in prison in the U.S. under the Espionage Act for publishing classified documents exposing U.S. war crimes, including in Iraq and Afghanistan. Ali calls the case a political trial and a punitive attempt by the B","2021-10-28 12:15:20","Top News","https://www.democracynow.org/2021/10/28/tariq_ali_julian_assange","d1b0054165f4d02823fdb00f91cc331da8dae73aabe6babaf241d408b2f0918a","b790e862fdacfa236fa9ba419242f326"
"Headlines for October 28, 2021","Democracy Now!","Biden Set to Announce Framework for Revised Social Spending and Climate Bill, Iran to Rejoin Talks to Restore Nuclear Deal Abandoned by Trump, Top U.S. General Compares Chinese Hypersonic Missile Test to Sputnik Moment, U.S. Voices Rare Criticism as Israel Announces Plans to Further Expand Illegal Settlements, COVID-19 Sickened Nearly 60,000 Meat Industry Workers During Pandemic's First Year, Inexpensive Antidepressant Fluvoxamine Shows Promise as COVID-19 Therapeutic, Merck to Allow Generic","2021-10-28 12:00:00","Top News","https://www.democracynow.org/2021/10/28/headlines","d1b0054165f4d02823fdb00f91cc331da8dae73aabe6babaf241d408b2f0918a","50f95cb4bc58a0eeec124ca1d90f37fa"
"Lawyer Steven Donziger, Who Sued Chevron over Amazon Chernobyl, Ordered to Prison After House Arrest","Democracy Now!","The environmental and human rights lawyer Steven Donziger joins us just before he is ordered to report to jail today, after a years-long legal battle with the oil company Chevron and 813 days of house arrest. In 2011, Donziger won an $18 billion settlement against Chevron on behalf of 30,000 Indigenous people in Ecuador for dumping 16 billion gallons of oil into their ancestral land in the Amazon. Since the landmark case, Donziger has faced a series of legal attacks from Chevron and a New York f","2021-10-27 12:47:38","Top News","https://www.democracynow.org/2021/10/27/steven_donziger_judicial_harassment_from_chevron","d1b0054165f4d02823fdb00f91cc331da8dae73aabe6babaf241d408b2f0918a","cf11edaf1cc886e6165669016684771e"
"Hunger Striker Out of Hospital Demands Biden Keep All Climate Provisions in Build Back Better Plan","Democracy Now!","We speak with one of the group of five climate activists who have entered their eighth day of hunger strike demanding President Biden pass the full $3.5 trillion Build Back Better plan to combat the climate crisis and expand the U.S. social safety net. The climate programs drafted in the bill face opposition from Democratic Senator Joe Manchin, who has made millions of dollars from coal companies in his home state of West Virginia since taking office. ​​I'm on hunger strike for my family and my","2021-10-27 12:40:05","Top News","https://www.democracynow.org/2021/10/27/white_house_climate_activist_hunger_strike","d1b0054165f4d02823fdb00f91cc331da8dae73aabe6babaf241d408b2f0918a","12f85231b3974dd36ab58bef5b038a19"
"No Way Out: Taxi Drivers, Allies Enter 2nd Week of Hunger Strike Against Crushing Medallion Debt","Democracy Now!","New York City taxi drivers have entered their second week of hunger striking outside City Hall to demand that the mayor grant debt relief for thousands of drivers impacted by the taxi medallion price crash. Many drivers purchased taxi medallions, the permits required to drive a taxi, for upwards of $1 million. After the incursion of ride-sharing apps like Uber and Lyft, as well as more recent plummeting demand for taxis due to the pandemic, they are now only worth about $100,000. Faced with mass","2021-10-27 12:29:45","Top News","https://www.democracynow.org/2021/10/27/drivers_demand_debt_relief_in_second","d1b0054165f4d02823fdb00f91cc331da8dae73aabe6babaf241d408b2f0918a","9f0af5c2b6c6c4ef827180d57a6d0f42"
"White Nationalists on Trial in Charlottesville over Deadly Rally After Victims Sued Under KKK Act","Democracy Now!","Four years after the deadly white supremacist Unite the Right rally in Charlottesville, Virginia, a federal civil trial charges the organizers with an unlawful conspiracy to commit violent acts. Defendants include Jason Kessler, the main organizer, and Richard Spencer, a white nationalist who spoke at the event. Neo-Nazi James Alex Fields, who slammed his car into a crowd of antiracist counterprotesters during the rally and killed activist Heather Heyer, has already been sentenced to life in p","2021-10-27 12:12:32","Top News","https://www.democracynow.org/2021/10/27/trial_of_unite_the_right_neo","d1b0054165f4d02823fdb00f91cc331da8dae73aabe6babaf241d408b2f0918a","7f9c8e211ec6849489ee202ec9c45daf"
"Headlines for October 27, 2021","Democracy Now!","U.N.'s Guterres Warns World on Track for Climate Catastrophe, Even with Gov't Pledges Ahead of COP26, Brazilian Senators Back Report Accusing Bolsonaro of Crimes Against Humanity for Pandemic Response, Deborah Birx Says 130,000 Lives Could Have Been Saved, But Trump Admin Distracted by Election, FDA Panel Recommends Pfizer Vaccine for Children Aged 5-11; Moderna to Sell 110M Vaccines to African Countries, Afghanistan Heading Toward Collapse as Half the Country Faces Acute Food Insecurity, Four","2021-10-27 12:00:00","Top News","https://www.democracynow.org/2021/10/27/headlines","d1b0054165f4d02823fdb00f91cc331da8dae73aabe6babaf241d408b2f0918a","8a5407dee12684aaf41bb708837a1867"
"Worked to Death: IATSE Film Crew on Rust Walked Off Set to Protest Conditions Before Shooting","Democracy Now!","We look at how the tragic shooting death of cinematographer Halyna Hutchins during the filming of Rust last Thursday on a set in New Mexico is drawing attention to cost-cutting decisions and overall safety in the film industry. Yahoo News is reporting the gun that killed Hutchins had been used by crew members just hours beforehand for live-ammunition target practice. The film's lead actor and producer Alec Baldwin later shot the revolver after he was reportedly handed it by the first assistant","2021-10-26 12:50:14","Top News","https://www.democracynow.org/2021/10/26/iatse_unionizing_crew_members_walk_off","d1b0054165f4d02823fdb00f91cc331da8dae73aabe6babaf241d408b2f0918a","bc8e7c24e70cfb2575bd132b0e29cd4f"
"Devastation and Anger in Sudan as Military Coup Halts Country's Democratic Transition","Democracy Now!","We look at the attempted coup in Sudan, where the military, led by General Abdel Fattah al-Burhan overthrew the transitional government Monday, detaining Prime Minister Abdalla Hamdok and other political leaders. As protesters flooded the streets of Khartoum demanding the government be handed back to the civilians, Sudanese soldiers opened fire on them, killing at least 10 and wounding scores more. The United Nations has condemned the coup, and the United States has suspended a $700 million emer","2021-10-26 12:31:49","Top News","https://www.democracynow.org/2021/10/26/sudan_s_military_seizes_power_soldiers","d1b0054165f4d02823fdb00f91cc331da8dae73aabe6babaf241d408b2f0918a","881d72e0a40cda00fbbc5ef0c964e479"
"As SCOTUS Reviews Texas Abortion Ban, Activists Look to New Strategies to Save Reproductive Freedom","Democracy Now!","We look at Monday's Supreme Court oral arguments on the constitutionality of Texas's near-total ban on abortions with legendary lawyer Kathryn Kitty Kolbert, who argued the 1992 landmark Supreme Court case credited with saving Roe v. Wade. 'Save Roe' has been our mantra for so many years, and it no longer works because of the ultraconservatie nature of this Supreme Court, Kolbert says. Instead, people must protect abortion rights by electing people who will preserve women's rights, and begi","2021-11-02 12:48:25","Top News","https://www.democracynow.org/2021/11/2/supreme_court_hears_challengers_texas_abortion","d1b0054165f4d02823fdb00f91cc331da8dae73aabe6babaf241d408b2f0918a","b8aac53bb35f055849762ae64860f5f2"
"Dinosaur Warns Nations Are “Driving Themselves to Extinction” With Billions in Fossil Fuel Subsidies","Democracy Now!","A new ad released by the United Nations Development Program shows a computer-generated dinosaur speaking in the U.N. General Assembly hall, warning diplomats that going extinct is a bad thing and calling for an end to fossil fuel subsidies. The dinosaur is voiced by Jack Black.","2021-11-02 12:44:14","Top News","https://www.democracynow.org/2021/11/2/dinosaur_warns_nations_are_driving_themselves","d1b0054165f4d02823fdb00f91cc331da8dae73aabe6babaf241d408b2f0918a","4efb2affbadb2832fe94aaedb067b2e6"
"Samoan Climate Activist Brianna Fruean: If Pacific Islands Drown, the Rest of the World Is Doomed","Democracy Now!","We speak with Brianna Fruean, an activist from Samoa, who implored global leaders at the U.N. climate summit to consider how small islands like Samoa, Tutuila and Tonga might drown without urgent action against rising sea levels. She told the audience, If you're looking for inspiration on climate leadership, take a look at young Pacific people. Many Pacific islands are in danger of vanishing in the next decade if sea levels and global temperatures continue to rise. If we are able to save the ","2021-11-02 12:38:36","Top News","https://www.democracynow.org/2021/11/2/brianna_fruean_cop26_pacific_climate_warriors","d1b0054165f4d02823fdb00f91cc331da8dae73aabe6babaf241d408b2f0918a","f53fd4ab437576647c638b64a3832b69"
"Tom Goldtooth at COP26: Absolute Carbon Reduction Is Issue of Life and Death for Indigenous Peoples","Democracy Now!","Countries attending the U.N. climate summit in Glasgow have made new pledges to cut their emissions, but activists say it's not enough to avert the worst of the climate crisis. India has vowed to reduce its carbon emissions to net zero by 2070. Over 100 leaders have agreed to end deforestation by 2030. The United States is announcing a new plan to reduce methane emissions, among other measures. Tom Goldtooth, executive director of the Indigenous Environmental Network, is in Glasgow for the talks","2021-11-02 12:24:24","Top News","https://www.democracynow.org/2021/11/2/un_climate_summit_developments_day_1","d1b0054165f4d02823fdb00f91cc331da8dae73aabe6babaf241d408b2f0918a","e2ad3e89c7af1dbeed9c9d8ef1404cff"
"Bill McKibben: Manchin's Latest Hissy Fit Threatens to Curb Biden Agenda at U.N. Climate Summit","Democracy Now!","As President Biden addressed the U.N. climate summit in Glasgow on Monday, warning that climate change is already ravaging the world, back home his climate agenda was dealt a major setback when Democratic Senator Joe Manchin of West Virginia criticized the slimmed-down $1.85 trillion Build Back Plan. The air went out of this conference when Biden showed up with no major climate legislation passed, says Bill McKibben of 350.org in Glasgow. It makes it extremely difficult to proceed when the ","2021-11-02 12:13:38","Top News","https://www.democracynow.org/2021/11/2/manchin_says_no_build_back_better","d1b0054165f4d02823fdb00f91cc331da8dae73aabe6babaf241d408b2f0918a","1fe1146412d24ff1b560357c3e939cae"
"Headlines for November  2, 2021","Democracy Now!","World Leaders Gather in Glasgow for Start of Crucial COP26 U.N. Climate Summit, Sen. Joe Manchin Won't Commit to Build Back Better Act, Imperiling Biden's Domestic Agenda, Supreme Court Hears Oral Arguments on Texas's Near-Total Abortion Ban, Virginia Governor's Race Takes Center Stage on Election Day, Kids as Young as 5 Set to Be Vaccinated Within Days as Pediatric Doses Begin Shipping, Judge Blocks Vaccine Mandate for Chicago Police Officers, U.N. Security Council Extends Peacekeeping Mandate ","2021-11-02 12:00:00","Top News","https://www.democracynow.org/2021/11/2/headlines","d1b0054165f4d02823fdb00f91cc331da8dae73aabe6babaf241d408b2f0918a","dad55ef41cb28a3724b25d56a1c1bfc6"
"Dinosaur Warns Nations Are Driving Themselves to Extinction with Billions in Fossil Fuel Subsidies","Democracy Now!","A new ad released by the United Nations Development Program shows a computer-generated dinosaur speaking in the U.N. General Assembly hall, warning diplomats that going extinct is a bad thing and calling for an end to fossil fuel subsidies. The dinosaur is voiced by Jack Black.","2021-11-02 12:44:14","Top News","https://www.democracynow.org/2021/11/2/dinosaur_warns_nations_are_driving_themselves","d1b0054165f4d02823fdb00f91cc331da8dae73aabe6babaf241d408b2f0918a","4a48c61b9284643f682b7e4d6554a11d"
"Uproot the System: Filipina Activist Mitzi Tan on How Capitalism & Colonialism Fuel Climate Crisis","Democracy Now!","We speak to Mitzi Tan, a climate activist based in the Philippines, who will join Greta Thunberg of Sweden and Vanessa Nakate of Uganda in speaking at a major march and rally in Glasgow on Saturday. Among their demands are reparations from the Global North to the Global South to help rebuild the lives of those most impacted by the climate crisis. Tan has recently protested outside the offices of Standard Chartered Bank in London, which funds the most fossil fuel companies based in the Philippine","2021-11-03 12:50:11","Top News","https://www.democracynow.org/2021/11/3/filipino_climate_activist_mitzi_jonelle_tan","d1b0054165f4d02823fdb00f91cc331da8dae73aabe6babaf241d408b2f0918a","3a2bf9b5c1a8bfe48dee786c229c1b76"
"Hurricane LUMA: Puerto Ricans Fight Big Coal & Privatized Energy Amid Climate Disasters, Blackouts","Democracy Now!","As we cover the fight against Big Coal with climate activists attending the U.N. climate summit in Glasgow, Scotland, we look at the U.S. territory of Puerto Rico, which has experienced some of the most extreme weather over the last two decades. Hurricane Maria destroyed the island's electrical grid four years ago and left residents in the dark for months. The fragile power system is still unreliable for people, prompting mass protests and renewed calls for lawmakers to move away from dirty powe","2021-11-03 12:38:48","Top News","https://www.democracynow.org/2021/11/3/puerto_rice_power_grid_in_crisis","d1b0054165f4d02823fdb00f91cc331da8dae73aabe6babaf241d408b2f0918a","7fd02392d598a3d8806e2e353d4e31c9"
"Kumi Naidoo at COP26: Will Rich Countries Deliver Pledged Billions for South Africa to Get Off Coal?","Democracy Now!","On day three of the U.N. climate summit in Glasgow, Scotland, we look at the fight against Big Coal, starting with leading South African climate activist Kumi Naidoo. South Africa is one of the world's largest coal producers, and the United States has joined the European Union and other wealthy nations to announce a new deal to provide $8.5 billion to the country to help it decommission its coal plants and invest in renewable energy. Let's see if the money actually flows and if those countries ","2021-11-03 12:30:15","Top News","https://www.democracynow.org/2021/11/3/glasgow_un_climate_summit_day_3","d1b0054165f4d02823fdb00f91cc331da8dae73aabe6babaf241d408b2f0918a","d9d460901f1dc52fd6a461326d8364f7"
"The Nation's John Nichols: Democrats Must Deliver on Promises or Voters Will Punish the Party","Democracy Now!","We speak with The Nation's John Nichols about key outcomes from Tuesday's election night. In a major blow for Democrats, Republican Glenn Youngkin, who President Biden warned is an extremist in the vein of former President Trump, won the Virginia governor's race against former Governor Terry McAuliffe. Youngkin campaigned for so-called parents' rights — a catch-all phrase adopted by right-wing opponents of vaccine and mask mandates, transgender rights and critical race theory. Tuesday's election","2021-11-03 12:12:00","Top News","https://www.democracynow.org/2021/11/3/election_roundup_virginia_new_jersey_gubernatorial","d1b0054165f4d02823fdb00f91cc331da8dae73aabe6babaf241d408b2f0918a","c182883ab9aeb0f0ccf899b73122c222"
"Headlines for November  3, 2021","Democracy Now!","Youngkin Beats McAuliffe in VA Gov. Race; India Walton Trails Write-in Primary Loser Byron Brown in Buffalo, Eric Adams Wins NYC Mayoral Race; Michelle Wu Is 1st Woman, BIPOC Elected as Boston Mayor, Ohio Special House Races Go to Republican Mike Carey and Democrat Shontel Brown, Minneapolis Rejects Police Overhaul Measure; Oregon Legalizes Magic Mushrooms for Medical Use, COP26: U.S. Joins 90 Nations in Pledge to Cut Methane Emissions; South Africa Coal Deal Announced, CDC Approves Pfizer COV","2021-11-03 12:00:00","Top News","https://www.democracynow.org/2021/11/3/headlines","d1b0054165f4d02823fdb00f91cc331da8dae73aabe6babaf241d408b2f0918a","1a152573f0b49afc9d1cc539a0d54111"
