"How a Fossil Fuel Non-Proliferation Treaty Can Guide a Global Just Transition & Emission Cuts","Democracy Now!","We speak with Harjeet Singh, senior adviser with the Climate Action Network, who is at the U.N. climate summit in Glasgow. Activists like Singh are pressuring world leaders to join the Fossil Fuel Non-Proliferation Treaty, which would supplement the Paris Agreement by directly targeting the fossil fuel industry and outlining clear actions that every country could take to drastically decrease carbon emissions. This treaty talks about ending fossil fuel expansion, phasing out, and also just trans","2021-11-04 12:43:02","Top News","https://www.democracynow.org/2021/11/4/harjeet_singh_glasgow_un_climate_summit","d1b0054165f4d02823fdb00f91cc331da8dae73aabe6babaf241d408b2f0918a","dff7923a8a63e6f09034583fe24c8f37"
"Meet the Climate Lawyer Who Helped Write 2015 Paris Agreement & Superglued Herself at Shell's U.K. HQ","Democracy Now!","We speak to Farhana Yamin, one of the most prominent climate lawyers in Britain, who has been deeply involved in international climate negotiations for decades, including the landmark 2015 Paris Agreement, and has also engaged in direct action to effect change. Yamin is currently working with the Climate Vulnerable Forum, a group that represents 48 of the countries most threatened by the climate crisis, at the U.N. climate summit in Glasgow. We last spoke with Farhana in 2019 after she was arres","2021-11-04 12:30:33","Top News","https://www.democracynow.org/2021/11/4/farhana_yamin_glasgow_un_climate_summit","d1b0054165f4d02823fdb00f91cc331da8dae73aabe6babaf241d408b2f0918a","23b793e1deffde0de30f34091b124ca2"
"Former Maldives President Mohamed Nasheed on Climate Risk & Surviving Assassination Attempt","Democracy Now!","We speak to Mohamed Nasheed, the former president of the low-lying island nation of the Maldives, at the U.N. climate summit in Glasgow. Nasheed is one of the world's leading climate advocates, who once held a cabinet meeting underwater to bring attention to the threat of global warming, pledged to make the Maldives the first carbon-neutral country and installed solar panels on the roof of his presidential residence. Now serving as speaker of parliament, Nasheed survived an assassination attempt","2021-11-04 12:12:35","Top News","https://www.democracynow.org/2021/11/4/mohamed_nasheed_glasgow_un_climate_summit","d1b0054165f4d02823fdb00f91cc331da8dae73aabe6babaf241d408b2f0918a","77916221bcd46d0134cdaa8407870594"
"Headlines for November  4, 2021","Democracy Now!","Global Carbon Emissions Near Record High as Nations Meet for Crucial Climate Summit, NJ Gov. Phil Murphy Narrowly Wins Reelection, in Ominous Sign for Democrats Ahead of 2022 Midterms, Socialist Candidate India Walton Concedes Hard-Fought Mayoral Race in Buffalo, NY, Senate Republicans Filibuster Voting Rights Legislation Again, U.S. COVID-19 Death Toll Passes 750,000, White House Warns of Vaccine Misinformation, Urges Parents to Get Children Vaccinated, Russia Records Another Record Daily COVID","2021-11-04 12:00:00","Top News","https://www.democracynow.org/2021/11/4/headlines","d1b0054165f4d02823fdb00f91cc331da8dae73aabe6babaf241d408b2f0918a","438ac5dd7857a691973fb2976c771724"
"Barbados Prime Minister Mia Mottley: 2 Degrees of Global Warming Is Death Sentence for Millions","Democracy Now!","Prime Minister of Barbados Mia Mottley addressed the audience at the U.N. climate summit in Glasgow this week. We must act in the interests of all our people, she said. If we don't, we will allow the path of greed and selfishness to sow the seeds of our common destruction. She implored global leaders to try harder to keep global temperatures at 1.5 degrees Celsius, as anything above this would mean a death sentence for vulnerable island countries, including Barbados.","2021-11-05 12:49:39","Top News","https://www.democracynow.org/2021/11/5/mia_mottley_taped_speech_at_cop26","d1b0054165f4d02823fdb00f91cc331da8dae73aabe6babaf241d408b2f0918a","ac2ea5a239aa535b6157786858c918c3"
"Too Little, Too Late: Global South Activists Decry 2050 Net Zero Goal by Wealthy Nations","Democracy Now!","After nearly a week of speeches, negotiations and protests at the COP26 U.N. climate summit, we speak with Meena Raman, head of programs at Third World Network, who says developing countries need more time and resources to adapt to the climate crisis and end the use of fossil fuels. Without a just transition that addresses inequality, she says, many countries will continue to suffer from both poverty and environmental devastation. When the rich world has not been able to phase out fossil fuels,","2021-11-05 12:39:26","Top News","https://www.democracynow.org/2021/11/5/meena_raman_glasgow_un_climate_summit","d1b0054165f4d02823fdb00f91cc331da8dae73aabe6babaf241d408b2f0918a","a88e7c8bb7c59c49b23ba5ed35d79c50"
"Please Open Your Hearts: Kenyan Activist Elizabeth Wathuti Urges Leaders to Act on Climate Crisis","Democracy Now!","Youth activists are taking to the streets outside the U.N. climate summit in Glasgow to demand world leaders do more to avert a climate catastrophe. The protest is being organized by Fridays for Future, an international movement of students which grew out of Greta Thunberg's climate strike outside the Swedish parliament in 2018. We hear from Elizabeth Wathuti of Kenya. Over 2 million of my fellow Kenyans are facing climate-related starvation, Wathuti said earlier this week. The decisions you ","2021-11-05 12:33:11","Top News","https://www.democracynow.org/2021/11/5/elizabeth_wathuti_taped_speech_at_cop26","d1b0054165f4d02823fdb00f91cc331da8dae73aabe6babaf241d408b2f0918a","7b63d48cb3cee9ed3d13d8f3dd0a35d4"
"Ben Crump on the Start of Trials for Kyle Rittenhouse & the Killers of Ahmed Arbery","Democracy Now!","Only one Black juror, along with 11 white jurors, has been selected to hear the murder trial of three white men who fatally shot Ahmaud Arbery, an unarmed 25-year-old Black man who was jogging through the suburbs of Brunswick, Georgia. The defendants — Gregory McMichael, his son Travis McMichael, as well as their neighbor William Roddie Bryan — claim they were attempting a citizen's arrest when they chased and killed Arbery. Prosecutors asked Judge Timothy Walmsley to reinstate eight Black pot","2021-11-05 12:15:58","Top News","https://www.democracynow.org/2021/11/5/murder_trial_ahmaud_arbery_killers_begins","d1b0054165f4d02823fdb00f91cc331da8dae73aabe6babaf241d408b2f0918a","bf2c14a0a5029272de485c8e3e4cda55"
"Headlines for November  5, 2021","Democracy Now!","World's Biggest Polluters Remain on Sidelines as Over 40 Nations Pledge to Phase Out Coal, House Schedules Votes on Infrastructure Bill & Build Back Better Act, We Want to Live!: Climate Activists Confront Sen. Joe Manchin over Climate Emergency, White House Announces Vaccine Mandate for Over 100 Million U.S. Workers by January 4, U.S. to Cancel Contract with COVID-19 Vaccine Maker That Ruined Millions of Doses, Moderna Reports $3.3B Third-Quarter Profit; Protesters Demand It Share Vaccine Rec","2021-11-05 12:00:00","Top News","https://www.democracynow.org/2021/11/5/headlines","d1b0054165f4d02823fdb00f91cc331da8dae73aabe6babaf241d408b2f0918a","b4cba94232153ae5c22714c3b910b9d2"
"Ben Crump on the Start of Trials for Kyle Rittenhouse & the Killers of Ahmaud Arbery","Democracy Now!","Only one Black juror, along with 11 white jurors, has been selected to hear the murder trial of three white men who fatally shot Ahmaud Arbery, an unarmed 25-year-old Black man who was jogging through the suburbs of Brunswick, Georgia. The defendants — Gregory McMichael, his son Travis McMichael, as well as their neighbor William Roddie Bryan — claim they were attempting a citizen's arrest when they chased and killed Arbery. Prosecutors asked Judge Timothy Walmsley to reinstate eight Black pot","2021-11-05 12:15:58","Top News","https://www.democracynow.org/2021/11/5/ben_crump_on_the_start_of","d1b0054165f4d02823fdb00f91cc331da8dae73aabe6babaf241d408b2f0918a","65ed8c9694e89554c3ed80a98bffff20"
"The Greenwashing of COP26: Fossil Fuel Lobbyists Make Up Biggest Delegation at U.N. Climate Summit","Democracy Now!","The Glasgow U.N. climate summit is inundated with fossil fuel lobbyists, according to a recent report published by Global Witness that found if the fossil fuel lobby were a country delegation at COP, it would be the largest with 503 delegates — two dozen more than the largest country delegation. We speak with Louis Wilson, senior adviser at Global Witness, and Andrea Ixchíu, a Maya K'iche' leader, journalist and human rights defender based in Guatemala, about the vast presence of the fossil fu","2021-11-08 13:55:49","Top News","https://www.democracynow.org/2021/11/8/greenwashing_at_glasgow_un_climate_summit","d1b0054165f4d02823fdb00f91cc331da8dae73aabe6babaf241d408b2f0918a","b503ff9e788d0add04bf5ddd5172ced7"
"Activists at COP26 Honor 1,000+ Environmental Defenders Killed Since Paris Accord — 1 in 3 Indigenous","Democracy Now!","Activists held a memorial in Glasgow for those unable to attend this year's U.N. climate summit: 1,005 land and environmental defenders who have been murdered since the 2015 Paris Agreement. One in three of those defenders killed was an Indigenous person. This comes as 2020 was the most dangerous year on record for environmental and land defenders. We speak with Andrea Ixchíu, a Maya K'iche' leader, journalist and human rights defender based in Guatemala. Ixchíu says that the Guatemalan governme","2021-11-08 13:36:57","Top News","https://www.democracynow.org/2021/11/8/memorial_for_murdered_earth_defenders","d1b0054165f4d02823fdb00f91cc331da8dae73aabe6babaf241d408b2f0918a","06ee254ff9ecbd838ae0466027563f0e"
"Frontline Climate Activists Vanessa Nakate and Kathy Jetn̄il-Kijiner Urge Global Action in Glasgow","Democracy Now!","Saturday's massive climate rally outside of the U.N. climate summit in Glasgow was led by Indigenous frontline activists. We hear from Kathy Jetn̄il-Kijiner, a poet and climate change activist from the Marshall Islands, and Ugandan climate activist Vanessa Nakate. We did nothing to contribute to this crisis, and we should not have to pay the consequences, said Jetn̄il-Kijiner. We will survive climate change. We refuse to leave. We refuse to go anywhere. And our sovereignty is not up for debat","2021-11-08 13:28:56","Top News","https://www.democracynow.org/2021/11/8/fridays_for_future_saturday_rally_ft","d1b0054165f4d02823fdb00f91cc331da8dae73aabe6babaf241d408b2f0918a","fc2ad239d5c04b635707495ebd469bc7"
"COP26 Is a Failure: Greta Thunberg Condemns U.N. Climate Summit as a Greenwash Festival","Democracy Now!","Eighteen-year-old Swedish climate activist Greta Thunberg called COP26 a failure when she addressed the Fridays for Future rally in Glasgow, which drew around 25,000 demonstrators. Her address comes after Thunberg dismissed climate leaders a month prior to the U.N. climate summit for political inaction. The COP has turned into a PR event where leaders are giving beautiful speeches and announcing fancy commitments and targets, while behind the curtains the governments of the Global North count","2021-11-08 13:23:55","Top News","https://www.democracynow.org/2021/11/8/greta_thunberg_speaks_at_cop26","d1b0054165f4d02823fdb00f91cc331da8dae73aabe6babaf241d408b2f0918a","14ab3f6622293878d9491abb19abd8e1"
"We Are Not Responsible: Youth Climate Activists Rally in Glasgow to Demand World Leaders Act Now","Democracy Now!","More than 100,000 people took to the streets of Glasgow this weekend in a pair of climate rallies outside the U.N. climate summit. The first protest was organized by Fridays for Future, an international movement of students which grew out of Greta Thunberg's climate strike outside the Swedish parliament in 2018. We hear from climate activists Evelyn Acham, Mikaela Loach, Raki Ap, Helena Gualinga and Jon Bonifacio. In her address, Loach slammed the leaders of rich nations at COP26: [They] steal ","2021-11-08 13:13:47","Top News","https://www.democracynow.org/2021/11/8/youth_speak_out_at_cop26","d1b0054165f4d02823fdb00f91cc331da8dae73aabe6babaf241d408b2f0918a","92618c21a297e17b24ad778754636bb9"
"Headlines for November  8, 2021","Democracy Now!","100,000+ People Take to Streets to Call Out Climate Inaction, COP26 Greenwashing, House Passes Bipartisan $1.2 Infrastructure Bill Without Vote on $1.75T Build Back Better Package, Court Blocks Company Vaccine Mandate; U.S. Lifts Travel Restrictions; Pfizer Seeks OK for COVID Pill, Iraqi Prime Minister Mustafa al-Kadhimi Survives Assassination Attempt, Israeli Forces Kill Palestinian Teenager During West Bank Protest, Ortega Set to Retain Nicaraguan Presidency in Elections Marred by Crackdown on","2021-11-08 13:00:00","Top News","https://www.democracynow.org/2021/11/8/headlines","d1b0054165f4d02823fdb00f91cc331da8dae73aabe6babaf241d408b2f0918a","85f5a77e9b4982241c438435c25d2805"
"Julian Assange's Fiancée: U.K. Blocking Our Attempt to Marry While He Is Tortured in Belmarsh Prison","Democracy Now!","Stella Moris, partner of WikiLeaks founder Julian Assange, says British authorities have so far blocked attempts for her and Assange to marry while he is being held in Belmarsh prison. Supporters have also raised concerns Assange has become suicidal. They are killing him. If he dies, it is because they are killing him, Moris says. They are torturing him to death.","2021-11-09 13:54:56","Top News","https://www.democracynow.org/2021/11/9/uk_government_blocks_partner_of_julian","d1b0054165f4d02823fdb00f91cc331da8dae73aabe6babaf241d408b2f0918a","b5914a9adcc2f28a71f80c1d75bc702a"
"Julian Assange's Fiancée Stella Moris: WikiLeaks Helped Expose Climate Change Hypocrisy & War Crimes","Democracy Now!","Britain's High Court is expected to decide in the coming weeks whether to extradite WikiLeaks founder Julian Assange to the United States, where he faces up to 175 years in prison under espionage charges for publishing classified documents exposing U.S. war crimes. We get an update from Assange's partner, Stella Moris, who is in Glasgow as part of her campaign to free Julian and to highlight how WikiLeaks has also revealed evidence of how corporations and states have undermined the goals of prio","2021-11-09 13:42:30","Top News","https://www.democracynow.org/2021/11/9/stella_moris_on_wikileaks_and_climate","d1b0054165f4d02823fdb00f91cc331da8dae73aabe6babaf241d408b2f0918a","b8172ac94024f67f70f4c84c87404172"
"War Helps Fuel the Climate Crisis as U.S. Military Carbon Emissions Exceed 140+ Nations","Democracy Now!","Climate activists protested outside the U.N. climate summit in Glasgow Monday spotlighting the role of the U.S. military in fueling the climate crisis. The Costs of War project estimates the military produced around 1.2 billion metric tons of carbon emissions between 2001 and 2017, with nearly a third coming from U.S. wars overseas. But military carbon emissions have largely been exempted from international climate treaties dating back to the 1997 Kyoto Protocol after lobbying from the United St","2021-11-09 13:14:12","Top News","https://www.democracynow.org/2021/11/9/cop26_military_emissions_and_climate_change","d1b0054165f4d02823fdb00f91cc331da8dae73aabe6babaf241d408b2f0918a","7d4c05c4b9f140ad51ed3512ed51820d"
"Headlines for November  9, 2021","Democracy Now!","Climate Activists Blast COP26 Draft Statement for Failing to Phase Out Fossil Fuels, Police Raid Glasgow Squat Housing Climate Activists Protesting COP26, Coronavirus Cases Surge to Record Highs Across Some European Nations, As U.S. Opens Borders to Vaccinated Travelers, Asylum Seekers Remain Trapped in Mexico, Poland Mobilizes Thousands of Troops to Belarus Border to Bar Entry to Refugees, Nicaraguan President Daniel Ortega Wins Fourth Term After Arresting Opponents, Crushing Dissent, Israeli S","2021-11-09 13:00:00","Top News","https://www.democracynow.org/2021/11/9/headlines","d1b0054165f4d02823fdb00f91cc331da8dae73aabe6babaf241d408b2f0918a","15c001dd6ad0c4ccf65dc1df1aa431cf"
"A Process of Violence: Indian Author Amitav Ghosh on How Colonialism Fueled the Climate Crisis","Democracy Now!","As talks at the Glasgow U.N. climate summit accelerate, we look at how the roots of the climate crisis date back to Western colonialism with award-winning Indian author Amitav Ghosh, who examines the violent exploitation of human life and the natural environment in his new book, The Nutmeg's Curse: Parables for a Planet in Crisis. Ghosh speaks about the political significance of fossil fuels in global politics, saying that if fossil fuels were to be completely substituted at scale, what you w","2021-11-10 13:44:24","Top News","https://www.democracynow.org/2021/11/10/the_nutmegs_curse","d1b0054165f4d02823fdb00f91cc331da8dae73aabe6babaf241d408b2f0918a","8949e8b47548febfffb641311083d56d"
"The Global Climate Wall: Wealthy Nations Prioritize Militarizing Borders Over Climate Action","Democracy Now!","The world's richest countries have responded by militarizing their borders and treating the humanitarian crisis as a security issue. NATO Secretary General Jens Stoltenberg attended this year's U.N. climate summit, marking the first time a top alliance leader came to the climate talks since they began. On Tuesday, U.S. House Speaker Nancy Pelosi at COP26 raised the issue of security during a press conference. The richest countries are building a climate wall against the consequences of climate ","2021-11-10 13:29:30","Top News","https://www.democracynow.org/2021/11/10/global_climate_wall","d1b0054165f4d02823fdb00f91cc331da8dae73aabe6babaf241d408b2f0918a","d3c9651e545508475c372d7d1a0bb368"
"This Will Set Africa on Fire: Nnimmo Bassey of Nigeria Blasts Progress of Talks at U.N. Climate Summit","Democracy Now!","Today a draft agreement at COP26 was released, calling on nations to accelerate the phasing out of coal and fossil fuel subsidies and make pledges to cut emissions by the end of 2022. The draft also urges wealthy nations to urgently scale-up financial support for developing countries to help them adapt to the climate crisis. This comes as a new report by the group Climate Action Tracker estimates world temperatures are on track to rise by 2.4 degrees Celsius above preindustrial levels based on","2021-11-10 13:12:21","Top News","https://www.democracynow.org/2021/11/10/nigerian_environmental_activist_nnimmo_bassey","d1b0054165f4d02823fdb00f91cc331da8dae73aabe6babaf241d408b2f0918a","24349d743eb8af681670ce7db2f83414"
"Headlines for November 10, 2021","Democracy Now!","U.N. Releases Draft Accord in COP26's Final Stretch as Data Show Global Temp. Set to Climb 2.4C, We Will Not Stand Idly By: Tuvalu Minister Delivers Speech Knee-Deep in Rising Sea Water, AOC Says U.S. Must Follow Up Climate Vows with Action, Focus on the Most Vulnerable, GOP Rep. Paul Gosar Posts Animated Video Showing Him Killing AOC, Attacking Biden, Pfizer Seeks OK on Booster for All Adults; Moderna Tries to Exclude Gov't Scientists from Vaccine Patent, Survivor of Rittenhouse Shooting Says","2021-11-10 13:00:00","Top News","https://www.democracynow.org/2021/11/10/headlines","d1b0054165f4d02823fdb00f91cc331da8dae73aabe6babaf241d408b2f0918a","468f99799de54b2e87fec8dbf2147906"
"How Wealth Inequality Fuels the Climate Emergency: Scientist Kevin Anderson & George Monbiot on COP26","Democracy Now!","The United States and China made a surprise announcement on Wednesday at the U.N. climate summit in Glasgow on a joint pledge to reduce methane emissions and slow deforestation. The United States is the largest historical emitter of carbon emissions, while China has been the largest emitter in recent years. As negotiations continue, we speak with British journalist George Monbiot and British climate scientist Kevin Anderson about how world leaders and even some climate scientists are downplaying","2021-11-11 13:35:59","Top News","https://www.democracynow.org/2021/11/11/how_the_wealthy_fuel_the_climate","d1b0054165f4d02823fdb00f91cc331da8dae73aabe6babaf241d408b2f0918a","bba3e4eb8a34be2165f50b7cf3e36c6e"
"White Supremacy on Trial: From Rittenhouse in Kenosha to Killers of Ahmaud Arbery, Will They Go Free?","Democracy Now!","Kyle Rittenhouse took to the stand on Wednesday before his defense team asked for a mistrial with prejudice in the case. If a mistrial is granted, Rittenhouse cannot be tried again, though the judge did not immediately rule on the request and said jury deliberations could begin on Monday. Now 18 years old, Rittenhouse was 17 when he fatally shot two men and injured one with a semiautomatic rifle during racial justice protests last year in Kenosha, Wisconsin. Rittenhouse is pleading not guilty to","2021-11-11 13:14:32","Top News","https://www.democracynow.org/2021/11/11/kyle_rittenhouse_takes_stand_in_murder","d1b0054165f4d02823fdb00f91cc331da8dae73aabe6babaf241d408b2f0918a","55d28237ba1800289c04df2da72d6709"
"Headlines for November 11, 2021","Democracy Now!","U.S. and China Pledge to Reduce Emissions as COP26 Climate Summit Hits Homestretch, Kyle Rittenhouse Breaks Down in Tears on Witness Stand, Claims Self-Defense , U.S. Coronavirus Cases Rise Again; Texas Judge Halts Ban on School Mask Mandates, Ethiopia Detains World Food Programme Drivers in War-Torn Northern Region, Sudan Restores Internet Service for First Time Since Coup; Civilian Leaders Reject Talks with Junta, Poland Increases Troops at Border Amid Reports of Migrant Deaths, Brutality by B","2021-11-11 13:00:00","Top News","https://www.democracynow.org/2021/11/11/headlines","d1b0054165f4d02823fdb00f91cc331da8dae73aabe6babaf241d408b2f0918a","5fa072be67fdb203d7b60876054ab2e5"
"How Wealth Inequality Fuels the Climate Emergency: George Monbiot & Scientist Kevin Anderson on COP26","Democracy Now!","The United States and China made a surprise announcement on Wednesday at the U.N. climate summit in Glasgow on a joint pledge to reduce methane emissions and slow deforestation. The United States is the largest historical emitter of carbon emissions, while China has been the largest emitter in recent years. As negotiations continue, we speak with British journalist George Monbiot and British climate scientist Kevin Anderson about how world leaders and even some climate scientists are downplaying","2021-11-11 13:35:59","Top News","https://www.democracynow.org/2021/11/11/how_the_wealthy_fuel_the_climate","d1b0054165f4d02823fdb00f91cc331da8dae73aabe6babaf241d408b2f0918a","f36c3f37222aef749ae9f147fc3bcc8c"
"East Timor Massacre Remembered: U.S.-Armed Indonesian Troops Killed 270 Timorese 30 Years Ago Today","Democracy Now!","Today marks the 30th anniversary of the Santa Cruz massacre in East Timor, when Indonesian troops armed with U.S. M16s fired on a peaceful memorial procession in the Santa Cruz cemetery in Dili, killing more than 270 East Timorese. Indonesia had invaded East Timor in 1975 and maintained a brutal occupation until 1999, when East Timorese voted overwhelmingly for independence in a United Nations referendum. The massacre on November 12, 1991, sparked widespread outrage against the Indonesian govern","2021-11-12 13:41:43","Top News","https://www.democracynow.org/2021/11/12/east_timor_massacre_anniversary","d1b0054165f4d02823fdb00f91cc331da8dae73aabe6babaf241d408b2f0918a","089c50022b9e60d11529bcfc0e56c70e"
"Walkout: Outraged by New COP26 Pact, Civil Society Holds People's Plenary & Leaves Climate Summit","Democracy Now!","As the U.N. climate summit in Glasgow concludes, activists staged a walkout Friday in response to late decisions made by negotiators to severely weaken commitments in the final agreement. While the earlier draft of the unbinding Glasgow Agreement called for phasing-out of coal and subsidies for fossil fuels, the new draft calls for the phaseout of unabated coal power and of inefficient subsidies for fossil fuels. We get an update on the walkout from one of its leaders: COP26 Coalition lead s","2021-11-12 13:32:15","Top News","https://www.democracynow.org/2021/11/12/walkout_at_un_climate_summit_cop26","d1b0054165f4d02823fdb00f91cc331da8dae73aabe6babaf241d408b2f0918a","38a6f8224cc6386a9bccc8f93c2468e0"
"Climate Crisis = Heath Emergency: Air Pollution, Pandemics & Displacement Make the World Sick","Democracy Now!","Health leaders are warning governments of unimaginable health consequences from the climate crisis if world leaders don't take decisive action to decarbonize. This week at the U.N. climate summit in Glasgow, the Global Climate and Health Alliance presented a letter to the COP26 president signed by 46 million health workers who are calling for global climate action on health. Meanwhile, a delegation of mothers from Brazil, Britain, India, Nigeria, Poland and South Africa attended COP26 to deliv","2021-11-12 13:13:35","Top News","https://www.democracynow.org/2021/11/12/climate_health_pollution_decarbonize_cop26","d1b0054165f4d02823fdb00f91cc331da8dae73aabe6babaf241d408b2f0918a","248402ec975484707fc9571d40e7d0fa"
"Headlines for November 12, 2021","Democracy Now!","New Draft Agreement Weakens Earlier Calls to Phase Out Coal, Fossil Fuel Funding as COP26 Nears End, Beyond Oil and Gas: Denmark and Costa Rica Lead New Push to Phase Out Fossil Fuels, Biden and Xi Jinping to Hold Virtual Summit Amid Ongoing Tensions, NIH and Moderna in Legal Battle over COVID Vaccine Patent Rights, Another Explosion Targets Mosque in Afghanistan, 5,000 Afghan Refugees Fleeing to Iran Every Day as Humanitarian Crisis Worsens, U.N.: 84 Million People Worldwide Displaced by War, I","2021-11-12 13:00:00","Top News","https://www.democracynow.org/2021/11/12/headlines","d1b0054165f4d02823fdb00f91cc331da8dae73aabe6babaf241d408b2f0918a","ac1e38fdd6d23925baf1f5f062d15aa2"
