"Steal This Look: A Painterly Farmhouse Kitchen in Upstate New York","Remodelista","At the new Inness, a design retreat in Upstate New York, Taavo Somer, Miranda Brooks, and Post Company collaborated to complete a Scandinavian meets American farmhouse interior that we’d like to replicate in our own homes. For a host of similar sources, see our finds below. Materials Faucets & Fixtures Accessories For more kitchen design […]","2021-11-16 09:00:52","Home","https://www.remodelista.com/posts/steal-look-painterly-farmhouse-kitchen-upstate-new-york/","d2620e9e32a77d30b6f2ceb659211e9d9daa500887599779b15a21e34cd1339b","7cd5306748eed685cd5df59ffb4b66a0"
"Creative Flow: A Novelist’s Elegant Pied-a-Terre by Colombe Studio","Remodelista","When we happened upon Colombe Studio’s Instagram account, we discovered image after image that activated our endorphins. It was clear that we had to share founder Marta Chrapka’s sophisticated projects on our site. A while ago, we did just that—see A Glamorous Pre-War Flat in Poland, Courtesy of Colombe Design (and eBay).  Here’s another refreshingly grown-up […]","2021-11-17 09:00:56","Home","https://www.remodelista.com/posts/colombe-studio-apartment-warsaw-marta-chrapka/","d2620e9e32a77d30b6f2ceb659211e9d9daa500887599779b15a21e34cd1339b","f07b7744f4ea7b815c9204bf1ae26b6f"
"10 Easy Pieces: Linen-Slipcovered Sofas","Remodelista","We’ve cornered our 10 favorite linen slipcovered sofas, beginning with the costliest to the most modestly priced. Looking for more classic sofas? See our previous post: 10 Easy Pieces: The Perfect White Sofa. N.B.: This post was originally published on February 29, 2012. We have updated it with new and additional product selections and current […]","2021-11-17 09:00:00","Home","https://www.remodelista.com/posts/10-easy-pieces-linen-slipcovered-sofas/","d2620e9e32a77d30b6f2ceb659211e9d9daa500887599779b15a21e34cd1339b","24922711ba02841b3c26ea23f2bcccea"
"Now Admiring: Handwoven Rugs in Rich Hues from Kiliim in Egypt","Remodelista","This week I’ve been taken by rugs by Egyptian brand Kiliim, originally spotted via their Etsy shop. The richly hued cotton and wool kilim rugs are handwoven by artisans in Fowa, in the Nile Delta region: “Decades ago,” according to Kiliim’s website, “Fowa used to be home to over 2,000 kilim weaving workshops,. However, when […]","2021-11-18 11:00:56","Home","https://www.remodelista.com/posts/rugs-kiliim-egypt/","d2620e9e32a77d30b6f2ceb659211e9d9daa500887599779b15a21e34cd1339b","383a38f8f2b6213bd17b435fd2877e1b"
"Kitchen of the Week: “Preserving the Spirit of the Old” in Reims, France","Remodelista","A while back, Annie discovered a charming rehabbed house in Reims, a city in the Champagne region of France—more resuscitation than renovation. We’re revisiting it again, this time focusing on the singular kitchen. (You can see the whole house tour here.) The kitchen belongs to antique store owners Annabelle Brun and Brice Bérard. It’s inside […]","2021-11-18 09:00:25","Home","https://www.remodelista.com/posts/kitchen-of-the-week-les-penates-reims/","d2620e9e32a77d30b6f2ceb659211e9d9daa500887599779b15a21e34cd1339b","4aa651d350c4a35f4455011eeaf0c8e3"
"Can Minimalism and 5 Kids Co-Exist? A Design Couple’s Child-Friendly, Clutter-Free Home","Remodelista","When most of us see a blank wall, our urge is to cover it—with photos, posters, art, or color. But in the inviting home of Maria and Paul Le Mesurier, the founders of UK furniture company WoodEdit (see our story about it here), there is not a hint of wall art to be found, nor […]","2021-11-19 09:00:33","Home","https://www.remodelista.com/posts/woodedit-founders-house-tour-minimalist-children/","d2620e9e32a77d30b6f2ceb659211e9d9daa500887599779b15a21e34cd1339b","cc13dbcf0ddb31a55d27a32d8d1ad673"
