"'Paying for our own destruction': Clock ticks down on COP talks amid anger over watered down vow","Sky News","The US, EU and Marshall Islands are among nations to have demanded a contested fossil fuel statement lives on in a final agreement from COP26, as the Glasgow talks run into overtime.","2021-11-12 08:56:00","Top News","https://news.sky.com/story/cop26-clock-ticks-down-on-summit-talks-amid-anger-over-watered-down-vow-on-fossil-fuel-12466712","e708c1d33bdfaa397da3f3f68681ae2d010f0fd76eaef33bb65f8cf4544a7713","86de926ad5599e55ecb16fd4ea148038"
"COP26 talks to continue into Saturday amid disagreement over wording on fossil fuels","Sky News","Talks to reach a climate deal at a United Nations summit in Glasgow will continue into Saturday afternoon, after a Friday deadline passed without an agreement.","2021-11-12 21:19:00","Top News","https://news.sky.com/story/cop26-talks-to-continue-into-saturday-as-leaders-try-to-reach-climate-deal-12467304","e708c1d33bdfaa397da3f3f68681ae2d010f0fd76eaef33bb65f8cf4544a7713","836503d80b8d337e4de465041eb3e700"
"ABBA 'over the moon' as they top charts with first album in almost 40 years","Sky News","ABBA say they are over the moon after their first album in almost 40 years went straight to number one, selling 204,000 copies in its first week.","2021-11-12 19:41:00","Top News","https://news.sky.com/story/abba-over-the-moon-as-they-top-charts-with-first-album-in-almost-40-years-12467220","e708c1d33bdfaa397da3f3f68681ae2d010f0fd76eaef33bb65f8cf4544a7713","afb45c23a248224353848b375ca3399a"
"'Congratulations fellas!': Biden makes video call to Ireland rugby team after All Blacks win","Sky News","US President Joe Biden made a video call to the Irish rugby team to congratulate them for their win over New Zealand.","2021-11-15 04:53:00","Top News","https://news.sky.com/story/joe-biden-makes-video-call-to-ireland-rugby-team-after-their-win-against-all-blacks-congratulations-fellas-12469042","e708c1d33bdfaa397da3f3f68681ae2d010f0fd76eaef33bb65f8cf4544a7713","ede5206dc31fb7f00624f9755c6755f1"
"Austria imposes lockdown on unvaccinated citizens - as Europe becomes epicentre of pandemic","Sky News","Austria is placing millions of people not fully vaccinated against COVID-19 in lockdown as of today as Europe becomes the epicentre of the pandemic once again.","2021-11-15 02:00:00","Top News","https://news.sky.com/story/covid-19-austria-imposes-lockdown-on-unvaccinated-citizens-as-europe-becomes-epicentre-of-pandemic-12469030","e708c1d33bdfaa397da3f3f68681ae2d010f0fd76eaef33bb65f8cf4544a7713","2fb83c7dd76cab2f76c5014cb99e02c0"
"Ed Sheeran wins big at MTV EMAs in Budapest as stars celebrate LGBT+ community","Sky News","Ed Sheeran won big at the MTV Europe Music Awards (EMAs) in Budapast - landing two major awards as stars gathered to celebrate the LGBT+ community.","2021-11-14 23:51:00","Top News","https://news.sky.com/story/ed-sheeran-wins-big-at-mtv-emas-in-budapest-as-stars-celebrate-the-lgbt-community-12469022","e708c1d33bdfaa397da3f3f68681ae2d010f0fd76eaef33bb65f8cf4544a7713","ea632e4deaeb0e448a84a505fe8b845f"
"Gaddafi's son announces candidacy for Libya's presidential elections","Sky News","The son of late Libyan dictator Muammar Gaddafi has announced his candidacy for the country's presidential elections next month.","2021-11-14 21:03:00","Top News","https://news.sky.com/story/libya-son-of-muammar-gaddafi-announces-candidacy-for-countrys-presidential-elections-next-month-12468933","e708c1d33bdfaa397da3f3f68681ae2d010f0fd76eaef33bb65f8cf4544a7713","6ee021b6aaa922d6769cd4c7dbc02783"
"Israel to begin vaccinating 1.2 million children as young as five against coronavirus","Sky News","Israel has announced that a campaign to vaccinate some 1.2 million children aged five to 11 will begin within days.","2021-11-14 19:25:00","Top News","https://news.sky.com/story/covid-19-israel-to-begin-vaccinating-12-million-children-aged-5-to-11-against-coronavirus-12468848","e708c1d33bdfaa397da3f3f68681ae2d010f0fd76eaef33bb65f8cf4544a7713","bacc81ab4517a3176aaf9f5f196c11fb"
"'The government has failed': Inside the underground Polish movement helping migrants on Belarus border","Sky News","Driving through the Bialowieza forest - next to Poland's border with Belarus - a green light shines out from the porch of a house.","2021-11-14 14:47:00","Top News","https://news.sky.com/story/belarus-migrants-inside-the-polish-underground-movement-offering-help-to-people-in-the-bialowieza-forest-12468540","e708c1d33bdfaa397da3f3f68681ae2d010f0fd76eaef33bb65f8cf4544a7713","6f81e75ef21064ff4015e272a639eccb"
"Fifteen people arrested after protests in the Netherlands over COVID lockdown","Sky News","Fifteen people have been arrested after protests broke out in the Netherlands over a newly-imposed COVID-19 lockdown.","2021-11-14 03:40:00","Top News","https://news.sky.com/story/covid-19-fifteen-people-arrested-after-protests-in-dutch-city-of-leeuwarden-over-newly-imposed-lockdown-12468206","e708c1d33bdfaa397da3f3f68681ae2d010f0fd76eaef33bb65f8cf4544a7713","3869ea27cf61d48824282d6dd1a17338"
"'If we give up now, all hope is lost' - the island in desperate need of climate justice","Sky News","Beyond Glasgow, beyond the ambition and the pledges, and the conclusions, the forests of Great Abaco have gone.","2021-11-14 00:29:00","Top News","https://news.sky.com/story/the-bahamas-if-we-give-up-now-all-hope-is-lost-the-island-in-desperate-need-of-climate-justice-12468201","e708c1d33bdfaa397da3f3f68681ae2d010f0fd76eaef33bb65f8cf4544a7713","6496171aa0ee4a6dbd799119ced07995"
"Why an appetite for emissions data shows China is taking climate change seriously","Sky News","The world was hoping for a lot from China at COP26. Or, at least, something.","2021-11-13 09:46:00","Top News","https://news.sky.com/story/cop26-why-an-appetite-for-emissions-data-shows-china-is-taking-climate-change-seriously-12467552","e708c1d33bdfaa397da3f3f68681ae2d010f0fd76eaef33bb65f8cf4544a7713","3b20820d4c774cb1ed6ed8b7c124abd3"
"World leaders agree climate change deal but 'deep disappointment' over fossil fuel compromise","Sky News","World leaders have reached the most significant climate change pact since the landmark Paris Agreement, following a turbulent two weeks of fraught negotiations in Glasgow.","2021-11-12 14:57:00","Top News","https://news.sky.com/story/cop26-world-leaders-reach-most-significant-climate-deal-since-the-historic-paris-agreement-12467001","e708c1d33bdfaa397da3f3f68681ae2d010f0fd76eaef33bb65f8cf4544a7713","d49e26946b11998f5c392b89373711e3"
"Trump reaches $375m deal to sell Washington DC hotel","Sky News","The Trump Organization has reached a deal to sell the rights to its Washington DC hotel for $375m (£279m), according to the Wall Street Journal.","2021-11-15 07:51:00","Top News","https://news.sky.com/story/donald-trump-reaches-375m-deal-to-sell-washington-dc-hotel-reports-12469114","e708c1d33bdfaa397da3f3f68681ae2d010f0fd76eaef33bb65f8cf4544a7713","88eec4d310d271af3f147a7af9706cbe"
"Man charged with killing 18 women in Texas to go on trial","Sky News","A man charged with killing 18 women in Texas is set to go on trial over one of the deaths.","2021-11-15 09:00:00","Top News","https://news.sky.com/story/billy-chemirmir-man-charged-with-killing-18-women-in-texas-to-go-on-trial-12469178","e708c1d33bdfaa397da3f3f68681ae2d010f0fd76eaef33bb65f8cf4544a7713","98bb9a3560402c2975b8b0d26dcf9f2e"
"Macron changed colour of French flag 'to revive a symbol of the revolution'","Sky News","Emmanuel Macron has changed one of the colours of the official French flag, opting for a darker shade of blue.","2021-11-15 08:26:00","Top News","https://news.sky.com/story/emmanuel-macron-changed-colour-of-french-flag-to-revive-a-symbol-of-the-revolution-12469156","e708c1d33bdfaa397da3f3f68681ae2d010f0fd76eaef33bb65f8cf4544a7713","db1d857cb4e087f41c1c99180bc8c148"
"'We're so proud of you': Joe Biden makes touching video call to Ireland rugby team after All Blacks win","Sky News","US President Joe Biden made a video call to the Irish rugby team to congratulate them for their win over New Zealand.","2021-11-15 04:53:00","Top News","https://news.sky.com/story/joe-biden-makes-video-call-to-ireland-rugby-team-after-their-win-against-all-blacks-congratulations-fellas-12469042","e708c1d33bdfaa397da3f3f68681ae2d010f0fd76eaef33bb65f8cf4544a7713","0f0e3dbb7b833f0ef6937a64413fc06e"
"'We're all in the same boat': Austria imposes lockdown on unvaccinated citizens as further measures being considered","Sky News","Austria is placing millions of people not fully vaccinated against COVID-19 in lockdown as of today as Europe becomes the epicentre of the pandemic once again.","2021-11-15 02:00:00","Top News","https://news.sky.com/story/covid-19-austria-imposes-lockdown-on-unvaccinated-citizens-as-europe-becomes-epicentre-of-pandemic-12469030","e708c1d33bdfaa397da3f3f68681ae2d010f0fd76eaef33bb65f8cf4544a7713","b647d9d5888c2efbd95218b631425605"
"Two murder arrests after children 'thrown from window of flat' in Sweden","Sky News","Swedish police have arrested a man and a woman on suspicion of murder after two children fell from a great height and one of them died.","2021-11-15 11:52:00","Top News","https://news.sky.com/story/sweden-man-and-woman-arrested-on-suspicion-of-murder-after-children-thrown-from-window-of-flat-12469307","e708c1d33bdfaa397da3f3f68681ae2d010f0fd76eaef33bb65f8cf4544a7713","98557a58d79c6cb52c4387f9e04d41c9"
"Emmanuel Macron has changed colour of French flag in 'very political' decision","Sky News","Emmanuel Macron has changed one of the colours of the official French flag, opting for a darker shade of blue.","2021-11-15 08:26:00","Top News","https://news.sky.com/story/emmanuel-macron-changed-colour-of-french-flag-to-revive-a-symbol-of-the-revolution-12469156","e708c1d33bdfaa397da3f3f68681ae2d010f0fd76eaef33bb65f8cf4544a7713","ed77a1550397682bacdcbf7bf6c661b4"
"Airdrop for family of four who could be stranded in desert for weeks","Sky News","A couple with two young children could be stuck in the Australian Outback for a fortnight after their campervan got bogged down following heavy rain.","2021-11-15 09:10:00","Top News","https://news.sky.com/story/airdrop-for-family-of-four-who-could-be-stranded-in-south-australias-simpson-desert-for-weeks-12469188","e708c1d33bdfaa397da3f3f68681ae2d010f0fd76eaef33bb65f8cf4544a7713","17b3a75ac2fbc08d2e966f6a6dd0fb06"
"England qualify for World Cup after thrashing San Marino 10-0","Sky News","England have qualified for the World Cup after thrashing San Marino 10-0 in their final qualifying group game.","2021-11-15 16:57:00","Top News","https://news.sky.com/story/england-qualify-for-2022-world-cup-after-thrashing-san-marino-10-0-12469512","e708c1d33bdfaa397da3f3f68681ae2d010f0fd76eaef33bb65f8cf4544a7713","2e3eff29201b4beb53e280d1253858c8"
"Biden and Xi Jinping's chummy 'Zoom' meeting masked the frostiness, tension and mistrust","Sky News","A virtual meeting between US President Joe Biden and China's Xi Jinping has taken place - with the Chinese leader greeting his US counterpart as his old friend.","2021-11-16 03:49:00","Top News","https://news.sky.com/story/biden-and-xi-jinpings-chummy-zoom-meeting-masked-the-frostiness-tension-and-mistrust-between-the-us-and-china-12469717","e708c1d33bdfaa397da3f3f68681ae2d010f0fd76eaef33bb65f8cf4544a7713","c091c641db38a3c416988081e74496e5"
"Biden holds virtual meeting with 'old friend' Xi Jinping amid strained US-China relations","Sky News","US President Joe Biden has held a virtual meeting with China's Xi Jinping and began on a positive note - saying their goal is to ensure competition does not veer into conflict.","2021-11-16 01:46:00","Top News","https://news.sky.com/story/biden-and-xi-jinping-virtual-meeting-us-president-says-the-goal-is-to-ensure-competition-does-not-veer-into-conflict-12469715","e708c1d33bdfaa397da3f3f68681ae2d010f0fd76eaef33bb65f8cf4544a7713","f655bc9129c8f58390030bf34b3bcf94"
"ISS crew endangered by space junk from 'reckless' Russian weapons test","Sky News","A reckless and irresponsible Russian weapons test has created more than 1,500 pieces of debris now endangering the seven crew aboard the International Space Station, US officials have said.","2021-11-16 00:36:00","Top News","https://news.sky.com/story/international-space-station-crewendangered-by-space-junk-from-reckless-russian-weapons-test-12469713","e708c1d33bdfaa397da3f3f68681ae2d010f0fd76eaef33bb65f8cf4544a7713","db10e010848214e7280b61ed5efcd652"
"Shivering, hungry migrants on the Poland-Belarus border hope the EU will 'make a good decision'","Sky News","After a week shivering in sodden woodland, the largest group of migrants stuck between the serried ranks of Belarusian and Polish border guards decided to move. We were en route to their camp but they had other plans.","2021-11-15 21:17:00","Top News","https://news.sky.com/story/poland-belarus-border-shivering-hungry-migrants-hope-the-eu-will-make-a-good-decision-12469639","e708c1d33bdfaa397da3f3f68681ae2d010f0fd76eaef33bb65f8cf4544a7713","f4b8b2688ed87daecbc3ef396658c1f8"
"Kane moves up to third in England's all-time scoring charts as Three Lions reach 2022 World Cup","Sky News","England have qualified for the World Cup after thrashing San Marino 10-0 in their final qualifying group game.","2021-11-15 16:57:00","Top News","https://news.sky.com/story/england-qualify-for-2022-world-cup-after-thrashing-san-marino-10-0-12469512","e708c1d33bdfaa397da3f3f68681ae2d010f0fd76eaef33bb65f8cf4544a7713","2c047c1e0d36a3a81a3caa4daae85110"
"Maori ask anti-vaxxers to stop using haka","Sky News","Protesters in New Zealand have been asked to not perform the Ka Mate as the tribe with ancestral ties to the famous haka say they do not support the protesters' position.","2021-11-15 10:00:00","Top News","https://news.sky.com/story/a-moari-tribe-have-asked-anti-vaxxers-to-not-use-the-haka-at-protests-as-covid-cases-in-new-zealand-rise-12469226","e708c1d33bdfaa397da3f3f68681ae2d010f0fd76eaef33bb65f8cf4544a7713","f49ea0ec4442d731a7a017cc7af678ba"
"Dad 'saved daughter's life' by shielding her during plane crash - and she was the only survivor","Sky News","A dad shielded his daughter in his arms - saving her life during a plane crash on Lake Michigan at the weekend, a family friend has said.","2021-11-16 08:23:00","Top News","https://news.sky.com/story/michigan-dad-saved-daughters-life-by-shielding-her-during-plane-crash-and-she-was-the-only-survivor-12469838","e708c1d33bdfaa397da3f3f68681ae2d010f0fd76eaef33bb65f8cf4544a7713","44fed90619ad6150c9e687e996860192"
"Stranded family rescued from stuck campervan after four days in Australian desert","Sky News","A family of four, who were left stranded in the Australian outback when their campervan got bogged down following heavy rain, have been rescued.","2021-11-16 12:10:00","Top News","https://news.sky.com/story/australia-outback-rescue-family-safe-after-being-stranded-in-campervan-for-four-days-12470021","e708c1d33bdfaa397da3f3f68681ae2d010f0fd76eaef33bb65f8cf4544a7713","df64a1a3de40cc341d1d1aec8566f108"
"Bodies found in New Zealand mine 11 years after explosion","Sky News","Human remains have been found in a New Zealand coal mine more than a decade after one of the country's worst industrial disasters, police have said.","2021-11-17 04:09:00","Top News","https://news.sky.com/story/new-zealand-mine-explosion-bodies-found-11-years-after-blast-that-killed-29-men-12470508","e708c1d33bdfaa397da3f3f68681ae2d010f0fd76eaef33bb65f8cf4544a7713","2bd865e7cd1a8dd42a237e4b40f48282"
"UK signs deal to help boost Ukraine's navy in the face of increased threat from Russia","Sky News","Britain and Ukraine have finalised a treaty that will enable Kiev to seek loans from London to buy British warships and missiles at a time of heightened tensions with Russia.","2021-11-16 23:27:00","Top News","https://news.sky.com/story/uk-signs-deal-to-help-boost-ukraines-navy-in-the-face-of-increased-threat-from-russia-12470490","e708c1d33bdfaa397da3f3f68681ae2d010f0fd76eaef33bb65f8cf4544a7713","5b6e2ab3a4e8174bde85a88e4353857e"
"Cold and wet migrants evicted from camp near Dunkirk won't stop until they reach British shores","Sky News","The police came early to the migrant camp in Grande-Synthe, a commune near Dunkirk in northern France.","2021-11-16 21:21:00","Top News","https://news.sky.com/story/cold-and-wet-migrants-evicted-from-camp-near-dunkirk-wont-stop-until-they-reach-british-shores-12470360","e708c1d33bdfaa397da3f3f68681ae2d010f0fd76eaef33bb65f8cf4544a7713","57f294b9e1e5f009cd91547215d6996d"
"The West faces a test of unity over Russia as tensions intensify between Moscow and NATO","Sky News","An unusual build-up of Russian troops in and around Ukraine, the use of migrants by Kremlin-ally Belarus to destabilise the European Union, and Moscow's firing of an anti-satellite weapon in space - all actions below the threshold of war.","2021-11-16 20:11:00","Top News","https://news.sky.com/story/the-west-faces-a-test-of-unity-over-russia-as-tensions-intensify-between-moscow-and-nato-12470321","e708c1d33bdfaa397da3f3f68681ae2d010f0fd76eaef33bb65f8cf4544a7713","50328ac6773f95034f1cd552ef646c1d"
"Users report outage on social media apps and internet services including Snapchat and Spotify","Sky News","Several social media apps and internet services including Snapchat, Spotify, Amazon and Google Cloud were reported to be down on Tuesday.","2021-11-16 18:41:00","Top News","https://news.sky.com/story/users-report-outage-on-social-media-apps-and-internet-services-including-snapchat-and-spotify-12470258","e708c1d33bdfaa397da3f3f68681ae2d010f0fd76eaef33bb65f8cf4544a7713","230cd1996b728aa26c2fc90bacc46ec3"
"Secret DJ condemns 'plague raves' as he tells how he 'died for five minutes' during weeks-long COVID coma","Sky News","A British DJ who spent weeks in a coma after contracting coronavirus in Ibiza has told how he died for five minutes during his ordeal - and says he has received death threats for speaking out against others in the industry who continued to perform during the pandemic.","2021-11-16 16:49:00","Top News","https://news.sky.com/story/covid-19-secret-dj-condemns-plague-raves-as-he-tells-how-he-died-for-five-minutes-during-weeks-long-coronavirus-coma-12470189","e708c1d33bdfaa397da3f3f68681ae2d010f0fd76eaef33bb65f8cf4544a7713","4fdc634d4dd1cba5bc41bf4ce90f8fda"
"Ireland introduces new COVID restrictions including midnight hospitality curfew as country battles fourth wave of infections","Sky News","Ireland is introducing new COVID-19 restrictions including a midnight closing time for pubs, nightclubs and restaurants as the country battles a fourth wave of infections.","2021-11-16 16:10:00","Top News","https://news.sky.com/story/covid-19-ireland-introduces-new-coronavirus-restrictions-including-midnight-hospitality-curfew-as-country-battles-fourth-wave-of-infections-12470162","e708c1d33bdfaa397da3f3f68681ae2d010f0fd76eaef33bb65f8cf4544a7713","734f9f9800571bdd52faca831db06a9e"
"Belarusian military linked to hacking and disinformation campaigns targeting regime critics","Sky News","The Belarusian military is linked to hacking and disinformation campaigns which targeted the regime's critics, including dissidents and foreign governments, new research has found.","2021-11-15 14:00:00","Top News","https://news.sky.com/story/belarusian-military-linked-to-hacking-and-disinformation-campaigns-targeting-regime-critics-12469385","e708c1d33bdfaa397da3f3f68681ae2d010f0fd76eaef33bb65f8cf4544a7713","1df4d1bca01cd7c920e77fa4ec2815b3"
"Stars sign letter criticising Israel's move to label Palestinian charities as terror organisations","Sky News","More than 100 celebrities have signed an open letter criticising Israel's decision to designate six prominent Palestinian charities as terrorist organisations.","2021-11-17 07:32:00","Top News","https://news.sky.com/story/israel-hollywood-stars-sign-letter-criticising-labelling-of-palestinian-charities-as-terror-organisations-12470560","e708c1d33bdfaa397da3f3f68681ae2d010f0fd76eaef33bb65f8cf4544a7713","b092f5e547c405cef939a17691ffbb96"
"One dead and thousands evacuated after 'severe' flooding in parts of Canada and US","Sky News","One person is dead, several people are missing and thousands have been evacuated following severe flooding in the northwest of the US and parts of Canada.","2021-11-17 07:33:00","Top News","https://news.sky.com/story/canada-and-washington-flooding-one-dead-and-thousands-evacuated-following-days-of-heavy-rainfall-12470558","e708c1d33bdfaa397da3f3f68681ae2d010f0fd76eaef33bb65f8cf4544a7713","6a6a1a94837eadc51b8dbabbb01b101b"
"'It breaks my heart to see what's going on': Thousands evacuated as heavy rain hits parts of US and Canada","Sky News","One person is dead, several people are missing and thousands have been evacuated following severe flooding in the northwest of the US and parts of Canada.","2021-11-17 07:33:00","Top News","https://news.sky.com/story/canada-and-washington-flooding-one-dead-and-thousands-evacuated-following-days-of-heavy-rainfall-12470558","e708c1d33bdfaa397da3f3f68681ae2d010f0fd76eaef33bb65f8cf4544a7713","915f5ad4b64b985654d2ba44ff886df1"
"India considering lockdown to cut dangerous New Delhi air pollution levels","Sky News","Authorities in New Delhi are considering a first-of-its-kind lockdown to combat worsening air pollution.","2021-11-17 09:58:00","Top News","https://news.sky.com/story/india-authorities-considering-new-delhi-lockdown-to-cut-dangerous-air-pollution-levels-12470667","e708c1d33bdfaa397da3f3f68681ae2d010f0fd76eaef33bb65f8cf4544a7713","fa5097d6f8cb49fe998a136ebbf20093"
"'It was amazing': Charles praises COP26 summit as he retraces Jesus' footsteps in Jordan","Sky News","The Prince of Wales has said the amazing COP26 conference produced quite a lot of success as he retraced Jesus Christ's footsteps in Jordan.","2021-11-17 12:44:00","Top News","https://news.sky.com/story/prince-charles-praises-amazing-cop26-conference-as-he-retraces-jesus-footsteps-in-jordan-12470812","e708c1d33bdfaa397da3f3f68681ae2d010f0fd76eaef33bb65f8cf4544a7713","029f0889ba3fe23738a1b71f70771bf0"
"Prince Charles and Camilla pictured as pair retrace Jesus' footsteps in Jordan","Sky News","The Prince of Wales has said the amazing COP26 conference produced quite a lot of success as he retraced Jesus Christ's footsteps in Jordan.","2021-11-17 12:44:00","Top News","https://news.sky.com/story/prince-charles-praises-amazing-cop26-conference-as-he-retraces-jesus-footsteps-in-jordan-12470812","e708c1d33bdfaa397da3f3f68681ae2d010f0fd76eaef33bb65f8cf4544a7713","eddd299507c223416098f6624fc9e2cb"
"Transgender athletes should not have to lower testosterone to compete, IOC says","Sky News","Transgender women should not be forced to reduce their testosterone levels to compete in sports, new International Olympic Committee (IOC) guidelines have said.","2021-11-17 09:02:00","Top News","https://news.sky.com/story/transgender-athletes-should-not-have-to-lower-testosterone-to-compete-ioc-says-as-it-changes-guidelines-12470620","e708c1d33bdfaa397da3f3f68681ae2d010f0fd76eaef33bb65f8cf4544a7713","9902af343edc65f84b97492343be5289"
"Pilot ejects as British F35 jet crashes into the Mediterranean","Sky News","A British F35 jet from the UK's flagship aircraft carrier has crashed into the Mediterranean while flying and the pilot has ejected in the first such incident to impact HMS Queen Elizabeth.","2021-11-17 14:54:00","Top News","https://news.sky.com/story/pilot-ejects-as-british-f35-jet-from-flagship-air-carrier-crashes-into-the-mediterranean-12470933","e708c1d33bdfaa397da3f3f68681ae2d010f0fd76eaef33bb65f8cf4544a7713","969791cacef122648afdc74bc7628004"
"Prince Charles on Queen's health: 'Once you get to 95, it's not quite as easy as it used to be'","Sky News","The Prince of Wales has said the Queen is alright but added once you get to 95, it's not quite as easy as it used to be.","2021-11-17 14:27:00","Top News","https://news.sky.com/story/prince-charles-on-queens-health-once-you-get-to-95-its-not-quite-as-easy-as-it-used-to-be-12470911","e708c1d33bdfaa397da3f3f68681ae2d010f0fd76eaef33bb65f8cf4544a7713","4ebd94da17e17b4e99eadd02fab9f382"
"Barbados to launch world's first virtual embassy in the metaverse","Sky News","Barbados says it is the first country in the world to establish a digital embassy in a metaverse.","2021-11-17 10:39:00","Top News","https://news.sky.com/story/barbados-to-launch-worlds-first-virtual-embassy-in-the-metaverse-12470727","e708c1d33bdfaa397da3f3f68681ae2d010f0fd76eaef33bb65f8cf4544a7713","2a8b01dc28c6b1ae385c543e31c24075"
"Woman found dead in US park had 'FAT' carved on to chest and dozens of stab wounds","Sky News","A woman who was killed while walking her dog in a US park had FAT carved on to her chest and had been stabbed dozens of times, according to a post-mortem report.","2021-11-17 15:56:00","Top News","https://news.sky.com/story/katherine-janness-woman-found-dead-in-us-park-had-fat-carved-on-to-chest-and-dozens-of-stab-wounds-12470982","e708c1d33bdfaa397da3f3f68681ae2d010f0fd76eaef33bb65f8cf4544a7713","f60ddee0b06abe4cd6b5d6a09a9a37ac"
"Pilot ejects as British F35 stealth jet crashes into the Mediterranean","Sky News","A British F35 stealth jet from the UK's flagship aircraft carrier has crashed into the Mediterranean while flying, with the pilot forced to eject in the first such incident to impact HMS Queen Elizabeth.","2021-11-17 14:54:00","Top News","https://news.sky.com/story/pilot-ejects-as-british-f35-jet-from-flagship-air-carrier-crashes-into-the-mediterranean-12470933","e708c1d33bdfaa397da3f3f68681ae2d010f0fd76eaef33bb65f8cf4544a7713","481a6d3296dd88f16fe75cede5e4d915"
