"Britain tracked Chinese submarines and was ready to intercept jets in South China Sea, officers reveal","Sky News","Britain tracked Chinese submarines from its flagship aircraft carrier and was ready to intercept Chinese jets in the South China Sea if required, officers have revealed.","2021-11-05 04:39:00","Top News","https://news.sky.com/story/britain-tracked-chinese-submarines-and-was-ready-to-intercept-jets-in-south-china-sea-officers-reveal-12460378","e708c1d33bdfaa397da3f3f68681ae2d010f0fd76eaef33bb65f8cf4544a7713","c3081fcf5e32503b15940dc7206d02b4"
"'Happy Voyage Day!': Fans celebrate as ABBA release first studio album in nearly 40 years","Sky News","ABBA have released a new studio album after a nearly-40-year hiatus.","2021-11-05 00:55:00","Top News","https://news.sky.com/story/abba-release-ninth-studio-album-voyage-their-first-body-of-work-in-nearly-40-years-12460365","e708c1d33bdfaa397da3f3f68681ae2d010f0fd76eaef33bb65f8cf4544a7713","7d1fe4f41f1a1cab6928cc51c70bd25c"
"New Delhi wakes up to blanket of toxic smog and worst pollution all year after defying firework ban","Sky News","The morning after Diwali celebrations residents of New Delhi woke up to a blanket of toxic smog, breathing in the most polluted air of the year so far.","2021-11-05 08:04:00","Top News","https://news.sky.com/story/new-delhi-wakes-up-to-blanket-of-toxic-smog-and-worst-pollution-all-year-after-defying-firework-ban-12460468","e708c1d33bdfaa397da3f3f68681ae2d010f0fd76eaef33bb65f8cf4544a7713","af2ccd694fd58098a43d014b1f43eadc"
"Pfizer's new COVID pill cuts hospitalisation or death by 89%, trial results indicate","Sky News","Pfizer's new experimental COVID-19 antiviral pill cuts the risk of hospitalisation or death by 89%, the company has announced.","2021-11-05 10:56:00","Top News","https://news.sky.com/story/pfizers-new-covid-treatment-cuts-hospitalisation-by-89-trial-results-indicate-12460628","e708c1d33bdfaa397da3f3f68681ae2d010f0fd76eaef33bb65f8cf4544a7713","ca39a1ad650abc3255776f5369f9c75f"
"Barcelona to appoint former midfielder Xavi as new manager","Sky News","Barcelona are set to appoint former captain Xavi Hernandez as their new head coach, after his current club agreed to let him return to the Nou Camp.","2021-10-30 02:03:00","Top News","https://news.sky.com/story/barcelona-to-appoint-former-midfielder-xavi-as-new-manager-after-sacking-ronald-koeman-12454702","e708c1d33bdfaa397da3f3f68681ae2d010f0fd76eaef33bb65f8cf4544a7713","2603cac53290aaeb6a12d895b65477e9"
"'The world's richest are plundering the planet': Billionaires' huge carbon footprints prompt call for action","Sky News","Oxfam has called for action over billionaires plundering the planet and placing the world in grave danger from climate change with their enormous carbon footprints.","2021-11-05 10:25:00","Top News","https://news.sky.com/story/the-worlds-richest-are-plundering-the-planet-billionaires-huge-carbon-footprints-prompt-call-for-action-12460623","e708c1d33bdfaa397da3f3f68681ae2d010f0fd76eaef33bb65f8cf4544a7713","f3dd7ce9fc78250a3f612b9bc6bdadd8"
"Fourth COVID wave 'in full force' in Germany as WHO warns Europe is 'back at epicentre'","Sky News","A fourth wave of coronavirus is in full force, Germany's health minister has warned, after a 55% rise in cases over the past month.","2021-11-05 09:12:00","Top News","https://news.sky.com/story/covid-fourth-wave-in-full-force-in-germany-as-who-warns-europe-is-back-at-epicentre-12460514","e708c1d33bdfaa397da3f3f68681ae2d010f0fd76eaef33bb65f8cf4544a7713","9cbc9f0270d3d4afe2789d45e32d4c33"
"Multimillion pound beef washing conspiracy means Amazon's rainforest destroyed so the world can eat meat","Sky News","You can hear the clanking of hooves and the mooing of a hundred or so head of cattle crammed into a transporter truck, from a long way off. ","2021-11-01 15:27:00","Top News","https://news.sky.com/story/multimillion-pound-beef-washing-conspiracy-means-amazons-rainforest-destroyed-so-the-world-can-eat-meat-12457255","e708c1d33bdfaa397da3f3f68681ae2d010f0fd76eaef33bb65f8cf4544a7713","b0abf1aa599123c859ace3d190207e95"
"Family of Kenyan mother 'murdered by British soldier' take legal action against MoD","Sky News","The family of a 21-year-old Kenyan woman said to have been murdered by a British soldier are taking legal action against the Ministry of Defence.","2021-11-07 19:38:00","Top News","https://news.sky.com/story/agnes-wanjiru-family-of-kenyan-mother-murdered-by-british-soldier-take-legal-action-against-ministry-of-defence-12463516","e708c1d33bdfaa397da3f3f68681ae2d010f0fd76eaef33bb65f8cf4544a7713","54cfcf9f8b8f9e155896376e6a4d7b37"
"Boy, 10, stabbed by 'stranger' at TK Maxx store in Munich","Sky News","A 10-year-old boy has been stabbed with a kitchen knife at a branch of department store TK Maxx in Germany.","2021-11-07 16:47:00","Top News","https://news.sky.com/story/germany-boy-10-stabbed-by-stranger-at-tk-maxx-store-in-munich-12463272","e708c1d33bdfaa397da3f3f68681ae2d010f0fd76eaef33bb65f8cf4544a7713","fd05ad243866025e67abdf3c67e559d9"
"Search called off for swimmer attacked by shark in Australia","Sky News","Police in Western Australia have called off a search for a swimmer attacked by a shark.","2021-11-07 15:13:00","Top News","https://news.sky.com/story/australia-search-called-off-for-swimmer-attacked-by-shark-at-port-beach-12463112","e708c1d33bdfaa397da3f3f68681ae2d010f0fd76eaef33bb65f8cf4544a7713","d703596369edba82ea358b882fa81a65"
"US woman accused of shooting and killing neighbour after bouncy castle was allegedly stolen","Sky News","A woman in Texas has been accused of shooting and killing a neighbour after a bouncy castle was allegedly stolen.","2021-11-07 13:33:00","Top News","https://news.sky.com/story/texas-woman-accused-of-shooting-and-killing-neighbour-after-bouncy-castle-was-allegedly-stolen-12462976","e708c1d33bdfaa397da3f3f68681ae2d010f0fd76eaef33bb65f8cf4544a7713","91fddeaec87fa0a45ee6dcfb1cbc65b7"
"Afghanistan to launch polio vaccination programme as Taliban tries to improve its profile","Sky News","Afghanistan is launching a four-day polio vaccination campaign, the Taliban-run public health ministry says.","2021-11-07 13:18:00","Top News","https://news.sky.com/story/afghanistan-to-launch-four-day-polio-vaccination-programme-as-taliban-tries-to-improve-its-profile-12462947","e708c1d33bdfaa397da3f3f68681ae2d010f0fd76eaef33bb65f8cf4544a7713","422d89af9a52bf602b599f39a10e3932"
"Australian woman wins $1m  - just for getting vaccinated against COVID-19","Sky News","An Australian woman has become a millionaire after winning the country's vaccine lottery prize.","2021-11-07 10:39:00","Top News","https://news.sky.com/story/australian-woman-wins-1m-just-for-getting-vaccinated-against-covid-19-12462831","e708c1d33bdfaa397da3f3f68681ae2d010f0fd76eaef33bb65f8cf4544a7713","ebd122e6f2558c6d7e483734cc0871f8"
"Expedia stops selling holidays that include experiences with captive dolphins and whales","Sky News","Travel company Expedia has stopped selling holidays that involve performances by dolphins and whales in captivity.","2021-11-07 08:08:00","Top News","https://news.sky.com/story/expedia-stops-selling-holidays-that-include-experiences-with-captive-dolphins-and-whales-12462718","e708c1d33bdfaa397da3f3f68681ae2d010f0fd76eaef33bb65f8cf4544a7713","2ec4722e2287946727bf07b94251e1e4"
"Troops deployed around Baghdad after failed drone assassination attempt against Iraqi PM","Sky News","Iraq's prime minister has survived an attempted assassination by a drone armed with explosives.","2021-11-07 00:42:00","Top News","https://news.sky.com/story/iraq-pm-mustafa-al-kadhimi-survives-assassination-attempt-by-drone-armed-with-explosives-12462635","e708c1d33bdfaa397da3f3f68681ae2d010f0fd76eaef33bb65f8cf4544a7713","464a01c7b9dc3c176e22cf7bb62f6f95"
"Three people seriously injured in knife attack on German train","Sky News","At least three people have been left seriously injured by a knife attack on a high-speed train in Germany, the Bavarian Red Cross has said.","2021-11-06 10:36:00","Top News","https://news.sky.com/story/several-people-reported-injured-in-knife-attack-on-german-train-12461603","e708c1d33bdfaa397da3f3f68681ae2d010f0fd76eaef33bb65f8cf4544a7713","fbab1cf6fd78f42e6a62dfc889a89e08"
"'Horrendous loss of life': At least 99 people killed in Sierra Leone oil tanker explosion","Sky News","At least 99 people have been killed after an oil tanker exploded near Sierra Leone's capital, with the country's president mourning the horrendous loss of life.","2021-11-06 09:31:00","Top News","https://news.sky.com/story/sierra-leone-oil-tanker-explosion-kills-scores-of-people-in-capital-as-president-mourns-horrendous-loss-of-life-12461569","e708c1d33bdfaa397da3f3f68681ae2d010f0fd76eaef33bb65f8cf4544a7713","47fa1dcbd8eef294cac9cc31bc3fc3ea"
"Police official injured after being stabbed with knife, French interior minister says","Sky News","A French police official has been injured after being stabbed with a knife in Cannes, the country's interior minister has said.","2021-11-08 06:57:00","Top News","https://news.sky.com/story/police-official-injured-after-being-stabbed-with-knife-in-cannes-interior-minister-says-12463778","e708c1d33bdfaa397da3f3f68681ae2d010f0fd76eaef33bb65f8cf4544a7713","d83e6d07138a9650186b35b40e41b099"
"President Joe Biden congratulates Big Bird for COVID vaccine while Texas senator accuses muppet of 'propaganda'","Sky News","American President Joe Biden has weighed in after Sesame Street's Big Bird was accused of spreading propaganda by a Texas senator after the cartoon muppet announced it had been vaccinated against COVID-19.","2021-11-07 23:51:00","Top News","https://news.sky.com/story/senator-ted-cruz-accuses-sesame-streets-big-bird-of-spreading-propaganda-after-getting-covid-19-vaccine-12463707","e708c1d33bdfaa397da3f3f68681ae2d010f0fd76eaef33bb65f8cf4544a7713","0fc1890d4a3d09cd370780c5ee0d39d5"
"Australia expects to continue selling coal 'for decades into the future'","Sky News","Australia has said it expects to continue selling coal decades into the future.","2021-11-08 09:16:00","Top News","https://news.sky.com/story/climate-change-australia-expects-to-continue-to-sell-coal-for-decades-into-the-future-12463871","e708c1d33bdfaa397da3f3f68681ae2d010f0fd76eaef33bb65f8cf4544a7713","dbdcd7623b177358ea9c0de9b8c5ac20"
"Shark that killed Briton was 'big one' say witnesses - as wife pays tribute","Sky News","The wife of a British man killed by a shark was a wonderful husband and father who died doing what he enjoyed the most, his wife has said.","2021-11-08 08:12:00","Top News","https://news.sky.com/story/australia-shark-attack-wife-pays-tribute-to-wonderful-briton-killed-off-port-beach-near-perth-12463818","e708c1d33bdfaa397da3f3f68681ae2d010f0fd76eaef33bb65f8cf4544a7713","a9c941496d24fdbd933f975fb290e18f"
"Indian city sees 89 cases of Zika virus amid worsening outbreak","Sky News","The Indian city of Kanpur is seeing an outbreak of Zika virus cases, with at least 89 infections confirmed.","2021-11-08 09:04:00","Top News","https://news.sky.com/story/zika-virus-outbreak-indian-city-of-kanpur-sees-89-cases-amid-surge-in-infections-12463874","e708c1d33bdfaa397da3f3f68681ae2d010f0fd76eaef33bb65f8cf4544a7713","c69624bd0518ed05d8429772544c3f0d"
"NASA releases first images taken by Landsat climate change monitoring mission","Sky News","NASA has released the first images of Earth taken by the Landsat 9 mission which is designed to capture high-resolution snapshots of the planet to help track climate change.","2021-11-08 10:10:00","Top News","https://news.sky.com/story/nasa-releases-first-images-taken-by-landsat-climate-change-monitoring-mission-12463904","e708c1d33bdfaa397da3f3f68681ae2d010f0fd76eaef33bb65f8cf4544a7713","a4826675fc8c17ab95885e542552d5cd"
"'Borrowed to our eyeballs' and facing 'debt traps' - poor countries demand help with climate finance","Sky News","Poor countries have borrowed to our eyeballs and must be granted more cash to cope with the climate change ruining lives and livelihoods around the world, a representative of 46 developing nations has told Sky News.","2021-11-07 12:59:00","Top News","https://news.sky.com/story/cop26-borrowed-to-our-eyeballs-and-facing-debt-traps-poor-countries-call-for-more-help-with-climate-finance-12462926","e708c1d33bdfaa397da3f3f68681ae2d010f0fd76eaef33bb65f8cf4544a7713","826d75c37047225ba930543f6e08c21e"
"70 defendants found guilty in trial involving powerful 'Ndrangheta mafia group","Sky News","An Italian judge has found 70 defendants guilty in a trial involving one of the most powerful mafia groups in the country.","2021-11-08 12:02:00","Top News","https://news.sky.com/story/ndrangheta-70-defendants-found-guilty-in-trial-involving-powerful-mafia-group-12463972","e708c1d33bdfaa397da3f3f68681ae2d010f0fd76eaef33bb65f8cf4544a7713","dc77d46eb9ef4bfb2b50ce3222334dd7"
"Poland accuses Belarus of trying to incite violence as migrants attempt to cross border","Sky News","Poland has accused Belarus of trying to cause a violent provocation following reports that hundreds of migrants are attempting to cross Poland's border.","2021-11-08 10:18:00","Top News","https://news.sky.com/story/poland-accuses-belarus-of-trying-to-cause-major-incident-as-hundreds-of-migrants-attempt-to-cross-border-12463907","e708c1d33bdfaa397da3f3f68681ae2d010f0fd76eaef33bb65f8cf4544a7713","fdf98f68ba0f25324ee8fc10ebcc195a"
"NASA reveals new images taken during satellite mission that has 'power to save lives'","Sky News","NASA has released the first images of Earth taken by the Landsat 9 mission which is designed to capture high-resolution snapshots of the planet to help track climate change.","2021-11-08 10:10:00","Top News","https://news.sky.com/story/nasa-releases-first-images-taken-by-landsat-climate-change-monitoring-mission-12463904","e708c1d33bdfaa397da3f3f68681ae2d010f0fd76eaef33bb65f8cf4544a7713","6d4300e8a40e6c2675a714965a411e9b"
"French police official injured after being stabbed with knife in Cannes","Sky News","A French police official has been injured after being stabbed with a knife in Cannes.","2021-11-08 06:57:00","Top News","https://news.sky.com/story/police-official-injured-after-being-stabbed-with-knife-in-cannes-interior-minister-says-12463778","e708c1d33bdfaa397da3f3f68681ae2d010f0fd76eaef33bb65f8cf4544a7713","ae9f740b265215606ee1e31b53c8b873"
"Obama tells COP26 world 'still falling short' on fighting climate change","Sky News","Barack Obama has told the COP26 summit that the world is collectively and individually... still falling short on fighting climate change.","2021-11-08 14:30:00","Top News","https://news.sky.com/story/cop26-barack-obama-says-world-still-falling-short-on-fighting-climate-change-12464067","e708c1d33bdfaa397da3f3f68681ae2d010f0fd76eaef33bb65f8cf4544a7713","af5d6582577246af50eed4330019a49c"
"Superyacht sales soar thanks to pandemic and growing numbers of billionaires","Sky News","Sales of superyachts are soaring amid growing numbers of billionaires and the appeal of escaping crowds during the COVID pandemic.","2021-11-08 12:39:00","Top News","https://news.sky.com/story/superyacht-sales-soar-thanks-to-pandemic-and-growing-numbers-of-billionaires-12463991","e708c1d33bdfaa397da3f3f68681ae2d010f0fd76eaef33bb65f8cf4544a7713","327f22d95929f3cf8724cb73a4e2351e"
"Satellite images reveal China has built mock-up US Navy warships in remote desert","Sky News","Satellite images have revealed that China has built mock-ups of US warships in its northwestern desert.","2021-11-08 12:27:00","Top News","https://news.sky.com/story/satellite-images-reveal-china-has-built-mock-up-us-navy-warships-in-remote-desert-12463984","e708c1d33bdfaa397da3f3f68681ae2d010f0fd76eaef33bb65f8cf4544a7713","0fce2d4408283f302cdcc163857a0662"
"Knifeman shot and injured after attack on officers outside French police station","Sky News","A French police officer escaped serious injury when he was attacked with a knife in Cannes.","2021-11-08 06:57:00","Top News","https://news.sky.com/story/police-official-injured-after-being-stabbed-with-knife-in-cannes-interior-minister-says-12463778","e708c1d33bdfaa397da3f3f68681ae2d010f0fd76eaef33bb65f8cf4544a7713","ffccf9be79ca2bfc6ab48f00952a11df"
"Zaghari-Ratcliffe's husband calls on UK to be 'tougher' with Iran as he continues hunger strike","Sky News","The husband of Nazanin Zaghari-Ratcliffe has called on the British government to be a lot tougher with Iran as he continues his hunger strike outside the Foreign Office for a third week.","2021-11-08 14:35:00","Top News","https://news.sky.com/story/nazanin-zaghari-ratcliffe-husband-urges-uk-govt-to-be-a-lot-tougher-with-iran-over-wifes-detention-as-hunger-strike-continues-12464068","e708c1d33bdfaa397da3f3f68681ae2d010f0fd76eaef33bb65f8cf4544a7713","a8bf70b999eeec93d0337c7db92445aa"
"UN peacekeepers accused of helping smuggle diamonds and drugs out of Central African Republic","Sky News","A handful of Portuguese peacekeepers may have been involved in smuggling gold, diamonds and drugs out of the Central African Republic (CAR).","2021-11-08 18:55:00","Top News","https://news.sky.com/story/portuguese-un-peacekeepers-accused-of-helping-to-smuggle-diamonds-gold-and-drugs-out-of-central-african-republic-12464194","e708c1d33bdfaa397da3f3f68681ae2d010f0fd76eaef33bb65f8cf4544a7713","fb1ba3d5abfc94760412bf058d40c06b"
"COP26: President Bolsonaro no-show is no embarrassment, says Brazil's lead negotiator","Sky News","The absence of President Jair Bolsonaro at the critical UN summit in Glasgow is not a problem, Brazil's top climate diplomat has told Sky News.","2021-11-08 14:21:00","Top News","https://news.sky.com/story/cop26-president-bolsonaros-no-show-is-no-embarrassment-says-brazils-lead-negotiator-12464053","e708c1d33bdfaa397da3f3f68681ae2d010f0fd76eaef33bb65f8cf4544a7713","a27657c8f867ff6208e51d65be9ea56a"
"Australian mining community defiant on future of coal amid COP26 call to phase it out","Sky News","The last piece of coal burned in the world should come from Australia, according to members of the country's coal communities. ","2021-11-08 05:39:00","Top News","https://news.sky.com/story/cop26-australian-mining-community-defiant-on-future-of-coal-amid-calls-to-phase-it-out-12463752","e708c1d33bdfaa397da3f3f68681ae2d010f0fd76eaef33bb65f8cf4544a7713","670fc0d2847e00a76ff9a253a77270fe"
"Fire kills four newborn babies at children's hospital in India","Sky News","Four newborn babies have died after a fire broke out at a children's hospital in India, officials said.","2021-11-09 07:51:00","Top News","https://news.sky.com/story/india-fire-kills-four-newborn-babies-at-childrens-hospital-in-madhya-pradesh-12464344","e708c1d33bdfaa397da3f3f68681ae2d010f0fd76eaef33bb65f8cf4544a7713","1f124aef31aef74f3e9352fe68a7ac68"
"'Cold Bone' dinosaur that lived 214 million years ago discovered on Greenland","Sky News","Scientists have discovered the first species of dinosaur that lived on Greenland 214 million years ago, and named it Cold Bone.","2021-11-09 09:30:00","Top News","https://news.sky.com/story/cold-bone-dinosaur-that-lived-214-million-years-ago-discovered-on-greenland-12464440","e708c1d33bdfaa397da3f3f68681ae2d010f0fd76eaef33bb65f8cf4544a7713","a122963e95b5386764a4e689a90ac43f"
"Should any piece of hospital equipment cost more than $1,000 per item?","Sky News","Today's entrepreneurs who want to reduce the cost of hospital equipment down to less than $1,000 (£736) per item and ensure that girls around the world have access to a technical education have two things in common.","2021-11-02 11:30:00","Top News","https://news.sky.com/story/should-any-piece-of-hospital-equipment-cost-more-than-1000-per-item-12457843","e708c1d33bdfaa397da3f3f68681ae2d010f0fd76eaef33bb65f8cf4544a7713","e5a872e9055ed169cacd5a5f59eb6a42"
"SpaceX capsule splashes down returning astronauts to Earth","Sky News","Four astronauts have landed safely back on Earth as their SpaceX Crew Dragon capsule splashed down off the coast of Florida.","2021-11-09 11:07:00","Top News","https://news.sky.com/story/spacex-capsule-splashes-down-returning-astronauts-to-earth-12464536","e708c1d33bdfaa397da3f3f68681ae2d010f0fd76eaef33bb65f8cf4544a7713","3ffe4989387fc22c6438d3255e7789ac"
"Brothel offers customers 30 minutes with 'lady of their choice' in exchange for COVID jab","Sky News","A brothel in Vienna is providing COVID-19 vaccinations and giving those who take up the offer vouchers for a free visit.","2021-11-09 12:38:00","Top News","https://news.sky.com/story/covid-19-vienna-brothel-offers-customers-30-minutes-with-lady-of-their-choice-in-exchange-for-coronavirus-jab-12464616","e708c1d33bdfaa397da3f3f68681ae2d010f0fd76eaef33bb65f8cf4544a7713","9b05d03bb0bb92a4bdd6a7b223977be0"
"Germany urges EU unity amid growing tensions as migrants camp on Poland-Belarus border","Sky News","A group of migrants have camped overnight on the far side of Poland's eastern border in Belarus.","2021-11-09 11:52:00","Top News","https://news.sky.com/story/germany-urges-eu-unity-amid-growing-tensions-as-migrants-camp-on-poland-belarus-border-12464576","e708c1d33bdfaa397da3f3f68681ae2d010f0fd76eaef33bb65f8cf4544a7713","f728f8c84563f9f8e046b9711d42bb9b"
"COP26 pledges 'will cut warming by just a few tenths of a degree'","Sky News","Pledges to cut methane, coal and protect forests made at COP26 will reduce global warming by just a few tenths of a degree - with temperatures on course to be at least 2.4C higher by 2100, according to the first major assessment of commitments at the summit.","2021-11-09 12:47:00","Top News","https://news.sky.com/story/cop26-climate-pledges-will-cut-global-warming-by-just-a-few-tenths-of-a-degree-analysis-claims-12464632","e708c1d33bdfaa397da3f3f68681ae2d010f0fd76eaef33bb65f8cf4544a7713","9d6854c91aebe047e75b9aa552142bfb"
"'Gangster-style' Lukashenko turns to Putin in tense stand-off with EU as crisis escalates over migrants on Belarus-Poland border","Sky News","Belarus has turned to the Kremlin in its tense stand-off with the EU over the escalating crisis that has left around 2,000 migrants gathered at the country's border with Poland.","2021-11-09 11:52:00","Top News","https://news.sky.com/story/germany-urges-eu-unity-amid-growing-tensions-as-migrants-camp-on-poland-belarus-border-12464576","e708c1d33bdfaa397da3f3f68681ae2d010f0fd76eaef33bb65f8cf4544a7713","61aedeb75bd998545c474e44dda7a2f5"
"Peru: 'The glaciers are melting before our eyes - and there is no plan'","Sky News","My guide tells me it's only 260m to 270m to go.","2021-11-09 09:48:00","Top News","https://news.sky.com/story/cop26-melting-glaciers-could-see-perus-economy-crash-if-no-action-is-taken-on-climate-change-12464456","e708c1d33bdfaa397da3f3f68681ae2d010f0fd76eaef33bb65f8cf4544a7713","a562b41e53e6a16c9c5e38f63e096420"
"US signals return to climate leadership after 'unfortunate' Trump years","Sky News","The US is signalling a return to the world stage in a leadership role on climate, after President Donald Trump withdrew from the Paris climate agreement.","2021-11-09 15:50:00","Top News","https://news.sky.com/story/cop26-nancy-pelosi-flaunts-us-return-to-climate-leadership-after-unfortunate-trump-years-12464747","e708c1d33bdfaa397da3f3f68681ae2d010f0fd76eaef33bb65f8cf4544a7713","9a2142b7bbeda68813c3464ffe1098ed"
"'Gangster-style' Lukashenko turns to Putin in tense stand-off with EU as migrant border crisis escalates","Sky News","Belarus has turned to the Kremlin in its tense stand-off with the EU over the escalating crisis that has left around 2,000 migrants gathered at the country's border with Poland.","2021-11-09 11:52:00","Top News","https://news.sky.com/story/germany-urges-eu-unity-amid-growing-tensions-as-migrants-camp-on-poland-belarus-border-12464576","e708c1d33bdfaa397da3f3f68681ae2d010f0fd76eaef33bb65f8cf4544a7713","5e55ed65957761d5acf2c5d73c22d128"
"'You leave us no choice': Squid Game series two confirmed by creator Hwang Dong-hyuk","Sky News","Squid Game will return for a second series, according to its creator and director.","2021-11-09 17:17:00","Top News","https://news.sky.com/story/squid-game-series-two-confirmed-by-creator-hwang-dong-hyuk-after-south-korean-shows-record-netflix-success-12464800","e708c1d33bdfaa397da3f3f68681ae2d010f0fd76eaef33bb65f8cf4544a7713","94042cf2af9f31a8db1e4a671980ada1"
"Russia's hand 'at play' in brewing Bosnia crisis which could see war, UK minister says","Sky News","A UK minister has said Russia's hand is at play in the brewing Bosnia crisis, which experts fear could lead to another war.","2021-11-09 17:58:00","Top News","https://news.sky.com/story/bosnia-uk-minister-says-russias-hand-at-play-in-brewing-crisis-experts-fear-could-lead-to-another-war-12464820","e708c1d33bdfaa397da3f3f68681ae2d010f0fd76eaef33bb65f8cf4544a7713","17a318af6f931532ad6ea9baec710f3a"
"Singapore government to no longer pay COVID medical bills for patients 'unvaccinated by choice'","Sky News","Singapore will no longer pay the medical bills for coronavirus patients who remain unvaccinated by choice, the country's government has said.","2021-11-10 04:29:00","Top News","https://news.sky.com/story/singapore-government-to-no-longer-pay-covid-medical-bills-for-patients-unvaccinated-by-choice-12464966","e708c1d33bdfaa397da3f3f68681ae2d010f0fd76eaef33bb65f8cf4544a7713","11bf6b408fcafe33f69f7607fb86d788"
"Marie Antoinette's diamond bracelets sell for more than £6 million at auction","Sky News","A pair of diamond bracelets that belonged to Queen of France Marie Antoinette have sold at auction for $8.18 million (£6.03 million).","2021-11-10 00:38:00","Top News","https://news.sky.com/story/marie-antoinettes-diamond-bracelets-sell-for-more-than-1636-million-at-auction-after-being-in-family-for-200-years-12464951","e708c1d33bdfaa397da3f3f68681ae2d010f0fd76eaef33bb65f8cf4544a7713","59315c11cdc5531d6b7343b7c870ea3b"
