"How one man's goal to build a huge urban forest hopes to save a city heading for disaster","Sky News","Rio de Janeiro is considered one of the most vulnerable cities in Latin America when it comes to climate change.","2021-11-09 20:12:00","Top News","https://news.sky.com/story/brazil-how-one-mans-goal-to-build-a-huge-urban-forest-hopes-to-save-a-city-teetering-towards-disaster-12464878","e708c1d33bdfaa397da3f3f68681ae2d010f0fd76eaef33bb65f8cf4544a7713","3ad2471529d0d83179dd672a7c78363a"
"Ethiopia crisis escalates as 16 UN staff detained and Britons warned to leave immediately","Sky News","At least 16 UN workers have been detained against their will in war-torn Ethiopia, while British nationals have been told to leave the African nation immediately.","2021-11-09 18:34:00","Top News","https://news.sky.com/story/ethiopia-crisis-escalates-as-16-un-staff-detained-and-britons-warned-to-leave-country-immediately-12464842","e708c1d33bdfaa397da3f3f68681ae2d010f0fd76eaef33bb65f8cf4544a7713","d8c2a82424ef45b697fb1cfb1925b92c"
"Icelandic glacier melting faster than it can recover, experts warn","Sky News","An Icelandic glacier is melting faster than it can recover due to climate change, experts have warned, as footage has captured the startling rate of melting ice.","2021-11-09 13:31:00","Top News","https://news.sky.com/story/climate-change-icelandic-glacier-melting-faster-than-it-can-recover-experts-warn-12464649","e708c1d33bdfaa397da3f3f68681ae2d010f0fd76eaef33bb65f8cf4544a7713","33af8780761e305e9a92314f0f456adb"
"Sixty-year-old fights off crocodile with pocket knife and drives himself to hospital","Sky News","A 60-year-old in Australia fought off a crocodile with a pocket knife after the reptile tried dragging him underwater.","2021-11-10 09:30:00","Top News","https://news.sky.com/story/australian-60-fights-of-crocodile-with-pocket-knife-and-drives-himself-to-hospital-12465108","e708c1d33bdfaa397da3f3f68681ae2d010f0fd76eaef33bb65f8cf4544a7713","63e5385d296e9567a360c1c414e5f2ec"
"COP26: Draft agreement urges accelerated end to fossil fuel subsidies","Sky News","A first draft of a key political decision countries will issue at the end of the Glasgow climate summit has been published by the United Kingdom presidency of the talks.","2021-11-10 08:04:00","Top News","https://news.sky.com/story/cop26-countries-urged-to-accelerate-end-to-fossil-fuel-subsidies-in-draft-agreement-from-glasgow-climate-talks-12465048","e708c1d33bdfaa397da3f3f68681ae2d010f0fd76eaef33bb65f8cf4544a7713","2c01b6b0de782e892a38ff229f5ee9d1"
"Belarus migrants: Two groups cross border into Poland as forces accused of firing shots into the air","Sky News","Two groups of migrants have reportedly managed to cross the border from Belarus into Poland, amid accusations that Belarusian forces have fired shots into the air near a makeshift camp.","2021-11-10 10:54:00","Top News","https://news.sky.com/story/belarus-migrants-two-groups-cross-border-into-poland-as-forces-accused-of-firing-shots-into-the-air-12465162","e708c1d33bdfaa397da3f3f68681ae2d010f0fd76eaef33bb65f8cf4544a7713","0d794a1c83453208655ad432bd28a65e"
"'I let myself down': McDonald's boss apologises for sending 'racist' text after child shootings","Sky News","The chief executive of McDonald's has apologised after activists said a text he sent about shootings in Chicago was ignorant, racist and unacceptable.","2021-11-10 09:17:00","Top News","https://news.sky.com/story/mcdonalds-chief-executive-apologises-for-sending-text-message-described-as-racist-after-chicago-child-shootings-12465093","e708c1d33bdfaa397da3f3f68681ae2d010f0fd76eaef33bb65f8cf4544a7713","dfe5c8320f647963862da16a41eb30d3"
"'It was like judgement day': 21 survive being buried under rubble after building collapses","Sky News","Twenty-one people have reportedly survived after being buried in rubble during a building collapse in Turkey, with no others believed to be missing.","2021-11-10 10:54:00","Top News","https://news.sky.com/story/turkey-building-collapse-21-survive-being-buried-under-rubble-according-to-reports-12465159","e708c1d33bdfaa397da3f3f68681ae2d010f0fd76eaef33bb65f8cf4544a7713","f3ab093368b31e964914589404d561f8"
"North Korean hackers detected searching for COVID vaccine manufacturing secrets","Sky News","North Korean hackers have been detected attempting to steal information from a multinational life sciences company involved in manufacturing coronavirus vaccines.","2021-11-10 12:59:00","Top News","https://news.sky.com/story/covid-19-north-korean-hackers-detected-searching-for-vaccine-manufacturing-secrets-12465280","e708c1d33bdfaa397da3f3f68681ae2d010f0fd76eaef33bb65f8cf4544a7713","16996d6534e113a4678fb7daa23f896f"
"Chennai prepares for more rainfall as residents struggle to cope with flooding","Sky News","We're standing in the bedroom of a house, knee-deep in filthy floodwater.","2021-11-10 12:50:00","Top News","https://news.sky.com/story/climate-crisis-chennai-prepares-for-more-rainfall-as-residents-struggle-to-cope-with-flooding-12465271","e708c1d33bdfaa397da3f3f68681ae2d010f0fd76eaef33bb65f8cf4544a7713","906c255ac180ae99ae9305194eefb379"
"Migrant crisis on Belarus-Poland border has been frighteningly easy for Minsk to orchestrate","Sky News","Seeing the hand of Russia behind the misery of migrants on the Belarus-Polish border, as Poland's prime minister does, may overestimate President Putin's agency over his rogue Belarusian counterpart and underestimate Alexander Lukashenko's desire and ability to wreak his own revenge on the EU for its escalating sanctions regime. ","2021-11-10 14:29:00","Top News","https://news.sky.com/story/migrant-crisis-on-belarus-polish-border-has-been-frighteningly-easy-for-minsk-to-orchestrate-12465359","e708c1d33bdfaa397da3f3f68681ae2d010f0fd76eaef33bb65f8cf4544a7713","5d92b93d315a7cd9aecb315ff5bff4cd"
"PSG midfielder Aminata Diallo arrested following alleged attack on teammate","Sky News","Police have arrested Paris Saint-Germain midfielder Aminata Diallo in connection with an alleged attack on one of her teammates.","2021-11-10 14:13:00","Top News","https://news.sky.com/story/aminata-diallo-psg-midfielder-arrested-following-alleged-attack-on-teammate-12465349","e708c1d33bdfaa397da3f3f68681ae2d010f0fd76eaef33bb65f8cf4544a7713","d12e4c703ef5f914df77d4f359402914"
"Saudi Arabia denies 'fabrications' that it is trying to derail COP26 negotiations","Sky News","“This is where the game begins.","2021-11-10 14:08:00","Top News","https://news.sky.com/story/cop26-saudi-arabia-denies-fabrications-that-it-is-trying-to-derail-summit-negotiations-12465348","e708c1d33bdfaa397da3f3f68681ae2d010f0fd76eaef33bb65f8cf4544a7713","b8f1b9d9c1b60b89abca6e51f9b11e8a"
"International Space Station being forced to swerve to avoid Chinese satellite junk","Sky News","The International Space Station (ISS) is being forced to swerve to avoid a collision with a fragment of a Chinese satellite, according to Russian space agency Roscosmos.","2021-11-10 13:51:00","Top News","https://news.sky.com/story/international-space-station-being-forced-to-swerve-to-avoid-chinese-satellite-junk-12465331","e708c1d33bdfaa397da3f3f68681ae2d010f0fd76eaef33bb65f8cf4544a7713","1873eeb8b2cedf91d8fed9cf1c2a66cc"
"Doctor diagnoses woman with 'climate change' after breathing problems amid heatwaves and wildfires","Sky News","A Canadian doctor has diagnosed a woman with climate change after she came to hospital with breathing problems.","2021-11-10 10:22:00","Top News","https://news.sky.com/story/canadian-doctor-diagnoses-woman-in-british-columbia-with-climate-change-after-breathing-problems-during-summer-of-heatwaves-and-wildfires-12465131","e708c1d33bdfaa397da3f3f68681ae2d010f0fd76eaef33bb65f8cf4544a7713","b41fb715b8095606e49f038e8c6c2d0c"
"NASA delays moon landings as China becomes 'aggressive competitor' in space race","Sky News","NASA's administrator Bill Nelson said that the space agency's planned moon landings will likely take place no earlier than 2025 but warned about Washington slipping behind Beijing.","2021-11-10 12:18:00","Top News","https://news.sky.com/story/nasa-delays-moon-landings-as-china-becomes-aggressive-competitor-in-space-race-12465243","e708c1d33bdfaa397da3f3f68681ae2d010f0fd76eaef33bb65f8cf4544a7713","7ab6457208f0ab9748c9bd2c1b37550a"
"Clinical trials start for new Ebola vaccine developed by the University of Oxford","Sky News","Clinical trials are starting for a new Ebola vaccine developed by the University of Oxford, designed to tackle the two strains responsible for nearly all outbreaks and deaths worldwide.","2021-11-11 01:59:00","Top News","https://news.sky.com/story/clinical-trials-start-for-new-ebola-vaccine-developed-by-the-university-of-oxford-12465671","e708c1d33bdfaa397da3f3f68681ae2d010f0fd76eaef33bb65f8cf4544a7713","98a851002fe2bb29aebeffdb98e254cb"
"US high school teacher who redesigned curriculum for her refugee students wins $1 million Global Teacher Prize","Sky News","A Maryland high school teacher who has devoted her career to teaching immigrant children has been awarded the annual million-dollar (£745,670) Global Teacher Prize.","2021-11-11 00:41:00","Top News","https://news.sky.com/story/us-high-school-teacher-who-redesigned-curriculum-for-her-refugee-students-wins-1-million-global-teacher-prize-12465664","e708c1d33bdfaa397da3f3f68681ae2d010f0fd76eaef33bb65f8cf4544a7713","ab22a6aa1e5af601e64a1de33c92674e"
"'I know it will make a difference': Brazilian's rooftop fight against climate change","Sky News","In the Parque Arara favela north of Rio, I'm invited into Luis Cassiano's piece of tropical paradise, nestled in between a chaos of corrugated iron and breeze blocks.","2021-11-10 21:50:00","Top News","https://news.sky.com/story/climate-change-brazilian-turns-rooftop-into-tropical-paradise-in-fight-against-global-warming-12465620","e708c1d33bdfaa397da3f3f68681ae2d010f0fd76eaef33bb65f8cf4544a7713","02b5751133ea079b08b8c9d07e7b8d4a"
"La Palma volcano covers homes in ash as eruption continues more than five weeks after it began","Sky News","Homes on the island of La Palma have been left covered in ash as the Cumbre Vieja volcano continues to erupt.","2021-11-10 21:36:00","Top News","https://news.sky.com/story/la-palma-eruption-homes-covered-in-ash-as-volcano-continues-to-emit-magma-and-gas-more-than-five-weeks-after-it-began-12465616","e708c1d33bdfaa397da3f3f68681ae2d010f0fd76eaef33bb65f8cf4544a7713","eb01ebe0b6d20b01d8e8386e79409cd5"
"Arrest warrant for grandfather accused of kidnapping sole survivor of cable car crash","Sky News","An international arrest warrant has been issued for a grandfather accused of kidnapping his grandson, the sole survivor of a cable car crash in Italy.","2021-11-10 19:25:00","Top News","https://news.sky.com/story/shmuel-peleg-arrest-warrant-for-grandfather-accused-of-kidnapping-sole-survivor-of-italy-cable-car-crash-12465551","e708c1d33bdfaa397da3f3f68681ae2d010f0fd76eaef33bb65f8cf4544a7713","c64595cecebc1a22e2ebadbda34f060c"
"COVID-19: Will eastern Europe face repeated restrictions until vaccination rates rise?","Sky News","Scientists have warned that some countries in eastern Europe risk facing repeated COVID-19 restrictions until vaccination rates improve.","2021-11-10 12:57:00","Top News","https://news.sky.com/story/covid-19-will-eastern-europe-face-repeated-restrictions-until-vaccination-rates-rise-12465275","e708c1d33bdfaa397da3f3f68681ae2d010f0fd76eaef33bb65f8cf4544a7713","26ea6658e3e5c315fac24ff7ab99a1cd"
"US and China announce surprise declaration to work together on climate","Sky News","The United States and China have released a rare joint declaration on climate change, saying there is more agreement between China and the US than divergence”.","2021-11-10 08:04:00","Top News","https://news.sky.com/story/cop26-us-and-china-announce-unexpected-declaration-to-work-together-on-climate-change-measures-12465048","e708c1d33bdfaa397da3f3f68681ae2d010f0fd76eaef33bb65f8cf4544a7713","5783ba7678c449d4b22661eed43ef048"
"Former president of South Africa, FW de Klerk, dies at age of 85","Sky News","FW de Klerk, former president of South Africa, has died at the age of 85.","2021-11-11 10:41:00","Top News","https://news.sky.com/story/former-president-of-south-africa-fw-de-klerk-dies-at-age-of-85-12465881","e708c1d33bdfaa397da3f3f68681ae2d010f0fd76eaef33bb65f8cf4544a7713","32b4a597d70183613653208541d2ac99"
"Last president of apartheid South Africa, FW de Klerk, dies aged 85","Sky News","FW de Klerk, the last president of apartheid South Africa, has died at the age of 85.","2021-11-11 10:41:00","Top News","https://news.sky.com/story/former-president-of-south-africa-fw-de-klerk-dies-at-age-of-85-12465881","e708c1d33bdfaa397da3f3f68681ae2d010f0fd76eaef33bb65f8cf4544a7713","c35c8a06a544fa9e795347cfe7507a18"
"Concern over climate finance for poor nations amid race to strike COP26 deal","Sky News","The president of the COP26 climate talks has sounded the alarm on a number of issues outstanding on funding for poor nations, urging progress on all topics before we are literally out of time.","2021-11-11 11:03:00","Top News","https://news.sky.com/story/cop26-president-alok-sharma-airs-concern-over-climate-finance-for-poor-nations-amid-race-to-strike-deal-were-not-there-yet-12465904","e708c1d33bdfaa397da3f3f68681ae2d010f0fd76eaef33bb65f8cf4544a7713","8787484155511a6eb9abf2b71ca80bda"
"US govt sues Uber over 'discriminatory' wait time fees for disabled passengers","Sky News","Uber is being sued by the US government for allegedly overcharging disabled people.","2021-11-11 12:46:00","Top News","https://news.sky.com/story/uber-us-govt-sues-ride-hailing-app-over-discriminatory-wait-time-fees-for-disabled-passengers-12466030","e708c1d33bdfaa397da3f3f68681ae2d010f0fd76eaef33bb65f8cf4544a7713","87429245a0bc5ca7536c38d71e76f611"
"Latest COP26 deal draft an attempt to 'cheat, greenwash and find loopholes', campaigners say","Sky News","A key commitment on fossil fuels has been watered down in a draft of the final agreement between nearly 200 nations at the COP26 climate summit - and the latest text has sparked a backlash from campaigners.","2021-11-12 08:56:00","Top News","https://news.sky.com/story/cop26-latest-draft-agreement-an-attempt-to-cheat-greenwash-and-find-loopholes-climate-campaigners-say-12466712","e708c1d33bdfaa397da3f3f68681ae2d010f0fd76eaef33bb65f8cf4544a7713","a8ade4abfd55a9981eaf4cc9b0fdcdf7"
"China's Communist Party elevates Xi Jinping's authority with 'historical resolution'","Sky News","President Xi Jinping has extended his power after the Chinese Communist Party (CCP) passed a historical resolution, further elevating his status and comparing him to Mao Zedong.","2021-11-12 08:05:00","Top News","https://news.sky.com/story/chinas-communist-party-cements-xi-jinpings-authority-with-historical-resolution-12466679","e708c1d33bdfaa397da3f3f68681ae2d010f0fd76eaef33bb65f8cf4544a7713","eea4c2d23501564df290d9af5ee50f42"
"Austria to place millions of unvaccinated people into lockdown 'in days' as COVID cases surge","Sky News","Austria is just days away from placing millions of people who are not fully-vaccinated against coronavirus into lockdown, as daily infections are at a record high, the country's chancellor has said.","2021-11-12 05:32:00","Top News","https://news.sky.com/story/covid-19-austria-to-place-millions-of-unvaccinated-people-into-lockdown-in-days-as-coronavirus-cases-surge-12466575","e708c1d33bdfaa397da3f3f68681ae2d010f0fd76eaef33bb65f8cf4544a7713","0ed1782c3d398aefd402da4bfb64f6a9"
"Olympic gold medallist says she was pepper-sprayed in racist attack","Sky News","An Olympic gold medallist has said she was pepper-sprayed in a racist attack while waiting for an Uber with a group of friends.","2021-11-12 04:38:00","Top News","https://news.sky.com/story/olympic-gold-medallist-suni-lee-says-she-was-pepper-sprayed-in-racist-attack-while-waiting-for-uber-12466567","e708c1d33bdfaa397da3f3f68681ae2d010f0fd76eaef33bb65f8cf4544a7713","370d41b2e5e25ac156b42ab67b045aa0"
"About 1,000 migrants cross into the UK in one day as government says 'British public have had enough'","Sky News","It is estimated that about 1,000 migrants crossed into the UK on Thursday as the government warns the number of people departing from France is unacceptable.","2021-11-12 03:42:00","Top News","https://news.sky.com/story/around-1000-migrants-cross-into-the-uk-in-one-day-as-government-says-british-public-have-had-enough-12466562","e708c1d33bdfaa397da3f3f68681ae2d010f0fd76eaef33bb65f8cf4544a7713","c81f35dd20ef058755c916aca3e5fa18"
"'He beat us for three hours' - the stories of asylum seekers trying to make it into Poland","Sky News","Outside a detention centre in the Polish city of Bialystok, where we know asylum seekers who crossed the border from Belarus are being held, we meet a local mother and son.","2021-11-12 01:37:00","Top News","https://news.sky.com/story/he-beat-us-for-three-hours-the-stories-of-asylum-seekers-trying-to-make-it-in-poland-12466557","e708c1d33bdfaa397da3f3f68681ae2d010f0fd76eaef33bb65f8cf4544a7713","d950a8662c64363620a8c8defc12a3b9"
"Leader of one of most climate-vulnerable nations says Boris Johnson's language doesn't 'convey seriousness' of crisis","Sky News","The leader of one of the world's most climate-vulnerable nations has told Sky News that the commitments at the Glasgow summit have no teeth and are just aspirational.","2021-11-12 00:52:00","Top News","https://news.sky.com/story/cop26-bahamas-pm-says-climate-summit-has-no-teeth-and-boris-johnsons-language-doesnt-convey-seriousness-of-the-climate-crisis160-12466556","e708c1d33bdfaa397da3f3f68681ae2d010f0fd76eaef33bb65f8cf4544a7713","73445d1119d16ad1edb0ced5d8ab6b07"
"'Without coal this area cannot exist': The impoverished who rely on India's mining industry","Sky News","What's happening is so extraordinary that at first it's difficult to make sense of it.","2021-11-11 14:43:00","Top News","https://news.sky.com/story/without-coal-this-area-cannot-exist-the-impoverished-who-rely-on-indias-coal-industry-after-cop26-pledge-to-go-net-zero-by-2070-12466128","e708c1d33bdfaa397da3f3f68681ae2d010f0fd76eaef33bb65f8cf4544a7713","10e229468d91b9f5ec71654ec73835ae"
"'Yes means yes': Sexual consent laws set for 'significant' reform in New South Wales","Sky News","The New South Wales lower house has passed legislation that could see affirmative consent incorporated into the law, changing the way courts understand consent in rape and sexual assault cases.","2021-11-11 11:04:00","Top News","https://news.sky.com/story/new-south-wales-moves-one-step-closer-to-making-significant-changes-to-consent-laws-12465909","e708c1d33bdfaa397da3f3f68681ae2d010f0fd76eaef33bb65f8cf4544a7713","480c00359dfdbd5cbc0e9e8a2517b281"
"COP26: 'Very bad signal' - fossil fuel phrase must not disappear from agreement, says EU's Timmermans","Sky News","A promise to end fossil fuel subsidies must not disappear from a final COP26 agreement despite opposition, the European Union's climate policy chief has warned.","2021-11-11 11:03:00","Top News","https://news.sky.com/story/cop26-very-bad-signal-fossil-fuel-phrase-must-not-disappear-from-agreement-says-eus-timmermans-12465904","e708c1d33bdfaa397da3f3f68681ae2d010f0fd76eaef33bb65f8cf4544a7713","fd657b351d6819a83d03987405236ba3"
"AstraZeneca eyes 'modest' profit from COVID-19 vaccine","Sky News","Drugs firm AstraZeneca has said it plans to start earning a modest profit from its COVID-19 vaccine having previously sold it at cost.","2021-11-12 08:30:00","Top News","https://news.sky.com/story/astrazeneca-eyes-modest-profit-from-covid-19-vaccine-12466692","e708c1d33bdfaa397da3f3f68681ae2d010f0fd76eaef33bb65f8cf4544a7713","0ecbc431a4aaf686cbb9c1e7765e4245"
"US journalist jailed for 11 years in Myanmar, lawyer says","Sky News","A US journalist has been jailed for 11 years in Myanmar, his lawyer has said.","2021-11-12 10:14:00","Top News","https://news.sky.com/story/us-journalist-danny-fenster-jailed-for-11-years-in-myanmar-lawyer-says-12466762","e708c1d33bdfaa397da3f3f68681ae2d010f0fd76eaef33bb65f8cf4544a7713","be2c1193523817253fe237a44104a205"
"AstraZeneca eyes profit from COVID-19 vaccine but pledges 'it will never be high priced'","Sky News","Drugs firm AstraZeneca has said it plans to start earning a modest profit from its COVID-19 vaccine having previously sold it at cost.","2021-11-12 08:30:00","Top News","https://news.sky.com/story/astrazeneca-eyes-modest-profit-from-covid-19-vaccine-12466692","e708c1d33bdfaa397da3f3f68681ae2d010f0fd76eaef33bb65f8cf4544a7713","48297e0bf5b32eb5008c81ac8b9d033d"
"What is causing the migrant crisis at the Belarus-Poland border?","Sky News","Thousands of migrants are enduring freezing conditions at the Belarus-Poland border in the hope of a better life inside the EU.","2021-11-12 09:43:00","Top News","https://news.sky.com/story/what-is-causing-the-migrant-crisis-at-the-belarus-poland-border-12466745","e708c1d33bdfaa397da3f3f68681ae2d010f0fd76eaef33bb65f8cf4544a7713","4076525101c3302e4fba9e042f8b857a"
"Austria to place unvaccinated people into lockdown from Monday as COVID cases surge","Sky News","Unvaccinated people in two hard-hit regions in Austria will be placed under lockdown next week as the government looks at doing the same nationwide due to rising COVID-19 cases.","2021-11-12 05:32:00","Top News","https://news.sky.com/story/covid-19-austria-to-place-millions-of-unvaccinated-people-into-lockdown-in-days-as-coronavirus-cases-surge-12466575","e708c1d33bdfaa397da3f3f68681ae2d010f0fd76eaef33bb65f8cf4544a7713","71d2f626f08b34b83a8f04aba668e586"
"'Small team' of British troops deployed to Belarus-Poland border amid migrant crisis","Sky News","A small team of British troops have deployed to Poland's border with Belarus to support Polish forces amid a growing migrant crisis that Warsaw has blamed on pro-Russia Minsk.","2021-11-12 15:03:00","Top News","https://news.sky.com/story/small-team-of-british-troops-deployed-to-belarus-border-to-support-polish-forces-amid-growing-migrant-crisis-12467012","e708c1d33bdfaa397da3f3f68681ae2d010f0fd76eaef33bb65f8cf4544a7713","a5f25ffc58600b16a5f4bdec7f5a67f0"
"Build-up of Russian troops on Ukraine-Russia border sparks concerns among Western allies","Sky News","A build-up of Russian troops on Russia's border with Ukraine has triggered concern among the UK, US and other Western allies about the potential of a military attack.","2021-11-12 13:28:00","Top News","https://news.sky.com/story/build-up-of-russian-troops-on-ukraine-russia-border-sparks-concerns-among-western-allies-12466937","e708c1d33bdfaa397da3f3f68681ae2d010f0fd76eaef33bb65f8cf4544a7713","b3ccf20e75b1eb17d63bda881b33c1d2"
"Grandparents have 15 days to return six-year-old cable car crash survivor to Italy","Sky News","An appeals court in Israel has ruled that a six-year old boy whose parents died in a cable car crash must be returned to his relatives in Italy within 15-days, upholding an earlier ruling in a bitter custody battle.","2021-11-12 10:22:00","Top News","https://news.sky.com/story/grandparents-of-six-year-old-cable-car-crash-survivor-eitan-biran-given-15-days-to-return-him-to-italy-12466769","e708c1d33bdfaa397da3f3f68681ae2d010f0fd76eaef33bb65f8cf4544a7713","324119e96f2551e608259845736cfab3"
"AstraZeneca accused of breaking promises as it looks to make a profit on COVID-19 vaccine","Sky News","Oxfam has accused AstraZeneca of breaking its promises after the drugs firm said it planned to start earning a modest profit from its COVID-19 vaccine having previously sold it at cost.","2021-11-12 08:30:00","Top News","https://news.sky.com/story/astrazeneca-eyes-modest-profit-from-covid-19-vaccine-12466692","e708c1d33bdfaa397da3f3f68681ae2d010f0fd76eaef33bb65f8cf4544a7713","aa8da7c1cebb01d2fd03eae18f296a90"
"Poverty fuelled by climate change driving deforestation and poaching - putting Madagascar's wildlife at risk","Sky News","The guardians of one of Madagascar's forests are downright worried.","2021-11-12 10:54:00","Top News","https://news.sky.com/story/poverty-fuelled-by-climate-change-is-driving-deforestation-and-poaching-putting-madagascars-endemic-wildlife-at-risk-12466798","e708c1d33bdfaa397da3f3f68681ae2d010f0fd76eaef33bb65f8cf4544a7713","af1ffe48ff8c493ee5b9a96ed7ecbaa0"
"A rainforest without rain: Madagascar's unique natural treasures are slowly dying in front of us","Sky News","The guardians of one of Madagascar's forests are downright worried.","2021-11-12 10:54:00","Top News","https://news.sky.com/story/poverty-fuelled-by-climate-change-is-driving-deforestation-and-poaching-putting-madagascars-endemic-wildlife-at-risk-12466798","e708c1d33bdfaa397da3f3f68681ae2d010f0fd76eaef33bb65f8cf4544a7713","ddfb7553012c3dee40ba51d2faddd667"
"Netherlands to return to partial lockdown amid COVID surge","Sky News","The Netherlands will return to a partial lockdown from Saturday amid a surge in COVID-19 cases, its government has announced.","2021-11-12 18:01:00","Top News","https://news.sky.com/story/covid-19-netherlands-to-return-to-partial-lockdown-amid-infection-rise-12467170","e708c1d33bdfaa397da3f3f68681ae2d010f0fd76eaef33bb65f8cf4544a7713","02d2243c33d74941105bbc07e75c34c8"
"Netherlands to return to partial lockdown as COVID cases surge","Sky News","The Netherlands will return to a partial lockdown from Saturday amid a surge in COVID-19 cases, its government has announced.","2021-11-12 18:01:00","Top News","https://news.sky.com/story/covid-19-netherlands-to-return-to-partial-lockdown-amid-infection-rise-12467170","e708c1d33bdfaa397da3f3f68681ae2d010f0fd76eaef33bb65f8cf4544a7713","8bf9895997020d90348b11eae9088ff8"
