"A chickpea genetic variation map based on the sequencing of 3,366 genomes","Nature","Nature, Published online: 10 November 2021; doi:10.1038/s41586-021-04066-1Whole-genome sequencing of 3,171 cultivated and 195 wild chickpea accessions is used to construct a chickpea pan-genome, providing insight into chickpea evolution and enabling breeding strategies that could improve crop productivity.","2021-11-10 00:00:00","Science","https://www.nature.com/articles/s41586-021-04066-1","ff3fcddf7772101e9a52107b5634f5d80b4d54ac2ddcc5e1af09f50024bb09ed","2dcdec8a324480a4bd81386c1209645a"
"Triangulation supports agricultural spread of the Transeurasian languages","Nature","Nature, Published online: 10 November 2021; doi:10.1038/s41586-021-04108-8A ‘triangulation’ approach combining linguistics, archaeology and genetics suggests that the origin and spread of Transeurasian family of languages can be traced back to early millet farmers in Neolithic North East Asia.","2021-11-10 00:00:00","Science","https://www.nature.com/articles/s41586-021-04108-8","ff3fcddf7772101e9a52107b5634f5d80b4d54ac2ddcc5e1af09f50024bb09ed","1c15376308d717760d98b5aa4989132c"
"Cognitive control persistently enhances hippocampal information processing","Nature","Nature, Published online: 10 November 2021; doi:10.1038/s41586-021-04070-5Studies in mice show that cognitive control training rapidly improves brain circuit function and enhances subsequent learning, which both persist for months.","2021-11-10 00:00:00","Science","https://www.nature.com/articles/s41586-021-04070-5","ff3fcddf7772101e9a52107b5634f5d80b4d54ac2ddcc5e1af09f50024bb09ed","5d0e787f1fd5f8f90b49c20c7c18fa8b"
"Dietary palmitic acid promotes a prometastatic memory via Schwann cells","Nature","Nature, Published online: 10 November 2021; doi:10.1038/s41586-021-04075-0Palmitic acid induces stable transcriptional and chromatin changes that lead to long-term stimulation of metastasis in orthotopic models of cancer through the secretion by tumour-associated Schwann cells of a specialized proregenerative extracellular matrix, the ablation of which inhibits metastasis initiation.","2021-11-10 00:00:00","Science","https://www.nature.com/articles/s41586-021-04075-0","ff3fcddf7772101e9a52107b5634f5d80b4d54ac2ddcc5e1af09f50024bb09ed","eb39db64c164be072fc806903a8b0302"
"Structures of the HER2–HER3–NRG1β complex reveal a dynamic dimer interface","Nature","Nature, Published online: 10 November 2021; doi:10.1038/s41586-021-04084-zCryo-electron microscopy structures of the HER2–HER3–NRG1β complex reveal a dynamic HER2–HER3 interface and explain the mechanism for the activating HER2 cancer mutations.","2021-11-10 00:00:00","Science","https://www.nature.com/articles/s41586-021-04084-z","ff3fcddf7772101e9a52107b5634f5d80b4d54ac2ddcc5e1af09f50024bb09ed","962a35bbc7e0d4d22d945b6ddb3d5e99"
"In situ formation of ZnOx species for efficient propane dehydrogenation","Nature","Nature, Published online: 10 November 2021; doi:10.1038/s41586-021-03923-3Propene is obtained through propane dehydrogenation using catalysts that are toxic, expensive or demanding to regenerate with ecologically harmful compounds, but the ZnO-based alternative reported here is cheap, clean and scalable.","2021-11-10 00:00:00","Science","https://www.nature.com/articles/s41586-021-03923-3","ff3fcddf7772101e9a52107b5634f5d80b4d54ac2ddcc5e1af09f50024bb09ed","5490783d18c6aac61d38af8c9c96afe4"
"Allometric rules for mammalian cortical layer 5 neuron biophysics","Nature","Nature, Published online: 10 November 2021; doi:10.1038/s41586-021-04072-3Analyses of layer 5 cortical pyramidal neurons in 10 mammalian species show that human neurons are distinct in that they do not follow the expected allometric relationship between neuron size and membrane conductance.","2021-11-10 00:00:00","Science","https://www.nature.com/articles/s41586-021-04072-3","ff3fcddf7772101e9a52107b5634f5d80b4d54ac2ddcc5e1af09f50024bb09ed","c6a7e585fecad3e7628e93d158acf962"
"Diverse alterations associated with resistance to KRAS(G12C) inhibition","Nature","Nature, Published online: 10 November 2021; doi:10.1038/s41586-021-04065-2Multiple treatment-emergent alterations appear in patients with advanced-stage cancer who were treated with a KRAS inhibitor.","2021-11-10 00:00:00","Science","https://www.nature.com/articles/s41586-021-04065-2","ff3fcddf7772101e9a52107b5634f5d80b4d54ac2ddcc5e1af09f50024bb09ed","a8544586cef357ef70368a7d487c38b3"
"Dynamic slab segmentation due to brittle–ductile damage in the outer rise","Nature","Nature, Published online: 10 November 2021; doi:10.1038/s41586-021-03937-xNumerical subduction models used to determine the consequences of bending-induced plate damage show that slab weakening and segmentation can occur at the outer-rise region of the subducting plate.","2021-11-10 00:00:00","Science","https://www.nature.com/articles/s41586-021-03937-x","ff3fcddf7772101e9a52107b5634f5d80b4d54ac2ddcc5e1af09f50024bb09ed","c04972e11d3e642dfc1be4014406b704"
"Globally resolved surface temperatures since the Last Glacial Maximum","Nature","Nature, Published online: 10 November 2021; doi:10.1038/s41586-021-03984-4Paleoclimate datasets are integrated with a climate model to reconstruct global surface temperature since the Last Glacial Maximum, showing sustained warming until the mid-Holocene.","2021-11-10 00:00:00","Science","https://www.nature.com/articles/s41586-021-03984-4","ff3fcddf7772101e9a52107b5634f5d80b4d54ac2ddcc5e1af09f50024bb09ed","3937fb2b027c895aa0eb6215cc594463"
"Bubble casting soft robotics","Nature","Nature, Published online: 10 November 2021; doi:10.1038/s41586-021-04029-6An all-in-one methodology for fabricating soft robotics reported here uses interfacial flows in elastomers that cure to produce actuators that can be tailored to suit applications from artificial muscles to grippers.","2021-11-10 00:00:00","Science","https://www.nature.com/articles/s41586-021-04029-6","ff3fcddf7772101e9a52107b5634f5d80b4d54ac2ddcc5e1af09f50024bb09ed","f4d496a8e3092eab89a2948ae237ecb6"
"Pre-existing polymerase-specific T cells expand in abortive seronegative SARS-CoV-2","Nature","Nature, Published online: 10 November 2021; doi:10.1038/s41586-021-04186-8Pre-existing polymerase-specific T cells expand in abortive seronegative SARS-CoV-2","2021-11-10 00:00:00","Science","https://www.nature.com/articles/s41586-021-04186-8","ff3fcddf7772101e9a52107b5634f5d80b4d54ac2ddcc5e1af09f50024bb09ed","472509e19678e3bd8f77fba2bf54d03e"
"Sleeplessness and anxiety: PhD supervisors on toll of COVID pandemic","Nature","Nature, Published online: 11 November 2021; doi:10.1038/d41586-021-03374-wSurvey of 3,500 supervisors lifts the lid on the demands of overseeing junior researchers — and the impacts of the pandemic.","2021-11-11 00:00:00","Science","https://www.nature.com/articles/d41586-021-03374-w","ff3fcddf7772101e9a52107b5634f5d80b4d54ac2ddcc5e1af09f50024bb09ed","2612b60363fe15a0923ab9aa06b06d4e"
"A cat can track its human by voice — if it can be bothered to","Nature","Nature, Published online: 10 November 2021; doi:10.1038/d41586-021-03080-7Experiments involving ‘impossible teleportation’ reveal the cognitive powers of the house cat.","2021-11-10 00:00:00","Science","https://www.nature.com/articles/d41586-021-03080-7","ff3fcddf7772101e9a52107b5634f5d80b4d54ac2ddcc5e1af09f50024bb09ed","1480ac10116c105431aa59f09b5a6d49"
"Climate special: the past and future of the Earth's climate","Nature","Nature, Published online: 10 November 2021; doi:10.1038/d41586-021-03406-5Reassessing 24,000 years of global temperatures, and on the ground at COP26.","2021-11-10 00:00:00","Science","https://www.nature.com/articles/d41586-021-03406-5","ff3fcddf7772101e9a52107b5634f5d80b4d54ac2ddcc5e1af09f50024bb09ed","2310dc696a8453d7935f223ed56e6306"
"When Finnish researchers took on the Twitter trolls","Nature","Nature, Published online: 11 November 2021; doi:10.1038/d41586-021-03407-4A nation’s scientists took to social media in response to criticism of their research, with surprising results. Sami Syrjämäki describes what happened.","2021-11-11 00:00:00","Science","https://www.nature.com/articles/d41586-021-03407-4","ff3fcddf7772101e9a52107b5634f5d80b4d54ac2ddcc5e1af09f50024bb09ed","99dff1d8289f400f53363d34faf907f1"
"Author Correction: Codon-specific translation reprogramming promotes resistance to targeted therapy","Nature","Nature, Published online: 11 November 2021; doi:10.1038/s41586-021-04074-1Author Correction: Codon-specific translation reprogramming promotes resistance to targeted therapy","2021-11-11 00:00:00","Science","https://www.nature.com/articles/s41586-021-04074-1","ff3fcddf7772101e9a52107b5634f5d80b4d54ac2ddcc5e1af09f50024bb09ed","8be458058e4f96784d41d9e9fee093c3"
"COP26 scientist: Microbes can help curb climate change","Nature","Nature, Published online: 11 November 2021; doi:10.1038/d41586-021-03029-wResearchers at COP26 speak of their hopes and fears for the momentous climate summit — and what they hope to achieve by attending.","2021-11-11 00:00:00","Science","https://www.nature.com/articles/d41586-021-03029-w","ff3fcddf7772101e9a52107b5634f5d80b4d54ac2ddcc5e1af09f50024bb09ed","3feaa19e1f52cbbb1fa5378776239dd4"
"How do people resist COVID infections? Hospital workers offer a hint","Nature","Nature, Published online: 11 November 2021; doi:10.1038/d41586-021-03110-4Immune cells might ‘abort’ SARS-CoV-2 infection, forestalling a positive PCR or antibody test.","2021-11-11 00:00:00","Science","https://www.nature.com/articles/d41586-021-03110-4","ff3fcddf7772101e9a52107b5634f5d80b4d54ac2ddcc5e1af09f50024bb09ed","64f8f7d6a174792a358988859535f9bb"
"Diamond delivers long-sought mineral from the deep Earth","Nature","Nature, Published online: 11 November 2021; doi:10.1038/d41586-021-03409-2Davemaoite is a vehicle for radioactive isotopes that help to heat the planet’s mantle.","2021-11-11 00:00:00","Science","https://www.nature.com/articles/d41586-021-03409-2","ff3fcddf7772101e9a52107b5634f5d80b4d54ac2ddcc5e1af09f50024bb09ed","238cdb14889e095bc8e54f0d5c18e7b3"
"Your COP26 questions answered: modelling a planetary patient","Nature","Nature, Published online: 11 November 2021; doi:10.1038/d41586-021-03422-5What if we thought of a warming Earth as a sick patient?","2021-11-11 00:00:00","Science","https://www.nature.com/articles/d41586-021-03422-5","ff3fcddf7772101e9a52107b5634f5d80b4d54ac2ddcc5e1af09f50024bb09ed","7e896ffc735643ebc7874da1f9802ae4"
"Author Correction: Isolation of SARS-CoV-2-related coronavirus from Malayan pangolins","Nature","Nature, Published online: 11 November 2021; doi:10.1038/s41586-021-03838-zAuthor Correction: Isolation of SARS-CoV-2-related coronavirus from Malayan pangolins","2021-11-11 00:00:00","Science","https://www.nature.com/articles/s41586-021-03838-z","ff3fcddf7772101e9a52107b5634f5d80b4d54ac2ddcc5e1af09f50024bb09ed","6c9bef45f5c57e6519ef75bbd46ab853"
"Author Correction: Hepatic stellate cells suppress NK cell-sustained breast cancer dormancy","Nature","Nature, Published online: 11 November 2021; doi:10.1038/s41586-021-04104-yAuthor Correction: Hepatic stellate cells suppress NK cell-sustained breast cancer dormancy","2021-11-11 00:00:00","Science","https://www.nature.com/articles/s41586-021-04104-y","ff3fcddf7772101e9a52107b5634f5d80b4d54ac2ddcc5e1af09f50024bb09ed","51cbbb68ea7ab4517613eb5c6e1f33f1"
"My international-student group helped me through a hurricane","Nature","Nature, Published online: 12 November 2021; doi:10.1038/d41586-021-03393-7When Hurricane Elsa hit her home nation, Sheri McDowell turned to her newly formed support committee.","2021-11-12 00:00:00","Science","https://www.nature.com/articles/d41586-021-03393-7","ff3fcddf7772101e9a52107b5634f5d80b4d54ac2ddcc5e1af09f50024bb09ed","cf2215a21c3abc6666988beaadf4be3d"
"Your COP26 questions answered: Is it too late?","Nature","Nature, Published online: 12 November 2021; doi:10.1038/d41586-021-03424-3Scientists are divided as COP26 reaches its crucial final day","2021-11-12 00:00:00","Science","https://www.nature.com/articles/d41586-021-03424-3","ff3fcddf7772101e9a52107b5634f5d80b4d54ac2ddcc5e1af09f50024bb09ed","76ca0c2c475dd5e8ccd24bd72463aa14"
"Protein vaccines 101 and rising temperatures — the week in infographics","Nature","Nature, Published online: 12 November 2021; doi:10.1038/d41586-021-03421-6Nature highlights three key infographics from the week in science and research.","2021-11-12 00:00:00","Science","https://www.nature.com/articles/d41586-021-03421-6","ff3fcddf7772101e9a52107b5634f5d80b4d54ac2ddcc5e1af09f50024bb09ed","e4aa2af429ef96dd85d3baae5d1800ed"
"Daily briefing: US and China issue joint climate pledge","Nature","Nature, Published online: 11 November 2021; doi:10.1038/d41586-021-03426-1The two biggest greenhouse-gas emitters have issued a surprise joint declaration at COP26. Plus, how Merck and Pfizer’s antiviral pills might reshape the pandemic, and the origin story of the arXiv.","2021-11-11 00:00:00","Science","https://www.nature.com/articles/d41586-021-03426-1","ff3fcddf7772101e9a52107b5634f5d80b4d54ac2ddcc5e1af09f50024bb09ed","3b8f715a053da719fbda529188c12ae5"
"Spider of the cross","Nature","Nature, Published online: 12 November 2021; doi:10.1038/d41586-021-03394-6A web of deceit.","2021-11-12 00:00:00","Science","https://www.nature.com/articles/d41586-021-03394-6","ff3fcddf7772101e9a52107b5634f5d80b4d54ac2ddcc5e1af09f50024bb09ed","d641c44192043510b38f26cd727f1193"
"Some of Earth’s longest-lived fish show how to reach extreme ages","Nature","Nature, Published online: 12 November 2021; doi:10.1038/d41586-021-03423-4Genomic analysis of Pacific rockfishes, which can survive for more than 200 years, provides insight into the biology of longevity.","2021-11-12 00:00:00","Science","https://www.nature.com/articles/d41586-021-03423-4","ff3fcddf7772101e9a52107b5634f5d80b4d54ac2ddcc5e1af09f50024bb09ed","914bd2fe90e786029988ec4d236d9bfa"
"Nearly-fatal heat already affects people in ‘informal’ towns","Nature","Nature, Published online: 10 November 2021; doi:10.1038/d41586-021-03079-0Temperatures in some settlements approach the limits of human survivability, even as Earth continues to warm.","2021-11-10 00:00:00","Science","https://www.nature.com/articles/d41586-021-03079-0","ff3fcddf7772101e9a52107b5634f5d80b4d54ac2ddcc5e1af09f50024bb09ed","47075d1834983db2c97b39b2f867febd"
"COP26 economist: Climate change threatens millions of small farms","Nature","Nature, Published online: 12 November 2021; doi:10.1038/d41586-021-03029-wResearchers at COP26 speak of their hopes and fears for the momentous climate summit — and what they hope to achieve by attending.","2021-11-12 00:00:00","Science","https://www.nature.com/articles/d41586-021-03029-w","ff3fcddf7772101e9a52107b5634f5d80b4d54ac2ddcc5e1af09f50024bb09ed","93f24be499b5ec34b8cb1e937158eb61"
"Brightest X-rays on Earth expose COVID lung damage","Nature","Nature, Published online: 12 November 2021; doi:10.1038/d41586-021-03077-2Imaging technique can pick up micrometre-scale details of intact brains and other organs.","2021-11-12 00:00:00","Science","https://www.nature.com/articles/d41586-021-03077-2","ff3fcddf7772101e9a52107b5634f5d80b4d54ac2ddcc5e1af09f50024bb09ed","6053ddf73e226c7647b514b80081a357"
"Author Correction: RecA finds homologous DNA by reduced dimensionality search","Nature","Nature, Published online: 12 November 2021; doi:10.1038/s41586-021-04154-2Author Correction: RecA finds homologous DNA by reduced dimensionality search","2021-11-12 00:00:00","Science","https://www.nature.com/articles/s41586-021-04154-2","ff3fcddf7772101e9a52107b5634f5d80b4d54ac2ddcc5e1af09f50024bb09ed","e2b84da2e306ab5693541eb815a20642"
"Scientist Rebellion: researchers join protestors at COP26","Nature","Nature, Published online: 12 November 2021; doi:10.1038/d41586-021-03430-5Scientists are among hundreds of demonstrators at the COP26 climate conference — and want more to join them.","2021-11-12 00:00:00","Science","https://www.nature.com/articles/d41586-021-03430-5","ff3fcddf7772101e9a52107b5634f5d80b4d54ac2ddcc5e1af09f50024bb09ed","ac4f9f7b2c5993383d875d1aa23af294"
"Homicide is a top cause of maternal death in the United States","Nature","Nature, Published online: 12 November 2021; doi:10.1038/d41586-021-03392-8Evaluation of death certificates from national database paints grim picture for pregnant women.","2021-11-12 00:00:00","Science","https://www.nature.com/articles/d41586-021-03392-8","ff3fcddf7772101e9a52107b5634f5d80b4d54ac2ddcc5e1af09f50024bb09ed","3e46efc45e07f9c63f92a46dafd7c222"
"Coronapod: new hope from COVID antiviral drugs","Nature","Nature, Published online: 12 November 2021; doi:10.1038/d41586-021-03441-2Two antiviral drugs could change the course of the pandemic, but scientists still have questions","2021-11-12 00:00:00","Science","https://www.nature.com/articles/d41586-021-03441-2","ff3fcddf7772101e9a52107b5634f5d80b4d54ac2ddcc5e1af09f50024bb09ed","35f47f3017010d2b2bfe34cbb2674f35"
"The final hours: Nature reporters reflect on COP26","Nature","Nature, Published online: 12 November 2021; doi:10.1038/d41586-021-03442-1Nature's team on the ground at COP26, reflect on their experience of the pivotal climate conference","2021-11-12 00:00:00","Science","https://www.nature.com/articles/d41586-021-03442-1","ff3fcddf7772101e9a52107b5634f5d80b4d54ac2ddcc5e1af09f50024bb09ed","abdc9c1b2973a5d8480ca9636c781924"
"New FDA chief will face COVID woes and calls for drug-approval reform","Nature","Nature, Published online: 12 November 2021; doi:10.1038/d41586-021-03432-3After long delay, US President Joe Biden picks Robert Califf to once again head the US Food and Drug Administration.","2021-11-12 00:00:00","Science","https://www.nature.com/articles/d41586-021-03432-3","ff3fcddf7772101e9a52107b5634f5d80b4d54ac2ddcc5e1af09f50024bb09ed","2eb8ff4833b9e1fe9e37ec147bdf9110"
"‘COP26 hasn’t solved the problem’: scientists react to UN climate deal","Nature","Nature, Published online: 14 November 2021; doi:10.1038/d41586-021-03431-4The Glasgow Climate Pact is a step forward, researchers say, but efforts to decarbonize are not enough to limit global temperature rises to 2 °C.","2021-11-14 00:00:00","Science","https://www.nature.com/articles/d41586-021-03431-4","ff3fcddf7772101e9a52107b5634f5d80b4d54ac2ddcc5e1af09f50024bb09ed","b26dcc1c26b844f8898830d68a994739"
"Friction: from fingerprints to climate change","Nature","Nature, Published online: 15 November 2021; doi:10.1038/d41586-021-03436-zAn enthusiastic exploration of how surfaces interact both intrigues and frustrates.","2021-11-15 00:00:00","Science","https://www.nature.com/articles/d41586-021-03436-z","ff3fcddf7772101e9a52107b5634f5d80b4d54ac2ddcc5e1af09f50024bb09ed","4ab3d4916be3208741bf54c36f97793e"
"How to turn your ideas into patents","Nature","Nature, Published online: 15 November 2021; doi:10.1038/d41586-021-03438-xResearchers and intellectual-property specialists offer their tips for deciding which discoveries are worth patenting, and how to do the homework needed for success.","2021-11-15 00:00:00","Science","https://www.nature.com/articles/d41586-021-03438-x","ff3fcddf7772101e9a52107b5634f5d80b4d54ac2ddcc5e1af09f50024bb09ed","25d6318c7ce7c2021ee5146e6cfe1e20"
"Daily briefing: How some people might thwart COVID","Nature","Nature, Published online: 12 November 2021; doi:10.1038/d41586-021-03461-yHow some people’s immune cells might ‘abort’ SARS-CoV-2 infection. Plus, an expanding molecular toolbox to probe neural circuits and your COP26 questions answered.","2021-11-12 00:00:00","Science","https://www.nature.com/articles/d41586-021-03461-y","ff3fcddf7772101e9a52107b5634f5d80b4d54ac2ddcc5e1af09f50024bb09ed","eed081504fd0820cbab494e884dfc18d"
"The greener route to indigo blue","Nature","Nature, Published online: 15 November 2021; doi:10.1038/d41586-021-03437-yTammy Hsu is finding a way to produce fabric dye with a lower environmental impact.","2021-11-15 00:00:00","Science","https://www.nature.com/articles/d41586-021-03437-y","ff3fcddf7772101e9a52107b5634f5d80b4d54ac2ddcc5e1af09f50024bb09ed","06deb705e33da8635a3fba298f320f61"
"COP26: Meet the scientists behind the crucial climate summit","Nature","Nature, Published online: 15 November 2021; doi:10.1038/d41586-021-03029-wResearchers attending the meeting spoke to Nature about how they’re contributing to the global fight against climate change.","2021-11-15 00:00:00","Science","https://www.nature.com/articles/d41586-021-03029-w","ff3fcddf7772101e9a52107b5634f5d80b4d54ac2ddcc5e1af09f50024bb09ed","c5d32b05955e0bd838d2645b407b947e"
"Scientist Rebellion: researchers join protesters at COP26","Nature","Nature, Published online: 12 November 2021; doi:10.1038/d41586-021-03430-5Scientists are among hundreds of demonstrators at the COP26 climate conference — and want more to join them.","2021-11-12 00:00:00","Science","https://www.nature.com/articles/d41586-021-03430-5","ff3fcddf7772101e9a52107b5634f5d80b4d54ac2ddcc5e1af09f50024bb09ed","eeb27103666b6b243dc933e4c80868ed"
"More Alzheimer’s drugs head for FDA review: what scientists are watching","Nature","Nature, Published online: 15 November 2021; doi:10.1038/d41586-021-03410-9Eli Lilly and other pharma firms have begun submitting their anti-amyloid drug hopefuls for approval. But questions linger over the controversial precedent set by Biogen's aducanumab.","2021-11-15 00:00:00","Science","https://www.nature.com/articles/d41586-021-03410-9","ff3fcddf7772101e9a52107b5634f5d80b4d54ac2ddcc5e1af09f50024bb09ed","22a0c9e241918d5356c50b6216dd52cb"
"Reflections on a pioneer in electrical engineering","Nature","Nature, Published online: 16 November 2021; doi:10.1038/d41586-021-03417-2Reflections on a pioneer in electrical engineering","2021-11-16 00:00:00","Science","https://www.nature.com/articles/d41586-021-03417-2","ff3fcddf7772101e9a52107b5634f5d80b4d54ac2ddcc5e1af09f50024bb09ed","a29e83e50b2c73340522f8124bb8bbb3"
"Link knowledge and action networks to tackle disasters","Nature","Nature, Published online: 16 November 2021; doi:10.1038/d41586-021-03419-0Link knowledge and action networks to tackle disasters","2021-11-16 00:00:00","Science","https://www.nature.com/articles/d41586-021-03419-0","ff3fcddf7772101e9a52107b5634f5d80b4d54ac2ddcc5e1af09f50024bb09ed","fa049aaa83dafa01bfa9f7a6f1ed89bb"
"Presidents of Royal Society live long lives","Nature","Nature, Published online: 16 November 2021; doi:10.1038/d41586-021-03420-7Presidents of Royal Society live long lives","2021-11-16 00:00:00","Science","https://www.nature.com/articles/d41586-021-03420-7","ff3fcddf7772101e9a52107b5634f5d80b4d54ac2ddcc5e1af09f50024bb09ed","a3b7f6772d2046b0ae22bd7b0a776180"
"Funders need to credit open science","Nature","Nature, Published online: 16 November 2021; doi:10.1038/d41586-021-03418-1Funders need to credit open science","2021-11-16 00:00:00","Science","https://www.nature.com/articles/d41586-021-03418-1","ff3fcddf7772101e9a52107b5634f5d80b4d54ac2ddcc5e1af09f50024bb09ed","938a1a71c123277e838e75749e3411a9"
"Daily briefing: New mineral discovered inside a diamond","Nature","Nature, Published online: 15 November 2021; doi:10.1038/d41586-021-03468-5‘Davemaoite’ usually only exists in the deep Earth. Plus, homicide is a top cause of maternal death in the United States, and what scientists think of the Glasgow Climate Pact.","2021-11-15 00:00:00","Science","https://www.nature.com/articles/d41586-021-03468-5","ff3fcddf7772101e9a52107b5634f5d80b4d54ac2ddcc5e1af09f50024bb09ed","16dd050e8ae3c17eb080ccc078d15861"
"COP26: Glasgow Climate Pact signed into history","Nature","Nature, Published online: 13 November 2021; doi:10.1038/d41586-021-03464-9A special breaking news edition of the Nature Briefing from the 26th Conference of the Parties (COP26) in Glasgow.","2021-11-13 00:00:00","Science","https://www.nature.com/articles/d41586-021-03464-9","ff3fcddf7772101e9a52107b5634f5d80b4d54ac2ddcc5e1af09f50024bb09ed","2dd9dccba69eef510a0ad4178c2bb416"
"Stagnating salaries present hurdles to career satisfaction","Nature","Nature, Published online: 16 November 2021; doi:10.1038/d41586-021-03041-0Fewer than half of respondents to Nature’s 2021 salary and satisfaction survey feel positive about their prospects.","2021-11-16 00:00:00","Science","https://www.nature.com/articles/d41586-021-03041-0","ff3fcddf7772101e9a52107b5634f5d80b4d54ac2ddcc5e1af09f50024bb09ed","573d14117775b351f7cb577086a64b41"
"Yes, science can weigh in on abortion law","Nature","Nature, Published online: 16 November 2021; doi:10.1038/d41586-021-03434-1Why, as a scientist, I signed an amicus brief for the US Supreme Court’s case on abortion.","2021-11-16 00:00:00","Science","https://www.nature.com/articles/d41586-021-03434-1","ff3fcddf7772101e9a52107b5634f5d80b4d54ac2ddcc5e1af09f50024bb09ed","7f50e870daf7c16daf2ca8239400adf4"
"COP26 didn’t solve everything — but researchers must stay engaged","Nature","Nature, Published online: 16 November 2021; doi:10.1038/d41586-021-03433-2The climate summit’s organizers stopped researchers accessing the negotiations in Glasgow, UK. A zero-carbon world needs science and social science to bridge divides.","2021-11-16 00:00:00","Science","https://www.nature.com/articles/d41586-021-03433-2","ff3fcddf7772101e9a52107b5634f5d80b4d54ac2ddcc5e1af09f50024bb09ed","96ddb584da16b939e6d811489c2d6d5e"
"High-speed spinning yields some of the toughest spider silk ever found","Nature","Nature, Published online: 16 November 2021; doi:10.1038/d41586-021-03443-0The silk that whizzes out of jumping spiders mid-bound is of superior quality.","2021-11-16 00:00:00","Science","https://www.nature.com/articles/d41586-021-03443-0","ff3fcddf7772101e9a52107b5634f5d80b4d54ac2ddcc5e1af09f50024bb09ed","eb6d6a5ea485c93522ba53f9afa7fe98"
