"New mineral, FDA chief and the pandemic’s toll on research","Nature","Nature, Published online: 17 November 2021; doi:10.1038/d41586-021-03435-0The latest science news, in brief.","2021-11-17 00:00:00","Science","https://www.nature.com/articles/d41586-021-03435-0","ff3fcddf7772101e9a52107b5634f5d80b4d54ac2ddcc5e1af09f50024bb09ed","dd4c4df6000b7a541ab21ebd25d485db"
"The start-ups chasing clean, carbon-free fusion energy","Nature","Nature, Published online: 17 November 2021; doi:10.1038/d41586-021-03401-wAn emerging industry of nuclear-fusion firms promises to have commercial reactors ready in the next decade.","2021-11-17 00:00:00","Science","https://www.nature.com/immersive/d41586-021-03401-w/index.html","ff3fcddf7772101e9a52107b5634f5d80b4d54ac2ddcc5e1af09f50024bb09ed","430818d741638424158d0f0fd70472c6"
"It’s a snap: the friction-based physics behind a common gesture","Nature","Nature, Published online: 17 November 2021; doi:10.1038/d41586-021-03444-zExperiments with various types of glove identify the factors behind a successful finger click.","2021-11-17 00:00:00","Science","https://www.nature.com/articles/d41586-021-03444-z","ff3fcddf7772101e9a52107b5634f5d80b4d54ac2ddcc5e1af09f50024bb09ed","b770c8b23ce701e44920fcbc7991da8c"
"Daily briefing: How some fish can live for centuries","Nature","Nature, Published online: 16 November 2021; doi:10.1038/d41586-021-03473-8How some fish can live for more than 200 years, the questions swirling around new Alzheimer’s drugs and how one of the world’s last COVID-elimination strategies is panning out in China.","2021-11-16 00:00:00","Science","https://www.nature.com/articles/d41586-021-03473-8","ff3fcddf7772101e9a52107b5634f5d80b4d54ac2ddcc5e1af09f50024bb09ed","08a253bf204e08fbbe53c8781316baac"
"Ancient mud bricks show adobe’s foundations 5,000 years ago","Nature","Nature, Published online: 15 November 2021; doi:10.1038/d41586-021-03446-xThe oldest known monumental adobe structure in the Americas provides clues to the origins of this versatile material.","2021-11-15 00:00:00","Science","https://www.nature.com/articles/d41586-021-03446-x","ff3fcddf7772101e9a52107b5634f5d80b4d54ac2ddcc5e1af09f50024bb09ed","16c27e10ced4be31a0a3d1fb4a73ca95"
"Welcome home","Nature","Nature, Published online: 17 November 2021; doi:10.1038/d41586-021-03396-4The taste of freedom.","2021-11-17 00:00:00","Science","https://www.nature.com/articles/d41586-021-03396-4","ff3fcddf7772101e9a52107b5634f5d80b4d54ac2ddcc5e1af09f50024bb09ed","0ff738a5d3d4d1608c009a007aa8e6a7"
"How Canada stacks up in science against its closest competitors","Nature","Nature, Published online: 17 November 2021; doi:10.1038/d41586-021-03061-wA visual overview of investment, collaborations and institutional stand-outs.","2021-11-17 00:00:00","Science","https://www.nature.com/articles/d41586-021-03061-w","ff3fcddf7772101e9a52107b5634f5d80b4d54ac2ddcc5e1af09f50024bb09ed","224524aa73bdbdc79ab88cfa861aaafd"
"Canada’s researchers call for a return to stated science ambitions","Nature","Nature, Published online: 17 November 2021; doi:10.1038/d41586-021-03059-4The buzz created by a 2017 national science review has faded, prompting calls for a renewed focus on innovation.","2021-11-17 00:00:00","Science","https://www.nature.com/articles/d41586-021-03059-4","ff3fcddf7772101e9a52107b5634f5d80b4d54ac2ddcc5e1af09f50024bb09ed","01d5a0b6bf111dfd99ef7d88f295d152"
"Polar bear researchers struggle for air time","Nature","Nature, Published online: 17 November 2021; doi:10.1038/d41586-021-03063-8Arctic fieldwork in Canada takes place in a difficult funding landscape.","2021-11-17 00:00:00","Science","https://www.nature.com/articles/d41586-021-03063-8","ff3fcddf7772101e9a52107b5634f5d80b4d54ac2ddcc5e1af09f50024bb09ed","aa7bc7b182043fb535d3ff7cb866225f"
"First Nations communities bring expertise to Canada’s scientific research","Nature","Nature, Published online: 17 November 2021; doi:10.1038/d41586-021-03060-xResearchers working with Indigenous partners are benefiting from traditional knowledge of the natural world.","2021-11-17 00:00:00","Science","https://www.nature.com/articles/d41586-021-03060-x","ff3fcddf7772101e9a52107b5634f5d80b4d54ac2ddcc5e1af09f50024bb09ed","18a5d15bc723a630c9eb3b87080d8b16"
"Canada’s scientists are elucidating the dark metabolome","Nature","Nature, Published online: 17 November 2021; doi:10.1038/d41586-021-03062-9Teams studying the human body at the molecular level are grappling with matter that defies identification.","2021-11-17 00:00:00","Science","https://www.nature.com/articles/d41586-021-03062-9","ff3fcddf7772101e9a52107b5634f5d80b4d54ac2ddcc5e1af09f50024bb09ed","ebad27a0a0e03a7e6d116629a646f6d0"
"A critical mass of learning at Mila, Canada","Nature","Nature, Published online: 17 November 2021; doi:10.1038/d41586-021-03064-7Attracted by generous funding and big names, a hub for leading talent in artificial intelligence is thriving in Montreal.","2021-11-17 00:00:00","Science","https://www.nature.com/articles/d41586-021-03064-7","ff3fcddf7772101e9a52107b5634f5d80b4d54ac2ddcc5e1af09f50024bb09ed","a32f1e6cf6e26daaf95e21bdf0a539d4"
"A guide to the Nature Index","Nature","Nature, Published online: 17 November 2021; doi:10.1038/d41586-021-03065-6A description of the terminology and methodology used in this supplement, and a guide to the functionality that is available free online at natureindex.com.","2021-11-17 00:00:00","Science","https://www.nature.com/articles/d41586-021-03065-6","ff3fcddf7772101e9a52107b5634f5d80b4d54ac2ddcc5e1af09f50024bb09ed","cfae94fddaf63e2aa580bfd1049c3c48"
"Canada’s scientific strength depends on greater support for innovation","Nature","Nature, Published online: 17 November 2021; doi:10.1038/d41586-021-03058-5To remain globally competitive, the country must regain an edge in emerging fields.","2021-11-17 00:00:00","Science","https://www.nature.com/articles/d41586-021-03058-5","ff3fcddf7772101e9a52107b5634f5d80b4d54ac2ddcc5e1af09f50024bb09ed","3ee9e5ac831a25abe98111b98bafccb1"
"Measuring phonon dispersion at an interface","Nature","Nature, Published online: 17 November 2021; doi:10.1038/s41586-021-03971-9Four-dimensional electron energy-loss spectroscopy measurements of the vibrational spectra and the phonon dispersion at a heterointerface show localized modes that are predicted to affect the thermal conductance and electron mobility.","2021-11-17 00:00:00","Science","https://www.nature.com/articles/s41586-021-03971-9","ff3fcddf7772101e9a52107b5634f5d80b4d54ac2ddcc5e1af09f50024bb09ed","a4fe427e1105baf71d740f2fbccf749d"
"Single-cell transcriptomic characterization of a gastrulating human embryo","Nature","Nature, Published online: 17 November 2021; doi:10.1038/s41586-021-04158-yThe single-cell transcriptional profile of a human embryo between 16 and 19 days after fertilization reveals parallels and differences in gastrulation in humans as compared with mouse and non-human primate models.","2021-11-17 00:00:00","Science","https://www.nature.com/articles/s41586-021-04158-y","ff3fcddf7772101e9a52107b5634f5d80b4d54ac2ddcc5e1af09f50024bb09ed","5fc5cd3dc70a2e24fa8ab81ee435a97a"
"Observation of Stark many-body localization without disorder","Nature","Nature, Published online: 17 November 2021; doi:10.1038/s41586-021-03988-0Experiments with a trapped-ion quantum simulator observe Stark many-body localization, in which the quantum system evades thermalization despite having no disorder.","2021-11-17 00:00:00","Science","https://www.nature.com/articles/s41586-021-03988-0","ff3fcddf7772101e9a52107b5634f5d80b4d54ac2ddcc5e1af09f50024bb09ed","b7890c392447c4b9ed4d080c7758d3b5"
"Herpesviruses assimilate kinesin to produce motorized viral particles","Nature","Nature, Published online: 17 November 2021; doi:10.1038/s41586-021-04106-wHerpes simplex virus type I and pseudorabies virus assimilate kinesin from host epithelial cells and repurpose the motor to traffic to the nuclei of neurons in the peripheral nervous system.","2021-11-17 00:00:00","Science","https://www.nature.com/articles/s41586-021-04106-w","ff3fcddf7772101e9a52107b5634f5d80b4d54ac2ddcc5e1af09f50024bb09ed","a3bbad8a9d0e6cf41e1eb058c190eb3f"
"Mental health concerns during the COVID-19 pandemic as revealed by helpline calls","Nature","Nature, Published online: 17 November 2021; doi:10.1038/s41586-021-04099-6Data collected from crisis helplines during the COVID-19 pandemic show that pandemic-related issues replaced rather than exacerbated underlying anxieties, and demonstrate that helpline data are useful indicators of public mental health.","2021-11-17 00:00:00","Science","https://www.nature.com/articles/s41586-021-04099-6","ff3fcddf7772101e9a52107b5634f5d80b4d54ac2ddcc5e1af09f50024bb09ed","e02894ae8fddd6f6685ac4988ffc994f"
"Cortical responses to touch reflect subcortical integration of LTMR signals","Nature","Nature, Published online: 17 November 2021; doi:10.1038/s41586-021-04094-xGenetic manipulation of skin peripheral sensory neurons in mice shows that cortical neuron responses to touch reflect subcortical mixing of signals from both rapidly adapting and slowly adapting low-threshold mechanoreceptors.","2021-11-17 00:00:00","Science","https://www.nature.com/articles/s41586-021-04094-x","ff3fcddf7772101e9a52107b5634f5d80b4d54ac2ddcc5e1af09f50024bb09ed","95d7e400c7d2bf8c7b3cabeb55c994fe"
"Reverse-translational identification of a cerebellar satiation network","Nature","Nature, Published online: 17 November 2021; doi:10.1038/s41586-021-04143-5Activity in anterior deep cerebellar nuclei reduces food consumption in mice without reducing metabolic rate, potentially identifying a therapeutic target for disorders involving excessive eating.","2021-11-17 00:00:00","Science","https://www.nature.com/articles/s41586-021-04143-5","ff3fcddf7772101e9a52107b5634f5d80b4d54ac2ddcc5e1af09f50024bb09ed","851ef54120fa6a02b8141b4f7b55f933"
"Exploding and weeping ceramics","Nature","Nature, Published online: 17 November 2021; doi:10.1038/s41586-021-03975-5A study demonstrates that a range of different behaviours—from reversible, through weeping, to explosive—can be exhibited by a chemically homogeneous ceramic system by manipulating conditions of compatibility in unusual ways.","2021-11-17 00:00:00","Science","https://www.nature.com/articles/s41586-021-03975-5","ff3fcddf7772101e9a52107b5634f5d80b4d54ac2ddcc5e1af09f50024bb09ed","a9d291ba28aea5cc94be542fddecb9eb"
"Structure, function and pharmacology of human itch receptor complexes","Nature","Nature, Published online: 17 November 2021; doi:10.1038/s41586-021-04077-yCryo-electron microscopy structures of the MRGPRX2–Gi1 trimer in complex with polycationic compound 48/80 or inflammatory peptides provide insights into the sensing of cationic allergens by MRGPRX2, potentially facilitating the design of therapies to prevent unwanted pseudoallergic reactions.","2021-11-17 00:00:00","Science","https://www.nature.com/articles/s41586-021-04077-y","ff3fcddf7772101e9a52107b5634f5d80b4d54ac2ddcc5e1af09f50024bb09ed","7e510e3a8a806309171a4459be0bcaae"
"Approaching the intrinsic exciton physics limit in two-dimensional semiconductor diodes","Nature","Nature, Published online: 17 November 2021; doi:10.1038/s41586-021-03949-7Two-dimensional transition metal dichalcogenide diodes with defect-free van der Waals contacts allows minimization of the extrinsic interfacial disorder-dominated recombination and access to the intrinsic excitonic behaviour in two-dimensional semiconductor devices.","2021-11-17 00:00:00","Science","https://www.nature.com/articles/s41586-021-03949-7","ff3fcddf7772101e9a52107b5634f5d80b4d54ac2ddcc5e1af09f50024bb09ed","9d3bf4cf517b0bd6e6f2c98814798477"
"Isolation and characterization of a californium metallocene","Nature","Nature, Published online: 17 November 2021; doi:10.1038/s41586-021-04027-8Chemical experiments on californium are stymied by isotope availability and radioactivity considerations, but are advanced here with synthesis and characterization of an organometallic complex.","2021-11-17 00:00:00","Science","https://www.nature.com/articles/s41586-021-04027-8","ff3fcddf7772101e9a52107b5634f5d80b4d54ac2ddcc5e1af09f50024bb09ed","fb59050c7f89ddf77808c4b412dff29f"
"Cardiopharyngeal deconstruction and ancestral tunicate sessility","Nature","Nature, Published online: 17 November 2021; doi:10.1038/s41586-021-04041-wThe heart of appendicularians has evolved by 'deconstructing' an ancestral ascidian-like gene regulatory network.","2021-11-17 00:00:00","Science","https://www.nature.com/articles/s41586-021-04041-w","ff3fcddf7772101e9a52107b5634f5d80b4d54ac2ddcc5e1af09f50024bb09ed","0a5871a8fb6a3cdd7fbd1a16e922f7d2"
"Structure, function and pharmacology of human itch GPCRs","Nature","Nature, Published online: 17 November 2021; doi:10.1038/s41586-021-04126-6Structural studies of the itch receptors MRGPRX2 and MRGPRX4 in complex with endogenous and synthetic ligands provide a basis for the development of therapeutic compounds for pain, itch and mast cell-mediated hypersensitivity.","2021-11-17 00:00:00","Science","https://www.nature.com/articles/s41586-021-04126-6","ff3fcddf7772101e9a52107b5634f5d80b4d54ac2ddcc5e1af09f50024bb09ed","c46f49633d0234b87fb4cd5f4fd472f3"
"In-orbit demonstration of an iodine electric propulsion system","Nature","Nature, Published online: 17 November 2021; doi:10.1038/s41586-021-04015-yThe successful in-orbit operation of an electric space propulsion system based on iodine, rather than the more expensive and difficult-to-store xenon, is demonstrated.","2021-11-17 00:00:00","Science","https://www.nature.com/articles/s41586-021-04015-y","ff3fcddf7772101e9a52107b5634f5d80b4d54ac2ddcc5e1af09f50024bb09ed","7856b9b894081f469974ef7b74cfdf97"
"Observation of universal ageing dynamics in antibiotic persistence","Nature","Nature, Published online: 17 November 2021; doi:10.1038/s41586-021-04114-wCharacterizations of bacteria under acute stress reveal features that can be predicted using a conceptual model of physical ageing.","2021-11-17 00:00:00","Science","https://www.nature.com/articles/s41586-021-04114-w","ff3fcddf7772101e9a52107b5634f5d80b4d54ac2ddcc5e1af09f50024bb09ed","310bab6972c53497a4b902b96b8522a7"
"Independent infections of porcine deltacoronavirus among Haitian children","Nature","Nature, Published online: 17 November 2021; doi:10.1038/s41586-021-04111-zThe presence of porcine deltacoronavirus has been detected in three children from Haiti that could have originated from zoonotic spillover.","2021-11-17 00:00:00","Science","https://www.nature.com/articles/s41586-021-04111-z","ff3fcddf7772101e9a52107b5634f5d80b4d54ac2ddcc5e1af09f50024bb09ed","60e30b969bb5df35863ea55e9be2e303"
"Sea squirts teach new lessons in evolution","Nature","Nature, Published online: 17 November 2021; doi:10.1038/d41586-021-03475-6Spineless sea squirts shed light on vertebrate evolution, and an iodine-fuelled engine powering a satellite in space.","2021-11-17 00:00:00","Science","https://www.nature.com/articles/d41586-021-03475-6","ff3fcddf7772101e9a52107b5634f5d80b4d54ac2ddcc5e1af09f50024bb09ed","52a35c47c3364b9a4751789f903fb888"
"Cell-type specialization is encoded by specific chromatin topologies","Nature","Nature, Published online: 17 November 2021; doi:10.1038/s41586-021-04081-2A new technique called immunoGAM, which combines genome architecture mapping (GAM) with immunoselection, enabled the discovery of specialized chromatin conformations linked to gene expression in specific cell populations from mouse brain tissues.","2021-11-17 00:00:00","Science","https://www.nature.com/articles/s41586-021-04081-2","ff3fcddf7772101e9a52107b5634f5d80b4d54ac2ddcc5e1af09f50024bb09ed","8d4daf7972d445833a42c54e96f87a2a"
"Europe’s COVID death toll could rise by hundreds of thousands","Nature","Nature, Published online: 18 November 2021; doi:10.1038/d41586-021-03455-wIn a worst-case scenario, the pandemic could cause a further 300,000 deaths if anti-contagion policies are lifted and people revert to their old habits.","2021-11-18 00:00:00","Science","https://www.nature.com/articles/d41586-021-03455-w","ff3fcddf7772101e9a52107b5634f5d80b4d54ac2ddcc5e1af09f50024bb09ed","5ca7ba75c769123084a03d9283bfdcd1"
"Do childhood colds help the body respond to COVID?","Nature","Nature, Published online: 18 November 2021; doi:10.1038/d41586-021-03087-0A mechanism known as ‘original antigenic sin' protects some people from flu; whether it helps immune reactions to coronaviruses is still unclear.","2021-11-18 00:00:00","Science","https://www.nature.com/articles/d41586-021-03087-0","ff3fcddf7772101e9a52107b5634f5d80b4d54ac2ddcc5e1af09f50024bb09ed","20c29c01c56e91b14bc90d71b454b945"
"Adopting as academics: what we learnt","Nature","Nature, Published online: 18 November 2021; doi:10.1038/d41586-021-03482-7Our quest to bring a child into our family led us to confront academic working practices, say Tony Ly and Nathan W. Bailey.","2021-11-18 00:00:00","Science","https://www.nature.com/articles/d41586-021-03482-7","ff3fcddf7772101e9a52107b5634f5d80b4d54ac2ddcc5e1af09f50024bb09ed","482684be7a043e096396e8e204a2dca5"
"CRISPR screens unveil signal hubs for nutrient licensing of T cell immunity","Nature","Nature, Published online: 18 November 2021; doi:10.1038/s41586-021-04109-7CRISPR screening and protein–protein interaction networks identify components and mechanisms of nutrient-dependent mTORC1 signalling in regulatory T cells and reveal how mTORC1 integrates immunological cues and nutrient signals for adaptive immunity.","2021-11-18 00:00:00","Science","https://www.nature.com/articles/s41586-021-04109-7","ff3fcddf7772101e9a52107b5634f5d80b4d54ac2ddcc5e1af09f50024bb09ed","a7e07112f2f643ebde8b87ce1a58db29"
"Optimization of Non-Coding Regions for a Non-Modified mRNA COVID-19 Vaccine","Nature","Nature, Published online: 18 November 2021; doi:10.1038/s41586-021-04231-6Optimization of Non-Coding Regions for a Non-Modified mRNA COVID-19 Vaccine","2021-11-18 00:00:00","Science","https://www.nature.com/articles/s41586-021-04231-6","ff3fcddf7772101e9a52107b5634f5d80b4d54ac2ddcc5e1af09f50024bb09ed","a868d9994d0abc206eff3749d1b0e461"
"Genome surveillance by HUSH-mediated silencing of intronless mobile elements","Nature","Nature, Published online: 18 November 2021; doi:10.1038/s41586-021-04228-1Genome surveillance by HUSH-mediated silencing of intronless mobile elements","2021-11-18 00:00:00","Science","https://www.nature.com/articles/s41586-021-04228-1","ff3fcddf7772101e9a52107b5634f5d80b4d54ac2ddcc5e1af09f50024bb09ed","e1f74237d17c1be45c30cdf964cffc18"
"Even organic pesticides spur change in the wildlife next door","Nature","Nature, Published online: 17 November 2021; doi:10.1038/d41586-021-03445-yA keystone aquatic species develops resistance to compounds used to treat organic fields near its ponds.","2021-11-17 00:00:00","Science","https://www.nature.com/articles/d41586-021-03445-y","ff3fcddf7772101e9a52107b5634f5d80b4d54ac2ddcc5e1af09f50024bb09ed","a9617b4eedc6951c5532356878e5f292"
